username;date;retweets;favorites;text;geo;mentions;hashtags;id;permalink
WSiHealthcare;2009-08-12 20:19;0;0;"Swine Flu Victim's Family Sues City For Wrongful Death - The family of the Queens high school administrator who wa... http://bit.ly/3UWHpd";;;;"3272118668";https://twitter.com/WSiHealthcare/status/3272118668
guwahaticity;2009-08-12 20:18;0;0;"SWINE FLU preparedness in Guwahati city is a complete eyewash by Govt of assam http://bit.ly/O1iDt #h1n1";;;#h1n1;"3272115261";https://twitter.com/guwahaticity/status/3272115261
30secondcommute;2009-08-12 20:18;0;0;"Online social networking to provide swine flu updates: ... Services (HHS) have been working jointly to provide c.. http://bit.ly/sOWnK";;;;"3272112243";https://twitter.com/30secondcommute/status/3272112243
SayfieReview;2009-08-12 20:18;0;0;"Sentinel: Crist and health officer to tour state warning about swine flu http://bit.ly/19LQmz #sayfie";;;#sayfie;"3272110605";https://twitter.com/SayfieReview/status/3272110605
news4u2;2009-08-12 20:18;0;0;"Costa Rica's Arias works from home with swine flu : SAN JOSE, Costa Rica, Aug 12 (Reuters) - Costa Rican Presiden.. http://bit.ly/ECfQl";;;;"3272105569";https://twitter.com/news4u2/status/3272105569
WheeluvFortune;2009-08-12 20:17;0;0;"Swine Flu Pandemic Unnerves Parts of India: India's vast and densely packed population, coupled with a patch.. http://bit.ly/33OoU6";;;;"3272096423";https://twitter.com/WheeluvFortune/status/3272096423
Wet_ahuizote;2009-08-12 20:17;0;0;"swine flu is very close to me, so many people around me has had it, and yet they say it is not dangerous, it is just a bad flu, hopefully!!";;;;"3272095427";https://twitter.com/Wet_ahuizote/status/3272095427
SwineFluNewsNZ;2009-08-12 20:16;0;0;"Holidays a swine flu circuit breaker http://tinyurl.com/mbovqb #swineflu #h1n1";;;#swineflu #h1n1;"3272072834";https://twitter.com/SwineFluNewsNZ/status/3272072834
bohemianGunjan;2009-08-12 20:16;0;0;"Swine Flu country by country http://bit.ly/8IQBX";;;;"3272066782";https://twitter.com/bohemianGunjan/status/3272066782
SwineFluNewsUSA;2009-08-12 20:16;0;0;"N.H., Maine efforts to quell swine flu upon right track http://tinyurl.com/mhpdpn #swineflu #h1n1";;;#swineflu #h1n1;"3272065230";https://twitter.com/SwineFluNewsUSA/status/3272065230
Asokans;2009-08-12 20:16;0;0;"Check this out - Swine flu to impact Janmasthamai celebrations: With Maharashtra accounting for .. http://bit.ly/nTmF7";;;;"3272062021";https://twitter.com/Asokans/status/3272062021
AtlParenting;2009-08-12 20:15;0;0;"10 Tips to Protect Your Family from Swine Flu . #moms #parents http://bit.ly/3298JQ";;;#moms #parents;"3272045134";https://twitter.com/AtlParenting/status/3272045134
SwineFlu_news;2009-08-12 20:15;0;0;"‘No option for those who miss out on Haj this year’ http://t.love.com/241015391";;;;"3272044324";https://twitter.com/SwineFlu_news/status/3272044324
echourouk;2009-08-12 20:14;0;0;"news: Four new cases of swine flu registered in Algeria : The reference laboratory for swine flu at Pasteur.. http://bit.ly/rQCcE";;;;"3272041355";https://twitter.com/echourouk/status/3272041355
AndrewAaronsMum;2009-08-12 20:14;0;0;"day 3 of swine flu : - feeling better just have the sore throat and runny nose still! the fever has gone";;;;"3272037156";https://twitter.com/AndrewAaronsMum/status/3272037156
JustVWells;2009-08-12 20:14;0;0;"Bleh. Too hot, too cold, bad back, sore throat, cough... wonder if I have swine flu ? :P I've definitely caught something though. Damnmit. :(";;;;"3272036732";https://twitter.com/JustVWells/status/3272036732
HealthHive;2009-08-12 20:14;0;0;"Swine Flu Pandemic Unnerves Parts of India http://bit.ly/15ALm4";;;;"3272033050";https://twitter.com/HealthHive/status/3272033050
crevei;2009-08-12 20:13;0;0;"Online social networking to provide swine flu updates http://bit.ly/5VnS4";;;;"3272017698";https://twitter.com/crevei/status/3272017698
SwineFluNewsAU;2009-08-12 20:13;0;0;"Swine flu fears allayed, rumour-mongers warned http://tinyurl.com/ln6s2d #swineflu #h1n1";;;#swineflu #h1n1;"3272017027";https://twitter.com/SwineFluNewsAU/status/3272017027
ThomasGordonONE;2009-08-12 20:13;0;0;"Seventh swine flu death in Alberta reported http://bit.ly/jOC5a";;;;"3272012845";https://twitter.com/ThomasGordonONE/status/3272012845
FolsomTelegraph;2009-08-12 20:13;0;0;"UPDATE: 5 now have swine flu at Granite Bay High http://tinyurl.com/nc52jw";;;;"3272010312";https://twitter.com/FolsomTelegraph/status/3272010312
lawblog;2009-08-12 20:13;0;0;"First US swine flu victim's family to sue for $40 mn http://tinyurl.com/n9k6ap";;;;"3272003588";https://twitter.com/lawblog/status/3272003588
H1N1swineflu;2009-08-12 20:12;0;0;"#swine #flu Trails begin in Idaho next month for swine flu vaccine: The Centers for Disease Control r.. http://bit.ly/HoaRi";;;#swine #flu;"3272000956";https://twitter.com/H1N1swineflu/status/3272000956
ABC7News;2009-08-12 20:12;0;0;"Schools Prepping for Swine Flu : http://clkurl.com/?tw649036";;;;"3271991994";https://twitter.com/ABC7News/status/3271991994
sinlung;2009-08-12 20:11;0;0;"Swine Flu Kills 16 in India; Schools Shut Down in Mumbai: Mumbai, Aug 13 : Swine flu pandemic toll today rose to.. http://bit.ly/w6Pt8";;;;"3271980656";https://twitter.com/sinlung/status/3271980656
1sthealthnews;2009-08-12 20:11;0;0;"Queens School Asst. Principal With Swine Flu On Ventilator - Gothamist: New York Daily NewsQueens School Asst. P.. http://bit.ly/6ZusI";;;;"3271978500";https://twitter.com/1sthealthnews/status/3271978500
YahooNewsME;2009-08-12 20:11;0;0;"NEWS: Palestinians to spend $8 mln on swine flu : Palestinian Authority in West Bank decides to spend $8 on .. http://bit.ly/1dNVRh";;;;"3271975688";https://twitter.com/YahooNewsME/status/3271975688
featherchick;2009-08-12 20:11;0;0;"RT @chrischinn We are going 3 make Twitter #oink at 9 a.m. Eastern, Aug. 16. Set your alarm.Goal: It's #H1N1 , not Swine Flu .Spread the word.";;@chrischinn;#oink #H1N1;"3271974495";https://twitter.com/featherchick/status/3271974495
ChronicFatigue1;2009-08-12 20:11;0;0;"How can you tell the difference btwn allergies and swine flu ...: Flu makes you feel like hell some over, but it.. http://bit.ly/IZ8o9";;;;"3271966469";https://twitter.com/ChronicFatigue1/status/3271966469
MikeFoster1403;2009-08-12 20:11;0;0;"Revising tonight as I have to present to the Cabinet Civil Contingencies Committee on Swine Flu tomorrow.";;;;"3271965663";https://twitter.com/MikeFoster1403/status/3271965663
bohemianGunjan;2009-08-12 20:10;0;0;"World Swine Flu Map http://www.healthmap.org/swineflu check out the date slider(horizontal) as well as the zoom slider";;;;"3271964799";https://twitter.com/bohemianGunjan/status/3271964799
lordredrock;2009-08-12 20:10;0;0;"Costa Rica's Arias works from home with swine flu: SAN JOSE, Costa Rica, Aug 12 (Reuters) - Costa Rican Pres.. http://bit.ly/ECfQl";;;;"3271962201";https://twitter.com/lordredrock/status/3271962201
swinefluh1n1;2009-08-12 20:10;0;0;""FBD: Value of Brazilian pork exports down 40.5% in July" http://tinyurl.com/kn5gq3 #swineflu #H1N1";;;#swineflu #H1N1;"3271957962";https://twitter.com/swinefluh1n1/status/3271957962
growtaller4u;2009-08-12 20:10;0;0;"IMA suggests tips to help prevent contracting swine flu : ... is still not of virulent nature in the country, the.. http://bit.ly/xrKEg";;;;"3271947350";https://twitter.com/growtaller4u/status/3271947350
SwineFluNewsIE;2009-08-12 20:09;0;0;"Swine flu symptoms highlighted in media campaign http://tinyurl.com/mm4hl7 #swineflu #h1n1";;;#swineflu #h1n1;"3271943156";https://twitter.com/SwineFluNewsIE/status/3271943156
gkhamba;2009-08-12 20:09;0;0;"5) Apparantly 17 people have died already of swine flu in India. 2 people die every 3 minutes of TB in India. No news coverage?";;;;"3271934466";https://twitter.com/gkhamba/status/3271934466
SwineFluNewsSG;2009-08-12 20:09;0;0;"Malaysian badminton manager quarantined http://tinyurl.com/l8fnus #swineflu #h1n1";;;#swineflu #h1n1;"3271931185";https://twitter.com/SwineFluNewsSG/status/3271931185
coloradoan;2009-08-12 20:08;0;0;"With classes set to resume, CSU preparing for H1N1 swine flu outbreak http://bit.ly/2YKmJ";;;;"3271920146";https://twitter.com/coloradoan/status/3271920146
YorkshireTaff;2009-08-12 20:08;0;0;"Sorry, but this reinforces my atheism :-) - 'Flying rabbis fight swine flu ' by BBC News - RichardDawkins.net http://bit.ly/8JLmh";;;;"3271918702";https://twitter.com/YorkshireTaff/status/3271918702
CBCTheNational;2009-08-12 20:08;0;0;"On tonight's National: Havard Gould on how small businesses are bracing for swine flu - and what it could mean for Canadians' livelihoods";;;;"3271917410";https://twitter.com/CBCTheNational/status/3271917410
H1N1VirusNews;2009-08-12 20:08;0;0;"WHO recommends Tamiflu in 'severe' swine flu treatment (AFP via Yahoo! News) http://cli.gs/QUhNG";;;;"3271917405";https://twitter.com/H1N1VirusNews/status/3271917405
huis_Bodegraven;2009-08-12 20:07;0;0;"Flying Rabbis Pray for End to Swine Flu 50 Rabbis and Mystics Hold Prayer Meeting above Israel (Source: Health News: C.. http://bit.ly/47cid";;;;"3271908159";https://twitter.com/huis_Bodegraven/status/3271908159
SwineFluNewsEU;2009-08-12 20:07;0;0;"Mumbai schools to sojourn tighten compartment Aug 19 http://tinyurl.com/l2uf8h #swineflu #h1n1";;;#swineflu #h1n1;"3271907236";https://twitter.com/SwineFluNewsEU/status/3271907236
reenymal;2009-08-12 20:07;0;0;"HAPPYNINGS… » Blog Archive » Swine Flu : The Facts and much more…: Elaborating on this, Dr. Manikantan and Dr. Ni.. http://bit.ly/1htoSa";;;;"3271900912";https://twitter.com/reenymal/status/3271900912
reenymal;2009-08-12 20:07;0;0;"Homeopathic Medicine For Swine Flu influenzum 200 | Tulasi ...: Read more about, Swine Flu precautions at home, .. http://bit.ly/118QdQ";;;;"3271899635";https://twitter.com/reenymal/status/3271899635
SwineFluNewsORG;2009-08-12 20:07;0;0;"Costa Rica's Arias functions from home with swine flu http://tinyurl.com/lfzfg8 #swineflu #h1n1";;;#swineflu #h1n1;"3271897229";https://twitter.com/SwineFluNewsORG/status/3271897229
reenymal;2009-08-12 20:07;0;0;"emagazineindia.com – Herbs like tulsi can help fight swine flu ...: Preeti Chhabra, an Ayurveda doctor in the ca.. http://bit.ly/ic3sn";;;;"3271895350";https://twitter.com/reenymal/status/3271895350
SwineFluH1N1_;2009-08-12 20:06;0;0;"A proactive buyer plans for Swine flu : http://bit.ly/MARdR";;;;"3271891465";https://twitter.com/SwineFluH1N1_/status/3271891465
ladiespowerhour;2009-08-12 20:06;0;0;"Online social networking to provide swine flu updates http://bit.ly/tcZmj";;;;"3271880664";https://twitter.com/ladiespowerhour/status/3271880664
ticotimesdirect;2009-08-12 20:06;0;0;"More Bad News - Costa Rica President gets swine flu - http://bit.ly/iW2q9";;;;"3271879218";https://twitter.com/ticotimesdirect/status/3271879218
_101_;2009-08-12 20:05;0;0;"[digg] How to Stop the Spread of the Swine Flu Virus in Schools: The swine flu (H1N1) virus is expected to.. http://bit.ly/6uyIg";;;;"3271867942";https://twitter.com/_101_/status/3271867942
Acubalance;2009-08-12 20:05;0;0;"Swine flu - safety issues surrounding vaccination http://ow.ly/jntJ";;;;"3271859571";https://twitter.com/Acubalance/status/3271859571
poetryc;2009-08-12 20:04;0;0;"RT @HaikuNews Nobel laureate / And Costa Rica leader / Says he has swine flu ~ http://is.gd/2d3Se #haiku #swineflu http://bit.ly/qnvLS";;@HaikuNews;#haiku #swineflu;"3271852747";https://twitter.com/poetryc/status/3271852747
DuckSportsNow;2009-08-12 20:04;0;0;"Since a couple folks have asked, no, the Ducks aren't dealing with swine flu , I'm told. Just a couple of bugs going around. ( @DuckFootball )";;@DuckFootball;;"3271848576";https://twitter.com/DuckSportsNow/status/3271848576
napsterkct;2009-08-12 20:04;0;0;"Govt guidelines to private labs on swine flu test http://bit.ly/k4VuH";;;;"3271847590";https://twitter.com/napsterkct/status/3271847590
love4macs;2009-08-12 20:04;0;0;"Online social networking to provide swine flu updates: To encourage information sharing, collaboration, and inte.. http://bit.ly/108VGL";;;;"3271836993";https://twitter.com/love4macs/status/3271836993
gforcatto;2009-08-12 20:03;0;0;"Planning my newsletter tosend to my clients regarding how to prepare their families for the swine flu naturally. Avoid the vaccine.";;;;"3271818739";https://twitter.com/gforcatto/status/3271818739
Swineflu_wires;2009-08-12 20:02;0;0;"New post: New Zealand reports two new confirmed (http://cli.gs/SmDdy)";;;;"3271807282";https://twitter.com/Swineflu_wires/status/3271807282
Agweek;2009-08-12 20:02;0;0;"Minnesota pork industry hit hard by swine flu fears http://bit.ly/17m1If";;;;"3271807215";https://twitter.com/Agweek/status/3271807215
247dotpt;2009-08-12 20:01;0;0;"#News #WorldNews Costa Rica's Arias works from home with swine flu http://247.pt";;;#News #WorldNews;"3271793362";https://twitter.com/247dotpt/status/3271793362
NewsTribune;2009-08-12 20:01;0;0;"St. Louis among 8 cities testing swine flu vaccine http://bit.ly/2VbGz";;;;"3271784532";https://twitter.com/NewsTribune/status/3271784532
swine_flu_pro;2009-08-12 20:00;0;0;"ad: Thomson Last Minute Cruise Deals http://is.gd/2dYla";;;;"3271780668";https://twitter.com/swine_flu_pro/status/3271780668
Absurdonihilist;2009-08-12 20:00;0;0;"90 people get swine flu in india and everyone's wearin masks.12 million people suffering from aids and still no one bothers to wear condoms";;;;"3271777372";https://twitter.com/Absurdonihilist/status/3271777372
flawless_hustle;2009-08-12 20:00;0;0;"#flawlesshustle Military Planning To “Assist” Civilian Authorities Incase of Swine Flu Outbreak: .. http://bit.ly/KeElD";;;#flawlesshustle;"3271774310";https://twitter.com/flawless_hustle/status/3271774310
SwineFlu_news;2009-08-12 20:00;0;0;"Central team inspects swine flu treatment facilities in state http://t.love.com/241013998";;;;"3271768946";https://twitter.com/SwineFlu_news/status/3271768946
bharatru;2009-08-12 20:00;0;0;"fitness > The Best Two Foods To Beat Swine Flu http://www.bharatbhasha.com/health.php/154691";;;;"3271762359";https://twitter.com/bharatru/status/3271762359
AllDayNews;2009-08-12 19:59;0;0;"Swine Flu Pandemic Unnerves Parts of India- With at least 17 deaths confirmed from the virus and nearly 1,200 diagn... http://bit.ly/Bro1s";;;;"3271753698";https://twitter.com/AllDayNews/status/3271753698
swineflumania;2009-08-12 19:58;0;0;"PIG FLU! #swineflu Swine Flu Pandemic Unnerves Parts of India - New York Times: Voice of Ameri.. http://bit.ly/XxO9P";;;#swineflu;"3271739861";https://twitter.com/swineflumania/status/3271739861
swineflu_news_;2009-08-12 19:58;0;0;"Costa Rica's Arias works from home with swine flu: SAN JOSE, Costa Rica, Aug 12 (Reuters) - Costa Rican Pres.. http://bit.ly/ECfQl";;;;"3271737786";https://twitter.com/swineflu_news_/status/3271737786
pedrofolga;2009-08-12 19:58;0;0;"Online social networking to provide swine flu updates http://bit.ly/Dl4d3";;;;"3271734083";https://twitter.com/pedrofolga/status/3271734083
nytimesworld;2009-08-12 19:58;0;0;"Swine Flu Pandemic Unnerves Parts of India http://bit.ly/12BAYD";;;;"3271725203";https://twitter.com/nytimesworld/status/3271725203
SwineFluNewsORG;2009-08-12 19:57;0;0;"Swine Flu cancels Hong Kong kids' unison in Portland http://tinyurl.com/meajuu #swineflu #h1n1";;;#swineflu #h1n1;"3271710712";https://twitter.com/SwineFluNewsORG/status/3271710712
healthy_news;2009-08-12 19:57;0;0;"Swine flu cases climb among US soldiers in Iraq - Breaking News ...: There have been 67 confirmed cases of swine.. http://bit.ly/edjou";;;;"3271709688";https://twitter.com/healthy_news/status/3271709688
sarahwilson91;2009-08-12 19:57;0;0;"SWINE FLU MESSAGE TO NRIS…MUMBAI SCHOOLS TO BE CLOSED FOR 7 DAYS…WE LOST OUR BABY, SAYS AAMIR http://bit.ly/KrDyW";;;;"3271707615";https://twitter.com/sarahwilson91/status/3271707615
SwineFluDoctors;2009-08-12 19:57;0;0;"Doses Administered Reporting - Information on Doses Administered Reporting. (Source: CDC Swine Flu Updates)MedWorm ... http://ow.ly/15KLX9";;;;"3271707399";https://twitter.com/SwineFluDoctors/status/3271707399
flu360;2009-08-12 19:56;0;0;"Puyallup woman dies after battle with swine flu |By KOMO Staff SEATTLE -- A Puyallup mother who spent weeks in a .. http://oohja.com/x6bi";;;;"3271706109";https://twitter.com/flu360/status/3271706109
flu360;2009-08-12 19:56;0;0;"Peru finds swine flu in Amazon tribe, more at risk|LIMA, Aug 12 (Reuters) - Members of an Amazon tribe have tested .. http://oohja.com/x6bh";;;;"3271705743";https://twitter.com/flu360/status/3271705743
breakingflunews;2009-08-12 19:56;0;0;"breakingflunews.com Nineteen Swine Flu Cases Confirmed at Coast Guard Training Center - Cape .. http://bit.ly/5USaQ";;;;"3271694596";https://twitter.com/breakingflunews/status/3271694596
SwineFluH1N1_;2009-08-12 19:56;0;0;"What happens if Swine Flu hits hard this year? are you prepared? http://bit.ly/MARdR";;;;"3271692782";https://twitter.com/SwineFluH1N1_/status/3271692782
SwineFluHeds;2009-08-12 19:56;0;0;"CBS News-Health: Flying Rabbis Pray for End to Swine Flu . More #Swine Flu #news - http://tinyurl.com/lwe3fk";;;#Swine #news;"3271692134";https://twitter.com/SwineFluHeds/status/3271692134
DuckFootball;2009-08-12 19:56;0;0;"Since a couple folks have asked, no, the Ducks aren't dealing with swine flu , I'm told. Just a couple of bugs going around.";;;;"3271691835";https://twitter.com/DuckFootball/status/3271691835
KSLbbruce;2009-08-12 19:56;0;0;"Local schools are learning about the swine flu from the southern hemisphere. That's interesting...";;;;"3271691594";https://twitter.com/KSLbbruce/status/3271691594
breakingflunews;2009-08-12 19:56;0;0;"breakingflunews.com Peru finds swine flu in Amazon tribe, more at risk - Reuters: Peru finds .. http://bit.ly/9CGto";;;;"3271689720";https://twitter.com/breakingflunews/status/3271689720
swinefluh1n1;2009-08-12 19:55;0;0;""One case of swine flu reported at YMCA Camp Falcona - The Sudbury ..." http://tinyurl.com/kv5frr #swineflu #H1N1";;;#swineflu #H1N1;"3271688153";https://twitter.com/swinefluh1n1/status/3271688153
breakingflunews;2009-08-12 19:55;0;0;"breakingflunews.com Mother died after swine flu error - BBC News: guardian.co.ukMother died a.. http://bit.ly/m2l2A";;;;"3271687885";https://twitter.com/breakingflunews/status/3271687885
swinefluh1n1;2009-08-12 19:55;0;0;""Why is India Closing Schools for Swine Flu ? (Global Health ..." http://tinyurl.com/lmuffm #swineflu #H1N1";;;#swineflu #H1N1;"3271686752";https://twitter.com/swinefluh1n1/status/3271686752
SwineFluUpdate;2009-08-12 19:55;0;0;"Swine Flu Swine Flu Pandemic Unnerves Parts of India - New York Times: Voice of AmericaSwine Flu Pandem.. http://bit.ly/XxO9P";;;;"3271683762";https://twitter.com/SwineFluUpdate/status/3271683762
sensextweet;2009-08-12 19:55;0;0;"sensex: Airline, hotel stocks catch cold on flu fear: The rapid spread of swine flu has hit share prices .. http://bit.ly/jhK0P";;;;"3271678669";https://twitter.com/sensextweet/status/3271678669
erlangerelsmere;2009-08-12 19:55;0;0;"Information regarding Swine Flu for parents and staff members: http://bit.ly/gM04X";;;;"3271674575";https://twitter.com/erlangerelsmere/status/3271674575
SwineFluNewsNZ;2009-08-12 19:54;0;0;"Swine Flu Florida News http://tinyurl.com/ryao42 #swineflu #h1n1";;;#swineflu #h1n1;"3271665919";https://twitter.com/SwineFluNewsNZ/status/3271665919
Ginaism;2009-08-12 19:54;0;0;"he said "i'm just one swine flu away from my perfect weight"... AAHAHA. funniest thing ive heard all day.";;;;"3271656199";https://twitter.com/Ginaism/status/3271656199
WorldOfWonder;2009-08-12 19:54;0;0;"[Richard Courtney]: Richard is clear of swine flu and was search for drugs but authorities only found an empty http://tinyurl.com/pwgauj";;;;"3271652950";https://twitter.com/WorldOfWonder/status/3271652950
AICOMM;2009-08-12 19:53;0;0;"RT @SwineFluNewsUSA 600 volunteers pointer up to exam swine flu vaccine at Vanderbilt http://tinyurl.com/n8e457 #swineflu #h1n1";;@SwineFluNewsUSA;#swineflu #h1n1;"3271651594";https://twitter.com/AICOMM/status/3271651594
isomsmith;2009-08-12 19:53;0;0;"Costa Rica's Arias works from home with swine flu http://bit.ly/4jIVx";;;;"3271642059";https://twitter.com/isomsmith/status/3271642059
isomsmith;2009-08-12 19:53;0;0;"Swine flu cases climb among US soldiers in Iraq | Home >> Other ... http://bit.ly/cZuII";;;;"3271639486";https://twitter.com/isomsmith/status/3271639486
DeLoong;2009-08-12 19:52;0;0;"Badminton news | Malaysian badminton coach tests negative for swine flu (Lead): M.. http://bit.ly/141sj3 | Read More...";;;;"3271627485";https://twitter.com/DeLoong/status/3271627485
wonderhearts;2009-08-12 19:52;0;0;"IMA suggests tips to help prevent contracting swine flu : ... is still not of virulent nature in the country, the.. http://bit.ly/xrKEg";;;;"3271625771";https://twitter.com/wonderhearts/status/3271625771
SwineFluNewsNZ;2009-08-12 19:52;0;0;"NZ swine flu cases strike 3000 http://tinyurl.com/ms2gst #swineflu #h1n1";;;#swineflu #h1n1;"3271623131";https://twitter.com/SwineFluNewsNZ/status/3271623131
ArthurTubman;2009-08-12 19:52;0;0;"Online social networking to provide swine flu updates: To encourage information sharing, collaboration, and inte.. http://bit.ly/3tw7U";;;;"3271616050";https://twitter.com/ArthurTubman/status/3271616050
science_watch;2009-08-12 19:51;0;0;"Sci. Am.: Swine flu strikes Amazonian Indians: Swine flu has been reported for the first time in Amazon.. http://bit.ly/DLPti";;;;"3271612694";https://twitter.com/science_watch/status/3271612694
turbohobbit;2009-08-12 19:51;0;0;"Tour cancelled due to swine flu . Guess who wasn't told? Once again Epsom & St.Hellier Trust dazzles me with their crass incompetence.";;;;"3271609514";https://twitter.com/turbohobbit/status/3271609514
SwineFluNewsEU;2009-08-12 19:51;0;0;"Swine flu cases stand between US soldiers in Iraq http://tinyurl.com/kupyxh #swineflu #h1n1";;;#swineflu #h1n1;"3271609105";https://twitter.com/SwineFluNewsEU/status/3271609105
JuiceBlue;2009-08-12 19:51;0;0;"RT @CBSNews : Flying Rabbis pray for an end to Swine Flu during prayer meeting above Israel. Read more: http://cbs.bit.ly/15ultB";;@CBSNews;;"3271604575";https://twitter.com/JuiceBlue/status/3271604575
RLInfoServices;2009-08-12 19:51;0;0;"Latest Technology, Jobs And Education: Swine flu symptoms ... http://bit.ly/6yp3V";;;;"3271597992";https://twitter.com/RLInfoServices/status/3271597992
science_watch;2009-08-12 19:50;0;0;"Sci. Am.: Swine flu strikes Amazonian Indians: Swine flu has been reported for the first time in Amazon.. http://bit.ly/A6qJd";;;;"3271595558";https://twitter.com/science_watch/status/3271595558
Swine_Virus;2009-08-12 19:50;0;1;"Swine Flu Pandemic Unnerves Parts of India - New York Times http://bit.ly/13ZoZg";;;;"3271589429";https://twitter.com/Swine_Virus/status/3271589429
freymans;2009-08-12 19:50;0;0;"Online social networking to provide swine flu updates: To encourage information sharing, collaboration, and inte.. http://bit.ly/NWZEE";;;;"3271588032";https://twitter.com/freymans/status/3271588032
GeneRef;2009-08-12 19:50;0;0;"Peru finds swine flu in Amazon tribe, more at risk http://bit.ly/OJRhE";;;;"3271587549";https://twitter.com/GeneRef/status/3271587549
swinefluh1n1;2009-08-12 19:50;0;0;""China, Singapore join list of places reporting Tamiflu-resistant ..." http://tinyurl.com/ncrayk #swineflu #H1N1";;;#swineflu #H1N1;"3271582887";https://twitter.com/swinefluh1n1/status/3271582887
biotechstocks;2009-08-12 19:50;0;0;"Swine flu might be just as mild in autumn, say experts: Swine Flu May Not Be Any Deadlier This Fall: Experts Rev.. http://bit.ly/eHPCp";;;;"3271579240";https://twitter.com/biotechstocks/status/3271579240
earnmoneyinfo;2009-08-12 19:49;0;0;"Online social networking to provide swine flu updates - Business Standard http://ff.im/-6w56B";;;;"3271574535";https://twitter.com/earnmoneyinfo/status/3271574535
WJHG_TV;2009-08-12 19:49;0;0;"Swine Flu Update: Additional laboratory confirmed H1N1 Swine Flu deaths have been verified in that of the follow.. http://bit.ly/153AVa";;;;"3271573908";https://twitter.com/WJHG_TV/status/3271573908
SwineFluNewsHK;2009-08-12 19:49;0;0;"Vail doc: Do we know your (influenza) alphabet? http://tinyurl.com/mwokgb #swineflu #h1n1";;;#swineflu #h1n1;"3271568721";https://twitter.com/SwineFluNewsHK/status/3271568721
newsonswineflu;2009-08-12 19:49;0;0;"Trails begin in Idaho next month for swine flu vaccine: The Centers for Disease Control reports that they expect.. http://bit.ly/HoaRi";;;;"3271565840";https://twitter.com/newsonswineflu/status/3271565840
newsonswineflu;2009-08-12 19:49;0;0;"Swine Flu Update: Tamiflu, Mumbai Schools & Flying Rabbis: By Jacob Goldstein The WHO reiterated its recomme.. http://bit.ly/C1FW7";;;;"3271565170";https://twitter.com/newsonswineflu/status/3271565170
burbleon;2009-08-12 19:49;0;0;"he prolly cant cure it but the man's right..yoga does improve the immune system=>no swine flu http://tiny.cc/w2NUM";;;;"3271562618";https://twitter.com/burbleon/status/3271562618
mohitthatte;2009-08-12 19:48;0;0;"ROFL I knew it too! RT @neo_indian I knew it! Yoga can cure Swine Flu : http://bit.ly/27t224";;@neo_indian;;"3271552395";https://twitter.com/mohitthatte/status/3271552395
public_affairs;2009-08-12 19:48;0;0;"RT @JudithBaumel Still worrying about #swineflu ? Philip Alcabes talks about DREAD, Monday 7pm, Half King, NYC http://bit.ly/3tbLA";;@JudithBaumel;#swineflu;"3271552029";https://twitter.com/public_affairs/status/3271552029
swineflunews24;2009-08-12 19:48;0;0;"Costa Rica's Arias works from home with swine flu: SAN JOSE, Costa Rica, Aug 12 (Reuters) - Costa Rican Pres.. http://bit.ly/IKDBK";;;;"3271550325";https://twitter.com/swineflunews24/status/3271550325
General_Trivia;2009-08-12 19:47;0;0;"Check out this Vid: Swine Flu 101: 9 My Thoughts on the .... via @twttblogs http://bit.ly/DuI8s";;@twttblogs;;"3271536123";https://twitter.com/General_Trivia/status/3271536123
