username;date;retweets;favorites;text;geo;mentions;hashtags;id;permalink
Alderalarms;2009-07-16 21:12;0;0;"Fight for swine flu vaccine could get ugly - Yahoo! News http://bit.ly/BKg9P";;;;"2676289263";https://twitter.com/Alderalarms/status/2676289263
travelwise1;2009-07-16 21:12;0;0;"Swine flu vaccine a boon for Baxter http://u.mavrev.com/p4xt";;;;"2676288930";https://twitter.com/travelwise1/status/2676288930
travelwise1;2009-07-16 21:12;0;0;"Obama earmarks $1.8 billion for swine flu fight http://u.mavrev.com/p4xo";;;;"2676287452";https://twitter.com/travelwise1/status/2676287452
cincylocal;2009-07-16 21:12;0;0;"Americans Expect Widespread Swine Flu - http://fwix.com/article/25_f466378ebe";;;;"2676280632";https://twitter.com/cincylocal/status/2676280632
canny1985;2009-07-16 21:11;0;1;"has got mild case of swine flu if this is the mild case i dont want the full version";;;;"2676273873";https://twitter.com/canny1985/status/2676273873
dmfranks;2009-07-16 21:11;0;0;"Swine flu talk on @noagenda gives me tired head! Still a good ep today though. http://bit.ly/3vL8Wy";;@noagenda;;"2676272831";https://twitter.com/dmfranks/status/2676272831
jadeorsum;2009-07-16 21:11;0;0;"doesn't understand why that lovely documentary about Michael Jackson was followed by a load of crap about Swine Flu ...totally killed my buzz";;;;"2676268738";https://twitter.com/jadeorsum/status/2676268738
TheLovingMother;2009-07-16 21:11;0;0;"Two children at Harford camp test positive for swine flu http://bit.ly/BfhpZ";;;;"2676268515";https://twitter.com/TheLovingMother/status/2676268515
stormewg;2009-07-16 21:11;0;0;"roundhouse 2mwz, little touring in da houzzile w skint & noisettes all under one roof. Followed by swine flu house.";;;;"2676268108";https://twitter.com/stormewg/status/2676268108
alchme;2009-07-16 21:11;0;0;"Wishes it was pouring with rain today. Oh and I think I might be getting swine flu . Stupid pigs.";;;;"2676267520";https://twitter.com/alchme/status/2676267520
ChatterMatters;2009-07-16 21:11;0;0;"ITN is getting shouty about Swine 'flu ' - meanwhile lots of people are getting soaked to the skin watching http://www.oneandother.co.uk/";;;;"2676266438";https://twitter.com/ChatterMatters/status/2676266438
latinageek;2009-07-16 21:11;0;0;"Where's the #Sotomayor love, Puerto Rican newspapers? Oh right, everyone's freaking out about 1st #swineflu death.";;;#Sotomayor #swineflu;"2676264461";https://twitter.com/latinageek/status/2676264461
Catskillz;2009-07-16 21:10;0;0;"Oh no. My pal Melissa Auf Der Maur has swine flu . Hope she gets better - poor thing! http://bit.ly/Jis8X";;;;"2676255268";https://twitter.com/Catskillz/status/2676255268
MJHaney;2009-07-16 21:10;0;0;"Breaking news from BBC: We've no bloody idea how many people could die from Swine Flu . Between 3000 and 65000? Might as well say 'some'...";;;;"2676251248";https://twitter.com/MJHaney/status/2676251248
Moffly;2009-07-16 21:10;0;0;"Swine flu threatens Muslim Hajj season http://bit.ly/62PVJ";;;;"2676248746";https://twitter.com/Moffly/status/2676248746
swineflueupdate;2009-07-16 21:09;0;0;"Educate and Prevent Three new cases of swine flu in state - Times of India: Press Trust of In.. http://bit.ly/Pqn5t";;;;"2676247026";https://twitter.com/swineflueupdate/status/2676247026
edyong209;2009-07-16 21:09;0;0;"http://tinyurl.com/n85peu Totally bizarre picture. Caption could be "Gluing pills to your face proves to be ineffective against swine flu ".";;;;"2676242809";https://twitter.com/edyong209/status/2676242809
AmyJessicaB;2009-07-16 21:09;0;0;"It's thundering and lightening tonight in England mum reckons I have swine flu .. Chest is really bad it seems to b worst at night.. Great :(";;;;"2676242348";https://twitter.com/AmyJessicaB/status/2676242348
RosieFrances;2009-07-16 21:09;0;0;"my grandma and cousins have swine flu , and two of my friends have mumps- it's only a matter of time..feels like death row for me!";;;;"2676238089";https://twitter.com/RosieFrances/status/2676238089
Bluepower10Pro;2009-07-16 21:09;0;0;"USA Today News: Survey: Americans expect widespread swine flu ahead: About three out of five Amer.. http://bit.ly/EE3Ec";;;;"2676237711";https://twitter.com/Bluepower10Pro/status/2676237711
bigdiler;2009-07-16 21:08;0;0;"A special swine flu service is being set up to relieve the pressure on the NHS as the death toll hits 29, says the government.";;;;"2676229500";https://twitter.com/bigdiler/status/2676229500
freecloud;2009-07-16 21:08;0;0;"Ah - clearly the NHS is too busy preparing for Swine Flu to deal with my miserable request for an annual check up appointment #prdrivennhs";;;#prdrivennhs;"2676227548";https://twitter.com/freecloud/status/2676227548
NigelLBevan;2009-07-16 21:08;0;0;"Swine Flu . Governments create FEAR to instill trust so they can return to power.";;;;"2676227508";https://twitter.com/NigelLBevan/status/2676227508
ChartAttack;2009-07-16 21:08;0;0;"Swine Flu , Arguments Hit Ex-Hole Members: Melissa Auf Der Maur has been recovering from swine flu while Courtne.. http://bit.ly/ndrEB";;;;"2676226184";https://twitter.com/ChartAttack/status/2676226184
MarkReckons;2009-07-16 21:08;0;0;"Fight for swine flu vaccine could get ugly http://bit.ly/6uCbp [del.icio.us]";;;;"2676225073";https://twitter.com/MarkReckons/status/2676225073
SwineInfluenza;2009-07-16 21:08;0;0;"Two children at Harford camp test positive for swine flu - Baltimore Sun: Globe and MailTwo children at Harford .. http://bit.ly/Z2HyN";;;;"2676222296";https://twitter.com/SwineInfluenza/status/2676222296
clarinette02;2009-07-16 21:08;0;0;"LOL double attack RT @cyberdoyle News: PpL can access swineflu info on internet. But Ppl who don't have broadband either #digitalbritain";;@cyberdoyle;#digitalbritain;"2676219048";https://twitter.com/clarinette02/status/2676219048
MedicalNewsUSA;2009-07-16 21:08;0;0;"Health officials plan for next wave of swine flu | Ottawa and ...: News Ottawa and Region ... Public health is a.. http://bit.ly/x2b5f";;;;"2676218533";https://twitter.com/MedicalNewsUSA/status/2676218533
SWINE_FLU_VRUS;2009-07-16 21:08;0;0;"Fight For Swine Flu Vaccine Could Get Ugly http://bit.ly/pxXJs";;;;"2676218478";https://twitter.com/SWINE_FLU_VRUS/status/2676218478
Fluheadlines;2009-07-16 21:08;0;0;"Fluheadlines Scenario of 65,000 deaths from swine flu based on simple calculation: The figure of 65,.. http://bit.ly/t3Ozv";;;;"2676217927";https://twitter.com/Fluheadlines/status/2676217927
lynnelaurenson;2009-07-16 21:07;0;0;"He's behind you! He's got Swine Flu ! Ooooooh! Make a sacrifice for society's sake! Decapitate your mate!";;;;"2676216476";https://twitter.com/lynnelaurenson/status/2676216476
Fluheadlines;2009-07-16 21:07;0;0;"Fluheadlines Swine Flu Vaccine Won’t Meet Demand, Baxter CEO Says (Update1): July 16 (Bloomberg) -- .. http://bit.ly/TOjgC";;;;"2676216382";https://twitter.com/Fluheadlines/status/2676216382
wisree;2009-07-16 21:07;0;0;"H5N1: Hong Kong: Suspected fatal swine flu case reported http://bit.ly/LeFG2";;;;"2676215678";https://twitter.com/wisree/status/2676215678
Fluheadlines;2009-07-16 21:07;0;0;"Fluheadlines Cherie Blair suffering from swine flu : reports: Cherie Blair, wife of former prime mini.. http://bit.ly/n8iq4";;;;"2676215161";https://twitter.com/Fluheadlines/status/2676215161
wisree;2009-07-16 21:07;0;0;"Fights over swine flu vaccine doses loom, could provoke battles ... http://bit.ly/2Sy7v";;;;"2676214957";https://twitter.com/wisree/status/2676214957
breakingnewsie;2009-07-16 21:07;0;0;"WORLD: Obama earmarks emergency funding to fight swine flu : President Barack Obama today earmarked $1.825b.. http://short.ie/xoso6t";;;;"2676214685";https://twitter.com/breakingnewsie/status/2676214685
AboveTheFold59;2009-07-16 21:07;0;0;"Reading: "Fight for swine flu vaccine could get ugly - Yahoo! News" ( http://bit.ly/18RPEs )";;;;"2676214474";https://twitter.com/AboveTheFold59/status/2676214474
SWINE_FLU_VRUS;2009-07-16 21:07;0;0;"Swine flu probed at 3 more Ontario camps http://bit.ly/OuQrF";;;;"2676212119";https://twitter.com/SWINE_FLU_VRUS/status/2676212119
happy2hostLTD;2009-07-16 21:07;0;0;"65k cases of swine flu is the worst case scenario by next year..";;;;"2676211646";https://twitter.com/happy2hostLTD/status/2676211646
alandavies;2009-07-16 21:07;0;0;"Swine flu symptoms - courtesy of the BBC http://bit.ly/5GcG6";;;;"2676211530";https://twitter.com/alandavies/status/2676211530
USATODAYhealth;2009-07-16 21:07;0;0;"Survey: Americans expect widespread swine flu ahead http://tr.im/sGAk";;;;"2676210441";https://twitter.com/USATODAYhealth/status/2676210441
news4u2;2009-07-16 21:07;0;0;"Obama earmarks $1.8 billion for swine flu fight: WASHINGTON, July 16 (Reuters) - President Barack Obama designat.. http://bit.ly/FIARa";;;;"2676207123";https://twitter.com/news4u2/status/2676207123
ThatGirlAdele;2009-07-16 21:07;0;0;"What the hell is going on? First the credit crunch, then Michael Jackson dies, now the swine Flu is running tings!";;;;"2676205675";https://twitter.com/ThatGirlAdele/status/2676205675
news4u2;2009-07-16 21:07;0;0;"Swine flu vaccine a boon for Baxter: By Bruce Japsen | Tribune staff reporter Worldwide demand for a swine flu v.. http://bit.ly/MZd0u";;;;"2676205490";https://twitter.com/news4u2/status/2676205490
guardiannews;2009-07-16 21:07;0;1;"Swine flu could kill 65,000 in UK, warns chief medical officer http://bit.ly/12T9Bc";;;;"2676204826";https://twitter.com/guardiannews/status/2676204826
Live_NewsAU;2009-07-16 21:06;0;0;"Spike in British swine flu deaths: BRITAIN has announced a spike in deaths related to swine flu , but as health e.. http://bit.ly/7zb0P";;;;"2676197496";https://twitter.com/Live_NewsAU/status/2676197496
SwineFluNewsCA;2009-07-16 21:06;0;0;"Spike in British swine flu deaths as competition for vaccines begins http://tinyurl.com/mzpy7w #swineflu #h1n1";;;#swineflu #h1n1;"2676194519";https://twitter.com/SwineFluNewsCA/status/2676194519
SWINE_FLU_VRUS;2009-07-16 21:06;0;0;"Are You Breaking Swine Flu 's Golden Rule? http://bit.ly/FZ6GR";;;;"2676194461";https://twitter.com/SWINE_FLU_VRUS/status/2676194461
alastairs;2009-07-16 21:06;0;0;"Talking Head on the news: "The NHS is one of the most prepared countries to deal with swine flu ." Lol!";;;;"2676194238";https://twitter.com/alastairs/status/2676194238
cyberdoyle;2009-07-16 21:06;0;0;"News at 10 just said peeps can access swineflu info on internet. But peeps furthest from medics don't have broadband either #digitalbritain";;;#digitalbritain;"2676193706";https://twitter.com/cyberdoyle/status/2676193706
CBCRadio3;2009-07-16 21:06;0;0;"Former Hole and Smashing Pumpkins member Melissa Auf Der Maur writes about her month-long battle with Swine Flu . http://bit.ly/f3DFE";;;;"2676192256";https://twitter.com/CBCRadio3/status/2676192256
news_bot;2009-07-16 21:06;0;0;"UK Opens Swine Flu Advice Center as Deaths Double in Week - Bloomberg http://ow.ly/15HXi2";;;;"2676185956";https://twitter.com/news_bot/status/2676185956
DebdoesDevizes;2009-07-16 21:05;0;0;"Just packed the caravan ready for weekend get away - surley I can escape swine flu in the middle of the Forrest!";;;;"2676185237";https://twitter.com/DebdoesDevizes/status/2676185237
JEEM1E;2009-07-16 21:05;0;0;"This swine flu is getting serious....better go stick on gloves and a scarf";;;;"2676184606";https://twitter.com/JEEM1E/status/2676184606
andyofengland;2009-07-16 21:05;0;0;"All this talk about swine flu , blimey - talk about panicing the public.";;;;"2676181911";https://twitter.com/andyofengland/status/2676181911
bookwormboy;2009-07-16 21:05;0;0;"News at Ten NHS preparing for 65,000 people to die from swine flu this year using my calculator thats approx 360 a day";;;;"2676179662";https://twitter.com/bookwormboy/status/2676179662
MakedaQoS;2009-07-16 21:05;0;0;"Tony Blair is being treated for Swine Flu !! Up to 65K people will die!! WTF!!?? Think I'll be staying in quite a bit this summer......";;;;"2676179092";https://twitter.com/MakedaQoS/status/2676179092
lebanonrss;2009-07-16 21:05;0;0;"Number of swine flu cases hits 70 - Daily Star - Lebanon http://bit.ly/wy0Qn";;;;"2676177124";https://twitter.com/lebanonrss/status/2676177124
SusannaTerry;2009-07-16 21:05;0;0;"People worry so much about the swine flu epidemic and yet if we strenghten our immune system we can protect ourselves from ill-health";;;;"2676176944";https://twitter.com/SusannaTerry/status/2676176944
Little_Miss_B;2009-07-16 21:05;0;0;"okay reword... at worse case scenario 65000 people could ahve died from swine flu ... as quoted on the news";;;;"2676175177";https://twitter.com/Little_Miss_B/status/2676175177
SWINE_FLU_VRUS;2009-07-16 21:04;0;0;"H1N1 pandemic spreading too fast to count: WHO (source: Reuters) http://bit.ly/19vKcr";;;;"2676167510";https://twitter.com/SWINE_FLU_VRUS/status/2676167510
ABC11_WTVD;2009-07-16 21:04;0;0;"Swine Flu claims new mother http://bit.ly/19hkFw";;;;"2676167271";https://twitter.com/ABC11_WTVD/status/2676167271
Little_Miss_B;2009-07-16 21:04;0;0;"whhhhaaattttt........ news saying end of year 65000 people will die of swine flu ???? worst case scenario";;;;"2676165638";https://twitter.com/Little_Miss_B/status/2676165638
Laura_Rads;2009-07-16 21:04;0;0;"WHY Is Britan At The Front Of The Queue For Swine Flu Vaccine?!! Shouldnt We Be Treatin The Problem At The Root Of The Outbreak";;;;"2676164123";https://twitter.com/Laura_Rads/status/2676164123
MumsnetTowers;2009-07-16 21:04;0;0;"Are you keeping swine flu under your hat? http://bit.ly/woqFl";;;;"2676163112";https://twitter.com/MumsnetTowers/status/2676163112
SwineFluNewsUSA;2009-07-16 21:04;0;0;"H1N1 pandemic swelling as well quick to equate - WHO http://tinyurl.com/l7s584 #swineflu #h1n1";;;#swineflu #h1n1;"2676160058";https://twitter.com/SwineFluNewsUSA/status/2676160058
SWINE_FLU_VRUS;2009-07-16 21:04;0;0;"Swine flu probed at 3 more Ontario camps (source: CBC) http://bit.ly/VQHh3";;;;"2676158879";https://twitter.com/SWINE_FLU_VRUS/status/2676158879
lbmonitor;2009-07-16 21:04;0;0;"Number of swine flu cases hits 70 - Daily Star - Lebanon http://bit.ly/wy0Qn";;;;"2676158737";https://twitter.com/lbmonitor/status/2676158737
alterforex;2009-07-16 21:04;0;0;"Swine flu vaccine a boon for Baxter http://bit.ly/MZd0u";;;;"2676157854";https://twitter.com/alterforex/status/2676157854
jeanmacc;2009-07-16 21:04;0;0;"What is one to believe over swine flu . Is it all panic and worse case senarios.";;;;"2676156280";https://twitter.com/jeanmacc/status/2676156280
BIEBERLOVER818;2009-07-16 21:03;0;0;"omg mums keepin me home from skool 2moro cuz of swine flu + lipson have closed cuz of it :O its my last day 2morocant go in :(";;;;"2676152738";https://twitter.com/BIEBERLOVER818/status/2676152738
johncurrie;2009-07-16 21:03;0;0;"30 more Air Force cadets diagnosed with swine flu";;;;"2676151169";https://twitter.com/johncurrie/status/2676151169
Chavender;2009-07-16 21:03;0;0;"alarming forecast on news of possibly 65,000 swine flu cases in UK by the end of the year.";;;;"2676149023";https://twitter.com/Chavender/status/2676149023
SWINE_FLU_VRUS;2009-07-16 21:03;0;0;"Gov'ts Worry About H1N1 Vaccine Contracts (source: CBS News) http://bit.ly/UmEvh";;;;"2676148699";https://twitter.com/SWINE_FLU_VRUS/status/2676148699
I_P_Squint;2009-07-16 21:03;0;0;"swine flu kickin about here :-0";;;;"2676147085";https://twitter.com/I_P_Squint/status/2676147085
nikala_;2009-07-16 21:03;0;0;"mm, worried about swine flu , my mums operation, my cats out in thunder and rain and falling in love with him.";;;;"2676144706";https://twitter.com/nikala_/status/2676144706
brrohama;2009-07-16 21:03;0;0;"Obama earmarks $1.8 billion for swine flu fight: WASHINGTON, July 16 (Reuters) - President Barack Obama designat.. http://bit.ly/X2fML";;;;"2676140966";https://twitter.com/brrohama/status/2676140966
jrobertson;2009-07-16 21:02;0;0;"swine flu ... don't worry you'll be fine providing you don't have to leave the house from now until Christmas.";;;;"2676137008";https://twitter.com/jrobertson/status/2676137008
edwardclarke;2009-07-16 21:02;0;0;"Ooooh love the BBC's swineflu virus animated graphic! #aporkalypse";;;#aporkalypse;"2676135010";https://twitter.com/edwardclarke/status/2676135010
star_search;2009-07-16 21:02;0;0;"Two children at Harford camp test positive for swine flu - Baltimore Sun http://ff.im/-5jHOb";;;;"2676134873";https://twitter.com/star_search/status/2676134873
SonoChietta;2009-07-16 21:02;0;0;"Is it true Cherie Blair has got swine flu ? Hmm, not as newsworthy as hearing Leo has got measles cause they didn't give him MMR.....";;;;"2676133249";https://twitter.com/SonoChietta/status/2676133249
ZoeJayneCarter;2009-07-16 21:02;0;0;"I am trying to stay calm when I see Swine Flu coverage but when an average cold puts your son in intensive care it is hard not to PANIC!!!!!";;;;"2676132277";https://twitter.com/ZoeJayneCarter/status/2676132277
allesegretti;2009-07-16 21:02;0;0;"WOAH Swine Flu in England - Deaths Doubled since Monday. NHS preparing for 65,000 deaths THIS YEAR.";;;;"2676131920";https://twitter.com/allesegretti/status/2676131920
SwineFluNewsHK;2009-07-16 21:02;0;0;"Hong Kong annals initial swine flu death http://tinyurl.com/nk2yvs #swineflu #h1n1";;;#swineflu #h1n1;"2676129796";https://twitter.com/SwineFluNewsHK/status/2676129796
indywire;2009-07-16 21:02;0;0;"Americans Expect Widespread Swine Flu - http://fwix.com/article/18_14fa287ec1";;;;"2676125039";https://twitter.com/indywire/status/2676125039
JamesAbb5;2009-07-16 21:02;0;1;"start of the news straight into "possible deaths of 65,000 people from swine flu " great stuff";;;;"2676124599";https://twitter.com/JamesAbb5/status/2676124599
WSBTHealth;2009-07-16 21:02;0;0;"Fight for swine flu vaccine could get ugly http://bit.ly/ezYJX";;;;"2676123113";https://twitter.com/WSBTHealth/status/2676123113
norwestbusiness;2009-07-16 21:01;0;0;"BPD: Cherie Blair battles suspected swine flu : Tony Blair's wife Cherie is suffering from suspected swine fl.. http://bit.ly/rtSf8";;;;"2676122130";https://twitter.com/norwestbusiness/status/2676122130
clairey67;2009-07-16 21:01;0;0;"OH had trip 2 OZ cancelled due to large numbers of swine flu cases. Will be interested to see how it goes as it's their Winter, ours 2 come.";;;;"2676121403";https://twitter.com/clairey67/status/2676121403
norwestbusiness;2009-07-16 21:01;0;0;"BPD: Swine flu kills 10 in NSW: Pregnant women urged to wear masks in public and stay at home if possible. http://bit.ly/OsRgo";;;;"2676120898";https://twitter.com/norwestbusiness/status/2676120898
sambaliz;2009-07-16 21:01;0;0;"Nice wee article on swine flu and other flu prophylaxis, http://bit.ly/1WGLbx via http://twib.es/450";;;;"2676120693";https://twitter.com/sambaliz/status/2676120693
FlennieJ;2009-07-16 21:01;0;0;"I do NOT want my diabetic husband to geT swine flu . NOT NOT NOT. By the way.";;;;"2676119856";https://twitter.com/FlennieJ/status/2676119856
SWINE_FLU_VRUS;2009-07-16 21:01;0;0;"Swine flu chronicles - Need to know - Macleans.ca http://bit.ly/3MMok";;;;"2676115894";https://twitter.com/SWINE_FLU_VRUS/status/2676115894
JCLFAULKNER;2009-07-16 21:01;0;0;"lot of people in manchester got swine flu . Im worried for my glands.";;;;"2676113661";https://twitter.com/JCLFAULKNER/status/2676113661
ITbarbie;2009-07-16 21:01;0;0;"swine flu panic in the UK, what a surprise.";;;;"2676112404";https://twitter.com/ITbarbie/status/2676112404
StephenMossGdn;2009-07-16 21:01;0;1;"People at Vauxhall station were openly weeping at the news that Cherie Blair had swine flu and well-wishers are gathering at her London home";;;;"2676111599";https://twitter.com/StephenMossGdn/status/2676111599
procpr;2009-07-16 21:01;0;0;"News:: Up to 65,000 Swine Flu Deaths possible for Britain http://bit.ly/zYl6";;;;"2676111094";https://twitter.com/procpr/status/2676111094
Diligence_MENA;2009-07-16 21:00;0;0;"Lebanon swine flu cases reach 70. http://tr.im/sGwb";;;;"2676105548";https://twitter.com/Diligence_MENA/status/2676105548
westsider2;2009-07-16 21:00;0;0;"Obama earmarks $1.8 billion for swine flu fight - Reuters - guardian.co.ukObama earmarks $1.8 billion for swine flu ... http://ow.ly/15HXf3";;;;"2676099551";https://twitter.com/westsider2/status/2676099551
SWINE_FLU_VRUS;2009-07-16 21:00;0;0;"Swine flu cases jump | Local News | Toowoomba Chronicle http://bit.ly/3BCep";;;;"2676092739";https://twitter.com/SWINE_FLU_VRUS/status/2676092739
IBWhitty;2009-07-16 20:59;0;0;"Concerned for my UK friends after reading today's swine flu headlines. Read 2 books on flu pandemic 1918-19 & this alarms me. You all okay?";;;;"2676081848";https://twitter.com/IBWhitty/status/2676081848
ruth_clark;2009-07-16 20:59;0;0;"Hugh hasn't got the dreaded swine flu . So I will see him this weekend :)";;;;"2676080692";https://twitter.com/ruth_clark/status/2676080692
RebeccaJBradley;2009-07-16 20:59;0;0;"Daughter has mild case of swine flu . Hoping she feels better soon";;;;"2676079369";https://twitter.com/RebeccaJBradley/status/2676079369
swinefluupdated;2009-07-16 20:59;0;0;"Classical swine fever - Lithuania: (PA) susp, RFI #swineflu http://bit.ly/f8zyq";;;#swineflu;"2676079154";https://twitter.com/swinefluupdated/status/2676079154
HNatarajan;2009-07-16 20:59;0;0;"Swine flu deaths in Britain soar to 29 as 12 people die in just FOUR days http://tinyurl.com/nubpxg";;;;"2676078717";https://twitter.com/HNatarajan/status/2676078717
swinefluupdated;2009-07-16 20:59;0;0;"Influenza pandemic (H1N1) 2009 (04): pandemic origins #swineflu http://bit.ly/dlDA6";;;#swineflu;"2676078054";https://twitter.com/swinefluupdated/status/2676078054
SWINE_FLU_VRUS;2009-07-16 20:59;0;0;"Survey shows Americans expect widespread swine flu ... http://bit.ly/xXKmL";;;;"2676077295";https://twitter.com/SWINE_FLU_VRUS/status/2676077295
dizzy99;2009-07-16 20:59;0;0;"DON'T have a go at me, it's swine flu . You are going to die. Get on with it. QUIETLY!!!";;;;"2676077228";https://twitter.com/dizzy99/status/2676077228
H1N1SwineFluNuz;2009-07-16 20:58;0;0;"Fight Swine Flu With ProBiotics - Your Other Option To Help Boost Your Immune System - Free Bottle To Try http://snurl.com/mg5mr";;;;"2676069402";https://twitter.com/H1N1SwineFluNuz/status/2676069402
swinefluremedy_;2009-07-16 20:58;0;0;"Move Over Swine Flu , Ebola's Back http://bit.ly/mdjRv";;;;"2676062469";https://twitter.com/swinefluremedy_/status/2676062469
SWINE_FLU_VRUS;2009-07-16 20:57;0;0;"UK swine flu deaths jump to 29 | Rocket News http://bit.ly/20istF";;;;"2676058921";https://twitter.com/SWINE_FLU_VRUS/status/2676058921
_kavita;2009-07-16 20:57;0;0;"Methinks te stupid swine flu has finally died down. I feel a lot better now (: Quarantine finishes tomorrow!";;;;"2676058286";https://twitter.com/_kavita/status/2676058286
BHardcastle;2009-07-16 20:57;0;0;"thinking Swine Flu man on BBC home page resembles Micheal Stipe";;;;"2676056591";https://twitter.com/BHardcastle/status/2676056591
ankar71;2009-07-16 20:57;0;0;"A greek bishop insists that you cannot catch the swine flu through the holy communion: http://tinyurl.com/m2rjt6. What a moron.";;;;"2676056161";https://twitter.com/ankar71/status/2676056161
breakingflunews;2009-07-16 20:57;0;0;"breakingflunews.com Obama earmarks emergency funding to fight swine flu - Ireland Online: Oba.. http://bit.ly/O2cSS";;;;"2676054841";https://twitter.com/breakingflunews/status/2676054841
breakingflunews;2009-07-16 20:57;0;0;"breakingflunews.com Navy equipped to test for swine flu - WAVY-TV: WAVY-TVNavy equipped to te.. http://bit.ly/nVj3o";;;;"2676052979";https://twitter.com/breakingflunews/status/2676052979
TimesVideo;2009-07-16 20:57;0;0;"#video Swine flu death estimates rise http://bit.ly/4aOlrU";;;#video;"2676052905";https://twitter.com/TimesVideo/status/2676052905
samykins80;2009-07-16 20:57;0;0;"havent been on twitter for a few days......sick sick sick...dont want to give anyone my germs..........with the whole swine flu going round";;;;"2676051430";https://twitter.com/samykins80/status/2676051430
SwineFluNewsSG;2009-07-16 20:57;0;0;"Batam Asks Int'L Shipping Companies to Provide Face Masks http://tinyurl.com/lgmfs3 #swineflu #h1n1";;;#swineflu #h1n1;"2676051233";https://twitter.com/SwineFluNewsSG/status/2676051233
diseasesonline;2009-07-16 20:56;0;0;"http://tr.im/meld Fight for swine flu vaccine could get ugly - Yahoo! News: Jul 16, 2009 ... An.. http://u.mavrev.com/p4ja";;;;"2676034524";https://twitter.com/diseasesonline/status/2676034524
SocietyGuardian;2009-07-16 20:56;0;0;"Society news: Swine flu could kill 65,000 in UK, warns chief medical officer http://bit.ly/12T9Bc";;;;"2676030825";https://twitter.com/SocietyGuardian/status/2676030825
abhiways;2009-07-16 20:56;0;0;"WORLD NEWS: UK swine flu deaths jump to 29 A special swine flu service is being...http://tilltoday.com";;;;"2676030049";https://twitter.com/abhiways/status/2676030049
adammorland;2009-07-16 20:56;0;0;"Melissa Auf der Maur has swine flu and is blogging about it - http://bit.ly/IJWzF";;;;"2676029856";https://twitter.com/adammorland/status/2676029856
Nightline;2009-07-16 20:55;0;0;"RT @khinman : In Florida on a heartbreaker of a story about a pregnant mom in a coma because of swine flu .";;@khinman;;"2676025902";https://twitter.com/Nightline/status/2676025902
DOTmedcom;2009-07-16 20:55;0;0;"http://www.dotmed.com/news/story/9645/ Swine flu hits Australia. H1N1 still on its viral path.";;;;"2676024500";https://twitter.com/DOTmedcom/status/2676024500
marmalade;2009-07-16 20:55;0;0;"Not getting paid this week as both bosses are out with The Illness ( swine flu ? very likely). Hope they are ok, but damn, really needed the $";;;;"2676020989";https://twitter.com/marmalade/status/2676020989
davidmkeen;2009-07-16 20:55;0;0;"new on the blog Swine Flu leaflet for Sunday: Based on a helpful circular forwarded by Richard Fr.. http://bit.ly/NaDW8";;;;"2676016811";https://twitter.com/davidmkeen/status/2676016811
