username;date;retweets;favorites;text;geo;mentions;hashtags;id;permalink
igeldard;2009-05-29 19:24;0;0;"RT @realreporter : Centers for Disease Control reports 15 people dead, 8975 cases of #SwineFlu in US";;@realreporter;#SwineFlu;"1963229591";https://twitter.com/igeldard/status/1963229591
1010WINS;2009-05-29 19:24;0;0;"65 Swine Flu Cases Now Confirmed in New Jersey http://tinyurl.com/l4ehn5";;;;"1963227643";https://twitter.com/1010WINS/status/1963227643
decherneyge;2009-05-29 19:23;0;0;""You don’t have swine flu … but it’d be cool if you did." - David http://tumblr.com/xtw1wg30f";;;;"1963225440";https://twitter.com/decherneyge/status/1963225440
swinefluh1n1;2009-05-29 19:23;0;0;""China has first domestic H1N1 infection" http://tinyurl.com/m5n69j #swineflu #H1N1";;;#swineflu #H1N1;"1963225047";https://twitter.com/swinefluh1n1/status/1963225047
swinefluh1n1;2009-05-29 19:23;0;0;""OMS/Europe - Grippe - 25 countries have reported influenza A(H1N1 ..." http://tinyurl.com/l2et7b #swineflu #H1N1";;;#swineflu #H1N1;"1963224218";https://twitter.com/swinefluh1n1/status/1963224218
albaniannews;2009-05-29 19:23;0;0;"Albanian diplomat not infected with swine flu - BSANNA NEWS http://bit.ly/Rnjxj";;;;"1963221617";https://twitter.com/albaniannews/status/1963221617
jaynehendry;2009-05-29 19:23;0;0;"RT @universalhub : Swine flu takes out three more Boston schools. 11 schools have been shut over recent weeks http://tinyurl.com/lmycxs";;@universalhub;;"1963219149";https://twitter.com/jaynehendry/status/1963219149
mg_health;2009-05-29 19:22;0;0;"El Paso swine flu deaths push Texas total to 5: EL PASO, Texas — Health officials in El Paso are reporting.. http://tinyurl.com/lxnez8";;;;"1963210487";https://twitter.com/mg_health/status/1963210487
SwineFluNewsIE;2009-05-29 19:22;0;0;"45 kids with swine flu at same first school http://tinyurl.com/pgpzvh";;;;"1963207289";https://twitter.com/SwineFluNewsIE/status/1963207289
universalhub;2009-05-29 19:21;0;0;"Oh, Mann: Swine flu takes out three more Boston schools http://www.universalhub.com/node/25520";;;;"1963201283";https://twitter.com/universalhub/status/1963201283
noland_fam;2009-05-29 19:20;0;0;"Everyone--if you think you have a cold dont go to the doctor when they do that swine flu test you will wish you had something lol";;;;"1963184602";https://twitter.com/noland_fam/status/1963184602
TammyOConnor;2009-05-29 19:18;0;0;"A case of the H1N1 virus ( Swine Flu ) has been confirmed at the Lake Orion High School.";;;;"1963172154";https://twitter.com/TammyOConnor/status/1963172154
TM_Outbreak;2009-05-29 19:18;0;0;"Swine Flu threatens to close Springfield middle school - Dayton Business Journal: http://tinyurl.com/kwnbs2 (via @breakingflunews )";;@breakingflunews;;"1963171123";https://twitter.com/TM_Outbreak/status/1963171123
epaulnet;2009-05-29 19:18;0;0;"USTDY: U.S. official in Normandy, France, diagnosed with swine flu http://tinyurl.com/l99orq";;;;"1963171044";https://twitter.com/epaulnet/status/1963171044
CDashMoney;2009-05-29 19:18;0;0;"RT @health Latest h1n1 swine flu case totals from CDC: 8,975 cases, 15 deaths. Wisconsin has 1,430 cases. http://tr.im/mPcT";;@health;;"1963169148";https://twitter.com/CDashMoney/status/1963169148
SwineFluNewsEU;2009-05-29 19:17;0;0;"Britain's Eton propagandize closes after swine flu case http://tinyurl.com/nlaaqq";;;;"1963162760";https://twitter.com/SwineFluNewsEU/status/1963162760
swineflu_virus;2009-05-29 19:16;0;0;"Md. School Group Released from Quarantine in China http://tinyurl.com/l8keqr";;;;"1963149022";https://twitter.com/swineflu_virus/status/1963149022
ladyreporter;2009-05-29 19:16;0;0;"El Paso swine flu deaths push Texas total to 5 - Houston Chronicle http://ff.im/-3nH56";;;;"1963145908";https://twitter.com/ladyreporter/status/1963145908
BlueRidgeNow;2009-05-29 19:16;0;0;"First case of swine flu confirmed in Buncombe County http://tinyurl.com/n4xvqw";;;;"1963144832";https://twitter.com/BlueRidgeNow/status/1963144832
Mari_Fitzroy;2009-05-29 19:16;0;0;"OMG!...Other Swine Flu is following me...kkkkkkk";;;;"1963143314";https://twitter.com/Mari_Fitzroy/status/1963143314
AndeeD;2009-05-29 19:15;0;0;"I assume you have a Bedazzler? RT @dragonboysuede : I'm totally gonna bling out my swine flu mask! Any design ideas? #swineflumaskbling";;@dragonboysuede;#swineflumaskbling;"1963140200";https://twitter.com/AndeeD/status/1963140200
swinefluh1n1;2009-05-29 19:15;0;0;""Md. school group freed from quarantine in China - Nation ..." http://tinyurl.com/l5azty #swineflu #H1N1";;;#swineflu #H1N1;"1963139788";https://twitter.com/swinefluh1n1/status/1963139788
swinefluh1n1;2009-05-29 19:15;0;0;""NYC Closes More Schools Due To Flu-like Symptoms, Flu and Cold" http://tinyurl.com/l4hn2h #swineflu #H1N1";;;#swineflu #H1N1;"1963138575";https://twitter.com/swinefluh1n1/status/1963138575
dawnhershey;2009-05-29 19:15;0;0;"90 people get the Swine Flu and everybody wants to wear a mask.Six million people have AIDS and no one wants to wear a condom.";;;;"1963134282";https://twitter.com/dawnhershey/status/1963134282
SwineFluNewsCA;2009-05-29 19:14;0;0;"Swine flu cases pass 15,000 mark http://tinyurl.com/l82ffn";;;;"1963120798";https://twitter.com/SwineFluNewsCA/status/1963120798
SwineFluNewsORG;2009-05-29 19:14;0;0;"Rheumatoid arthritis drug competence quarrel swine flu http://tinyurl.com/mupgad";;;;"1963120375";https://twitter.com/SwineFluNewsORG/status/1963120375
jahbini;2009-05-29 19:14;0;0;"#swineflu in Alaska http://bit.ly/xBFmj as well as Tasmania http://burnurl.com/EBB5Up-- Like 'chicken man' it's everywhere, it's everywhere";;;#swineflu;"1963120318";https://twitter.com/jahbini/status/1963120318
BestNewsDotCom;2009-05-29 19:13;0;0;"US official in France has Swine Flu - Tribune - http://www.thenewstribune.com/tacoma/24hour/world/story/760079.html - on www.BestNews.com";;;;"1963114046";https://twitter.com/BestNewsDotCom/status/1963114046
ekoreen;2009-05-29 19:13;0;0;"Empty anti-bacterial dispensers at Post HQ taunting me. Gonna get Swine Flu and teach 'em.";;;;"1963111211";https://twitter.com/ekoreen/status/1963111211
IanReeves;2009-05-29 19:13;0;0;"Swine Flu threatens to close Springfield middle school: The director of the Clark County Combined Health Distric.. http://bit.ly/f22dX";;;;"1963111097";https://twitter.com/IanReeves/status/1963111097
SAJP;2009-05-29 19:12;0;0;"RT @CDCemergency Update 5/29/09: 8,975 total cases of novel H1N1 flu, 15 deaths, 49 states affected: http://is.gd/J7wG #swineflu #h1n1";;@CDCemergency;#swineflu #h1n1;"1963107307";https://twitter.com/SAJP/status/1963107307
VOLOTech386;2009-05-29 19:12;0;0;"rt @MiamiHeraldNews Carnival shares slip after swine flu outbreak on Australian cruise http://snipurl.com/j0foi";;@MiamiHeraldNews;;"1963105188";https://twitter.com/VOLOTech386/status/1963105188
swinefluh1n1;2009-05-29 19:12;0;0;""US government places $811 million order for swine flu vaccine" http://tinyurl.com/lexndd #swineflu #H1N1";;;#swineflu #H1N1;"1963102471";https://twitter.com/swinefluh1n1/status/1963102471
VOLOTech386;2009-05-29 19:12;0;0;"Carnival Offers Refund After Swine Flu Sickens Passengers, Crew http://cli.gs/DW9Dpz";;;;"1963100532";https://twitter.com/VOLOTech386/status/1963100532
swineflunews24;2009-05-29 19:12;0;0;"65 swine flu cases now confirmed in NJ: AP TRENTON, NJ - The number of confirmed swine flu cases in New Jersey h.. http://bit.ly/gZZbu";;;;"1963100062";https://twitter.com/swineflunews24/status/1963100062
swineflunews24;2009-05-29 19:12;0;0;"El Paso swine flu deaths push Texas total to 5: State health officials said Friday the deaths bring the number o.. http://bit.ly/xAccA";;;;"1963099648";https://twitter.com/swineflunews24/status/1963099648
swineflunews24;2009-05-29 19:12;0;0;"How swine flu kills | Life Sciences Blog: Story Summary:...That list of people who would die is the same list of.. http://bit.ly/hOAHr";;;;"1963099235";https://twitter.com/swineflunews24/status/1963099235
H1N1VirusNews;2009-05-29 19:11;0;0;"Two more Scots confirmed with swine flu http://cli.gs/93nzPb";;;;"1963096422";https://twitter.com/H1N1VirusNews/status/1963096422
GovernAmerica;2009-05-29 19:11;0;0;"CDC wants to start injecting Swine Flu by October... http://bit.ly/MEyiG";;;;"1963095297";https://twitter.com/GovernAmerica/status/1963095297
ChirpLouder;2009-05-29 19:11;0;0;"RT @birdflu : 10 patients are currently on ventilators in New York City because of H1N1 swine flu . http://bit.ly/757sa";;@birdflu;;"1963090018";https://twitter.com/ChirpLouder/status/1963090018
marrsattacks;2009-05-29 19:11;0;0;"now that the swine flu is starting to not get as much press I think I'm gonna bring back SARS...";;;;"1963088159";https://twitter.com/marrsattacks/status/1963088159
swinefluh1n1;2009-05-29 19:10;0;0;""UMH Medicine Grand Rounds 2009 Novel Influenza AH1N1 Outbreak | e ..." http://tinyurl.com/no954j #swineflu #H1N1";;;#swineflu #H1N1;"1963085357";https://twitter.com/swinefluh1n1/status/1963085357
swinefluh1n1;2009-05-29 19:10;0;0;""A/H1N1 Patients in Romania Under Hospital Surveillance - en ..." http://tinyurl.com/mvdmtv #swineflu #H1N1";;;#swineflu #H1N1;"1963079931";https://twitter.com/swinefluh1n1/status/1963079931
Mari_Fitzroy;2009-05-29 19:09;0;0;"OMG. Swine flu is following me on Twitter! O_o";;;;"1963067323";https://twitter.com/Mari_Fitzroy/status/1963067323
PokJournal;2009-05-29 19:08;0;0;"Three more cases of swine flu confirmed in Dutchess County. - http://bit.ly/mXm0W";;;;"1963063903";https://twitter.com/PokJournal/status/1963063903
healthy_news;2009-05-29 19:08;0;0;"Swine flu strikes New York City flu expert's daughter: Scientific ...: On Thursday, Scott Harper, an influen.. http://bit.ly/HcEi1";;;;"1963057647";https://twitter.com/healthy_news/status/1963057647
CrucesSunNews;2009-05-29 19:08;0;0;"Officials: Swine flu suspected in two El Paso deaths. http://www.lcsun-news.com/ci_12478043";;;;"1963057142";https://twitter.com/CrucesSunNews/status/1963057142
LodiEnterprise;2009-05-29 19:07;0;0;"A child who attends Poynette Middle School has a laboratory confirmed case of H1N1 ( swine flu ) http://tinyurl.com/nfxmwo";;;;"1963049997";https://twitter.com/LodiEnterprise/status/1963049997
BestNewsDotCom;2009-05-29 19:07;0;0;"US official in France has Swine flu - Breitbart - http://bit.ly/9ilyj - on www.BestNews.com";;;;"1963049161";https://twitter.com/BestNewsDotCom/status/1963049161
swineflumania;2009-05-29 19:06;0;0;"PIG FLU! #swineflu Two more confirmed with swine flu - BBC News: Times OnlineTwo more confirme.. http://tinyurl.com/larmdn";;;#swineflu;"1963036051";https://twitter.com/swineflumania/status/1963036051
13NewsNow;2009-05-29 19:06;0;0;"A Chesapeake middle student and a girl in the Peninsula Health District are being treated for the H1N1 " swine flu ," health officials say.";;;;"1963036021";https://twitter.com/13NewsNow/status/1963036021
swinefluh1n1;2009-05-29 19:06;0;0;""Disease Hunters Add Swine Flu Genome to Arsenal" http://tinyurl.com/omqau8 #swineflu #H1N1";;;#swineflu #H1N1;"1963035164";https://twitter.com/swinefluh1n1/status/1963035164
swineflumania;2009-05-29 19:06;0;0;"PIG FLU! #swineflu Swine Flu threatens to close Springfield middle school - Bizjournals.com: A.. http://tinyurl.com/l3nt8x";;;#swineflu;"1963035116";https://twitter.com/swineflumania/status/1963035116
onacloud;2009-05-29 19:05;0;0;"RT @traveldudes : RT @pen4hire : Swine Flu , H1N1, ho-hum. Travelers don't care. Mexico getting back to business. http://bit.ly/Pmz0L";;@traveldudes @pen4hire;;"1963030753";https://twitter.com/onacloud/status/1963030753
christabelaroo;2009-05-29 19:05;0;0;"I didn't expect to be glugging the covonia on the hottest day yet this year. Why me? I may be mummy pig but I don't have swine flu !";;;;"1963028831";https://twitter.com/christabelaroo/status/1963028831
SwineFluNewsNZ;2009-05-29 19:04;0;0;"NZ faces ongoing swine flu battle http://tinyurl.com/mjc8ad";;;;"1963016063";https://twitter.com/SwineFluNewsNZ/status/1963016063
novelh1n1;2009-05-29 19:04;0;0;"http://novelh1n1.com Rutland High student diagnosed with swine flu - Rutland Herald: Rutland.. http://bit.ly/EBNIa";;;;"1963014881";https://twitter.com/novelh1n1/status/1963014881
novelh1n1;2009-05-29 19:04;0;0;"http://novelh1n1.com H1N1 Influenza ( swine flu ) Update: as of May 29, 2009: UPDATE ON CASES:.. http://bit.ly/u79Qh";;;;"1963014437";https://twitter.com/novelh1n1/status/1963014437
novelh1n1;2009-05-29 19:04;0;0;"http://novelh1n1.com Travel Roundup: Carnival's Swine Flu Outbreak, Southwest Pilot's &#8230.. http://bit.ly/17ev2p";;;#8230;"1963013929";https://twitter.com/novelh1n1/status/1963013929
Lily244;2009-05-29 19:04;0;0;"Swine Flu threatens to close Springfield middle school http://bit.ly/U3LnE";;;;"1963013021";https://twitter.com/Lily244/status/1963013021
Lyne_Robichaud;2009-05-29 19:03;0;1;"RT @CP_Branswell Wise words at Effect Measure about hitting right notes (or wrong notes) in #swineflu messaging: http://tinyurl.com/mh8sho";;@CP_Branswell;#swineflu;"1963010145";https://twitter.com/Lyne_Robichaud/status/1963010145
chelc_sea;2009-05-29 19:03;0;0;"Me: I'd be so pissed if someone killed me right before I retire. Sherm: I'd be pissed if I die of swine flu Oh, priorities.";;;;"1963006746";https://twitter.com/chelc_sea/status/1963006746
stopflunews;2009-05-29 19:02;0;0;"El Paso swine flu deaths push Texas total to 5 - Houston Chronicle http://tinyurl.com/m5gshs";;;;"1962996873";https://twitter.com/stopflunews/status/1962996873
therealdjflux;2009-05-29 19:02;0;0;"Just got the word - I'll be gettin' my swine flu on soon. Headed to Mexico City for the day job on June 13. ¡Salud!";;;;"1962992028";https://twitter.com/therealdjflux/status/1962992028
Mari_Fitzroy;2009-05-29 19:01;0;0;"Sometimes I think people are much sensationalism, in relation to Swine flu .";;;;"1962987463";https://twitter.com/Mari_Fitzroy/status/1962987463
myOptum;2009-05-29 19:01;0;0;"Rheumatoid Arthritis Drug Might Fight Swine Flu : It helps regulate the immune system's response, study with mice.. http://tinyurl.com/nxl35x";;;;"1962986972";https://twitter.com/myOptum/status/1962986972
WeyW;2009-05-29 19:01;0;0;"RT CCCNJ has at least 1 confirmed case of swine flu . They went to the retreat. If you have flu-like symptoms, go to the hospital for testing";;;;"1962986165";https://twitter.com/WeyW/status/1962986165
myOptum;2009-05-29 19:01;0;0;"Swine Flu Vaccine Won't Be Ready Until October: CDC: But it's still not certain that a broad-based immunization .. http://tinyurl.com/n6rba7";;;;"1962985923";https://twitter.com/myOptum/status/1962985923
LEDTV;2009-05-29 19:01;0;0;"You cannot get swine flu from a new LED TV. That is a promise from me, LED TV.";;;;"1962980666";https://twitter.com/LEDTV/status/1962980666
health;2009-05-29 19:01;0;1;"Latest h1n1 swine flu case totals from CDC: 8,975 cases, 15 deaths. Wisconsin has 1,430 cases. http://tr.im/mPcT";;;;"1962979342";https://twitter.com/health/status/1962979342
Mari_Fitzroy;2009-05-29 19:00;0;0;"@mishacollins I dont know that about Birmingham! Today there was a confirmed case of swine flu in my city. Near Sao Paulo - Brazil";;@mishacollins;;"1962971167";https://twitter.com/Mari_Fitzroy/status/1962971167
mtsource;2009-05-29 18:59;0;0;"New Blog Entry, "Rheumatoid Arthritis Drug Might Fight Swine Flu " - Visit http://www.mtsource.us to read more.";;;;"1962965931";https://twitter.com/mtsource/status/1962965931
mrRiffles;2009-05-29 18:59;0;0;"RT @guav : First Celebrity to Die of Swine Flu : http://twitpic.com/671bt And we all know who infected him.";;@guav;;"1962959194";https://twitter.com/mrRiffles/status/1962959194
wisree;2009-05-29 18:58;0;0;"Swine Flu threatens to close Springfield middle school http://bit.ly/qXbwz";;;;"1962955927";https://twitter.com/wisree/status/1962955927
wisree;2009-05-29 18:58;0;0;"El Paso swine flu deaths push Texas total to 5 http://bit.ly/2AYnHq";;;;"1962955456";https://twitter.com/wisree/status/1962955456
rawsienna;2009-05-29 18:58;0;0;"Still can't get over why people who think they have the swine flu think it's OK to come to work and spread their germs";;;;"1962951973";https://twitter.com/rawsienna/status/1962951973
diseasesonline;2009-05-29 18:58;0;0;"http://tr.im/meld 65 swine flu cases now confirmed in NJ: AP TRENTON, NJ - The number of confir.. http://tinyurl.com/nuflp2";;;;"1962950168";https://twitter.com/diseasesonline/status/1962950168
health_club;2009-05-29 18:57;0;0;"Swine Flu threatens to close Springfield middle school: The director of the Clark County Combined Health Distric.. http://tinyurl.com/merscd";;;;"1962943466";https://twitter.com/health_club/status/1962943466
SwineFluNewsSG;2009-05-29 18:57;0;0;"Swine Flu in Greek Students May Point to Outbreak in Edinburgh, Study Says http://tinyurl.com/kuu4dj";;;;"1962942364";https://twitter.com/SwineFluNewsSG/status/1962942364
SwineFluNewsIE;2009-05-29 18:57;0;0;"Critically sick Glasgow male reliable as swine flu case http://tinyurl.com/mr2lln";;;;"1962942285";https://twitter.com/SwineFluNewsIE/status/1962942285
break_glass;2009-05-29 18:57;0;0;"Last night I posted on #swineflu and its many names. There's a lesson there for #crisiscomms - http://tr.im/mPaG";;;#swineflu #crisiscomms;"1962939760";https://twitter.com/break_glass/status/1962939760
swinefluh1n1;2009-05-29 18:57;0;0;""H5N1: China reports first domestic case of A/H1N1 flu" http://tinyurl.com/mhzl9t #swineflu #H1N1";;;#swineflu #H1N1;"1962939197";https://twitter.com/swinefluh1n1/status/1962939197
swinefluh1n1;2009-05-29 18:57;0;0;""Signs of the Times News for Fri, 29 May 2009" http://tinyurl.com/lcllpg #swineflu #H1N1";;;#swineflu #H1N1;"1962938849";https://twitter.com/swinefluh1n1/status/1962938849
aseansociety;2009-05-29 18:56;0;0;"www.asean-society.org: More swine flu cases confirmed at Birmingham school http://bit.ly/LpuOg";;;;"1962932919";https://twitter.com/aseansociety/status/1962932919
swinefluh1n1;2009-05-29 18:56;0;0;""2 Greek students catch swine flu in UK" http://tinyurl.com/mxuo44 #swineflu #H1N1";;;#swineflu #H1N1;"1962927319";https://twitter.com/swinefluh1n1/status/1962927319
TechZader;2009-05-29 18:56;0;0;"SciAm - Swine flu strikes New York City flu expert's daughter http://bit.ly/m4y14";;;;"1962925998";https://twitter.com/TechZader/status/1962925998
BankersDidIt;2009-05-29 18:54;0;0;"RT @birdflu : A U.S. official in Normandy to prepare President Obama's upcoming visit has been hospitalized with swine flu http://bit.ly/ ...";;@birdflu;;"1962913465";https://twitter.com/BankersDidIt/status/1962913465
TravelDudes;2009-05-29 18:54;0;0;"RT @pen4hire : Swine Flu , H1N1, ho-hum. Travelers don't care. Mexico getting back to business. http://bit.ly/Pmz0L";;@pen4hire;;"1962912814";https://twitter.com/TravelDudes/status/1962912814
birdflu;2009-05-29 18:54;0;0;"2 swine flu deaths recorded in El Paso, Texas. One 24-year-old pregnant woman and a 42-year-old man. http://bit.ly/HZtSk";;;;"1962909489";https://twitter.com/birdflu/status/1962909489
RutlandHerald;2009-05-29 18:53;0;0;"Rutland High School student diagnosed with Swine Flu http://www.rutlandherald.com/article/20090529/NEWS/905299987";;;;"1962904344";https://twitter.com/RutlandHerald/status/1962904344
NewsNewYork;2009-05-29 18:53;0;0;"NY News: Swine flu strikes New York City flu expert's daughter - Scientific American http://bit.ly/uTxId #NewYork";;;#NewYork;"1962902118";https://twitter.com/NewsNewYork/status/1962902118
birdflu;2009-05-29 18:53;0;0;"10 patients are currently on ventilators in New York City because of H1N1 swine flu . http://bit.ly/757sa";;;;"1962899857";https://twitter.com/birdflu/status/1962899857
Finn_Girl;2009-05-29 18:53;0;0;"Drs don't test for Swine Flu , and Schools don't want you to come back for 7 days after a fever. Finals Week is not the time to miss school";;;;"1962899408";https://twitter.com/Finn_Girl/status/1962899408
aseansociety;2009-05-29 18:52;0;0;"www.asean-society.org: Swine flu spreading faster in UK than rest of EU http://bit.ly/17Nhkf";;;;"1962894139";https://twitter.com/aseansociety/status/1962894139
WIREDInsider;2009-05-29 18:51;0;0;"Vamprisim more contagious than swine flu ? Guillermo Del Toro thinks so...http://www.wired.com/video";;;;"1962884119";https://twitter.com/WIREDInsider/status/1962884119
Lyne_Robichaud;2009-05-29 18:51;0;0;"Seven swine flu clinics open in Melbourne http://bit.ly/veueX";;;;"1962880927";https://twitter.com/Lyne_Robichaud/status/1962880927
swineflu2;2009-05-29 18:51;0;0;"#swineflu El Paso swine flu deaths push Texas total to 5 - Houston Chronicle: WIVBEl Paso swine flu dea.. http://tinyurl.com/mbx2uj";;;#swineflu;"1962879858";https://twitter.com/swineflu2/status/1962879858
Justgod007;2009-05-29 18:50;0;0;"Swine Flu Friday is coming to an end! Happy Friday!";;;;"1962879590";https://twitter.com/Justgod007/status/1962879590
swineflu2;2009-05-29 18:50;0;0;"#swineflu Two more confirmed with swine flu - BBC News: BBC NewsTwo more confirmed with swine fluBBC Ne.. http://tinyurl.com/lkzsk9";;;#swineflu;"1962878996";https://twitter.com/swineflu2/status/1962878996
EricMEsteves;2009-05-29 18:50;0;0;"this swine flu thing just keeps quietly banging away...3 more schools quarantined. yikes";;;;"1962874454";https://twitter.com/EricMEsteves/status/1962874454
pulsepointcmp;2009-05-29 18:50;0;0;"Two Greek Students Catch Swine Flu in Scotland, Virus Moving Toward Pandemic?: Swine flu has been in the news ev.. http://tinyurl.com/nqpep3";;;;"1962874042";https://twitter.com/pulsepointcmp/status/1962874042
politics;2009-05-29 18:50;0;0;"RT: @birdflu U.S. official in Normandy to prepare President Obama's upcoming visit has been hospitalized with swine flu http://bit.ly/plqSE";;@birdflu;;"1962871510";https://twitter.com/politics/status/1962871510
AlwaysTexan2000;2009-05-29 18:49;0;0;"RT @swineflubrk : According to WHO Swine flu infections world wide pass 15,000 http://bit.ly/dep4x #h1n1 #swineflu";;@swineflubrk;#h1n1 #swineflu;"1962870719";https://twitter.com/AlwaysTexan2000/status/1962870719
financialonstar;2009-05-29 18:49;0;0;"http://www.loan-star.ch: Queenslanders will be only passengers allowed off swine flu ship http://cli.gs/uyVdHY";;;;"1962866256";https://twitter.com/financialonstar/status/1962866256
swinefluh1n1;2009-05-29 18:48;0;0;""Hungary confirms first H1N1 flu case" http://tinyurl.com/mdobrj #swineflu #H1N1";;;#swineflu #H1N1;"1962861327";https://twitter.com/swinefluh1n1/status/1962861327
thenoodleator;2009-05-29 18:47;0;0;"Lectured about being quarantined in Sydney unless I get a swine flu shot. Trip is mid July! I dose her with another "media beat up" rant.";;;;"1962852639";https://twitter.com/thenoodleator/status/1962852639
dbeggs;2009-05-29 18:47;0;0;"America's panic gap: Fortune's Stanley Bing says the U.S. is suffering a lag in panics now that the swine flu fe.. http://bit.ly/jVkY8";;;;"1962852091";https://twitter.com/dbeggs/status/1962852091
cheeseslice;2009-05-29 18:46;0;0;"Staying home to help ailing daughter with swine flu . Foregoing col reunion to eventually meet dozens of classmates I never met 20 years ago.";;;;"1962843951";https://twitter.com/cheeseslice/status/1962843951
petejames2233;2009-05-29 18:46;0;0;"RT @kwtx : Just in.... confirmed cases of that new swine flu strain are popping up in some area counties... http://is.gd/JeLF";;@kwtx;;"1962842880";https://twitter.com/petejames2233/status/1962842880
SwineFluNewsEU;2009-05-29 18:45;0;0;"Global swine flu death fee mounts http://tinyurl.com/ls738h";;;;"1962837042";https://twitter.com/SwineFluNewsEU/status/1962837042
FluffyPira;2009-05-29 18:45;0;0;"This is the weekend I claim swine flu as an excuse to stay at home all day and do heroics in WoW. Its a secret though ;)";;;;"1962832092";https://twitter.com/FluffyPira/status/1962832092
thedailydish;2009-05-29 18:41;0;0;"Feels better. No swine flu . Sorry @LelandKim !";;@LelandKim;;"1962804960";https://twitter.com/thedailydish/status/1962804960
SPFsocial;2009-05-29 18:41;0;0;"Member of Obama's advance team in France has swine flu | The Arabist http://bit.ly/19gBGF";;;;"1962802309";https://twitter.com/SPFsocial/status/1962802309
TND_Crisis;2009-05-29 18:40;0;0;"2 Greek students catch swine flu in UK - The Associated Press (http://cli.gs/bp9nDY) #swineflu #H1N1";;;#swineflu #H1N1;"1962791027";https://twitter.com/TND_Crisis/status/1962791027
TND_Crisis;2009-05-29 18:40;0;0;"Further swine flu cases confirmed - BBC News (http://cli.gs/M94zXu) #swineflu #H1N1";;;#swineflu #H1N1;"1962789024";https://twitter.com/TND_Crisis/status/1962789024
difflam;2009-05-29 18:39;0;0;"Swine Flu threatens to close Springfield middle school http://bit.ly/VA0CT";;;;"1962785473";https://twitter.com/difflam/status/1962785473
badfaery;2009-05-29 18:39;0;0;"Just when you've forgotten the swine flu the news reports two people in your city have died from it in the past week! Be careful out there!";;;;"1962781719";https://twitter.com/badfaery/status/1962781719
saltlakehealth;2009-05-29 18:38;0;0;"Novel H1N1 ( swine flu ) cases decreasing nationwide. Active transmission still ongoing in Utah, no decrease in our state at this time.";;;;"1962772684";https://twitter.com/saltlakehealth/status/1962772684
LBFGlasgow;2009-05-29 18:37;0;0;"Two more confirmed with swine flu , The Health Secretary has announced two more people.. http://tinyurl.com/mwpv42 #confirmed #announced";;;#confirmed #announced;"1962770953";https://twitter.com/LBFGlasgow/status/1962770953
weighlesstoday;2009-05-29 18:37;0;0;"Swine Flu threatens to close Springfield middle school: The director of the Clark County Combined Health District and the Superintendent ..";;;;"1962770761";https://twitter.com/weighlesstoday/status/1962770761
freshtwit;2009-05-29 18:37;0;0;"updated page about zombie swine flu at http://freshtwit.com/zombie-swine-flu";;;;"1962768185";https://twitter.com/freshtwit/status/1962768185
chrisbowers;2009-05-29 18:37;0;0;"RT @KXAN_News : Health officials in El Paso are reporting that a pregnant woman and man who died earlier this month both had swine flu .";;@KXAN_News;;"1962765707";https://twitter.com/chrisbowers/status/1962765707
