username;date;retweets;favorites;text;geo;mentions;hashtags;id;permalink
jfnord;2009-08-12 17:33;0;0;"I cd think of one other head of state who cd use the flu RT @@ABSCBNNews : Costa Rican pres. Arias contracts swine flu http://bit.ly/hBmPv";;@ @ABSCBNNews;;"3269133526";https://twitter.com/jfnord/status/3269133526
SundeepDougal;2009-08-12 17:32;0;0;"Mail recd: 900 people got swine flu and the whole world wants to wear surgical masks. 20 million have AIDS and nobody wants to wear a condom";;;;"3269121173";https://twitter.com/SundeepDougal/status/3269121173
VOLOTech386;2009-08-12 17:32;0;0;"Canada warns businesses to plan now for late 2009 swine flu surge (AP) http://bit.ly/19jidB";;;;"3269120283";https://twitter.com/VOLOTech386/status/3269120283
m_hamilton;2009-08-12 17:32;0;0;"BREAKING - Costa Rican president sick with swine flu . http://bit.ly/1aeenr";;;;"3269109447";https://twitter.com/m_hamilton/status/3269109447
SwineFluNewsEU;2009-08-12 17:32;0;0;"Swine Flu United Kingdom News http://tinyurl.com/r9mu39 #swineflu #h1n1";;;#swineflu #h1n1;"3269108101";https://twitter.com/SwineFluNewsEU/status/3269108101
ocbarista;2009-08-12 17:31;0;0;"Swine flu : How experts are preparing their families: http://bit.ly/sNJuf";;;;"3269096684";https://twitter.com/ocbarista/status/3269096684
edinburghUKnews;2009-08-12 17:31;0;0;"http://bit.ly/101eYW Woman dies after swine flu misdiagnosis: • Woman prescribed Tamiflu and.. http://bit.ly/121O9s";;;;"3269094917";https://twitter.com/edinburghUKnews/status/3269094917
LingoNews;2009-08-12 17:31;0;0;"Swine Flu Prompts Mumbai Closures - Voice of America- Indian Express ... http://bit.ly/nPg7Z";;;;"3269089166";https://twitter.com/LingoNews/status/3269089166
demofta;2009-08-12 17:30;0;0;"- Costa Rican President is suffering from the H1N1 virus, making him the first head of state known to have contracted swine flu .";;;;"3269076317";https://twitter.com/demofta/status/3269076317
sharphealthcare;2009-08-12 17:30;0;0;"Swine Flu May Not Be Any Deadlier This Fall: Experts: Review of prior epidemics refutes theory that virus gets m.. http://bit.ly/1xsjJe";;;;"3269075475";https://twitter.com/sharphealthcare/status/3269075475
HelenBranswell;2009-08-12 17:29;0;0;"China, S'pore join list of places that have spotted Tamiflu-resistant #swineflu viruses. WHO says it knows of a few more http://bit.ly/aaMTY";;;#swineflu;"3269062430";https://twitter.com/HelenBranswell/status/3269062430
sporkette;2009-08-12 17:29;0;0;"RT @drlaibow #SwineFlu #MandatoryVaccination http://bit.ly/hDxIR What you need to know about Swine Flu Fact and Fiction http://bit.ly/hDxIR";;@drlaibow;#SwineFlu #MandatoryVaccination;"3269059867";https://twitter.com/sporkette/status/3269059867
SwineFluNewsNZ;2009-08-12 17:29;0;0;"Media goes overboard after swine flu scare http://tinyurl.com/ml3xmp #swineflu #h1n1";;;#swineflu #h1n1;"3269056802";https://twitter.com/SwineFluNewsNZ/status/3269056802
HealthPR;2009-08-12 17:28;0;0;"Costa Rican President Conracts Swine Flu : Health, Fitness, Wellness, Diabetes, Cancer, Exercise by Vitabeat. H.. http://bit.ly/1Xh9LQ";;;;"3269045947";https://twitter.com/HealthPR/status/3269045947
Therap_Ease;2009-08-12 17:28;0;0;"RT @FluInTheNews: WHO Reiterates Advice on Use of Flu Drugs for H1N1 - ABC News http://bit.ly/3UmGwt #swineflu";;@FluInTheNews;#swineflu;"3269038949";https://twitter.com/Therap_Ease/status/3269038949
rvazquez;2009-08-12 17:28;0;0;"RT @newscientist : Exclusive swine flu poll: How experts are preparing their families for the second wave http://bit.ly/y8vQJ";;@newscientist;;"3269038256";https://twitter.com/rvazquez/status/3269038256
evilflea;2009-08-12 17:28;0;0;"Guardian: second person dies of meningitis after swine flu diagnosis";;;;"3269036900";https://twitter.com/evilflea/status/3269036900
novelh1n1;2009-08-12 17:27;0;0;"http://novelh1n1.com Swine flu outbreak in remotest Amazon raises fears of devastating &#823.. http://bit.ly/8tIsS";;;#823;"3269030708";https://twitter.com/novelh1n1/status/3269030708
SwineFluNewsEU;2009-08-12 17:27;0;0;"H1N1 Flu Cases Among GIs in Iraq Hit 67 http://tinyurl.com/nfn2p5 #swineflu #h1n1";;;#swineflu #h1n1;"3269030540";https://twitter.com/SwineFluNewsEU/status/3269030540
novelh1n1;2009-08-12 17:27;0;0;"http://novelh1n1.com Area school districts gear up for Fall season…and swine flu &#821.. http://bit.ly/3Z2Nxg";;;#821;"3269030355";https://twitter.com/novelh1n1/status/3269030355
vmcnews;2009-08-12 17:27;0;0;"InTheNews: Americans Line up for Experimental Swine Flu Vaccinations - KATV ABC: KATV, Channel 7, Litt.. http://bit.ly/VOFZ4";;;;"3269028617";https://twitter.com/vmcnews/status/3269028617
ukallergies;2009-08-12 17:27;0;0;"How can you tell the difference btwn allergies and swine flu ... http://u.mavrev.com/01dah";;;;"3269021459";https://twitter.com/ukallergies/status/3269021459
Alderalarms;2009-08-12 17:26;0;0;"Swine Flu Update: Tamiflu, Mumbai Schools & Flying Rabbis http://bit.ly/hexco";;;;"3269008359";https://twitter.com/Alderalarms/status/3269008359
SwineFluHeds;2009-08-12 17:26;0;0;"Boston (MA) WCVB: State Wages War On H1N1 Flu . More #Swine Flu #news - http://tinyurl.com/lwe3fk";;;#Swine #news;"3269000669";https://twitter.com/SwineFluHeds/status/3269000669
justinaireland;2009-08-12 17:26;0;0;"Trying to figure how I can get out of a two hour afternoon meeting. Maybe claim swine flu ? Cough, cough.";;;;"3268999366";https://twitter.com/justinaireland/status/3268999366
mariapage;2009-08-12 17:26;0;0;"" Swine flu : How experts are preparing their families - health - 12 August 2009 - New Scientist" ( http://bit.ly/lihpo )";;;;"3268998099";https://twitter.com/mariapage/status/3268998099
diseasesonline;2009-08-12 17:25;0;0;"http://tr.im/meld Swine Flu Update: Tamiflu, Mumbai Schools & Flying Rabbis: ... keep dying.. http://u.mavrev.com/01d9y";;;;"3268996099";https://twitter.com/diseasesonline/status/3268996099
swineflu_news_;2009-08-12 17:25;0;0;"Swine Flu Update: Tamiflu, Mumbai Schools & Flying Rabbis: ... keep dying from it,” one rabbi told a local n.. http://bit.ly/C1FW7";;;;"3268993558";https://twitter.com/swineflu_news_/status/3268993558
TubScrubber;2009-08-12 17:24;0;0;"Catch it, Bin it, Kill it - Swine flu Campaign | .::tek3D Weblog::.: Catch it – germs spread easily. Always carr.. http://u.mavrev.com/01d8s";;;;"3268976546";https://twitter.com/TubScrubber/status/3268976546
TubScrubber;2009-08-12 17:24;0;0;"Swine Flu Symptoms: The Difference between Regular flu and Swine ...: Germs of swine flu can spread when a perso.. http://u.mavrev.com/01d8p";;;;"3268975726";https://twitter.com/TubScrubber/status/3268975726
Purpleanne;2009-08-12 17:24;0;0;"10 top homeopathic remedies for swine flu http://bit.ly/fHPHO";;;;"3268965487";https://twitter.com/Purpleanne/status/3268965487
AllentownChiro;2009-08-12 17:23;0;0;"Costa Rican President Conracts Swine Flu : Health, Fitness, Wellness, Diabetes, Cancer, Exercise by Vitabeat. H.. http://bit.ly/1Xh9LQ";;;;"3268958734";https://twitter.com/AllentownChiro/status/3268958734
medically;2009-08-12 17:23;0;0;"Do You Know ? Swine Flu Update: Tamiflu, Mumbai Schools & Flying Rabbis http://medical-ebook.com/?p=32927 By : Dr Ranjkar";;;;"3268957788";https://twitter.com/medically/status/3268957788
hindustan_times;2009-08-12 17:23;0;0;"Swine flu claims 6 in Malaysia; death toll reaches 44 http://bit.ly/eVtlF";;;;"3268955955";https://twitter.com/hindustan_times/status/3268955955
SwineFluNewsORG;2009-08-12 17:23;0;0;"Vanderbilt starts trials of swine flu vaccine http://tinyurl.com/n6bahq #swineflu #h1n1";;;#swineflu #h1n1;"3268951303";https://twitter.com/SwineFluNewsORG/status/3268951303
Coistycat;2009-08-12 17:22;0;0;"To top everything off my mum is recovering from swine flu & my dad now has it & i'm staying with them until i can get the stairs at mine";;;;"3268944030";https://twitter.com/Coistycat/status/3268944030
AtlasCT;2009-08-12 17:22;0;0;"This 'September Epidemic' is Swine Flu free: "Believe it or not, asthma is the number one chronic d.. http://bit.ly/4tNHjn";;;;"3268943266";https://twitter.com/AtlasCT/status/3268943266
healthwarehouse;2009-08-12 17:22;0;0;"http://hwhwh.com Swine Flu Update: Tamiflu, Mumbai Schools & Flying Rabbis http://bit.ly/uoJYt";;;;"3268934952";https://twitter.com/healthwarehouse/status/3268934952
VF4rcy;2009-08-12 17:22;0;1;"#swineflu http://bit.ly/9m251 etat de lieux";;;#swineflu;"3268929847";https://twitter.com/VF4rcy/status/3268929847
indiaupdates;2009-08-12 17:21;0;0;"'Kaminey' releasing worldwide, barring in swine flu hit Mumbai: MUMBAI - Mumbai will have to wait. With .. http://bit.ly/3V96AX";;;;"3268924266";https://twitter.com/indiaupdates/status/3268924266
SwineFluNewsIE;2009-08-12 17:21;0;0;"Irelanda s initial swine flu plant is burried http://tinyurl.com/knjd8a #swineflu #h1n1";;;#swineflu #h1n1;"3268923056";https://twitter.com/SwineFluNewsIE/status/3268923056
swinefluh1n1;2009-08-12 17:21;0;0;""Chinese mainland reports first "critical condition" case of A/H1N1 flu" http://tinyurl.com/lsnemh #swineflu #H1N1";;;#swineflu #H1N1;"3268915971";https://twitter.com/swinefluh1n1/status/3268915971
SwineFluNewsSG;2009-08-12 17:21;0;0;"Bengal gears up to plunge into Swine Flu http://tinyurl.com/mnkkw8 #swineflu #h1n1";;;#swineflu #h1n1;"3268909621";https://twitter.com/SwineFluNewsSG/status/3268909621
knoxvillehosp;2009-08-12 17:20;0;0;"Swine Flu Update: Tamiflu, Mumbai Schools & Flying Rabbis: As the pandemic continues, a new analysis looks at th.. http://bit.ly/YSWNU";;;;"3268895410";https://twitter.com/knoxvillehosp/status/3268895410
SwineFluNow;2009-08-12 17:20;0;0;"by @newscientist : Exclusive swine flu poll: How experts are preparing their families for the second wave http://bit.ly/y8vQJ";;@newscientist;;"3268892312";https://twitter.com/SwineFluNow/status/3268892312
SwineFluH1N1_;2009-08-12 17:19;0;0;"The swine flu - H1N1 is a potentially deadly virus. Be prepared: http://bit.ly/MARdR";;;;"3268891221";https://twitter.com/SwineFluH1N1_/status/3268891221
jshinde199;2009-08-12 17:19;0;0;"swine flu hits mumbai..n rest of india it suxx :(";;;;"3268888144";https://twitter.com/jshinde199/status/3268888144
onicarpeso;2009-08-12 17:18;0;0;"Swine flu : How experts are preparing their families: An exclusive New Scientist survey revea.. http://bit.ly/ojmCT [via New Scientist]";;;;"3268872559";https://twitter.com/onicarpeso/status/3268872559
GuamPDN;2009-08-12 17:18;0;0;"Swine flu tally now 139: The prevalence of swine flu continues to multiply on island, as Guam public health offi.. http://bit.ly/D0JM8";;;;"3268861569";https://twitter.com/GuamPDN/status/3268861569
ChirpLouder;2009-08-12 17:17;0;0;"Brazil swine flu deaths at 192 - third highest total after U.S. and Argentina. (Mexico is now 4th.) http://bit.ly/1yJEC8 #swineflu #h1n1";;;#swineflu #h1n1;"3268854281";https://twitter.com/ChirpLouder/status/3268854281
Cococ83;2009-08-12 17:17;0;0;"Learn How to Survive from the Swine Flu http://tinyurl.com/m3zq3e";;;;"3268849007";https://twitter.com/Cococ83/status/3268849007
HealthWebBlog;2009-08-12 17:17;0;0;"Comment on With the swine flu outbreak, would you still go on this vacation? by Peter C: i found this realy good.. http://bit.ly/13z1r0";;;;"3268845841";https://twitter.com/HealthWebBlog/status/3268845841
HealthWebBlog;2009-08-12 17:17;0;0;"Comment on What can I do to prevent getting sick because of the swine flu ? by Mussab: search in google they say .. http://bit.ly/16y8wh";;;;"3268845010";https://twitter.com/HealthWebBlog/status/3268845010
swineflu2;2009-08-12 17:17;0;0;"#swineflu Swine Flu Update: Tamiflu, Mumbai Schools & Flying Rabbis - Wall Street Journal Blogs: AB.. http://bit.ly/UP0mk";;;#swineflu;"3268844617";https://twitter.com/swineflu2/status/3268844617
RedSneakerDiary;2009-08-12 17:17;0;0;"well, I still feel sick. And its the flu. And a coworker had the swine flu 2 weeks ago. I doubt I caught it from him, but concern is up.";;;;"3268837717";https://twitter.com/RedSneakerDiary/status/3268837717
SWINE_FLU_VRUS;2009-08-12 17:16;0;0;"South African official fears Africa could bear brunt of swine flu (source: Earth Times) http://bit.ly/CxiTO";;;;"3268823688";https://twitter.com/SWINE_FLU_VRUS/status/3268823688
LivingSafely;2009-08-12 17:16;0;0;"UK/Leicester: 48-year-old mom becomes second to die from Meningitis misdiagnosed by non-doctor as #Swine #Flu . Oh, there are other diseases?";;;#Swine #Flu;"3268822877";https://twitter.com/LivingSafely/status/3268822877
SLotH13;2009-08-12 17:15;0;0;"So, in latest Mumbai is shut down for 3 days cuz of the swine flu heebeejeebees.. enjoy guys";;;;"3268814066";https://twitter.com/SLotH13/status/3268814066
SwineFlu_news;2009-08-12 17:15;0;0;"Don't ‘play politics' on flu plan, Health Minister tells opposition http://t.love.com/240960032";;;;"3268802878";https://twitter.com/SwineFlu_news/status/3268802878
Tendaijoe;2009-08-12 17:15;0;0;"Seems like Swine Flu will affect Africa more than anywhere else. #poverty added on that!~!";;;#poverty;"3268800992";https://twitter.com/Tendaijoe/status/3268800992
shanteshca;2009-08-12 17:15;0;0;"Suddenly, Mumbai is covered with masked faces. Is a thin layer of cloth, protection against SwineFlu ?";;;;"3268800551";https://twitter.com/shanteshca/status/3268800551
vineethjose;2009-08-12 17:14;0;0;"GOV portal on swineflu http://www.mohfw.nic.in/SWINEFLU.htm";;;;"3268796470";https://twitter.com/vineethjose/status/3268796470
TejasaKhambete;2009-08-12 17:14;0;0;"Swine Flu ..why is everyone so frikkin scared...everyone on the street looks as if they r going to rob a bank....or r off to surgery or s ...";;;;"3268796390";https://twitter.com/TejasaKhambete/status/3268796390
SWINE_FLU_VRUS;2009-08-12 17:14;0;0;"V For Vendetta Mask Lot Of 10 (Toy) newly tagged ''politics'' (source: Amazon) http://bit.ly/rZqYZ";;;;"3268788387";https://twitter.com/SWINE_FLU_VRUS/status/3268788387
guamnews_pdn;2009-08-12 17:14;0;0;"[Top Stories] Swine flu tally now 139: The prevalence of swine flu continues to multiply on island,.. http://bit.ly/D0JM8";;;;"3268785370";https://twitter.com/guamnews_pdn/status/3268785370
SwineInfluenza;2009-08-12 17:14;0;0;"Africa could be worst hit by swine flu : South African minister (New Kerala): Johannesburg, Aug 12 : South Africa.. http://bit.ly/4AKwAe";;;;"3268781535";https://twitter.com/SwineInfluenza/status/3268781535
A_Healthy_bliss;2009-08-12 17:13;0;0;"Cure swineflu by detoxing your body now - find out more http://yeahtips.com/body-detox-videos/";;;;"3268779346";https://twitter.com/A_Healthy_bliss/status/3268779346
AtlasCT;2009-08-12 17:13;0;0;"How can you tell the difference btwn allergies and swine flu ... http://bit.ly/uNFUj";;;;"3268779192";https://twitter.com/AtlasCT/status/3268779192
SWINE_FLU_VRUS;2009-08-12 17:13;0;0;"Mother, 48, dies of meningitis after swine flu diagnosis http://bit.ly/OJflA";;;;"3268779106";https://twitter.com/SWINE_FLU_VRUS/status/3268779106
SwineInfluenza;2009-08-12 17:13;0;0;"Six more die of swine flu , India toll climbs to 17 (Calcutta News): Pune/Mumbai/India's swine flu toll rose to 1.. http://bit.ly/1akw1u";;;;"3268778730";https://twitter.com/SwineInfluenza/status/3268778730
Jono;2009-08-12 17:13;0;0;"Plans to watch socceroos game with a mate aborted due to suspected swine flu (Him, not me). Carn straya.";;;;"3268773836";https://twitter.com/Jono/status/3268773836
mignews;2009-08-12 17:13;0;0;"Malaysian badminton coach tests negative for swine flu (Lead): Hyderabad, Aug 12 (IANS) The Malaysian badminton .. http://bit.ly/IHjPm";;;;"3268763565";https://twitter.com/mignews/status/3268763565
healthy_news;2009-08-12 17:12;0;0;"Swine Flu Update: Tamiflu, Mumbai Schools & Flying Rabbis: As the pandemic continues, a new analysis looks at th.. http://bit.ly/YSWNU";;;;"3268757070";https://twitter.com/healthy_news/status/3268757070
thaindian;2009-08-12 17:12;0;0;"Malaysian badminton coach tests negative for swine flu (Lead) - http://n.thaindian.com/231616 #Sports";;;#Sports;"3268756360";https://twitter.com/thaindian/status/3268756360
news4u2;2009-08-12 17:12;0;0;"Anthem Blue Cross to cover swine flu shot: Anthem Blue Cross and Blue Shield in Missouri said Wednesday that it .. http://bit.ly/10BlCe";;;;"3268750444";https://twitter.com/news4u2/status/3268750444
swinefluh1n1;2009-08-12 17:12;0;0;"" Swine Flu Update: Tamiflu, Mumbai Schools ' Flying Rabbis" http://tinyurl.com/kwoh2u #swineflu #H1N1";;;#swineflu #H1N1;"3268747798";https://twitter.com/swinefluh1n1/status/3268747798
BeWellBoston;2009-08-12 17:12;0;0;"Costa Rican president has swine flu - http://is.gd/2dMe4";;;;"3268747493";https://twitter.com/BeWellBoston/status/3268747493
SwineFluNewsEU;2009-08-12 17:11;0;0;"Holidays a swine flu circuit breaker http://tinyurl.com/lhgjg4 #swineflu #h1n1";;;#swineflu #h1n1;"3268746173";https://twitter.com/SwineFluNewsEU/status/3268746173
CrisisWatch;2009-08-12 17:11;0;0;"*Pandemic Info News* India: Schools in Mumbai closed amid swine flu panic http://bit.ly/4gGba";;;;"3268745509";https://twitter.com/CrisisWatch/status/3268745509
locomunkey;2009-08-12 17:11;0;0;"Swine Flu outbreaks got a bit more severe. And I drank grape juice from a cool bar near to a hospital. Now I'm worried... DaMN!!";;;;"3268740513";https://twitter.com/locomunkey/status/3268740513
longdrivesouth;2009-08-12 17:11;0;0;"Almost 200 dead of swine flu in Brazil: http://bit.ly/8NoA4";;;;"3268734023";https://twitter.com/longdrivesouth/status/3268734023
swinefluh1n1;2009-08-12 17:10;0;0;""How can you tell the difference btwn allergies and swine flu ..." http://tinyurl.com/kk6efz #swineflu #H1N1";;;#swineflu #H1N1;"3268727723";https://twitter.com/swinefluh1n1/status/3268727723
swineflu_news_;2009-08-12 17:10;0;0;"Morning colonoscopy may catch more polyps: NEW YORK (Reuters Health) - People who undergo screening colonoscopy .. http://bit.ly/19utLL";;;;"3268727640";https://twitter.com/swineflu_news_/status/3268727640
novelh1n1;2009-08-12 17:10;0;0;"http://novelh1n1.com Swine flu outbreak in remotest Amazon raises fears of devastating ... -.. http://bit.ly/8tIsS";;;;"3268723723";https://twitter.com/novelh1n1/status/3268723723
novelh1n1;2009-08-12 17:10;0;0;"http://novelh1n1.com Area school districts gear up for Fall season...and swine flu - WKTV: A.. http://bit.ly/3Z2Nxg";;;;"3268723157";https://twitter.com/novelh1n1/status/3268723157
newsrunner_com;2009-08-12 17:10;0;0;"Four more test positive for swine flu in Gujarat - Hindustan Times - India http://bit.ly/bn19h";;;;"3268717486";https://twitter.com/newsrunner_com/status/3268717486
Bob_Beaulaurier;2009-08-12 17:10;0;0;"Swine flu no longer seems like a hamdemic. I apologize for my earlier comment.";;;;"3268717084";https://twitter.com/Bob_Beaulaurier/status/3268717084
pembdave;2009-08-12 17:10;0;0;"RT @Hyper8 : @PembsDave Swine flu remedies...http://bit.ly/6S22c < *speechless";;@Hyper8 @PembsDave;;"3268715098";https://twitter.com/pembdave/status/3268715098
dennisRay;2009-08-12 17:10;0;0;"New blog post: Swine Flu Update: Tamiflu, Mumbai Schools & Flying Rabbis - Wall Street Journal Blogs http://bit.ly/4pq0AX";;;;"3268715065";https://twitter.com/dennisRay/status/3268715065
acidnews;2009-08-12 17:10;0;0;"Schools prepare for swine flu - Southeast Sun http://bit.ly/ittdU";;;;"3268712715";https://twitter.com/acidnews/status/3268712715
acidnews;2009-08-12 17:10;0;0;"Mumbai closes schools and colleges for a week due to swine flu - Radio Australia News http://bit.ly/2N6K9";;;;"3268712162";https://twitter.com/acidnews/status/3268712162
businesslister;2009-08-12 17:09;0;0;"TRADE: Swine Flu hits Box Office collections: ... bollyscoops Bollywood Make Money From Home: We list resources .. http://bit.ly/3Jcxvy";;;;"3268697158";https://twitter.com/businesslister/status/3268697158
peskyme;2009-08-12 17:08;0;0;"RT @HeadlinesIndia : Six more die of swine flu , India toll climbs to 17 http://uurl.in/FHoBo";;@HeadlinesIndia;;"3268691553";https://twitter.com/peskyme/status/3268691553
ericmates;2009-08-12 17:07;0;0;"Costa Rican President, 1st to get swine flu : http://bit.ly/17UMKE";;;;"3268675895";https://twitter.com/ericmates/status/3268675895
indianstocks;2009-08-12 17:07;0;0;"Swine flu impact: Multiplexes\’ occupancy may dip to 2025%: Mumbai has ordered all multiplexes to be close.. http://bit.ly/1RcD5I";;;;"3268664329";https://twitter.com/indianstocks/status/3268664329
gtoppo;2009-08-12 17:07;0;0;"RT @newscientist : Exclusive swine flu poll: How experts are preparing their families for the second wave http://bit.ly/y8vQJ";;@newscientist;;"3268662615";https://twitter.com/gtoppo/status/3268662615
_ritesh;2009-08-12 17:06;0;0;"What the hell is going on ? A sudden increase in Swine Flu deaths in India - http://bit.ly/1632iU , Why ?";;;;"3268657613";https://twitter.com/_ritesh/status/3268657613
TeamTelax;2009-08-12 17:06;0;0;"Swine flu quarantine: Coming this fall to an office near you! http://snurl.com/pqq4i";;;;"3268657521";https://twitter.com/TeamTelax/status/3268657521
biotechRSS;2009-08-12 17:06;0;0;"WSJ Health: Swine Flu Update: Tamiflu, Mumbai Schools & Flying Rabbis: As the pandemic continues, a n.. http://bit.ly/lqBgj";;;;"3268645418";https://twitter.com/biotechRSS/status/3268645418
inbollywood;2009-08-12 17:06;0;0;"Kaminey not to release in Mumbai due to swine-flu scare - Sify: Kaminey not to release in Mumbai due to swine-fl.. http://bit.ly/P2VvL";;;;"3268643869";https://twitter.com/inbollywood/status/3268643869
Context_Group;2009-08-12 17:05;0;0;"Same day NASA says can’t get enough young scientists to study the planet, religious leaders blow horns to scare swine flu . Wither science?";;;;"3268638528";https://twitter.com/Context_Group/status/3268638528
MMaryMcKenna;2009-08-12 17:05;0;0;"Wondering if the whole of Pool Heights is goin to fall to swine flu - missing u already @ben_jones_derry & Happy Birthday man - sorry ur ill";;@ben_jones_derry;;"3268635553";https://twitter.com/MMaryMcKenna/status/3268635553
minorkunju;2009-08-12 17:05;0;0;"Why Swine Flu will not affect a s/w proj mgrs ? - It is not that easy for that virus to enter another PIG's body";;;;"3268631613";https://twitter.com/minorkunju/status/3268631613
SwineFluNewsNZ;2009-08-12 17:05;0;0;"Swine flu fee hits 1,462, infections delayed in south http://tinyurl.com/lypf5q #swineflu #h1n1";;;#swineflu #h1n1;"3268631596";https://twitter.com/SwineFluNewsNZ/status/3268631596
SwineFluNewsUSA;2009-08-12 17:05;0;0;"N.H., Maine efforts to quell swine flu upon right track http://tinyurl.com/mhpdpn #swineflu #h1n1";;;#swineflu #h1n1;"3268630768";https://twitter.com/SwineFluNewsUSA/status/3268630768
SwineFluNewsIE;2009-08-12 17:05;0;0;"Swine Flu United Kingdom News http://tinyurl.com/r9mu39 #swineflu #h1n1";;;#swineflu #h1n1;"3268630134";https://twitter.com/SwineFluNewsIE/status/3268630134
SiddharthaYadav;2009-08-12 17:04;0;0;"RAMDEV says he has a HERBAL/AYURVEDIC Medicine for SWINE FLU . My question:Can his herbs diagnose it in the first place b4 treating the pts?";;;;"3268611537";https://twitter.com/SiddharthaYadav/status/3268611537
SWINE_FLU_VRUS;2009-08-12 17:04;0;0;"Costa Rican President Struck With Swine Flu | ChattahBox News Blog http://bit.ly/1z6Z7T";;;;"3268608596";https://twitter.com/SWINE_FLU_VRUS/status/3268608596
marciawerts;2009-08-12 17:03;0;0;"Reporter Fred Mann is looking for Wichita-area parents to talk to about swine flu and school. Contact info here: http://bit.ly/19sm5r";;;;"3268605844";https://twitter.com/marciawerts/status/3268605844
wearamask;2009-08-12 17:03;0;0;"8 people die of swine flu , everyone wears a mask ! thousands die of aids but nobody wants to wear a condom ! http://bit.ly/ibScB";;;;"3268596914";https://twitter.com/wearamask/status/3268596914
breakingnewsie;2009-08-12 17:03;0;0;"WORLD: Mumbai shutdown planned to fight swine flu : All schools and colleges in India’s financial capital w.. http://short.ie/fdtti6";;;;"3268594650";https://twitter.com/breakingnewsie/status/3268594650
inbollywood;2009-08-12 17:03;0;0;"Swine flu deaths halt Bollywood releases - AFP: bollywoodhungamaSwine flu deaths halt Bollywood releasesAFPMUMBA.. http://bit.ly/CUnDG";;;;"3268589131";https://twitter.com/inbollywood/status/3268589131
TampaBayNews;2009-08-12 17:02;0;0;"State officials: Swine flu vaccine for schoolkids coming in October http://bit.ly/Sjp89";;;;"3268584170";https://twitter.com/TampaBayNews/status/3268584170
SociaTropin;2009-08-12 17:02;0;0;"Swine Flu Update: Tamiflu, Mumbai Schools & Flying Rabbis http://bit.ly/DkTSk";;;;"3268578092";https://twitter.com/SociaTropin/status/3268578092
ChirpLouder;2009-08-12 17:02;0;0;"Expect pandemic-related lawsuits. Ex: Family of NYC asst school principal - swine flu fatality - suing the city. http://bit.ly/SRHpG";;;;"3268577888";https://twitter.com/ChirpLouder/status/3268577888
newscientist;2009-08-12 17:02;0;6;"Exclusive swine flu poll: How experts are preparing their families for the second wave http://bit.ly/y8vQJ";;;;"3268575143";https://twitter.com/newscientist/status/3268575143
El_Chaco_Veloz;2009-08-12 17:01;0;0;"RT @roadmr : Last 2 times I remember Mexico being a trending topic: swine flu and soccer match. Poor country.";;@roadmr;;"3268569260";https://twitter.com/El_Chaco_Veloz/status/3268569260
pinlfloy;2009-08-12 17:01;0;0;"swine flu rapidly distressing normal life in important cities ie Mumbai,Pune,Banglore,Delhi,Amritsar,Hyderabad and other small cities.";;;;"3268566711";https://twitter.com/pinlfloy/status/3268566711
SwineFluNewsHK;2009-08-12 17:01;0;0;"Swine flu might strike 1 crore in December http://tinyurl.com/n7hr9a #swineflu #h1n1";;;#swineflu #h1n1;"3268558632";https://twitter.com/SwineFluNewsHK/status/3268558632
DailyMeHealth;2009-08-12 17:01;0;0;"Costa Rican president has swine flu http://bit.ly/w71fQ #health #wellness";;;#health #wellness;"3268556299";https://twitter.com/DailyMeHealth/status/3268556299
_DDMcGee;2009-08-12 17:01;0;0;"lk SERi0USLY u believe him whn he said he caught the swine flu & thats the reason he didnt call u 4 2wks. but he can update his status???";;;;"3268551634";https://twitter.com/_DDMcGee/status/3268551634
