username;date;retweets;favorites;text;geo;mentions;hashtags;id;permalink
totzik;2009-11-20 19:40;0;0;"WHO investigating Norway swine flu mutations (AP) : AP - The World Health Organization said Friday it is inve.. http://tinyurl.com/yb85bv9";;;;"5898325137";https://twitter.com/totzik/status/5898325137
karekc;2009-11-20 19:40;1;0;"RT @JennyfromMTV Do u think Kermit frog has higher chance of catching swine flu cuz he's doing a pig or do you think his immunity built up?";;@JennyfromMTV;;"5898323852";https://twitter.com/karekc/status/5898323852
foxnews_pol;2009-11-20 19:40;0;0;"FOX NEWS POLITICS: Fox News Poll: Worries About Safety of Swine Flu Vaccine Persist: Nearly equal numbers of Americ... http://bit.ly/7juNFs";;;;"5898322075";https://twitter.com/foxnews_pol/status/5898322075
newsfeeding;2009-11-20 19:40;0;0;"Fox News Poll: Worries About Safety of Swine Flu Vaccine Persist: Nearly equal numbers of Americans are more afra... http://twurl.nl/n2hud8";;;;"5898321900";https://twitter.com/newsfeeding/status/5898321900
JonKeel;2009-11-20 19:40;0;0;"Swine flu update: Illinois reports 9 new deaths: AP The Illinois Department of Public Health's weekly updat.. h.. http://tinyurl.com/yg6y2d5";;;;"5898317853";https://twitter.com/JonKeel/status/5898317853
twnstar2;2009-11-20 19:40;0;0;"RT @KNX1070 : Health officials say 4 ppl in NC have tested positive 4 a type of swine flu that's resistant 2 the drug Tamiflu.";;@KNX1070;;"5898317471";https://twitter.com/twnstar2/status/5898317471
sccnewswire;2009-11-20 19:40;0;0;"WHO Investigating Norway Swine Flu Mutations: The World Health Organization says it is investigating samples of.. http://bit.ly/2IEmCf";;;;"5898316849";https://twitter.com/sccnewswire/status/5898316849
Beautyon_;2009-11-20 19:40;0;0;"RT @infowarsstories Aspirin kills 400% more people than H1N1 swine flu : Mike Adams | You are ten times more likely to http://bit.ly/17CIu9";;@infowarsstories;;"5898315780";https://twitter.com/Beautyon_/status/5898315780
JonKeel;2009-11-20 19:40;0;0;"Swine flu update: Illinois reports 9 new deaths http://tinyurl.com/yktvb97: Swine flu update: Illinois reports .. http://tinyurl.com/ygwzdq2";;;;"5898315470";https://twitter.com/JonKeel/status/5898315470
DrPheelep;2009-11-20 19:40;0;0;"Tamiflu-resistant swine flu cluster reported in NC (AP) : AP - Health officials say four people in North Caro.. http://tinyurl.com/ygpakqa";;;;"5898313350";https://twitter.com/DrPheelep/status/5898313350
4Encouragers;2009-11-20 19:40;0;0;"#Swineflu UK investigates spread of drug resistant swine flu : LONDON, Nov 20 (Reuters) - British healt.. http://bit.ly/6SGEVT";;;#Swineflu;"5898310448";https://twitter.com/4Encouragers/status/5898310448
KOLO8;2009-11-20 19:39;0;0;"No more wristbands for Saturday's swine flu vaccination clinic at the Washoe County Health District";;;;"5898303455";https://twitter.com/KOLO8/status/5898303455
Emiilyy94;2009-11-20 19:39;0;0;"got the swine flu vaccine this morning at school & my arm is sore! I'm also extremely tired because I came home at 2:45am from new moon <3";;;;"5898303102";https://twitter.com/Emiilyy94/status/5898303102
RonPaulNews;2009-11-20 19:39;0;0;"C4L News: Fox News Poll: Worries About Safety of Swine Flu Vaccine Persist http://tinyurl.com/yc5f5kz";;;;"5898292597";https://twitter.com/RonPaulNews/status/5898292597
latimesmuskal;2009-11-20 19:39;0;0;"About 52 Tamiflu-resistant cases have been reported in the world since April, including 15 in the U.S.#H1N1 #swine #flu .";;;#H1N1 #swine #flu;"5898290582";https://twitter.com/latimesmuskal/status/5898290582
lipkaw;2009-11-20 19:39;0;0;"WHO investigating Norway swine flu mutations (AP) : AP - The World Health Organization said Friday it is inve.. http://bit.ly/41Ugrd";;;;"5898289393";https://twitter.com/lipkaw/status/5898289393
Reuters_Health;2009-11-20 19:39;0;1;"Swine flu may be peaking in U.S., reports indicate http://link.reuters.com/xaz72g";;;;"5898285494";https://twitter.com/Reuters_Health/status/5898285494
GarCasey;2009-11-20 19:39;0;0;"RT @HARRISFAULKNER : Breaking: Health off'ls- 4 ppl in North Carolina test positive type of swine flu resistant to drug Tamiflu.";;@HARRISFAULKNER;;"5898284305";https://twitter.com/GarCasey/status/5898284305
MyDigitalStore;2009-11-20 19:38;0;0;"How Swine Flu and ebooks Changed Medical Publishing http://bit.ly/4rEgUK";;;;"5898283745";https://twitter.com/MyDigitalStore/status/5898283745
HCR_Now;2009-11-20 19:38;0;0;"Swine flu update: Illinois reports 9 new deaths: AP The Illinois Department of Public Health's weekly updat.. http://tinyurl.com/yktvb97";;;;"5898282816";https://twitter.com/HCR_Now/status/5898282816
science_watch;2009-11-20 19:38;0;0;"PNL: Did U.S. make a swine flu mistake?: WASHINGTON - As U.S. health officials struggle to vaccinate tens of millio... http://bit.ly/6p9gKE";;;;"5898282463";https://twitter.com/science_watch/status/5898282463
God_Ops;2009-11-20 19:38;0;0;"Fox News Poll: Worries About Safety of Swine Flu Vaccine Persist: Nearly equal numbers of Americans ar.. http://bit.ly/1BOXvh #america";;;#america;"5898280405";https://twitter.com/God_Ops/status/5898280405
whatifcode;2009-11-20 19:38;0;0;"Swine Flu Clinic To Add To Traffic, Parking Today, Tomorrow: If you don't have Internet access, you can cal.. http://bit.ly/52zYJr";;;;"5898275660";https://twitter.com/whatifcode/status/5898275660
yourplaceorvine;2009-11-20 19:38;0;0;"Red wine prevents Swine Flu ?! Skip the Tamiflu, where's... http://www.facebook.com/permalink.php?story_fbid=180234253858&id=51464107077";;;;"5898274073";https://twitter.com/yourplaceorvine/status/5898274073
JulieRasmussen;2009-11-20 19:38;1;0;"First we had mad cow disease, then we had bird flu, now we have swine flu .... O.M.F.G it's FARMAGGEDON";;;;"5898270497";https://twitter.com/JulieRasmussen/status/5898270497
keithramsey;2009-11-20 19:37;0;0;"Is Tamiflu-resistant swine flu a result of the indiscriminate prescription of Tamiflu in the early stages of the epidemic?";;;;"5898258116";https://twitter.com/keithramsey/status/5898258116
restinp3ace;2009-11-20 19:37;0;0;"Health | Tamiflu-resistant swine flu cluster reported in NC (AP) : AP - Health offi.. http://bit.ly/5TxKiT | Read More Here!";;;;"5898253943";https://twitter.com/restinp3ace/status/5898253943
ABC5FOX9;2009-11-20 19:37;0;0;"Health: H1N1 Vaccine Program Plagued With Proble - When the nation's swine flu vaccination program began in early O... http://ow.ly/163ce2";;;;"5898244890";https://twitter.com/ABC5FOX9/status/5898244890
SwineFluDoctors;2009-11-20 19:37;0;0;"#SwineFlu Oregon Cat Dies From Swine Flu Complications - PETMD http://ow.ly/163cdC";;;#SwineFlu;"5898239292";https://twitter.com/SwineFluDoctors/status/5898239292
european_footie;2009-11-20 19:37;0;0;"BBC: Barcelona duo contract swine flu : Barcelona players Yaya Toure and Eric Abidal are put in isolation af.. http://bit.ly/1hVXGd";;;;"5898238172";https://twitter.com/european_footie/status/5898238172
SwineFluDoctors;2009-11-20 19:37;0;0;"#SwineFlu WHO investigating Norway swine flu mutations - The Associated Press http://ow.ly/163cdx";;;#SwineFlu;"5898238159";https://twitter.com/SwineFluDoctors/status/5898238159
SwineFluMedNews;2009-11-20 19:37;0;0;"#SwineFlu WHO investigating Norway swine flu mutations - The Associated Press http://ow.ly/163cdu";;;#SwineFlu;"5898237350";https://twitter.com/SwineFluMedNews/status/5898237350
SwineFluMedNews;2009-11-20 19:36;0;0;"#SwineFlu Seasonal Flu Vaccine May Cut Swine Flu Risk - WebMD http://ow.ly/163cdp";;;#SwineFlu;"5898235550";https://twitter.com/SwineFluMedNews/status/5898235550
SwineFluDoctors;2009-11-20 19:36;0;0;"#SwineFlu UK investigates spread of drug resistant swine flu - Reuters http://ow.ly/163cdn";;;#SwineFlu;"5898235172";https://twitter.com/SwineFluDoctors/status/5898235172
thewellnessteam;2009-11-20 19:36;0;0;"Swine flu update: Illinois reports 9 new deaths: AP The Illinois Department of Public Health's weekly updat.. http://tinyurl.com/ykylla2";;;;"5898234879";https://twitter.com/thewellnessteam/status/5898234879
footballgossip;2009-11-20 19:36;0;0;"Football News: Barcelona duo contract swine flu : Barcelona players Yaya Toure and Eric Abidal are put in isolation ... http://bit.ly/2zJ2rA";;;;"5898232250";https://twitter.com/footballgossip/status/5898232250
bbcfoot;2009-11-20 19:36;1;0;"Barcelona duo contract swine flu http://bit.ly/2zJ2rA";;;;"5898232173";https://twitter.com/bbcfoot/status/5898232173
JonKeel;2009-11-20 19:36;0;0;"RT @listdeb : off to get my swine flu shot. Hope it is a good decision. Good one!: RT @listdeb : off to get my sw.. http://tinyurl.com/ykanrj8";;@listdeb @listdeb;;"5898232063";https://twitter.com/JonKeel/status/5898232063
TeaseMeSanDiego;2009-11-20 19:36;0;0;"Dirtiest woman of life just coughed on me @starbucks . Good thing I got that swine flu shot...";;@starbucks;;"5898227665";https://twitter.com/TeaseMeSanDiego/status/5898227665
DotMoms;2009-11-20 19:36;0;0;"CDC: H1N1 cases seem to be dropping in U.S.: Health officials say swine flu cases appear to declining throughout mo... http://bit.ly/16C0QP";;;;"5898227011";https://twitter.com/DotMoms/status/5898227011
MOBINGO;2009-11-20 19:36;0;0;"JUST IN -- Norwegian scientists say they have found a mutated virus of H1N1 swine flu ; does not appear to be spreading.";;;;"5898225798";https://twitter.com/MOBINGO/status/5898225798
MOBINGO;2009-11-20 19:36;0;0;"Norwegian scientists find mutated virus of H1N1 swine flu . Full story: http://news.bnonews.com/wxip";;;;"5898225111";https://twitter.com/MOBINGO/status/5898225111
krmritunjay;2009-11-20 19:36;0;0;"Link: Tamiflu-resistant swine flu strain spreads in UK « The End is Start! - As various health bodies are... http://tumblr.com/xmi45gxu7";;;;"5898220337";https://twitter.com/krmritunjay/status/5898220337
thewellnessteam;2009-11-20 19:36;0;0;"UK investigates spread of drug resistant swine flu : LONDON, Nov 20 (Reuters) - British health officials are inv.. http://bit.ly/ZDSDs";;;;"5898219921";https://twitter.com/thewellnessteam/status/5898219921
JonKeel;2009-11-20 19:36;0;0;"RT @HARRISFAULKNER : Breaking: Health off'ls- 4 ppl in North Carolina test positive type of swine flu resistant .. http://tinyurl.com/yjxgorl";;@HARRISFAULKNER;;"5898219356";https://twitter.com/JonKeel/status/5898219356
qivanahealth;2009-11-20 19:35;0;0;"Qivana - Tamiflu-resistant swine flu cluster reported in NC (AP) http://bit.ly/6j5ANr";;;;"5898208757";https://twitter.com/qivanahealth/status/5898208757
mraffertytv;2009-11-20 19:35;0;0;"Reporting on the nationwide decline in number of deaths from H1N1( Swine Flu ). Health Officials: Still widespread in 43 states.";;;;"5898208526";https://twitter.com/mraffertytv/status/5898208526
Carp305biz;2009-11-20 19:35;0;0;"Fox News Poll: Worries About Safety of Swine Flu Vaccine Persist: by Tami Buhr Nearly equal numbers of American.. http://bit.ly/EX2el";;;;"5898208489";https://twitter.com/Carp305biz/status/5898208489
PrisonPlanetTV;2009-11-20 19:35;0;0;"Aspirin kills 400% more people than H1N1 swine flu : Mike Adams | You are ten times more likely to die in a car acci... http://bit.ly/17CIu9";;;;"5898201900";https://twitter.com/PrisonPlanetTV/status/5898201900
web9media;2009-11-20 19:35;0;0;"Update:CDC: 4 people in NC test positive for Tamiflu-resistant swine flu , first such US cluster http://tinyurl.com/ydgw3jo";;;;"5898199448";https://twitter.com/web9media/status/5898199448
word_czar;2009-11-20 19:34;0;0;"ATTN: @RaganReporter (via @Reuters_FluNews ) Swine flu may be peaking in U.S., reports indicate http://link.reuters.com/paz72g";;@RaganReporter @Reuters_FluNews;;"5898186457";https://twitter.com/word_czar/status/5898186457
CrisisWatch;2009-11-20 19:34;0;0;"*Pandemic Info News* Wales: Tamiflu-resistant swine flu spreads 'between patients' http://bit.ly/59DzBQ";;;;"5898186151";https://twitter.com/CrisisWatch/status/5898186151
healthfulchoice;2009-11-20 19:34;0;0;"Swine flu update: Illinois reports 9 new deaths http://bit.ly/6H4X9q";;;;"5898181642";https://twitter.com/healthfulchoice/status/5898181642
News_SwineFlu;2009-11-20 19:34;0;0;"#swineflu Santa's Holiday Wish: the Swine Flu Shot - TIME http://tinyurl.com/ybnxubw";;;#swineflu;"5898177397";https://twitter.com/News_SwineFlu/status/5898177397
SalBarguil;2009-11-20 19:34;0;0;"Newfoundland to review role of swine flu in six deaths: Health officials want to determine if H1N1 was primary caus... http://bit.ly/7G3me8";;;;"5898175534";https://twitter.com/SalBarguil/status/5898175534
keithramsey;2009-11-20 19:34;0;0;"Oh joy, Tamiflu-resistant swine flu , and only ten miles from where I'm sitting at the moment. http://tinyurl.com/ylb8prf";;;;"5898175279";https://twitter.com/keithramsey/status/5898175279
NewsUpdatesRUs;2009-11-20 19:34;0;0;"WHO investigating Norway swine flu mutations (AP) : AP - The World Health Organization said Friday it is inve.. http://bit.ly/1VAyJf";;;;"5898174814";https://twitter.com/NewsUpdatesRUs/status/5898174814
News_SwineFlu;2009-11-20 19:34;0;0;"#swineflu Swine flu may be peaking in US, reports indicate - Reuters http://tinyurl.com/ygn8jgp";;;#swineflu;"5898172344";https://twitter.com/News_SwineFlu/status/5898172344
CrisisWatch;2009-11-20 19:34;0;0;"*EMM Disease Alerts* Drug-resistant swine flu spreads http://bit.ly/8PgNlu";;;;"5898169382";https://twitter.com/CrisisWatch/status/5898169382
HARRISFAULKNER;2009-11-20 19:34;2;0;"Breaking: Health off'ls- 4 ppl in North Carolina test positive type of swine flu resistant to drug Tamiflu.";;;;"5898164640";https://twitter.com/HARRISFAULKNER/status/5898164640
worldbooktrade;2009-11-20 19:33;0;0;"[BookNews] How Swine Flu and ebooks Changed Medical Publishing - mediabistro.com (blog) http://ow.ly/163c5s";;;;"5898162932";https://twitter.com/worldbooktrade/status/5898162932
News_SwineFlu;2009-11-20 19:33;0;0;"#swineflu scientists detect mutated form of swine flu - Washington Post http://tinyurl.com/yz6es72";;;#swineflu;"5898161832";https://twitter.com/News_SwineFlu/status/5898161832
tiffaneejohnson;2009-11-20 19:33;0;0;"CDC: Swine flu cases seem to be dropping in US (AP) - AP - Health officials say swine flu cases appear to be d... http://ow.ly/163c4z";;;;"5898153484";https://twitter.com/tiffaneejohnson/status/5898153484
robchristianson;2009-11-20 19:33;0;0;"Did you know Swine Flu was in the Bible? Yep - Jesus cast the demons into the pigs, and the swine FLU down the hill into the lake! ;)";;;;"5898151784";https://twitter.com/robchristianson/status/5898151784
breakingflunews;2009-11-20 19:33;0;0;"breakingflunews.com Swine flu may be peaking in US, reports indicate - Reuters: ReutersSwine.. http://tinyurl.com/ygn8jgp";;;;"5898150018";https://twitter.com/breakingflunews/status/5898150018
swineflu_news_;2009-11-20 19:33;0;0;"Swine flu may be peaking in U.S., reports indicate: WASHINGTON (Reuters) - The pandemic of swine flu may be hitting... http://bit.ly/4zHHRS";;;;"5898148564";https://twitter.com/swineflu_news_/status/5898148564
swineflu_news_;2009-11-20 19:33;0;0;"Harmful effects seen with repeated ketamine abuse: NEW YORK (Reuters Health) - Abuse of ketamine, a powerful anesth... http://bit.ly/4qtPBz";;;;"5898148048";https://twitter.com/swineflu_news_/status/5898148048
breakingflunews;2009-11-20 19:33;0;0;"breakingflunews.com scientists detect mutated form of swine flu - Washington Post: AFPscient.. http://tinyurl.com/yz6es72";;;;"5898147628";https://twitter.com/breakingflunews/status/5898147628
breakingflunews;2009-11-20 19:33;0;0;"breakingflunews.com CDC: Swine flu cases seem to be dropping in US - The Associated Press: W.. http://tinyurl.com/yfh9fjx";;;;"5898145714";https://twitter.com/breakingflunews/status/5898145714
ctffox;2009-11-20 19:33;0;0;"Seasonal flu vaccine may provide some cross immunity against #swineflu . http://ow.ly/E6Nw";;;#swineflu;"5898141722";https://twitter.com/ctffox/status/5898141722
rabin_galan;2009-11-20 19:33;0;0;"spreadin of swine flu in the poor country like Nepal is a dreadfull and can bring fatal result. be careful!!!!";;;;"5898141238";https://twitter.com/rabin_galan/status/5898141238
News_SwineFlu;2009-11-20 19:33;0;0;"#swineflu Oregon Cat Dies From Swine Flu Complications - PETMD http://bit.ly/2GIhT9";;;#swineflu;"5898139646";https://twitter.com/News_SwineFlu/status/5898139646
web9media;2009-11-20 19:32;0;0;"CDC: 4 people in NC test positive for Tamiflu-resistant swine flu , first such US cluster http://tinyurl.com/ydgw3jo";;;;"5898138421";https://twitter.com/web9media/status/5898138421
rwperkinsjr;2009-11-20 19:32;0;0;"H1N1 Swine Flu Protection From Seasonal Flu Vaccine http://ow.ly/E6Nx";;;;"5898134972";https://twitter.com/rwperkinsjr/status/5898134972
gotswineflu;2009-11-20 19:32;0;0;"Go to mrsimcard.com Deaths following swine flu immunization not linked to vaccine, the... http://ow.ly/163c2Y";;;;"5898134124";https://twitter.com/gotswineflu/status/5898134124
gotswineflu;2009-11-20 19:32;0;0;"Go to mrsimcard.com WHO investigating Norway swine flu mutations http://ow.ly/163c2W";;;;"5898133806";https://twitter.com/gotswineflu/status/5898133806
gotpurpledrank;2009-11-20 19:32;0;0;"RT @BreakingNews : Norwegian scientists find mutated virus of H1N1 swine flu . Full story: http://news.bnonews.com/wxip";;@BreakingNews;;"5898124462";https://twitter.com/gotpurpledrank/status/5898124462
Sport__News;2009-11-20 19:32;0;0;"Barcelona duo contract swine flu http://bit.ly/2zJ2rA";;;;"5898121231";https://twitter.com/Sport__News/status/5898121231
TWEET_HEALTHYES;2009-11-20 19:32;0;0;"Tamiflu-resistant swine flu spreads 'between patients': BBC News By Fergus Walsh Health officials say a.. http://bit.ly/2EKkgb";;;;"5898118970";https://twitter.com/TWEET_HEALTHYES/status/5898118970
rtsradio;2009-11-20 19:32;0;0;"CDC: Swine flu cases seem to be dropping in US - ATLANTA (AP) -- Health officials say swine flu cases appear to... http://ow.ly/163c1y";;;;"5898115529";https://twitter.com/rtsradio/status/5898115529
eyeonfda;2009-11-20 19:32;0;0;"RT @medpedia : Tamiflu-Resistant Swine Flu Hits UK: http://bit.ly/54Vm4I";;@medpedia;;"5898114993";https://twitter.com/eyeonfda/status/5898114993
beyondthesenedd;2009-11-20 19:31;0;0;"blog post on response to swine flu strain in Cardiff http://blog.jonathanmorganam.com/2009/11/20/new-swine-flu-response-first-class/";;;;"5898110379";https://twitter.com/beyondthesenedd/status/5898110379
felinelovers;2009-11-20 19:31;0;0;"Oregon Cat Dies From Swine Flu Complications: In both cases the flu was acquired from the cats' owners, and.. http://bit.ly/2Q66o2";;;;"5898104163";https://twitter.com/felinelovers/status/5898104163
swineflumania;2009-11-20 19:31;0;0;"PIG AIDS! #swineflu Santa's Holiday Wish: the Swine Flu Shot - TIME: Tampabay.comSanta's.. http://tinyurl.com/ybnxubw";;;#swineflu;"5898102319";https://twitter.com/swineflumania/status/5898102319
kenakatweet;2009-11-20 19:31;0;0;"How Swine Flu and ebooks Changed Medical Publishing http://bit.ly/6Ri5lo";;;;"5898098497";https://twitter.com/kenakatweet/status/5898098497
jttraffic;2009-11-20 19:31;0;0;"Swine Flu Clinic To Add To Traffic, Parking Today, Tomorrow: If you don't have Internet access, you can cal.. http://bit.ly/52zYJr";;;;"5898090733";https://twitter.com/jttraffic/status/5898090733
medpedia;2009-11-20 19:30;0;0;"Tamiflu-Resistant Swine Flu Hits UK: http://bit.ly/54Vm4I";;;;"5898086612";https://twitter.com/medpedia/status/5898086612
RTme_sport;2009-11-20 19:30;0;0;"RT: Barcelona duo contract swine flu : Barcelona players Yaya Toure and Eric Abidal are put in isolation afte.. http://bit.ly/1hVXGd";;;;"5898085425";https://twitter.com/RTme_sport/status/5898085425
wfleurant;2009-11-20 19:30;0;0;"Swine flu update: Illinois reports 9 new deaths - Chicago Sun-Times - http://tinyurl.com/yzl4rar";;;;"5898077334";https://twitter.com/wfleurant/status/5898077334
swineflumania;2009-11-20 19:30;0;0;"PIG AIDS! #swineflu Swine flu may be peaking in US, reports indicate - Reuters: Natural News.. http://tinyurl.com/ygn8jgp";;;#swineflu;"5898076205";https://twitter.com/swineflumania/status/5898076205
earthquakesfeed;2009-11-20 19:30;0;0;"Top Stories: Fox News Poll: Worries About Safety of Swine Flu Vaccine Persist - FOXNews: CBC.caFox .. http://tinyurl.com/ygehmjj";;;;"5898074149";https://twitter.com/earthquakesfeed/status/5898074149
diamondsecretLF;2009-11-20 19:30;0;0;"Swine flu toll climbs by around 500: WHO (AFP): AFP - Around 6,750 people have died from the swine flu pandemic.. http://tinyurl.com/ybgoxrt";;;;"5898073531";https://twitter.com/diamondsecretLF/status/5898073531
swineflumania;2009-11-20 19:30;0;0;"PIG AIDS! #swineflu scientists detect mutated form of swine flu - Washington Post: AFPscient.. http://tinyurl.com/yz6es72";;;#swineflu;"5898071503";https://twitter.com/swineflumania/status/5898071503
SwineFlu_news;2009-11-20 19:30;0;0;"Gripes About Swine Flu Vaccine Abound http://t.love.com/272919137";;;;"5898068586";https://twitter.com/SwineFlu_news/status/5898068586
weroxik;2009-11-20 19:29;0;0;"WHO investigating Norway swine flu mutations (AP) : AP - The World Health Organization said Friday it is inve.. http://tinyurl.com/yb85bv9";;;;"5898055444";https://twitter.com/weroxik/status/5898055444
restinp3ace;2009-11-20 19:29;0;0;"Top Stories | CDC: Swine flu cases seem to be dropping in US (AP) : AP - Healt.. http://bit.ly/5jDahC | Read More Here!";;;;"5898053451";https://twitter.com/restinp3ace/status/5898053451
LiveAustin;2009-11-20 19:29;0;0;"Is Swine Flu Ebbing?: Remember that hospital in Austin, Texas -- Dell's Medical Center -- that was using sp.. http://bit.ly/7Dyf78";;;;"5898051201";https://twitter.com/LiveAustin/status/5898051201
KNX1070;2009-11-20 19:29;1;0;"Health officials say four people in North Carolina have tested positive for a type of swine flu that's resistant to the drug Tamiflu.";;;;"5898046872";https://twitter.com/KNX1070/status/5898046872
JUNGLEtours;2009-11-20 19:28;0;0;"3 ET sorrows: 1) plagues/pestilence (disease/ swine flu ) 2) famine (floods/droughts/insects destroy food supplies) 3) death/sword-wars/nukes";;;;"5898039634";https://twitter.com/JUNGLEtours/status/5898039634
AllMN;2009-11-20 19:28;0;0;"Kare11: CDC: Swine flu cases seem to be dropping: Health officials say swine flu cases appear to declining througho... http://bit.ly/7Zhosz";;;;"5898035471";https://twitter.com/AllMN/status/5898035471
imsure;2009-11-20 19:28;1;0;"Norwegian scientists raise concerns about mutated form of swine flu ... http://bit.ly/6XYjc0 #tcot";;;#tcot;"5898031114";https://twitter.com/imsure/status/5898031114
Queena7139;2009-11-20 19:28;0;0;"How Swine Flu and ebooks Changed Medical Publishing: mediabistro.com (blog) By Jason Boog on Nov 20, 2009 01:23.. http://tinyurl.com/ydr53p2";;;;"5898028574";https://twitter.com/Queena7139/status/5898028574
howloweener;2009-11-20 19:28;0;0;"My family's story: surviving swine flu http://bit.ly/5y5Sgg";;;;"5898026364";https://twitter.com/howloweener/status/5898026364
restinp3ace;2009-11-20 19:28;0;0;"Top Stories | CDC: Swine flu cases seem to be dropping in US (AP) : AP - Healt.. http://bit.ly/5jDahC | Read More Here!";;;;"5898021401";https://twitter.com/restinp3ace/status/5898021401
SwineFluTicker;2009-11-20 19:28;0;0;"Norwegian scientists detect mutated form of swine flu : By Rob Stein Scientists in Norway announced Friday they .. http://bit.ly/90mPRd";;;;"5898019724";https://twitter.com/SwineFluTicker/status/5898019724
SwineFluTicker;2009-11-20 19:27;0;0;"Swine flu declined slightly last week, but watch out for Thanksgiving, CDC says: Pandemic H1N1 influenza activi.. http://bit.ly/4ydR4L";;;;"5898014674";https://twitter.com/SwineFluTicker/status/5898014674
pulsationsevent;2009-11-20 19:27;0;0;"Protect yourself from the Swine Flu with CWI Medical Infection Control Products. http://TwitPWR.com/wUW/";;;;"5898010057";https://twitter.com/pulsationsevent/status/5898010057
SaintXavier;2009-11-20 19:27;0;0;"SXU administers more than 1,100 free H1N1 ( Swine) Flu vaccinationsWatch video of SXU Health Center Director Monica... http://bit.ly/voYx7";;;;"5898009568";https://twitter.com/SaintXavier/status/5898009568
xdtalk;2009-11-20 19:27;0;0;"I'm really concerned about swine flu : I'm really concerned about swine flu . Here's my concern. 3 years ago,.. http://bit.ly/5GojBQ";;;;"5898009271";https://twitter.com/xdtalk/status/5898009271
SwineFluTicker;2009-11-20 19:27;0;0;"Swine flu update: Illinois reports 9 new deaths: AP The Illinois Department of Public Health's weekly updat.. http://bit.ly/7ggYHS";;;;"5898008370";https://twitter.com/SwineFluTicker/status/5898008370
ThinkAboutArt;2009-11-20 19:27;0;0;"We can choose not to get caught up in the fear mongering around swine flu . Decisions made in fear are often hasty and ill-considered.";;;;"5898002209";https://twitter.com/ThinkAboutArt/status/5898002209
milerdiler;2009-11-20 19:27;0;0;"If you and your kid are recovering from SWINE flu , stay home... I don't want to hear about how your coughs are not contagious.";;;;"5897994947";https://twitter.com/milerdiler/status/5897994947
OrganicLoudoun;2009-11-20 19:27;0;0;"Twitter Organic Loudoun Seasonal Flu Vaccine May C: Seasonal Flu Vaccine May Cut Swine Flu Risk: But it was 50%.. http://tinyurl.com/ygr3bxz";;;;"5897993993";https://twitter.com/OrganicLoudoun/status/5897993993
JakeGarvey;2009-11-20 19:26;0;0;"RT @WisNugs : A desire to watch sparkling vampires is one of the first signs of swine flu . #twilightfacts";;@WisNugs;#twilightfacts;"5897992864";https://twitter.com/JakeGarvey/status/5897992864
AndreLeMarchal;2009-11-20 19:26;0;0;"Barcelona duo contract swine flu : Barcelona players Yaya Toure and Eric Abidal are put in isolat.. http://tinyurl.com/ydodrs2 - BBC Football";;;;"5897987690";https://twitter.com/AndreLeMarchal/status/5897987690
sciencecohen;2009-11-20 19:25;0;0;"RT @DickKnox : Being cautious abt Wales/Norway #swineflu mutations. 5 Welsh pts immunocompromised, CDC sez Norway mutation n mild cases 2";;@DickKnox;#swineflu;"5897964971";https://twitter.com/sciencecohen/status/5897964971
