username;date;retweets;favorites;text;geo;mentions;hashtags;id;permalink
detroitnews;2009-11-20 17:17;0;0;"New Dr. Molly: Is Tamiflu for swine flu really good - or necessary - for everyone? http://bit.ly/HWhqW #H1N1 #flu";;;#H1N1 #flu;"5894792590";https://twitter.com/detroitnews/status/5894792590
fwpharma;2009-11-20 17:17;0;0;"Norwegian scientists raise concerns about mutated form of swine flu http://bit.ly/6iGk2z";;;;"5894792107";https://twitter.com/fwpharma/status/5894792107
trackswineflu;2009-11-20 17:17;0;0;"[News] Swine Flu Clinic To Add To Traffic, Parking Today, Tomorrow: If you're scheduled to receive a swine flu shot... http://bit.ly/28sd10";;;;"5894787754";https://twitter.com/trackswineflu/status/5894787754
BLOOMBARG;2009-11-20 17:17;0;0;"Swine Flu Mutation Discovered in Norway May Make Viral Disease More Severe : Nov. 20 (Bloomberg) -- Norway’s In.. http://bit.ly/5l1UE";;;;"5894780527";https://twitter.com/BLOOMBARG/status/5894780527
jednews;2009-11-20 17:17;0;0;"#BBCNews : Drug resistant swine flu hits UK http://cli.gs/puAu5";;;#BBCNews;"5894778862";https://twitter.com/jednews/status/5894778862
SputnikInt;2009-11-20 17:16;0;0;"World WHO reports 525,000 swine flu cases worldwide: http://bit.ly/7KTuER";;;;"5894769218";https://twitter.com/SputnikInt/status/5894769218
doantu;2009-11-20 17:16;0;0;"Drug resistant swine flu hits UK: Health officials in Cardiff confirm a Tamiflu-resistant strain of swine flu h.. http://bit.ly/5qrkP9";;;;"5894763736";https://twitter.com/doantu/status/5894763736
marney73;2009-11-20 17:16;0;0;"Pandemonium at the doctors with people waiting for swine flu jab. Had mine now. Mums flight from Ireland is delayed so time to chill.";;;;"5894762991";https://twitter.com/marney73/status/5894762991
VFW_Vet;2009-11-20 17:16;0;0;"RT @DavidCornDC : Is the Chamber of Commere pro-swine flu? I post: http://bit.ly/W4ygR GOP Democrats";;@DavidCornDC;;"5894760799";https://twitter.com/VFW_Vet/status/5894760799
GaianCollective;2009-11-20 17:16;0;1;"Aspirin kills 400% more people than H1N1 swine flu http://bit.ly/8UY0XJ";;;;"5894758201";https://twitter.com/GaianCollective/status/5894758201
mdodhh;2009-11-20 17:16;0;0;"Governor O'Malley's weekly swine flu update captioned at www.odhh.maryland.gov. Check it out!";;;;"5894749789";https://twitter.com/mdodhh/status/5894749789
SputnikInt;2009-11-20 17:16;0;0;"Online news WHO reports 525,000 swine flu cases worldwide: http://bit.ly/4xxVq9";;;;"5894747863";https://twitter.com/SputnikInt/status/5894747863
ReportingHealth;2009-11-20 17:16;0;0;"Stinky! Moldovan Army is issuing garlic and onions to help its soldiers ward off #swineflu in Eastern Europe http://bit.ly/8OJtFe #h1n1";;;#swineflu #h1n1;"5894744861";https://twitter.com/ReportingHealth/status/5894744861
Beppe_Grillo_;2009-11-20 17:15;0;0;"Steve Phillips - We don't want your swine flu vaccinations MUSIC http://ow.ly/DKfg";;;;"5894735189";https://twitter.com/Beppe_Grillo_/status/5894735189
kellystagg;2009-11-20 17:15;0;0;"RT @BreakingNews : Norwegian scientists say they have found a mutated virus of H1N1 swine flu ; does not appear to be spreading.";;@BreakingNews;;"5894733928";https://twitter.com/kellystagg/status/5894733928
Amorous_II;2009-11-20 17:15;0;0;"Did U.S. make a swine flu mistake?: WASHINGTON (Reuters) - As U.S. health officials struggle to vaccinate tens .. http://bit.ly/3jwtVd";;;;"5894731255";https://twitter.com/Amorous_II/status/5894731255
SwineFlu_news;2009-11-20 17:15;0;0;"Bayern coach says his job on the line this weekend http://t.love.com/272874702";;;;"5894721784";https://twitter.com/SwineFlu_news/status/5894721784
live_h1n1;2009-11-20 17:15;0;0;"Possible spread of #Tamiflu resistant #swineflu probed - BBC News : http://bit.ly/1SEhaq";;;#Tamiflu #swineflu;"5894720977";https://twitter.com/live_h1n1/status/5894720977
swineflueupdate;2009-11-20 17:14;0;0;"Educate and Prevent Norfolk swine flu latest - Norfolk Eastern Daily Press: Globe and MailNo.. http://bit.ly/1U2VAI";;;;"5894710748";https://twitter.com/swineflueupdate/status/5894710748
BreakthroughHS;2009-11-20 17:14;0;0;"Health Department Reviewing Swine Flu Vaccine Clinics http://cli.gs/tr5rS";;;;"5894709350";https://twitter.com/BreakthroughHS/status/5894709350
clarkey101;2009-11-20 17:13;0;0;"Swine Flu - DON'T GET IT! Believe me, it's not enjoyable! Might get something to eat for only the 3rd time since Saturday.";;;;"5894681313";https://twitter.com/clarkey101/status/5894681313
Alderalarms;2009-11-20 17:12;0;0;"Swine Flu Clinic To Add To Traffic, Parking Today, Tomorrow http://bit.ly/7wMeTT";;;;"5894665542";https://twitter.com/Alderalarms/status/5894665542
MarylandFlu;2009-11-20 17:12;1;0;"Garrett County Swine Flu Vaccination TOMORROW: 10am-3pm, Health Department, Grantsville Ctr. Priority Groups";;;;"5894641509";https://twitter.com/MarylandFlu/status/5894641509
tokre;2009-11-20 17:11;0;0;"i was wrong in that last tweet, http://is.gd/4ZL0n is the CURE for the swine flu ... that being said, i do have a slight headache";;;;"5894631663";https://twitter.com/tokre/status/5894631663
_hairstyles__;2009-11-20 17:11;0;0;"Its swine flu vaccine may be sufficient to protect people from the virus and could allow many more to be immunized with current supplies.";;;;"5894625677";https://twitter.com/_hairstyles__/status/5894625677
ShulTweets;2009-11-20 17:11;0;0;"http://bit.ly/25p83g Huffpost-Wall Street Banks Getting Swine Flu Vaccine Before Many High-Risk Groups (VIDEO) ....oy.";;;;"5894623250";https://twitter.com/ShulTweets/status/5894623250
ignoramus_rex;2009-11-20 17:11;0;0;"RT @washingtonpost : More on swine flu mutation concerns: http://bit.ly/3zfobo #swineflu";;@washingtonpost;#swineflu;"5894622302";https://twitter.com/ignoramus_rex/status/5894622302
SwineFluNewsHK;2009-11-20 17:11;1;1;"Swine Flu Netherlands Antilles News http://tinyurl.com/ybw3kmb #swineflu #netherlandsantilles";;;#swineflu #netherlandsantilles;"5894617725";https://twitter.com/SwineFluNewsHK/status/5894617725
KevinTrudeau;2009-11-20 17:10;0;0;"Irish Government Plans Mandatory Swine Flu Shots - Or You'll Go to Jail http://bit.ly/66kJkR";;;;"5894610209";https://twitter.com/KevinTrudeau/status/5894610209
healthbyholly;2009-11-20 17:10;0;0;"Health Department Reviewing Swine Flu Vaccine Clinics: It was also an alternative for some people who started i.. http://bit.ly/EwIyV";;;;"5894609989";https://twitter.com/healthbyholly/status/5894609989
hashphotoshop;2009-11-20 17:10;0;0;"The girls Swine Flu masks in this photo look Tie-Died like they're out of the 1960's http://bit.ly/oNTW4 #photoshop (via @jonah_kessel )";;@jonah_kessel;#photoshop;"5894608978";https://twitter.com/hashphotoshop/status/5894608978
Crof;2009-11-20 17:10;0;0;"UK: Possible H2H case of Tamiflu resistant swine flu ? http://bit.ly/8ERvOw";;;;"5894606850";https://twitter.com/Crof/status/5894606850
swinefluh1n1;2009-11-20 17:10;0;0;""People line up for H1N1 vaccine at Woodland Memorial Hospital" http://tinyurl.com/ydmbmep #swineflu #H1N1";;;#swineflu #H1N1;"5894596369";https://twitter.com/swinefluh1n1/status/5894596369
dublindoc;2009-11-20 17:10;0;0;"Possible spread of Tamiflu resistant swine flu probed - http://tr.im/Fnvy";;;;"5894592930";https://twitter.com/dublindoc/status/5894592930
theopolitico;2009-11-20 17:10;0;0;"Norwegian scientists raise concerns about mutated form of swine flu : Scientists in Norway have identified a mut.. http://bit.ly/6dKzMz";;;;"5894588867";https://twitter.com/theopolitico/status/5894588867
knowmorestuff;2009-11-20 17:09;0;0;"U.K. HPA Is Investigating Tamiflu-Resistant Swine Flu Cases|Nov. 20 (Bloomberg) -- The U.K. Health Protection .. http://oohja.com/x2tD3";;;;"5894587113";https://twitter.com/knowmorestuff/status/5894587113
jaytsend;2009-11-20 17:09;0;0;"Flu Prevention: Swine Flu Vaccine Clinics Held Thursday http://bit.ly/7Utilw";;;;"5894582915";https://twitter.com/jaytsend/status/5894582915
jaytsend;2009-11-20 17:09;0;0;"Flu Prevention: H1N1( Swine Flu ): Recommendations for Prevention Of Pneumonia ... http://bit.ly/4Q7SAz";;;;"5894576582";https://twitter.com/jaytsend/status/5894576582
evilcheltdevil;2009-11-20 17:09;0;0;"Oh lordy - Tamiflu resistant swine flu ? The pigocolypse is coming... http://bit.ly/2Pm1Nn";;;;"5894568834";https://twitter.com/evilcheltdevil/status/5894568834
tokre;2009-11-20 17:08;0;0;"this is THE REASON for pretty much every case of swine flu world wide: http://is.gd/4ZL0n ... for sure!";;;;"5894539952";https://twitter.com/tokre/status/5894539952
novelh1n1;2009-11-20 17:08;0;0;"http://novelh1n1.com Swine flu vaccination extended to all children under five: NHS figures.. http://tinyurl.com/ydvbupt";;;;"5894538034";https://twitter.com/novelh1n1/status/5894538034
abc15nev;2009-11-20 17:08;0;0;"700 swine flu vaccinations available at Scottsdale clinic http://tinyurl.com/yj5wwyz";;;;"5894536443";https://twitter.com/abc15nev/status/5894536443
MarylandFlu;2009-11-20 17:08;1;0;"Wicomico County Swine Flu Vaccination TOMORROW: For info: http://www.wicomicohealth.org/H1N1_Main1.htm";;;;"5894536056";https://twitter.com/MarylandFlu/status/5894536056
andrewakuffo;2009-11-20 17:07;0;0;"good point but don't think Seth Godin would really market a Swine Flu vaccine like that....would he? Hmm, maybe he would! http://ow.ly/E39r";;;;"5894530104";https://twitter.com/andrewakuffo/status/5894530104
News_SwineFlu;2009-11-20 17:07;0;0;"#swineflu Three die of swine flu in Rajasthan - Press Trust of India http://bit.ly/453ri1";;;#swineflu;"5894524672";https://twitter.com/News_SwineFlu/status/5894524672
News_SwineFlu;2009-11-20 17:07;0;0;"#swineflu Did us make a swine flu mistake? - Reuters http://bit.ly/2dYuxC";;;#swineflu;"5894523443";https://twitter.com/News_SwineFlu/status/5894523443
CHDInc;2009-11-20 17:07;0;0;"RT @swineflu _tweets: Did U.S. make a swine flu mistake? #H1N1 http://ow.ly/E4hb";;@swineflu;#H1N1;"5894513152";https://twitter.com/CHDInc/status/5894513152
MiamiDonkey;2009-11-20 17:07;0;0;"Got my swine flu vaccine today. Didn't hurt, didn't really need it in the first place cos my asthma isn't bad, and, oh yeah, now I can fly";;;;"5894512707";https://twitter.com/MiamiDonkey/status/5894512707
TheSwineFluGuru;2009-11-20 17:06;0;0;"Protect yourself before you shake hands. www.antisepticausa.com. Swine Flu , H1N1";;;;"5894487285";https://twitter.com/TheSwineFluGuru/status/5894487285
ipapoo;2009-11-20 17:06;0;0;"Swine flu nightmare sidelines poorly Barcelona duo Abidal and Toure: Spanish giants Barcelona have confirmed de.. http://bit.ly/stnpw";;;;"5894484382";https://twitter.com/ipapoo/status/5894484382
TheSwineFluGuru;2009-11-20 17:05;0;0;"First H1N1 Death Reported in Northern Michigan 9&10 News -. www.antisepticausa.com. Swine Flu , H1N1";;;;"5894479434";https://twitter.com/TheSwineFluGuru/status/5894479434
swinefluh1n1;2009-11-20 17:05;0;0;""Respiratory illness shuts down hospital unit" http://tinyurl.com/yhzw6bn #swineflu #H1N1";;;#swineflu #H1N1;"5894476013";https://twitter.com/swinefluh1n1/status/5894476013
pulsetoday;2009-11-20 17:05;0;0;"Pulse Today: GPC warns of 'massive' extra swine flu workload as new pay talks loom: The Government’.. http://bit.ly/4iLUBl";;;;"5894474423";https://twitter.com/pulsetoday/status/5894474423
SwineFluGuru;2009-11-20 17:05;0;0;"As local vaccine supplies increase, swine flu cases plummet http://bit.ly/4VxCgw";;;;"5894470399";https://twitter.com/SwineFluGuru/status/5894470399
live_h1n1;2009-11-20 17:05;0;0;"RT @AIDigest : BBC News - Possible spread of Tamiflu resistant swine flu probed - http://shar.es/aioXy";;@AIDigest;;"5894464353";https://twitter.com/live_h1n1/status/5894464353
sfoflu;2009-11-20 17:05;0;0;"U.S. Influenza and Pneumonia-Associated Hospitalizations and Deaths from August 30 to November .. http://bit.ly/2wkLGU #h1n1 #swineflu";;;#h1n1 #swineflu;"5894463416";https://twitter.com/sfoflu/status/5894463416
grishastewart;2009-11-20 17:05;0;1;"Up-to-date info on cats & swine flu . http://www.avma.org/public_health/influenza/new_virus/";;;;"5894458341";https://twitter.com/grishastewart/status/5894458341
CeciliaBruce;2009-11-20 17:05;0;0;"It's friday:D no homework and no stress^^ but my mom and dad is making me take the swine flu shot on monday, and I really don't wanna do it!";;;;"5894456641";https://twitter.com/CeciliaBruce/status/5894456641
PhoenixArizona;2009-11-20 17:04;0;0;"PHX-AZ: 700 swine flu vaccinations available at Scottsdale clinic: Health officials say while the number of new cas... http://bit.ly/6Q8wBh";;;;"5894452269";https://twitter.com/PhoenixArizona/status/5894452269
loveresearch;2009-11-20 17:04;0;0;"Here's a quote for swine flu season: "Love is like a virus it can happen to anybody at any time." - Maya Angelou http://fb.me/3aQ5jWI";;;;"5894446840";https://twitter.com/loveresearch/status/5894446840
SearchClinic;2009-11-20 17:04;0;0;"Health Direct Sharp rise in England swine flu deaths: The latest weekly bulletin sho.. http://bit.ly/4bKZqG Health Direct";;;;"5894443297";https://twitter.com/SearchClinic/status/5894443297
SwineFluNewsUSA;2009-11-20 17:04;1;0;"Swine flu vaccine is only one step towards winning the fight against the H1N1 virus. http://tinyurl.com/yg4v969 #h1n1 #flu";;;#h1n1 #flu;"5894441731";https://twitter.com/SwineFluNewsUSA/status/5894441731
OttawaBob;2009-11-20 17:04;0;0;"The difference between Bird Flu and Swine Flu ??? Well, Bird Flu is tweetable...but you will need oinkment for Swine Flu ...";;;;"5894439341";https://twitter.com/OttawaBob/status/5894439341
NightOwlMom;2009-11-20 17:03;0;0;"I've rambled enough. I need to go pretend that SAHM's, like myself, actually DO STUFF. I'll be the one curing Swine Flu ......";;;;"5894415446";https://twitter.com/NightOwlMom/status/5894415446
TheSwineFluGuru;2009-11-20 17:03;0;0;"Even mild asthma boosts H1N1 risk Canada.com . www.antisepticausa.com. Swine Flu , H1N1";;;;"5894414480";https://twitter.com/TheSwineFluGuru/status/5894414480
Chrissypants;2009-11-20 17:03;0;0;"Sarah Palin in Rochester signing books? Can see it now, "the masses drove from swine flu clinics to Sarah Palin book signing." Scary";;;;"5894408543";https://twitter.com/Chrissypants/status/5894408543
fuTuRe_sHOcK;2009-11-20 17:02;1;0;"Swine Flu Cases in Norway Show Mutation, WHO Says http://tinyurl.com/ydchwgh";;;;"5894394635";https://twitter.com/fuTuRe_sHOcK/status/5894394635
SeekBluntTruth;2009-11-20 17:02;0;0;"Aspirin kills 400% more people than H1N1 swine flu http://bit.ly/4rJobc";;;;"5894391543";https://twitter.com/SeekBluntTruth/status/5894391543
Biz_Headlines;2009-11-20 17:01;0;0;"Tamiflu-Resistant Swine Flu Cases Investigated by U.K. Health Authorities http://bit.ly/6V0YtE";;;;"5894373167";https://twitter.com/Biz_Headlines/status/5894373167
Biz_Headlines;2009-11-20 17:01;0;0;"Swine Flu Cases in Norway Show Virus Mutating Into Stronger Form, WHO Says http://bit.ly/8wh6Xj";;;;"5894371909";https://twitter.com/Biz_Headlines/status/5894371909
LRglobe;2009-11-20 17:01;0;0;"Two More Dead; Arkansas Toll From Swine Flu Reaches 20 - Fort Smith Times Record http://bit.ly/126uRj";;;;"5894369234";https://twitter.com/LRglobe/status/5894369234
DJABSOLUT;2009-11-20 17:01;1;0;"Dam 'c.j. Watson(who tha hell is that) of the golden state warriors has the Swine Flu ! Smh!";;;;"5894367540";https://twitter.com/DJABSOLUT/status/5894367540
jeffaron;2009-11-20 17:01;0;0;"Vaccine shortage? GOOD! Only 2% of those with flu-like symptoms have the SWINE FLU – most don’t even have the flu: http://ping.fm/KKijY";;;;"5894363144";https://twitter.com/jeffaron/status/5894363144
dbwrite4u;2009-11-20 17:01;0;0;"FDA's list of fraudulent swine flu products - http://bit.ly/BiQoK";;;;"5894359642";https://twitter.com/dbwrite4u/status/5894359642
wobmnews;2009-11-20 17:00;0;0;"Limited amounts of swine-flu vaccine being administered in Toms River, Lakewood & Freehold in next two weeks. Hear & read more at wobm.com.";;;;"5894348317";https://twitter.com/wobmnews/status/5894348317
TheSwineFluGuru;2009-11-20 17:00;0;0;"Protect yourself before you go out in public. www.antisepticausa.com. Swine Flu , H1N1";;;;"5894340540";https://twitter.com/TheSwineFluGuru/status/5894340540
karenfayeth;2009-11-20 17:00;0;0;"Swine flu hysteria has reached irrational. Lady describes being detained at Istanbul airport. For having a hot flash! http://bit.ly/85Kr7h";;;;"5894334238";https://twitter.com/karenfayeth/status/5894334238
clickonnews;2009-11-20 17:00;0;0;"cbpbtv: CBPB.ca Local | H1N1 vaccine running out in Winnipeg: Swine flu vaccine clinics in Winnipeg are .. http://tinyur http://url4.eu/nPdi";;;;"5894332591";https://twitter.com/clickonnews/status/5894332591
mdotperiod;2009-11-20 16:59;0;0;"*dead* @my friend!The chick in Starbucks was smelling her coffee+she said that's gross where's the manager! U mt have swine flu !";;@my;;"5894316813";https://twitter.com/mdotperiod/status/5894316813
sanjive01;2009-11-20 16:59;0;0;"Norwegian scientists raise concerns about mutated form of swine flu (Oh oh! :-S) www.flne.ws/21295218 on Fluent News";;;;"5894301732";https://twitter.com/sanjive01/status/5894301732
mottv;2009-11-20 16:59;0;0;"alteralias [20 Nov 16h] swine flu : 3";;;;"5894296044";https://twitter.com/mottv/status/5894296044
TheSwineFluGuru;2009-11-20 16:59;0;0;"Arkansas Has 20 Confirmed Deaths Due to H1N1 Influenza eMaxHealth. www.antisepticausa.com. Swine Flu , H1N1";;;;"5894294854";https://twitter.com/TheSwineFluGuru/status/5894294854
swineflumania;2009-11-20 16:58;0;0;"PIG AIDS! #swineflu I Saw Mommy Vaccinating Santa Claus - Boston Channel.com: CBC.caI Saw Mo.. http://bit.ly/2ERBLA";;;#swineflu;"5894287928";https://twitter.com/swineflumania/status/5894287928
breakingflunews;2009-11-20 16:58;0;0;"breakingflunews.com Three die of swine flu in Rajasthan - Press Trust of India: Online Lates.. http://bit.ly/453ri1";;;;"5894285370";https://twitter.com/breakingflunews/status/5894285370
AmandaJDavies;2009-11-20 16:58;0;0;"Hmm.. Swine flu jab for all children 6mths - 5yrs... Not sure about it myself - what do you think?";;;;"5894281698";https://twitter.com/AmandaJDavies/status/5894281698
MissBayArea09;2009-11-20 16:58;0;0;"my baby appointment to get his 2nd dose of swine flu shot then gota do my passport then to manteca for a meeting...have a beautiful friday!!";;;;"5894277935";https://twitter.com/MissBayArea09/status/5894277935
PharmacyGuru;2009-11-20 16:58;0;0;"Possible spread of Tamiflu resistant swine flu probed http://bit.ly/2EKkgb";;;;"5894272555";https://twitter.com/PharmacyGuru/status/5894272555
BreakingNewsEds;2009-11-20 16:58;0;0;"The current wave of swine flu peaked around Oct. 20 and numbers continue to decline sharply. But, officials warn of a third wave.";;;;"5894271175";https://twitter.com/BreakingNewsEds/status/5894271175
PharmacyGuru;2009-11-20 16:58;0;0;"Milwaukee swine flu vaccine offered for general public Friday http://bit.ly/1Ttz5X";;;;"5894270574";https://twitter.com/PharmacyGuru/status/5894270574
PharmacyGuru;2009-11-20 16:58;0;0;"2009 H1N1 Swine Flu vaccine side effects and safety update by WHO http://bit.ly/3bKTsS";;;;"5894269186";https://twitter.com/PharmacyGuru/status/5894269186
Fla_Medic;2009-11-20 16:58;0;0;"AFD Blog `Norwegian Statement On Mutated Virus' #H1N1 #Swineflu http://bit.ly/7pqUJ9 h/t @Crof at http://bit.ly/6tGWFe";;@Crof;#H1N1 #Swineflu;"5894267565";https://twitter.com/Fla_Medic/status/5894267565
dmbosstone;2009-11-20 16:57;0;0;"Very interesting blog post on our idea of Risk and Swine Flu : http://bit.ly/7BdY6Z";;;;"5894258872";https://twitter.com/dmbosstone/status/5894258872
o01tac;2009-11-20 16:57;0;0;"RT $ BCRX $ CVM Possible spread of Tamiflu resistant swine flu probed (in Wales) http://tinyurl.com/ydvgmqv Norway Reports Mutated H1N1 Virus";;;;"5894256600";https://twitter.com/o01tac/status/5894256600
Melissa30082;2009-11-20 16:57;0;0;"Mortgage Help John Hemming's Web Log: Swine Flu fortnightly report: The total number of new ad.. http://tinyurl.com/yb4o22w";;;;"5894255889";https://twitter.com/Melissa30082/status/5894255889
AIDigest;2009-11-20 16:57;0;0;"BBC News - Possible spread of Tamiflu resistant swine flu probed - http://shar.es/aioXy";;;;"5894244475";https://twitter.com/AIDigest/status/5894244475
swineflu_news_;2009-11-20 16:57;0;0;"Is the Business Community Pro-Swine Flu? -- Politics Daily: This is cold. The US Chamber of Commerce, the major.. http://bit.ly/1Sie7h";;;;"5894241620";https://twitter.com/swineflu_news_/status/5894241620
Dialogue4Health;2009-11-20 16:56;0;0;"What do you think? thanks @d4hmbrown! Swine Flu Myths - Debunking 5 Myths about H1N1 Flu Virus - Popular ... http://icio.us/u0bj4o";;@d4hmbrown;;"5894240499";https://twitter.com/Dialogue4Health/status/5894240499
MarylandFlu;2009-11-20 16:56;1;0;"2 PG County Swine Flu Vaccinations TOMORROW: For info: http://bit.ly/7aCbgN";;;;"5894239778";https://twitter.com/MarylandFlu/status/5894239778
srinaldi;2009-11-20 16:56;0;0;"RT @SwineFluHeds : Canada-CBC News: 4.8 million doses of H1N1 vaccine on way . More #Swine Flu #news - http://tinyurl.com/lwe3fk";;@SwineFluHeds;#Swine #news;"5894239183";https://twitter.com/srinaldi/status/5894239183
swineflu_news_;2009-11-20 16:56;0;0;"The Final Redoubt: Ukraine Swine-Flu Update: British scientists are examining the strain of swine flu behind a .. http://bit.ly/4EPyD4";;;;"5894236452";https://twitter.com/swineflu_news_/status/5894236452
SwineFluTicker;2009-11-20 16:56;0;0;"Did U.S. make a swine flu mistake?: Reuters By Maggie Fox, Health and Science Editor WASHINGTON (Reuters) - As .. http://bit.ly/8Ymk2q";;;;"5894233589";https://twitter.com/SwineFluTicker/status/5894233589
sanmccarron;2009-11-20 16:56;0;0;"What do you think? RT @MicrobeWorld Deaths following swine flu immunization not linked to vaccine, the WHO says http://bit.ly/4lSakp";;@MicrobeWorld;;"5894231707";https://twitter.com/sanmccarron/status/5894231707
swineflu_news_;2009-11-20 16:56;0;0;"Have you had the swine flu ? | Better Health: Have you thought you or a family member might have a bad case of s.. http://bit.ly/49I3kg";;;;"5894230694";https://twitter.com/swineflu_news_/status/5894230694
dkayserwx;2009-11-20 16:56;1;0;"RT @BreakingNews : JUST IN -- Norwegian scientists say they have found a mutated virus of H1N1 swine flu ; does not appear to be spreading.";;@BreakingNews;;"5894225421";https://twitter.com/dkayserwx/status/5894225421
SwineFluTicker;2009-11-20 16:56;0;0;"Possible spread of Tamiflu resistant swine flu probed: BBC News By Fergus Walsh Health officials are investigat.. http://bit.ly/8hZr8J";;;;"5894225178";https://twitter.com/SwineFluTicker/status/5894225178
SwineFluNewsHK;2009-11-20 16:56;0;1;"Asia Swine Flu Schools sealed in Sri Lanka doubts about a genuine series of deaths in China http://tinyurl.com/ycpj6fu #flu #hongkong #hk";;;#flu #hongkong #hk;"5894218549";https://twitter.com/SwineFluNewsHK/status/5894218549
SwineFluHeds;2009-11-20 16:56;0;0;"Canada-CBC News: 4.8 million doses of H1N1 vaccine on way . More #Swine Flu #news - http://tinyurl.com/lwe3fk";;;#Swine #news;"5894218394";https://twitter.com/SwineFluHeds/status/5894218394
SwineFluTicker;2009-11-20 16:55;0;0;"Milwaukee swine flu vaccine offered for general public Friday: By Sharif Durhams of the Journal Sentinel The in.. http://bit.ly/7kDFBf";;;;"5894214294";https://twitter.com/SwineFluTicker/status/5894214294
SwineFluTicker;2009-11-20 16:55;0;0;"2009 H1N1 Swine Flu vaccine side effects and safety update by WHO: Examiner.com The World Health Organization (.. http://bit.ly/8QfMuc";;;;"5894211523";https://twitter.com/SwineFluTicker/status/5894211523
swineflunews24;2009-11-20 16:55;0;0;"The Final Redoubt: Ukraine Swine-Flu Update: British scientists are examining the strain of swine flu behind a .. http://bit.ly/6edTSp";;;;"5894205865";https://twitter.com/swineflunews24/status/5894205865
barcelonafeedr;2009-11-20 16:55;0;0;"Swine flu sidelines poorly Barca duo Eric Abidal and Yaya Toure http://bit.ly/8LF0kG #barcelona #barca";;;#barcelona #barca;"5894205861";https://twitter.com/barcelonafeedr/status/5894205861
swineflunews24;2009-11-20 16:55;0;0;"Have you had the swine flu ? | Better Health: Have you thought you or a family member might have a bad case of s.. http://bit.ly/4NZNr1";;;;"5894200212";https://twitter.com/swineflunews24/status/5894200212
swineflunews24;2009-11-20 16:55;0;0;"Is the Business Community Pro-Swine Flu? -- Politics Daily: This is cold. The US Chamber of Commerce, the major.. http://bit.ly/4Yuvf9";;;;"5894194941";https://twitter.com/swineflunews24/status/5894194941
MorayFirthLive;2009-11-20 16:55;0;0;"Medical centres under pressure as swine flu spreads http://cli.gs/JTaGm";;;;"5894193629";https://twitter.com/MorayFirthLive/status/5894193629
MyRAEDiO;2009-11-20 16:55;0;0;"Hell fuccin naw, My gurl Sasha got the swine flu !? Smh, cant fucc w/ her, hope she feels better tho =(";;;;"5894192245";https://twitter.com/MyRAEDiO/status/5894192245
KungFluFighter;2009-11-20 16:54;0;0;"RT @foxtiger RT @unreal_g : Norwegian scientists raise concerns ABT mutated form of swine flu http://yr.flu.0sp.in #H1N1 #swineflu";;@foxtiger @unreal_g;#H1N1 #swineflu;"5894169087";https://twitter.com/KungFluFighter/status/5894169087
amjadmalik22;2009-11-20 16:54;0;0;"RT: @NicRobertsonCNN @ishasesayCNN sterilized stones for the pilgrims doing Jamrah! The Saudis are taking the swine flu very seriously #fb";;@NicRobertsonCNN @ishasesayCNN;#fb;"5894168086";https://twitter.com/amjadmalik22/status/5894168086
MattJSour;2009-11-20 16:54;0;0;"Just got a shot of the swine flu vaccine, which now makes me almost certain that I will now get the diease. So, stay away.";;;;"5894162693";https://twitter.com/MattJSour/status/5894162693
TriggerNews;2009-11-20 16:53;0;0;"$ BCRX $ NVAX $ CVM Possible spread of Tamiflu resistant swine flu probed (in Wales) http://tinyurl.com/ydvgmqv";;;;"5894155791";https://twitter.com/TriggerNews/status/5894155791
