username;date;retweets;favorites;text;geo;mentions;hashtags;id;permalink
SwineFluNewsSG;2009-07-16 18:33;0;0;"Batam Asks Int'L Shipping Companies to Provide Face Masks http://tinyurl.com/lgmfs3 #swineflu #h1n1";;;#swineflu #h1n1;"2673799484";https://twitter.com/SwineFluNewsSG/status/2673799484
jaimiek;2009-07-16 18:33;0;0;"Bass legend. Swine Flu victim. http://bit.ly/Jis8X";;;;"2673798358";https://twitter.com/jaimiek/status/2673798358
SwineFluNewsEU;2009-07-16 18:33;0;0;"Wife of ex British PM Tony Blair in swine flu mystery http://tinyurl.com/m6eaf6 #swineflu #h1n1";;;#swineflu #h1n1;"2673798292";https://twitter.com/SwineFluNewsEU/status/2673798292
harrywalker1;2009-07-16 18:33;0;0;"flatmate has swine flu . how long before i do? who's up for a sweepstake?";;;;"2673798117";https://twitter.com/harrywalker1/status/2673798117
3dstuffed;2009-07-16 18:33;0;0;"New post: Swine flu : 65,000 deaths is UK's worst case scenario (http://cli.gs/BVZpj)";;;;"2673797756";https://twitter.com/3dstuffed/status/2673797756
3dstuffed;2009-07-16 18:33;0;0;"New post: Third swine flu death in Scotland (http://cli.gs/aPA92)";;;;"2673795284";https://twitter.com/3dstuffed/status/2673795284
ImpactNS;2009-07-16 18:33;0;0;"Three more camps under microscope for swine flu in Ontario cottage country - http://tinyurl.com/lv8dr5";;;;"2673793396";https://twitter.com/ImpactNS/status/2673793396
3dstuffed;2009-07-16 18:32;0;0;"New post: British swine flu death toll reaches 29 (http://cli.gs/N1QeW)";;;;"2673790704";https://twitter.com/3dstuffed/status/2673790704
SpiritualNurse;2009-07-16 18:32;0;0;"RT @ManiKarthik I am un-following anyone who perpetutates the created media drama called " swine flu "";;@ManiKarthik;;"2673788241";https://twitter.com/SpiritualNurse/status/2673788241
fawblended;2009-07-16 18:32;0;0;"FirstAid Blog update Important information about swine flu - There were an estimated 55,000 new cases of swine flu ... http://ow.ly/15HWnH";;;;"2673787072";https://twitter.com/fawblended/status/2673787072
novelh1n1;2009-07-16 18:31;0;0;"http://novelh1n1.com Swine flu – everything you need to know: The latest swine flu inf.. http://bit.ly/3xwv7k";;;;"2673769691";https://twitter.com/novelh1n1/status/2673769691
davidriedel;2009-07-16 18:31;0;0;"Article on swine flu in Southrn hemisphere (winter) Expect return to headlines and stock impact when our winter returns. http://twi.cc/SwiU";;;;"2673766480";https://twitter.com/davidriedel/status/2673766480
newsnigel;2009-07-16 18:31;0;0;"LATEST NEWS: Pandemic threat 'worse than terror': A swine flu pandemic could be more devastating tha.. http://bit.ly/18yqEo";;;;"2673766332";https://twitter.com/newsnigel/status/2673766332
novelh1n1;2009-07-16 18:31;0;0;"http://novelh1n1.com Fifth case of swine flu confirmed – Pacific Daily News: Fifth cas.. http://bit.ly/sW3xy";;;;"2673766178";https://twitter.com/novelh1n1/status/2673766178
RetailUK;2009-07-16 18:31;0;0;"Retail Bulletin - Swine flu 'will keep one in eight workers at home' http://bit.ly/L6DxX";;;;"2673765345";https://twitter.com/RetailUK/status/2673765345
urbanlegendshu;2009-07-16 18:31;0;0;"Wife of ex British PM Tony Blair in swine flu mystery http://tinyurl.com/kpstr8";;;;"2673763569";https://twitter.com/urbanlegendshu/status/2673763569
tomtheguvnor;2009-07-16 18:30;0;0;"Sitting in the most deserted train carriage I can find. Swine flu paranoia is setting in. Did that bloke just cough?";;;;"2673751653";https://twitter.com/tomtheguvnor/status/2673751653
kevinpmiller;2009-07-16 18:30;0;0;"FDA Advisory Committee will meet 7/23 to Discuss H1N1/ SwineFlu Vaccines from 8 am - 4 pm http://tinyurl.com/nypcok OPEN TO PUBLIC";;;;"2673750890";https://twitter.com/kevinpmiller/status/2673750890
Dietguidesnow;2009-07-16 18:30;0;0;"Build Immunity Against Swine Flu http://bit.ly/Rh9ji";;;;"2673750610";https://twitter.com/Dietguidesnow/status/2673750610
Amezzeray;2009-07-16 18:30;0;0;"my dad has just told me that if I ever get Swine Flu , it'll be pretty bad for me because I always have a bad chest during a cold. thanks!!";;;;"2673748361";https://twitter.com/Amezzeray/status/2673748361
_xNatalie;2009-07-16 18:30;0;0;"swine flu seems to be catchin like wild fire. unless doctors are misdiagnosin everyone...";;;;"2673747509";https://twitter.com/_xNatalie/status/2673747509
adastranews;2009-07-16 18:30;0;0;"Two swine flu cases confirmed in Stafford County. H1N1 influenza virus now reported in 35 Kansas counties";;;;"2673745968";https://twitter.com/adastranews/status/2673745968
swineflupdates;2009-07-16 18:30;0;0;"Fight for swine flu vaccine could get ugly (AP) Swine Flu Updates! http://tinyurl.com/nmhkcb";;;;"2673744312";https://twitter.com/swineflupdates/status/2673744312
peterosbornuk;2009-07-16 18:30;0;0;"@SwineFluMaps Well, ambitious or not, as a virus this one looks as though it might be quite successful #swineflu #h1n1";;@SwineFluMaps;#swineflu #h1n1;"2673744152";https://twitter.com/peterosbornuk/status/2673744152
RawFoodLover;2009-07-16 18:29;0;0;""Healthy" 22-year-old dies from swine flu: By Anna Scott The 22-year-old Sarasota man who died of swin.. http://bit.ly/11mvcy";;;;"2673733391";https://twitter.com/RawFoodLover/status/2673733391
haringagila;2009-07-16 18:28;0;0;"Fight for swine flu vaccine could get ugly (AP) : AP - An ugly scramble is brewing over the swine flu vaccine .. http://bit.ly/wkC2S";;;;"2673725326";https://twitter.com/haringagila/status/2673725326
nppopular;2009-07-16 18:28;0;0;"Swine flu spreading at Ontario summer camps: As swine flu sweeps through several popular kids' summer camps, pol.. http://bit.ly/T5h0e";;;;"2673723821";https://twitter.com/nppopular/status/2673723821
pumilio;2009-07-16 18:28;0;0;"What happened to all the news about Swine Flu ? WHO: Spreading too fast to count - at least 1 mil infected in US alone: http://bit.ly/7dBsw";;;;"2673718047";https://twitter.com/pumilio/status/2673718047
CBCManitoba;2009-07-16 18:28;0;0;"Swine flu adviser named for Man. First Nations http://bit.ly/19I36I";;;;"2673716642";https://twitter.com/CBCManitoba/status/2673716642
breakingflunews;2009-07-16 18:27;0;0;"breakingflunews.com Fight for swine flu vaccine could get ugly - The Associated Press: KPICFi.. http://bit.ly/na4mQ";;;;"2673713014";https://twitter.com/breakingflunews/status/2673713014
breakingflunews;2009-07-16 18:27;0;0;"breakingflunews.com Children hardest hit by swine flu pandemic - NEWS.com.au: New Zealand Her.. http://bit.ly/3QrKt9";;;;"2673711770";https://twitter.com/breakingflunews/status/2673711770
breakingflunews;2009-07-16 18:27;0;0;"breakingflunews.com Air Force Academy Cadets Hit by Swine Flu - U.S. News & World Report: Air.. http://bit.ly/13nQoX";;;;"2673710251";https://twitter.com/breakingflunews/status/2673710251
ButAsForMe;2009-07-16 18:27;0;0;": Cherie Blair has caught suspected swine flu , The Sun can reveal. http://bit.ly/iVh8h";;;;"2673706897";https://twitter.com/ButAsForMe/status/2673706897
fluvirus;2009-07-16 18:27;0;0;"How Bad Is Swine Flu ? Without Numbers, Who Knows?: Many people are confused about just how many patients have be.. http://bit.ly/GOePR";;;;"2673705439";https://twitter.com/fluvirus/status/2673705439
Einvestigator;2009-07-16 18:27;0;0;"Cherie Blair has suspected swine flu , it was revealed today. http://bit.ly/10EOXm http://ff.im/5jmFT";;;;"2673703451";https://twitter.com/Einvestigator/status/2673703451
SwineFluNewsCA;2009-07-16 18:27;0;0;"Manitoba's First Nations raising $1.5M to quarrel swine flu http://tinyurl.com/lx9nwk #swineflu #h1n1";;;#swineflu #h1n1;"2673698283";https://twitter.com/SwineFluNewsCA/status/2673698283
lenrichardson;2009-07-16 18:26;0;0;"Patient with swine flu virus dies http://bit.ly/VyTOK";;;;"2673697413";https://twitter.com/lenrichardson/status/2673697413
SwineFluTicker;2009-07-16 18:26;0;0;"London Times Censors Mass Opposition to Mandatory Swine Flu Vaccine: Prison Planet.com The London Times newspape.. http://bit.ly/nFZoj";;;;"2673697162";https://twitter.com/SwineFluTicker/status/2673697162
horse__wife;2009-07-16 18:26;0;0;"MadM tells us that YOU TOO can get swine flu : http://bit.ly/Jis8X new album featuring fantasy film WHAA";;;;"2673691401";https://twitter.com/horse__wife/status/2673691401
DailyNewsToday;2009-07-16 18:26;0;0;"Wife of ex British PM Tony Blair in swine flu mystery http://tinyurl.com/nu9ckb";;;;"2673691292";https://twitter.com/DailyNewsToday/status/2673691292
AccessSportsPgh;2009-07-16 18:25;0;0;"Patient with swine flu virus dies: A patient who tested positive for swine flu has died at the Great Western Hos.. http://bit.ly/2ihjg0";;;;"2673673398";https://twitter.com/AccessSportsPgh/status/2673673398
fluarticles;2009-07-16 18:25;0;0;"British swine flu death toll reaches 29: Twenty nine people have now died in Britain from swine flu amid predict.. http://bit.ly/GMWim";;;;"2673670221";https://twitter.com/fluarticles/status/2673670221
jc76;2009-07-16 18:25;0;0;"RT @cindylu_ : 50.000 cases of H1N1 swine flu if u have underlying health conditions ...stay away from crowds eat well wash hands X..SCARY:(";;@cindylu_;;"2673668816";https://twitter.com/jc76/status/2673668816
JamShowbiz;2009-07-16 18:25;0;0;"Ex-Hole bassist gets swine flu http://bit.ly/rdkAw";;;;"2673667644";https://twitter.com/JamShowbiz/status/2673667644
YahooNews;2009-07-16 18:25;0;0;"Fight for swine flu vaccine could get ugly (AP) http://bit.ly/13l2cr";;;;"2673667375";https://twitter.com/YahooNews/status/2673667375
fluarticles;2009-07-16 18:25;0;0;"Tourist suffering from swine flu dies in Scotland: A FEMALE tourist suffering from the swine flu virus has died .. http://bit.ly/KS5wa";;;;"2673667318";https://twitter.com/fluarticles/status/2673667318
NJMcGee18;2009-07-16 18:24;0;0;"Survey: Americans expect widespread swine flu http://bit.ly/TAmhD";;;;"2673662163";https://twitter.com/NJMcGee18/status/2673662163
webtipsfree;2009-07-16 18:24;0;0;"UK swine flu deaths jump to 29: Twenty-nine grouping hit today died in the UK after getting swine flu , the poli.. http://bit.ly/EM4UT";;;;"2673655583";https://twitter.com/webtipsfree/status/2673655583
DailyFill;2009-07-16 18:23;0;0;"Harry Potter And The Half-Baked Prince: Does the treatment for swine flu involve smoking large amounts of doobag.. http://bit.ly/14FGWP";;;;"2673641458";https://twitter.com/DailyFill/status/2673641458
uktn;2009-07-16 18:22;0;0;"Cherie Blair suffering from swine flu : Cherie Blair suffering from swine flu http://bit.ly/qwL5o";;;;"2673634629";https://twitter.com/uktn/status/2673634629
alessiamissita;2009-07-16 18:22;0;0;"it took for me to get swine flu to get someone to talk to me after over 2 months!wow!";;;;"2673632144";https://twitter.com/alessiamissita/status/2673632144
amvr2medwriter;2009-07-16 18:22;0;0;"Google India Closes Office Due To Swine Flu | WebProNews http://twurl.nl/difkgu";;;;"2673631306";https://twitter.com/amvr2medwriter/status/2673631306
kaplinskyreport;2009-07-16 18:22;0;0;"The coming swine flu storm http://bit.ly/wy46L";;;;"2673629747";https://twitter.com/kaplinskyreport/status/2673629747
menzfashion;2009-07-16 18:22;0;0;"Cherie Blair joins Rupert Grint as famous Brits with swine flu ; UK … - Examiner.com http://ff.im/-5jlZa";;;;"2673628702";https://twitter.com/menzfashion/status/2673628702
DaveWilliamsPPC;2009-07-16 18:22;0;0;"I'm suffering flu-like symptoms. Not sure whether it's man-flu or swine-flu yet.";;;;"2673627847";https://twitter.com/DaveWilliamsPPC/status/2673627847
FU4ChildRights;2009-07-16 18:22;0;2;"Lethal secrets of 1918 flu virus: http://news.bbc.co.uk/2/hi/health/6271833.htm #eugenics #swineflu #vaccines #tcot #all #health #tlot";;;#eugenics #swineflu #vaccines #tcot #all #health #tlot;"2673627661";https://twitter.com/FU4ChildRights/status/2673627661
GETVAXED;2009-07-16 18:21;0;0;"Health | WHO: No licensed swine flu vaccine til end of year | Seattle Times Newspaper http://ow.ly/hrXS #h1n1 #health @swineflu";;@swineflu;#h1n1 #health;"2673609763";https://twitter.com/GETVAXED/status/2673609763
AKthe5th;2009-07-16 18:20;0;0;"If you have any family at an Ontario camp.... RT @TorontoStar Number of camps hit by swine flu now up to nine http://bit.ly/C2RfK";;@TorontoStar;;"2673604613";https://twitter.com/AKthe5th/status/2673604613
ReligiousIntel;2009-07-16 18:20;0;2;"Churches ‘have key role to play in swine flu crisis’, see http://bit.ly/14AcKw";;;;"2673600370";https://twitter.com/ReligiousIntel/status/2673600370
RichardRuhling;2009-07-16 18:20;0;0;"I just updated my Squidoo page: Swine Flu Vaccine / http://tinyurl.com/lpb2yd";;;;"2673599967";https://twitter.com/RichardRuhling/status/2673599967
HubScout;2009-07-16 18:19;0;0;"Scouting the #News : Survey: Americans expect widespread swine flu http://bit.ly/kXrd5 http://bit.ly/Sh9pI";;;#News;"2673589500";https://twitter.com/HubScout/status/2673589500
GifseMensagens;2009-07-16 18:19;0;0;"Wife of Tony Blair in swine flu mystery * Music and Messages - @Chrysca - www.gifsemensagens.com.br";;@Chrysca;;"2673585088";https://twitter.com/GifseMensagens/status/2673585088
peteblakemore;2009-07-16 18:19;0;0;"Just recieved news that old friend in UK has #swineflu - knew it was a matter of time, but 'll hold the jokes till he's all clear";;;#swineflu;"2673584702";https://twitter.com/peteblakemore/status/2673584702
bluearmy99;2009-07-16 18:19;0;0;"#swineflu Just worked out that with the swine flu death toll doubling every day, we'll all be dead by a week next Tuesday.";;;#swineflu;"2673577275";https://twitter.com/bluearmy99/status/2673577275
UCLocalSource;2009-07-16 18:19;0;0;"A 55-year-old Union County woman died from swine flu yesterday. This brings the total swine flu death count to 14 for NJ.";;;;"2673576301";https://twitter.com/UCLocalSource/status/2673576301
frostheath;2009-07-16 18:19;0;0;"Newsmax reports that the current vaccine may be more dangerous than the Swine Flu ~Vaccine contains squalene & gp120 www.thepeoplesvoice.org";;;;"2673574993";https://twitter.com/frostheath/status/2673574993
peterosbornuk;2009-07-16 18:18;0;0;"So what happens if 1/3 to 1/5 of the workforce is absent? #swineflu #h1n1";;;#swineflu #h1n1;"2673571860";https://twitter.com/peterosbornuk/status/2673571860
cynsheis;2009-07-16 18:18;0;0;"Rt @desiredeffect and here's a good article about the censorship of opposition to mandatory swine flu vaccinations http://tr.im/sF2W";;@desiredeffect;;"2673571434";https://twitter.com/cynsheis/status/2673571434
almoot2001;2009-07-16 18:18;0;0;"RT @timesonline : Ruth Gledhill: CofE bishops: 'Noble' metal of chalice no protection against swine flu http://bit.ly/waEdq";;@timesonline;;"2673564124";https://twitter.com/almoot2001/status/2673564124
sjp1979;2009-07-16 18:17;0;0;"Wow! Today has been eventful. Diagnosed with possible swine flu and followed on twitter by North Korea and Lady Gaga!";;;;"2673558962";https://twitter.com/sjp1979/status/2673558962
russkick;2009-07-16 18:17;0;0;"Major Expose on Swine Flu by 60 Minutes -- in 1979. http://bit.ly/izRCH";;;;"2673556614";https://twitter.com/russkick/status/2673556614
novelh1n1;2009-07-16 18:17;0;0;"http://novelh1n1.com Fight for swine flu vaccine could get ugly - The Associated Press: Figh.. http://bit.ly/na4mQ";;;;"2673555308";https://twitter.com/novelh1n1/status/2673555308
peterosbornuk;2009-07-16 18:17;0;0;"5% of GDP they say! #swineflu #h1n1";;;#swineflu #h1n1;"2673546907";https://twitter.com/peterosbornuk/status/2673546907
Admiralowen;2009-07-16 18:17;0;0;"damn this channel 4 coverage of swineflu is grim, they are talking about the power grid's plans for mass sickness of its staff etc";;;;"2673546581";https://twitter.com/Admiralowen/status/2673546581
IsraelNewsNow;2009-07-16 18:16;0;0;"Israeli 21c: Fighting swine flu with math Health - Jul. 16, 2009 A team of http://tinyurl.com/ry9uuv Full http://tinyurl.com/jv97a";;;;"2673541411";https://twitter.com/IsraelNewsNow/status/2673541411
SwineFluNewsNZ;2009-07-16 18:16;0;0;"Spike in British swine flu deaths as competition for vaccines begins http://tinyurl.com/mylqdm #swineflu #h1n1";;;#swineflu #h1n1;"2673535709";https://twitter.com/SwineFluNewsNZ/status/2673535709
dmibelli;2009-07-16 18:16;0;0;"is sending all her good wishes to her friend in Caracas who's in the hospital because of the swine flu .";;;;"2673533564";https://twitter.com/dmibelli/status/2673533564
flumap;2009-07-16 18:16;0;0;"#h1n1 Fully licensed swine flu vaccine still months away: WHO. - The Gazette (Montreal): Fully licensed swi.. http://bit.ly/1sNVMl";;;#h1n1;"2673526831";https://twitter.com/flumap/status/2673526831
flumap;2009-07-16 18:15;0;0;"#h1n1 Swine flu virus unpredictable, experts warn - The Gazette (Montreal): Bangladesh News 24 hoursSwine f.. http://bit.ly/xbujN";;;#h1n1;"2673525063";https://twitter.com/flumap/status/2673525063
katierattray;2009-07-16 18:15;0;0;"Now they say that swine flu will be like 28 days later, now everyone will think they have it, It could be a cold. I dont want a vaccine!!!!";;;;"2673518902";https://twitter.com/katierattray/status/2673518902
bweikle;2009-07-16 18:15;0;0;"Number of camps reporting swine flu now up to NINE. Please get in touch if your child's camp is affected. http://ow.ly/hsb4";;;;"2673516087";https://twitter.com/bweikle/status/2673516087
peterosbornuk;2009-07-16 18:15;0;0;"UK sick absentees normally 1/630, it's currently 1/202 and among health staff 1/163 #swineflu #h1n1";;;#swineflu #h1n1;"2673515755";https://twitter.com/peterosbornuk/status/2673515755
SwineFlu_news;2009-07-16 18:15;0;0;"Sarasota County confirms first swine flu death http://t.love.com/232640744";;;;"2673513288";https://twitter.com/SwineFlu_news/status/2673513288
mrshavers;2009-07-16 18:14;0;0;"cherie blair has swine flu . too many jokes running through my head.";;;;"2673509434";https://twitter.com/mrshavers/status/2673509434
PatParslow;2009-07-16 18:14;0;0;"So, swine flu and mortality in non-retired people. Surely this is likely to impact the course of the recession too?";;;;"2673506104";https://twitter.com/PatParslow/status/2673506104
TannerTrosper;2009-07-16 18:14;0;0;"WHO says swine flu is the worst pandemic ever,same article reports as of July 6 there are 426 confirmed deaths globally..wtf?? bit.ly/JXHar";;;;"2673503988";https://twitter.com/TannerTrosper/status/2673503988
bluenapedparrot;2009-07-16 18:14;0;0;"Fight for swine flu vaccine could get ugly (AP) : AP - An ugly scramble is brewing over the swine flu vaccine .. http://bit.ly/13l2cr";;;;"2673497720";https://twitter.com/bluenapedparrot/status/2673497720
refuseandresist;2009-07-16 18:14;0;0;"RT @SirTimJones : London Times Censors Mass Opposition to Mandatory Swine Flu Vaccine - Scores of comments deleted from.. http://bit.ly/omjvS";;@SirTimJones;;"2673497042";https://twitter.com/refuseandresist/status/2673497042
gbay;2009-07-16 18:14;0;0;"Jeeez the news is doing some proper scaremongering re swine flu ... trying to recreate a James Herbert film there by any chance?";;;;"2673496248";https://twitter.com/gbay/status/2673496248
SwineFluUpdate;2009-07-16 18:14;0;0;"Swine Flu Swine flu parties a bad idea: Expert - Vancouver Sun: BBC NewsSwine flu parties a bad idea: E.. http://bit.ly/f6SYB";;;;"2673495916";https://twitter.com/SwineFluUpdate/status/2673495916
SwineFluUpdate;2009-07-16 18:13;0;0;"Swine Flu More swine-flu deaths in the Prairie provinces - Calgary Herald: More swine-flu deaths in the.. http://bit.ly/ioPSq";;;;"2673494478";https://twitter.com/SwineFluUpdate/status/2673494478
areveritt;2009-07-16 18:13;0;0;"Seems i can't escape swine flu - it's now my professional and personal life!! I'm swine flu personified it seems...";;;;"2673492376";https://twitter.com/areveritt/status/2673492376
Dee_Jay_Es;2009-07-16 18:12;0;0;"Prosperity 2-2 Swine flu warning for rugby Tri-Nations Test (AFP via Yahoo! News ...: New Zealand .. http://bit.ly/lxAy1";;;;"2673478718";https://twitter.com/Dee_Jay_Es/status/2673478718
rssfever;2009-07-16 18:12;0;0;"Infidel Bloggers Alliance: Swine Flu Interferes With The Hajj - http://bit.ly/qlPk9";;;;"2673475728";https://twitter.com/rssfever/status/2673475728
rssfever;2009-07-16 18:12;0;0;"Swine flu chronicles - Need to know - Macleans.ca - http://bit.ly/UiuC5";;;;"2673474581";https://twitter.com/rssfever/status/2673474581
peterosbornuk;2009-07-16 18:12;0;0;"My advice: lay in enough food & water for your family for three weeks, I have #swineflu #h1n1";;;#swineflu #h1n1;"2673471053";https://twitter.com/peterosbornuk/status/2673471053
SomersetNews;2009-07-16 18:12;0;0;"Sky News: Twenty-nine people have now died in the UK after contracting swine flu , the Government has announced.";;;;"2673470982";https://twitter.com/SomersetNews/status/2673470982
PatParslow;2009-07-16 18:12;0;0;"I thought my model for swineflu in the UK was seriously over-estimating. New figures suggest it is seriously under-estimating.";;;;"2673466291";https://twitter.com/PatParslow/status/2673466291
tweetdrudge;2009-07-16 18:12;0;0;"Official: Britain will see 63,000 die from swine flu ... http://ad.vu/sear";;;;"2673465409";https://twitter.com/tweetdrudge/status/2673465409
Researchlight;2009-07-16 18:11;0;0;"Why-oh-why didn't this useless government close the schools last week as a precaution against swine flu epidemic";;;;"2673462267";https://twitter.com/Researchlight/status/2673462267
Politics_Hawaii;2009-07-16 18:11;0;0;"The World Health Organization (WHO) said on Thursday that the Swine flu pandemic is spreading too fast to count http://tiny.cc/mmkWV";;;;"2673458945";https://twitter.com/Politics_Hawaii/status/2673458945
bluenapedparrot;2009-07-16 18:11;0;0;"Fight for swine flu vaccine could get ugly (AP) : AP - An ugly scramble is brewing over the swine flu vaccine .. http://bit.ly/wkC2S";;;;"2673457169";https://twitter.com/bluenapedparrot/status/2673457169
TorontoStar;2009-07-16 18:11;0;0;"Number of camps hit by swine flu now up to nine http://bit.ly/C2RfK";;;;"2673456663";https://twitter.com/TorontoStar/status/2673456663
lindenparker;2009-07-16 18:11;0;0;"doesn't understand why C4 News are quoting predicted swine flu figures from a document published about 3 months ago, as if they're new.";;;;"2673456191";https://twitter.com/lindenparker/status/2673456191
Chrysca;2009-07-16 18:11;0;0;"Wife of Tony Blair in swine flu mystery * Music and Messages - @Chrysca - www.gifsemensagens.com.br";;@Chrysca;;"2673452819";https://twitter.com/Chrysca/status/2673452819
Fluheadlines;2009-07-16 18:10;0;0;"Fluheadlines Live Through This? Former Hole bassist Melissa Auf der Maur gets swine flu : TORONTO - I.. http://bit.ly/5elir";;;;"2673446873";https://twitter.com/Fluheadlines/status/2673446873
Fluheadlines;2009-07-16 18:10;0;0;"Fluheadlines UK & World News UK's swine flu death toll is now 29: Twenty-nine people have now died i.. http://bit.ly/1AIeG";;;;"2673445215";https://twitter.com/Fluheadlines/status/2673445215
peterosbornuk;2009-07-16 18:10;0;0;"At last! After wittering on about the threat for 5 years people are starting to see the potential for disruption of society #swineflu #h1n1";;;#swineflu #h1n1;"2673444786";https://twitter.com/peterosbornuk/status/2673444786
Fluheadlines;2009-07-16 18:10;0;0;"Fluheadlines Revealed: RCGP's damning dossier on swine flu chaos: On Tuesday, Pulse exclusively reve.. http://bit.ly/Rll5q";;;;"2673443177";https://twitter.com/Fluheadlines/status/2673443177
HeadlineVa_News;2009-07-16 18:10;0;0;"Va naval lab to test for swine flu : A Navy lab in Virginia soon will begin testing for swine flu . http://bit.ly/oDnLX";;;;"2673442405";https://twitter.com/HeadlineVa_News/status/2673442405
SwineFluNewsCA;2009-07-16 18:10;0;0;"2010 Games organizers contend talks underway over entrance to swine flu vaccine http://tinyurl.com/kk5r9o #swineflu #h1n1";;;#swineflu #h1n1;"2673438096";https://twitter.com/SwineFluNewsCA/status/2673438096
BostonWire;2009-07-16 18:10;0;0;"Survey: Americans expect widespread swine flu - http://fwix.com/article/5_bfe1e9b0fa";;;;"2673435116";https://twitter.com/BostonWire/status/2673435116
SwineFluNewsIE;2009-07-16 18:09;0;0;"25% of race might get Swine Flu http://tinyurl.com/nuvaqh #swineflu #h1n1";;;#swineflu #h1n1;"2673431184";https://twitter.com/SwineFluNewsIE/status/2673431184
HaysDaily;2009-07-16 18:09;0;0;"Rawlins Co. becomes 33rd in state w/confirmed swine flu case, sixth in northwest Kansas: http://snurl.com/nd5oh";;;;"2673429564";https://twitter.com/HaysDaily/status/2673429564
SwineFluNewsSG;2009-07-16 18:09;0;0;"Swine Flu a Big Contributor to Growth http://tinyurl.com/n3uyb5 #swineflu #h1n1";;;#swineflu #h1n1;"2673425666";https://twitter.com/SwineFluNewsSG/status/2673425666
diabetesbasic;2009-07-16 18:09;0;0;"Swine flu - National Pandemic Flu Service > everything you need to know >> Read >> http://bit.ly/4oTY8e";;;;"2673417167";https://twitter.com/diabetesbasic/status/2673417167
clareefrancis;2009-07-16 18:08;0;0;"#swine flu really is back on the news agenda this week. If you're worried and about to go on holiday, don't panic http://bit.ly/eGmOT";;;#swine;"2673414776";https://twitter.com/clareefrancis/status/2673414776
devinmartin;2009-07-16 18:08;0;0;"UK Swine flu deaths could reach 63K in worst case scenario @http://bit.ly/HpRLq =fox_australian";;@http;;"2673413434";https://twitter.com/devinmartin/status/2673413434
linap;2009-07-16 18:08;0;0;"Swine flu diary by Melissa Auf der Maur: http://tinyurl.com/nq3b9y";;;;"2673413431";https://twitter.com/linap/status/2673413431
NUVO_net;2009-07-16 18:08;0;0;"Indiana Dept. of Health reports 13 more cases of swine flu virus http://bit.ly/27Ckp9";;;;"2673411995";https://twitter.com/NUVO_net/status/2673411995
geprods;2009-07-16 18:08;0;0;"Swine flu is takin hold, next the infected will become hungry n start to feed from the uninfected !";;;;"2673411231";https://twitter.com/geprods/status/2673411231
swineflucure_;2009-07-16 18:08;0;0;"New post: County health officials ready, swine flu vaccine is not - Hernando Today (http://cli.gs/3D9ag)";;;;"2673408948";https://twitter.com/swineflucure_/status/2673408948
