username;date;retweets;favorites;text;geo;mentions;hashtags;id;permalink
idahoBNN;2009-11-10 21:28;0;0;"Huckleberries Online: Trish Gannon: Swine Flu Hits Home in Sandpoint: "Jody Matz was your typical, fun-loving 30-year... http://bit.ly/DPuMS";;;;"5599876912";https://twitter.com/idahoBNN/status/5599876912
madcatdisease;2009-11-10 21:28;0;0;"Stay away from your pets if you have the flu. RT @MissionOrange : Update on H1N1 ( Swine Flu ) in Pets http://bit.ly/3qpEQ6";;@MissionOrange;;"5599876064";https://twitter.com/madcatdisease/status/5599876064
disorganization;2009-11-10 21:28;0;0;"many hands make swine flu , but the attorneys still act like the only stapler on the whole floor is the one at the reference desk.";;;;"5599871538";https://twitter.com/disorganization/status/5599871538
toferbrown;2009-11-10 21:28;0;0;"There is a weird smell lurking in the Green Hills library. It smells like Swine Flu or something.";;;;"5599870437";https://twitter.com/toferbrown/status/5599870437
infoflu;2009-11-10 21:28;0;0;"News Flu H1N1: Ontario has 52 swine flu related deaths since April, infection rates on the rise (The Canadian Press... http://ow.ly/160NNZ";;;;"5599860094";https://twitter.com/infoflu/status/5599860094
TheNatural1;2009-11-10 21:28;0;0;"Swine Flu Remedies | Swine Flu Symptoms, Home Remedies, and Treatment http://bit.ly/4vBYT6";;;;"5599857765";https://twitter.com/TheNatural1/status/5599857765
cymplify;2009-11-10 21:27;0;0;"Got your swine flu shot yet? Well, if not, you hopefully haven't been hanging out with any of these celebs. http://bit.ly/1UiReC";;;;"5599853349";https://twitter.com/cymplify/status/5599853349
spillsmusic;2009-11-10 21:27;0;0;"Wow. Someone in my office just got the swine flu .";;;;"5599851479";https://twitter.com/spillsmusic/status/5599851479
TheSoup;2009-11-10 21:27;0;0;"Let's Face the Illness and Dance on DWTS: We've heard of Swan Lake, but Swine Flu Lake? http://bit.ly/1WGdSz";;;;"5599851092";https://twitter.com/TheSoup/status/5599851092
Crazy4RealityTV;2009-11-10 21:27;0;0;"Still Think Swine Flu Is Not A Scam? Listen To CFR Members Plan ... (http://cli.gs/4NvSn) #RealityTV";;;#RealityTV;"5599850698";https://twitter.com/Crazy4RealityTV/status/5599850698
VanSunHealth;2009-11-10 21:27;0;0;"H1N1 swine flu kills eight more B.C. residents in the past week: Eight people have died and 202 B.C. residents .. http://bit.ly/42giLB";;;;"5599848448";https://twitter.com/VanSunHealth/status/5599848448
SwineFluNewsORG;2009-11-10 21:27;0;0;"Police examine strong try to auction flu vaccine upon a Internet http://tinyurl.com/yen4f9z #swineflu #h1n1";;;#swineflu #h1n1;"5599838316";https://twitter.com/SwineFluNewsORG/status/5599838316
swineflu_news_;2009-11-10 21:27;0;0;"Lack of exercise may not explain teen obesity: NEW YORK (Reuters Health) - Most U.S. teenagers are not as active as ... http://bit.ly/46VPOr";;;;"5599838266";https://twitter.com/swineflu_news_/status/5599838266
swineflu_news_;2009-11-10 21:27;0;0;"Those in true emergency hardest hit by ER crisis: NEW YORK (Reuters Health) - The state of US emergency departments ... http://bit.ly/3mjC2x";;;;"5599837812";https://twitter.com/swineflu_news_/status/5599837812
Jenna_Buzzacco;2009-11-10 21:26;0;0;"RT @NBC2 : 11-year-old Lee County girl w/ pre-existing conditions dies of swine flu";;@NBC2;;"5599829669";https://twitter.com/Jenna_Buzzacco/status/5599829669
CdnGal_ps;2009-11-10 21:26;0;0;"Hmm... RT @marisa_herrera : swine flu confirmed in cat! http://ow.ly/ATXV";;@marisa_herrera;;"5599827541";https://twitter.com/CdnGal_ps/status/5599827541
Health_Updates;2009-11-10 21:26;0;0;"NYC Expands Free Swine Flu Vaccines After Low Turnout - Bloomberg: CNET NewsNYC Expands Free Swine Flu Vaccines.. http://bit.ly/1N0hcZ";;;;"5599819357";https://twitter.com/Health_Updates/status/5599819357
I_AM_JoeCamel;2009-11-10 21:26;0;0;"New Flu Victim: Blood Supply: Doctors are now afraid of the blood supply in relation to the Swine Flu for two r.. http://bit.ly/2LFdO0";;;;"5599818897";https://twitter.com/I_AM_JoeCamel/status/5599818897
blastenergy;2009-11-10 21:26;0;0;"Coles County Health Department schedules swine flu clinics for today and Thursday http://bit.ly/eJUla";;;;"5599814640";https://twitter.com/blastenergy/status/5599814640
SwineFluHeds;2009-11-10 21:26;0;0;"Eagle River (WI) WYOW: Pentagon: 300 doses of H1N1 vaccine at Guantanamo . More #Swine Flu #news - http://tinyurl.com/lwe3fk";;;#Swine #news;"5599808977";https://twitter.com/SwineFluHeds/status/5599808977
heartdisease;2009-11-10 21:26;0;0;"NYC Expands Access to Swine Flu Vaccine - WNYC: NEW YORK, NY November 10, 2009 —Thousands of people have been l.. http://doz68.tk";;;;"5599807136";https://twitter.com/heartdisease/status/5599807136
fox6now;2009-11-10 21:26;0;1;"NEW Milwaukee swine flu (H1N1) vaccination clinics just scheduled. Check out latest list. http://ow.ly/B7tJ";;;;"5599806539";https://twitter.com/fox6now/status/5599806539
lifeandscience;2009-11-10 21:25;1;0;"Who will I see at #periodictables tonight? It's about swine flu and smart textiles. http://bit.ly/2yU14q";;;#periodictables;"5599805626";https://twitter.com/lifeandscience/status/5599805626
bostonnewsnow;2009-11-10 21:25;0;0;"Boston man dies from swine flu : BOSTON - Boston public health officials say a 65-year-old man has become the fi.. http://bit.ly/YyDEf";;;;"5599805614";https://twitter.com/bostonnewsnow/status/5599805614
thetoria;2009-11-10 21:25;0;0;"i'm pretty sure the guy sitting next to me in my three-hour lecture has swine flu o______O";;;;"5599801350";https://twitter.com/thetoria/status/5599801350
swinefluh1n1;2009-11-10 21:25;0;0;""ST. MARY'S HOSPITAL OFFERS H1N1 VACCINATION CLINIC TO THE PUBLIC" http://tinyurl.com/y9ze2zm #swineflu #H1N1";;;#swineflu #H1N1;"5599798806";https://twitter.com/swinefluh1n1/status/5599798806
swinefluh1n1;2009-11-10 21:25;0;0;""State warns asthmatics to get shots" http://tinyurl.com/y9wzul5 #swineflu #H1N1";;;#swineflu #H1N1;"5599798413";https://twitter.com/swinefluh1n1/status/5599798413
swinefluh1n1;2009-11-10 21:25;0;0;""New South Jersey Healthcare H1N1 restrictions limit hospital visitation" http://tinyurl.com/yclwok6 #swineflu #H1N1";;;#swineflu #H1N1;"5599797897";https://twitter.com/swinefluh1n1/status/5599797897
swinefluh1n1;2009-11-10 21:25;0;0;""Eight more H1N1 flu deaths in BC; 202 more people need hospital care" http://tinyurl.com/yct25le #swineflu #H1N1";;;#swineflu #H1N1;"5599797486";https://twitter.com/swinefluh1n1/status/5599797486
socialpin;2009-11-10 21:25;0;0;"Tracking antiviral prescriptions for swine flu http://bit.ly/28jyft";;;;"5599796885";https://twitter.com/socialpin/status/5599796885
swine_flu_pro;2009-11-10 21:25;0;0;"http://bit.ly/4ngDZN Senate Committee Talks Paid Sick Leave For H1N1: By Scott Sarvay WASHI.. http://bit.ly/1HupBH";;;;"5599793470";https://twitter.com/swine_flu_pro/status/5599793470
swine_flu_pro;2009-11-10 21:25;0;0;"http://bit.ly/4ngDZN FDA Responds to Docs Refusing H1N1 Vaccine Over Fears It's Too New.. http://bit.ly/2mNsh1";;;;"5599790992";https://twitter.com/swine_flu_pro/status/5599790992
EdenPest;2009-11-10 21:25;0;0;"RT @KIRO7Seattle : Dozens Of Swine Flu Vaccines Stolen http://bit.ly/40gRD4 Wow, who steals vaccines... Swine Flu isn't thaat bad.";;@KIRO7Seattle;;"5599784005";https://twitter.com/EdenPest/status/5599784005
TheNatural1;2009-11-10 21:24;0;0;"School attendance up; has swine flu peaked? http://bit.ly/FlsXv";;;;"5599770339";https://twitter.com/TheNatural1/status/5599770339
TheNatural1;2009-11-10 21:24;0;0;"Swine flu cases 'levelling off' http://bit.ly/4p5KjT";;;;"5599769266";https://twitter.com/TheNatural1/status/5599769266
loisthometv;2009-11-10 21:23;1;0;"11 year old Lee County child dies of Swine Flu . Had pre-existing medical conditions.";;;;"5599746183";https://twitter.com/loisthometv/status/5599746183
timbo21timbo;2009-11-10 21:22;0;0;"Recorded a new track on @Dopetracks . ghetto service (swine) by TIMBO21 ♫ http://deetz.fm/t/155984 anotha swine-flu alert********WARNING";;@Dopetracks;;"5599725929";https://twitter.com/timbo21timbo/status/5599725929
swineonline;2009-11-10 21:22;0;0;"Origin of swine flu discovered! http://alturl.com/j7y2";;;;"5599716529";https://twitter.com/swineonline/status/5599716529
Medindia;2009-11-10 21:22;0;0;"GSK to Donate 50 Million Swine Flu Vaccines to Developing Nations: GlaxoSmithKline (GSK) said on Tuesday it wil.. http://bit.ly/47rvFt";;;;"5599711492";https://twitter.com/Medindia/status/5599711492
margauxdemerle;2009-11-10 21:22;0;0;"went to the doc today to get a prescription and, as I was already there, I've asked about the swine-flu vaccination - and got jumped...TBC";;;;"5599709583";https://twitter.com/margauxdemerle/status/5599709583
dbwrite4u;2009-11-10 21:21;0;0;"Is it a cold or swine flu ? - http://bit.ly/2pO4iB";;;;"5599702923";https://twitter.com/dbwrite4u/status/5599702923
jon_melville;2009-11-10 21:21;0;0;"Health authorities bribing doctors to push swine flu vaccine http://bit.ly/1tT5Ne (and they won't take it themselves! http://bit.ly/1Hd9B3)";;;;"5599697625";https://twitter.com/jon_melville/status/5599697625
ljmaximus;2009-11-10 21:21;0;0;"Ukrainian Women Protest #swineflu Panic Wearing Only Surgical Masks http://bit.ly/1C9PHB #H1N1 (via @lukeallnutt )";;@lukeallnutt;#swineflu #H1N1;"5599695370";https://twitter.com/ljmaximus/status/5599695370
CleanInt;2009-11-10 21:21;0;0;"Swine Flu Update: Troops in Afghanistan take on swine flu : Hundreds of Afghan and internationa.. http://bit.ly/28TmUq";;;;"5599690527";https://twitter.com/CleanInt/status/5599690527
CleanInt;2009-11-10 21:21;0;0;"Swine Flu Update: Pentagon: 300 Doses Of H1N1 Vaccine At Gitmo: The Pentagon says a small ship.. http://bit.ly/GzssB";;;;"5599690042";https://twitter.com/CleanInt/status/5599690042
CleanInt;2009-11-10 21:21;0;0;"Swine Flu Update: First local swine flu death reported in Austria: Vienna - Swine flu claimed .. http://bit.ly/1LAX53";;;;"5599689464";https://twitter.com/CleanInt/status/5599689464
and_elf;2009-11-10 21:21;0;0;"wonders what it feels like when swineflu attacks";;;;"5599680706";https://twitter.com/and_elf/status/5599680706
5moneymaking;2009-11-10 21:20;0;0;"NYC Expands Free Swine Flu Vaccines After Low Turnout: 10 (Bloomberg) -- New York City expanded its weekend cli.. http://tinyurl.com/yfol6uj";;;;"5599664990";https://twitter.com/5moneymaking/status/5599664990
NDN_SPoston;2009-11-10 21:20;0;0;"RT @ndnvonna Got questions about swine flu ? Send us your questions and participate in our upcoming interactive forum. http://bit.ly/1LTUq2";;@ndnvonna;;"5599657111";https://twitter.com/NDN_SPoston/status/5599657111
PEIHeather;2009-11-10 21:20;0;0;"PEI health officials say swine flu has peaked on the Island, closed assement clinic because it's no longer busy. More on CBC News: Compass.";;;;"5599656989";https://twitter.com/PEIHeather/status/5599656989
Essex_TweetiePi;2009-11-10 21:19;0;0;"RT @RuthieeL : Those of you who thought my secret job was heading into the "celebrity" jungle . . . . PIGS MIGHT FLY!!!!!! <--- #SWINE FLU!";;@RuthieeL;#SWINE;"5599650216";https://twitter.com/Essex_TweetiePi/status/5599650216
jeffglaze;2009-11-10 21:18;0;0;"Got my swine flu vaccine today. Hopefully it doesnt get me sick.";;;;"5599626493";https://twitter.com/jeffglaze/status/5599626493
WBAP247NEWS;2009-11-10 21:17;0;0;"Pres. Obama speaks at Ft. Hood, more swine flu vaccine availbable. The 3 pm podcast: http://bit.ly/q7ZHG";;;;"5599601671";https://twitter.com/WBAP247NEWS/status/5599601671
VancouverSun;2009-11-10 21:17;0;0;"H1N1 swine flu kills eight in B.C.'s deadliest week of outbreak: Eight people have died and 202 B.C. resident.. http://bit.ly/44OVVp";;;;"5599596401";https://twitter.com/VancouverSun/status/5599596401
novelh1n1;2009-11-10 21:17;0;0;"http://novelh1n1.com Troops in Afghanistan take on swine flu : Hundreds of Afghan and intern.. http://bit.ly/3wNrza";;;;"5599586946";https://twitter.com/novelh1n1/status/5599586946
USCTeacher;2009-11-10 21:17;0;0;"Swine Flu Vaccine Now Available to Students http://bit.ly/1jWCTK";;;;"5599586084";https://twitter.com/USCTeacher/status/5599586084
CarinaTK;2009-11-10 21:16;0;0;"now both of my nephews got the swineflu .. the youngest one just turned 1 year. Don't die..:(";;;;"5599580786";https://twitter.com/CarinaTK/status/5599580786
FrannyWood;2009-11-10 21:16;0;0;"Swine Flu Remedies | Swine Flu Symptoms, Home Remedies, and Treatment http://bit.ly/3lFerC";;;;"5599575375";https://twitter.com/FrannyWood/status/5599575375
Ericajohn1;2009-11-10 21:16;0;0;"Swine flu cases 'levelling off': BBC News Phase one of the vaccination programme, which covers around 7.. http://bit.ly/c5lzM";;;;"5599573569";https://twitter.com/Ericajohn1/status/5599573569
MemphisRSSFeed;2009-11-10 21:16;0;0;"New post: 18 Swine Flu Deaths Confirmed in Arkansas (http://bit.ly/4jDYRY) http://bit.ly/4jDYRY #memphis #news";;;#memphis #news;"5599562760";https://twitter.com/MemphisRSSFeed/status/5599562760
MissToria4;2009-11-10 21:15;0;0;"@soulmate47 I'm thinking since I got my flu shot about a month ago it helped! Cause it really isn't bad! Pigs didn't start the swine flu !";;@soulmate47;;"5599556218";https://twitter.com/MissToria4/status/5599556218
mexflu;2009-11-10 21:15;0;0;"http://tinyurl.com/yjhdoqg NYC Expands Free Swine Flu Vaccines After Low Turnout (Update3) (Bloomberg) via Yahoo! News";;;;"5599543102";https://twitter.com/mexflu/status/5599543102
SwineFlu_news;2009-11-10 21:15;0;0;"Swine flu vaccination clinic today in Estero http://t.love.com/269437665";;;;"5599533908";https://twitter.com/SwineFlu_news/status/5599533908
GregorioLoco;2009-11-10 21:15;0;0;":^) RT @SoCalVixen : get ur swine flu injection, its gonna hurt tho!! http://twitpic.com/p15at";;@SoCalVixen;;"5599533136";https://twitter.com/GregorioLoco/status/5599533136
deeecapp;2009-11-10 21:14;0;0;"little cousin has the swine flu :( everyone take care of yourselves!";;;;"5599525795";https://twitter.com/deeecapp/status/5599525795
BreakingJaxNews;2009-11-10 21:13;0;0;"Pentagon: 300 Doses Of H1N1 Vaccine At Gitmo: The Pentagon says a small shipment of swine flu vaccine has arriv.. http://bit.ly/3hGuLy";;;;"5599499296";https://twitter.com/BreakingJaxNews/status/5599499296
oinopion;2009-11-10 21:13;0;0;"RT @DJStratton Is not surprised @"Shocking H1N1 Swine Flu Vaccine Miscarriage Stories From Pregnant Women" ( http://bit.ly/2CEbx2 )";;@DJStratton @;;"5599495809";https://twitter.com/oinopion/status/5599495809
monstersandcrit;2009-11-10 21:12;0;0;"M&C World News First local swine flu death reported in Austria: Vienna - Swine flu claimed its first local victim in... http://bit.ly/2jhumK";;;;"5599480236";https://twitter.com/monstersandcrit/status/5599480236
punsultant;2009-11-10 21:12;0;0;"OH (a coworker): "Do you know how you cure the swine flu ? Oinkment."";;;;"5599477506";https://twitter.com/punsultant/status/5599477506
flu360;2009-11-10 21:12;0;0;"Swine flu clinic scheduled in Coalville (Park Record)|Summit County health officials have about 900 H1N1 flu .. http://oohja.com/x1YXq";;;;"5599468039";https://twitter.com/flu360/status/5599468039
BriannaMonae;2009-11-10 21:12;0;0;"On my way to Kaiser hope I don't get the swine flu in the waiting room..lol";;;;"5599466985";https://twitter.com/BriannaMonae/status/5599466985
The_Riz;2009-11-10 21:12;0;0;"Swine Flu Epidemic Infographic. Now will you shut up about not getting your damn vaccine? http://bit.ly/1sBkMz";;;;"5599457946";https://twitter.com/The_Riz/status/5599457946
jeffwolf;2009-11-10 21:11;0;0;"Waiting at the pharmacy for my drugs and spreading my Swine Flu to a bunch of unsuspecting old people.";;;;"5599451836";https://twitter.com/jeffwolf/status/5599451836
3dstuffed;2009-11-10 21:11;0;0;"New post: Senator Dodd proposes paid sick leave for swine flu (http://cli.gs/pWSpm) http://cli.gs/pWSpm";;;;"5599441343";https://twitter.com/3dstuffed/status/5599441343
trackswineflu;2009-11-10 21:11;0;0;"[News] Swine flu cases 'levelling off': BBC News The number of swine flu cases in Wales appears t.. http://bit.ly/4BfuzR";;;;"5599435599";https://twitter.com/trackswineflu/status/5599435599
KQDS_FOX21;2009-11-10 21:10;0;0;"H1N1 " swine flu " vaccine distribution moves to SMDC Wednesday http://bit.ly/41Fpyw";;;;"5599418065";https://twitter.com/KQDS_FOX21/status/5599418065
SunBreakingNews;2009-11-10 21:10;0;0;"H1N1 swine flu kills eight in B.C.'s deadliest week of outbreak: Eight people have died and 202 B.C. residents have ... http://bit.ly/4q1OGf";;;;"5599414633";https://twitter.com/SunBreakingNews/status/5599414633
Newapostolic;2009-11-10 21:08;0;0;"Swine flu in the region: Last Wednesday, Iranian Health Ministry reported that six people .. http://bit.ly/1HsZl7 http://bit.ly/105Fmv";;;;"5599380359";https://twitter.com/Newapostolic/status/5599380359
crumbsfordays;2009-11-10 21:08;0;0;"ehh my doctor said i possibly have swine flu .....";;;;"5599370431";https://twitter.com/crumbsfordays/status/5599370431
wisree;2009-11-10 21:08;0;0;"NYC Expands Free Swine Flu Vaccines After Low Turnout http://bit.ly/OZnr1";;;;"5599357616";https://twitter.com/wisree/status/5599357616
wisree;2009-11-10 21:07;0;0;"US sick leave policy toughens swine flu fight: senator http://bit.ly/4fCgzQ";;;;"5599356801";https://twitter.com/wisree/status/5599356801
health_issues;2009-11-10 21:07;0;0;"Troops in Afghanistan take on swine flu : Hundreds of Afghan and international troops already battling a rising .. http://bit.ly/sFHTe";;;;"5599354398";https://twitter.com/health_issues/status/5599354398
SarahInTx;2009-11-10 21:07;0;0;"Swine flu news from around the world http://bit.ly/1ERWhe Heiny Flu Update";;;;"5599348300";https://twitter.com/SarahInTx/status/5599348300
realreporter;2009-11-10 21:07;0;0;"EIGHT MORE Dead in B.C. from Swine Flu and 202 hospitalized as virus illness intensifies. http://bit.ly/1eW8cw";;;;"5599347707";https://twitter.com/realreporter/status/5599347707
johnjordan;2009-11-10 21:07;1;0;"@ZaneDeFazio you should be careful & wear a mask around @LisaBarone #swineflu :x";;@ZaneDeFazio @LisaBarone;#swineflu;"5599338989";https://twitter.com/johnjordan/status/5599338989
NatalyBacon;2009-11-10 21:07;0;0;"Swine flu shows resistance to Tamiflu http://oskonews.com/2963.html";;;;"5599338589";https://twitter.com/NatalyBacon/status/5599338589
swineflumania;2009-11-10 21:07;0;0;"PIG AIDS! #swineflu School attendance up; has swine flu peaked? - Warwick Beacon: School att.. http://bit.ly/3Mdf22";;;#swineflu;"5599337338";https://twitter.com/swineflumania/status/5599337338
ContactoLatino;2009-11-10 21:07;0;0;"NYC Expands Free Swine Flu Vaccines After Low Turnout - Bloomberg - GN http://bit.ly/32BA1W";;;;"5599333243";https://twitter.com/ContactoLatino/status/5599333243
Daplayboyfanboy;2009-11-10 21:07;0;0;"I think my Supervisor Has Swine Flu he just coughed and sounds Horrible. He comes near me & I'm gonna smack his face I don't like'em anyhow";;;;"5599332405";https://twitter.com/Daplayboyfanboy/status/5599332405
SwineFluNewsORG;2009-11-10 21:06;0;0;"U S H1N1 Vaccine Output Rising Quickly Sanofi CEO http://tinyurl.com/ylxepg7 #swineflu #virus";;;#swineflu #virus;"5599331340";https://twitter.com/SwineFluNewsORG/status/5599331340
luverbuggbaby;2009-11-10 21:06;0;0;"All the kids are now "immune" and should not get the swine flu this season. Phew.";;;;"5599330936";https://twitter.com/luverbuggbaby/status/5599330936
twoofnews;2009-11-10 21:06;0;0;"OregonLive.com News: More ferrets in Oregon get swine flu from owners: Nine ferrets in Roseburg got sick after two k... http://bit.ly/36BHgw";;;;"5599317965";https://twitter.com/twoofnews/status/5599317965
SwineFluUpdate;2009-11-10 21:06;0;0;"Swine Flu Manitoba marks first death in second wave of swine flu - The Canadian Press: Manitoba marks .. http://bit.ly/D35Fk";;;;"5599317963";https://twitter.com/SwineFluUpdate/status/5599317963
breakingflunews;2009-11-10 21:06;0;0;"breakingflunews.com H1N1 " swine flu " vaccine distribution moves to SMDC Wednesday - FOX 21 O.. http://bit.ly/utnNV";;;;"5599316654";https://twitter.com/breakingflunews/status/5599316654
breakingflunews;2009-11-10 21:06;0;0;"breakingflunews.com Swine Flu Clinic Planned For Saturday - Hartford Courant: Palm Beach Pos.. http://bit.ly/27ynyd";;;;"5599315310";https://twitter.com/breakingflunews/status/5599315310
SwineFluUpdate;2009-11-10 21:06;0;0;"Swine Flu Swine flu shot now available to Ontario's first-responders - Toronto Sun: Swine flu shot now.. http://bit.ly/23gnlh";;;;"5599315050";https://twitter.com/SwineFluUpdate/status/5599315050
markmatthews;2009-11-10 21:05;0;0;"Forget the swine flu . The real pandemic will be the bad case of COD flu that will be affecting workplaces this month... year... decade.";;;;"5599302378";https://twitter.com/markmatthews/status/5599302378
swineflu2;2009-11-10 21:05;0;0;"#swineflu Swine flu widespread in Rhode Island - Examiner.com: Examiner.comSwine flu widespread in Rho.. http://bit.ly/3LMS4Z";;;#swineflu;"5599295054";https://twitter.com/swineflu2/status/5599295054
swineflu2;2009-11-10 21:05;0;0;"#swineflu Swine flu kills 65-year-old Boston man - Boston Globe: Dothan EagleSwine flu kills 65-year-o.. http://bit.ly/1at9vA";;;#swineflu;"5599293245";https://twitter.com/swineflu2/status/5599293245
stephcgonzalez;2009-11-10 21:05;0;0;"took a fantastic shower, got dressed and did my makeup. feel like a new woman! take that, SWINE FLU !";;;;"5599291565";https://twitter.com/stephcgonzalez/status/5599291565
stopflunews;2009-11-10 21:05;0;0;"School attendance up; has swine flu peaked? - Warwick Beacon http://bit.ly/3Mdf22";;;;"5599284197";https://twitter.com/stopflunews/status/5599284197
AIDigest;2009-11-10 21:04;0;0;"Iran: Swine flu in the region - http://shar.es/akUAN";;;;"5599278582";https://twitter.com/AIDigest/status/5599278582
TheCullmanTimes;2009-11-10 21:04;1;0;"The Cullman Health Department will host H1N1 swine flu vaccine clinics Thursday - Friday from 8 a.m. - 4 p.m., or until vaccines run out.";;;;"5599270083";https://twitter.com/TheCullmanTimes/status/5599270083
LivingSafely;2009-11-10 21:04;0;0;"Sweden/Stockholm: ECDC reports total of 6,094 worldwide Swine Flu deaths; has stopped reporting mere illnesses: http://bit.ly/3ko8Ta";;;;"5599266617";https://twitter.com/LivingSafely/status/5599266617
juniperala;2009-11-10 21:04;0;0;"Bird flu, Swine flu , what's next, Feline flu? Wel I do kiss my kitties a lot, they're so frigging cute. #fb";;;#fb;"5599261657";https://twitter.com/juniperala/status/5599261657
Healthy_Livin;2009-11-10 21:04;0;0;"Swine flu blog: Wishing you a swine-flu free Christmas http://tinyurl.com/yh7qzhu";;;;"5599259151";https://twitter.com/Healthy_Livin/status/5599259151
jennelsonlane;2009-11-10 21:03;0;0;"BOTH my parents now have the swine flu . It's a mess over there.";;;;"5599252441";https://twitter.com/jennelsonlane/status/5599252441
swinefluh1n1;2009-11-10 21:03;0;0;""Global consultation on public health research agenda for influenza" http://tinyurl.com/ydurbke #swineflu #H1N1";;;#swineflu #H1N1;"5599247680";https://twitter.com/swinefluh1n1/status/5599247680
KissMissYve;2009-11-10 21:03;1;0;"get ur swine flu injection, its gonna hurt tho!! http://twitpic.com/p15at";;;;"5599243841";https://twitter.com/KissMissYve/status/5599243841
MommaAsh;2009-11-10 21:02;0;0;"@dr w/Rylan :( someone I know just came out & her kid who is Ry's age has swine flu ...bleh!";;@dr;;"5599220206";https://twitter.com/MommaAsh/status/5599220206
daytradingguru;2009-11-10 21:02;0;0;"Flu Spray vs. Shot: Is One Better?: My four-year-old got her swine flu vaccination yesterday. At the time, I wa.. http://bit.ly/FLRpR";;;;"5599216508";https://twitter.com/daytradingguru/status/5599216508
barbhaynes;2009-11-10 21:02;0;0;"RT @MattTheGr8 Is it wrong that every time I see someone in a swine flu mask, I just want to go over and cough into their eye sockets?";;@MattTheGr8;;"5599212302";https://twitter.com/barbhaynes/status/5599212302
TheTopMarketer;2009-11-10 21:02;0;0;"Richland County now offering swine flu mist — what you need to know: You shouldn't get the mist vaccine if .. http://tinyurl.com/ydrrstn";;;;"5599209866";https://twitter.com/TheTopMarketer/status/5599209866
AIDigest;2009-11-10 21:02;0;0;"H1N1 swine flu kills eight more B.C. residents in the past week - http://shar.es/akUwz";;;;"5599206320";https://twitter.com/AIDigest/status/5599206320
healthylife1;2009-11-10 21:01;0;0;"Health News about FACTBOX-Measures to fight H1N1 swine flu in ...: ... Here are some details about measures tak.. http://bit.ly/1QBCPs";;;;"5599201033";https://twitter.com/healthylife1/status/5599201033
daniharding;2009-11-10 21:01;0;0;"And since we don't have swine flu we will go to the park and not spread it";;;;"5599199516";https://twitter.com/daniharding/status/5599199516
charjoe;2009-11-10 21:01;0;0;"Have recd note from docs re swine flu jab. What do people think. Seems v quick and untested to me!";;;;"5599198322";https://twitter.com/charjoe/status/5599198322
Happy_Dais;2009-11-10 21:01;0;0;"#thingsthatwontstopGodzilla Swine Flu";;;#thingsthatwontstopGodzilla;"5599196501";https://twitter.com/Happy_Dais/status/5599196501
epispider;2009-11-10 21:01;0;0;"Boston man dies from swine flu (http://is.gd/4S1QZ)";;;;"5599194506";https://twitter.com/epispider/status/5599194506
swinefluh1n1;2009-11-10 21:01;0;0;""FDA commissioner thanks nation's doctors for work in fighting influenza ..." http://tinyurl.com/ygy46ae #swineflu #H1N1";;;#swineflu #H1N1;"5599194124";https://twitter.com/swinefluh1n1/status/5599194124
wmpitt;2009-11-10 21:01;0;0;"Apparently pH levels and alkalising are a good defence against Swine Flu - see Dr. Robert Young’s Articles of Health http://ihid.us?i=son";;;;"5599192130";https://twitter.com/wmpitt/status/5599192130
H1N1SafeSchool;2009-11-10 21:01;0;0;"AllClear! School attendance up; has swine flu peaked? http://bit.ly/pRMmy";;;;"5599185063";https://twitter.com/H1N1SafeSchool/status/5599185063
