username;date;retweets;favorites;text;geo;mentions;hashtags;id;permalink
Nottingham_Post;2009-06-30 13:16;0;0;"A PUPIL at Chilwell Comprehensive School is the latest in Notts to be diagnosed with swine flu . They have been a.. http://tinyurl.com/mc95jb";;;;"2403244871";https://twitter.com/Nottingham_Post/status/2403244871
atra_intelexis;2009-06-30 13:16;0;0;"Six new cases of swine flu as fears grow over drug http://tinyurl.com/mbssun";;;;"2403243532";https://twitter.com/atra_intelexis/status/2403243532
datmattmiles;2009-06-30 13:16;0;0;"" Swine flu parties"? http://news.bbc.co.uk/1/hi/health/8125191.stm Wow. Crazy. o_O";;;;"2403240653";https://twitter.com/datmattmiles/status/2403240653
SwineFluNewsAU;2009-06-30 13:16;0;0;"Swine flu fears strike Wimbledon as cases rise http://tinyurl.com/leo68d";;;;"2403238967";https://twitter.com/SwineFluNewsAU/status/2403238967
SasaWrites;2009-06-30 13:16;0;0;"Anyone for a swineflu party at mine this weekend? Thought not. http://news.bbc.co.uk/1/hi/health/8125191.stm";;;;"2403236980";https://twitter.com/SasaWrites/status/2403236980
SwineFlu_news;2009-06-30 13:15;0;0;"Swine flu victim had 'been through a lot' http://t.love.com/227701055";;;;"2403223027";https://twitter.com/SwineFlu_news/status/2403223027
MichaelTyson;2009-06-30 13:14;0;0;"Sitting down to lager and fish and chips; booked ourselves a ticket to Chicago at the theatre, and suffering slightly from a cold/ swine flu .";;;;"2403215126";https://twitter.com/MichaelTyson/status/2403215126
SwineFluTicker;2009-06-30 13:13;0;0;"Study charts swine flu 's spread through air travel | San Francisco ...: In a startling measure of just how w.. http://bit.ly/m0zQ";;;;"2403209118";https://twitter.com/SwineFluTicker/status/2403209118
SwineFluTicker;2009-06-30 13:13;0;0;"Three more swine flu cases detected in South Africa | Sindh Today ...: Pretoria, June 30 (IANS) Three more cases.. http://bit.ly/pCI8o";;;;"2403208606";https://twitter.com/SwineFluTicker/status/2403208606
UHSFT;2009-06-30 13:13;0;0;"Official statement about maternity worker with swine flu including what to do if you're worried http://tiny.cc/QnXqm";;;;"2403207017";https://twitter.com/UHSFT/status/2403207017
mebuell;2009-06-30 13:13;0;0;"Nursing grads to help Manitoba reserves in swine flu crisis http://bit.ly/yA5Z5 (Toronto Star)";;;;"2403204285";https://twitter.com/mebuell/status/2403204285
thebsap;2009-06-30 13:12;0;0;"i have a bad cough, so i made my way over to webmd...i now have emphysema, bronchitis, tuberculosis and swine flu . who wants my stuff?";;;;"2403194653";https://twitter.com/thebsap/status/2403194653
SwineFluNewsEU;2009-06-30 13:11;0;0;"U.S. considers large swine flu vaccination program http://tinyurl.com/ltqf3o";;;;"2403188966";https://twitter.com/SwineFluNewsEU/status/2403188966
isciences;2009-06-30 13:10;0;0;"RT @healthmap : Denmark: first case of drug-resistant H1N1 identified http://bit.ly/2rPOo #h1n1 #swineflu";;@healthmap;#h1n1 #swineflu;"2403179459";https://twitter.com/isciences/status/2403179459
st_swineflu;2009-06-30 13:10;0;0;"Swine Flu Parties Are A Bad Idea (James_DCFC@The Football Forum) #swineflu http://p.boardtracker.com/1604283834";;@The;#swineflu;"2403171025";https://twitter.com/st_swineflu/status/2403171025
SwineFluNewsORG;2009-06-30 13:09;0;0;"Swine flu girl, 6, 'had suffered' http://tinyurl.com/l38h7m";;;;"2403168473";https://twitter.com/SwineFluNewsORG/status/2403168473
bgoulet;2009-06-30 13:09;0;0;"Great day to Fly Australia's Flying Doctors Target Aborigines Hit by Swine Flu: By Ed Johnso.. http://bit.ly/lLBxr";;;;"2403168257";https://twitter.com/bgoulet/status/2403168257
JenNorris;2009-06-30 13:07;0;0;"My niece came home from summer camp in Denver with swine flu . She'll be fine but the family is quarantined for a week.";;;;"2403149139";https://twitter.com/JenNorris/status/2403149139
cesarcd;2009-06-30 13:07;0;0;"Health- Swine flu girl, 6, 'had suffered' - BBC News: Mirror.co.ukSwine flu girl, 6, 'had suf.. http://bit.ly/JyqF4";;;;"2403141493";https://twitter.com/cesarcd/status/2403141493
libraryshade;2009-06-30 13:07;0;0;"my roommate probably has swine flu and I'm the caretaker by default. Thenmy laptop has low battery and I have a paper due in 24h. FML";;;;"2403140122";https://twitter.com/libraryshade/status/2403140122
mygreg;2009-06-30 13:06;0;0;"i guess you are a twitter spam @SWINE_FLU _INFO1 no ? well nice to meet you ! be kind with me ! bye bye !";;@SWINE_FLU;;"2403131313";https://twitter.com/mygreg/status/2403131313
trackswineflu;2009-06-30 13:05;0;0;"[News] Swine flu linked to isle death: By Mary Adamski The first swine flu death in the state and the hosp.. http://tr.im/qiMQ";;;;"2403124851";https://twitter.com/trackswineflu/status/2403124851
birminghampost;2009-06-30 13:05;0;0;"Birmingham swine flu girl suffered a lot in her short life, father tells inquest http://snurl.com/l6b5z";;;;"2403119947";https://twitter.com/birminghampost/status/2403119947
travel_hack;2009-06-30 13:05;0;0;"I'm at home with some mild form of swine flu . Messages of symphathy to maferguson@ttglive.com";;@ttglive;;"2403118701";https://twitter.com/travel_hack/status/2403118701
SwineFluNewsNZ;2009-06-30 13:04;0;0;"Swine flu : studious in complete care http://tinyurl.com/ksmxks";;;;"2403113644";https://twitter.com/SwineFluNewsNZ/status/2403113644
SwineFluNewsUSA;2009-06-30 13:04;0;0;"Tests endorse Tri-Citian has swine flu http://tinyurl.com/mkjd4w";;;;"2403113364";https://twitter.com/SwineFluNewsUSA/status/2403113364
CelesteHarned;2009-06-30 13:04;0;0;"UK Parents urged not to take kids to " swine flu parties" http://bit.ly/6IBN9";;;;"2403109522";https://twitter.com/CelesteHarned/status/2403109522
Observer_Owl;2009-06-30 13:04;0;0;"West Hertfordshire is a swine flu hot spot, says the Government http://twurl.nl/txq3fx";;;;"2403108286";https://twitter.com/Observer_Owl/status/2403108286
Dwight_KSchrute;2009-06-30 13:04;0;3;"I am demanding the swine flu vaccine! It contains self replicating hydrochloric acid producing nano-bots just like The Blob!";;;;"2403107583";https://twitter.com/Dwight_KSchrute/status/2403107583
melbuckpitt;2009-06-30 13:03;0;0;"Daughter and boyfriend have been quarantined with suspected Swine Flu . Hope that it is no more than the doctor being prudent.";;;;"2403105530";https://twitter.com/melbuckpitt/status/2403105530
FrankieHiggin3;2009-06-30 13:02;0;0;"Bad medicine: Doctors warn against throwing swine flu parties http://www.gasta.co.uk/s/an9";;;;"2403088897";https://twitter.com/FrankieHiggin3/status/2403088897
swinflunews;2009-06-30 13:01;0;0;"Michael Jackson dies because of swine flu given by Obama http://ff.im/-4Coxu";;;;"2403079451";https://twitter.com/swinflunews/status/2403079451
WBFO;2009-06-30 13:01;0;0;"The Erie County Health Commissioner discusses the swine flu outbreak, which has taken the lives of two school children, at 9:30AM on WBFO.";;;;"2403079175";https://twitter.com/WBFO/status/2403079175
godwingrech;2009-06-30 13:01;0;0;"Is Nicola Roxon not washing her hair as a form of immunity building against swine flu ? Just asking.";;;;"2403077588";https://twitter.com/godwingrech/status/2403077588
mgfamiliarnet;2009-06-30 13:00;0;0;"RT @gripenet : "Virologists fear swine flu will soon pick up resistance by merging with seasonal H1N1 flu, perhaps in the Southern Hemisphere";;@gripenet;;"2403064924";https://twitter.com/mgfamiliarnet/status/2403064924
SwineFlu_news;2009-06-30 13:00;0;0;"California continues to have widespread flu activity, a rare occurrence as July approaches http://t.love.com/227710179";;;;"2403063268";https://twitter.com/SwineFlu_news/status/2403063268
web9media;2009-06-30 13:00;0;0;"'British kids in swine flu parties' ( http://bit.ly/17fo6C )";;;;"2403062596";https://twitter.com/web9media/status/2403062596
satcaweb;2009-06-30 12:59;0;0;"Only a flight away? Swine flu followed route map, Reuters, EUA http://www.alertnet.org/thenews/newsdesk/N2990339.htm (Mon, 29 Jun 2009 2 ...";;;;"2403061731";https://twitter.com/satcaweb/status/2403061731
swineflunews24;2009-06-30 12:59;0;0;"Kenya works to stem spread of Swine Flu : Capital FM In mid-June, the WHO raised the pandemic alert status for Sw.. http://bit.ly/HmHUW";;;;"2403059241";https://twitter.com/swineflunews24/status/2403059241
swineflunews24;2009-06-30 12:59;0;0;"Swine flu linked to isle death: By Mary Adamski The first swine flu death in the state and the hospitalization o.. http://bit.ly/YwgMo";;;;"2403058727";https://twitter.com/swineflunews24/status/2403058727
NorthEastTweets;2009-06-30 12:59;0;0;"Curious about: "BBC NEWS | Health | Swine flu parties 'a bad idea'" ( http://bit.ly/ClHUv )";;;;"2403057430";https://twitter.com/NorthEastTweets/status/2403057430
projecthamster;2009-06-30 12:58;0;0;"A friend, who shall remain nameless, has the vogue illness. Yes, I finally have a friend with Swine Flu after all the hype.";;;;"2403051193";https://twitter.com/projecthamster/status/2403051193
rssfever;2009-06-30 12:58;0;0;"Study charts swine flu 's spread through air travel | Home >> Other ... - http://bit.ly/cw022";;;;"2403043695";https://twitter.com/rssfever/status/2403043695
rssfever;2009-06-30 12:58;0;0;"Hawaii Has First Death Linked to Swine Flu | KGMB9 News Hawaii | (KG - http://bit.ly/uDOQ8";;;;"2403043343";https://twitter.com/rssfever/status/2403043343
traddr;2009-06-30 12:57;0;0;"VICL Vical says swine flu vaccine works in mice, moving well in pre mrkt";;;;"2403040583";https://twitter.com/traddr/status/2403040583
paultakahashi;2009-06-30 12:57;0;0;"The swine flu deaths just keep getting closer - first one in Bergen County, sixth in NJ, just reported. http://bit.ly/bd3TX";;;;"2403040286";https://twitter.com/paultakahashi/status/2403040286
edyong209;2009-06-30 12:57;0;0;"#wcsj Wikipedia swine flu coverage cited as "living story". Why don't news organisations do the same?";;;#wcsj;"2403039989";https://twitter.com/edyong209/status/2403039989
13wmaznews;2009-06-30 12:57;0;0;"Health officials at the CDC have confirmed a case of swine flu that is resistant to Tamiflu. http://tr.im/qiJv";;;;"2403035810";https://twitter.com/13wmaznews/status/2403035810
SwineFluNewsSG;2009-06-30 12:57;0;0;"Thailand reports initial dual swine flu deaths http://tinyurl.com/lamsjz";;;;"2403035673";https://twitter.com/SwineFluNewsSG/status/2403035673
suffolkcc;2009-06-30 12:56;0;0;"1 confirmed case of swine flu and several more suspected - St Albans RC High School, Ipswich closed until 7 July: http://tinyurl.com/lze5h3";;;;"2403032157";https://twitter.com/suffolkcc/status/2403032157
SwineFluNewsEU;2009-06-30 12:56;0;0;"Wimbledon officials fool around down swine flu fears http://tinyurl.com/nr5ddt";;;;"2403027730";https://twitter.com/SwineFluNewsEU/status/2403027730
ashishkulkarni;2009-06-30 12:55;0;0;"RT @DiabetesUK : Latest swine flu advice - Diabetes UK http://tinyurl.com/mvzx6y";;@DiabetesUK;;"2403020252";https://twitter.com/ashishkulkarni/status/2403020252
dennisRay;2009-06-30 12:55;0;0;"New blog post: Hawaii has 1st swine flu death, of ailing patient - The Associated Press http://bit.ly/sAQcD";;;;"2403014682";https://twitter.com/dennisRay/status/2403014682
srukrish;2009-06-30 12:54;0;0;"RT @ramyakannan One more case of Swine Flu in Chennai. TN toll goes up to 9.";;@ramyakannan;;"2403009895";https://twitter.com/srukrish/status/2403009895
raunakms;2009-06-30 12:54;0;0;"RT: @NewsFromNepal : Nepalnews: Govt steps up surveillance to detect symptoms of Swine flu across country http://tr.im/qhU1";;@NewsFromNepal;;"2403007228";https://twitter.com/raunakms/status/2403007228
SwineFluNewsIN;2009-06-30 12:54;0;0;"India strengthens swine flu facilities, annals 104 cases http://tinyurl.com/nf4tfw";;;;"2403007072";https://twitter.com/SwineFluNewsIN/status/2403007072
Rambhai;2009-06-30 12:53;0;0;"Number of Swine Flu cases goes up to 104 in India: Swine Flu is on the rise in India. With 11 fresh cases report.. http://tinyurl.com/mhlbep";;;;"2403000629";https://twitter.com/Rambhai/status/2403000629
plymouth;2009-06-30 12:53;0;0;"Two have swine flu on Plymouth construction site http://ff.im/-4Cnzx";;;;"2403000412";https://twitter.com/plymouth/status/2403000412
wombat;2009-06-30 12:53;0;0;"is happy to know that the coworker that sits next to her coaches a swim team and all on the team have been diagnosed w/ swine flu . Nice. :)";;;;"2402995972";https://twitter.com/wombat/status/2402995972
swineflu2;2009-06-30 12:52;0;0;"#swineflu Vical Says Swine Flu Vaccine Works In Mice - FOXBusiness: Vical Says Swine Flu Vaccine Works .. http://tinyurl.com/mc4thq";;;#swineflu;"2402993627";https://twitter.com/swineflu2/status/2402993627
SwineFluNewsPH;2009-06-30 12:52;0;0;"Saudi swine flu swell puts Mideast over 600 http://tinyurl.com/nrkyy6";;;;"2402990942";https://twitter.com/SwineFluNewsPH/status/2402990942
Swine_Virus;2009-06-30 12:52;0;0;"Swine flu : lab accident may have caused pandemic - Telegraph.co.uk http://bit.ly/UvtvK";;;;"2402986545";https://twitter.com/Swine_Virus/status/2402986545
Swine_Virus;2009-06-30 12:50;0;0;"New Jersey reports 6th swine flu death - Philadelphia Inquirer http://bit.ly/CuBve";;;;"2402969294";https://twitter.com/Swine_Virus/status/2402969294
ramyakannan;2009-06-30 12:49;0;0;"One more case of Swine Flu in Chennai. TN toll goes up to 9.";;;;"2402961070";https://twitter.com/ramyakannan/status/2402961070
nilsafeeds;2009-06-30 12:49;0;0;"Google News: Swine flu girl, 6, 'had suffered' - BBC News: BBC NewsSwine flu girl, 6, 'h.. http://tinyurl.com/loa2qr";;;;"2402957999";https://twitter.com/nilsafeeds/status/2402957999
jamesmlucas;2009-06-30 12:49;0;0;"Seriously: how dumb are these people?! http://bit.ly/r9FSZ - Swine flu parties 'a bad idea'";;;;"2402956146";https://twitter.com/jamesmlucas/status/2402956146
kimthewriter;2009-06-30 12:48;0;0;"Doctors warn against " swine flu parties." http://bit.ly/U0yt7";;;;"2402946299";https://twitter.com/kimthewriter/status/2402946299
bumperboy;2009-06-30 12:47;0;0;"Swine Flu Kenya works to stem spread of Swine Flu http://bit.ly/turKj";;;;"2402944014";https://twitter.com/bumperboy/status/2402944014
bumperboy;2009-06-30 12:47;0;0;"Swine Flu Swine flu linked to isle death http://bit.ly/aEWwG";;;;"2402943588";https://twitter.com/bumperboy/status/2402943588
mg_health;2009-06-30 12:47;0;0;"Swine flu girl's inquest opened: An inquest has been opened into the death of a six-year-old girl who died after.. http://tinyurl.com/mn4xxt";;;;"2402940129";https://twitter.com/mg_health/status/2402940129
mg_health;2009-06-30 12:47;0;0;"Girl who became third swine flu death named: Sameerah, who had underlying health problems, died at Birmingham Ch.. http://tinyurl.com/nykaf9";;;;"2402939320";https://twitter.com/mg_health/status/2402939320
OntarioRebELLEs;2009-06-30 12:47;0;1;"The Guardian: @jessyee on Canada's failure to protect First Nations from swine flu - http://twurl.nl/oax6w0 (via @schoodic & @CIF_Jessica)";;@jessyee @schoodic @CIF_Jessica;;"2402935093";https://twitter.com/OntarioRebELLEs/status/2402935093
UHSFT;2009-06-30 12:47;0;0;"Don't forget to visit http://www.nhs.uk for loads of helpful info and advice about swine flu including symptom checker";;;;"2402934766";https://twitter.com/UHSFT/status/2402934766
CrisisWatch;2009-06-30 12:46;0;0;"*EMM Disease Alerts* English schoolgirl with swine flu dies http://tinyurl.com/m8uapf";;;;"2402930507";https://twitter.com/CrisisWatch/status/2402930507
CrisisWatch;2009-06-30 12:46;0;0;"*EMM Disease Alerts* Swine Flu Update Issued On Monday 29 June 2009, Wales http://tinyurl.com/koh5ko";;;;"2402930163";https://twitter.com/CrisisWatch/status/2402930163
ramorel;2009-06-30 12:45;0;0;"Girl, 9, dies of swine flu as UK cases jump: A nine-year-old girl has died in Britain from the H1N1 virus, commo.. http://bit.ly/dVWmA";;;;"2402919316";https://twitter.com/ramorel/status/2402919316
lordredrock;2009-06-30 12:45;0;0;"Study charts swine flu 's spread through air travel: ATLANTA (AP) — In a startling measure of just how widely.. http://tinyurl.com/nxqrek";;;;"2402918890";https://twitter.com/lordredrock/status/2402918890
lordredrock;2009-06-30 12:45;0;0;"2 more swine flu deaths reported; official says victims had health ...: Underlying health problems might have pl.. http://tinyurl.com/m26ng9";;;;"2402918012";https://twitter.com/lordredrock/status/2402918012
lordredrock;2009-06-30 12:45;0;0;"Resistance to swine flu drug found: The first swine flu patient to show resistance to the anti-viral drug Tamifl.. http://tinyurl.com/lr83jx";;;;"2402916918";https://twitter.com/lordredrock/status/2402916918
SwineFlu_news;2009-06-30 12:45;0;0;"Swine flu girl, 6, 'had suffered' http://t.love.com/227707039";;;;"2402915753";https://twitter.com/SwineFlu_news/status/2402915753
AccessSportsPgh;2009-06-30 12:45;0;0;"Swine flu linked to isle death: By Mary Adamski The first swine flu death in the state and the hospitalization o.. http://bit.ly/qNR0y";;;;"2402915312";https://twitter.com/AccessSportsPgh/status/2402915312
doctorbiotech;2009-06-30 12:44;0;0;"r they serious ?? RT @Foxy617 : Swine flu parties? Really??!!! http://tinyurl.com/lbevgh #swineflu";;@Foxy617;#swineflu;"2402909084";https://twitter.com/doctorbiotech/status/2402909084
AIDigest;2009-06-30 12:42;0;0;"Roche Sees First Case of Tamiflu-Resistant #Swine Flu -- http://shar.es/uTfi";;;#Swine;"2402894436";https://twitter.com/AIDigest/status/2402894436
That_dude_Xito;2009-06-30 12:41;0;0;"Working. Feeling a lil sick due to the change in weather (hot here, cold in Peru). NO IT'S NOT SWINE FLU ! Lol. Should be at 100% by Friday.";;;;"2402886987";https://twitter.com/That_dude_Xito/status/2402886987
craftyterri;2009-06-30 12:41;0;0;"Swine flu pandemic 'caused by accidental leak from laboratory': Daily Mail By Daily Mail Reporter The sw.. http://bit.ly/634rm";;;;"2402882932";https://twitter.com/craftyterri/status/2402882932
AimeeLudars;2009-06-30 12:41;0;0;"http://yfrog.com/18d0dj it's no wonder swine flu is spreading given that NHS toilets are left in this state. Urghhjj";;;;"2402879533";https://twitter.com/AimeeLudars/status/2402879533
AlayaDjamaludin;2009-06-30 12:40;0;0;"RT @AmoriCitananda 6 peoples more in Bali has been infected by swine flu .. Bless me, dear God (Aduh, gmn nih?!)";;@AmoriCitananda;;"2402877211";https://twitter.com/AlayaDjamaludin/status/2402877211
Web20_Dev;2009-06-30 12:40;0;0;"Swine Flu Update Issued On Monday 29 June 2009, Wales: -- 17 confirmed cases in Wales, with 0 new cases. -- Ther.. http://bit.ly/LguuR";;;;"2402876128";https://twitter.com/Web20_Dev/status/2402876128
SwineFluNewsNZ;2009-06-30 12:40;0;0;"Al-Rabeeah briefs WHO experts upon measures opposite swine flu http://tinyurl.com/m73gr3";;;;"2402874542";https://twitter.com/SwineFluNewsNZ/status/2402874542
MDCIII;2009-06-30 12:40;0;0;"Swine Flu parties? Yikes. http://tinyurl.com/lw66mn";;;;"2402871205";https://twitter.com/MDCIII/status/2402871205
swinflunews;2009-06-30 12:40;0;0;"[Video]Michael Jackson dies because of swine flu given by Obama - http://tinyurl.com/lwhp78";;;;"2402870464";https://twitter.com/swinflunews/status/2402870464
Libbyextra;2009-06-30 12:39;0;0;"Swine Flu parties ~ what ever next?! http://bit.ly/pAWhs";;;;"2402869377";https://twitter.com/Libbyextra/status/2402869377
swineflucases;2009-06-30 12:39;0;0;"Vical says swine flu vaccine works in mice - MarketWatch - Vical says swine flu vaccine works in miceMarketWatchLON... http://ow.ly/15Guvf";;;;"2402869338";https://twitter.com/swineflucases/status/2402869338
SwineFluNewsEU;2009-06-30 12:39;0;0;"Swine flu claims initial hold up in Spain http://tinyurl.com/lq6kqb";;;;"2402866413";https://twitter.com/SwineFluNewsEU/status/2402866413
bbc_news;2009-06-30 12:39;0;0;"Swine flu girl, 6, 'had suffered' http://bit.ly/6P0Cy";;;;"2402865661";https://twitter.com/bbc_news/status/2402865661
dannywhitehouse;2009-06-30 12:39;0;0;"RT @SWINE_FLU _VRUS Deadly pneumonia in swine-flu outbreak hit young hard (source: CBC) http://bit.ly/lJAOs";;@SWINE_FLU;;"2402860780";https://twitter.com/dannywhitehouse/status/2402860780
SWEveningPost;2009-06-30 12:38;0;0;"Hospital worker contracts swine flu : A SECOND healthcare worker at a hospital has caught swine flu , it was revea.. http://tinyurl.com/mhk32e";;;;"2402858789";https://twitter.com/SWEveningPost/status/2402858789
scaemberley;2009-06-30 12:38;0;0;"Swine flu girl, 6, 'had suffered': An inquest opens into the death of six-year-old girl Sameerah Ahmad who died .. http://bit.ly/RC82n";;;;"2402858427";https://twitter.com/scaemberley/status/2402858427
5minutesperday;2009-06-30 12:38;0;0;"Swine flu girl, 6, 'had suffered' http://u.mavrev.com/ft0y";;;;"2402854096";https://twitter.com/5minutesperday/status/2402854096
AcupunctureGary;2009-06-30 12:38;0;0;"http://bit.ly/BA | Swine Flu Update Issued On Monday 29 June 2009, Wales: -- 17 confirmed case.. http://bit.ly/LguuR";;;;"2402853852";https://twitter.com/AcupunctureGary/status/2402853852
RobMurrayUK;2009-06-30 12:37;0;0;"Swine flu parties 'a bad idea' http://tr.im/qiBj - Idiots. Complete idiots.";;;;"2402849823";https://twitter.com/RobMurrayUK/status/2402849823
cookiebird;2009-06-30 12:37;0;0;"the latest idea for parents is.. swine flu parties chicken pox is one thing but seems to me thats asking for trouble..man flu is bad enough";;;;"2402849821";https://twitter.com/cookiebird/status/2402849821
SWINE_FLU_VRUS;2009-06-30 12:37;0;0;"Swine flu girl's inquest opened - BBC News http://bit.ly/lq0ro";;;;"2402846014";https://twitter.com/SWINE_FLU_VRUS/status/2402846014
Ojibray;2009-06-30 12:37;0;0;"Jessica Yee @jessyee on Canada's swine flu shame and the gov" failure to protect... Read More: http://is.gd/1j5FP";;@jessyee;;"2402845875";https://twitter.com/Ojibray/status/2402845875
H1N1VirusNews;2009-06-30 12:37;0;0;"Drug-Resistant Swine Flu Arises and Then Dies in Danish Patient - Security Management http://cli.gs/VeDu4";;;;"2402843010";https://twitter.com/H1N1VirusNews/status/2402843010
H1N1VirusNews;2009-06-30 12:37;0;0;"Agencies Discussed Swine Flu Plans For Dona Ana County - KFOXtv.com http://cli.gs/30Wte";;;;"2402842747";https://twitter.com/H1N1VirusNews/status/2402842747
H1N1VirusNews;2009-06-30 12:36;0;0;"Australia's Flying Doctors Target Aborigines Hit by Swine Flu - Bloomberg http://cli.gs/PUmRR";;;;"2402842472";https://twitter.com/H1N1VirusNews/status/2402842472
AIDigest;2009-06-30 12:36;0;0;"#Swine Flu: Just the Latest Chapter in a 91-Year Pandemic Era | Wired Science | Wired.com - http://shar.es/uTaP";;;#Swine;"2402842236";https://twitter.com/AIDigest/status/2402842236
CoachPickles;2009-06-30 12:36;0;0;"RT @seanquigley : 6 summer camps in my county have evacuated kids for the swine flu .. It is not dead";;@seanquigley;;"2402840197";https://twitter.com/CoachPickles/status/2402840197
RSS_BBC;2009-06-30 12:36;0;0;"Sports centre shut over swine flu http://bit.ly/3gRudQ";;;;"2402833396";https://twitter.com/RSS_BBC/status/2402833396
pandemicflublog;2009-06-30 12:35;0;0;"Swine flu 'shows drug resistance' (BBC, edited) http://bit.ly/ySdXS";;;;"2402832001";https://twitter.com/pandemicflublog/status/2402832001
pandemicflublog;2009-06-30 12:35;0;0;"Swine flu girl's inquest opened - BBC News http://bit.ly/13AQrI";;;;"2402831483";https://twitter.com/pandemicflublog/status/2402831483
pandemicflublog;2009-06-30 12:35;0;0;"29-6-09 WHO confirms over 70,000 swine flu cases http://bit.ly/uAubN";;;;"2402831150";https://twitter.com/pandemicflublog/status/2402831150
Wonko_thesane;2009-06-30 12:35;0;0;"Girl, 6, who died after contracting swine flu was born with 'extremely rare' disease http://kl.am/146G";;;;"2402827209";https://twitter.com/Wonko_thesane/status/2402827209
ianmbuckley;2009-06-30 12:35;0;0;"http://news.bbc.co.uk/1/hi/health/8125191.stm Swine Flu Parties? What!?!? Whaaaat?!?! Ah my brain. Gibbergibbergibber....";;;;"2402824752";https://twitter.com/ianmbuckley/status/2402824752
newsticker;2009-06-30 12:34;0;0;"Swine flu detected at Argentina pig farm - guardian.co.uk http://tinyurl.com/nef2pv";;;;"2402821546";https://twitter.com/newsticker/status/2402821546
YourDNAknows;2009-06-30 12:34;0;0;"2 more swine flu deaths reported; official says victims had health ... http://ow.ly/15Gunf";;;;"2402817416";https://twitter.com/YourDNAknows/status/2402817416
YourDNAknows;2009-06-30 12:34;0;0;"Kenya works to stem spread of Swine Flu http://ow.ly/15Gund";;;;"2402817231";https://twitter.com/YourDNAknows/status/2402817231
dailyecho;2009-06-30 12:34;0;0;"Swine flu in city hospital http://bit.ly/TWa7r";;;;"2402816615";https://twitter.com/dailyecho/status/2402816615
cruick;2009-06-30 12:33;0;0;"Wondering who R the ppl that thought up the idea of a ' swine flu party' count me out. http://bit.ly/lGErt";;;;"2402811691";https://twitter.com/cruick/status/2402811691
SwineFluNewsIE;2009-06-30 12:33;0;0;"British licentiate dies from swine flu http://tinyurl.com/m7vkx6";;;;"2402811147";https://twitter.com/SwineFluNewsIE/status/2402811147
PlymouthHerald;2009-06-30 12:33;0;0;"Two have swine flu on Plymouth construction site: TWO people have been sent home after being confirmed with swin.. http://snipurl.com/l69ig";;;;"2402809299";https://twitter.com/PlymouthHerald/status/2402809299
bbc_news;2009-06-30 12:32;0;0;"Sports centre shut over swine flu http://news.bbc.co.uk/1/hi/england/shropshire/8126556.stm";;;;"2402801078";https://twitter.com/bbc_news/status/2402801078
breakingnewsie;2009-06-30 12:32;0;0;"WORLD: English schoolgirl with swine flu dies: An English schoolgirl with underlying health problems has d.. http://tinyurl.com/mb4gg9";;;;"2402797135";https://twitter.com/breakingnewsie/status/2402797135
AnimalWelfareIC;2009-06-30 12:31;0;0;"Researchers Describe History Of Swine Flu And Warn About Using Extinct Viruses: MedicalNewsToday.com -- In a lea.. http://tinyurl.com/moo3pc";;;;"2402790760";https://twitter.com/AnimalWelfareIC/status/2402790760
gripenet;2009-06-30 12:31;0;0;""Virologists fear swine flu will soon pick up resistance by merging with seasonal H1N1 flu, perhaps in the Southern Hemisphere", NYT";;;;"2402790742";https://twitter.com/gripenet/status/2402790742
