username;date;retweets;favorites;text;geo;mentions;hashtags;id;permalink
News24_7;2009-11-20 21:36;0;0;"Yahoo News: Tamiflu-resistant swine flu cluster reported in NC (AP) : AP - Four North Carolina pat.. http://bit.ly/3AtpnU";;;;"5901116030";https://twitter.com/News24_7/status/5901116030
wfleurant;2009-11-20 21:36;0;0;"Moldovan Soldiers Given Onions To Fight Swine Flu - http://tinyurl.com/yzo655h";;;;"5901114400";https://twitter.com/wfleurant/status/5901114400
loreletti;2009-11-20 21:36;0;0;"RT @Reuters : Swine flu may be peaking in U.S. http://link.reuters.com/gyc82g <--hmmm... I doubt it, hearing lots of ppl getting it lately.";;@Reuters;;"5901113583";https://twitter.com/loreletti/status/5901113583
MarylandFlu;2009-11-20 21:36;0;0;"Talbot County Swine Flu Vaccination MONDAY: 4-7pm, Info: http://www.talbothealth.org/";;;;"5901112932";https://twitter.com/MarylandFlu/status/5901112932
theopolitico;2009-11-20 21:35;0;0;"[Via IW] Aspirin kills 400% more people than H1N1 swine flu : The CDC now reports that nearly 4,000 Amer.. http://bit.ly/6U08aN";;;;"5901108377";https://twitter.com/theopolitico/status/5901108377
postlocal;2009-11-20 21:35;0;0;"A story about young victims of the swine flu outbreak: http://bit.ly/8l7F6W";;;;"5901104844";https://twitter.com/postlocal/status/5901104844
eyzrbrn;2009-11-20 21:35;0;0;"FDA has ordered drweil.com to stop making illegal claims that its Immune Spt Formula could help prevent swine flu /colds http://bit.ly/5KKehM";;;;"5901100621";https://twitter.com/eyzrbrn/status/5901100621
Jamestown502;2009-11-20 21:35;0;0;"RT @msamariie: @jamestown502 .Current Event: the swine flu has officially hit broadway in louisville, ky... better get yur shot! lol (ha ha)";;@msamariie @jamestown502;;"5901098108";https://twitter.com/Jamestown502/status/5901098108
thewellnessteam;2009-11-20 21:35;0;0;"Collin County gets 6500 swine flu doses: She wrote me, saying she can't find a provider to give her a swine.. http://bit.ly/07AhZWc";;;;"5901096060";https://twitter.com/thewellnessteam/status/5901096060
live_h1n1;2009-11-20 21:35;0;0;"RT @Reuters_FluNews: UPDATE 1-UK investigates spread of drug resistant swine flu http://link.reuters.com/wac82g";;@Reuters_FluNews;;"5901094800";https://twitter.com/live_h1n1/status/5901094800
ElPasoCP;2009-11-20 21:35;0;0;"El Paso: Texans can check Web site for swine flu vaccine http://bit.ly/61bzO2";;;;"5901091600";https://twitter.com/ElPasoCP/status/5901091600
yourtraveltips;2009-11-20 21:35;0;0;"msnbc travel: Swine flu puts airlines, travelers in tough spot: As outbreaks of the H1N1 virus inj.. http://rly.cc/Do06n";;;;"5901087441";https://twitter.com/yourtraveltips/status/5901087441
mattstreuli;2009-11-20 21:34;0;0;"Can teddy bears get swine flu ? Bluted is looking worried... or maybe its because its pudsey night";;;;"5901085332";https://twitter.com/mattstreuli/status/5901085332
social_star;2009-11-20 21:34;0;0;"Die sieben Todsünden im Social Media Marketing / Praxistipps ...: Swine Flu Outbreak - All the news about the S.. http://bit.ly/6PclEH";;;;"5901067743";https://twitter.com/social_star/status/5901067743
rebeccastark;2009-11-20 21:33;0;0;"2nd swine flu death in the Yukon. There are only 30,000 of us. This time, it was an otherwise healthy woman under 50.";;;;"5901056120";https://twitter.com/rebeccastark/status/5901056120
bettingexpert;2009-11-20 21:33;0;0;"Barcelona Yaya Toure & Eric Abidal have contracted swine flu ahead of the Bilbao tie http://www.bettingexpert.com/league_preview.php?id=445";;;;"5901047811";https://twitter.com/bettingexpert/status/5901047811
kimber0003;2009-11-20 21:33;0;0;"Tamiflu-resistant swine flu cluster reported in NC (AP) : AP - Four North Carolina patients at a single hospi.. http://bit.ly/4D6YQN";;;;"5901043145";https://twitter.com/kimber0003/status/5901043145
qfromctu;2009-11-20 21:33;0;0;"LOL RT @mparent77772 : While swine flu , or H1N1, gets all the attention, cooties sit back and quietly plot their comeback.";;@mparent77772;;"5901040343";https://twitter.com/qfromctu/status/5901040343
Reuters;2009-11-20 21:33;2;1;"Swine flu may be peaking in U.S. http://link.reuters.com/gyc82g";;;;"5901039270";https://twitter.com/Reuters/status/5901039270
beauteague;2009-11-20 21:33;0;0;"I'm on this plane headed home and I'm pretty sure I just saw a tiny piece of swine flu land in that guy's hair.";;;;"5901038754";https://twitter.com/beauteague/status/5901038754
wexik;2009-11-20 21:32;0;0;"Swine flu may be peaking in U.S. (Reuters) : Reuters - The pandemic of swine flu may be hitting a peak in the.. http://bit.ly/07cLBO8";;;;"5901034362";https://twitter.com/wexik/status/5901034362
Houston_CP;2009-11-20 21:32;0;0;"Houston: Tamiflu-resistant swine flu cluster reported in NC http://bit.ly/07YSC8A";;;;"5901025063";https://twitter.com/Houston_CP/status/5901025063
I_AM_JoeCamel;2009-11-20 21:32;0;0;"Swine flu begins mutation!: Scientists in Norway announced Friday they had detected a mutated form of the swine.. http://bit.ly/6JUdS6";;;;"5901019737";https://twitter.com/I_AM_JoeCamel/status/5901019737
titusmagnus;2009-11-20 21:32;0;0;"Tamiflu-resistant swine flu cluster reported in NC http://tinyurl.com/ygkqj6k";;;;"5901015347";https://twitter.com/titusmagnus/status/5901015347
dudeman718;2009-11-20 21:31;0;0;"RT @AlohaArleen @KimberleKelly @zaibatsu : Just Frickin' Great: Norwegian scientists detect mutated form of swine flu http://bit.ly/8vpRcN";;@AlohaArleen @KimberleKelly @zaibatsu;;"5901009568";https://twitter.com/dudeman718/status/5901009568
Damntorr;2009-11-20 21:31;0;0;"just told my dad that "idontwant to get sick so im not getting the swine flu shot so you can get over that one fast."";;;;"5901003046";https://twitter.com/Damntorr/status/5901003046
swineflupdates;2009-11-20 21:31;0;0;"Northside schools to begin swine flu vaccinations (KENS 5 San Antonio) Swine Flu Updates! http://tinyurl.com/yjg6bk3";;;;"5901002085";https://twitter.com/swineflupdates/status/5901002085
wfleurant;2009-11-20 21:31;0;0;"Swine flu may be peaking in US, reports indicate - Reuters - http://tinyurl.com/ygn8jgp";;;;"5900991969";https://twitter.com/wfleurant/status/5900991969
CasablancaComic;2009-11-20 21:31;0;0;"We have the Swine Flu (from Giant Microbes)! Get your own plush Swine Flu now and give it to a friend! http://bit.ly/0814rwo";;;;"5900991472";https://twitter.com/CasablancaComic/status/5900991472
MixMastaKing;2009-11-20 21:30;0;0;"RUDEBWOY THE SWINE FLU WAS A WALK IN THE PARK COMPARED TO THE ONCOMING OUTBREAK!! http://tinyurl.com/ylh7duj";;;;"5900980918";https://twitter.com/MixMastaKing/status/5900980918
robcollingridge;2009-11-20 21:30;0;0;"http://bit.ly/2Pm1Nn Tamiflu-resistant swine flu spreads 'between patients' - Bugger!";;;;"5900972306";https://twitter.com/robcollingridge/status/5900972306
swinefluh1n1;2009-11-20 21:30;0;0;""USMEF: Pork exports regain momentum, beef struggle 20 Nov 2009" http://tinyurl.com/yh9vsca #swineflu #H1N1";;;#swineflu #H1N1;"5900972060";https://twitter.com/swinefluh1n1/status/5900972060
swinefluh1n1;2009-11-20 21:30;0;0;""Xinhua China News Digest at 16:00 GMT, Nov. 18" http://tinyurl.com/ykrmcga #swineflu #H1N1";;;#swineflu #H1N1;"5900971603";https://twitter.com/swinefluh1n1/status/5900971603
swinefluh1n1;2009-11-20 21:30;0;0;""Monday's biggest gaining and declining stocks" http://tinyurl.com/yg42xlw #swineflu #H1N1";;;#swineflu #H1N1;"5900971113";https://twitter.com/swinefluh1n1/status/5900971113
swineflumania;2009-11-20 21:30;0;0;"PIG AIDS! #swineflu UPDATE 1-UK investigates spread of drug resistant swine flu - Reuters: N.. http://bit.ly/5YJlgh";;;#swineflu;"5900969209";https://twitter.com/swineflumania/status/5900969209
SwineFlu_news;2009-11-20 21:30;0;0;"Illinois Swine Flu Update http://t.love.com/272951258";;;;"5900966535";https://twitter.com/SwineFlu_news/status/5900966535
swineflumania;2009-11-20 21:30;0;0;"PIG AIDS! #swineflu UPDATE 1- Swine flu may be peaking in US, reports indicate - Reuters: WBN.. http://bit.ly/07B7cCE";;;#swineflu;"5900965475";https://twitter.com/swineflumania/status/5900965475
natural_remedie;2009-11-20 21:30;0;0;"Swine flu may be peaking in U.S., reports indicate (source: Reuters): WASHINGTON (Reuters) - The pandemic of sw.. http://bit.ly/093cWFb";;;;"5900965147";https://twitter.com/natural_remedie/status/5900965147
TopNewsStories;2009-11-20 21:29;0;0;"Tamiflu-resistant swine flu cluster reported in NC (AP): AP - Four North Carolina patients at a single hospita... http://bit.ly/72r7HA";;;;"5900961379";https://twitter.com/TopNewsStories/status/5900961379
WingschREI;2009-11-20 21:29;0;0;"Signs That Swine Flu Wave Has Peaked in U.S.: The Centers for Disease Control and Prevention said flu .. http://bit.ly/082JFQA #nytimes";;;#nytimes;"5900952514";https://twitter.com/WingschREI/status/5900952514
breakingflunews;2009-11-20 21:29;0;0;"breakingflunews.com Texans can check Web site for swine flu vaccine - Houston Chronicle: Tex.. http://bit.ly/5Lnr31";;;;"5900945833";https://twitter.com/breakingflunews/status/5900945833
breakingflunews;2009-11-20 21:29;0;0;"breakingflunews.com 2 more swine flu deaths reported in MA - WBZ News Radio 1030: Thai News .. http://bit.ly/4VLbMe";;;;"5900944505";https://twitter.com/breakingflunews/status/5900944505
breakingflunews;2009-11-20 21:29;0;0;"breakingflunews.com UPDATE 1- Swine flu may be peaking in US, reports indicate - Reuters: WBN.. http://bit.ly/07B7cCE";;;;"5900940856";https://twitter.com/breakingflunews/status/5900940856
ColorMeLorin;2009-11-20 21:28;0;0;"So in my dream last night...everyone was suddenly dropping dead from swine flu . it was QUITE interesting.";;;;"5900922046";https://twitter.com/ColorMeLorin/status/5900922046
h1n1_talk;2009-11-20 21:28;0;0;"RT @KimberleKelly : RT @zaibatsu : Just Frickin' Great: Norwegian scientists detect mutated form of swine flu http://bit.ly/8vpRcN";;@KimberleKelly @zaibatsu;;"5900920796";https://twitter.com/h1n1_talk/status/5900920796
web9media;2009-11-20 21:27;0;0;"Update:CDC: 4 people in NC test positive for Tamiflu-resistant swine flu , first such US cluster http://tinyurl.com/ydgw3jo";;;;"5900908804";https://twitter.com/web9media/status/5900908804
UkHealthNews;2009-11-20 21:26;0;0;"UPDATE 1-UK investigates spread of drug resistant swine flu - Reuters http://tinyurl.com/y885u8g";;;;"5900883920";https://twitter.com/UkHealthNews/status/5900883920
swinefluh1n1;2009-11-20 21:25;0;0;""CDC: Swine flu now widespread in fewer US states, but future cases are h..." http://tinyurl.com/yfw8put #swineflu #H1N1";;;#swineflu #H1N1;"5900862938";https://twitter.com/swinefluh1n1/status/5900862938
greenteaexpert;2009-11-20 21:25;0;0;"Europeans Question if Swine Flu is Pandemic or Scandal: Examiner.com A focus on natural health and natural ways.. http://bit.ly/089L5SI";;;;"5900862866";https://twitter.com/greenteaexpert/status/5900862866
swinefluh1n1;2009-11-20 21:25;0;0;""2 more swine flu deaths reported in MA" http://tinyurl.com/yjw7lsx #swineflu #H1N1";;;#swineflu #H1N1;"5900860735";https://twitter.com/swinefluh1n1/status/5900860735
mparent77772;2009-11-20 21:25;1;0;"While swine flu , or H1N1, gets all the attention, cooties sit back and quietly plot their comeback.";;;;"5900860691";https://twitter.com/mparent77772/status/5900860691
MarcPearton;2009-11-20 21:25;0;0;"Another potential example of #evolution in real time--> UK investigates spread of drug resistant swine flu : http://bit.ly/4Reyf8 #swineflu";;;#evolution #swineflu;"5900860044";https://twitter.com/MarcPearton/status/5900860044
swineflu_news_;2009-11-20 21:25;0;0;"Eat and drink your way to a healthy colon?: NEW YORK (Reuters Health) - Eating fruits and vegetables, and drinking ... http://bit.ly/8ECrJ8";;;;"5900853907";https://twitter.com/swineflu_news_/status/5900853907
News4Sacramento;2009-11-20 21:25;0;0;"Tamiflu-Resistant Swine Flu Cluster Reported In NC (http://cli.gs/7M0yX) #Sacramento";;;#Sacramento;"5900849227";https://twitter.com/News4Sacramento/status/5900849227
News4Sacramento;2009-11-20 21:25;0;0;"WHO Investigating Norway Swine Flu Mutations (http://cli.gs/h0Hyh) #Sacramento";;;#Sacramento;"5900847947";https://twitter.com/News4Sacramento/status/5900847947
SwineFluUK;2009-11-20 21:25;1;0;"Tamiflu-resistant swine flu spreads between patients in Wales: A form of swine flu that is resistant to antivir.. http://bit.ly/07vZpxF";;;;"5900843670";https://twitter.com/SwineFluUK/status/5900843670
messi_barcelona;2009-11-20 21:24;0;0;"Barcelona's Abidal, Toure confirmed swine flu http://bit.ly/07ilKRw";;;;"5900837374";https://twitter.com/messi_barcelona/status/5900837374
UnlockWindows;2009-11-20 21:24;0;0;"college off due to swine flu .... 10 days holiday.....";;;;"5900832264";https://twitter.com/UnlockWindows/status/5900832264
NCNews0verviews;2009-11-20 21:24;0;0;"Article Tamiflu-resistant swine flu cluster found in North Carolina: Video Body ATLANTA (AP) - Health of.. http://bit.ly/4YXwch";;;;"5900825032";https://twitter.com/NCNews0verviews/status/5900825032
NEWS__HEADLINES;2009-11-20 21:24;0;0;"NYDAILYNEWS: Drug-resistant strain of swine flu appearing, worries H1N1 virus mutating http://bit.ly/55d40Q";;;;"5900822658";https://twitter.com/NEWS__HEADLINES/status/5900822658
thetank;2009-11-20 21:24;0;0;"Are you going to have your under 5 vaccinated against swine flu when the letter from the NHS arrives next month? http://myloc.me/1C1E0";;;;"5900820274";https://twitter.com/thetank/status/5900820274
dave13100;2009-11-20 21:23;0;0;"Swine flu may be peaking in U.S.: WASHINGTON (Reuters) - The pandemic of swine flu may be hitting a peak in the Uni... http://bit.ly/6vGEib";;;;"5900818517";https://twitter.com/dave13100/status/5900818517
MWTab;2009-11-20 21:23;0;0;"oh no! RT @jshockley RT @BreakingNews Norwegian scientists find mutated virus of H1N1 swine flu . Full story: http://news.bnonews.com/wxip";;@jshockley @BreakingNews;;"5900814839";https://twitter.com/MWTab/status/5900814839
vroblespac;2009-11-20 21:23;0;0;"More #H1N1 , resistance in US Drug resistant swine flu found in N.C. hospital http://tinyurl.com/yj76zaf from @iNewsApp";;@iNewsApp;#H1N1;"5900808331";https://twitter.com/vroblespac/status/5900808331
PFCdgayo;2009-11-20 21:23;1;3;"Reading "Using Prediction Markets and Twitter to Predict a Swine Flu Pandemic" by Ritterman, Osborne and Klein. http://tinyurl.com/yb9udcx";;;;"5900803030";https://twitter.com/PFCdgayo/status/5900803030
AdvertisingLaw;2009-11-20 21:23;0;0;"RT @FortaliceLLC Carefully click! RT @InBoxRevenge RT @Gumblar Blog: Russian #Spammers Trying to Cash in On Swine Flu http://bit.ly/LFYF8";;@FortaliceLLC @InBoxRevenge @Gumblar;#Spammers;"5900799638";https://twitter.com/AdvertisingLaw/status/5900799638
MaximumHealth;2009-11-20 21:23;0;0;"Liked "BBC News - Tamiflu-resistant swine flu spreads 'between patients'" http://ff.im/bLRVb";;;;"5900795488";https://twitter.com/MaximumHealth/status/5900795488
livingfuel;2009-11-20 21:22;0;0;"Aspirin Kills 400% More People Than H1N1 Swine Flu - Read more on the Living Fuel Blog - http://blog.livingfuel.com/";;;;"5900788230";https://twitter.com/livingfuel/status/5900788230
OHNews0verviews;2009-11-20 21:22;0;0;"Article Ohio swine flu deaths now at 30: Health officials say the flu - including swine flu - peaked in .. http://bit.ly/5D0bX6";;;;"5900785358";https://twitter.com/OHNews0verviews/status/5900785358
PearlFlipper;2009-11-20 21:22;0;0;"Day 2 may be Swine Flu , mild. Not sure? Check this great link: http://www.strollertraffic.com/ee-assets/my-uploads/pdfs/FluChart.pdf";;;;"5900779614";https://twitter.com/PearlFlipper/status/5900779614
PEcom_moms;2009-11-20 21:22;0;0;"Nearly all swine flu vaccines distributed: California's public health officer today said the state has distributed ... http://bit.ly/5lMWNx";;;;"5900778686";https://twitter.com/PEcom_moms/status/5900778686
huis_Bodegraven;2009-11-20 21:22;0;0;"Tamiflu-Resistant H1N1 Cluster Reported Cases of 4 N.C. Patients Show Swine Flu Virus May be Mutating (Source: Health.. http://bit.ly/5D4yRQ";;;;"5900778668";https://twitter.com/huis_Bodegraven/status/5900778668
LittaBird;2009-11-20 21:21;0;0;"Swine Flu Mutation: New Strain Found In Europe; Drug Resistant And Harsher Symptoms: European public health officia... http://bit.ly/6A2scj";;;;"5900763549";https://twitter.com/LittaBird/status/5900763549
travelfeed;2009-11-20 21:21;0;0;"MSNBC: Swine flu puts airlines, travelers in tough spot: As outbreaks of the H1N1 virus inject more frazzle into a... http://bit.ly/07sfKYi";;;;"5900762517";https://twitter.com/travelfeed/status/5900762517
DenbyRadio;2009-11-20 21:21;0;0;"Swine Flu Mutation: New Strain Found In Europe; Drug Resistant And Harsher Symptoms http://viigo.im/1yoY";;;;"5900757592";https://twitter.com/DenbyRadio/status/5900757592
TravelNewsFeeds;2009-11-20 21:20;0;0;"last minute travel Swine flu is making some folks alter their holiday plans: Boston Globe Mos.. http://bit.ly/8nUXF3";;;;"5900738166";https://twitter.com/TravelNewsFeeds/status/5900738166
Sir_Julez;2009-11-20 21:20;0;0;"omg yall so why me & mom both think my Dad got the swine flu right and some of th thoughts running thru my head arent good Lord plz 4give me";;;;"5900736400";https://twitter.com/Sir_Julez/status/5900736400
swinefluh1n1;2009-11-20 21:20;0;0;""H1N1 intensifying in Canada but subsiding elsewhere: WHO" http://tinyurl.com/yavtjf3 #swineflu #H1N1";;;#swineflu #H1N1;"5900730357";https://twitter.com/swinefluh1n1/status/5900730357
StoneWyre;2009-11-20 21:20;0;0;"RT @KCBSNews : Tamiflu-Resistant Swine Flu Reported in NC http://easyuri.com/4c90b";;@KCBSNews;;"5900728321";https://twitter.com/StoneWyre/status/5900728321
swinefluh1n1;2009-11-20 21:20;0;0;""CDC: Sees Slight Decline In H1N1 Influenza Illnesses" http://tinyurl.com/ybrktyj #swineflu #H1N1";;;#swineflu #H1N1;"5900726169";https://twitter.com/swinefluh1n1/status/5900726169
vroblespac;2009-11-20 21:20;0;0;"Tamiflu resistant #H1N1 , not boding well Drug resistant swine flu hits UK http://tinyurl.com/yz6f94n from @iNewsApp";;@iNewsApp;#H1N1;"5900724580";https://twitter.com/vroblespac/status/5900724580
Xperienced_;2009-11-20 21:19;0;0;"Going out gear in the Swine Flu age. Shiny, sparkly, safe. http://yfrog.com/4g5vrj";;;;"5900718532";https://twitter.com/Xperienced_/status/5900718532
HiltonHHonors;2009-11-20 21:19;0;0;"RT @msnbc_travel : Swine flu puts airlines, travelers in tough spot http://bit.ly/69PF02";;@msnbc_travel;;"5900715225";https://twitter.com/HiltonHHonors/status/5900715225
1sthealthnews;2009-11-20 21:18;0;0;"Parents 'should vaccinate children against swine flu ' - School Days: Parents 'should vaccinate children against swi... http://bit.ly/6wtPt4";;;;"5900694780";https://twitter.com/1sthealthnews/status/5900694780
PEIHeather;2009-11-20 21:18;0;0;"Organizers of QEH fundraising campaign forced to changes plans due to Swine Flu outbreak. Angela MacIvor has more tonight on Compass at 6";;;;"5900690189";https://twitter.com/PEIHeather/status/5900690189
royce_1778;2009-11-20 21:18;0;0;"Have you had the swine flu ?: Atlanta Journal Constitution I sought medical care the next day of symptoms. After.. http://bit.ly/ETFNO";;;;"5900688051";https://twitter.com/royce_1778/status/5900688051
MollyROXanne;2009-11-20 21:18;0;0;"what a day today - take Dementia Dadda, kids and whingy husband for swine flu vaccine, then to bike shop, then to lunch, then to new moon";;;;"5900682689";https://twitter.com/MollyROXanne/status/5900682689
TBOBreaking;2009-11-20 21:18;0;0;"Breaking News: Swine flu vaccine delays could extend well into the holidays: Health officials remain unable to say ... http://bit.ly/7LUewB";;;;"5900676077";https://twitter.com/TBOBreaking/status/5900676077
shavedheadgirl;2009-11-20 21:17;0;0;"Europeans Question if Swine Flu is Pandemic or Scandal: Examiner.com Still homeopathic and holistic health care.. http://bit.ly/7zcTNT";;;;"5900671094";https://twitter.com/shavedheadgirl/status/5900671094
stopflunews;2009-11-20 21:17;0;0;"UPDATE 1-UK investigates spread of drug resistant swine flu - Reuters http://bit.ly/5YJlgh";;;;"5900656811";https://twitter.com/stopflunews/status/5900656811
wbznewsradio;2009-11-20 21:17;0;0;"WBZ TOP STORIES: 2 more swine flu deaths reported in MA: Swine flu claims two more lives in Ma.. http://bit.ly/4AJYfM";;;;"5900656673";https://twitter.com/wbznewsradio/status/5900656673
TerriModo;2009-11-20 21:17;0;0;"Had flu and swine flu jabs and worried about side effects";;;;"5900653796";https://twitter.com/TerriModo/status/5900653796
stopflunews;2009-11-20 21:17;0;0;"UPDATE 1- Swine flu may be peaking in US, reports indicate - Reuters http://bit.ly/07B7cCE";;;;"5900653090";https://twitter.com/stopflunews/status/5900653090
DrVes;2009-11-20 21:17;1;1;"Seasonal Flu Vaccine May Cut Swine Flu Risk by 45% For Some People http://bit.ly/6CuBlL";;;;"5900650530";https://twitter.com/DrVes/status/5900650530
WBAP247NEWS;2009-11-20 21:16;0;0;"Swine flu may be losing its punch, Sanford faces impeachment. The 3 pm podcast: http://www.wbap.com/sectional.asp?id=9206";;;;"5900644797";https://twitter.com/WBAP247NEWS/status/5900644797
flu360;2009-11-20 21:16;0;1;"Drug resistant swine flu found in N.C. hospital|Epidemic experts have launched an investigation of four .. http://oohja.com/x2uTL";;;;"5900635362";https://twitter.com/flu360/status/5900635362
SkyGrid;2009-11-20 21:15;0;0;"Tamiflu-resistant swine flu cluster in N.C. (http://bit.ly/8cmzax) - The Washington Times | SkyGrid";;;;"5900623213";https://twitter.com/SkyGrid/status/5900623213
swinefluh1n1;2009-11-20 21:15;0;0;""TFN eNews: 11/20/2009: When bureaucratic red tape actually creates ..." http://tinyurl.com/ygzz6yg #swineflu #H1N1";;;#swineflu #H1N1;"5900620187";https://twitter.com/swinefluh1n1/status/5900620187
cesarcd;2009-11-20 21:15;0;0;"Health- UPDATE 1-UK investigates spread of drug resistant swine flu - Reuters: BBC NewsUPDATE 1-UK inves.. http://bit.ly/5YJlgh";;;;"5900616506";https://twitter.com/cesarcd/status/5900616506
flutefish;2009-11-20 21:15;0;0;"Got my swine flu vaccine after work today. Target on Timber Dr. in Garner has the shots if anyone is looking for where to get them. #fb";;;#fb;"5900613968";https://twitter.com/flutefish/status/5900613968
SwineFlu_news;2009-11-20 21:15;0;0;"CDC: Swine Flu Cases Seem to be Dropping in U.S. http://t.love.com/272939965";;;;"5900602913";https://twitter.com/SwineFlu_news/status/5900602913
SwineFluGuru;2009-11-20 21:15;1;0;"Drug resistant swine flu found in NC hospital http://bit.ly/7eLw3F";;;;"5900602664";https://twitter.com/SwineFluGuru/status/5900602664
SS501TripleS;2009-11-20 21:14;0;1;"[News+Info] SS501 Leader Hyunjoong for Swine Flu Prevention Campaign Song!http://wp.me/pCu8Q-2Ui";;;;"5900600022";https://twitter.com/SS501TripleS/status/5900600022
we_are_football;2009-11-20 21:14;0;0;"Sports Illustrated Soccer football: Barcelona says Abidal, Touré both have swine flu http://bit.ly/7UAGrH";;;;"5900591653";https://twitter.com/we_are_football/status/5900591653
armgate;2009-11-20 21:14;0;0;"22 swine flu cases in Armenia - Information-Analytic Agency NEWS.am http://bit.ly/4uJkQn";;;;"5900589954";https://twitter.com/armgate/status/5900589954
dmonroy;2009-11-20 21:14;0;0;"RT @KNX1070 : Health officials say 4 people in N. Carolina have tested positive for a type of swine flu that's resistant to the drug Tamiflu.";;@KNX1070;;"5900576372";https://twitter.com/dmonroy/status/5900576372
swineflu2;2009-11-20 21:13;0;0;"#swineflu Santa's Holiday Wish: the Swine Flu Shot - TIME: Tampabay.comSanta's Holiday Wish: the Swine Flu ShotTIM... http://bit.ly/08sf2BH";;;#swineflu;"5900575119";https://twitter.com/swineflu2/status/5900575119
swineflu2;2009-11-20 21:13;0;0;"#swineflu Collin County gets 6500 swine flu doses - Dallas Morning News: Collin County gets 6500 swine flu dosesDal... http://bit.ly/4gZGdS";;;#swineflu;"5900574843";https://twitter.com/swineflu2/status/5900574843
swineflu2;2009-11-20 21:13;0;0;"#swineflu Fox News Poll: Worries About Safety of Swine Flu Vaccine Persist - FOXNews: Globe and MailFox News Poll:... http://bit.ly/07lUH2s";;;#swineflu;"5900574510";https://twitter.com/swineflu2/status/5900574510
SwineFluUpdate;2009-11-20 21:13;0;0;"Swine Flu WHO investigating Norway swine flu mutations - The Associated Press: AFPWHO investigating Norway swine fl... http://bit.ly/18aMrx";;;;"5900566764";https://twitter.com/SwineFluUpdate/status/5900566764
SwineFluUpdate;2009-11-20 21:13;0;0;"Swine Flu Swine flu shot available to all in NL - CBC.ca: Globe and MailSwine flu shot available to all in NLCBC.caN... http://bit.ly/R0EB1";;;;"5900566350";https://twitter.com/SwineFluUpdate/status/5900566350
SwineFluUpdate;2009-11-20 21:13;0;0;"Swine Flu H1N1 intensifying in Canada but subsiding elsewhere: WHO - CBC.ca: National PostH1N1 intensifying in Cana... http://bit.ly/58yhQW";;;;"5900565852";https://twitter.com/SwineFluUpdate/status/5900565852
SwineFluUpdate;2009-11-20 21:13;0;0;"Swine Flu UPDATE 1-UK investigates spread of drug resistant swine flu - Reuters: UPDATE 1-UK investigates spread of... http://bit.ly/5YJlgh";;;;"5900565335";https://twitter.com/SwineFluUpdate/status/5900565335
SwineFluUpdate;2009-11-20 21:13;0;0;"Swine Flu Tamiflu-resistant swine flu spreads between patients in Wales - Times Online: BBC NewsTamiflu-resistant s... http://bit.ly/4W4aR5";;;;"5900565039";https://twitter.com/SwineFluUpdate/status/5900565039
healthissuesnow;2009-11-20 21:13;0;0;"Drug resistant swine flu found in N.C. hospital: Epidemic experts have launched an investigation of four Tamifl.. http://bit.ly/08deKMi";;;;"5900553110";https://twitter.com/healthissuesnow/status/5900553110
BillCantrellCFP;2009-11-20 21:12;0;0;"New blog post: Senior Safeguards against Swine Flu http://home-health-phoenix.carebuzz.com/h1n1-seniors-safeguard/";;;;"5900548009";https://twitter.com/BillCantrellCFP/status/5900548009
ryanxmair;2009-11-20 21:12;0;0;"just voted "I'm sick, but not with the swine. (i think)" on "Do you have Swine Flu ?"! Vote now ➤ http://bit.ly/2p3y8O";;;;"5900534911";https://twitter.com/ryanxmair/status/5900534911
