username;date;retweets;favorites;text;geo;mentions;hashtags;id;permalink
prettyphysicist;2009-05-29 15:22;0;0;"Dr appt at 1. Any bets that its swine flu ? I do live in berks county after all...";;;;"1960699241";https://twitter.com/prettyphysicist/status/1960699241
dreve0317;2009-05-29 15:22;0;0;"in beijing. Tell me all abt the great guarantin of swine flu . Fell victim of it";;;;"1960698872";https://twitter.com/dreve0317/status/1960698872
SwineInfluenza;2009-05-29 15:21;0;0;"Swine flu vaccine being rushed into production - WPEC: Swine flu vaccine being rushed into productionWPEC, .. http://tinyurl.com/mecmlp";;;;"1960695212";https://twitter.com/SwineInfluenza/status/1960695212
SwineInfluenza;2009-05-29 15:21;0;0;"Companies poised for swine flu vaccine drive - Pharmafocus: Companies poised for swine flu vaccine drivePharmafo.. http://tinyurl.com/kmu3fq";;;;"1960694772";https://twitter.com/SwineInfluenza/status/1960694772
science_watch;2009-05-29 15:21;0;0;"New Scientist: New swine flu cases point to invisible pandemic: Chance testing of two Greek studen.. http://tinyurl.com/lc6ale";;;;"1960693267";https://twitter.com/science_watch/status/1960693267
zaklina15;2009-05-29 15:21;0;0;"From the CDC - swine flu has genes from pigs in Europe & Asia, plus bird flu and human flu - how did a virus mutate into this???";;;;"1960692911";https://twitter.com/zaklina15/status/1960692911
SwineFluNewsSG;2009-05-29 15:21;0;0;"Singapore confirms 3 some-more swine flu cases http://tinyurl.com/mg3wwb";;;;"1960692521";https://twitter.com/SwineFluNewsSG/status/1960692521
John_Taylor;2009-05-29 15:21;0;0;"Swine flu - everything you need to know :... -...... - John Taylor - FriendFeed http://ff.im/3nfvl";;;;"1960689737";https://twitter.com/John_Taylor/status/1960689737
BriefNews;2009-05-29 15:20;0;0;"CSL Biotherapies to supply HHS with swine flu vaccine antigen http://cli.gs/Ln38A9 #linktweet";;;#linktweet;"1960684794";https://twitter.com/BriefNews/status/1960684794
potterben;2009-05-29 15:20;0;0;"Happy that the media panic over #swineflu was not sustainable. I'd much rather read about "Crazy Turtle Woman" http://tinyurl.com/knvt85";;;#swineflu;"1960684295";https://twitter.com/potterben/status/1960684295
Lily244;2009-05-29 15:20;0;0;"Health officials: Illinois man dies from swine flu : AP Health officials say the victim had other medical problem.. http://bit.ly/P8nqQ";;;;"1960679260";https://twitter.com/Lily244/status/1960679260
zeroping;2009-05-29 15:20;1;0;"US official in France diagnosed with swine flu http://newsbb.org/?p=37150";;;;"1960674505";https://twitter.com/zeroping/status/1960674505
ashleyboyerrr;2009-05-29 15:19;0;0;"Tired as hell. Runny nose, coughing, kind of sort of achy, can't think right. Swine flu ? I think not";;;;"1960673251";https://twitter.com/ashleyboyerrr/status/1960673251
H1N1swineflu;2009-05-29 15:19;0;0;"#swine #flu Friday Update - H1N1 ( Swine Flu ) (5/29/09) : As of 11 AM, May 27, CDC is reporting 8,975.. http://tinyurl.com/mofyf7";;;#swine #flu;"1960669933";https://twitter.com/H1N1swineflu/status/1960669933
Vidfair;2009-05-29 15:19;0;0;"Rheumatoid Arthritis Drug Might Fight Swine Flu http://tinyurl.com/krhwg4";;;;"1960666213";https://twitter.com/Vidfair/status/1960666213
CrisisWatch;2009-05-29 15:19;0;0;"*CDC Updates* Friday Update - H1N1 ( Swine Flu ) (5/29/09) http://tinyurl.com/mofyf7";;;;"1960664194";https://twitter.com/CrisisWatch/status/1960664194
monstersandcrit;2009-05-29 15:18;0;0;"M&C World News Slovak infant infected with swine flu : Bratislava - A Slovak infant was confirmed .. http://tinyurl.com/lc8p99";;;;"1960663858";https://twitter.com/monstersandcrit/status/1960663858
CrisisWatch;2009-05-29 15:18;0;0;"*EMM Disease Alerts* First probable case of swine flu in Wales http://tinyurl.com/mf2fux";;;;"1960660927";https://twitter.com/CrisisWatch/status/1960660927
news_mail;2009-05-29 15:18;0;0;"PEOPLE who were in contact with a child with swine flu are informed. http://twurl.nl/tuzx74";;;;"1960659530";https://twitter.com/news_mail/status/1960659530
honiedip;2009-05-29 15:18;0;0;"ok, so my 1st question 2day was bout Jay Z's bird nest hair. but my 2nd question's bout Swine Flu ...wtf?? was it like a 2 week epidemic? lol";;;;"1960658609";https://twitter.com/honiedip/status/1960658609
Jesusophile;2009-05-29 15:18;0;0;"Further swine flu cases confirmed: The Department of Health confirms 12 further patients in England have contrac.. http://tinyurl.com/m975re";;;;"1960656951";https://twitter.com/Jesusophile/status/1960656951
swinefluh1n1;2009-05-29 15:18;0;0;""BioWorld Today - May. 26, 2009" http://tinyurl.com/nsr95o #swineflu #H1N1";;;#swineflu #H1N1;"1960655236";https://twitter.com/swinefluh1n1/status/1960655236
TechnologyTweet;2009-05-29 15:17;0;0;"From Carnival to Surgical Masks – Swine Flu 's Affect on Mexican Tourism http://bit.ly/DlNDT";;;;"1960653544";https://twitter.com/TechnologyTweet/status/1960653544
SwineFluNewsEU;2009-05-29 15:17;0;0;"World closer to swine flu pandemic, says WHO http://tinyurl.com/lwlr96";;;;"1960651676";https://twitter.com/SwineFluNewsEU/status/1960651676
WSBTHealth;2009-05-29 15:17;0;0;"8 new swine flu cases reported in Indiana http://tinyurl.com/m7h39q";;;;"1960644989";https://twitter.com/WSBTHealth/status/1960644989
st_louis_life;2009-05-29 15:16;0;0;"The U.S. and Russia continue talks over Russia's ban on U.S. meat after the swine-flu outbreak. (Guardian)The go.. http://tinyurl.com/mvmxva";;;;"1960639799";https://twitter.com/st_louis_life/status/1960639799
LivingSafely;2009-05-29 15:16;0;0;"US/Atlanta: US CDC reports 8,975 total US Swine Flu cases; 15 deaths in 49 states. Next scheduled update this Monday.";;;;"1960639089";https://twitter.com/LivingSafely/status/1960639089
critiquereview;2009-05-29 15:16;0;0;"Health officials: Illinois man dies from swine flu http://bit.ly/Jzciy";;;;"1960637761";https://twitter.com/critiquereview/status/1960637761
News12BX;2009-05-29 15:16;0;0;"Some P.S. 209 parents say kids were exposed to swine flu";;;;"1960636000";https://twitter.com/News12BX/status/1960636000
RonGrender;2009-05-29 15:15;0;0;"http://bit.ly/BrveT Climate change causes 315,000 deaths a year... and we are worried about Swine Flu";;;;"1960631537";https://twitter.com/RonGrender/status/1960631537
EMNews;2009-05-29 15:15;0;0;"Info from the CDC to pass along to patients: Warning signs that your case of swine flu warrants medical attention. http://bit.ly/NKhsC.";;;;"1960630690";https://twitter.com/EMNews/status/1960630690
SwineFluUK;2009-05-29 15:15;0;0;"swine flu Police fears over mother and two sons who disappeared five days ago: Police fears over mother.. http://tinyurl.com/lhrgdm";;;;"1960628061";https://twitter.com/SwineFluUK/status/1960628061
SwineFluUK;2009-05-29 15:15;0;0;"swine flu Britain set to be hotter than Spain as nation basks in glorious weekend of sunshine : And Met.. http://tinyurl.com/koa5xp";;;;"1960627464";https://twitter.com/SwineFluUK/status/1960627464
KotanAustralia;2009-05-29 15:15;0;0;"Swine flu ... and the arts fly http://bit.ly/3bPLmB";;;;"1960625280";https://twitter.com/KotanAustralia/status/1960625280
paaatmunoz;2009-05-29 15:15;0;0;"o.o1% of catching swine flu --facebook quiz :-D http://plurk.com/p/x195m";;;;"1960622252";https://twitter.com/paaatmunoz/status/1960622252
bewellbuzz;2009-05-29 15:14;0;1;"Algae Protein Could Stop Deadly SARS Infection: One reason the emergence of H1N1, also called swine flu , has cau.. http://bit.ly/2YaxF";;;;"1960616022";https://twitter.com/bewellbuzz/status/1960616022
newstrendz;2009-05-29 15:13;0;0;"9. swine flu may 28: newsminer.com • Fairbanks-area woman diagnosed with swine flu , Fairbanks-area woman diagnose http://tinyurl.com/mbxncg";;;;"1960609637";https://twitter.com/newstrendz/status/1960609637
Adigold;2009-05-29 15:13;0;0;"RT @tweetmeme Swine flu keeps cruise ship off coast of Australia | Breaking Tweets http://bit.ly/YRpYv";;@tweetmeme;;"1960608374";https://twitter.com/Adigold/status/1960608374
scynet;2009-05-29 15:13;0;0;"#swineflu #news More flu cases at primary school - BBC News http://ow.ly/9S4o";;;#swineflu #news;"1960608020";https://twitter.com/scynet/status/1960608020
H1N1VirusNews;2009-05-29 15:13;0;0;"Rheumatoid Arthritis Drug Might Fight Swine Flu - U.S. News & World Report http://cli.gs/HDGdq1";;;;"1960603055";https://twitter.com/H1N1VirusNews/status/1960603055
globeizer;2009-05-29 15:12;0;0;"#swineflu #travel Probable swine flu case in Wales - BBC News http://tinyurl.com/ljlgng";;;#swineflu #travel;"1960600476";https://twitter.com/globeizer/status/1960600476
globeizer;2009-05-29 15:12;0;0;"#swineflu #travel 2 Greek students catch swine flu in UK - The Associated Press http://tinyurl.com/nry9ox";;;#swineflu #travel;"1960599918";https://twitter.com/globeizer/status/1960599918
H1N1VirusNews;2009-05-29 15:12;0;0;"Swine Flu Media Update 27 Issued At: 11am Tuesday 26 May 2009, Wales http://cli.gs/66EHmL";;;;"1960599498";https://twitter.com/H1N1VirusNews/status/1960599498
karenhye;2009-05-29 15:12;0;0;"@nerdywhitegrl - but it did remind me of the Rutgers graduation where they weren't allowed to shake the dean's hand cuz of swine flu . lawlz.";;@nerdywhitegrl;;"1960594429";https://twitter.com/karenhye/status/1960594429
sahnafoley;2009-05-29 15:12;0;0;"So I'm on set. Word just came in that one of the actors has swine flu . WTF!? Seriously...if it's not one thing while making a movie, it' ...";;;;"1960591862";https://twitter.com/sahnafoley/status/1960591862
xnhell;2009-05-29 15:11;0;0;"for real! If she don't get swine flu tonight, it ain't a big deal.";;;;"1960588308";https://twitter.com/xnhell/status/1960588308
NHSE_infections;2009-05-29 15:10;0;0;"News Update on confirmed swine flu cases 29/5/2009 http://bit.ly/100Sri #swineflu H1N1";;;#swineflu;"1960576064";https://twitter.com/NHSE_infections/status/1960576064
swinefluh1n1;2009-05-29 15:09;0;0;""ClearysNoteBook: City School Board and Union Agree on Sick Bank ..." http://tinyurl.com/l9bd4q #swineflu #H1N1";;;#swineflu #H1N1;"1960567008";https://twitter.com/swinefluh1n1/status/1960567008
swinefluh1n1;2009-05-29 15:09;0;0;""Tomorrows Trust - A Review of Catholic Education » Blog Archive ..." http://tinyurl.com/kqe6a8 #swineflu #H1N1";;;#swineflu #H1N1;"1960566298";https://twitter.com/swinefluh1n1/status/1960566298
swinefluh1n1;2009-05-29 15:09;0;0;""8 New Swine Flu Cases Reported in Indiana" http://tinyurl.com/l6xwbe #swineflu #H1N1";;;#swineflu #H1N1;"1960565518";https://twitter.com/swinefluh1n1/status/1960565518
birminghampost;2009-05-29 15:09;0;0;"Birmingham swine flu school to re-open next week - as number of cases rises to 74 http://snurl.com/j0ovn";;;;"1960562876";https://twitter.com/birminghampost/status/1960562876
realjons;2009-05-29 15:09;0;0;"RT @TM_Outbreak : newsminer.com • Fairbanks woman is Alaska's first swine flu case http://tinyurl.com/llwdvu (via @SwineInfluenza )";;@TM_Outbreak @SwineInfluenza;;"1960560014";https://twitter.com/realjons/status/1960560014
News12CT;2009-05-29 15:08;0;0;"Greenwich day care center closes due to swine flu fears";;;;"1960552409";https://twitter.com/News12CT/status/1960552409
dreamtripscda;2009-05-29 15:08;0;0;"Swine flu : cruise to nowhere : Effect Measure http://u.mavrev.com/6aij";;;;"1960550474";https://twitter.com/dreamtripscda/status/1960550474
VotersUnite;2009-05-29 15:08;0;0;"New Blog post Other Than Its Origin, Whats The Difference Between Swine Flu And The Regular Flu? http://bit.ly/7FpwQ ...";;;;"1960549460";https://twitter.com/VotersUnite/status/1960549460
infoxenter_apps;2009-05-29 15:07;0;0;""iPhone New App: Swine Flu in US (FREE) Price: US$0 Category: Education http://tinyurl.com/msolqr"";;;;"1960540552";https://twitter.com/infoxenter_apps/status/1960540552
ArthritisUpdate;2009-05-29 15:06;0;0;"US News.com - Arthritis: Rheumatoid Arthritis Drug Might Fight Swine Flu http://tinyurl.com/pltw6v Full http://tinyurl.com/krhwg4";;;;"1960534910";https://twitter.com/ArthritisUpdate/status/1960534910
BriefNews;2009-05-29 15:05;0;0;"Ship in Australia changes course as swine flu hits crew http://cli.gs/6uDEJE #linktweet";;;#linktweet;"1960521800";https://twitter.com/BriefNews/status/1960521800
aus_politics;2009-05-29 15:05;0;0;"State urged to close schools for week: VICTORIA has passed the point where the spread of swine flu can be preven.. http://tinyurl.com/lvaoo6";;;;"1960521711";https://twitter.com/aus_politics/status/1960521711
Lyne_Robichaud;2009-05-29 15:05;0;0;"CANADA Nunavut records first case of swine flu http://www.google.com/hostednews/canadianpress/article/ALeqM5i94frnxNM0iu17zmrJQx5O5Vr1RA";;;;"1960516896";https://twitter.com/Lyne_Robichaud/status/1960516896
mycancundeals;2009-05-29 15:05;0;0;"No swine flu , just sun and sandy beaches! Take advantage of great deals and enjoy a mexican caribbean summer! http://ow.ly/9RGj";;;;"1960515514";https://twitter.com/mycancundeals/status/1960515514
australian;2009-05-29 15:04;0;0;"Mad scramble for swine flu vaccine: SOMETHING other than chickens will soon be growing inside these eggs: the we.. http://tinyurl.com/nmh7xf";;;;"1960513310";https://twitter.com/australian/status/1960513310
HMGOVNEWS;2009-05-29 15:04;0;0;"#WelshAssembly : First probable case of swine flu in Wales: A probable case of swine flu in Wales .. http://twurl.nl/l7ff2h";;;#WelshAssembly;"1960510188";https://twitter.com/HMGOVNEWS/status/1960510188
SwineFluNewsNZ;2009-05-29 15:04;0;0;"Seriously sick male has swine flu http://tinyurl.com/ouxdq7";;;;"1960510022";https://twitter.com/SwineFluNewsNZ/status/1960510022
MollyDugganLLC;2009-05-29 15:04;0;0;"London Times Health: Eton closed after positive swine flu test Britain’s m http://tinyurl.com/oyjcbt Full http://tinyurl.com/ch8axl";;;;"1960504024";https://twitter.com/MollyDugganLLC/status/1960504024
NHSE_infections;2009-05-29 15:03;0;0;"Resources: Swine flu lealet http://bit.ly/6vMRK #swineflu H1N1";;;#swineflu;"1960502805";https://twitter.com/NHSE_infections/status/1960502805
HMGOVNEWS;2009-05-29 15:03;0;0;"#Localgovassociation Copy of Swine flu briefing 26 May, 4.00pm: Updated briefing from the LGA. http://twurl.nl/kvmqo5";;;#Localgovassociation;"1960502386";https://twitter.com/HMGOVNEWS/status/1960502386
NHSE_infections;2009-05-29 15:03;0;0;"Info: How to make a swine flu vaccine http://bit.ly/2sfrd #swineflu H1N1";;;#swineflu;"1960501447";https://twitter.com/NHSE_infections/status/1960501447
infonautlive;2009-05-29 15:03;0;0;"#swineflu Swine Flu Watch: Vaccine by October; Australian Cruise Ship Told to Circle http://tinyurl.com/n7j4s3";;;#swineflu;"1960497604";https://twitter.com/infonautlive/status/1960497604
jinx_ed8;2009-05-29 15:03;0;0;"Health officials: Illinois man dies from swine flu http://bit.ly/FvtwT";;;;"1960497158";https://twitter.com/jinx_ed8/status/1960497158
SwineFluNewsEU;2009-05-29 15:03;0;0;"Behind a Swine Flu http://tinyurl.com/nx24cb";;;;"1960495830";https://twitter.com/SwineFluNewsEU/status/1960495830
SwineFluNewsORG;2009-05-29 15:03;0;0;"Health officials: Illinois male dies from swine flu http://tinyurl.com/my3ghp";;;;"1960494749";https://twitter.com/SwineFluNewsORG/status/1960494749
swinefluh1n1;2009-05-29 15:03;0;0;""Further swine flu cases confirmed" http://tinyurl.com/ldmaoq #swineflu #H1N1";;;#swineflu #H1N1;"1960493063";https://twitter.com/swinefluh1n1/status/1960493063
swinefluh1n1;2009-05-29 15:02;0;0;""Third Muskegon County resident found to have H1N1 flu" http://tinyurl.com/ndeeum #swineflu #H1N1";;;#swineflu #H1N1;"1960487724";https://twitter.com/swinefluh1n1/status/1960487724
Lyne_Robichaud;2009-05-29 15:02;0;0;"RT @peterosbornuk UK health officials confirm that 12 patients in England contracted swine flu , bringing the UK total to 215 #swineflu #h1n1";;@peterosbornuk;#swineflu #h1n1;"1960486458";https://twitter.com/Lyne_Robichaud/status/1960486458
streetbloggers;2009-05-29 15:02;0;0;"Swine Flu exposed http://bit.ly/WjtUp";;;;"1960483746";https://twitter.com/streetbloggers/status/1960483746
fluarticles;2009-05-29 15:01;0;0;"U.S. official in France diagnosed with swine flu : French authorities say a U.S. official in Normandy to prepare .. http://ping.fm/MWeg1";;;;"1960481004";https://twitter.com/fluarticles/status/1960481004
fluarticles;2009-05-29 15:01;0;0;"US Takes Stock Of H1N1 Situation: After roughly a month of emergency response to the new H1N1 swine flu virus, U.. http://ping.fm/megRV";;;;"1960480678";https://twitter.com/fluarticles/status/1960480678
novelh1n1;2009-05-29 15:01;0;0;"http://novelh1n1.com CSL Biotherapies to supply HHS with swine flu vaccine antigen - MSN Mon.. http://bit.ly/X4ibN";;;;"1960478684";https://twitter.com/novelh1n1/status/1960478684
novelh1n1;2009-05-29 15:01;0;0;"http://novelh1n1.com Update on confirmed swine flu cases: 12 further patients under investig.. http://bit.ly/n6sAT";;;;"1960475388";https://twitter.com/novelh1n1/status/1960475388
novelh1n1;2009-05-29 15:01;0;0;"http://novelh1n1.com Swine Flu , H1N1 Virus Outbreak Case Incident Report - Imperial Valley N.. http://bit.ly/yFCVL";;;;"1960474508";https://twitter.com/novelh1n1/status/1960474508
Lyne_Robichaud;2009-05-29 15:01;0;0;"RT @peterosbornuk A school in the Handsworth area now has 74 children with the virus, the UK's biggest single outbreak. #swineflu #h1n1";;@peterosbornuk;#swineflu #h1n1;"1960474381";https://twitter.com/Lyne_Robichaud/status/1960474381
diseasesonline;2009-05-29 15:01;0;0;"http://tr.im/meld Health officials: Illinois man dies from swine flu : The man is the third pers.. http://tinyurl.com/n92wsm";;;;"1960473583";https://twitter.com/diseasesonline/status/1960473583
Amatus23;2009-05-29 15:00;0;0;"6 schools closed today because of swine flu in NY...really...wow.";;;;"1960467650";https://twitter.com/Amatus23/status/1960467650
NutritionWndlnd;2009-05-29 15:00;0;0;"1st official #swineflu case that shows transmission without direct contact - http://is.gd/J6tc, translation: the pandemic is already here";;;#swineflu;"1960467482";https://twitter.com/NutritionWndlnd/status/1960467482
flunews_;2009-05-29 15:00;0;0;"Probable swine flu case in Wales http://bit.ly/iDFak #swineflu";;;#swineflu;"1960463332";https://twitter.com/flunews_/status/1960463332
flunews_;2009-05-29 15:00;0;0;"Further swine flu cases confirmed http://bit.ly/1xgWf #swineflu";;;#swineflu;"1960462846";https://twitter.com/flunews_/status/1960462846
flunews_;2009-05-29 15:00;0;0;"More flu cases at primary school http://bit.ly/Hq2OE #swineflu";;;#swineflu;"1960462303";https://twitter.com/flunews_/status/1960462303
es5nhc;2009-05-29 14:59;0;0;"http://uudised.err.ee/index.php?06166261 Breaking: Preliminary analysis indicates that H1N1(a.k.a swine flu ) has reached Estonia!";;;;"1960454569";https://twitter.com/es5nhc/status/1960454569
FunAdvice;2009-05-29 14:59;0;0;"ndubz swine flu : is it true tulissa from ndubz had swine flu ? loads of people were saying she did/d... http://www.funadvice.com/r/389830";;;;"1960452175";https://twitter.com/FunAdvice/status/1960452175
SWINE_H1N1;2009-05-29 14:58;0;0;"Swine Flu Vaccine Won't Be Ready Until October: CDC - Atlanta Journal Constitution (http://cli.gs/VHqMR3)";;;;"1960446350";https://twitter.com/SWINE_H1N1/status/1960446350
SWINE_FLU_VRUS;2009-05-29 14:58;0;0;"China releases US school group quarantined over flu concerns - CNN http://bit.ly/j0TQF";;;;"1960445982";https://twitter.com/SWINE_FLU_VRUS/status/1960445982
SWINE_FLU_VRUS;2009-05-29 14:58;0;0;"US Takes Stock Of H1N1 Situation http://bit.ly/LfB5v";;;;"1960445112";https://twitter.com/SWINE_FLU_VRUS/status/1960445112
SWINE_H1N1;2009-05-29 14:58;0;0;"New swine flu cases point to invisible pandemic (http://cli.gs/SUzXGn)";;;;"1960443068";https://twitter.com/SWINE_H1N1/status/1960443068
SWINE_H1N1;2009-05-29 14:58;0;0;"Journal says swine flu needs a better name (http://cli.gs/4QH9Ph)";;;;"1960441113";https://twitter.com/SWINE_H1N1/status/1960441113
health_tweets;2009-05-29 14:58;0;0;"Rheumatoid Arthritis Drug Might Fight Swine Flu (HealthDay) HealthDay - FRIDAY, May 29 (HealthDay News) -- Scientis.. http://snipr.com/j0o08";;;;"1960439595";https://twitter.com/health_tweets/status/1960439595
SwineFluNewsIE;2009-05-29 14:57;0;0;"Swine Flu Media Bulletin Issued At: 11am Thursday 21 May 2009, Wales http://tinyurl.com/mo7byj";;;;"1960437679";https://twitter.com/SwineFluNewsIE/status/1960437679
SWINE_FLU_VRUS;2009-05-29 14:57;0;0;"Swine Flu Hits Local (Baristanet) http://bit.ly/xPpFF";;;;"1960436860";https://twitter.com/SWINE_FLU_VRUS/status/1960436860
SWINE_H1N1;2009-05-29 14:57;0;0;"Swine Flu Hits Local (Baristanet) (http://cli.gs/EQgusg)";;;;"1960435536";https://twitter.com/SWINE_H1N1/status/1960435536
SwineFluNewsSG;2009-05-29 14:57;0;0;"Swine Flu in Greek Students May Point to Outbreak in Edinburgh, Study Says http://tinyurl.com/kuu4dj";;;;"1960435164";https://twitter.com/SwineFluNewsSG/status/1960435164
SWINE_FLU_VRUS;2009-05-29 14:57;0;0;"County Takes Non-Alarmist Approach To H1N1 Influenza - Webster Kirkwood Times http://bit.ly/1aEu3R";;;;"1960434506";https://twitter.com/SWINE_FLU_VRUS/status/1960434506
swinflunews;2009-05-29 14:57;0;0;"swine flu sing a long http://ff.im/-3ncyg";;;;"1960434180";https://twitter.com/swinflunews/status/1960434180
swinflunews;2009-05-29 14:57;0;0;"Project: How to prevent Swine Flu Infection. http://ff.im/-3ncx6";;;;"1960434146";https://twitter.com/swinflunews/status/1960434146
swinflunews;2009-05-29 14:57;0;0;"Worst Swine Flu Puppet Show Ever http://ff.im/-3ncyi";;;;"1960433998";https://twitter.com/swinflunews/status/1960433998
H1N1VirusNews;2009-05-29 14:57;0;0;"<b> Swine Flu </b>-Worried Parents Want Their Schools To Close - Gothamist <b>...</b> http://cli.gs/NDvHd9";;;;"1960432638";https://twitter.com/H1N1VirusNews/status/1960432638
SWINE_H1N1;2009-05-29 14:57;0;0;"CSL Biotherapies to supply HHS with swine flu vaccine antigen - Bizjournals.com (http://cli.gs/gPqrsW)";;;;"1960431800";https://twitter.com/SWINE_H1N1/status/1960431800
difflam;2009-05-29 14:56;0;0;"Health officials: Illinois man dies from swine flu http://bit.ly/edCir";;;;"1960427151";https://twitter.com/difflam/status/1960427151
SWINE_H1N1;2009-05-29 14:56;0;0;"France: Swine Flu Hits US Official Preparing For Obama's Visit (http://cli.gs/Q85Mpm)";;;;"1960421310";https://twitter.com/SWINE_H1N1/status/1960421310
TerenceShepherd;2009-05-29 14:56;0;0;"Swine flu sickens 3 crew members on the Pacific Dawn http://tr.im/mNsP";;;;"1960418389";https://twitter.com/TerenceShepherd/status/1960418389
OrganicNetwork;2009-05-29 14:55;0;0;"US Takes Stock Of H1N1 Situation: After roughly a month of emergency response to the new H1N1 swine flu virus, U.. http://bit.ly/1zpSYi";;;;"1960412872";https://twitter.com/OrganicNetwork/status/1960412872
Swineflu_wires;2009-05-29 14:55;0;0;"New post: First Confirmed Case of H1N1 In Brazos (http://cli.gs/mZM2Bj)";;;;"1960412405";https://twitter.com/Swineflu_wires/status/1960412405
SwineFluNewsAU;2009-05-29 14:54;0;0;"Hotels spurn swine flu siege plan http://tinyurl.com/lftcng";;;;"1960401612";https://twitter.com/SwineFluNewsAU/status/1960401612
EducatePlus;2009-05-29 14:54;0;0;"News: More children may have swine flu http://cli.gs/d3h6eD";;;;"1960398854";https://twitter.com/EducatePlus/status/1960398854
cityhealthnews;2009-05-29 14:54;0;0;"Rheumatoid Arthritis Drug Might Fight Swine Flu (HealthDay): HealthDay - FRIDAY, May 29 (HealthDay News) -- Scie.. http://cli.gs/eSJ4ev";;;;"1960397315";https://twitter.com/cityhealthnews/status/1960397315
hebrewzzi;2009-05-29 14:53;0;0;"The swine has made it's way to my office...co-worker's bf has it...and she just touched my paycheck...oink oink... :-( #swineflu";;;#swineflu;"1960395214";https://twitter.com/hebrewzzi/status/1960395214
nolasaintsfan_;2009-05-29 14:52;0;0;"Qivana Health Tweet Rheumatoid Arthritis Drug Might Fight Swine Flu http://bit.ly/EmJrO";;;;"1960386102";https://twitter.com/nolasaintsfan_/status/1960386102
BrooklynBiggz;2009-05-29 14:52;0;0;"my fuccin job swineflu . n they aint sayin ahit so now they need 2 close the buildings or else!!!!!!!!";;;;"1960382519";https://twitter.com/BrooklynBiggz/status/1960382519
newsero;2009-05-29 14:52;0;0;"Eton pupil tested for swine flu ... http://newsero.com/228311";;;;"1960377428";https://twitter.com/newsero/status/1960377428
jamieholden;2009-05-29 14:52;0;0;"Never say sorry for flurry of posts... I just twote all over the place, hey it's cold - I thought I had swine flu ... what can I tell you...";;;;"1960376425";https://twitter.com/jamieholden/status/1960376425
MarylandMudflap;2009-05-29 14:51;0;0;"I'll get Swine Flu ....when Pigs Fly.";;;;"1960376127";https://twitter.com/MarylandMudflap/status/1960376127
milkyjoe75;2009-05-29 14:51;0;0;"whats happened to swine flu ??? or has everyone jumped off that bandwagon and now its all about MP's? trends are so difficult to follow!";;;;"1960367936";https://twitter.com/milkyjoe75/status/1960367936
jordancook;2009-05-29 14:50;0;0;"@wyllycoyote hopefully of isn't swine flu ...oink oink";;@wyllycoyote;;"1960364135";https://twitter.com/jordancook/status/1960364135
swinflunews;2009-05-29 14:50;0;0;"[Video] swine flu sing a long - http://tinyurl.com/lrjhr5";;;;"1960356140";https://twitter.com/swinflunews/status/1960356140
985WNYR;2009-05-29 14:50;0;0;"FLDN: Cayuga County Has 1st Swine Flu Case- An Onondaga County student attending a Cayuga County private school... http://twurl.nl/2ubdoc";;;;"1960356062";https://twitter.com/985WNYR/status/1960356062
TheOOC;2009-05-29 14:49;0;0;"How do you know when swine flu has turned serious? The Centers for Disease Control and Prevention explains http://tr.im/mNrH";;;;"1960353938";https://twitter.com/TheOOC/status/1960353938
ah1n1;2009-05-29 14:49;0;0;"Forget about H1N1 or Swine Flu . With 4 deaths out of 5 infected, the Lujo vius will be the new scare http://twurl.cc/113f";;;;"1960349227";https://twitter.com/ah1n1/status/1960349227
chrispugh;2009-05-29 14:49;0;1;"I love this 'Keep Calm and Don't Sneeze' poster for Swine Flu campaign: http://www.workforfood.nu/dontsneeze";;;;"1960345188";https://twitter.com/chrispugh/status/1960345188
