username;date;retweets;favorites;text;geo;mentions;hashtags;id;permalink
SwineFluNewsCA;2009-05-22 16:23;0;0;"Swine Flu News: Report: Following swine flu outbreak, pigs should be monitored some-more closely http://tinyurl.com/qnk4on";;;;"1883967587";https://twitter.com/SwineFluNewsCA/status/1883967587
itemlive;2009-05-22 16:23;0;0;"update: Swine flu hits Revere's Garfield School http://tinyurl.com/r23f63";;;;"1883967336";https://twitter.com/itemlive/status/1883967336
pharmaguy;2009-05-22 16:22;0;0;"NIH announces $1Bn windfall for drug companies to prepare H1N! ( #swineflu ) vaccine http://bit.ly/tAcaK";;;#swineflu;"1883961434";https://twitter.com/pharmaguy/status/1883961434
Newsplex;2009-05-22 16:22;0;0;"US Sets Aside $1 Billion for Swine Flu Vaccine: The government is setting aside $1 billion to pursue a vaccine a.. http://tinyurl.com/psn6sa";;;;"1883958523";https://twitter.com/Newsplex/status/1883958523
BusinessSpec;2009-05-22 16:22;0;0;"Latest News US directs $US1bn for new swine flu vaccine http://tinyurl.com/prb2da";;;;"1883956053";https://twitter.com/BusinessSpec/status/1883956053
swineflu2;2009-05-22 16:22;0;0;"#swineflu More than 50 confirmed swine flu cases in NYC - The Daily News Online: myfoxny.comMore than 5.. http://tinyurl.com/ps789b";;;#swineflu;"1883954257";https://twitter.com/swineflu2/status/1883954257
HelenBranswell;2009-05-22 16:21;0;0;"WHO goalposts for #swineflu pandemic moving rapidly";;;#swineflu;"1883948577";https://twitter.com/HelenBranswell/status/1883948577
LondonSearch;2009-05-22 16:21;0;0;"BBC London: Eight more UK cases of swine flu http://tr.im/m7fW";;;;"1883946373";https://twitter.com/LondonSearch/status/1883946373
TecNasty;2009-05-22 16:20;0;0;"www.TecNasty.com Eight more UK cases of swine flu http://ow.ly/8zad";;;;"1883942085";https://twitter.com/TecNasty/status/1883942085
rsspberry;2009-05-22 16:20;0;0;"US Sets Aside Billion for Swine Flu Vaccine - http://rsspberry.com/view/76573/";;;;"1883941837";https://twitter.com/rsspberry/status/1883941837
Fluheadlines;2009-05-22 16:20;0;0;"Fluheadlines China, Hong Kong announce new swine flu cases: BEIJING (AP) - The spread of swine flu c.. http://tinyurl.com/oofhjl";;;;"1883941490";https://twitter.com/Fluheadlines/status/1883941490
rsspberry;2009-05-22 16:20;0;0;"US sets aside billion for swine flu vaccine - The Associated Press - http://rsspberry.com/view/76572/";;;;"1883941117";https://twitter.com/rsspberry/status/1883941117
foodbloggernews;2009-05-22 16:20;0;0;"Topix - Food Wire: 4 NYC schools closed because of swine flu reopen: ... at the jails at Riker.. http://tinyurl.com/o7m4t2";;;;"1883939885";https://twitter.com/foodbloggernews/status/1883939885
Fluheadlines;2009-05-22 16:20;0;0;"Fluheadlines Swine flu spoils wedding: A FATHER-OF-THE-BRIDE was prevented from walking his daughter.. http://tinyurl.com/rxkmc7";;;;"1883939768";https://twitter.com/Fluheadlines/status/1883939768
Fluheadlines;2009-05-22 16:20;0;0;"Fluheadlines Swine flu still deadly threat: Swine flu may have finally fallen off the front pages bu.. http://tinyurl.com/p8uqfg";;;;"1883938025";https://twitter.com/Fluheadlines/status/1883938025
CrisisWatch;2009-05-22 16:20;0;0;"*EMM Disease Alerts* Swine Flu Outbreak May Be Subsiding, CDC Says http://tinyurl.com/osm49y";;;;"1883936769";https://twitter.com/CrisisWatch/status/1883936769
rilescat;2009-05-22 16:20;0;0;"Swine Flu Outbreak May Be on the Wane: CDC (HealthDay): HealthDay - FRIDAY, May 22 (HealthDay News) -- While man.. http://tinyurl.com/p8jscs";;;;"1883935665";https://twitter.com/rilescat/status/1883935665
amjohnno;2009-05-22 16:20;0;0;"RT @imule : If you get an email warning you not to eat tinned pork due to swine flu please ignore as it is just Spam (via @Thunder_God ) Haha!";;@imule @Thunder_God;;"1883935393";https://twitter.com/amjohnno/status/1883935393
jackiesheldon;2009-05-22 16:19;0;0;"RT @NCCitizen : News: Clatsop County reveals local swine flu case http://tinyurl.com/oxqeow";;@NCCitizen;;"1883929132";https://twitter.com/jackiesheldon/status/1883929132
vow_vow;2009-05-22 16:19;0;0;"I think God doesn't want me to catch swine flu - too many obstacles!";;;;"1883925151";https://twitter.com/vow_vow/status/1883925151
samozzy;2009-05-22 16:18;0;0;"Don't know why, but Cat Face is suddenly recommended for me on YouTube. Will look after watching Swine Flu by @originaltyler";;@originaltyler;;"1883913760";https://twitter.com/samozzy/status/1883913760
zeroping;2009-05-22 16:17;0;0;"WHO chief Swine flu will keep spreading globally http://newsbb.org/?p=34974";;;;"1883909902";https://twitter.com/zeroping/status/1883909902
malfletcher;2009-05-22 16:17;0;0;"...expect new stories re SWINE FLU in nxt month as no. of new cases grows in s'thern hemisphere & in Asia - & the 'worried well' get active";;;;"1883907229";https://twitter.com/malfletcher/status/1883907229
SeriouslyGuys;2009-05-22 16:17;0;0;"Swine Flu ? More like Swinging Flu, am I right?: We’re not here to make a big deal of something that should.. http://tinyurl.com/obyvlw";;;;"1883902343";https://twitter.com/SeriouslyGuys/status/1883902343
lurendreyer;2009-05-22 16:16;0;1;"RT @idioten It's bizarre when 100 people die of swineflu people wear facemasks, yet millions die of AIDS and nobody wants to wear a condom.";;@idioten;;"1883898272";https://twitter.com/lurendreyer/status/1883898272
BriefNews;2009-05-22 16:16;0;0;"U.S. directs $1 billion for new swine flu vaccine (Reuters) http://cli.gs/VHAq38 #linktweet";;;#linktweet;"1883897819";https://twitter.com/BriefNews/status/1883897819
newhealthtopics;2009-05-22 16:16;0;0;"Published a new post: Swine Flu Media Bulletin Issued At: 11am Monday 18 May 2009, Wales ( http://www.bionews.zampbioworld.org/index.php ...";;;;"1883892391";https://twitter.com/newhealthtopics/status/1883892391
breakingflunews;2009-05-22 16:15;0;0;"breakingflunews.com Sixth swine flu case confirmed in Taiwan - eTaiwan News: Washington PostS.. http://tinyurl.com/qtwt9r";;;;"1883887588";https://twitter.com/breakingflunews/status/1883887588
jaggerkieth;2009-05-22 16:15;0;0;"New Blog post Season change could spread swine flu in Asia-Pacific http://bit.ly/1K9CF ...";;;;"1883886694";https://twitter.com/jaggerkieth/status/1883886694
MikeBusson;2009-05-22 16:15;0;0;"Despite what people are saying, I have a heavy cold. It's not swine flu . I have not..NOT..had carnal knowledge of a pig";;;;"1883886050";https://twitter.com/MikeBusson/status/1883886050
swinflunews;2009-05-22 16:15;0;0;"N.Y./Region: Hospitals Confront Fear of Swine Flu - NYTimes http://ff.im/-39gAS";;;;"1883885467";https://twitter.com/swinflunews/status/1883885467
breakingflunews;2009-05-22 16:15;0;0;"breakingflunews.com Confirmed cases of swine flu rise to 366 in NY - WRGB: Confirmed cases of.. http://tinyurl.com/qhd38l";;;;"1883885242";https://twitter.com/breakingflunews/status/1883885242
breakingflunews;2009-05-22 16:15;0;0;"breakingflunews.com Sebelius directs $1B for swine flu vaccine - Kansas City Star: Sebelius d.. http://tinyurl.com/r5hl3f";;;;"1883884159";https://twitter.com/breakingflunews/status/1883884159
swinflunews;2009-05-22 16:15;0;0;"Japan sees spike in swine flu cases WHO warns of raising pandemic alert to level 6 http://ff.im/-39gAT";;;;"1883884049";https://twitter.com/swinflunews/status/1883884049
Reuters_Health;2009-05-22 16:15;0;0;"U.S. directs $1 billion for new swine flu vaccine http://r.reuters.com/myc95c";;;;"1883882738";https://twitter.com/Reuters_Health/status/1883882738
malfletcher;2009-05-22 16:15;0;0;"All eyes on southern hemisphere coming into its flu season, 2c whether SWINE FLU will spread faster than regular. http://tinyurl.com/p5so6x";;;;"1883881623";https://twitter.com/malfletcher/status/1883881623
SwineFlu_news;2009-05-22 16:15;0;0;"WHO chief warns of danger, unpredicability of A/H1N1 virus http://t.love.com/216148831";;;;"1883880210";https://twitter.com/SwineFlu_news/status/1883880210
JackKrupansky;2009-05-22 16:14;0;0;"CDC: 6,552 confirmed H1N1 ( swine flu ) cases in 48 states, 9 dead. 14% daily growth rate. Doubled in 9 days. http://tinyurl.com/cb3rkm";;;;"1883876311";https://twitter.com/JackKrupansky/status/1883876311
yourshoppe88;2009-05-22 16:13;0;0;"Swine flu genes circulated undetected for years (AP) : AP - Genes included in the new swine flu may have been .. http://bit.ly/Fi9ql";;;;"1883865449";https://twitter.com/yourshoppe88/status/1883865449
ICAV;2009-05-22 16:13;0;0;"RT @peterosbornuk :Chan, the head of WHO is now saying she is waiting "until it's clearly gone global" which is NOT the definition #swineflu";;@peterosbornuk;#swineflu;"1883865166";https://twitter.com/ICAV/status/1883865166
Ammouni;2009-05-22 16:13;0;0;"Mexico is offering free vacation for people infected with Swine flu . Anyone infected wants to have dinner with me? :)";;;;"1883864626";https://twitter.com/Ammouni/status/1883864626
radiochannel;2009-05-22 16:13;0;0;"WHO: 42 Countries Report Swine Flu Cases http://tinyurl.com/rabk3h";;;;"1883863663";https://twitter.com/radiochannel/status/1883863663
HealthWebBlog;2009-05-22 16:13;0;0;"Swine flu deters Japanese from traveling to Hawaii - BusinessWeek (http://cli.gs/nQEdSJ)";;;;"1883862444";https://twitter.com/HealthWebBlog/status/1883862444
gotswineflu;2009-05-22 16:12;0;0;"Swine Flu Detection in Japan Delayed by Traveler Screening, Doctor... http://ow.ly/8yZ0";;;;"1883857264";https://twitter.com/gotswineflu/status/1883857264
gotswineflu;2009-05-22 16:12;0;0;"Dead Rising 2 Skipping E3 Due to Swine Flu http://ow.ly/8yYZ";;;;"1883856708";https://twitter.com/gotswineflu/status/1883856708
gotswineflu;2009-05-22 16:12;0;0;"UT: Utah's first H1N1 swine flu-linked death is 21-year-old man http://ow.ly/8yYW";;;;"1883856154";https://twitter.com/gotswineflu/status/1883856154
gotswineflu;2009-05-22 16:12;0;0;"Group decides priorities for swine flu vaccines http://ow.ly/8yYU";;;;"1883855884";https://twitter.com/gotswineflu/status/1883855884
news_science;2009-05-22 16:12;0;1;"Study of swine flu genome shows segments circulated in pigs for at ... http://cli.gs/eQNBQN #LinkTweet";;;#LinkTweet;"1883848793";https://twitter.com/news_science/status/1883848793
leofixer;2009-05-22 16:11;0;0;"Swine flu to hit world's poor harder: WHO (AFP): AFP - Global health chiefs warned on Friday that swine flu could soon hit http://is.gd/CoAI";;;;"1883844585";https://twitter.com/leofixer/status/1883844585
baja123;2009-05-22 16:11;0;0;"Mexico City ends swine flu alert, no cases in week http://twurl.nl/sh8h0h";;;;"1883843498";https://twitter.com/baja123/status/1883843498
RudyABC15;2009-05-22 16:11;0;0;"Both the radiator motor and ac motor out on car. Same thing happened to a crv here this week. Swine flu of honda!";;;;"1883843091";https://twitter.com/RudyABC15/status/1883843091
SwineFluNewsORG;2009-05-22 16:11;0;0;"Swine Flu News: Flu Spreads, though Some Countries Ease Measures http://tinyurl.com/odw559";;;;"1883840800";https://twitter.com/SwineFluNewsORG/status/1883840800
NewsX;2009-05-22 16:11;0;0;"WHO chief issues dire warning over swine flu http://tinyurl.com/pz3l3z";;;;"1883840192";https://twitter.com/NewsX/status/1883840192
Crof;2009-05-22 16:10;0;0;"Blogging 'Chan: Swine flu will keep spreading globally' http://bit.ly/7EXu3";;;;"1883833912";https://twitter.com/Crof/status/1883833912
ourmaninchicago;2009-05-22 16:10;0;0;"We're not #1! We're not #1! RT @annsaphir IL no longer #1 in reported swine flu cases: Texas is, with 900, CDC figures show.";;@annsaphir;#1 #1 #1;"1883833019";https://twitter.com/ourmaninchicago/status/1883833019
DiggPics;2009-05-22 16:10;0;1;""Root Cause Analysis of Swine Flu Revealed [IMAGE]" - http://digg.com/d2rqo2?OTC-twf16";;;;"1883826643";https://twitter.com/DiggPics/status/1883826643
panja47;2009-05-22 16:09;0;0;"Eww. Swine flu has hit adelaide and also my old school blackfrairs. I hope everyone is okay!!";;;;"1883823207";https://twitter.com/panja47/status/1883823207
Alderalarms;2009-05-22 16:09;0;0;"Swine Flu Travel Tips - Swine Flu and Travel to Mexico http://u.mavrev.com/579d";;;;"1883822262";https://twitter.com/Alderalarms/status/1883822262
EdibleSF;2009-05-22 16:09;0;0;"RT @NaomiStarkman : Food & Water Watch Op Ed: This is Your Pig on Drugs http://twurl.nl/nmwdmm Swine flu this baby.";;@NaomiStarkman;;"1883822107";https://twitter.com/EdibleSF/status/1883822107
mobileauto;2009-05-22 16:09;0;0;"U.S. directs $1 billion for new swine flu vaccine: WASHINGTON (Reuters) - The U.S. government said on Friday tha.. http://tinyurl.com/pjcslf";;;;"1883819117";https://twitter.com/mobileauto/status/1883819117
BuzzG_com;2009-05-22 16:08;0;0;"New blog post: Old seasonal flu antibodies may be active against swine flu virus http://bit.ly/6ajOJ";;;;"1883813455";https://twitter.com/BuzzG_com/status/1883813455
JennerEvans;2009-05-22 16:08;0;0;"On the way to Viva....surrounded by total swine flu !!";;;;"1883811212";https://twitter.com/JennerEvans/status/1883811212
lordredrock;2009-05-22 16:08;0;0;"Swine flu genes circulated undetected for years: The Associated Press WASHINGTON (AP) — Genes included in the ne.. http://tinyurl.com/q4g89p";;;;"1883809820";https://twitter.com/lordredrock/status/1883809820
lordredrock;2009-05-22 16:08;0;0;"The James Clayton Column: Cinematically swiping at swine - Den of Geek: Do you remember swine flu ? About two or .. http://tinyurl.com/o45fmz";;;;"1883805723";https://twitter.com/lordredrock/status/1883805723
lordredrock;2009-05-22 16:08;0;0;"Swine Flu Travel Tips - Swine Flu and Travel to Mexico: Find out what measures to take to prevent the spread of .. http://tinyurl.com/ppuxx8";;;;"1883805231";https://twitter.com/lordredrock/status/1883805231
alert112;2009-05-22 16:07;0;0;"msnbc.com New York, NY: Swine Flu Victim's Son Pitches N... Windows Live Alerts from msnbc.com Local: Northeast states";;;;"1883801489";https://twitter.com/alert112/status/1883801489
WMCActionNews5;2009-05-22 16:07;0;0;"Swine flu genes circulated undetected for years http://tinyurl.com/olcoqd";;;;"1883801205";https://twitter.com/WMCActionNews5/status/1883801205
YourCarTips;2009-05-22 16:07;0;0;"Check out this Vid: Swine Flu 101: 9 My Thoughts on the .... via @twttblogs http://bit.ly/DuI8s";;@twttblogs;;"1883795017";https://twitter.com/YourCarTips/status/1883795017
vshchen;2009-05-22 16:06;0;0;"Taiwan's swine-flu cases double to six http://bit.ly/2pFutG (God bless everyone!)";;;;"1883794209";https://twitter.com/vshchen/status/1883794209
SwineFluNewsEU;2009-05-22 16:05;0;0;"Swine Flu News: CDC: H1N1 Genes Went Undetected For A Decade http://tinyurl.com/oamsw4";;;;"1883782862";https://twitter.com/SwineFluNewsEU/status/1883782862
WorldFootprints;2009-05-22 16:05;0;0;"Mexico City ends swine flu alert, no cases in week http://tinyurl.com/r3fuuf";;;;"1883775888";https://twitter.com/WorldFootprints/status/1883775888
greatjoebivins;2009-05-22 16:05;0;0;"YES! ninja ron paul vampire cougar enema cyborg work from home singles American Idol swine flu gay marriage jaguar elephant #followbotbait";;;#followbotbait;"1883774173";https://twitter.com/greatjoebivins/status/1883774173
MsRebecca;2009-05-22 16:04;0;0;"Dear cold/allergies/ swine flu : please take your symptoms and bugger off. Don't you know it's the start of a long weekend? Thankyouverymuch.";;;;"1883772130";https://twitter.com/MsRebecca/status/1883772130
NCCitizen;2009-05-22 16:04;0;0;"News: Clatsop County reveals local swine flu case http://tinyurl.com/oxqeow";;;;"1883771645";https://twitter.com/NCCitizen/status/1883771645
melissakeyes;2009-05-22 16:04;0;0;"Swine flu genes circulated undetected for years - ummm interesting reading http://bit.ly/iGouB";;;;"1883769667";https://twitter.com/melissakeyes/status/1883769667
jqwall;2009-05-22 16:04;0;0;"Swine flu cannot kill bacon's mojo. Did you miss out on breakfast, have no fear: http://tiny.cc/fYeFK";;;;"1883767814";https://twitter.com/jqwall/status/1883767814
ChicagoDiane;2009-05-22 16:04;0;0;"Yea Illinois!! RT @annsaphir : Illinois no longer #1 in reported swine flu cases: that distinction goes to Texas, with 900, CDC figures show.";;@annsaphir;#1;"1883767334";https://twitter.com/ChicagoDiane/status/1883767334
fullnelson;2009-05-22 16:04;0;0;"RT @BKCyclones : 'Son throws no-hitter to honor dad, the first swine flu victim in NYC' http://tinyurl.com/q3man4 -Seriously, a must read!";;@BKCyclones;;"1883766315";https://twitter.com/fullnelson/status/1883766315
erosdavid4real;2009-05-22 16:04;0;0;"RT @robhuebel Several older asian women wearing swine-flu masks on this plane. Somehow that turns me on.";;@robhuebel;;"1883764650";https://twitter.com/erosdavid4real/status/1883764650
_101_;2009-05-22 16:04;0;0;"[news] WHO: 42 Countries Report Swine Flu Cases - Voice of America: Washington PostWHO: 42 Countries Repor.. http://tinyurl.com/q9bwjn";;;;"1883762546";https://twitter.com/_101_/status/1883762546
H1N1VirusNews;2009-05-22 16:03;0;0;"<b> Swine flu </b>: why are older people (apparently) less at risk <b>...</b> http://cli.gs/W25MLV";;;;"1883759693";https://twitter.com/H1N1VirusNews/status/1883759693
kinboshi;2009-05-22 16:03;0;0;"RT @newscientist : H1N1 #swineflu passes WHO rules to be classified as a pandemic - but all is quiet? http://tinyurl.com/p5so6x";;@newscientist;#swineflu;"1883752033";https://twitter.com/kinboshi/status/1883752033
Y_Atide;2009-05-22 16:03;0;1;"Town's first victim of swine flu http://ow.ly/8yL3";;;;"1883751567";https://twitter.com/Y_Atide/status/1883751567
novelh1n1;2009-05-22 16:02;0;0;"http://novelh1n1.com Update on confirmed swine flu cases: Five further patients under invest.. http://bit.ly/VbCKH";;;;"1883749583";https://twitter.com/novelh1n1/status/1883749583
novelh1n1;2009-05-22 16:02;0;0;"http://novelh1n1.com Spanish soldiers quarantined in swine flu scare: Madrid - Around 60 sol.. http://bit.ly/6gBS2";;;;"1883748718";https://twitter.com/novelh1n1/status/1883748718
_101_;2009-05-22 16:02;0;0;"[bbc] Eight more UK cases of swine flu : Eight new cases of swine flu have been confirmed in England and Sco.. http://tinyurl.com/ovh844";;;;"1883748221";https://twitter.com/_101_/status/1883748221
annsaphir;2009-05-22 16:02;0;0;"Illinois no longer #1 in reported swine flu cases: that distinction goes to Texas, with 900, CDC figures show.";;;#1;"1883746111";https://twitter.com/annsaphir/status/1883746111
BBC_Hampshire;2009-05-22 16:02;0;0;"BBC News: A man has been confirmed as Hampshire's first case of swine flu , the Health Protection Agency.. http://tinyurl.com/oh2ynl";;;;"1883741413";https://twitter.com/BBC_Hampshire/status/1883741413
SwineFluNewsCA;2009-05-22 16:02;0;0;"Swine Flu News: WHO confirms 11,168 A/H1N1 swine flu cases worldwide, 86 deaths http://tinyurl.com/p32ckq";;;;"1883741089";https://twitter.com/SwineFluNewsCA/status/1883741089
webtipsfree;2009-05-22 16:01;0;0;"U.S. directs $1 billion for new swine flu vaccine: WASHINGTON (Reuters) - The U.S. government said on Friday tha.. http://tinyurl.com/pjcslf";;;;"1883737686";https://twitter.com/webtipsfree/status/1883737686
illinoisBNN;2009-05-22 16:01;0;0;"Catalyst-Chicago - District 299: Friday Morning News: Swine flu confirmed at Lincolnshire school Sun Times A sec.. http://tinyurl.com/o3uuwy";;;;"1883734917";https://twitter.com/illinoisBNN/status/1883734917
froggensays;2009-05-22 16:01;0;0;"RT @newscientist H1N1 #swineflu passes WHO rules to be classified as a pandemic - so why haven't they declared it? http://tinyurl.com/p5so6x";;@newscientist;#swineflu;"1883733349";https://twitter.com/froggensays/status/1883733349
HelenBranswell;2009-05-22 16:01;0;0;"WHO's Fukuda: Phase 6 def changing, but can't define how exactly now. "looking 4 significant increased risk of harm to people" #swineflu";;;#swineflu;"1883731282";https://twitter.com/HelenBranswell/status/1883731282
NHSE_infections;2009-05-22 16:01;0;0;"Info: Assessing the severity of an influenza pandemic http://bit.ly/PSNzY #swineflu H1N1";;;#swineflu;"1883730290";https://twitter.com/NHSE_infections/status/1883730290
NHSE_infections;2009-05-22 16:00;0;0;"Info: NHS Choices' information page http://www.nhs.uk/AlertsEmergencies/Pages/Pandemicflualert.aspx #swineflu H1N1";;;#swineflu;"1883729000";https://twitter.com/NHSE_infections/status/1883729000
shannalolson;2009-05-22 16:00;0;0;"well it turns out yesterday i had a fever of 101.5 and i thought i had swine flu ...i was also talkin nonsense to mt mom..funny stuff";;;;"1883728880";https://twitter.com/shannalolson/status/1883728880
swineflu_news_;2009-05-22 16:00;0;0;"Swine flu genes circulated undetected for years: The Associated Press WASHINGTON (AP) — Genes included in the ne.. http://bit.ly/3ZP9y";;;;"1883728488";https://twitter.com/swineflu_news_/status/1883728488
swineflu_news_;2009-05-22 16:00;0;0;"WHO urges hospitals to join climate change battle: By Katie Reid GENEVA (Reuters) - Hospitals and their emergenc.. http://tinyurl.com/p6u44j";;;;"1883727563";https://twitter.com/swineflu_news_/status/1883727563
flintjournal;2009-05-22 16:00;0;0;"UPDATE: Hospital care for Saginaw County's first confirmed swine flu victim http://bit.ly/2ciRb";;;;"1883723776";https://twitter.com/flintjournal/status/1883723776
wopularall;2009-05-22 16:00;0;0;"Swine flu genes circulated undetected for years http://ff.im/-39eBJ";;;;"1883721448";https://twitter.com/wopularall/status/1883721448
swinflunews;2009-05-22 16:00;0;0;"[Video]Japan sees spike in swine flu cases WHO warns of raising pandemic alert to level 6 - http://tinyurl.com/ocrhv9";;;;"1883721243";https://twitter.com/swinflunews/status/1883721243
SwineFlu_news;2009-05-22 16:00;0;0;"US sets aside $1 billion for swine flu vaccine http://t.love.com/216150630";;;;"1883720506";https://twitter.com/SwineFlu_news/status/1883720506
EcoBizNews;2009-05-22 15:59;0;0;"The U.S. government is setting aside $1B to develop a vaccine for swine flu . http://ow.ly/8zkk";;;;"1883715438";https://twitter.com/EcoBizNews/status/1883715438
StaceySinger;2009-05-22 15:59;0;0;"Interesting genetic analysis of #swine flu in Journal Science. May have been circulating in pigs for many years. http://tinyurl.com/q85k2r";;;#swine;"1883712019";https://twitter.com/StaceySinger/status/1883712019
boomnoise;2009-05-22 15:59;0;0;"RT @newscientist H1N1 #swineflu passes WHO rules to be classified as a pandemic - so why haven't they declared it? http://tinyurl.com/p5so6x";;@newscientist;#swineflu;"1883710548";https://twitter.com/boomnoise/status/1883710548
gmanewsbreaking;2009-05-22 15:59;0;0;"Breaking News : UK confirms 5 new cases of swine flu : LONDON - British health authorities have co.. http://tinyurl.com/pqjvtm";;;;"1883710111";https://twitter.com/gmanewsbreaking/status/1883710111
surfexpo;2009-05-22 15:58;0;0;"Word has it that SIMA Surf Summit 12 might not happen until September because of Swine Flu hassles. Stay tuned.";;;;"1883705480";https://twitter.com/surfexpo/status/1883705480
TM_Outbreak;2009-05-22 15:58;0;0;"Swine Flu Must Be Global Phenomenon to Spark Pandemic, WHO Says - Bloomberg.com http://tinyurl.com/qzs6wa (via @flumap )";;@flumap;;"1883704726";https://twitter.com/TM_Outbreak/status/1883704726
nwherald;2009-05-22 15:57;0;0;"A 6-year-old boy from Lake in the Hills is McHenry County's fourth confirmed swine flu case, according to county health department.";;;;"1883697327";https://twitter.com/nwherald/status/1883697327
rwneilljr;2009-05-22 15:57;0;0;"Five more UK cases of swine flu http://ow.ly/8yE6";;;;"1883694938";https://twitter.com/rwneilljr/status/1883694938
swinefluh1n1;2009-05-22 15:57;0;0;""Who Issues Swine Flu Update And Other Health News | Health News Home" http://tinyurl.com/pwks96 #swineflu #H1N1";;;#swineflu #H1N1;"1883693676";https://twitter.com/swinefluh1n1/status/1883693676
Annimallover;2009-05-22 15:57;0;0;"this song is funny! I hear our friends in mexico aren't doing so well with swine flu scare. Crap. ♫ http://blip.fm/~6tjs9";;;;"1883689408";https://twitter.com/Annimallover/status/1883689408
swinefluh1n1;2009-05-22 15:57;0;0;""Truthdig - Ear to the Ground - Has Swine Flu Flown?" http://tinyurl.com/p4zerw #swineflu #H1N1";;;#swineflu #H1N1;"1883689214";https://twitter.com/swinefluh1n1/status/1883689214
1CindyBlake1;2009-05-22 15:57;0;0;"Swine flu to hit world's poor harder: WHO (AFP): AFP - Global health chiefs warned on Friday that swine flu coul.. http://bit.ly/KoKT";;;;"1883688870";https://twitter.com/1CindyBlake1/status/1883688870
LanaMcAra;2009-05-22 15:57;0;0;"Swine Flu Celebrity Fatality ~from Soul Mate Savvy http://bit.l/VoMkJ ***Join us on Tues night to talk about LOVE http://tinyurl.com/d846rt";;;;"1883687364";https://twitter.com/LanaMcAra/status/1883687364
hotsciencenews;2009-05-22 15:56;0;0;"Swine flu genes circulated undetected for years (AP) http://bit.ly/LdPNY";;;;"1883685428";https://twitter.com/hotsciencenews/status/1883685428
market_currents;2009-05-22 15:56;0;0;"The U.S. government is setting aside $1B to develop a vaccine for swine flu . : The U.S. government is setting as.. http://tinyurl.com/oay975";;;;"1883684009";https://twitter.com/market_currents/status/1883684009
actual_news;2009-05-22 15:56;0;0;"Reuters: U.S. directs $1 billion for new swine flu vaccine http://r.reuters.com/kec95c: Reuters: U.S. directs $1 b http://tinyurl.com/oaw994";;;;"1883676627";https://twitter.com/actual_news/status/1883676627
CaleeL;2009-05-22 15:55;0;0;"Packing for our trip to Mexico! Bring on the swine flu and the pina coladas";;;;"1883666258";https://twitter.com/CaleeL/status/1883666258
tonyny1feed;2009-05-22 15:55;0;0;"nbc4 news- Swine Flu Victim's Son Pitches No-Hitter Day After Funeral: Somewhere, Mitchell Weiner was .. http://tinyurl.com/o6rwp6";;;;"1883666211";https://twitter.com/tonyny1feed/status/1883666211
jpculture;2009-05-22 15:54;0;0;"Demand in Japan for masks is greater than the supply, despite an increase in production. http://bit.ly/RZTZF (via WSJ) #swineflu";;;#swineflu;"1883659698";https://twitter.com/jpculture/status/1883659698
