username;date;retweets;favorites;text;geo;mentions;hashtags;id;permalink
thecnnwire;2009-07-16 16:04;0;0;""No comment on reports Cherie Blair has swine flu" - http://tinyurl.com/l4v377";;;;"2671530305";https://twitter.com/thecnnwire/status/2671530305
feedzillahealth;2009-07-16 16:04;0;0;"Third Swine Flu-Related Death Reported in Maryland (source: Washington Post) http://buzzup.com/83to";;;;"2671528674";https://twitter.com/feedzillahealth/status/2671528674
health;2009-07-16 16:04;0;1;"British government estimates that 65,000 people could die from the H1N1 swine flu virus in Britain this year. http://bit.ly/itPZE";;;;"2671527695";https://twitter.com/health/status/2671527695
DrKimMD;2009-07-16 16:04;0;0;"Swine flu seems to have peaked in northern California....finally. Still plenty of sick kids but numbers falling.";;;;"2671527573";https://twitter.com/DrKimMD/status/2671527573
Live_NewsAU;2009-07-16 16:04;0;0;"Fight for flu vaccine could get ugly: AN ugly scramble is brewing over the swine flu vaccine - and when it becom.. http://bit.ly/vvXhG";;;;"2671526646";https://twitter.com/Live_NewsAU/status/2671526646
_101_;2009-07-16 16:04;0;0;"[bbc] UK swine flu deaths jump to 29: Twenty-nine people have now died in the UK after contracting swine fl.. http://bit.ly/to65q";;;;"2671523537";https://twitter.com/_101_/status/2671523537
NikiBakesCakes;2009-07-16 16:04;0;0;"Daughter sent home from school...hysteria over the dreaded swine flu ...didn't fancy English!!";;;;"2671521339";https://twitter.com/NikiBakesCakes/status/2671521339
tumeden;2009-07-16 16:03;0;0;"#News [top stories]- Ex-UK PM Tony Blair's wife may have swine flu : The office of the wife o.. http://bit.ly/14Goj8";;;#News;"2671518990";https://twitter.com/tumeden/status/2671518990
AcupunctureGary;2009-07-16 16:03;0;0;"Acupuncture London | UK swine flu deaths jump to 29: Twenty-nine people h.. http://bit.ly/9i9dX | http://bit.ly/BA";;;;"2671518915";https://twitter.com/AcupunctureGary/status/2671518915
ICAV;2009-07-16 16:03;0;0;"RT @profvrr :Is the 2009 H1N1 influenza virus more dangerous than we think? http://bit.ly/Sv52E at virology blog #swineflu #h1n1";;@profvrr;#swineflu #h1n1;"2671517140";https://twitter.com/ICAV/status/2671517140
nigelcameron;2009-07-16 16:03;0;0;"#Swineflu : UK forecast of 65,000 deaths. http://bit.ly/lHvoG";;;#Swineflu;"2671516440";https://twitter.com/nigelcameron/status/2671516440
missrak;2009-07-16 16:03;0;0;"Swine Flu & Business: Impact & What You Can Do - Business Coaching http://bit.ly/moKRT";;;;"2671516307";https://twitter.com/missrak/status/2671516307
DailyMirror;2009-07-16 16:03;0;0;"Swine flu : UK death toll reaches 29 http://bit.ly/10J4Dd";;;;"2671515546";https://twitter.com/DailyMirror/status/2671515546
SWINE_FLU_VRUS;2009-07-16 16:03;0;0;"Breaking news: Tourist suffering from swine flu dies in Scotland http://bit.ly/1Cc6fK";;;;"2671514152";https://twitter.com/SWINE_FLU_VRUS/status/2671514152
flirtbox;2009-07-16 16:03;0;0;"mirrorpool http://bit.ly/yRiaB : [quote:85da8bd7f9=\"hiddenxlust\"]Today i was told i have swine flu . Not allowed to leave the house, th ...";;;;"2671512262";https://twitter.com/flirtbox/status/2671512262
if_I_must;2009-07-16 16:03;0;0;"The BBC webwonders do it again - an interative timelapse world map on swine flu cases and deaths http://bit.ly/3MFB9 (NB only 0.1% fatality)";;;;"2671510862";https://twitter.com/if_I_must/status/2671510862
web9media;2009-07-16 16:03;0;0;"Fat people 'more likely to die of swine flu ' ( http://bit.ly/S3Jrl )";;;;"2671505162";https://twitter.com/web9media/status/2671505162
nashvillelocal;2009-07-16 16:02;0;0;"Tennessee records first swine flu death - http://fwix.com/article/35_640ff39cda";;;;"2671501544";https://twitter.com/nashvillelocal/status/2671501544
SWINE_FLU_VRUS;2009-07-16 16:02;0;0;"Home Care Guidance Physician Directions to Patient/Parent http://bit.ly/wIfTS";;;;"2671499082";https://twitter.com/SWINE_FLU_VRUS/status/2671499082
comedytrek;2009-07-16 16:02;0;0;"Been sick the last couple of days. It's flu like but i don't think it's swine flu .";;;;"2671496728";https://twitter.com/comedytrek/status/2671496728
workshome;2009-07-16 16:02;0;0;"Swine Flu Hits 3 Ontario Summer Camps - AHN: MiamiHerald.comSwine Flu Hits 3 Ontario Summer CampsAHNToronto, Ont.. http://tr.im/sDDN";;;;"2671494654";https://twitter.com/workshome/status/2671494654
deadmandavid380;2009-07-16 16:01;0;0;"[Blog] How many people in the UK will die of Swine flu before the end of the 2009?: 16 people in the UK have died of swine flu so far - ...";;;;"2671484936";https://twitter.com/deadmandavid380/status/2671484936
apoplexiac;2009-07-16 16:01;0;0;"Well, whaddya know? http://is.gd/1B8Iv It's hard not to be cynical when so many second-tier names keep contracting swine flu .";;;;"2671483819";https://twitter.com/apoplexiac/status/2671483819
deadmandavid380;2009-07-16 16:01;0;0;"[Blog] How many people in the UK will die of Swine flu before the end of the 2009?...: 16 people... http://ping.fm/7vHe5";;;;"2671482163";https://twitter.com/deadmandavid380/status/2671482163
nathanifill;2009-07-16 16:01;0;0;"I've been told that "providing I don't touch anything" I can go downstairs while everyone is out. Wow - I'm privileged. #sarcasm #swineflu";;;#sarcasm #swineflu;"2671481072";https://twitter.com/nathanifill/status/2671481072
WheeluvFortune;2009-07-16 16:00;0;0;"Third Swine Flu-Related Death Reported in Maryland http://u.mavrev.com/oxe6";;;;"2671475980";https://twitter.com/WheeluvFortune/status/2671475980
MonctonNBNews;2009-07-16 16:00;0;0;"Eight more swine flu cases in NB - CBC.ca http://bit.ly/I8nWO";;;;"2671471835";https://twitter.com/MonctonNBNews/status/2671471835
matt_drudge;2009-07-16 16:00;0;0;"Official: Britain will see 63,000 die from swine flu ... http://bit.ly/2CTaTX";;;;"2671471399";https://twitter.com/matt_drudge/status/2671471399
flunews_;2009-07-16 16:00;0;0;"Patient with swine flu virus dies http://bit.ly/11vCUu #flu #h1n1";;;#flu #h1n1;"2671468694";https://twitter.com/flunews_/status/2671468694
SwineFlu_news;2009-07-16 16:00;0;0;"Woodhouse school closes over swine flu alert http://t.love.com/232603357";;;;"2671467695";https://twitter.com/SwineFlu_news/status/2671467695
PakCric;2009-07-16 16:00;0;0;"#CNN Ex-UK PM Tony Blair's wife may have swine flu : The office of the wife of former British pr.. http://bit.ly/1sqQuL #squarespace";;;#CNN #squarespace;"2671467348";https://twitter.com/PakCric/status/2671467348
barcampdurgapur;2009-07-16 16:00;0;0;"[BBC] GPs 'in firing line' over swine flu : Microbiologist Professor Hugh Pennington says he thinks the sw.. http://bit.ly/13FeTZ";;;;"2671464895";https://twitter.com/barcampdurgapur/status/2671464895
SWINE_FLU_VRUS;2009-07-16 16:00;0;0;"Fight for swine flu vaccine could get ugly (source: The Arizona Republic) http://bit.ly/8ebSz";;;;"2671464406";https://twitter.com/SWINE_FLU_VRUS/status/2671464406
ForexBlogger;2009-07-16 16:00;0;0;"French government orders swine flu vaccine doses (AP) - http://www.forexglobe.net?p=451";;;;"2671464248";https://twitter.com/ForexBlogger/status/2671464248
SwineFluTicker;2009-07-16 15:59;0;0;"Third Swine Flu-Related Death Reported in Maryland: Maryland state health officials said yesterday that a third .. http://bit.ly/15TGlT";;;;"2671460550";https://twitter.com/SwineFluTicker/status/2671460550
SwineFluTicker;2009-07-16 15:59;0;0;"Survey: Americans expect widespread swine flu : ATLANTA — A new survey finds about three out of five Americans be.. http://bit.ly/41UPNQ";;;;"2671459832";https://twitter.com/SwineFluTicker/status/2671459832
SWINE_FLU_VRUS;2009-07-16 15:59;0;0;"Third Swine Flu-Related Death Reported in Maryland (source: Washington Post) http://bit.ly/hLgD9";;;;"2671459799";https://twitter.com/SWINE_FLU_VRUS/status/2671459799
EromillagT;2009-07-16 15:59;0;0;"Would you send your child to school if their sibling had swine flu ? Especially when there is only a few days left at school anyway. cont";;;;"2671458851";https://twitter.com/EromillagT/status/2671458851
SwineFluTicker;2009-07-16 15:59;0;0;"Washoe County says 21 new swine flu cases: Washoe County health officials say 21 new cases of swine flu have bee.. http://bit.ly/DseVl";;;;"2671458708";https://twitter.com/SwineFluTicker/status/2671458708
CrisisWatch;2009-07-16 15:59;0;0;"*WHO Swine Flu Updat Pandemic (H1N1) 2009 briefing note 3 http://bit.ly/ITU6E";;;;"2671455489";https://twitter.com/CrisisWatch/status/2671455489
breakingflunews;2009-07-16 15:59;0;0;"breakingflunews.com Swine flu tests lift Meridian Bioscience 3Q profit - Forbes: Swine flu te.. http://bit.ly/MvM7b";;;;"2671454727";https://twitter.com/breakingflunews/status/2671454727
breakingflunews;2009-07-16 15:59;0;0;"breakingflunews.com Patient with swine flu virus dies - BBC News: Patient with swine flu viru.. http://bit.ly/xfcPe";;;;"2671453786";https://twitter.com/breakingflunews/status/2671453786
breakingflunews;2009-07-16 15:59;0;0;"breakingflunews.com French government orders swine flu vaccine doses - The Associated Press: .. http://bit.ly/1IowT3";;;;"2671451015";https://twitter.com/breakingflunews/status/2671451015
mycasinorocks;2009-07-16 15:58;0;0;"Fight for swine flu vaccine could get ugly (AP) : AP - An ugly scramble is brewing over the swine flu vaccine .. http://bit.ly/yM6i1";;;;"2671448622";https://twitter.com/mycasinorocks/status/2671448622
rssfever;2009-07-16 15:58;0;0;"Baltimore Breaking News » Blog Archive » Third swine flu death ... - http://bit.ly/LYbp2";;;;"2671447128";https://twitter.com/rssfever/status/2671447128
begoodtwoyou;2009-07-16 15:58;0;0;"#remedy Quick Swine Flu Symptoms Checker: ... there are some natural remedies. WebMD has a good story on .. http://bit.ly/12eo8D";;;#remedy;"2671445329";https://twitter.com/begoodtwoyou/status/2671445329
Slipfinger;2009-07-16 15:58;0;0;"I always seem to be in wrong half! When 16 and half town slept with Debbie Collins, I was in wrong half, and now half world has swine flu ..!";;;;"2671440191";https://twitter.com/Slipfinger/status/2671440191
Lyndarenham;2009-07-16 15:58;0;0;"great day. Had swine flu contact. So took books back to library and made a pasta bake. Ready for my five days in bed should I need it.";;;;"2671437450";https://twitter.com/Lyndarenham/status/2671437450
tiaraaudrey;2009-07-16 15:57;0;0;"just heard that swine flu is a man-made virus to decrease the world's population.. (annoyed) http://plurk.com/p/1afmsi";;;;"2671426895";https://twitter.com/tiaraaudrey/status/2671426895
carolharnett;2009-07-16 15:57;0;0;"RT @doc2doc Feeling the strain of swine - another brilliant swine flu blog by @tnolan http://ow.ly/hpYb";;@doc2doc @tnolan;;"2671426756";https://twitter.com/carolharnett/status/2671426756
admataz;2009-07-16 15:57;0;0;"swine flu officially knocked out our first staff member, went home with doc ordering 5-7 days off. rest up @gleeding , not too much xbox.";;@gleeding;;"2671424647";https://twitter.com/admataz/status/2671424647
freetroll;2009-07-16 15:57;0;0;"I bet it's closer to 62,931 RT @Drudge_Report : Official: Britain will see 63,000 die from swine flu ... http://tinyurl.com/ljtn85";;@Drudge_Report;;"2671424450";https://twitter.com/freetroll/status/2671424450
SwineFluNewsAU;2009-07-16 15:57;0;0;"Australia braces for some-more swine flu deaths http://tinyurl.com/nroc7c #swineflu #h1n1";;;#swineflu #h1n1;"2671423856";https://twitter.com/SwineFluNewsAU/status/2671423856
hongkongmacau;2009-07-16 15:56;0;0;"Hong Kong reports first death from swine flu . http://tinyurl.com/lcfzof #hongkong #swineflu";;;#hongkong #swineflu;"2671422409";https://twitter.com/hongkongmacau/status/2671422409
BiotechNews;2009-07-16 15:56;0;0;"Swine flu scares up multibillion-dollar windfall: Swine flu has turned out to be far milder than once feared, bu.. http://bit.ly/4cGU1";;;;"2671410768";https://twitter.com/BiotechNews/status/2671410768
Slipfinger;2009-07-16 15:55;0;0;"Oh how the other half live? @sasultana The other half without quarantined with swine flu that is! Hope youre making the most of it!";;@sasultana;;"2671403821";https://twitter.com/Slipfinger/status/2671403821
cameramensch;2009-07-16 15:55;0;0;"Hole and Smashing Pumpkins babe has SWINE FLU ! (And isn't afraid to dish) #Hole reunion complicated? http://tinyurl.com/nq3b9y #swineflu";;;#Hole #swineflu;"2671403535";https://twitter.com/cameramensch/status/2671403535
Pony_Express;2009-07-16 15:55;0;0;"LATEST NEWS: Wife of ex British PM Tony Blair in swine flu mystery: The office of the wife of former.. http://bit.ly/T88Oc";;;;"2671401993";https://twitter.com/Pony_Express/status/2671401993
RenoNews;2009-07-16 15:54;0;0;"Washoe County says 21 new swine flu cases http://bit.ly/1PHW6T";;;;"2671393370";https://twitter.com/RenoNews/status/2671393370
Jesusophile;2009-07-16 15:54;0;0;"Third swine flu death in Scotland: A third swine flu patient has died north of the border, Health Secretary Nico.. http://bit.ly/1fJBg";;;;"2671390477";https://twitter.com/Jesusophile/status/2671390477
ViewFromEngland;2009-07-16 15:54;0;0;"UK Swine flu deaths total jumps to 29 http://bit.ly/1iXtT The official total was given as 17 on Monday.";;;;"2671390384";https://twitter.com/ViewFromEngland/status/2671390384
TheVeryEssence;2009-07-16 15:54;0;1;"#Swine Flu Chilling Propaganda from 1970s also note how journalism was much better in this 60 Minutes interview http://snipurl.com/ncw1b";;;#Swine;"2671389032";https://twitter.com/TheVeryEssence/status/2671389032
JonHeathNFL;2009-07-16 15:54;0;0;"prayin 4 B me and mom went up 2 camp 2 get her yesterday.. ppl thought she has swine flu , now the docter thinks its strut";;;;"2671389008";https://twitter.com/JonHeathNFL/status/2671389008
DRUDGE_REPORT;2009-07-16 15:54;0;2;"Official: Britain will see 63,000 die from swine flu ... http://tinyurl.com/ljtn85";;;;"2671385511";https://twitter.com/DRUDGE_REPORT/status/2671385511
ActivistJane;2009-07-16 15:53;0;0;"RT @1txsage1957 : Swine flu virus more virulent than first thought http://snipr.com/nakoa TO BAD IT'S NOT DONKEY FLU VIRUS";;@1txsage1957;;"2671382049";https://twitter.com/ActivistJane/status/2671382049
Jesusophile;2009-07-16 15:53;0;0;"UK swine flu deaths jump to 29: Twenty-nine people have now died in the UK after contracting swine flu , the gove.. http://bit.ly/to65q";;;;"2671378033";https://twitter.com/Jesusophile/status/2671378033
peterosbornuk;2009-07-16 15:52;0;0;"I don't think anyone has any idea what number of cases to put down on the list for the UK #swineflu #h1n1";;;#swineflu #h1n1;"2671369622";https://twitter.com/peterosbornuk/status/2671369622
swineflunews24;2009-07-16 15:52;0;0;"Fight for swine flu vaccine could get ugly http://bit.ly/2O8iBU";;;;"2671369095";https://twitter.com/swineflunews24/status/2671369095
uncugly;2009-07-16 15:52;0;0;"Apparently there have been lots of emails circulating about tinned pork causing #swineflu . Turns out its just spam.";;;#swineflu;"2671367369";https://twitter.com/uncugly/status/2671367369
SwineFluNewsNZ;2009-07-16 15:52;0;0;"Swine flu threatens Muslim Hajj season http://tinyurl.com/lxtgep #swineflu #h1n1";;;#swineflu #h1n1;"2671366831";https://twitter.com/SwineFluNewsNZ/status/2671366831
Jesusophile;2009-07-16 15:52;0;0;"Wife of ex British PM Tony Blair in swine flu mystery: The office of the wife of former British prime minister T.. http://bit.ly/T88Oc";;;;"2671366238";https://twitter.com/Jesusophile/status/2671366238
swineflunews24;2009-07-16 15:52;0;0;"French government orders swine flu vaccine doses http://bit.ly/1b1I85";;;;"2671365962";https://twitter.com/swineflunews24/status/2671365962
swineflunews24;2009-07-16 15:52;0;0;"Meridian sales get shot in arm from swine flu http://bit.ly/z7YhL";;;;"2671364517";https://twitter.com/swineflunews24/status/2671364517
swineflunews24;2009-07-16 15:52;0;0;"Survey: Americans expect widespread swine flu http://bit.ly/51wQ2";;;;"2671363160";https://twitter.com/swineflunews24/status/2671363160
swineflunews24;2009-07-16 15:52;0;0;"84 new swine flu cases confirmed in NC http://bit.ly/BH99R";;;;"2671361774";https://twitter.com/swineflunews24/status/2671361774
johobbs;2009-07-16 15:52;0;0;"The phrase "underlying health problems" in relation to swine flu is just incredibly lazy journalism and, TBH, rather patronising.";;;;"2671358389";https://twitter.com/johobbs/status/2671358389
SwineFluUK;2009-07-16 15:52;0;0;"Never mind swine flu , these Caribbean pigs are in the swim : Any thoughts of swine flu is water off a pig's bac.. http://bit.ly/DzIfu";;;;"2671358071";https://twitter.com/SwineFluUK/status/2671358071
CambridgeUKNews;2009-07-16 15:51;0;0;"Swine flu deaths up to 29 - Cambridge Evening News: Swine flu deaths up to 29Cambridge Evening NewsTwenty-nine p.. http://bit.ly/lUMkp";;;;"2671353452";https://twitter.com/CambridgeUKNews/status/2671353452
SwineFluNewsEU;2009-07-16 15:51;0;0;"Thai Airways turns concentration upon Europe http://tinyurl.com/mj4rfz #swineflu #h1n1";;;#swineflu #h1n1;"2671352375";https://twitter.com/SwineFluNewsEU/status/2671352375
st_swineflu;2009-07-16 15:51;0;0;"Swine flu caught whilst in Orlando ?? (70054609@Disney Information Bulletin Board) #swineflu http://p.boardtracker.com/1636210579";;@Disney;#swineflu;"2671352201";https://twitter.com/st_swineflu/status/2671352201
adkinsdietplan;2009-07-16 15:51;0;0;"http://swineflutreatment.top1spot.com Breaking News: The Swine Flu Changes To Become More Deadly";;;;"2671347676";https://twitter.com/adkinsdietplan/status/2671347676
juvedermny;2009-07-16 15:51;0;0;"www.1800blemish.org Third Swine Flu-Related Death Reported in Maryland - Washington Post: Telegraph.co.ukThird Swine F..";;;;"2671345536";https://twitter.com/juvedermny/status/2671345536
Drudge_Siren;2009-07-16 15:51;0;0;"Official: Britain will see 63,000 die from swine flu ... http://plu.gd/24P";;;;"2671344278";https://twitter.com/Drudge_Siren/status/2671344278
GOGADGETFIX;2009-07-16 15:50;0;0;"#CNN Ex-UK PM Tony Blair's wife may have swine flu : The office of the wife of former British pr.. http://bit.ly/1sqQuL #squarespace";;;#CNN #squarespace;"2671343227";https://twitter.com/GOGADGETFIX/status/2671343227
SMendi;2009-07-16 15:50;0;0;"RT @razshafer : Please keep my dad, mom & brother in yr prayers. Dad was exposed 2 swine flu on recent bangkok trip & is now presenting f ...";;@razshafer;;"2671338953";https://twitter.com/SMendi/status/2671338953
narflet;2009-07-16 15:50;0;0;"Swine Flu ? Swine Cute! RT @TelegraphPics : The bay of pigs: swine swimming in the crystal clear sea off the Bahamas. http://snurl.com/ncuel";;@TelegraphPics;;"2671337099";https://twitter.com/narflet/status/2671337099
essexnews;2009-07-16 15:50;0;0;"ClactonGazette: Swine flu takes over schools: MORE than half the schools in the Clacton and Frint.. http://bit.ly/8fQYo";;;;"2671335618";https://twitter.com/essexnews/status/2671335618
Afroman231;2009-07-16 15:50;0;0;"Wife of ex British PM Tony Blair in swine flu mystery: The office of the wife of former British prime minister T.. http://bit.ly/T88Oc";;;;"2671334686";https://twitter.com/Afroman231/status/2671334686
swineflu_virus;2009-07-16 15:50;0;0;"Third Swine Flu-Related Death Reported in Maryland http://bit.ly/ZvqtD";;;;"2671333761";https://twitter.com/swineflu_virus/status/2671333761
swahiligal;2009-07-16 15:49;0;0;"Swine flu might just have finally hit our home";;;;"2671328322";https://twitter.com/swahiligal/status/2671328322
lmirani;2009-07-16 15:49;0;0;"Boots have run out of thermometers. This swine flu thing is getting out of hand.";;;;"2671328155";https://twitter.com/lmirani/status/2671328155
Cobatra;2009-07-16 15:49;0;0;"Fight for swine flu vaccine could get ugly (AP): AP - An ugly scramble is brewing over the swine flu vaccine .. http://bit.ly/w0ufP";;;;"2671324906";https://twitter.com/Cobatra/status/2671324906
mikenott;2009-07-16 15:49;0;0;"First person (out of 12) in our office has been diagnosed with Swine Flu - panic!!!!!!";;;;"2671324705";https://twitter.com/mikenott/status/2671324705
GunnerMichael;2009-07-16 15:49;0;0;"Just had the advisory from HR that somebody has been sent home with Swine Flu symptoms. Might work from home for a bit";;;;"2671322173";https://twitter.com/GunnerMichael/status/2671322173
SwineFluNewsHK;2009-07-16 15:49;0;0;"First swine-flu -related death in HK http://tinyurl.com/nxp6or #swineflu #h1n1";;;#swineflu #h1n1;"2671322111";https://twitter.com/SwineFluNewsHK/status/2671322111
SandwichINK;2009-07-16 15:49;0;0;"New Post at SandwichINK: Swine Flu Tools Update 4 Grandparents /Senior Home Care Givers + :) http://bit.ly/GvK9B :)";;;;"2671320608";https://twitter.com/SandwichINK/status/2671320608
FOX21News;2009-07-16 15:48;0;0;"30 more Air Force cadets diagnosed with swine flu http://bit.ly/1p5lLt";;;;"2671316196";https://twitter.com/FOX21News/status/2671316196
DGStandard;2009-07-16 15:48;0;0;"Swine flu hits third teen http://bit.ly/rzdSP";;;;"2671315813";https://twitter.com/DGStandard/status/2671315813
kktnxbye;2009-07-16 15:48;0;0;"Ex-UK PM Tony Blair's wife may have swine flu : The office of the wife of former British prime minister Tony Blair refused to comment Thur..";;;;"2671313788";https://twitter.com/kktnxbye/status/2671313788
swineflu_virus;2009-07-16 15:48;0;0;"British swine flu death toll reaches 29 and could hit 65000 http://bit.ly/yK5Ke";;;;"2671312314";https://twitter.com/swineflu_virus/status/2671312314
SweetCaroline2;2009-07-16 15:48;0;0;"kids' ped said i have #swine flu-'what else is there this time of yr?' my doc has xplainin' to do. mwhl both boys asleep. i can eat in ...";;;#swine;"2671310579";https://twitter.com/SweetCaroline2/status/2671310579
Labourcat;2009-07-16 15:48;0;0;"Just back from CAB volunteering, and alarmed at news about rise in Swine flu cases. Going abroad going to be prob if you get the sniffles.";;;;"2671310419";https://twitter.com/Labourcat/status/2671310419
VtZ_;2009-07-16 15:48;0;0;"Wife of ex British PM Tony Blair in swine flu mystery (via @Pom_Som ) http://bit.ly/2miend";;@Pom_Som;;"2671310001";https://twitter.com/VtZ_/status/2671310001
Slipfinger;2009-07-16 15:48;0;0;"Does anyone fancy popping out and buying me a massive tub of ice cream and then leaving it outside my swine flu quarantined front door?";;;;"2671308156";https://twitter.com/Slipfinger/status/2671308156
pantelleria_;2009-07-16 15:48;0;0;"Swine flu death toll now 29: health agency http://bit.ly/2SbQvw";;;;"2671305583";https://twitter.com/pantelleria_/status/2671305583
medworldnews;2009-07-16 15:47;0;0;"Medical World News - Novel Influenza A (H1N1) 09 Swine Flu - Update 102: The number of confir.. http://bit.ly/C1FAY";;;;"2671303777";https://twitter.com/medworldnews/status/2671303777
AuroraFirechild;2009-07-16 15:47;0;0;"there are many in the uva area that have had swine flu recently. when is it coming for me? omg its the stand all over again!";;;;"2671300026";https://twitter.com/AuroraFirechild/status/2671300026
M24digital_en;2009-07-16 15:47;0;0;"Swine flu : The UK advices citizens traveling to Argentina http://bit.ly/15W2rJ";;;;"2671293770";https://twitter.com/M24digital_en/status/2671293770
TM_Outbreak;2009-07-16 15:46;0;0;"CDC H1N1 Flu | Interim Guidance to Assist Airline Flight Deck and Cabin Crew in Identifyin... http://tinyurl.com/n2wjwt (via @News_ SwineFlu )";;@News_;;"2671288288";https://twitter.com/TM_Outbreak/status/2671288288
faith_telegraph;2009-07-16 15:46;0;0;"Bishop: Empty Holy Water Stoups Until Swine Flu Pandemic Is Over. http://bit.ly/7zDdu #twurch #news";;;#twurch #news;"2671287110";https://twitter.com/faith_telegraph/status/2671287110
RSS_BBC;2009-07-16 15:46;0;0;"Patient with swine flu virus dies http://bit.ly/XTDAQ";;;;"2671286874";https://twitter.com/RSS_BBC/status/2671286874
SwineFluNewsIE;2009-07-16 15:46;0;0;"' Swine flu dangers have been real' - Dr. McDaid warns http://tinyurl.com/kryov2 #swineflu #h1n1";;;#swineflu #h1n1;"2671281623";https://twitter.com/SwineFluNewsIE/status/2671281623
novelh1n1;2009-07-16 15:46;0;0;"http://novelh1n1.com French government orders swine flu vaccine doses - The Associated Press.. http://bit.ly/1IowT3";;;;"2671281003";https://twitter.com/novelh1n1/status/2671281003
thebestblogs;2009-07-16 15:46;0;0;"CNN: Wife of ex British PM Tony Blair in swine flu mystery: The office of the wife of former British prime m.. http://bit.ly/T88Oc";;;;"2671278325";https://twitter.com/thebestblogs/status/2671278325
novelh1n1;2009-07-16 15:46;0;0;"http://novelh1n1.com British swine flu death toll reaches 29 and could hit 65000 - Telegraph.. http://bit.ly/buxDW";;;;"2671278271";https://twitter.com/novelh1n1/status/2671278271
shaf;2009-07-16 15:45;0;0;"RT @kirrus : @shaf swine flu has a low mortality rate, they'll be fine. < I worried there for a moment, thought you said 'morality' LOL";;@kirrus @shaf;;"2671272413";https://twitter.com/shaf/status/2671272413
PeterHellyer;2009-07-16 15:45;0;0;"Ist I have to diagnose I've not got swine flu , then I get to see the Doc where I diagnose my condition it wasn't like that when I was a kid!";;;;"2671268453";https://twitter.com/PeterHellyer/status/2671268453
ernmander;2009-07-16 15:45;0;0;"RT @bbcworld : Twenty-nine people have now died in the UK after contracting swine flu , the government announces. http://tinyurl.com/n3l8ku";;@bbcworld;;"2671268098";https://twitter.com/ernmander/status/2671268098
SkyNews;2009-07-16 15:45;0;0;"Swine Flu Death Toll Hits 29 In The UK: Twenty-nine people have now died in the UK after contracting swine flu , .. http://bit.ly/XZxOC";;;;"2671265954";https://twitter.com/SkyNews/status/2671265954
SwineFluNewsSG;2009-07-16 15:45;0;0;"LI tyro reliable as swine flu victim http://tinyurl.com/m844du #swineflu #h1n1";;;#swineflu #h1n1;"2671263891";https://twitter.com/SwineFluNewsSG/status/2671263891
channelone;2009-07-16 15:44;0;0;"UK swine flu deaths jump to 29 http://bit.ly/to65q";;;;"2671262466";https://twitter.com/channelone/status/2671262466
