username;date;retweets;favorites;text;geo;mentions;hashtags;id;permalink
aflnews;2009-05-29 12:24;0;0;"AFL News: No worries for AFL over swine flu : The AFL is confident it has no cause for concern over swin.. http://tinyurl.com/lc3bs9";;;;"1959033801";https://twitter.com/aflnews/status/1959033801
TM_Outbreak;2009-05-29 12:24;0;0;"The Associated Press: US official in France diagnosed with swine flu http://tinyurl.com/mdoyox (via @SwineFluUpdate )";;@SwineFluUpdate;;"1959029274";https://twitter.com/TM_Outbreak/status/1959029274
gma_news;2009-05-29 12:24;0;0;"Breaking News: 2 Greek students catch swine flu in UK http://tinyurl.com/lhh2gb";;;;"1959028084";https://twitter.com/gma_news/status/1959028084
BigKev_LSU;2009-05-29 12:23;0;0;"First we had mad cow disease, then it was bird flu and now swine flu ...O.M.F.G its FARMAGEDDON!!!";;;;"1959026830";https://twitter.com/BigKev_LSU/status/1959026830
agrogator;2009-05-29 12:23;0;0;"abcNews~ Let swine flu run its course: expert: Experts are criticising Australia's swine flu containment.. http://bit.ly/kx9jT";;;;"1959025534";https://twitter.com/agrogator/status/1959025534
sagat24;2009-05-29 12:23;0;0;"kermit the frog is the first celebrity casualty of the swine flu courtesy of ms. piggy. lol!";;;;"1959025384";https://twitter.com/sagat24/status/1959025384
swineflueupdate;2009-05-29 12:23;0;0;"Educate and Prevent Australian swine flu cases rise to 209 - Melbourne Herald Sun: BBC NewsAu.. http://tinyurl.com/lhq6dy";;;;"1959025234";https://twitter.com/swineflueupdate/status/1959025234
swineflueupdate;2009-05-29 12:23;0;0;"Educate and Prevent Swine flu : Indian sailor quarantined in Egypt - Sify: Swine flu : Indian s.. http://tinyurl.com/krqzh8";;;;"1959024998";https://twitter.com/swineflueupdate/status/1959024998
charlesalexanda;2009-05-29 12:23;0;0;"Two test positive for swine flu | Stuff.co.nz: The hotel came under scrutiny after it was accused of evicting th.. http://bit.ly/QoIL";;;;"1959022903";https://twitter.com/charlesalexanda/status/1959022903
DavidHall3;2009-05-29 12:23;0;0;"First celebrity succums to swine flu http://bit.ly/bxHf5";;;;"1959021515";https://twitter.com/DavidHall3/status/1959021515
newscientist;2009-05-29 12:22;0;5;"New swine flu cases point to invisible pandemic - and calls for changes to testing rules http://bit.ly/n95Gu";;;;"1959017217";https://twitter.com/newscientist/status/1959017217
SwineFluNewsEU;2009-05-29 12:22;0;0;"Britain's Eton propagandize closes after swine flu case http://tinyurl.com/nlaaqq";;;;"1959017133";https://twitter.com/SwineFluNewsEU/status/1959017133
LloydsList;2009-05-29 12:22;0;0;"Australia bans Pacific Dawn after swine flu cases on board: AUSTRALIAN health officials have ordered Carnival cr.. http://tinyurl.com/ndqaby";;;;"1959015954";https://twitter.com/LloydsList/status/1959015954
pantelleria_;2009-05-29 12:21;0;0;"US official in France diagnosed with swine flu http://tinyurl.com/m2wklj";;;;"1959013201";https://twitter.com/pantelleria_/status/1959013201
IARProject;2009-05-29 12:21;0;0;"Swine Flu in Iraq? "Swine flu-free Iraq fears US contamination" http://bit.ly/56hK7";;;;"1959007326";https://twitter.com/IARProject/status/1959007326
HuffNewswire;2009-05-29 12:21;0;0;"HUFFWORLD: France: Swine Flu Hits US Official Preparing For Obama's Visit: PARIS — A U.S. offici.. http://tinyurl.com/nsgs8d";;;;"1959006728";https://twitter.com/HuffNewswire/status/1959006728
757KimmieB;2009-05-29 12:20;0;0;"Check this video out -- Tony Yayo - No Teeth No Names [New/ Swine Flu /Mixtape!!] http://bit.ly/p7AOC";;;;"1959005824";https://twitter.com/757KimmieB/status/1959005824
rsspberry;2009-05-29 12:20;0;0;"US Official in France Diagnosed With Swine Flu - http://rsspberry.com/view/82252/";;;;"1959005123";https://twitter.com/rsspberry/status/1959005123
flunews_;2009-05-29 12:20;0;0;"New Blog post 2 Greek students catch swine flu in UK (AP via Yahoo! News) http://bit.ly/LtYdP ...";;;;"1959001321";https://twitter.com/flunews_/status/1959001321
flunews_;2009-05-29 12:20;0;0;"New Blog post Swine flu infects US official in France for Obama trip (AFP via Yahoo! News) http://bit.ly/EvM98 ...";;;;"1959001122";https://twitter.com/flunews_/status/1959001122
SwineInfluenza;2009-05-29 12:19;0;0;"Teen could be first local case of swine flu - Marietta Times: Teen could be first local case of swine fluMariett.. http://tinyurl.com/kkau5v";;;;"1958994278";https://twitter.com/SwineInfluenza/status/1958994278
SwineInfluenza;2009-05-29 12:19;0;0;"Let swine flu run its course: expert - ABC Online: Let swine flu run its course: expertABC Online, Australi.. http://tinyurl.com/l9ec5n";;;;"1958994123";https://twitter.com/SwineInfluenza/status/1958994123
swinefluh1n1;2009-05-29 12:18;0;0;""Kutztown University Summer Student Infected with H1N1 : WFMZ-TV 69News" http://tinyurl.com/lwhldc #swineflu #H1N1";;;#swineflu #H1N1;"1958987417";https://twitter.com/swinefluh1n1/status/1958987417
wp_feed;2009-05-29 12:17;0;0;"MyDailyMusic: Tony Yayo - The Swine Flu [2009][EAC][Explicit]: INFO: 01 Swine Flu Intro 02 They Ha.. http://tinyurl.com/nkokvu";;;;"1958985736";https://twitter.com/wp_feed/status/1958985736
NJdoc;2009-05-29 12:17;0;0;"Companies starting work on #H1N1 #SwineFlu vaccine http://www.reuters.com/article/middleeastCrisis/idUSN28367585";;;#H1N1 #SwineFlu;"1958984919";https://twitter.com/NJdoc/status/1958984919
abcnews;2009-05-29 12:17;0;1;"Let swine flu run its course: expert http://bit.ly/Z1HDh";;;;"1958982694";https://twitter.com/abcnews/status/1958982694
SwineFluNewsNZ;2009-05-29 12:17;0;0;"Swine flu numbers solid in NZ, climb globally http://tinyurl.com/pqgwrm";;;;"1958979857";https://twitter.com/SwineFluNewsNZ/status/1958979857
SwineFluNewsORG;2009-05-29 12:16;0;0;"UWSP tyro recuperating from Portage County's primary swine flu case http://tinyurl.com/nm6ylb";;;;"1958979033";https://twitter.com/SwineFluNewsORG/status/1958979033
suineflu;2009-05-29 12:16;0;0;"#swineflu Only One H1N1 Case in Crawford County - PdCToday.com: PdCToday.comOnly One H1N1 Case in Crawf.. http://tinyurl.com/m57fv4";;;#swineflu;"1958978144";https://twitter.com/suineflu/status/1958978144
NJdoc;2009-05-29 12:16;0;0;"#h1n1 #SwineFlu in Greek Students means Outbreak in Edinburgh? http://bit.ly/KE2vH";;;#h1n1 #SwineFlu;"1958977659";https://twitter.com/NJdoc/status/1958977659
SwineFluNewsHK;2009-05-29 12:16;0;0;"3 journey boat organisation locate swine flu off Australia http://tinyurl.com/pefov7";;;;"1958976557";https://twitter.com/SwineFluNewsHK/status/1958976557
kuabt;2009-05-29 12:15;0;0;"CHINA'S health ministry reported Friday the first suspected case of swine flu involving a person infected with the virus inside the country.";;;;"1958971690";https://twitter.com/kuabt/status/1958971690
web9media;2009-05-29 12:15;0;0;"2 Greek students catch swine flu in Scotland, scientists say the virus spreading widely ( http://bit.ly/8YBvS )";;;;"1958969878";https://twitter.com/web9media/status/1958969878
zeroping;2009-05-29 12:15;0;0;"US official in France diagnosed with swine flu http://newsbb.org/?p=37150";;;;"1958966039";https://twitter.com/zeroping/status/1958966039
757KimmieB;2009-05-29 12:14;0;0;"Check this video out -- Tony Yayo - Now A Dayz [New/ Swine Flu /Mixtape!!] http://bit.ly/xYnJI";;;;"1958959720";https://twitter.com/757KimmieB/status/1958959720
caitlen;2009-05-29 12:12;0;0;""Let Swine FLu run it's course: treat it like any other seasonal flu" http://dickensurl.com/ae8c DUH! That's what I've been saying.";;;;"1958951162";https://twitter.com/caitlen/status/1958951162
H1N1VirusNews;2009-05-29 12:11;0;0;"CDC Says October Soonest For <b> Swine Flu </b> Shots - 11Alive.com | WXIA <b>...</b> http://cli.gs/z8ZAb9";;;;"1958942054";https://twitter.com/H1N1VirusNews/status/1958942054
H1N1VirusNews;2009-05-29 12:11;0;0;"<b> Swine flu </b>: cruise to nowhere : Effect Measure http://cli.gs/ad9LeW";;;;"1958941835";https://twitter.com/H1N1VirusNews/status/1958941835
H1N1VirusNews;2009-05-29 12:11;0;0;"U.S. Official in France Diagnosed With Swine Flu (Fox News) http://cli.gs/pLpyBD";;;;"1958941064";https://twitter.com/H1N1VirusNews/status/1958941064
SwineFluNewsIE;2009-05-29 12:10;0;0;"Scottish News: New case of swine flu confirmed http://tinyurl.com/pablcl";;;;"1958936638";https://twitter.com/SwineFluNewsIE/status/1958936638
Sleeplater;2009-05-29 12:10;0;0;"might close the home office because of swine flu . will head upstairs to the living room and work from there. send the staff home.";;;;"1958936405";https://twitter.com/Sleeplater/status/1958936405
springfieldohio;2009-05-29 12:10;0;0;"Swine Flu still a concern for parents: Northeastern Local school board members met Thursday night, and Swine Flu .http://ow.ly/9Qq0 @WDTN";;@WDTN;;"1958936039";https://twitter.com/springfieldohio/status/1958936039
lilibudiman;2009-05-29 12:10;0;0;"US Takes Stock Of H1N1 Situation: After roughly a month of emergency response to the new H1N1 swine flu virus, U.. http://tinyurl.com/nr8xsu";;;;"1958935094";https://twitter.com/lilibudiman/status/1958935094
stefanboublil;2009-05-29 12:09;0;1;"swine flu death toll? 10,000. climate change death toll? 300,000/year. panicking about the wrong thing? priceless... http://twurl.nl/l2qltw";;;;"1958929199";https://twitter.com/stefanboublil/status/1958929199
DominicanJewel;2009-05-29 12:09;0;0;"ATTENTION TO ALL THE DOMINICAN TWITTERS. SWINE FLU IN DR. 3 schools closed, 2 confirmed sick, and people walking around with mask. Que vaina";;;;"1958926672";https://twitter.com/DominicanJewel/status/1958926672
binnsy;2009-05-29 12:09;0;0;"300 cases of swine flu in Australia. Yup. We all gunna dah.";;;;"1958924789";https://twitter.com/binnsy/status/1958924789
SwineFluNewsSG;2009-05-29 12:09;0;0;"The gloves have been upon in quarrel opposite swine flu http://tinyurl.com/ledmfv";;;;"1958923770";https://twitter.com/SwineFluNewsSG/status/1958923770
jamiebrain;2009-05-29 12:08;0;0;"Bouncing knee hit coughing like he's got swine flu or something. Charming! Someone needs to put a f*cking bag over is head!";;;;"1958921129";https://twitter.com/jamiebrain/status/1958921129
USATODAYhealth;2009-05-29 12:08;0;0;"U.S. official in France diagnosed with swine flu http://tinyurl.com/llccqo";;;;"1958920622";https://twitter.com/USATODAYhealth/status/1958920622
hbailie;2009-05-29 12:07;0;0;"Swine flu sends ning out of control (out of my control). i think it's good...";;;;"1958915131";https://twitter.com/hbailie/status/1958915131
Shaui07;2009-05-29 12:07;0;0;"Swine flu ,C5 insertion,overpriced noodles plus the hayden-katrina scandal-wats goin on in the world today? :(";;;;"1958915117";https://twitter.com/Shaui07/status/1958915117
SwineFluUK;2009-05-29 12:07;0;0;"swine flu Married female RE teacher, 39, arrested 'for sex with 15-year-old': Married female RE teacher.. http://tinyurl.com/mfewxy";;;;"1958912642";https://twitter.com/SwineFluUK/status/1958912642
SwineFluUK;2009-05-29 12:07;0;0;"swine flu MP who claimed £15,000 rent paid to socialite daughter has 'very serious questions to answer'.. http://tinyurl.com/nzo8gr";;;;"1958912483";https://twitter.com/SwineFluUK/status/1958912483
SwineFluUK;2009-05-29 12:07;0;0;"swine flu Fears grow for Vauxhall jobs as Fiat pulls out of GM talks: Fears grow for Vauxhall jobs as F.. http://tinyurl.com/nchxu2";;;;"1958912289";https://twitter.com/SwineFluUK/status/1958912289
haydencooper;2009-05-29 12:07;0;0;"Victoria: The Swine Flu State. http://www.abc.net.au/news/stories/2009/05/29/2584998.htm";;;;"1958911175";https://twitter.com/haydencooper/status/1958911175
SwineFluNewsEU;2009-05-29 12:06;0;0;"Conn Company Goes Into Production upon Swine Flu Vaccine http://tinyurl.com/lsex5g";;;;"1958906950";https://twitter.com/SwineFluNewsEU/status/1958906950
SwineFluNewsIE;2009-05-29 12:06;0;0;"Swine Flu Michigan News http://tinyurl.com/qaubgr";;;;"1958906667";https://twitter.com/SwineFluNewsIE/status/1958906667
Chile_Quake;2009-05-29 12:06;0;0;"Got a swine flu (H1N1) story from a credible source that you would like to share? feel free to DM it to us";;;;"1958906587";https://twitter.com/Chile_Quake/status/1958906587
femwriter;2009-05-29 12:06;0;0;"Worth repeating: you cannot get H1N1 from pork. Ever. BTW...if your kids are playing swine flu tag...get them to wash their hands instead";;;;"1958906081";https://twitter.com/femwriter/status/1958906081
suedegambit;2009-05-29 12:05;0;0;"based on how people behave on public transport, it seems that nobody has read their #swineflu leaflets....";;;#swineflu;"1958897801";https://twitter.com/suedegambit/status/1958897801
twitnewsfeed;2009-05-29 12:03;0;0;"US official in France diagnosed with swine flu (AP): AP - A U.S. official in Normandy to prepare President Bar.. http://tinyurl.com/mjkt3n";;;;"1958886200";https://twitter.com/twitnewsfeed/status/1958886200
marycrawford9;2009-05-29 12:03;0;0;"CaliforniaIris Has anybody heard of this swine flu epidemic coming from Mexico and killing people. Praise God that Jesus heals.";;;;"1958886088";https://twitter.com/marycrawford9/status/1958886088
SwineFluTicker;2009-05-29 12:03;0;0;"The Summer of Swine Flu Propaganda?: Lez Get Real Sound familiar? Its funny how we keep hearing about the flu of.. http://bit.ly/Mnn3d";;;;"1958883720";https://twitter.com/SwineFluTicker/status/1958883720
melekh;2009-05-29 12:02;0;0;"Published a new post: Maintaining A Healthy Immunity Against The Swine Flu http://ping.fm/yFhmc";;;;"1958882801";https://twitter.com/melekh/status/1958882801
TheYamYam;2009-05-29 12:02;0;0;"Handsworth school swine flu cases rises to 64 http://tinyurl.com/lejvfg";;;;"1958881661";https://twitter.com/TheYamYam/status/1958881661
ron_crowe;2009-05-29 12:02;0;0;"Two test positive for swine flu | Stuff.co.nz http://tinyurl.com/kmlb73";;;;"1958880401";https://twitter.com/ron_crowe/status/1958880401
Swine_Virus;2009-05-29 12:02;0;0;"US official in France diagnosed with swine flu - The Associated Press http://bit.ly/ORP37";;;;"1958879444";https://twitter.com/Swine_Virus/status/1958879444
healthy_news;2009-05-29 12:02;0;0;"Swine flu : cruise to nowhere : Effect Measure: As flu season ramps up in the southern hemisphere, the US, Europe.. http://bit.ly/KCKi3";;;;"1958877051";https://twitter.com/healthy_news/status/1958877051
swineflumania;2009-05-29 12:01;0;0;"PIG FLU! #swineflu US official in France diagnosed with swine flu - The Associated Press: US o.. http://tinyurl.com/ox4fzn";;;#swineflu;"1958874759";https://twitter.com/swineflumania/status/1958874759
SwineFlu_Expert;2009-05-29 12:01;0;0;"Check it out >> Weekly Update of 2009 H1N1 Influenza a Virus in Kansas: As of Thursday a to.. http://bit.ly/D0RFF";;;;"1958873898";https://twitter.com/SwineFlu_Expert/status/1958873898
Seej500;2009-05-29 12:01;0;0;"Exercise then lunch. I am 195lb still. I do not have swine flu . I still haven't finished writing that song. etc. etc.";;;;"1958872295";https://twitter.com/Seej500/status/1958872295
swinflunews;2009-05-29 12:01;0;0;"[ Swine Flu Song] Wash Your Hands Too (Parody of Wonder Girl’s ‘Nobody’) http://ff.im/-3mRSb";;;;"1958871968";https://twitter.com/swinflunews/status/1958871968
MRSA_blog;2009-05-29 12:01;0;0;"New at SUPERBUG: More on #MRSA pneumonia, not a lot of evidence for H1N1 #swineflu involvement. http://is.gd/IYRf";;;#MRSA #swineflu;"1958871248";https://twitter.com/MRSA_blog/status/1958871248
NewshubFeatures;2009-05-29 12:00;0;0;"3 News Latest Video Kiwi swine flu couple sent packing from Sydney hotel http://tinyurl.com/nemcev";;;;"1958866679";https://twitter.com/NewshubFeatures/status/1958866679
TND_Crisis;2009-05-29 12:00;0;0;"Swine Flu Spreads in Asia - Wall Street Journal (http://cli.gs/gMr3UQ) #swineflu #H1N1";;;#swineflu #H1N1;"1958863921";https://twitter.com/TND_Crisis/status/1958863921
TND_Crisis;2009-05-29 12:00;0;0;"US official in France diagnosed with swine flu - USA Today (http://cli.gs/54G35v) #swineflu #H1N1";;;#swineflu #H1N1;"1958863716";https://twitter.com/TND_Crisis/status/1958863716
novelh1n1;2009-05-29 12:00;0;0;"http://novelh1n1.com Four 'Possible' Swine Flu Cases Circulating in West Virginia - HNN Hunt.. http://bit.ly/11JbIu";;;;"1958863650";https://twitter.com/novelh1n1/status/1958863650
TND_Crisis;2009-05-29 12:00;0;0;"Carnival Offers Refund After Swine Flu Sickens Passengers, Crew - Bloomberg (http://cli.gs/28HV2S) #swineflu #H1N1";;;#swineflu #H1N1;"1958863500";https://twitter.com/TND_Crisis/status/1958863500
mmmworld;2009-05-29 12:00;0;0;"New Swine Flu Information:";;;;"1958863064";https://twitter.com/mmmworld/status/1958863064
spazecraft;2009-05-29 12:00;0;0;"WOW Google's #WAVE makes mo noiz then SWINE FLU 2day, & deres a scare in da #BRONX ! complete guide 2 Google Wave: http://trkk.us/t/?49143 LF";;;#WAVE #BRONX;"1958862593";https://twitter.com/spazecraft/status/1958862593
Nasenpflege;2009-05-29 11:59;0;0;"Swine flu : Can the new H1N1 flu virus be spread through water in swimming pools? http://www.cdc.gov/h1n1flu/";;;;"1958860719";https://twitter.com/Nasenpflege/status/1958860719
BriefNews;2009-05-29 11:59;0;0;"Swine Flu Vaccine Possible by October http://cli.gs/7zNqHB #linktweet";;;#linktweet;"1958858889";https://twitter.com/BriefNews/status/1958858889
AP_Mobile;2009-05-29 11:59;0;0;"US official in France diagnosed with swine flu http://bit.ly/1Fgwm";;;;"1958858246";https://twitter.com/AP_Mobile/status/1958858246
novelh1n1;2009-05-29 11:59;0;0;"http://novelh1n1.com U.S. official in France diagnosed with swine flu : French authorities sa.. http://bit.ly/2hatd";;;;"1958857486";https://twitter.com/novelh1n1/status/1958857486
BrendaSkidmore;2009-05-29 11:59;0;0;"Is Swine Flu Invincible to Health and Nutrition ... http://tinyurl.com/ntpmkt";;;;"1958856966";https://twitter.com/BrendaSkidmore/status/1958856966
swinflunews;2009-05-29 11:59;0;0;"Bio Project on H1N1 or Swine flu virus http://ff.im/-3mRS9";;;;"1958856525";https://twitter.com/swinflunews/status/1958856525
lindakennedy;2009-05-29 11:58;0;0;"Swine flu ? All a mix-up based on masks. Just fans marking the last-ever episode of ER.";;;;"1958854715";https://twitter.com/lindakennedy/status/1958854715
jakub76;2009-05-29 11:58;0;0;"Un-named news running a big " Swine Flu " sting at the head of every related story. Justified or sensationalized scare-mongering?";;;;"1958851746";https://twitter.com/jakub76/status/1958851746
brisbanetimes;2009-05-29 11:58;0;0;"Qld ship passenger confirmed with swine flu : The number of people in Queensland confirmed as having human swine .. http://tinyurl.com/mk2xgo";;;;"1958850240";https://twitter.com/brisbanetimes/status/1958850240
MatthewSigley;2009-05-29 11:58;0;0;"@MatthewSigley Canberra. Swine flu . Drunks. Forget about it.";;@MatthewSigley;;"1958849084";https://twitter.com/MatthewSigley/status/1958849084
earlyautism;2009-05-29 11:57;0;0;"Could Swine Flu Deaths be the Key to Understanding Autism? http://bit.ly/D29dU";;;;"1958843185";https://twitter.com/earlyautism/status/1958843185
brooke_m;2009-05-29 11:56;0;0;"Nearly 40,000 ppl at the footy tonight. Hope none of them have #swine flu";;;#swine;"1958839958";https://twitter.com/brooke_m/status/1958839958
ReadingEagle;2009-05-29 11:54;0;0;"Kutztown University student among latest to contract swine flu http://bit.ly/1vzpxe";;;;"1958827612";https://twitter.com/ReadingEagle/status/1958827612
BarbAtSea;2009-05-29 11:54;0;0;"RT @askegg : I wonder if when they develop a vaccine for swine flu whether it will be bacon flavored? @hobartdaily ) (via @slackadjusterr )";;@askegg @hobartdaily @slackadjusterr;;"1958826852";https://twitter.com/BarbAtSea/status/1958826852
SwineFluNewsORG;2009-05-29 11:54;0;0;"Venezuela Reports First Swine Flu Case http://tinyurl.com/ndzdd4";;;;"1958826235";https://twitter.com/SwineFluNewsORG/status/1958826235
markschrader;2009-05-29 11:53;0;0;"Following the swine flu story in English media";;;;"1958822770";https://twitter.com/markschrader/status/1958822770
SwineFluNewsNZ;2009-05-29 11:52;0;0;"Seriously sick male has swine flu http://tinyurl.com/ouxdq7";;;;"1958815112";https://twitter.com/SwineFluNewsNZ/status/1958815112
pwnolan;2009-05-29 11:52;0;0;"already sick of swine flu and associated dramas even though the worst is yet to come.";;;;"1958815073";https://twitter.com/pwnolan/status/1958815073
Ethelmay;2009-05-29 11:51;0;0;"Swine Flu Why is it that all the Swins in the world are still alive. DIctators- IRAN TALiban Nth KOREA RUssIa BUmA etc etc etc My Land Lord";;;;"1958806753";https://twitter.com/Ethelmay/status/1958806753
swineflu2;2009-05-29 11:51;0;0;"#swineflu US official in France diagnosed with swine flu - The Associated Press: US official in France .. http://tinyurl.com/kkxoxk";;;#swineflu;"1958806402";https://twitter.com/swineflu2/status/1958806402
robmackenna;2009-05-29 11:50;0;0;"Woke up sick as a dog, both kids home for the day. This will be fun. Hope its not swine flu . http://myloc.me/1Yk1";;;;"1958803448";https://twitter.com/robmackenna/status/1958803448
swinefluh1n1;2009-05-29 11:50;0;0;""THANKS TO 'IDOL,' MARTIN'S BANJO ALBUM DOESN'T IDLE - Hollywood ..." http://tinyurl.com/mnft6l #swineflu #H1N1";;;#swineflu #H1N1;"1958800851";https://twitter.com/swinefluh1n1/status/1958800851
swinefluh1n1;2009-05-29 11:50;0;0;""H5N1: Indonesia: Memories of 1918" http://tinyurl.com/mym56s #swineflu #H1N1";;;#swineflu #H1N1;"1958800681";https://twitter.com/swinefluh1n1/status/1958800681
WinterBelle_;2009-05-29 11:50;0;0;"so. turns out i hav a slight chance i have swine flu coz my friend has a chance that she has it. wait and see...";;;;"1958799617";https://twitter.com/WinterBelle_/status/1958799617
citrusandcandy;2009-05-29 11:50;0;0;"Bloggers get porked at Yuletide dinner at Restaurant Atelier. Swine flu be damned! http://bit.ly/qDyyh";;;;"1958797432";https://twitter.com/citrusandcandy/status/1958797432
SwineFluNewsEU;2009-05-29 11:50;0;0;"World closer to swine flu pandemic, says WHO http://tinyurl.com/lwlr96";;;;"1958797322";https://twitter.com/SwineFluNewsEU/status/1958797322
ChrisEldridge;2009-05-29 11:50;0;0;"Chris My Wife is back from LA in 2 days. Wonder if my present will be a nice old dose of swine flu !! http://ff.im/-3mR00";;;;"1958797185";https://twitter.com/ChrisEldridge/status/1958797185
SwineFluNewsHK;2009-05-29 11:49;0;0;"Hong Kong propagandize suggested to tighten to stop swine flu spread";;;;"1958796326";https://twitter.com/SwineFluNewsHK/status/1958796326
swinefluh1n1;2009-05-29 11:49;0;0;""Searching correlations - Bad Astronomy and Universe Today Forum" #swineflu #H1N1";;;#swineflu #H1N1;"1958794434";https://twitter.com/swinefluh1n1/status/1958794434
NantoCielens;2009-05-29 11:49;0;0;"Long day. Swine flu causing issues @work @Mysie76 understands";;@work @Mysie76;;"1958791438";https://twitter.com/NantoCielens/status/1958791438
tommmi;2009-05-29 11:48;0;0;"Carnival Offers Refund After Swine Flu Sickens Passengers, Crew http://bit.ly/hPo8M";;;;"1958787003";https://twitter.com/tommmi/status/1958787003
swinefluh1n1;2009-05-29 11:48;0;0;""West African meningitis outbreak strains vaccine supplies : The Lancet" http://tinyurl.com/lard85 #swineflu #H1N1";;;#swineflu #H1N1;"1958786998";https://twitter.com/swinefluh1n1/status/1958786998
sbrobot;2009-05-29 11:47;0;0;"Swine flu : cruise to nowhere [Effect Measure]: As flu season ramps up in the southern hemisphere, the US, Europe.. http://bit.ly/3PgaW2";;;;"1958782365";https://twitter.com/sbrobot/status/1958782365
bradjward;2009-05-29 11:47;0;0;"Swine Flu was a conspiracy by the Mexican Gov't to take eyes off drug wars so they can now say "Mexico is safe to visit again." Discuss. :)";;;;"1958781847";https://twitter.com/bradjward/status/1958781847
SwineFluNewsCA;2009-05-29 11:46;0;0;"Group urges some-more movement to forestall swine flu outbreak http://tinyurl.com/nabntk";;;;"1958775287";https://twitter.com/SwineFluNewsCA/status/1958775287
SwineFluNewsIE;2009-05-29 11:45;0;0;"Swine Flu Media Bulletin Issued At: 11am Thursday 21 May 2009, Wales http://tinyurl.com/mo7byj";;;;"1958771818";https://twitter.com/SwineFluNewsIE/status/1958771818
breakingflunews;2009-05-29 11:45;0;0;"breakingflunews.com US official in France diagnosed with swine flu - The Associated Press: US.. http://tinyurl.com/l2jhoy";;;;"1958770629";https://twitter.com/breakingflunews/status/1958770629
swinefluclear;2009-05-29 11:45;0;0;"All cruise ships around the world are becoming major place to get infected with Swineflu . If you are planning for a cruise holiday -not now!";;;;"1958768313";https://twitter.com/swinefluclear/status/1958768313
hburgamerican;2009-05-29 11:45;0;0;"With warmer weather comes West Nile virus: With the onslaught of the swine flu , many are taking precautions to w.. http://ping.fm/HifMG";;;;"1958766711";https://twitter.com/hburgamerican/status/1958766711
fullyracked;2009-05-29 11:45;0;0;"Is Swine Flu Invincible to Health and Nutrition ... http://bit.ly/19Ph2x";;;;"1958766291";https://twitter.com/fullyracked/status/1958766291
JayJGarciaDiet;2009-05-29 11:44;0;0;"The third case of swine flu reported in manatee county. Keep washing those hands, covering coughs/sneezes, eating right, & take your omegas";;;;"1958762949";https://twitter.com/JayJGarciaDiet/status/1958762949
prempcc;2009-05-29 11:44;0;0;"New blog post: Swine flu alert! News/Death ratio: 8176 http://bit.ly/2t7ZI";;;;"1958760210";https://twitter.com/prempcc/status/1958760210
SwineFluNewsORG;2009-05-29 11:43;0;0;"129 Swine Flu Cases Now Reported in Bexar County http://tinyurl.com/m57pqv";;;;"1958755000";https://twitter.com/SwineFluNewsORG/status/1958755000
swinefluremedy_;2009-05-29 11:42;0;0;"Amanda Addams swine flu remedy buy great art while you can Swin ... http://bit.ly/uI1uB";;;;"1958753899";https://twitter.com/swinefluremedy_/status/1958753899
philmurfin;2009-05-29 11:42;0;0;"my mood: Relieved. I Just got back from the doctors, thought i had swine flu , been feeling rough for a weeeeeeeek! he gave me some oinkm ...";;;;"1958753319";https://twitter.com/philmurfin/status/1958753319
