username;date;retweets;favorites;text;geo;mentions;hashtags;id;permalink
breakingflunews;2009-05-22 19:46;0;0;"breakingflunews.com Son of NYC swine flu victim pitches no-hitter - The Associated Press: KAT.. http://tinyurl.com/rybmp2";;;;"1886033420";https://twitter.com/breakingflunews/status/1886033420
TheSUBWAY;2009-05-22 19:46;0;0;"[UK] WHO bows to criticism on swine flu alert - http://tinyurl.com/oqkvlu $$";;;;"1886032998";https://twitter.com/TheSUBWAY/status/1886032998
breakingflunews;2009-05-22 19:46;0;0;"breakingflunews.com Updated: 4 confirmed swine flu cases at Morris Hills HS - Dailyrecord.com.. http://tinyurl.com/osdadw";;;;"1886032513";https://twitter.com/breakingflunews/status/1886032513
playah8rzball;2009-05-22 19:45;0;0;"#h8rz Comment on Why Swine Flu Will NOT Kill Us All by PlanetJusta: LOL! Wize how bored/higher than a lil b.. http://bit.ly/fV3uX";;;#h8rz;"1886031706";https://twitter.com/playah8rzball/status/1886031706
jtjarzemsky;2009-05-22 19:45;0;0;"They just advised that hand sanitizer be used...the implication was swine flu";;;;"1886026246";https://twitter.com/jtjarzemsky/status/1886026246
ptpower;2009-05-22 19:45;0;0;"RT: @debmarkham : RT: @dahifi : First celebrity death from swineflu . http://twitpic.com/5imkg";;@debmarkham @dahifi;;"1886023252";https://twitter.com/ptpower/status/1886023252
SwineFlu_news;2009-05-22 19:45;0;0;"Bulgari faces difficult turnaround http://t.love.com/216213248";;;;"1886023036";https://twitter.com/SwineFlu_news/status/1886023036
FOX10News;2009-05-22 19:44;0;0;"CDC tests viruses for swine flu vaccine: Government scientists are moving a step closer to a possible swine flu .. http://tinyurl.com/qvhmj5";;;;"1886017977";https://twitter.com/FOX10News/status/1886017977
tompeyer;2009-05-22 19:44;0;0;"RT @Deadspin : NYC Pitcher Throws No-No After Dad Dies Of Swine Flu http://tinyurl.com/q7acdk";;@Deadspin;;"1886016457";https://twitter.com/tompeyer/status/1886016457
CrisisWatch;2009-05-22 19:44;0;0;"*EMM Disease Alerts* Season change could spread swine flu in Asia-Pacific: WHO http://tinyurl.com/oheanx";;;;"1886014845";https://twitter.com/CrisisWatch/status/1886014845
TM_Outbreak;2009-05-22 19:44;0;0;"The Associated Press: WHO to consider severity of 'sneaky' swine flu http://bit.ly/12WgVe (via @W0rldHealthOrg)";;@W0rldHealthOrg;;"1886013665";https://twitter.com/TM_Outbreak/status/1886013665
DailyRegister;2009-05-22 19:43;0;0;"Illinois hard hit with swine flu cases, but Southern Illinois has only a few http://tinyurl.com/pakox9";;;;"1886005263";https://twitter.com/DailyRegister/status/1886005263
healthytweet;2009-05-22 19:43;0;0;"Health News Swine Flu Outbreak May Be Subsiding, CDC Says: Title: Swine Flu Outbreak May Be Subsiding.. http://tinyurl.com/rxvxdh";;;;"1886003852";https://twitter.com/healthytweet/status/1886003852
VegasWalkinDude;2009-05-22 19:43;0;0;"RT @SamGaleRosen Okay, think at least I don't have swine flu . Hurray. - You're correct. You don't! It's #captaintrips";;@SamGaleRosen;#captaintrips;"1886003717";https://twitter.com/VegasWalkinDude/status/1886003717
swinefluupdated;2009-05-22 19:42;0;0;"Influenza A (H1N1) - worldwide (36): case counts, amended #swineflu http://tinyurl.com/qnass5";;;#swineflu;"1885997780";https://twitter.com/swinefluupdated/status/1885997780
The_Nation;2009-05-22 19:41;0;0;"Swine flu to hit world's poor harder: WHO chief http://tinyurl.com/ptlgvu #International";;;#International;"1885982232";https://twitter.com/The_Nation/status/1885982232
SwineFluNewsAU;2009-05-22 19:40;0;0;"Swine Flu News: Swine flu to 'sweep state' http://tinyurl.com/pmhynx";;;;"1885980061";https://twitter.com/SwineFluNewsAU/status/1885980061
SwineFluNewsORG;2009-05-22 19:40;0;0;"Swine Flu News: Son of NYC swine flu plant pitches no-hitter http://tinyurl.com/r4jrbx";;;;"1885979268";https://twitter.com/SwineFluNewsORG/status/1885979268
spinner941;2009-05-22 19:40;0;0;"18 year old son of NYC Asst Princ that died from swine flu earlier this week, pitched a HS baseball NO hitter yesterday. Very inspiring!";;;;"1885973946";https://twitter.com/spinner941/status/1885973946
CatchMyPitch;2009-05-22 19:40;0;0;"Great NY story: Son of NYC swine flu victim pitches no-hitter - http://bit.ly/TMnin";;;;"1885972857";https://twitter.com/CatchMyPitch/status/1885972857
4HealthNews;2009-05-22 19:39;0;0;"WHO Rethinks Swine Flu Pandemic Criteria: The World Health Organization today said it will reconsider its standa.. http://tinyurl.com/rccykg";;;;"1885966085";https://twitter.com/4HealthNews/status/1885966085
aMoneyMachine;2009-05-22 19:39;0;0;"SEO professionals trying to Catch Swine Flu !: Well okay not literally, but search engine optimization and the sw.. http://bit.ly/MRZto";;;;"1885962792";https://twitter.com/aMoneyMachine/status/1885962792
aMoneyMachine;2009-05-22 19:38;0;0;"SEO professionals trying to Catch Swine Flu !: Well okay not literally, but search engine optimization and the sw.. http://bit.ly/MRZto";;;;"1885953546";https://twitter.com/aMoneyMachine/status/1885953546
frumnews;2009-05-22 19:37;0;0;"VidYid.com JBN: Son of NYC swine flu victim Mitchell Wiener pitches no-hitter (in the Shiva): NEW.. http://tinyurl.com/pux6gb";;;;"1885943419";https://twitter.com/frumnews/status/1885943419
trackswineflu;2009-05-22 19:36;0;0;"[News] Number of Las Vegas-area swine flu raised to 26: AP LAS VEGAS—Health officials have raised the numb.. http://tr.im/m8yk";;;;"1885940174";https://twitter.com/trackswineflu/status/1885940174
swinefluh1n1;2009-05-22 19:36;0;0;""A TIME'S MEMORY: Low seasonal influenza activity but just over 300 ..." http://tinyurl.com/ocgcwo #swineflu #H1N1";;;#swineflu #H1N1;"1885937708";https://twitter.com/swinefluh1n1/status/1885937708
UTSciEnviron;2009-05-22 19:36;0;0;"Swine flu genes circulated undetected http://tinyurl.com/ohbsrd";;;;"1885936009";https://twitter.com/UTSciEnviron/status/1885936009
Swine_Virus;2009-05-22 19:36;0;0;"WHO to consider severity of 'sneaky' swine flu - The Associated Press http://bit.ly/J11it";;;;"1885934454";https://twitter.com/Swine_Virus/status/1885934454
H1N1swineflu;2009-05-22 19:36;0;0;"#swineflu Swine flu case suspected in Moradabad: Swine flu case suspected in Moradabad - Doctors at the.. http://tinyurl.com/p34uxq";;;#swineflu;"1885933671";https://twitter.com/H1N1swineflu/status/1885933671
caitcmcd;2009-05-22 19:35;0;0;"Man, mexico just can't catch a break. First swine flu then today an earthquake in mexico city!";;;;"1885930414";https://twitter.com/caitcmcd/status/1885930414
BriefNews;2009-05-22 19:34;0;0;"Elder Q&A: Take proper precautions to avoid catching swine flu http://cli.gs/yyumYd #linktweet";;;#linktweet;"1885916813";https://twitter.com/BriefNews/status/1885916813
Alderalarms;2009-05-22 19:34;0;0;"Number of Las Vegas-area swine flu raised to 26 http://bit.ly/qHRIb";;;;"1885913796";https://twitter.com/Alderalarms/status/1885913796
BreakingBizNews;2009-05-22 19:34;0;0;"WHO bows to criticism on swine flu alert: The World Health Organisation has bowed to pressure that it was unnece.. http://tinyurl.com/plfemn";;;;"1885913578";https://twitter.com/BreakingBizNews/status/1885913578
NT7S;2009-05-22 19:34;0;0;"Please, for the love of God, enough with the Ham Radio/ Swine Flu jokes already! I'm begging you.";;;;"1885911550";https://twitter.com/NT7S/status/1885911550
msekmingas;2009-05-22 19:33;0;0;"WHO confirms 11,168 A/H1N1 swine flu cases worldwide, 86 deaths http://bit.ly/1vV5BZ";;;;"1885908846";https://twitter.com/msekmingas/status/1885908846
swineflumania;2009-05-22 19:33;0;0;"PIG FLU! Son of NYC swine flu victim pitches no-hitter - The Associated Press: Son of NYC swine flu vict.. http://tinyurl.com/ocojqf";;;;"1885905720";https://twitter.com/swineflumania/status/1885905720
H1N1VirusNews;2009-05-22 19:33;0;0;"WHO To Consider Severity Of 'Sneaky' Swine Flu http://cli.gs/PnG3QM";;;;"1885902653";https://twitter.com/H1N1VirusNews/status/1885902653
NevadaNews;2009-05-22 19:33;0;0;"FOX5LV Vegas Swine Flu Cases Rising: Health officials have raised the number of swine flu cases reported i.. http://tinyurl.com/qdctsc";;;;"1885901775";https://twitter.com/NevadaNews/status/1885901775
csgazette;2009-05-22 19:32;0;0;"Son of swine flu victim pitches no-hitter day after funeral: NEW YORK - The son of a New York City assistant pri.. http://tinyurl.com/qqljyr";;;;"1885900322";https://twitter.com/csgazette/status/1885900322
tylrrthnbrg;2009-05-22 19:32;0;0;"I hope it's not Phillip! RT @thenewspress : From the news desk: 19 cases of swine flu now confirmed in Lee County http://tinyurl.com/r3orv8";;@thenewspress;;"1885896716";https://twitter.com/tylrrthnbrg/status/1885896716
lordredrock;2009-05-22 19:32;0;0;"Number of Las Vegas-area swine flu raised to 26: AP LAS VEGAS—Health officials have raised the number of swine f.. http://tinyurl.com/qbudua";;;;"1885895203";https://twitter.com/lordredrock/status/1885895203
CBSNewYork;2009-05-22 19:32;0;0;"The son of Mitchell Wiener, whose death was first in NYC linked to swine flu , pitches perfect game in father's honor. http://bit.ly/167D3j";;;;"1885894529";https://twitter.com/CBSNewYork/status/1885894529
lordredrock;2009-05-22 19:32;0;0;"WHO to consider severity of 'sneaky' swine flu: The Associated Press GENEVA (AP) — The World Health Orga.. http://tinyurl.com/pt9eoj";;;;"1885892241";https://twitter.com/lordredrock/status/1885892241
BasherMagerck;2009-05-22 19:32;0;0;"Russia Newswire,Rianovosti. Russia's Health Ministry reports Moscow's first swine flu case. http://en.rian.ru/world/20090522/155067268.html";;;;"1885890742";https://twitter.com/BasherMagerck/status/1885890742
matsassafras;2009-05-22 19:31;0;0;".... somebody at my school has swine flu ....... The letter called it "the novelty H1N1 virus" eveytime it was mentioned......ugggg";;;;"1885888365";https://twitter.com/matsassafras/status/1885888365
mycancundeals;2009-05-22 19:31;0;0;"Swine Flu Travel Warning lifted for Mexico causing Deals to Proliferate. Great Cancun and Riviera Maya family deals! http://ow.ly/8zlD";;;;"1885885628";https://twitter.com/mycancundeals/status/1885885628
stopflunews;2009-05-22 19:31;0;0;"Son of NYC swine flu victim pitches no-hitter - The Associated Press http://tinyurl.com/pemjjl";;;;"1885885126";https://twitter.com/stopflunews/status/1885885126
PennyEdmiston;2009-05-22 19:31;0;0;"90 people get the Swine Flu and everybody wants to wear a mask. A million people have AIDS and no one wants to wear a condom.";;;;"1885881267";https://twitter.com/PennyEdmiston/status/1885881267
healthaz;2009-05-22 19:30;0;0;"WHO Rethinks Swine Flu Pandemic Criteria: The World Health Organization today said it will reconsider its standa.. http://tinyurl.com/qtw7ce";;;;"1885879545";https://twitter.com/healthaz/status/1885879545
CoCoHealth;2009-05-22 19:30;0;0;"Total H1N1 ( swine flu ) cases in Contra Costa now 59. www.cchealth.org";;;;"1885877292";https://twitter.com/CoCoHealth/status/1885877292
TheNewsPress;2009-05-22 19:30;0;0;"From the news desk: 19 cases of swine flu now confirmed in Lee County http://tinyurl.com/r3orv8";;;;"1885877147";https://twitter.com/TheNewsPress/status/1885877147
swineflupdates;2009-05-22 19:30;0;0;"NEW INFO: Marathon County Confirms First Case of H1N1 ( Swine Flu ) (WSAW Wausau) Swine Flu Updates! http://tinyurl.com/k89jck";;;;"1885872005";https://twitter.com/swineflupdates/status/1885872005
SwineFlu_news;2009-05-22 19:30;0;0;"Talk of green shoots premature http://t.love.com/216204515";;;;"1885870543";https://twitter.com/SwineFlu_news/status/1885870543
SwineFluNewsCA;2009-05-22 19:30;0;0;"Swine Flu News: Interfax: 1st box of swine flu found in Russia http://tinyurl.com/p4pkwe";;;;"1885869535";https://twitter.com/SwineFluNewsCA/status/1885869535
sewrighter;2009-05-22 19:29;0;0;"Kara's AI song was like a bad case of Swine Flu .";;;;"1885868613";https://twitter.com/sewrighter/status/1885868613
swinflunews;2009-05-22 19:29;0;0;"COOPERS GOT THE SWINE FLU - PART 7 http://ff.im/-39CTF";;;;"1885864717";https://twitter.com/swinflunews/status/1885864717
swinflunews;2009-05-22 19:29;0;0;"COOPERS GOT THE SWINE FLU - PART 9 http://ff.im/-39CTx";;;;"1885864634";https://twitter.com/swinflunews/status/1885864634
damofoto;2009-05-22 19:29;0;0;"That little tremblor was a bit stronger, and longer, that the one during the swine 'flu fracas.";;;;"1885860489";https://twitter.com/damofoto/status/1885860489
Fla_Medic;2009-05-22 19:28;0;0;"Blogging `WHO To Change Criteria For Declaring A Pandemic' #swineflu http://tinyurl.com/q3dgs2 Warning:Rant Mode On";;;#swineflu;"1885854682";https://twitter.com/Fla_Medic/status/1885854682
Swine__Flu;2009-05-22 19:28;0;0;"#SwineFlu UPDATE 5-WHO chief says world should prepare for severe flu http://tinyurl.com/qfqx5g";;;#SwineFlu;"1885854451";https://twitter.com/Swine__Flu/status/1885854451
swinefluh1n1;2009-05-22 19:27;0;0;""H1N1 Flu ( Swine Flu ) - CDC Update, May 22, 2009" http://tinyurl.com/ogn76c #swineflu #H1N1";;;#swineflu #H1N1;"1885847418";https://twitter.com/swinefluh1n1/status/1885847418
swinefluh1n1;2009-05-22 19:27;0;0;""US to fund 1 billion dollars to develop vaccine against A/H1N1 flu" http://tinyurl.com/ol3lzy #swineflu #H1N1";;;#swineflu #H1N1;"1885846883";https://twitter.com/swinefluh1n1/status/1885846883
Fluheadlines;2009-05-22 19:27;0;0;"Fluheadlines Swine flu round up - May 22, 2009: All Nature’s swine flu coverage is collected on our .. http://tinyurl.com/ptyvu4";;;;"1885842938";https://twitter.com/Fluheadlines/status/1885842938
SkyNewsTopStory;2009-05-22 19:27;0;0;"'Sneaky' Swine flu may hit poor nations: World Health Organisation chief Margaret Chan has urged developing coun.. http://tinyurl.com/pro6jj";;;;"1885841126";https://twitter.com/SkyNewsTopStory/status/1885841126
Fluheadlines;2009-05-22 19:27;0;0;"Fluheadlines Namibia: More Cases of African Swine Flu in Omusati: Windhoek — More pigs died this wee.. http://tinyurl.com/ob77at";;;;"1885840427";https://twitter.com/Fluheadlines/status/1885840427
Fluheadlines;2009-05-22 19:26;0;0;"Fluheadlines Number of Las Vegas-area swine flu raised to 26: Health officials have raised the numbe.. http://tinyurl.com/r6jwoc";;;;"1885838639";https://twitter.com/Fluheadlines/status/1885838639
sickhater;2009-05-22 19:26;0;0;"US swine flu deaths hit double-digits http://jijr.com/hvgY";;;;"1885832754";https://twitter.com/sickhater/status/1885832754
hburgamerican;2009-05-22 19:25;0;0;"Case of swine flu confirmed in Forrest County http://ping.fm/ljPCF";;;;"1885826831";https://twitter.com/hburgamerican/status/1885826831
SwineInfluenza_;2009-05-22 19:25;0;0;"New post: Swine Flu Deaths Reach Double Digits in US - BET (http://cli.gs/A6qGTE)";;;;"1885824054";https://twitter.com/SwineInfluenza_/status/1885824054
SwineInfluenza_;2009-05-22 19:25;0;0;"New post: Number of Las Vegas-area swine flu raised to 26 - San Jose Mercury News (http://cli.gs/y3MtpB)";;;;"1885823821";https://twitter.com/SwineInfluenza_/status/1885823821
SwineInfluenza_;2009-05-22 19:25;0;0;"New post: Son of NYC swine flu victim pitches no-hitter - The Associated Press (http://cli.gs/VZ6NS8)";;;;"1885823463";https://twitter.com/SwineInfluenza_/status/1885823463
VerveOnline;2009-05-22 19:25;0;0;"Verve Online CDC tests candidate viruses for swine flu vaccine: Government scientists are moving a s.. http://bit.ly/12PkQT";;;;"1885822796";https://twitter.com/VerveOnline/status/1885822796
VerveOnline;2009-05-22 19:25;0;0;"Verve Online WHO to consider severity of 'sneaky' swine flu : The World Health Organization said Frid.. http://bit.ly/tEwOz";;;;"1885821081";https://twitter.com/VerveOnline/status/1885821081
VerveOnline;2009-05-22 19:24;0;0;"Verve Online Swine flu genes circulated undetected for years: Genes included in the new swine flu ma.. http://bit.ly/KhPsI";;;;"1885818369";https://twitter.com/VerveOnline/status/1885818369
sunherald;2009-05-22 19:24;0;0;"Mississippi swine flu cases now number 8: The Mississippi State Department of Health has reported one new case o.. http://tinyurl.com/rdlgml";;;;"1885816482";https://twitter.com/sunherald/status/1885816482
FluSymptoms;2009-05-22 19:24;0;0;"SWINE FLU SURVIVOR funny T-Shirt WHITE Sizes S M L XL http://tinyurl.com/oy8yrr";;;;"1885815663";https://twitter.com/FluSymptoms/status/1885815663
anneminard;2009-05-22 19:24;0;0;"New blog post: As swine flu keeps spreading, researchers reveal more of its story http://bit.ly/12o8Gx";;;;"1885815145";https://twitter.com/anneminard/status/1885815145
SwineFluNewsAU;2009-05-22 19:24;0;0;"Swine Flu News: Flu spreads 'faster than expected' http://tinyurl.com/omdshg";;;;"1885814142";https://twitter.com/SwineFluNewsAU/status/1885814142
DispatchAlerts;2009-05-22 19:24;0;0;"Another OSU student has confirmed case of swine flu http://tinyurl.com/o3pv4y";;;;"1885809895";https://twitter.com/DispatchAlerts/status/1885809895
earthtimes;2009-05-22 19:23;0;0;"Chilean man attacked in Argentina over swine flu symptoms http://tinyurl.com/p3f5hn";;;;"1885808432";https://twitter.com/earthtimes/status/1885808432
JoshTheGoon;2009-05-22 19:23;0;0;"RT @LAWeekly : DUI checkpoint tonight: Washington Boulevard and Lovelace Avenue http://bit.ly/ZaaAD (via @laist ) SWINE FLU ALERT";;@LAWeekly @laist;;"1885808227";https://twitter.com/JoshTheGoon/status/1885808227
globeizer;2009-05-22 19:23;0;0;"#swineflu #travel Japan eases anti- swine flu measures http://tinyurl.com/ozbxgj";;;#swineflu #travel;"1885807691";https://twitter.com/globeizer/status/1885807691
larryloik;2009-05-22 19:23;0;0;"Internet Marketing + Social Media Training.Cutting Edge Tech Better than hearing about the swine flu and gas prices http://is.gd/ynTk";;;;"1885803981";https://twitter.com/larryloik/status/1885803981
novelh1n1;2009-05-22 19:23;0;0;"http://novelh1n1.com WHO to consider severity of 'sneaky' swine flu - The Associated Press: .. http://bit.ly/fgWz2";;;;"1885800163";https://twitter.com/novelh1n1/status/1885800163
novelh1n1;2009-05-22 19:22;0;0;"http://novelh1n1.com WHO: 11,168 cases of swine flu worldwide: Geneva - The World Health Org.. http://bit.ly/SDvXv";;;;"1885797925";https://twitter.com/novelh1n1/status/1885797925
wbznewsradio;2009-05-22 19:22;0;0;"WBZ TOP STORIES: MA announces 49 new swine flu cases: State public health officials have confir.. http://tinyurl.com/q2tl64";;;;"1885796624";https://twitter.com/wbznewsradio/status/1885796624
pulsetoday;2009-05-22 19:22;0;0;"Blogs & comment: The heavy burden of insight: Swine flu guidance is updated on an almost daily b.. http://bit.ly/Zjn2L";;;;"1885793196";https://twitter.com/pulsetoday/status/1885793196
WellnessInfo;2009-05-22 19:22;0;0;"WebMD: WHO Rethinks Swine Flu Pandemic Criteria | Best, Worst Countries for Life: http://tinyurl.com/r9xycf Full http://tinyurl.com/qtw7ce";;;;"1885792317";https://twitter.com/WellnessInfo/status/1885792317
usnews;2009-05-22 19:22;0;0;"Swine Flu Genes Circulated Undetected for Years http://tr.im/m8ti";;;;"1885791667";https://twitter.com/usnews/status/1885791667
manboo;2009-05-22 19:21;0;0;"Swine Flu : How to Reduce Your Chance of Infection and Transmission to Others: April 27, 2009 Everyone wants to .. http://tinyurl.com/qkrdjf";;;;"1885788230";https://twitter.com/manboo/status/1885788230
oregonlive;2009-05-22 19:21;0;0;"U.S. sets aside $1 billion to find swine flu vaccine http://tinyurl.com/qblmnh";;;;"1885781414";https://twitter.com/oregonlive/status/1885781414
Greenicious;2009-05-22 19:21;0;0;"Mexico Travel Deals Abound In Swine Flu 's Wake - WSJ.com http://ow.ly/8AFW";;;;"1885780474";https://twitter.com/Greenicious/status/1885780474
ABC7NY;2009-05-22 19:21;0;0;"Son of swine flu victim pitches no-hitter: The son of a New York City assistant public school principal who died.. http://tinyurl.com/qjk9kq";;;;"1885780448";https://twitter.com/ABC7NY/status/1885780448
ecotrotters;2009-05-22 19:21;0;0;"Mexico Travel Deals Abound In Swine Flu 's Wake - WSJ.com http://ow.ly/8AFH";;;;"1885780075";https://twitter.com/ecotrotters/status/1885780075
swineflueupdate;2009-05-22 19:20;0;0;"Educate and Prevent Son of NYC swine flu victim pitches no-hitter - The Associated Press: KCB.. http://tinyurl.com/pxtc5h";;;;"1885779672";https://twitter.com/swineflueupdate/status/1885779672
swineflueupdate;2009-05-22 19:20;0;0;"Educate and Prevent WHO to consider severity of 'sneaky' swine flu - The Associated P.. http://tinyurl.com/qbg75n";;;;"1885777485";https://twitter.com/swineflueupdate/status/1885777485
webaddict;2009-05-22 19:20;0;0;"U.S. directs $1 billion for new swine flu vaccine http://bit.ly/cjmbK #health #swineflu";;;#health #swineflu;"1885777438";https://twitter.com/webaddict/status/1885777438
weightlosscoach;2009-05-22 19:20;0;0;"RT @GeoffHampton Because there is a VERY REAL national health crisis (not related to swineflu ). . sedentary living & poor nutritional choice";;@GeoffHampton;;"1885775483";https://twitter.com/weightlosscoach/status/1885775483
DanMonson;2009-05-22 19:20;0;0;"RT @Deadspin : NYC Pitcher Throws No-No After Dad Dies Of Swine Flu http://deadspin.com/5266214";;@Deadspin;;"1885774060";https://twitter.com/DanMonson/status/1885774060
TubbsKrueger;2009-05-22 19:19;0;0;"If this lady doesn't stop coughin that swine flu on my neck I'm goin to bodyslam they whole row!!!";;;;"1885766236";https://twitter.com/TubbsKrueger/status/1885766236
FluTrackers;2009-05-22 19:19;0;0;"WHO Director Chan's Closing remarks at 62nd World Health Assembly http://tinyurl.com/o3e6nz #swineflu #birdflu";;;#swineflu #birdflu;"1885764105";https://twitter.com/FluTrackers/status/1885764105
myOptum;2009-05-22 19:19;0;0;"Swine Flu Outbreak May Be on the Wane: CDC: Drop seen in doctor, hospital visits for possible infection http://tinyurl.com/o8dau3";;;;"1885762531";https://twitter.com/myOptum/status/1885762531
SwineFluNewsORG;2009-05-22 19:18;0;0;"Swine Flu News: CDC tests claimant viruses for swine flu vaccine prior to promulgation to manufacturers http://tinyurl.com/oqsexs";;;;"1885757347";https://twitter.com/SwineFluNewsORG/status/1885757347
SwineFluNewsEU;2009-05-22 19:18;0;0;"Swine Flu News: Season shift could widespread swine flu in Asia-Pacific: WHO http://tinyurl.com/olzbom";;;;"1885756122";https://twitter.com/SwineFluNewsEU/status/1885756122
IanRobinson;2009-05-22 19:18;0;0;"" Swine flu is a variant of rotter flu and cad flu, that have combined to form this. And if you sneeze it's an absolute shower" -Jeremy Hardy";;;;"1885752895";https://twitter.com/IanRobinson/status/1885752895
lakandiwa;2009-05-22 19:18;0;0;"RT @TheFix : Elmo on handwashing -- the video! http://bit.ly/Tv4QX (my kid loves him some elmo...the words of the day are... swine flu )";;@TheFix;;"1885752404";https://twitter.com/lakandiwa/status/1885752404
jonjtcclark;2009-05-22 19:17;0;0;"People in masks and people who are sneezing on flights make me uncomfortable... No swine flu for you! ;)";;;;"1885746085";https://twitter.com/jonjtcclark/status/1885746085
n3cr0phelia;2009-05-22 19:17;0;0;"RT @CappyLust: If you receive an email from the Dept of Health telling you not to eat tinned pork because of swine flu , please ignore it...";;@CappyLust;;"1885741614";https://twitter.com/n3cr0phelia/status/1885741614
ICAV;2009-05-22 19:16;0;0;"A Guide to Swine Flu (from Scientific American): http://bit.ly/Fmu5H";;;;"1885739899";https://twitter.com/ICAV/status/1885739899
DharmaDuck;2009-05-22 19:16;0;0;"RT @LifeQuips : Re: bacon - If u receive an email warning u not 2 eat tinned pork due 2 Swine flu outbreak. Ignore, its just Spam.";;@LifeQuips;;"1885732779";https://twitter.com/DharmaDuck/status/1885732779
wzzm13;2009-05-22 19:16;0;0;"OF INTEREST: Son of NYC swine flu victim pitches no-hitter #fb : NEW YORK (AP) -- The son of a New Yo.. http://tinyurl.com/qn7d4f";;;#fb;"1885730901";https://twitter.com/wzzm13/status/1885730901
Boomerradioshow;2009-05-22 19:15;0;0;"Great news for Boomers - we seem to have some immunity to Swine Flu ! http://bit.ly/8DwmA Groovy!";;;;"1885722933";https://twitter.com/Boomerradioshow/status/1885722933
newsreporter2;2009-05-22 19:15;0;0;"Elder Q&A: Take proper precautions to avoid catching swine flu http://cli.gs/gzAre1 #linktweet";;;#linktweet;"1885722550";https://twitter.com/newsreporter2/status/1885722550
SwineFlu_news;2009-05-22 19:15;0;0;"AREALSI -- fwsi1- Quick question? How do ... http://t.love.com/216204429";;;;"1885720909";https://twitter.com/SwineFlu_news/status/1885720909
wopularall;2009-05-22 19:14;0;0;"WHO to consider severity of swine flu http://ff.im/-39Bdh";;;;"1885718094";https://twitter.com/wopularall/status/1885718094
swinefluh1n1;2009-05-22 19:14;0;0;""WHO rethinks criteria for Phase 6 pandemic flu" http://tinyurl.com/o6bd6s #swineflu #H1N1";;;#swineflu #H1N1;"1885713132";https://twitter.com/swinefluh1n1/status/1885713132
sirpopper;2009-05-22 19:14;0;0;"How Swine Flu Has Changed the Faces of the Earth http://tinyurl.com/ppgu3l";;;;"1885713130";https://twitter.com/sirpopper/status/1885713130
SwineFluNewsCA;2009-05-22 19:14;0;0;"Swine Flu News: Don't panic, prepare http://tinyurl.com/okbelu";;;;"1885712817";https://twitter.com/SwineFluNewsCA/status/1885712817
swineflucure_;2009-05-22 19:13;0;0;"New post: WHO to consider severity of 'sneaky' swine flu - The Associated Press (http://cli.gs/X1ZBvt)";;;;"1885706864";https://twitter.com/swineflucure_/status/1885706864
nikkei_com;2009-05-22 19:13;0;0;"Local Govts Allowed To Take Flexible Approaches To Swine Flu http://bit.ly/rXqCZ";;;;"1885701755";https://twitter.com/nikkei_com/status/1885701755
theaimcompanies;2009-05-22 19:12;0;0;"If the swine flu doesn't get you, the seasonal allergies might. http://bit.ly/fn9rC";;;;"1885697372";https://twitter.com/theaimcompanies/status/1885697372
__josh__;2009-05-22 19:12;0;0;"Japan Stocks Drop on Swine Flu Spread, Yen; Tokyo Marine Drops: Aeon Co., Japan's largest supermarket operat.. http://bit.ly/7qZCM";;;;"1885690261";https://twitter.com/__josh__/status/1885690261
fluhelpnet;2009-05-22 19:11;0;0;"Breaking Flu News - Swine flu : Virus could 'mutate' in southern hemisphere http://bit.ly/J4vtP";;;;"1885687058";https://twitter.com/fluhelpnet/status/1885687058
