username;date;retweets;favorites;text;geo;mentions;hashtags;id;permalink
CallMeAuburn;2009-05-05 22:02;0;2;"HAHA; "Its funny how 90 ppl get infected with Swine Flu and everyone wears a mask, but millions of ppl get AIDS and no one wears a condom".";;;;"1710508303";https://twitter.com/CallMeAuburn/status/1710508303
AmandaWrites;2009-05-05 22:02;0;0;"Swine flu confirmed in Havelock, Cherry Point http://tinyurl.com/dmgor9";;;;"1710508263";https://twitter.com/AmandaWrites/status/1710508263
onlyinapril;2009-05-05 22:02;0;0;"On the way to @altgeldshrugged 's book tour stop. No worries, fellow bookies, I don't have swine flu , but did have nasty meeting with a ...";;@altgeldshrugged;;"1710508126";https://twitter.com/onlyinapril/status/1710508126
Jorriss;2009-05-05 22:02;0;0;"RT @ionpalmettobay : RT @robliberal: US resident dies from swine flu http://tinyurl.com/cvhzlc";;@ionpalmettobay @robliberal;;"1710507830";https://twitter.com/Jorriss/status/1710507830
KenBurgin;2009-05-05 22:02;0;0;"Human nature? My newsletters on biz building & promo gets a lower open rate than editions on swine flu , staff problems, theft etc...";;;;"1710506343";https://twitter.com/KenBurgin/status/1710506343
tweetla;2009-05-05 22:02;0;0;"U.S. eases swine flu guidelines for schools; Mexico begins returning to normal http://tinyurl.com/dfame5";;;;"1710505850";https://twitter.com/tweetla/status/1710505850
mixxbreaking;2009-05-05 22:02;0;0;"CDC turns to Social Media in the fight against H1N1 aka the Swine Flu : The CDC have turned to Social Media in an.. http://tinyurl.com/cpbyzc";;;;"1710505554";https://twitter.com/mixxbreaking/status/1710505554
QuintinOnCamera;2009-05-05 22:02;0;0;"I am not listening to news about swine flu anymore, I'm watching Keeping up With the Kardashians on E!";;;;"1710505193";https://twitter.com/QuintinOnCamera/status/1710505193
Slightly_Random;2009-05-05 22:01;0;0;"BBC NEWS | World | Americas | US resident dies from swine flu http://ff.im/-2CcFn";;;;"1710504251";https://twitter.com/Slightly_Random/status/1710504251
zach2o;2009-05-05 22:01;0;0;"Eyewitness News channel 5 is in Ada 4 swine flu , I walked by them 20 times trying to get them to call me over for interview. no luck YET..";;;;"1710503472";https://twitter.com/zach2o/status/1710503472
Shazemeen;2009-05-05 22:01;0;0;"The three trending topics of the day are KFC, Oprah and Swine Flu . Did Oprah give up on pork in favour of chicken, just because of the flu?";;;;"1710503309";https://twitter.com/Shazemeen/status/1710503309
tellingtales;2009-05-05 22:01;0;0;"My swine flu survival kit includes digestive cookies/biscuits";;;;"1710503223";https://twitter.com/tellingtales/status/1710503223
sakisrizos;2009-05-05 22:01;0;0;"Business and the swine-flu outbreak | Assuming the worst | The Economist http://ow.ly/5i8s";;;;"1710503123";https://twitter.com/sakisrizos/status/1710503123
senorgarcia;2009-05-05 22:01;0;0;"RT @pennjillette : : They've changed the name " Swine flu " to "H1N1" to as not offend pigs. I wonder how that makes Lou Gehirg's family feel.";;@pennjillette;;"1710501886";https://twitter.com/senorgarcia/status/1710501886
HeraldTribune;2009-05-05 22:01;0;0;"Schools should not close for swine flu : CDC changes its recommendations. http://tinyurl.com/cw8f39";;;;"1710501816";https://twitter.com/HeraldTribune/status/1710501816
Sqrlmom;2009-05-05 22:01;0;0;"Dry mouth, headache, nervous stomach-not swine flu , 'just' Yankees vs Red Sox.";;;;"1710501506";https://twitter.com/Sqrlmom/status/1710501506
Anomaly100;2009-05-05 22:01;0;0;"http://bit.ly/TPNzA So, this is where the Swine flu comes from!!";;;;"1710501004";https://twitter.com/Anomaly100/status/1710501004
adriana_bonta;2009-05-05 22:01;0;0;"OMG! They brought out a swine flu game: http://www.swinefighter.com #swineflu #swinefighter";;;#swineflu #swinefighter;"1710500627";https://twitter.com/adriana_bonta/status/1710500627
syanide;2009-05-05 22:01;0;0;"New Health Website Traffic Rises with Swine Flu http://bit.ly/LKEk3";;;;"1710497767";https://twitter.com/syanide/status/1710497767
thumbfight;2009-05-05 22:01;0;0;"Swine Flu (1 thumb down) VS. Happy Cinco De Mayo (1 thumb down) - http://bit.ly/TVUXe";;;;"1710497380";https://twitter.com/thumbfight/status/1710497380
H1N1VirusNews;2009-05-05 22:00;0;0;"Have an opinion on the H1N1 outbreak? Leave us a voicemail. H1N1 Virus ( Swine Flu ) Hotline. http://preview.tinyurl.com/ch7658";;;;"1710495161";https://twitter.com/H1N1VirusNews/status/1710495161
drivelcast;2009-05-05 22:00;0;0;"Relaxing after another radio run-in. Topical yuks with the Swine Flu leaflet, Radio Guess The Number of Sweets In the Jar and aces tunes.";;;;"1710494733";https://twitter.com/drivelcast/status/1710494733
Alderalarms;2009-05-05 22:00;0;0;"Officials: Swine flu an enigmatic epidemic http://bit.ly/5HXSl";;;;"1710494412";https://twitter.com/Alderalarms/status/1710494412
lance_agena;2009-05-05 22:00;0;0;"RT @hsbpolitics: CDC confirms three cases of swine flu in HI: http://www.hsblinks.com/99";;@hsbpolitics;;"1710493357";https://twitter.com/lance_agena/status/1710493357
darildarildaril;2009-05-05 22:00;0;0;"like... id rather have swine flu than watch this... it's THAT BAD!";;;;"1710492884";https://twitter.com/darildarildaril/status/1710492884
mjbraide;2009-05-05 22:00;0;0;"Listening to radio piece on how swine flu is spreading and heard House Wine Flu is spreading. (Is that like a hangover?)";;;;"1710492587";https://twitter.com/mjbraide/status/1710492587
OhCasablanca;2009-05-05 22:00;0;0;"@RealBillBailey Should we brace ourselves for a new, virulent pandemic? One that completely dwarfs SWINE FLU ?";;@RealBillBailey;;"1710492477";https://twitter.com/OhCasablanca/status/1710492477
NoteRobot;2009-05-05 22:00;0;0;"(@pastachick) @maddow http://twitpic.com/4k51z - Note to self: what NOT to do when trying to prevent getting swine flu ... [love your sho ...";;@pastachick @maddow;;"1710492181";https://twitter.com/NoteRobot/status/1710492181
doctorambient;2009-05-05 22:00;0;0;"RT: @maddow ...chose new icon for swine flu : http://tinyurl.com/c8mjug";;@maddow;;"1710491857";https://twitter.com/doctorambient/status/1710491857
twellness;2009-05-05 22:00;0;1;"Johns Hopkins Medicine has launched a new H1N1 ( swine) flu Web site http://tinyurl.com/djly7z (via @HopkinsMedNews ) #swineflu #H1N1";;@HopkinsMedNews;#swineflu #H1N1;"1710491243";https://twitter.com/twellness/status/1710491243
fredyrosal;2009-05-05 22:00;0;0;"can you believe this chick? ' Swine Flu Is Super Trendy' - Starpulse Entertainment.: Katy Perry is hoping a new ring w.. http://bit.ly/lky1m";;;;"1710490423";https://twitter.com/fredyrosal/status/1710490423
vimalap;2009-05-05 22:00;0;0;"Swine flu , pirates, octamom... Forget the distractions what about the real issues?";;;;"1710490079";https://twitter.com/vimalap/status/1710490079
Fox35News;2009-05-05 22:00;0;0;"RT @caleramaker : Another night leading with swine flu - but it appears fears are easing a bit! Govt' backing o.. http://bit.ly/105rYb";;@caleramaker;;"1710490030";https://twitter.com/Fox35News/status/1710490030
latimeshealth;2009-05-05 22:00;0;0;"U.S. eases swine flu guidelines for schools; Mexico begins returning to normal: CDC officials say they no longer.. http://tr.im/kA71";;;;"1710489293";https://twitter.com/latimeshealth/status/1710489293
brittanylake;2009-05-05 22:00;0;0;"Thanks Blue line for having people disinfecting the trains throughout the day. Good to know I won't be getting swine flu or H1N1.";;;;"1710487647";https://twitter.com/brittanylake/status/1710487647
lordredrock;2009-05-05 22:00;0;0;"Officials: Swine flu an enigmatic epidemic: By FIONA COHEN With the swine flu epidemic changing every day, it&#3.. http://tinyurl.com/df7lov";;;#3;"1710487475";https://twitter.com/lordredrock/status/1710487475
SwineFlu_news;2009-05-05 22:00;0;0;"Veguita, Carlsbad schools to reopen http://t.love.com/210689729";;;;"1710487246";https://twitter.com/SwineFlu_news/status/1710487246
swineflu_news_;2009-05-05 22:00;0;0;"First U.S. face transplant recipient offers thanks: In 2004, a bullet ripped away Connie Culp's nose, apple chee.. http://tinyurl.com/d2y6ts";;;;"1710487147";https://twitter.com/swineflu_news_/status/1710487147
lordredrock;2009-05-05 22:00;0;0;"St. Francis Prep sports resume, must catch up after swine flu outbreak: BY Mark Lelinwalla The swine flu threw t.. http://tinyurl.com/c3bsk5";;;;"1710486390";https://twitter.com/lordredrock/status/1710486390
sarahbarnes;2009-05-05 21:59;0;0;"RT @thedailytexan : First possible swine flu case on campus? http://budurl.com/fxfd";;@thedailytexan;;"1710486276";https://twitter.com/sarahbarnes/status/1710486276
waltjones;2009-05-05 21:59;0;1;"Swine Flu less lethal than regular flu! « Eric & Tracy’s Baja Blog http://bit.ly/Zfmf4";;;;"1710486224";https://twitter.com/waltjones/status/1710486224
danielpaulrules;2009-05-05 21:59;0;0;"I'm laughing at the Swine Flu commercials from 1976. One person died from the flu, 25 from the shots administered...";;;;"1710485367";https://twitter.com/danielpaulrules/status/1710485367
alisonkrause;2009-05-05 21:59;0;0;"Dell's advice for staying swine flu free...really?! http://yfrog.com/0p6lzj";;;;"1710484904";https://twitter.com/alisonkrause/status/1710484904
NBauer;2009-05-05 21:59;0;0;"RT @coopervsvan: Cinco de Mayo gives me an idea: I should hop in the MINI and drive to the border. Windows up-wouldn't want to get swine flu";;@coopervsvan;;"1710484797";https://twitter.com/NBauer/status/1710484797
100acres;2009-05-05 21:59;0;0;"Reading the Swine Flu /Bird Flu Survival Guide. A great reference to own, just in case. Be prepared! http://bit.ly/reZnu";;;;"1710484526";https://twitter.com/100acres/status/1710484526
swineflu_news_;2009-05-05 21:59;0;0;"Swine flu could jump start new drugs: The rush to respond to the swine-flu outbreak could provide an opportunity.. http://tinyurl.com/c68y75";;;;"1710484377";https://twitter.com/swineflu_news_/status/1710484377
Proph;2009-05-05 21:59;0;0;"Joke: It's been said that there would be a Black President, when pigs fly! Well, just 100 days into Obama's presidency, Swine Flu ! LOL";;;;"1710483626";https://twitter.com/Proph/status/1710483626
prestonrudie;2009-05-05 21:59;0;0;"Freedom HS and 2 other Tampa schools closed because of the swine flu will re-open on Thur.";;;;"1710483536";https://twitter.com/prestonrudie/status/1710483536
jamesmcdone;2009-05-05 21:59;0;0;"CNN report: Kermit the frog has just died from the Swine Flu . His last words were "That f!#$king pig, she told me that she was clean.";;;#;"1710483503";https://twitter.com/jamesmcdone/status/1710483503
tanukisan;2009-05-05 21:59;0;0;"Swine flu status: Case suspected on campus. "Rap Chop" stuck in my head. I'm sure these two are related somehow. >.> #wereallgoingtodie";;;#wereallgoingtodie;"1710482908";https://twitter.com/tanukisan/status/1710482908
mr_nil;2009-05-05 21:59;0;0;"RT @jackkeenan : Eating frazzles is an effective form of immunisation against swine flu . Discuss // chuckles";;@jackkeenan;;"1710482113";https://twitter.com/mr_nil/status/1710482113
NationalReset;2009-05-05 21:59;0;0;"Back from travels.Chose to wash hands,dump mask to avoid negative fashion stmnt. Hope this wasn't stupid. #swineflu";;;#swineflu;"1710481942";https://twitter.com/NationalReset/status/1710481942
pipkay;2009-05-05 21:59;0;0;"Pc may or may not be dead. Suspect swine flu . Mac refusing to go online.";;;;"1710481284";https://twitter.com/pipkay/status/1710481284
EvaMarieAyala;2009-05-05 21:59;0;0;"ExtraCredit Will Fort Worth resume classes this week after swine flu closure?: We are awaiting the fi.. http://tinyurl.com/cnrxc5";;;;"1710480186";https://twitter.com/EvaMarieAyala/status/1710480186
thegamesmith;2009-05-05 21:59;0;0;"RT @maddow : -- chose new icon for swine flu : http://tinyurl.com/c8mjug OMG the best picture. And you wonder how this all started.";;@maddow;;"1710479987";https://twitter.com/thegamesmith/status/1710479987
Geoffruben;2009-05-05 21:59;0;0;"CDC: No need to close schools over swine flu http://usat.me/?34964732";;;;"1710479595";https://twitter.com/Geoffruben/status/1710479595
charliebudd;2009-05-05 21:58;0;0;"RT @greenmeme : Companies Look to Swine Flu to Drive Profits http://tinyurl.com/cdcgwq No surprise!";;@greenmeme;;"1710477814";https://twitter.com/charliebudd/status/1710477814
palmer_eldritch;2009-05-05 21:58;0;0;"'Oprah Buys All Swine Flu Victims A Hot Dog' #tabloidheadlinesfromthenearfuture";;;#tabloidheadlinesfromthenearfuture;"1710476043";https://twitter.com/palmer_eldritch/status/1710476043
MarshallRamsey;2009-05-05 21:58;0;0;"maybe the rampant, driving and horrid fear of swine flu has kept people away from the Jackson polls.";;;;"1710475292";https://twitter.com/MarshallRamsey/status/1710475292
MrsGoose;2009-05-05 21:58;0;0;"RT: @melbyforce :think: 90 people get swine flu and everyone is wearing masks. Millions of people have AIDS but no one wears condoms!";;@melbyforce;;"1710475072";https://twitter.com/MrsGoose/status/1710475072
PANCHO305;2009-05-05 21:58;0;0;"Sound check at escapade.. Tonights guna b bananas out here in htown.. Cinco de mayo swine flu party! Hahaha";;;;"1710473706";https://twitter.com/PANCHO305/status/1710473706
craft_spells;2009-05-05 21:58;0;0;"shut up about swine flu already";;;;"1710473288";https://twitter.com/craft_spells/status/1710473288
epaulnet;2009-05-05 21:58;0;0;"SFGT: US no longer advising schools close for swine flu http://tinyurl.com/dabya2";;;;"1710473019";https://twitter.com/epaulnet/status/1710473019
swineflu_news_;2009-05-05 21:58;0;0;"Influenza A(H1N1) - update 16: As of 16:00 GMT, 5 May 2009, 21 countries have officially reported 1490 cases of .. http://tinyurl.com/d6vfkq";;;;"1710471270";https://twitter.com/swineflu_news_/status/1710471270
DanHaugen;2009-05-05 21:57;0;0;"RT @garyschwitzer : Swine flu-HIV could devastate human race: worst story yet? http://tinyurl.com/dbw24h";;@garyschwitzer;;"1710469635";https://twitter.com/DanHaugen/status/1710469635
QueenMeliska;2009-05-05 21:57;0;0;"is taking Zeke to the doctor, we got our first ear infection! Luckily got an appt. w/ the doc... swine flu and all.";;;;"1710467220";https://twitter.com/QueenMeliska/status/1710467220
jenndontstop;2009-05-05 21:57;0;0;"can we talk about the fact that there is a #swineflu mapping widget for my dashboard? what is this world coming to?";;;#swineflu;"1710467088";https://twitter.com/jenndontstop/status/1710467088
HoodCountyNews;2009-05-05 21:57;0;0;"Nothing breaking on swine flu - Hood County emergency management coordinator Brian Fine said he didn't get the opportu... http://tr.im/kA6j";;;;"1710466751";https://twitter.com/HoodCountyNews/status/1710466751
TomLimongello;2009-05-05 21:57;0;0;"I'm doing chloraseptic shots. At least it's not swine flu ! http://robo.to/tlimongello";;;;"1710466363";https://twitter.com/TomLimongello/status/1710466363
scj;2009-05-05 21:57;0;0;"Latest News: 29 probable swine flu cases now in Iowa: DES MOINES, Iowa (AP) -- There are now 29 prob.. http://tinyurl.com/dggzxg";;;;"1710465929";https://twitter.com/scj/status/1710465929
Hnygirl2000;2009-05-05 21:57;0;0;"RT @KITV4 BREAKING NEWS: State health officials say the CDC confirmed three Hawaii patients did have the swine flu .";;@KITV4;;"1710464709";https://twitter.com/Hnygirl2000/status/1710464709
framott;2009-05-05 21:57;0;0;"just read a roal dahl book with quote "swine sickness" in it! wow they had swine flu back then 2!";;;;"1710464317";https://twitter.com/framott/status/1710464317
thesaraolive;2009-05-05 21:57;0;0;"Don't tell me... RT @jensmccabe if you're dying for a #swineflu iPhone app, u can almost stop holding your breath: http://tinyurl.com/deblh3";;@jensmccabe;#swineflu;"1710464079";https://twitter.com/thesaraolive/status/1710464079
AnneTurner;2009-05-05 21:57;0;0;"My son's friend seriously thinks the swine flu is a cult conspiracy to turn humans into cannibalistic zombies. Holy cow. (Holy pig?)";;;;"1710463876";https://twitter.com/AnneTurner/status/1710463876
DemFromCT;2009-05-05 21:57;0;0;"RT @BirdFluGov : RT @CDCemergency : Read updated guidance on school (K-12) dismissal and childcare facilities: http://bit.ly/9QDpN #swineflu";;@BirdFluGov @CDCemergency;#swineflu;"1710462734";https://twitter.com/DemFromCT/status/1710462734
BlackInformant;2009-05-05 21:57;0;0;"Nativism's Swine Flu Field Day - Huffington Post http://ow.ly/5iyK";;;;"1710461851";https://twitter.com/BlackInformant/status/1710461851
H1N1VirusNews;2009-05-05 21:56;0;0;"CDC: H1N1 Flu ( Swine Flu ) Public Service Announcements (PSAs) http://cli.gs/sUnJsE";;;;"1710460104";https://twitter.com/H1N1VirusNews/status/1710460104
bentruman;2009-05-05 21:56;0;0;"US woman doesn't die from Swine Flu ! She had all kinds of things wrong with her before hand.. dont let the media scare u! http://tr.im/kA5K";;;;"1710459945";https://twitter.com/bentruman/status/1710459945
Sassy_Leslie;2009-05-05 21:56;0;0;"The stupid swine flu has hit my older son's school causing its closure tomorrow. Good grief!";;;;"1710459785";https://twitter.com/Sassy_Leslie/status/1710459785
wfaaep;2009-05-05 21:56;0;0;"School starting to reopen because everyone's standing down on the Swine Flu . Channel 8 has the list right now.";;;;"1710459554";https://twitter.com/wfaaep/status/1710459554
SAReunited;2009-05-05 21:56;0;0;"with HIV and AIDS rife, South Africa scrambles to prevent outbreak of Swine Flu http://bit.ly/rkzNq";;;;"1710459084";https://twitter.com/SAReunited/status/1710459084
graf808;2009-05-05 21:56;0;0;"Islans swine flu update RT @KGMB9 : Cases confirmed as H1N1, more coming soon on KGMB9 and KGMB9.com";;@KGMB9;;"1710458541";https://twitter.com/graf808/status/1710458541
zimscoop;2009-05-05 21:56;0;0;"WHO: swine flu epidemic still spreading - eTaiwan News http://tinyurl.com/d7h6pb #zimbabwe";;;#zimbabwe;"1710457498";https://twitter.com/zimscoop/status/1710457498
ConventionSouth;2009-05-05 21:56;0;0;"Thinks the CIC has there message right about swine flu . Read it at http://www.conventionsouth.com/board.home.cfm";;;;"1710457268";https://twitter.com/ConventionSouth/status/1710457268
itsonly_1me;2009-05-05 21:56;0;0;"These ladies just ran across the street coughing bff said all hell Nooo that got that swine flu !";;;;"1710456457";https://twitter.com/itsonly_1me/status/1710456457
1510wlac;2009-05-05 21:56;0;0;"First American adult dies of swine flu . http://bit.ly/B5oIS. Is the worst really over?";;;;"1710455130";https://twitter.com/1510wlac/status/1710455130
MEMRIReports;2009-05-05 21:56;0;0;"Syrian Gov't Daily: Swine Flu May Be Product of U.S. Lab http://tinyurl.com/cewmkb";;;;"1710455102";https://twitter.com/MEMRIReports/status/1710455102
momwifewoman;2009-05-05 21:56;0;0;"Kermit the frog died today from swine flu . He was wating miss piggy.";;;;"1710455028";https://twitter.com/momwifewoman/status/1710455028
phytwits;2009-05-05 21:56;0;0;"Tiffany Irrera assesses Kearney's outlook after swine flu-related delays (New York Daily News) http://cli.gs/MAjDJN";;;;"1710455011";https://twitter.com/phytwits/status/1710455011
sylviaswann;2009-05-05 21:56;0;0;"Evidence says swineflu emerged from giant inhumane pig farms - go to http://tinyurl.com/dm8e8e and sign the petition!";;;;"1710453694";https://twitter.com/sylviaswann/status/1710453694
jackkeenan;2009-05-05 21:56;0;0;"Eating frazzles is an effective form of immunisation against swine flu . Discuss";;;;"1710453635";https://twitter.com/jackkeenan/status/1710453635
lmccreary;2009-05-05 21:56;0;0;"wondering how the swine flu is effecting the cinco de mayo celebration in mexico...";;;;"1710453254";https://twitter.com/lmccreary/status/1710453254
starpolitics;2009-05-05 21:55;0;0;"CDC confirms three cases of swine flu in HI: http://www.hsblinks.com/99";;;;"1710452603";https://twitter.com/starpolitics/status/1710452603
healthythinker;2009-05-05 21:55;0;1;"An iPhone app for swine flu is imminent - http://bit.ly/oPtu8";;;;"1710451899";https://twitter.com/healthythinker/status/1710451899
TxTechnoguru;2009-05-05 21:55;0;0;"RT @waltmac : North Texas schools start to reopen after Swine Flu scare. Plano schools re-open tomorrow. Lewisville re-opens Thurs. Threa ...";;@waltmac;;"1710451886";https://twitter.com/TxTechnoguru/status/1710451886
txjrich;2009-05-05 21:55;0;0;"RT @fwstayala: Fort Worth ISD admin and campus leaders return Wednesday. Teachers on Thursday. Students? No word yet. #swineflu";;@fwstayala;#swineflu;"1710451039";https://twitter.com/txjrich/status/1710451039
ubnews;2009-05-05 21:55;0;0;"Front Page: Swine flu confirmed in state: Federal health officials have confirmed probable swine flu ,.. http://tinyurl.com/cwvc3l";;;;"1710450863";https://twitter.com/ubnews/status/1710450863
jensmccabe;2009-05-05 21:55;0;0;"if you're dying for a #swineflu iPhone app, you can almost stop holding your breath: http://tinyurl.com/deblh3 (sorry, couldn't help it)";;;#swineflu;"1710449494";https://twitter.com/jensmccabe/status/1710449494
gazette_opinion;2009-05-05 21:55;0;0;"Live chat with Kanawha Health Officer Dr. Rahul Gupta on #swine flu Wednesday, May 6 at 9 a.m. http://wvgazette.com";;;#swine;"1710449204";https://twitter.com/gazette_opinion/status/1710449204
txjrich;2009-05-05 21:55;0;0;"RT @BonzerWolf : wfaachannel8: FULL STORY: Schools across NTX reopen; CDC says #swineflu mirrors "seasonal flu" http://bit.ly/FeeIg";;@BonzerWolf;#swineflu;"1710449167";https://twitter.com/txjrich/status/1710449167
blakefoster;2009-05-05 21:55;0;0;"What? Swine flu-like symptoms? What symptoms? Oh, like the regular flu? This is getting so annoying.";;;;"1710448877";https://twitter.com/blakefoster/status/1710448877
garytfka;2009-05-05 21:55;0;1;"chillin in Grand Rapids thinking of excuses to get the bums away from me. best excuse so far: get away from me. i have the swine flu .";;;;"1710447295";https://twitter.com/garytfka/status/1710447295
Jason_S_Smith;2009-05-05 21:55;0;0;"Does anyone know why swine flu is anymore dangerous. As far as I can tell, it is just like flu but used to be found in pigs.";;;;"1710446804";https://twitter.com/Jason_S_Smith/status/1710446804
matsalted;2009-05-05 21:55;0;0;"Imagine if instead of a Swine Flu pandemic there was a pandemic of Saturday Night Fever. (Caused not by H1N1 but BeeGees)";;;;"1710446759";https://twitter.com/matsalted/status/1710446759
HealthAndTravel;2009-05-05 21:55;0;0;"Check out the newest Swine Flu article by Michael Kirsch, MD @http://travelvaccineforum.wordpress.com/";;@http;;"1710446463";https://twitter.com/HealthAndTravel/status/1710446463
StarWic;2009-05-05 21:55;0;0;"Swine flu Protect yourself and family. Get your Flu mask http://ow.ly/4D7T";;;;"1710446382";https://twitter.com/StarWic/status/1710446382
health_tweets;2009-05-05 21:55;0;0;"Officials Confirm Second US Swine Flu Death - Washington Post National GeographicOfficials Confirm Second US Swine .. http://snipr.com/hfosz";;;;"1710446375";https://twitter.com/health_tweets/status/1710446375
banksuk;2009-05-05 21:55;0;0;"Swine Flu and Bio-terror:A note of caution http://ff.im/2CbXD";;;;"1710445813";https://twitter.com/banksuk/status/1710445813
ecorrado;2009-05-05 21:55;0;0;"RT @HelloKiKi : How the hell did KFC top Oprah and Swine Flu on Trending Topics?";;@HelloKiKi;;"1710445546";https://twitter.com/ecorrado/status/1710445546
swinefluh1n1;2009-05-05 21:55;0;0;""Dark cloud, silver lining for H1N1 | Mac's Safety Space" http://tinyurl.com/ce4lbh #swineflu #H1N1";;;#swineflu #H1N1;"1710445390";https://twitter.com/swinefluh1n1/status/1710445390
swinefluh1n1;2009-05-05 21:55;0;0;""NH Confirms 2nd Case Of H1N1 - Health News Story - WMUR Manchester" http://tinyurl.com/c4ppfu #swineflu #H1N1";;;#swineflu #H1N1;"1710445070";https://twitter.com/swinefluh1n1/status/1710445070
SpokaneTracker;2009-05-05 21:55;0;0;"RT @chelsea_24 : Nine confirmed cases of Swine Flu in Washington State. Seven in King County, 1 in Snohomish County,";;@chelsea_24;;"1710444700";https://twitter.com/SpokaneTracker/status/1710444700
swinefluh1n1;2009-05-05 21:55;0;0;""12 new H1N1 cases confirmed in Indiana" http://tinyurl.com/cp6cbd #swineflu #H1N1";;;#swineflu #H1N1;"1710444686";https://twitter.com/swinefluh1n1/status/1710444686
pablonob;2009-05-05 21:55;0;0;"Hi KFC, Oprah is turning the Swine Flu in a Happy Cinco de Mayo and the H1N1 is the Arsenal. TINK cause Star Trek is coming to Big Apple";;;;"1710444679";https://twitter.com/pablonob/status/1710444679
kbranch;2009-05-05 21:55;0;0;"Squeezing in some hair metal cover band rehearsal before the Cinco de Swine Flu tweetup at Cedar Creek tonight!";;;;"1710444590";https://twitter.com/kbranch/status/1710444590
slightfoot62;2009-05-05 21:54;0;0;"Sitting home with a head ache and stomach ache! Not the Swine Flu or the Bird Flu or what ever...just not at the top of my game!";;;;"1710441902";https://twitter.com/slightfoot62/status/1710441902
Rubleaux;2009-05-05 21:54;0;0;"I would be a million bucks that I have swine flu and I mean that seriously. I knew that I would get sick after going to the grocery store.";;;;"1710440938";https://twitter.com/Rubleaux/status/1710440938
smfanboost;2009-05-05 21:54;0;0;"Forget kfc, oprah, swine flu This has to be this summers t-shirt fashion everyone wants one so order now :o) http://tiny.cc/tshirt331";;;;"1710440680";https://twitter.com/smfanboost/status/1710440680
TheAmyTucker;2009-05-05 21:54;0;0;"RT: @lovelycindy77 Happy Cinco de Mayo! Does tequila kill the swine flu virus?";;@lovelycindy77;;"1710440354";https://twitter.com/TheAmyTucker/status/1710440354
deepbluesealove;2009-05-05 21:54;0;0;"TX confirms first Swine Flu Death #swineflu : http://tinyurl.com/cvhc25";;;#swineflu;"1710440291";https://twitter.com/deepbluesealove/status/1710440291
mitdasein;2009-05-05 21:54;0;0;"All the swine flu coverage makes my inner Dale Gribble wonder what real news THEY don't want us to know about.";;;;"1710439961";https://twitter.com/mitdasein/status/1710439961
