username;date;retweets;favorites;text;geo;mentions;hashtags;id;permalink
gesuenderleben;2009-06-30 15:46;0;0;"Health News: Air Traffic Patterns Predict Swine Flu Spread: H1N1 case rates associated with number o.. http://bit.ly/19rgfa";;;;"2405177854";https://twitter.com/gesuenderleben/status/2405177854
philadelephia;2009-06-30 15:46;0;0;"hating the whole hayfever thing.. forget swine flu , its the hay you've really gotta watch for.. sneaky hay.";;;;"2405176535";https://twitter.com/philadelephia/status/2405176535
SwineFluNewsCA;2009-06-30 15:46;0;0;"Pandemic!Hini Swine Flu Has Infected 1,000,000 Americans, and Spread to at Least 105 Nations http://tinyurl.com/l3pglo";;;;"2405172057";https://twitter.com/SwineFluNewsCA/status/2405172057
H1N1VirusNews;2009-06-30 15:45;0;0;"Air Traffic Patterns Predict <b> Swine Flu </b> Spread - Drugs.com MedNews http://cli.gs/gQaab";;;;"2405170232";https://twitter.com/H1N1VirusNews/status/2405170232
H1N1VirusNews;2009-06-30 15:45;0;0;"<b> Swine Flu </b> Evolves. New Drug-Resistant Strain Discovered | Trends <b>...</b> http://cli.gs/LAERX";;;;"2405169736";https://twitter.com/H1N1VirusNews/status/2405169736
rickerbh;2009-06-30 15:45;0;0;"http://news.bbc.co.uk/1/hi/health/8125191.stm - people are having " swine flu parties" ?!?!";;;;"2405169465";https://twitter.com/rickerbh/status/2405169465
swineflu_news_;2009-06-30 15:45;0;0;"Study in mice sheds light on Ambien side effects: CHICAGO (Reuters) - A new study in mice may help explain some .. http://tinyurl.com/mylwgz";;;;"2405168743";https://twitter.com/swineflu_news_/status/2405168743
swineflu_news_;2009-06-30 15:45;0;0;"Drug cos at odds with FDA over acetaminophen risk: ADELPHI, Maryland (Reuters) - Johnson & Johnson, Procter .. http://tinyurl.com/l6qsq3";;;;"2405168148";https://twitter.com/swineflu_news_/status/2405168148
Joan_W;2009-06-30 15:45;0;1;"Debating the Wisdom of ‘ Swine Flu Parties’: http://digg.com/d1vHtQ?t (thanks @Madbello ).";;@Madbello;;"2405165333";https://twitter.com/Joan_W/status/2405165333
lordredrock;2009-06-30 15:45;0;0;"Middlesex County doctor treating swine flu with Tamiflu: When I go back to tell the parent the diagnosis, I brac.. http://tinyurl.com/new58s";;;;"2405162556";https://twitter.com/lordredrock/status/2405162556
kazitoshi;2009-06-30 15:45;0;0;"dammit the flu got to jens too? RT @pitchforkmedia : Jens Lekman contracts the H1N1 virus-- aka swine flu http://bit.ly/wEW7n";;@pitchforkmedia;;"2405162178";https://twitter.com/kazitoshi/status/2405162178
lordredrock;2009-06-30 15:45;0;0;"Former US health official from Marin dies of swine flu : By Richard Halstead, Bay Area News Group The recent deat.. http://tinyurl.com/nv3mt2";;;;"2405161200";https://twitter.com/lordredrock/status/2405161200
bystephwu;2009-06-30 15:45;0;0;"WTF news of the day: Parents holding swine flu parties so their kids get the virus (+ immunity) while it's still mild. http://bit.ly/3AJGw7";;;;"2405158679";https://twitter.com/bystephwu/status/2405158679
k1prd;2009-06-30 15:45;0;0;""Doctors warn against ' swine flu parties'" http://bit.ly/14SIVX - yeh, and I'll bring the 'tam-tinis', gin martini infused with tamiflu ;)";;;;"2405157838";https://twitter.com/k1prd/status/2405157838
jeffreywaynbush;2009-06-30 15:45;0;0;"Back from radio station. Many sick in city from swine flu & many scared - gov has announced early winter vacations b/c of so many problems";;;;"2405156108";https://twitter.com/jeffreywaynbush/status/2405156108
kayfro;2009-06-30 15:44;0;0;"Head killing me. Body aches. Throat hurts. Swine flu baby!";;;;"2405154876";https://twitter.com/kayfro/status/2405154876
lordredrock;2009-06-30 15:44;0;0;"New Jersey reports 6th swine flu death: ... Sussex County boy and a 49-year-old northern New Jersey man. There a.. http://tinyurl.com/kobfua";;;;"2405154627";https://twitter.com/lordredrock/status/2405154627
jtisonline;2009-06-30 15:44;0;0;"Girl, 9, dies of swine flu as UK cases jump: "The child has since tested positive for swine flu but had oth.. http://bit.ly/13oxNF";;;;"2405145681";https://twitter.com/jtisonline/status/2405145681
thestarcom;2009-06-30 15:43;0;0;"Danes find drug-resistant swine flu strain- For the first time, one isolated case of swine flu has proven resistant... http://bit.ly/aLS1s";;;;"2405135308";https://twitter.com/thestarcom/status/2405135308
mplds;2009-06-30 15:43;0;0;"Swine flu scare getting ridiculous - surgical masks on hand, temperature taken at work, cancelling meetings, 3 colleagues quarantined.";;;;"2405132357";https://twitter.com/mplds/status/2405132357
dirtycash;2009-06-30 15:43;0;0;"RT @TLOBF Jens Lekman catches nasty Swine Flu virus:. http://bit.ly/5A64q5 Hope you get well soon";;@TLOBF;;"2405128586";https://twitter.com/dirtycash/status/2405128586
dynamofire;2009-06-30 15:42;0;0;"NOOOOO! RT @bradleysalmanac Oh man, Jens Lekman got H1N1 (aka Swine Flu ) while touring South America. http://bit.ly/3eGw6B";;@bradleysalmanac;;"2405115882";https://twitter.com/dynamofire/status/2405115882
DudAvocado;2009-06-30 15:41;0;0;"Jens Lekman has Swine Flu ! (also title of next album) http://bit.ly/3eGw6B";;;;"2405114786";https://twitter.com/DudAvocado/status/2405114786
lenrichardson;2009-06-30 15:41;0;0;"New Jersey reports 6th swine flu death http://tinyurl.com/kobfua";;;;"2405112602";https://twitter.com/lenrichardson/status/2405112602
lairdthomas;2009-06-30 15:41;0;0;"EPIC RT: @pitchforkmedia : Jens Lekman contracts the H1N1 virus-- aka swine flu http://bit.ly/wEW7n";;@pitchforkmedia;;"2405110844";https://twitter.com/lairdthomas/status/2405110844
SwineFluNewsPH;2009-06-30 15:41;0;0;"Swine Flu In Brunei Breaks The 30-Case Barrier http://tinyurl.com/l6jqjj";;;;"2405105854";https://twitter.com/SwineFluNewsPH/status/2405105854
wisecrunch;2009-06-30 15:41;0;0;"Reduce the risk of getting a Swine Flu by 98%. Read about it here guys http://tinyurl.com/l3bf97";;;;"2405103778";https://twitter.com/wisecrunch/status/2405103778
NickEdwardEvans;2009-06-30 15:40;0;0;"Jens Lekman has SWINE FLU ! OMG! Why, world, art thou so cruel? http://bit.ly/3eGw6B";;;;"2405100267";https://twitter.com/NickEdwardEvans/status/2405100267
JasonMorse;2009-06-30 15:40;0;0;"Swine flu parties? http://tinyurl.com/lopv36 It's just like that South Park episode. "Hey kids, go play ookie mouth."";;;;"2405096698";https://twitter.com/JasonMorse/status/2405096698
odwyerpr;2009-06-30 15:40;0;0;"How one PR firm helped Mexico resort client deal with swine flu and border wars crisis (blog): http://snurl.com/l6l92";;;;"2405096180";https://twitter.com/odwyerpr/status/2405096180
kylehale;2009-06-30 15:40;0;0;"Say it ain't so Jens! Jens Lekman contracts swine flu : http://bit.ly/3eGw6B #swine flu";;;#swine;"2405088202";https://twitter.com/kylehale/status/2405088202
juliettina;2009-06-30 15:39;0;0;"http://www.cnn.com/2009/HEALTH/06/30/flu.party/ swine flu parties?! man, people are dumb. faith in the world: -1.";;;;"2405084882";https://twitter.com/juliettina/status/2405084882
amj7;2009-06-30 15:39;0;0;"RT @AndreaSantiago The difference between BIRD flu and SWINE flu ? To cure bird flu, you need tweetment, and for SWINE flu you need oinkment.";;@AndreaSantiago;;"2405084527";https://twitter.com/amj7/status/2405084527
kenwong;2009-06-30 15:38;0;0;"Swine flu parties a bad idea http://pop.ly/294i // via popurls.com";;;;"2405074068";https://twitter.com/kenwong/status/2405074068
lbjay;2009-06-30 15:38;0;0;"Oh noes! RT @bradleysalmanac : Oh man, Jens Lekman got H1N1 (aka Swine Flu ) while touring South America. http://bit.ly/3eGw6B";;@bradleysalmanac;;"2405067719";https://twitter.com/lbjay/status/2405067719
nanosounds;2009-06-30 15:38;0;0;"According to the swine flu website, I don't have swine flu . You can stop yelling at me now, @ultrabrilliant";;@ultrabrilliant;;"2405062157";https://twitter.com/nanosounds/status/2405062157
Interdome;2009-06-30 15:37;0;0;"#swineflu death rate now at 0.45% in the US - (via @CDCemergency ). Consumer confidence index is down. Have a good morning!";;@CDCemergency;#swineflu;"2405060181";https://twitter.com/Interdome/status/2405060181
kathipeters;2009-06-30 15:37;0;0;"Girl, 9, dies of swine flu as UK cases jump http://bit.ly/13NPtY";;;;"2405060105";https://twitter.com/kathipeters/status/2405060105
DaniNierenberg;2009-06-30 15:37;0;0;"RT @R71R71 NIH study traces the 1918 Flu Pandemic to current Swine Flu . Good news, it's getting less virulent http://bit.ly/dZBSh";;@R71R71;;"2405059562";https://twitter.com/DaniNierenberg/status/2405059562
wisree;2009-06-30 15:37;0;0;"Wimbledon 2009: top players on swine flu alert http://bit.ly/4DRRJ";;;;"2405057067";https://twitter.com/wisree/status/2405057067
drfredda;2009-06-30 15:37;0;0;"Doctors warn against ' swine flu parties' http://tinyurl.com/kqlshu";;;;"2405056379";https://twitter.com/drfredda/status/2405056379
mutgoff;2009-06-30 15:37;0;0;"Who would have thunk it? Swine flu parties are a bad idea? No way! http://www.cnn.com/2009/HEALTH/06/30/flu.party/";;;;"2405053497";https://twitter.com/mutgoff/status/2405053497
3imaginarygirls;2009-06-30 15:36;0;0;"RT @pitchforkmedia : Jens Lekman contracts the H1N1 virus -- aka swine flu http://bit.ly/wEW7n (via @ashcakes ) {Oh the swine flu Jens!}";;@pitchforkmedia @ashcakes;;"2405046156";https://twitter.com/3imaginarygirls/status/2405046156
karencunha;2009-06-30 15:36;0;0;"RT @randyhate why did you give jens lekman the swine flu http://bit.ly/wEW7n. you are so not a nice person....";;@randyhate;;"2405045829";https://twitter.com/karencunha/status/2405045829
bestfitmusic;2009-06-30 15:36;0;0;"[NEWS] Jens Lekman catches nasty Swine Flu virus: Mr Lekman has contracted the nasty " swine flu " virus. He.. http://bit.ly/5A64q";;;;"2405042608";https://twitter.com/bestfitmusic/status/2405042608
jgarrow;2009-06-30 15:36;0;0;"RT @SLVHealthDept : Working on #H1N1 #swineflu prep for the fall. Are there any details you thought lacking from our response?";;@SLVHealthDept;#H1N1 #swineflu;"2405040397";https://twitter.com/jgarrow/status/2405040397
freezingrss;2009-06-30 15:36;0;0;"digg: Swine flu parties ‘a bad idea’: FTA: "Throwing " swine flu parties" in an attempt to get immunity agai.. http://tinyurl.com/os373d";;;;"2405033633";https://twitter.com/freezingrss/status/2405033633
wardmark;2009-06-30 15:35;0;0;"Let's party like it's the Swine Flu ! http://bit.ly/p426N";;;;"2405030213";https://twitter.com/wardmark/status/2405030213
VemmaNutrition;2009-06-30 15:35;0;0;"Vemma Nutrition Air Traffic Patterns Predict Swine Flu Spread: Countries that received the most a.. http://tinyurl.com/kwnq45";;;;"2405029679";https://twitter.com/VemmaNutrition/status/2405029679
SwineFluNewsEU;2009-06-30 15:35;0;0;"9-year-old lady dies from swine flu in UK http://tinyurl.com/lh856t";;;;"2405028167";https://twitter.com/SwineFluNewsEU/status/2405028167
In_Details_DIY;2009-06-30 15:34;0;0;"Air Traffic Patterns Predict Swine Flu Spread: Countries that received the most airline passengers from Mexico t.. http://bit.ly/w6VxR";;;;"2405016918";https://twitter.com/In_Details_DIY/status/2405016918
M24digital_en;2009-06-30 15:34;0;0;"Santa Fe: All schools closed in the province due to Swine flu http://bit.ly/cYYoM";;;;"2405015825";https://twitter.com/M24digital_en/status/2405015825
finkm;2009-06-30 15:34;0;0;"Have your July 4th party. But please reconsider throwing that swine flu soiree; http://www.cnn.com/2009/HEALTH/06/30/flu.party/index.html.";;;;"2405015689";https://twitter.com/finkm/status/2405015689
suzara;2009-06-30 15:34;0;0;"People throwing swine flu parties? "I don't think it is a good idea" is an understatement http://tinyurl.com/nnglcf";;;;"2405010830";https://twitter.com/suzara/status/2405010830
lesjenkins;2009-06-30 15:34;0;1;"RT @brentrasmussen : Swine Flu parties "not a good idea", warn health experts. Uh, duh. http://is.gd/1jdw5 #swineflu";;@brentrasmussen;#swineflu;"2405007416";https://twitter.com/lesjenkins/status/2405007416
SwineFluNewsORG;2009-06-30 15:33;0;0;"Health officials endorse swine flu ..... http://tinyurl.com/m5wr9f";;;;"2404998832";https://twitter.com/SwineFluNewsORG/status/2404998832
R71;2009-06-30 15:33;0;1;"Interesting new NIH study that traces the 1918 Flu Pandemic to current Swine Flu . Good news, it's getting less virulent http://bit.ly/dZBSh";;;;"2404998153";https://twitter.com/R71/status/2404998153
Y_Atide;2009-06-30 15:33;0;0;"Pupil swine flu case shuts school - A Stoke-on-Trent primary school is closed for seven days after a pupil is diagn... http://ow.ly/15Gv8N";;;;"2404995950";https://twitter.com/Y_Atide/status/2404995950
swineflu_news_;2009-06-30 15:33;0;0;"Former US health official from Marin dies of swine flu : By Richard Halstead, Bay Area News Group The recent deat.. http://bit.ly/gkkpt";;;;"2404991913";https://twitter.com/swineflu_news_/status/2404991913
swineflu_news_;2009-06-30 15:32;0;0;"Swine flu case at ORAU: Of that number, one person has received a positive diagnosis of H1N1 flu, also known as .. http://bit.ly/jZLWJ";;;;"2404990040";https://twitter.com/swineflu_news_/status/2404990040
swineflu_news_;2009-06-30 15:32;0;0;"New Jersey reports 6th swine flu death: ... Sussex County boy and a 49-year-old northern New Jersey man. There a.. http://bit.ly/TRMsM";;;;"2404989366";https://twitter.com/swineflu_news_/status/2404989366
lfalkenburg;2009-06-30 15:32;0;0;"Es ist statistish wahrscheinlicher bei der Fahrt zum Arzt zu sterben als an der #schweinegrippe an sich!! #panikmache #swineflu #h1n1";;;#schweinegrippe #panikmache #swineflu #h1n1;"2404987403";https://twitter.com/lfalkenburg/status/2404987403
greenparenting;2009-06-30 15:32;0;0;"RT @amomsblog doctors warn against swine flu parites http://bit.ly/p426N";;@amomsblog;;"2404985097";https://twitter.com/greenparenting/status/2404985097
thedaysbetween;2009-06-30 15:32;0;0;"RT @katyhersh Poor Jens Lekman has H1N1! @pitchfork http://tiny.cc/UqaW1 I <3 you Jens, with or without Swine Flu";;@katyhersh @pitchfork;;"2404981418";https://twitter.com/thedaysbetween/status/2404981418
Fla_Medic;2009-06-30 15:32;0;0;"Blogging `Referral: Scott McPherson’s `The Worst Is Yet To Come’' #swineflu #H1n1 @scottmcpherson http://tinyurl.com/m36o6h";;@scottmcpherson;#swineflu #H1n1;"2404980591";https://twitter.com/Fla_Medic/status/2404980591
seth526;2009-06-30 15:32;0;0;"Pitchfork: Jens Lekman Contracts Swine Flu [ pitchfork.com ] [shared by 8 people] (Social.. http://bit.ly/12H9yK";;;;"2404980579";https://twitter.com/seth526/status/2404980579
healthy_tweets;2009-06-30 15:32;0;0;"BBC health news - Swine flu girl 'had tough life': An ill six-year-old girl who died in Birming.. http://bit.ly/BgIsE";;;;"2404976779";https://twitter.com/healthy_tweets/status/2404976779
AllDayNews;2009-06-30 15:31;0;0;"Doctors warn against ' swine flu parties'- Health experts are warning parents against holding " swine flu parties" in... http://bit.ly/QhBLz";;;;"2404972565";https://twitter.com/AllDayNews/status/2404972565
AmandaChanguris;2009-06-30 15:31;0;0;"RT @tstitt : Swine flu parties-a bad idea. http://bit.ly/llF96 <who comes up with these ideas?> [Crazy parents?]";;@tstitt;;"2404964748";https://twitter.com/AmandaChanguris/status/2404964748
CameroonTV;2009-06-30 15:31;0;0;"Uganda: Swine Flu Suspect Intercepted At Entebbe Airport - A woman who arrived today at Entebbe airport has been ru... http://ow.ly/15Gv6j";;;;"2404964152";https://twitter.com/CameroonTV/status/2404964152
SWINE_FLU_VRUS;2009-06-30 15:31;0;0;"Swine Flu Spread Mirrors Air Travel http://bit.ly/YGQsL";;;;"2404963203";https://twitter.com/SWINE_FLU_VRUS/status/2404963203
H1N1VirusNews;2009-06-30 15:30;0;0;"City's eight new swine flu cases (BBC News) http://cli.gs/s1TGn";;;;"2404958265";https://twitter.com/H1N1VirusNews/status/2404958265
joestracci;2009-06-30 15:30;0;0;"New post up-- Swine Flu Parties! Why didn't I think of that? Check it: http://joestracci.com";;;;"2404957960";https://twitter.com/joestracci/status/2404957960
H1N1VirusNews;2009-06-30 15:30;0;0;"Pupil swine flu case shuts school (BBC News) http://cli.gs/XeZT9";;;;"2404957824";https://twitter.com/H1N1VirusNews/status/2404957824
swineflupdates;2009-06-30 15:30;0;0;"U.S. urged to compare Alzheimer, ADD, other therapies (Reuters) Swine Flu Updates! http://tinyurl.com/mars2l";;;;"2404948967";https://twitter.com/swineflupdates/status/2404948967
SWINE_FLU_VRUS;2009-06-30 15:29;0;0;"Two more Phila. deaths from swine flu confirmed (source: The Philadelphia Inquirer) http://bit.ly/aGLTM";;;;"2404946865";https://twitter.com/SWINE_FLU_VRUS/status/2404946865
SWINE_FLU_VRUS;2009-06-30 15:29;0;0;"Doctors warn against ' swine flu parties' (source: CNN) http://bit.ly/luqLh";;;;"2404941179";https://twitter.com/SWINE_FLU_VRUS/status/2404941179
DarlingNicky999;2009-06-30 15:29;0;0;"Just read that ppl are throwing " swine flu parties". What happened to good old pill popping and glue sniffing? SMH. World is changing.";;;;"2404939794";https://twitter.com/DarlingNicky999/status/2404939794
swinflunews;2009-06-30 15:29;0;0;"FLYING PIG FLU? Swine flu made in USA-Suspicions Over Origin of Virus http://ff.im/-4CKTC";;;;"2404938480";https://twitter.com/swinflunews/status/2404938480
brentrasmussen;2009-06-30 15:29;0;0;"Swine Flu parties "not a good idea", warn health experts. Uh, duh. http://is.gd/1jdw5 #swineflu";;;#swineflu;"2404937789";https://twitter.com/brentrasmussen/status/2404937789
SwineFluNewsNZ;2009-06-30 15:28;0;0;"Person vicious with swine flu in Hawke's Bay http://tinyurl.com/nhj57f";;;;"2404927041";https://twitter.com/SwineFluNewsNZ/status/2404927041
SyDyMo;2009-06-30 15:27;0;0;"shocked that borough is thriving w/ Swine Flu .Can't wait 2get out of London next week.The worst part is that they wouldn't close the schools";;;;"2404919985";https://twitter.com/SyDyMo/status/2404919985
HealthSociety;2009-06-30 15:27;0;0;"CBC.caDoctors warn against 'swine flu parties'CNNLONDON, England (CNN) -- Health experts are warning par.. http://bit.ly/e6c8H";;;;"2404917383";https://twitter.com/HealthSociety/status/2404917383
ireddit;2009-06-30 15:27;0;1;"Swine flu parties ‘a bad idea’ http://bit.ly/195Cp2";;;;"2404916687";https://twitter.com/ireddit/status/2404916687
musosguide;2009-06-30 15:27;0;0;"Hoping Jens Lekman makes a speedy recovery from swine flu , as reported by @pitchforkmedia .";;@pitchforkmedia;;"2404914955";https://twitter.com/musosguide/status/2404914955
bradleysalmanac;2009-06-30 15:27;0;0;"Oh man, Jens Lekman got H1N1 (aka Swine Flu ) while touring South America. http://bit.ly/3eGw6B";;;;"2404912628";https://twitter.com/bradleysalmanac/status/2404912628
jenlong;2009-06-30 15:26;0;0;"RT @pitchforkmedia Jens Lekman contracts the H1N1 virus-- aka swine flu http://bit.ly/wEW7n - Crap. We're all doomed :(";;@pitchforkmedia;;"2404894945";https://twitter.com/jenlong/status/2404894945
Bianca_t;2009-06-30 15:25;0;0;"Im annoyed that my old school has closed due to swine flu , meaning that my leavers prom is now cancelled.....brilliant";;;;"2404891568";https://twitter.com/Bianca_t/status/2404891568
KPUA;2009-06-30 15:25;0;0;"Swine flu hits Molokai firefighters http://www.kpua.net/news.php?id=18285";;;;"2404891304";https://twitter.com/KPUA/status/2404891304
KPUA;2009-06-30 15:25;0;0;"Hawaii reports first swine flu death http://www.kpua.net/news.php?id=18284";;;;"2404887582";https://twitter.com/KPUA/status/2404887582
SwineFluNewsHK;2009-06-30 15:25;0;0;"Number of swine flu cases swells to 18 http://tinyurl.com/mu9p7p";;;;"2404885952";https://twitter.com/SwineFluNewsHK/status/2404885952
amomsblog;2009-06-30 15:25;0;0;"doctors warn against swine flu parites http://bit.ly/p426N";;;;"2404885142";https://twitter.com/amomsblog/status/2404885142
briantopping;2009-06-30 15:24;0;0;"Sounds like a good idea to me... Doctors warn against ' swine flu parties' http://www.cnn.com/2009/HEALTH/06/30/flu.party/";;;;"2404876792";https://twitter.com/briantopping/status/2404876792
PoconoRecord;2009-06-30 15:24;0;0;"News: New Jersey reports 6th swine flu death http://tinyurl.com/nwrjmj";;;;"2404874748";https://twitter.com/PoconoRecord/status/2404874748
Swine_Virus;2009-06-30 15:24;0;0;"Swine flu case at ORAU - Knoxville News Sentinel http://bit.ly/2OeMr";;;;"2404871614";https://twitter.com/Swine_Virus/status/2404871614
beware;2009-06-30 15:23;0;0;"RT: @pitchforkmedia : Jens Lekman contracts the H1N1 virus-- aka swine flu http://bit.ly/wEW7n";;@pitchforkmedia;;"2404864628";https://twitter.com/beware/status/2404864628
SociaTropin;2009-06-30 15:23;0;1;"Air Traffic Patterns Predict Swine Flu Spread http://bit.ly/GIpk9";;;;"2404862325";https://twitter.com/SociaTropin/status/2404862325
HEALTH____;2009-06-30 15:23;0;0;"Indonesia asking people arriving from swine flu-affected countries to wear face masks for 3 days http://twurl.nl/h74zh5 (via @SusanneUre )";;@SusanneUre;;"2404859836";https://twitter.com/HEALTH____/status/2404859836
dwonderly;2009-06-30 15:23;0;0;"http://tinyurl.com/nnglcf Swine Flu parties? What will the English come up with next??? @anamariecox Thought you could use the laugh. #H1N1";;@anamariecox;#H1N1;"2404856466";https://twitter.com/dwonderly/status/2404856466
BirdFluGov;2009-06-30 15:23;0;0;"Check out FDA's redesigned H1N1 flu page http://tr.im/qk1g #h1n1 #swineflu";;;#h1n1 #swineflu;"2404854670";https://twitter.com/BirdFluGov/status/2404854670
MonavieBusiness;2009-06-30 15:23;0;0;"MonavieBusiness Doctors warn against ' swine flu parties': Health experts are warning parents agai.. http://bit.ly/hJTfh";;;;"2404854191";https://twitter.com/MonavieBusiness/status/2404854191
SwineFluUpdate;2009-06-30 15:22;0;0;"Swine Flu New Case of Swine Flu Resistant to Key Drug - Voice of America: GulfNewsNew Case of Swine Flu .. http://tinyurl.com/l7vkn8";;;;"2404851052";https://twitter.com/SwineFluUpdate/status/2404851052
LivingSafely;2009-06-30 15:22;0;0;"UK/London: Britain reports 6,538 total Swine Flu cases. London has 1,673 known patients; West Midlands 2,308; Scotland 1,118. Three deaths.";;;;"2404849619";https://twitter.com/LivingSafely/status/2404849619
SwineFluNewsORG;2009-06-30 15:22;0;0;"Bergen Co. Woman Dies from Swine Flu ; 6th NJ Death http://tinyurl.com/myz8aj";;;;"2404839222";https://twitter.com/SwineFluNewsORG/status/2404839222
SwineFluNewsIE;2009-06-30 15:22;0;1;"Four round boys sent home from Wimbledon in swine flu scare http://tinyurl.com/nxprya";;;;"2404838650";https://twitter.com/SwineFluNewsIE/status/2404838650
thedunnething;2009-06-30 15:21;0;0;"Swine Flu Parties - a new low for survival instinct anitsocialism - BBC http://bit.ly/U0yt7 - NYT http://bit.ly/17YiYT #swine flu";;;#swine;"2404836140";https://twitter.com/thedunnething/status/2404836140
OrderMonavieAct;2009-06-30 15:21;0;0;"Order Monavie Act Swine flu parties ‘a bad idea’: FTA: "Throwing " swine flu parties" in an atte.. http://bit.ly/HoKvA";;;;"2404832055";https://twitter.com/OrderMonavieAct/status/2404832055
yatinsactivity;2009-06-30 15:21;0;0;"#Digg : Swine flu parties ‘a bad idea’: FTA: "Throwing " swine flu parties" in an attempt to get immunity .. http://digg.com/u175NM";;;#Digg;"2404831177";https://twitter.com/yatinsactivity/status/2404831177
sweetoblivion26;2009-06-30 15:21;0;0;"crikey! RT @ihwright jens lekman has swine flu . that's unfortunate http://bit.ly/wEW7n";;@ihwright;;"2404831034";https://twitter.com/sweetoblivion26/status/2404831034
SwineFluNewsSG;2009-06-30 15:21;0;0;"Thailand reports initial dual swine flu deaths http://tinyurl.com/lamsjz";;;;"2404828541";https://twitter.com/SwineFluNewsSG/status/2404828541
healthfulchoice;2009-06-30 15:21;0;0;"Girl, 9, dies of swine flu as UK cases jump http://bit.ly/dMU26";;;;"2404827087";https://twitter.com/healthfulchoice/status/2404827087
chestersoria;2009-06-30 15:21;0;0;"Jens Lekman has swine flu .";;;;"2404826906";https://twitter.com/chestersoria/status/2404826906
GiovanniGF;2009-06-30 15:21;0;0;"Funny headline @cnni : Doctors warn against ' swine flu parties' http://bit.ly/wQJcR";;@cnni;;"2404825062";https://twitter.com/GiovanniGF/status/2404825062
huis_Bodegraven;2009-06-30 15:20;0;0;"Pupil swine flu case shuts school (BBC News): A Stoke-on-Trent primary school is closed for seven days after a pupil is http://url4.eu/2kXT";;;;"2404823000";https://twitter.com/huis_Bodegraven/status/2404823000
twmercer;2009-06-30 15:20;0;0;"From the BBC ' Swine Flu Parties 'a bad' idea'' - most unnecessary headline ever? http://trunc.it/mvqs";;;;"2404821037";https://twitter.com/twmercer/status/2404821037
MeetMeAtTapps;2009-06-30 15:20;0;0;"RT @pitchforkmedia : Jens Lekman contracts the H1N1 virus-- aka swine flu http://bit.ly/wEW7n @anniquinn";;@pitchforkmedia @anniquinn;;"2404817931";https://twitter.com/MeetMeAtTapps/status/2404817931
Observer_Owl;2009-06-30 15:20;0;0;"Reports that pupils of Kingsway and Parkgate schools in Watford have swine flu , The schools remain open";;;;"2404816017";https://twitter.com/Observer_Owl/status/2404816017
sbrobot;2009-06-30 15:19;0;0;"Swine flu count in US hits 1 million; can't wait till flu season! [Neuron Culture]: U.S. Cases of New Flu .. http://bit.ly/jZv8o";;;;"2404805279";https://twitter.com/sbrobot/status/2404805279
thedunnething;2009-06-30 15:19;0;0;"Wow Swine Flu brings survival instinct anitsocialism to a new low - Swine Flu Parties - BBC http://bit.ly/U0yt7 - NYT http://bit.ly/17YiYT";;;;"2404802239";https://twitter.com/thedunnething/status/2404802239
SwineInfluenza;2009-06-30 15:19;0;0;"Swine flu case at ORAU - Knoxville News Sentinel: Swine flu case at ORAUKnoxville News SentinelAn employee at Oa.. http://tinyurl.com/n4v3rm";;;;"2404802226";https://twitter.com/SwineInfluenza/status/2404802226
MonavieEnergy;2009-06-30 15:19;0;0;"Monavie Energy Air Traffic Patterns Predict Swine Flu Spread: Countries that received the most air.. http://bit.ly/w6VxR";;;;"2404797402";https://twitter.com/MonavieEnergy/status/2404797402
News12NJ;2009-06-30 15:18;0;0;"Bergen Co. woman becomes 6th person in NJ to die from swine flu";;;;"2404792848";https://twitter.com/News12NJ/status/2404792848
