username;date;retweets;favorites;text;geo;mentions;hashtags;id;permalink
MissCeriss;2009-05-05 22:52;0;0;"silly pandemic, you're supposed to kill everyone on the planet BEFORE we get bored of you. #swineflu";;;#swineflu;"1710926712";https://twitter.com/MissCeriss/status/1710926712
ICAV;2009-05-05 22:52;0;0;"RT @swine_flu :Reuters: Make an H1N1 vaccine or not? http://tinyurl.com/d7d743 #H1N1 #Swineflu YES!!!";;@swine_flu;#H1N1 #Swineflu;"1710925820";https://twitter.com/ICAV/status/1710925820
NewsDFW;2009-05-05 22:51;0;0;"DFW News: CDC: Schools closed due to swine flu threat can now reopen http://bit.ly/13REaI";;;;"1710924880";https://twitter.com/NewsDFW/status/1710924880
abcactionnews;2009-05-05 22:51;0;0;"Hillsborough schools closed due to swine flu to reopen Thursday http://tr.im/kAlF";;;;"1710924329";https://twitter.com/abcactionnews/status/1710924329
GCTilla;2009-05-05 22:51;0;0;"completely trust that there is no swine flu in pork products. Quick, somebody give me a slice of bacon!";;;;"1710924130";https://twitter.com/GCTilla/status/1710924130
NewsDFW;2009-05-05 22:51;0;0;"DFW News: Texas schools scramble as feds drop swine flu closure advisory http://bit.ly/tSm7p";;;;"1710923093";https://twitter.com/NewsDFW/status/1710923093
CarrieMarieRN;2009-05-05 22:51;0;0;"my calves feel better and my clinical is canceled this week because of swine flu !!! what a fabulous day!";;;;"1710923055";https://twitter.com/CarrieMarieRN/status/1710923055
AstraOnTheAir;2009-05-05 22:51;0;1;"i hope i didn't catch the #swine flu today being in this middle school...my ear and throat are all of a sudden itchy..i HOPE it's allergies!";;;#swine;"1710921988";https://twitter.com/AstraOnTheAir/status/1710921988
TheKidsCraieola;2009-05-05 22:51;0;0;"swine flu , bird flu *hachu* "you're sick, foo! Ha ha i own you"";;;;"1710921644";https://twitter.com/TheKidsCraieola/status/1710921644
GumballFeed;2009-05-05 22:51;0;0;"RT BerryLowman @gentrytw: Gimballer trivia: Answer- The boys in the Swine Flu /CHP car!";;@gentrytw;;"1710921432";https://twitter.com/GumballFeed/status/1710921432
charly_murg;2009-05-05 22:51;0;0;"LOL at the swine flu site @MarkCorrigan just posted actual genius...personally i prefer "KILLER PIG FLU" as used by the daily mail";;@MarkCorrigan;;"1710918561";https://twitter.com/charly_murg/status/1710918561
dimeaglass;2009-05-05 22:51;0;0;"Feeling under the weather.. Allergies or the Swine Flu ? Must be allergies, my nose hasn't turned into a snout yet!";;;;"1710918186";https://twitter.com/dimeaglass/status/1710918186
jwalkersmith;2009-05-05 22:51;0;0;"Quit over-reacting! Pls put up ur silly masks for swine flu : http://tinyurl.com/d8l9ry http://tinyurl.com/c4r9tu http://tinyurl.com/c4feoa";;;;"1710918111";https://twitter.com/jwalkersmith/status/1710918111
ZachTumin;2009-05-05 22:51;0;0;"My pals at NYC 311 report that ovr 10 days they've handled 15,500+ swineflu calls, with >60% satisified by the IVR message. Wow.";;;;"1710917708";https://twitter.com/ZachTumin/status/1710917708
rhondanjohnny;2009-05-05 22:50;0;0;"Just saw that the first confirmed death from Swine Flu in Texas was from Cameron County. The same county I live in!";;;;"1710916624";https://twitter.com/rhondanjohnny/status/1710916624
Cessiec;2009-05-05 22:50;0;0;"RT @PeterSGreenberg Yes, it's true, I am headed to Mexico in about 2 weeks or so. Am I scared? No: http://bit.ly/tTCIR #swineflu #h1n1";;@PeterSGreenberg;#swineflu #h1n1;"1710916248";https://twitter.com/Cessiec/status/1710916248
rsspberry;2009-05-05 22:50;0;0;"US No Longer Advising Schools Close for Swine Flu - http://rsspberry.com/view/60005/";;;;"1710915444";https://twitter.com/rsspberry/status/1710915444
rsspberry;2009-05-05 22:50;0;0;"Developments on Swine Flu Worldwide - http://rsspberry.com/view/60004/";;;;"1710915304";https://twitter.com/rsspberry/status/1710915304
jehovahgodofgap;2009-05-05 22:50;0;0;"heading to #ham #radio meeting. would have taken my tech test last weekend but but they weren't doing VE's because of swine flu scare";;;#ham #radio;"1710915007";https://twitter.com/jehovahgodofgap/status/1710915007
HelloBeautiful;2009-05-05 22:50;0;0;"RECIPE: Cuban-Style Guacamole With Pineapple: In light of the ill-fated swine flu , politically known now as H1N1.. http://tinyurl.com/cyqu37";;;;"1710914452";https://twitter.com/HelloBeautiful/status/1710914452
salocalnews;2009-05-05 22:50;0;0;"First Texas Resident Dies of Swine Flu - http://fwix.com/article/773274";;;;"1710913296";https://twitter.com/salocalnews/status/1710913296
at_peep_show;2009-05-05 22:50;0;0;"RT MarkCorrigan: Renamed Swine Flu . Vote for it, this could be the name in lights alongside The Bubonic Plague: http://tr.im/kAfd";;;;"1710912743";https://twitter.com/at_peep_show/status/1710912743
monicaskinner;2009-05-05 22:50;0;0;"almost had a break down crisis- but all is good. East Asia is boosting security due to Swine Flu . Pray for our group! Pray for my sanity!";;;;"1710912435";https://twitter.com/monicaskinner/status/1710912435
KKComet;2009-05-05 22:50;0;0;"just heard the government of Egypt is ordering all pigs be slaughtered in response to " swine flu " (BTW: they have 0 cases)...";;;;"1710910650";https://twitter.com/KKComet/status/1710910650
foodbloggernews;2009-05-05 22:50;0;0;"Topix - Food: Critics question US reliance on industry's voluntary surveillance to spot swine flu : .. http://tinyurl.com/dcmtx3";;;;"1710910595";https://twitter.com/foodbloggernews/status/1710910595
SwineFluNow;2009-05-05 22:50;0;0;"by @healthmap : Officials Confirm Second U.S. Swine Flu Death (Texas) http://tinyurl.com/cuxbus #swineflu #h1n1";;@healthmap;#swineflu #h1n1;"1710909865";https://twitter.com/SwineFluNow/status/1710909865
CoW_mAn;2009-05-05 22:50;0;0;"Swine Flu perspective: AIDS kills about 38,500 people a week apparently.";;;;"1710909786";https://twitter.com/CoW_mAn/status/1710909786
foodbloggernews;2009-05-05 22:49;0;0;"Topix - Food Wire: Hog prices rise as swine flu worries abate: ... program to buy up $50 milli.. http://twurl.nl/sx166t";;;;"1710908451";https://twitter.com/foodbloggernews/status/1710908451
swinefluh1n1;2009-05-05 22:49;0;0;""Planeta Azul 'raquo; WORLD FIGHTS NEW FLU VIRUS WITH LATEST SCIENCE" http://tinyurl.com/dejq7x #swineflu #H1N1";;;#swineflu #H1N1;"1710908076";https://twitter.com/swinefluh1n1/status/1710908076
brobertslaw;2009-05-05 22:49;0;0;"This work week had flown by, but it's dragging it's feet out the door. I also may be sick. Probably swine flu . Maybe not. (but probably).";;;;"1710908055";https://twitter.com/brobertslaw/status/1710908055
swinefluh1n1;2009-05-05 22:49;0;0;""Britannia Radio" http://tinyurl.com/cuqdge #swineflu #H1N1";;;#swineflu #H1N1;"1710907333";https://twitter.com/swinefluh1n1/status/1710907333
mignews;2009-05-05 22:49;0;0;"Despite 2nd US Death, CDC Says Don't Close Schools for Swine Flu - WebMD: BBC NewsDespite 2nd US Death, CDC .. http://tinyurl.com/c2v9pw";;;;"1710907233";https://twitter.com/mignews/status/1710907233
swinefluh1n1;2009-05-05 22:49;0;0;""Pandemic Information News: Flu virus cases may rise in southern ..." http://tinyurl.com/cet6lt #swineflu #H1N1";;;#swineflu #H1N1;"1710907143";https://twitter.com/swinefluh1n1/status/1710907143
swinefluh1n1;2009-05-05 22:49;0;0;""KKXG: KING KONG VS GODZILLA (The Screenplay): NARITA AIRPORT ..." http://tinyurl.com/d7vvk9 #swineflu #H1N1";;;#swineflu #H1N1;"1710906802";https://twitter.com/swinefluh1n1/status/1710906802
swinefluh1n1;2009-05-05 22:49;0;0;""Economic indicators | Black Swans and Dead Pigs - Why Swine Flu Is ..." http://tinyurl.com/d9dc9n #swineflu #H1N1";;;#swineflu #H1N1;"1710906499";https://twitter.com/swinefluh1n1/status/1710906499
emrichards;2009-05-05 22:49;0;0;"Swine Flu : ALL Milwaukee-area schools will re-open tomorrow, 'cept for 2 closed in WestAllis-WestMilwaukee. Those will re-open Thurs.";;;;"1710905961";https://twitter.com/emrichards/status/1710905961
DailyTimes;2009-05-05 22:49;0;0;"Breaking News: Probably swine flu case closes second Knox school: http://www.thedailytimes.com/article/20090505/BREAKING/905059993";;;;"1710905919";https://twitter.com/DailyTimes/status/1710905919
jennwadsworth;2009-05-05 22:49;0;0;"Damn it. Swine flu-sick Tracy woman, 31, tells me she doesn't want a story written about her. Doesn't want her name in the paper. Sigh ...";;;;"1710904649";https://twitter.com/jennwadsworth/status/1710904649
mommyontheedge;2009-05-05 22:49;0;0;"RT @mom101 Thank goodness for Web MD whose headline is Swine Flu : Don't panic. You'd think the news outlets could take a lesson?";;@mom101;;"1710904605";https://twitter.com/mommyontheedge/status/1710904605
swineflualerts;2009-05-05 22:49;0;0;""the Library Channel » Blog Archive » Global Health on trial ..." http://tinyurl.com/cfck9b #swineflu";;;#swineflu;"1710904587";https://twitter.com/swineflualerts/status/1710904587
swineflualerts;2009-05-05 22:49;0;0;""Schwitzer health news blog: Swine flu-HIV could devastate human ..." http://tinyurl.com/dbw24h #swineflu";;;#swineflu;"1710904347";https://twitter.com/swineflualerts/status/1710904347
Stead;2009-05-05 22:49;0;0;"I don't fancy/have/want KFC, Oprah, Swine Flu , #jonaslive , Happy Cinco De Mayo, TINK, Star Trek, #railsconf , H1N1 or Brett Favre =]";;;#jonaslive #railsconf;"1710903947";https://twitter.com/Stead/status/1710903947
itsjonsense;2009-05-05 22:49;0;0;"We got the swine flu in this house people pig out with ruthless aggression. Haha";;;;"1710903469";https://twitter.com/itsjonsense/status/1710903469
crimsonhexagon;2009-05-05 22:49;0;0;"Swine Flu Conversation Declines on the Social Web, Provides an Opportunity for Brands: We wanted to update our t.. http://tinyurl.com/cc5rrs";;;;"1710903129";https://twitter.com/crimsonhexagon/status/1710903129
ryanzielonka;2009-05-05 22:49;0;0;"Is swine flu still front page news? Sorry excuse for a pandemic.";;;;"1710901099";https://twitter.com/ryanzielonka/status/1710901099
paladine;2009-05-05 22:49;0;0;"CDC Info Sheet On Pregnant Women and Swine Flu ...wow... http://bit.ly/pTPmV";;;;"1710900524";https://twitter.com/paladine/status/1710900524
OWASP_podcast;2009-05-05 22:48;0;0;"RT @Veratect US, Hawaii: Three cases of influenza A (H1N1) confirmed in individuals associated with travel. #swineflu #H1N1";;@Veratect;#swineflu #H1N1;"1710900445";https://twitter.com/OWASP_podcast/status/1710900445
MarkLawsonMLD;2009-05-05 22:48;0;0;"ppl die of normal flu and schools don't close then. still don't get the hyped up scares for swine flu . world is going mad. get real.";;;;"1710900164";https://twitter.com/MarkLawsonMLD/status/1710900164
Baconfeed;2009-05-05 22:48;0;0;"Brilliant! @bleakey has determined that TR's silliness is resulting from swine flu . I believe it. He needs more .. http://tinyurl.com/c5svap";;@bleakey;;"1710899999";https://twitter.com/Baconfeed/status/1710899999
sarahlouise16;2009-05-05 22:48;0;0;"Walked through public lounge on boat today and sky swine flu news was on tv, did my best not to sneeze.";;;;"1710899969";https://twitter.com/sarahlouise16/status/1710899969
AnthonyJLowe;2009-05-05 22:48;0;0;"Best swine flu joke under 140 characters heard so far: "I'm concerned about swine flu . Called a mate in Mexico and only got crackling."";;;;"1710899814";https://twitter.com/AnthonyJLowe/status/1710899814
Phil_Rainier;2009-05-05 22:48;0;0;"Texas woman who lived near U.S.-Mexico border and was in poor health has died from swine flu . It's the 2nd U.S. H1N1 death.";;;;"1710899593";https://twitter.com/Phil_Rainier/status/1710899593
TelegraphNews;2009-05-05 22:48;0;0;"Swine flu : Texas woman becomes first US resident to die from virus http://tinyurl.com/d4opa3";;;;"1710898977";https://twitter.com/TelegraphNews/status/1710898977
NewsAustinTx;2009-05-05 22:48;0;0;"Austin News: State officials confirm first Texan death from H1N1/ swine flu http://bit.ly/XGOHt";;;;"1710898746";https://twitter.com/NewsAustinTx/status/1710898746
NewsAustinTx;2009-05-05 22:48;0;0;"Austin News: New confirmed H1N1/ swine flu case in Austin, 2 probable cases http://bit.ly/ldwps";;;;"1710898191";https://twitter.com/NewsAustinTx/status/1710898191
swinflunews;2009-05-05 22:48;0;0;"Alex Jones - The swine flu swindle, gun control and the Obamajugend GPS census tactics 4of8 http://ff.im/-2ChiZ";;;;"1710898037";https://twitter.com/swinflunews/status/1710898037
NewsAustinTx;2009-05-05 22:48;0;0;"Austin News: U.S. officials no longer recommend school closures; Texas reports 2nd swine flu death http://bit.ly/19eL87";;;;"1710897077";https://twitter.com/NewsAustinTx/status/1710897077
fallingupagain;2009-05-05 22:48;0;1;"Kermit just died of swine flu . His last words were "That fucking pig said she was clean!";;;;"1710895251";https://twitter.com/fallingupagain/status/1710895251
lizmar;2009-05-05 22:48;0;0;"RT @BuzzEdition : LOL! RT @FizzyDuck : You know who's really worried about this swine flu ? Kevin Bacon LOL";;@BuzzEdition @FizzyDuck;;"1710893760";https://twitter.com/lizmar/status/1710893760
DAyers;2009-05-05 22:48;0;0;"I think that the swine flu 'panic' illustrates very well many every day things that we all take for granted.";;;;"1710893708";https://twitter.com/DAyers/status/1710893708
Explore_It;2009-05-05 22:47;0;0;"CU student tests positive for #swineflu - finals continue -- http://twurl.nl/ehfhwm";;;#swineflu;"1710890954";https://twitter.com/Explore_It/status/1710890954
MVHerald;2009-05-05 22:47;0;0;"Tam High will resume its regular schedule starting Wednesday morning after swine flu prompts closure.";;;;"1710890943";https://twitter.com/MVHerald/status/1710890943
camposmello;2009-05-05 22:47;0;0;"swine flu is beginning to look like Y2K, the millennium bug";;;;"1710890921";https://twitter.com/camposmello/status/1710890921
nonsensequitter;2009-05-05 22:47;0;0;"The h1n1 (aka Swine Flu ) panademic will henceforth be known as.... THE APORKALYPSE!!!!111!!";;;;"1710890583";https://twitter.com/nonsensequitter/status/1710890583
ultrabrown;2009-05-05 22:47;0;0;"Muslim Afghanistan's only known pig has been quarantined over swine flu . Mujahideen ate many of the ... http://tinyurl.com/ceocyg";;;;"1710890341";https://twitter.com/ultrabrown/status/1710890341
deadmandavid380;2009-05-05 22:47;0;0;"[Blog] Can swine flu kill a consistently stressed teen?: I am a very stressed out person and I know stress leads to ... http://s3nt.com/aofe";;;;"1710889740";https://twitter.com/deadmandavid380/status/1710889740
VikkiJohh;2009-05-05 22:47;0;0;"hmmm KFC Oprah Swine Flu #jonaslive Happy Cinco De Mayo Star Trek H1N1 -> follow @30SECONDSTOMARS *whistles innocently* wut... WUT? O_o";;@30SECONDSTOMARS;#jonaslive;"1710888277";https://twitter.com/VikkiJohh/status/1710888277
pueblowarriors;2009-05-05 22:47;0;0;"New letter from TUSD with updated information on Swine Flu will be sent home tomorrow and can be downloaded here: http://tinyurl.com/djlgoz";;;;"1710886800";https://twitter.com/pueblowarriors/status/1710886800
tellingtales;2009-05-05 22:47;0;0;"I've also got peanut butter in my swine flu kit";;;;"1710885770";https://twitter.com/tellingtales/status/1710885770
enochchoi;2009-05-05 22:47;0;0;"TODAY's SCC PHD guidance for school closures parallels CDC guidance today http://bit.ly/Ctr3U #H1N1 #swineflu";;;#H1N1 #swineflu;"1710885756";https://twitter.com/enochchoi/status/1710885756
schbank;2009-05-05 22:47;0;0;"Best question - "I suppose it’s too late to start a rumor that Veridian Dynamics is secretly working on a vaccine for Swine Flu ?"";;;;"1710885368";https://twitter.com/schbank/status/1710885368
adrienne_hall;2009-05-05 22:46;0;0;"just back from D.C. swine flu free. A Tad irked I didn't get to dabble in the cinematic offerings of Landmark's E Street.";;;;"1710883533";https://twitter.com/adrienne_hall/status/1710883533
MalMNN;2009-05-05 22:46;0;0;"Will the SWINE FLU (H1N1) Impact the Concert Biz This Season? - http://tinyurl.com/deoqnb";;;;"1710882893";https://twitter.com/MalMNN/status/1710882893
TheDBCs;2009-05-05 22:46;0;0;"This isn't a Swine Flu , Oprah, or KFC status. H1N1. Bret Farve isn't going to our shows. www.myspace.com/thedbcs. Happy Cinco De Mayo.";;;;"1710880978";https://twitter.com/TheDBCs/status/1710880978
EastOregonian;2009-05-05 22:46;0;0;"News: Two cases of swine flu confirmed in county http://tinyurl.com/cugrz8";;;;"1710880523";https://twitter.com/EastOregonian/status/1710880523
MrJamesCarter;2009-05-05 22:46;0;0;"chicken flu... swine flu ...whats next the watermelon virus?";;;;"1710879715";https://twitter.com/MrJamesCarter/status/1710879715
paladine;2009-05-05 22:46;0;0;"Swine Flu ...so...approx. 8-9% of cases hospitalized....sound mild?";;;;"1710879429";https://twitter.com/paladine/status/1710879429
HUViolet;2009-05-05 22:46;0;0;"Coronas, margaritas, spanish rice, tortilla chips, all I need is a swine flu threat and its just like mexico....";;;;"1710879281";https://twitter.com/HUViolet/status/1710879281
Rookmarks;2009-05-05 22:46;0;0;"Forget swine flu : dengue is spreading http://tinyurl.com/cb9doa";;;;"1710878286";https://twitter.com/Rookmarks/status/1710878286
LOedu_reporter;2009-05-05 22:46;0;0;"LOSD is taking measures to monitor H1N1 ( swine flu ) virus. See here: http://www.loswego.k12.or.us/news/h1n1.update.htm";;;;"1710877682";https://twitter.com/LOedu_reporter/status/1710877682
aazzure;2009-05-05 22:46;0;0;"Re @PurpleZoe : RT @Alkhemist Swine Flu is a lie. http://tinyurl.com/cpbx9m Swine Flu has been overinflated and reeks of Big pharma posi ...";;@PurpleZoe @Alkhemist;;"1710877441";https://twitter.com/aazzure/status/1710877441
noellescaggs;2009-05-05 22:46;0;0;"I may have a minor case of swine flu , Ill keep you posted. Unless I die in which no one would know because Im home alone till the 8th :/";;;;"1710876585";https://twitter.com/noellescaggs/status/1710876585
digitaltempest;2009-05-05 22:45;0;1;"RT @GamerTwit It was once said that a black man would be president when pigs would fly. Indeed..100 days into Obama's presidency - swine flu";;@GamerTwit;;"1710876149";https://twitter.com/digitaltempest/status/1710876149
autodrool;2009-05-05 22:45;0;0;"Swine flu casts a cloud over Cinco de Mayo http://jijr.com/h5RF";;;;"1710875204";https://twitter.com/autodrool/status/1710875204
AhaiOleloOla;2009-05-05 22:45;0;0;"Just In: Hawaii Cases Confirmed as H1N1, Swine Flu : The results are back from the Centers for Disease Control, a.. http://tinyurl.com/c74ul5";;;;"1710874621";https://twitter.com/AhaiOleloOla/status/1710874621
immuneprotect;2009-05-05 22:45;0;0;"WHAT'S UP DOC: Be prudent, be careful about swine flu http://bit.ly/F1jMP";;;;"1710874618";https://twitter.com/immuneprotect/status/1710874618
autodrool;2009-05-05 22:45;0;0;"US no longer advising schools close for swine flu http://jijr.com/h5RE";;;;"1710874367";https://twitter.com/autodrool/status/1710874367
shaunhaney;2009-05-05 22:45;0;0;"Here is an example of how ridiculous the media can be by justifying using the term " swine flu " http://tinyurl.com/dkujba #h1n1 #farm";;;#h1n1 #farm;"1710873791";https://twitter.com/shaunhaney/status/1710873791
autodrool;2009-05-05 22:45;0;0;"Texas woman with swine flu dies - health officials http://jijr.com/h5RD";;;;"1710873674";https://twitter.com/autodrool/status/1710873674
CDHDidaho;2009-05-05 22:45;0;0;"Ada County Infant Has Probable Test for H1N1 ( swine flu ) Infection - learn more at www.cdhd.idaho.gov";;;;"1710873033";https://twitter.com/CDHDidaho/status/1710873033
DaTrueBellaDon;2009-05-05 22:45;0;0;"Big hypochondriac so if I just hear the word swine flu I'll catch a headache or start coughin lol could be why I'm a vegetarian!";;;;"1710872291";https://twitter.com/DaTrueBellaDon/status/1710872291
MsMaryElizabeth;2009-05-05 22:45;0;0;"working at the bar tonight.. in honor of Cinco de Mayo, I'm gonna come up with a Swine Flu Shot... thoughts?";;;;"1710871161";https://twitter.com/MsMaryElizabeth/status/1710871161
swinefluh1n1;2009-05-05 22:45;0;0;""PAHO Urges Southern Hemisphere to Remain Alert for Influenza A(H1N1)" http://tinyurl.com/cvk9ep #swineflu #H1N1";;;#swineflu #H1N1;"1710870799";https://twitter.com/swinefluh1n1/status/1710870799
autodrool;2009-05-05 22:45;0;0;"Texas confirms first swine flu death of U.S. resident http://jijr.com/h5RB";;;;"1710869677";https://twitter.com/autodrool/status/1710869677
at_peep_show;2009-05-05 22:45;0;0;"RT MarkCorrigan: Renamed Swine Flu . Vote for it, this could be the name in lights alongside The Bubonic Plague: http://tr.im/kAfd";;;;"1710869018";https://twitter.com/at_peep_show/status/1710869018
iChaib;2009-05-05 22:45;0;0;"Swine Flu , twitter and Microsoft Vine, is technology useful during a crisis?";;;;"1710868899";https://twitter.com/iChaib/status/1710868899
SwineFlu_news;2009-05-05 22:45;0;0;"First U.S. Resident Dies Of H1N1 In Texas http://t.love.com/210706739";;;;"1710868836";https://twitter.com/SwineFlu_news/status/1710868836
paladine;2009-05-05 22:45;0;0;"FOX-Confirmed swine flu cases in the United States jumped Tuesday to 403 The CDC knows of 35 swine flu-related hospitalizations in the U.S.";;;;"1710868456";https://twitter.com/paladine/status/1710868456
encToday;2009-05-05 22:44;0;0;"JDNews.com Second case of swine flu confirmed in Onslow: The second probable case of swine flu in Onsl.. http://tinyurl.com/dffgb9";;;;"1710867688";https://twitter.com/encToday/status/1710867688
Humberto777;2009-05-05 22:44;0;0;"I'm feeling sick from all the grease and alcohol from this weekend's New Orleans trip. It's like Swine Flu without the sneezing! Miserable!";;;;"1710864799";https://twitter.com/Humberto777/status/1710864799
BriefNews;2009-05-05 22:44;0;0;"News: American, Already Ailing, Dies of Swine Flu - New York Times http://cli.gs/hGU3qL";;;;"1710863978";https://twitter.com/BriefNews/status/1710863978
SirishM;2009-05-05 22:44;0;0;"All this news abt Swine flu being the new virus, and bla bla bla. The flu 1st came in U.S. in 1976 and military knew about it too way back.";;;;"1710863619";https://twitter.com/SirishM/status/1710863619
RandyVale;2009-05-05 22:44;0;0;"At the doctors now. Making sure I don't have swine flu . I wish I was kidding.";;;;"1710862882";https://twitter.com/RandyVale/status/1710862882
underpressure;2009-05-05 22:44;0;0;"Not " swine" flu ? "The never-before-seen H1N1 flu virus has elements of swine, avian and human varieties." http://tinyurl.com/c2ftr2";;;;"1710862799";https://twitter.com/underpressure/status/1710862799
luca1983;2009-05-05 22:44;0;0;"US resident dies from swine flu http://tinyurl.com/d5z5y5";;;;"1710862650";https://twitter.com/luca1983/status/1710862650
Bloke28;2009-05-05 22:44;0;1;"Swine Flu Outbreak World Map ~ Tracks from start to current, updates too http://news.bbc.co.uk/2/hi/americas/8021547.stm #swineflu #map";;;#swineflu #map;"1710862483";https://twitter.com/Bloke28/status/1710862483
philgoodstory;2009-05-05 22:44;0;0;"a) i hate swine flu . b) so glad my sweeps pieces have already aired! c) happy cinco de mayo! d) is it the weekend yet?";;;;"1710862321";https://twitter.com/philgoodstory/status/1710862321
ByronJRichards;2009-05-05 22:44;0;0;"This week's podcast is online early! I answer many listener questions about the swine flu : http://www.wellnessresources.com/classroom.php";;;;"1710862267";https://twitter.com/ByronJRichards/status/1710862267
Paul_Berney;2009-05-05 22:44;0;0;"LOL, can't stop sneezing :-) It's a case of bad timing too, as i'm reading about swine flu on Yahoo :-(";;;;"1710861448";https://twitter.com/Paul_Berney/status/1710861448
pacioli;2009-05-05 22:44;0;0;"Health officials say you can't get swine flu from eating pork. You get it from people, which I don't eat.";;;;"1710860082";https://twitter.com/pacioli/status/1710860082
Breaking_News;2009-05-05 22:44;0;0;"Officials say schools can reopen despite swine flu (AP) : AP - Joan Tishkevich's joy was unequivocal. "YES!" t.. http://tinyurl.com/cv8zy9";;;;"1710860058";https://twitter.com/Breaking_News/status/1710860058
NightkrawlerXMT;2009-05-05 22:44;0;0;"no jobs and swine flu is all we hearin now/ recession depressing millions I hope that you hear me out/ the war is in the mind so be blind";;;;"1710859996";https://twitter.com/NightkrawlerXMT/status/1710859996
SpiderWebbII;2009-05-05 22:43;0;0;"ok. don't buy into the media hype on swine flu . wash your hands (as usual) and you should be fine... and, - don't cough on me. Thanks.";;;;"1710859358";https://twitter.com/SpiderWebbII/status/1710859358
GreenvilleNews;2009-05-05 22:43;0;0;"Texas confirms first swine flu death of U.S. resident: McALLEN, Texas -- Texas health officials have confirmed t.. http://tinyurl.com/d63crz";;;;"1710857735";https://twitter.com/GreenvilleNews/status/1710857735
peafold1983;2009-05-05 22:43;0;0;"my hayfever is quite bad but everytime i sneeze people look at me like i have swine flu !!!! damn it!";;;;"1710857262";https://twitter.com/peafold1983/status/1710857262
StaceySinger;2009-05-05 22:43;0;0;"CDC and HHS now say no need to close schools for two weeks if #swineflu hits. Instead, keep sick people home. http://tinyurl.com/d8fblb";;;#swineflu;"1710857089";https://twitter.com/StaceySinger/status/1710857089
realDrNick;2009-05-05 22:43;0;0;"How to diagnose & treat swine flu : by 1 of the top clinicians in the world-I've worked w/this guy in past on CAP: http://tinyurl.com/d5tpmh";;;;"1710856641";https://twitter.com/realDrNick/status/1710856641
GamerTwit;2009-05-05 22:43;0;0;"It was once said that a black man would be president when pigs would fly. Indeed..100 days into Obama's presidency - swine flu . ";;;;"1710855434";https://twitter.com/GamerTwit/status/1710855434
amandasdfjkl;2009-05-05 22:43;0;0;"Lets not let the swine flu keep us from properly celebrating 5 de mayo. Because the 5th of May is so much cooler than the 6th of May.";;;;"1710855059";https://twitter.com/amandasdfjkl/status/1710855059
JackKrupansky;2009-05-05 22:43;0;0;"NYT: First American death from H1N1 ( swine flu ). There was a pre-existing medical condition, but that's a typical flu death.";;;;"1710854839";https://twitter.com/JackKrupansky/status/1710854839
