username;date;retweets;favorites;text;geo;mentions;hashtags;id;permalink
bulldogonabc24;2009-11-10 16:11;0;0;"I've got only two vacation days left for the year. Now, I've got a problem. I can save them, in case I get swine flu , or use them.";;;;"5592185114";https://twitter.com/bulldogonabc24/status/5592185114
bbuckner;2009-11-10 16:11;0;0;"Praying 4 cousin Eric Faulkner, has had swine flu for 9 days...just passed out @work ..at Radford Hospital now.";;@work;;"5592181148";https://twitter.com/bbuckner/status/5592181148
hilariousgirl;2009-11-10 16:11;0;0;"Took the "Will you die of swine flu " quiz & got: just like zombieland you will get eaten :]! What about you? ➜ http://bit.ly/3XsANx";;;;"5592178791";https://twitter.com/hilariousgirl/status/5592178791
swinefluh1n1;2009-11-10 16:11;0;0;""Patient Being Treated at Morgantown Hospital for H1N1 Dies" http://tinyurl.com/yel3hxs #swineflu #H1N1";;;#swineflu #H1N1;"5592176082";https://twitter.com/swinefluh1n1/status/5592176082
swinefluh1n1;2009-11-10 16:11;0;0;""Officials say H1N1 linked to adult's death" http://tinyurl.com/y9ug56h #swineflu #H1N1";;;#swineflu #H1N1;"5592175708";https://twitter.com/swinefluh1n1/status/5592175708
swinefluh1n1;2009-11-10 16:11;0;0;""Clarian Health employees volunteer to assist Marion County Health Depart..." http://tinyurl.com/ycb26c8 #swineflu #H1N1";;;#swineflu #H1N1;"5592175397";https://twitter.com/swinefluh1n1/status/5592175397
SammiSweet_Hart;2009-11-10 16:11;0;0;"Fiddler says, " swine flu comes from birds right?" I say, "no! Pigs! Swine! Pig! Swine flu !" Ashley says, "bird flu comes from birds!"";;;;"5592175189";https://twitter.com/SammiSweet_Hart/status/5592175189
swinefluh1n1;2009-11-10 16:11;0;0;""On the Prevalance of H1N1" http://tinyurl.com/yc4dbsf #swineflu #H1N1";;;#swineflu #H1N1;"5592175063";https://twitter.com/swinefluh1n1/status/5592175063
RachaelWRider;2009-11-10 16:11;0;0;"And hopefully neither of us exhibit swine flu symptoms and are turned away at the airport!";;;;"5592170548";https://twitter.com/RachaelWRider/status/5592170548
subhashbohra;2009-11-10 16:11;0;0;"RT @SwineFluUK : Experts predict swine flu 's return as 84,000 new cases are reported.. http://bit.ly/2Ve7bJ hope in Pune again it not get bad";;@SwineFluUK;;"5592168925";https://twitter.com/subhashbohra/status/5592168925
marcelhofma;2009-11-10 16:11;0;0;"Just bought a car and then had my #swineflu jab, or did I do things in the wrong order ?";;;#swineflu;"5592165530";https://twitter.com/marcelhofma/status/5592165530
news10nbc;2009-11-10 16:10;0;0;"Ontario County holds swine flu clinic http://bit.ly/2RaYcn";;;;"5592160168";https://twitter.com/news10nbc/status/5592160168
mr_nolte;2009-11-10 16:10;0;0;"RT @sorensenpower So I'm officially over my Swine Flu . I didn't want to tweet these past days because I didn't want to get any of you sick.";;@sorensenpower;;"5592148619";https://twitter.com/mr_nolte/status/5592148619
Continuumltd;2009-11-10 16:10;0;0;"Need an Affordable Pandemic Plan A(H1N1)v “ Swine Flu ” etc..Or just some advice http://bit.ly/33oM52";;;;"5592137605";https://twitter.com/Continuumltd/status/5592137605
GooberSnattch;2009-11-10 16:09;0;0;"RT @JoeyHomza : Swine Flu is a figment of our imaginations. LOL. I actually had it. Wasn't something I'd wish on ppl.";;@JoeyHomza;;"5592129461";https://twitter.com/GooberSnattch/status/5592129461
karntna_bua;2009-11-10 16:09;0;0;"perfect autumn weather to safeguard from any kind of flu... heavy rain, cold and rough wind... leave home and enjoy it... #vienna #swineflu";;;#vienna #swineflu;"5592125757";https://twitter.com/karntna_bua/status/5592125757
QUICKMIXXRICK;2009-11-10 16:09;0;0;"dammit! i forgot today the company is giving out flu shots. i dont wanna! damn mexicans and that swine flu";;;;"5592125738";https://twitter.com/QUICKMIXXRICK/status/5592125738
OnPointRadio;2009-11-10 16:08;0;0;"Animals, humans & disease. Swine flu . Avian flu. Rabies. Ringworm. West Nile & many more. What's next? http://bit.ly/pGInj";;;;"5592101236";https://twitter.com/OnPointRadio/status/5592101236
SwineFluUpdate;2009-11-10 16:08;0;0;"Swine Flu Ottawa surgeries cancelled due to flu overload - CBC.ca: Ottawa surgeries cancelled due to f.. http://bit.ly/3NDUsE";;;;"5592100752";https://twitter.com/SwineFluUpdate/status/5592100752
CincyWebNet;2009-11-10 16:08;0;0;"Senator proposes paid sick leave for swine flu : WASHINGTON (Reuters) - Americans infected by the H1N1 flu virus.. http://bit.ly/35c4mp";;;;"5592096674";https://twitter.com/CincyWebNet/status/5592096674
swineflu2;2009-11-10 16:07;0;0;"#swineflu Woman kicked off flight over swine flu fear - KARE: Woman kicked off flight over swine flu f.. http://bit.ly/1W8IZU";;;#swineflu;"5592085875";https://twitter.com/swineflu2/status/5592085875
breakingflunews;2009-11-10 16:07;0;0;"breakingflunews.com Beware of swine flu swindles - amNY: Beware of swine flu swindlesamNYFre.. http://bit.ly/43NvUV";;;;"5592080444";https://twitter.com/breakingflunews/status/5592080444
SwineFluTicker;2009-11-10 16:07;0;0;"InsureBlog: Swine Flu and Goldman Sachs: Seems the folks at SNL "porked" a little fun at the CDC and .. http://bit.ly/3PhCRC";;;;"5592078767";https://twitter.com/SwineFluTicker/status/5592078767
breakingflunews;2009-11-10 16:07;0;0;"breakingflunews.com Changes for swine flu clinics in the Treasure Valley - KBOI: Changes for.. http://bit.ly/3zE2gn";;;;"5592078737";https://twitter.com/breakingflunews/status/5592078737
SwineFluTicker;2009-11-10 16:07;0;0;"Laughing Leah Loves Lilies: Swine Flu : Have you missed me? We've been battling swine flu in our home the la.. http://bit.ly/PmD4g";;;;"5592077430";https://twitter.com/SwineFluTicker/status/5592077430
SwineFluTicker;2009-11-10 16:07;0;0;"Canada swine flu | Canada social justice: In Canada last week as people from high risk groups were lining up ar.. http://bit.ly/31GumG";;;;"5592075793";https://twitter.com/SwineFluTicker/status/5592075793
swine_flu_pro;2009-11-10 16:07;0;0;"http://bit.ly/4ngDZN Canada swine flu | Canada social justice: In Canada last week as peopl.. http://bit.ly/450R7v";;;;"5592073684";https://twitter.com/swine_flu_pro/status/5592073684
suineflu;2009-11-10 16:07;0;0;"#swineflu What they mean by a pandemic - Palm Beach Post: What they mean by a pandemicPalm Beach PostT.. http://bit.ly/2dJT7S";;;#swineflu;"5592073203";https://twitter.com/suineflu/status/5592073203
swine_flu_pro;2009-11-10 16:07;0;0;"http://bit.ly/4ngDZN H1N1 Swine Flu Virus and Cats: However, since the discovery of a docum.. http://bit.ly/1lo6Tg";;;;"5592072044";https://twitter.com/swine_flu_pro/status/5592072044
AIDigest;2009-11-10 16:07;0;0;"Experts predict swine flu 's return as 84,000 new cases are reported - Times Online - http://shar.es/akIlW";;;;"5592069384";https://twitter.com/AIDigest/status/5592069384
wisree;2009-11-10 16:07;0;0;"FACTBOX-Measures to fight H1N1 swine flu in Europe http://bit.ly/gPQtb";;;;"5592067424";https://twitter.com/wisree/status/5592067424
KungFluFighter;2009-11-10 16:06;0;0;"RT @flahertb RT @McCann_NY Go 2 NYT.com home page. On right, story ABT intelligence of pigs. Directly beneath, story ABT swine flu vaccine.";;@flahertb @McCann_NY;;"5592062060";https://twitter.com/KungFluFighter/status/5592062060
starledger;2009-11-10 16:06;0;0;"N.J. hospitals are urged to halt kid visits to stem spread of swine flu http://bit.ly/1lEAu9";;;;"5592056962";https://twitter.com/starledger/status/5592056962
OxygenLynne;2009-11-10 16:06;0;0;"Sky Spiders and The Mark of The Beast #666 Don't get infected! #swineflu #H1N1 RT Plz http://tiny.cc/6Zo1k";;;#666 #swineflu #H1N1;"5592054153";https://twitter.com/OxygenLynne/status/5592054153
TaneSpasev;2009-11-10 16:06;0;0;"Josh Childress got the swine flu ....see kids,even the might basketball players can get it.";;;;"5592046674";https://twitter.com/TaneSpasev/status/5592046674
FUNomenalMe;2009-11-10 16:06;0;0;"RT @OCReggie : 8 O.C. adults died of swine flu last week > http://bit.ly/3wdd1M ^KS";;@OCReggie;;"5592042347";https://twitter.com/FUNomenalMe/status/5592042347
Rob_Nardone;2009-11-10 16:05;0;0;"Doctor I work for might have Swine Flu and everyone is blaming me cause I had a cough for one day last week. Cool.";;;;"5592031152";https://twitter.com/Rob_Nardone/status/5592031152
swinefluh1n1;2009-11-10 16:05;0;0;""Valparaiso Rotary Club's 11th Annual Veterans Day Program" http://tinyurl.com/yahd4y6 #swineflu #H1N1";;;#swineflu #H1N1;"5592030410";https://twitter.com/swinefluh1n1/status/5592030410
swinefluh1n1;2009-11-10 16:05;0;0;""US ' World News, Tuesday 11/10" http://tinyurl.com/ybqrm8l #swineflu #H1N1";;;#swineflu #H1N1;"5592030012";https://twitter.com/swinefluh1n1/status/5592030012
goneGrooming;2009-11-10 16:05;0;0;"Keeping it SAFE...one way to keep the Swine Flu away? http://ping.fm/Aouke www.goneGROOMING.com";;;;"5592025954";https://twitter.com/goneGrooming/status/5592025954
birdflu;2009-11-10 16:05;0;0;"Government's H1N1 swine flu death toll is incomplete http://bit.ly/4CCZl5";;;;"5592023665";https://twitter.com/birdflu/status/5592023665
Fluheadlines;2009-11-10 16:05;0;0;"Fluheadlines Khalifeh says no vaccine for swine flu in Lebanon yet: In an interview with An-Nahar n.. http://bit.ly/1KBLiz";;;;"5592014877";https://twitter.com/Fluheadlines/status/5592014877
live_h1n1;2009-11-10 16:05;0;0;"Experts predict #swineflu 's return as 84000 new cases are reported - Times Online : http://bit.ly/1wq6xy";;;#swineflu;"5592013522";https://twitter.com/live_h1n1/status/5592013522
johngreenart;2009-11-10 16:05;0;0;"Swine Flu hits the Hundred Acre Wood: http://imgrr.com/x/10zutkg.jpg";;;;"5592013342";https://twitter.com/johngreenart/status/5592013342
ah1n1news;2009-11-10 16:04;0;0;"When swine flu is a cash cow: Via the Globe and Mail: Fears of flu a cash cow for makers of sanitizers. Excerpt.. http://bit.ly/P3f7h";;;;"5592007352";https://twitter.com/ah1n1news/status/5592007352
swineflu_news_;2009-11-10 16:04;0;0;"Canada swine flu | Canada social justice: In Canada last week as people from high risk groups were lining up ar.. http://bit.ly/2u82KR";;;;"5592005786";https://twitter.com/swineflu_news_/status/5592005786
swineflu_news_;2009-11-10 16:04;0;0;"H1N1 Swine Flu Virus and Cats: However, since the discovery of a documented case of a cat in Iowa contracting s.. http://bit.ly/1CrwNe";;;;"5592003955";https://twitter.com/swineflu_news_/status/5592003955
Prehab212;2009-11-10 16:04;0;0;"RT @weeddude Miss Piggy did not attend todays anniversary events celebrating the 40th of Bert and Ernie because of potential swine flu .";;@weeddude;;"5591999079";https://twitter.com/Prehab212/status/5591999079
Blazing_Health;2009-11-10 16:04;0;0;"H1N1: The scoop on swine flu - So what's it really like to come down with this year's pandemic? Ou... [MORE] http://bit.ly/1IvFHa #swineflu";;;#swineflu;"5591998619";https://twitter.com/Blazing_Health/status/5591998619
Blazing_Health;2009-11-10 16:04;0;0;"Syn's Life: The Flu Hits Home [LIFEOFSYN] http://bit.ly/3tnufX #swineflu";;;#swineflu;"5591998386";https://twitter.com/Blazing_Health/status/5591998386
Crof;2009-11-10 16:03;0;0;"When swine flu is a cash cow http://bit.ly/4jtkPc";;;;"5591985813";https://twitter.com/Crof/status/5591985813
revchriss;2009-11-10 16:03;0;0;"The Swine Flu is an orchestrated attempt to spread fear and chaos http://bit.ly/kNuyK";;;;"5591984202";https://twitter.com/revchriss/status/5591984202
SwineFluNewsCIS;2009-11-10 16:03;0;0;"Baku Metro continues disinfection opposite “swine flu” http://tinyurl.com/ygrp4lm #h1n1 #azerbaijan";;;#h1n1 #azerbaijan;"5591978255";https://twitter.com/SwineFluNewsCIS/status/5591978255
SwineFluUK;2009-11-10 16:03;0;0;"Experts predict swine flu 's return as 84,000 new cases are reported: The number of people in hospital suffering.. http://bit.ly/2Ve7bJ";;;;"5591973383";https://twitter.com/SwineFluUK/status/5591973383
KCarson85;2009-11-10 16:03;0;0;"Oh god yeah hope not too!! RT @Manda_Lynn615 At the doctor now. Hope its not that swine flu *chuckels* oh it hurts to laugh.";;@Manda_Lynn615;;"5591972374";https://twitter.com/KCarson85/status/5591972374
jacksonmichael5;2009-11-10 16:02;0;0;"#michaeljackson : Swine-flu worries spur shortage of hand sanitizer, respirator supplies in N.J.";;;#michaeljackson;"5591939336";https://twitter.com/jacksonmichael5/status/5591939336
NPPC;2009-11-10 16:01;0;0;"“ Swine Flu ” – It’s Time to Move On - http://bit.ly/HnMMZ #oink #ag";;;#oink #ag;"5591932019";https://twitter.com/NPPC/status/5591932019
pbpost;2009-11-10 16:01;0;0;"Swine flu claims 9th Palm Beach County victim, a 70-year-old man. http://bit.ly/1ZScVw";;;;"5591929499";https://twitter.com/pbpost/status/5591929499
RomanianTimes;2009-11-10 16:01;0;0;"First football player diagnosed with swine flu http://bit.ly/4ov2Au";;;;"5591916760";https://twitter.com/RomanianTimes/status/5591916760
novelh1n1;2009-11-10 16:01;0;0;"http://novelh1n1.com Experts warn of swine flu wave - Wiener Zeitung: Experts warn of swine.. http://bit.ly/1Hts4U";;;;"5591916664";https://twitter.com/novelh1n1/status/5591916664
novelh1n1;2009-11-10 16:01;0;0;"http://novelh1n1.com NJ hospitals are urged to halt kid visits to stem spread of swine flu .. http://bit.ly/17kWrI";;;;"5591914239";https://twitter.com/novelh1n1/status/5591914239
lordredrock;2009-11-10 16:00;0;0;"FACTBOX-Measures to fight H1N1 swine flu in Europe: Nov 10 (Reuters) - Here are some details about measures tak.. http://bit.ly/3B99VE";;;;"5591909977";https://twitter.com/lordredrock/status/5591909977
lordredrock;2009-11-10 16:00;0;0;"Swine Flu Outbreak In Ukraine Claims 144 Lives: Reports say that over 1 million people in the country have H1N1.. http://bit.ly/teQK8";;;;"5591907360";https://twitter.com/lordredrock/status/5591907360
MyDesert;2009-11-10 16:00;0;0;"Local swine flu deaths on the rise: http://bit.ly/6MNKR";;;;"5591906493";https://twitter.com/MyDesert/status/5591906493
SwisherLohseRX;2009-11-10 16:00;0;0;"Swine Flu What me worry? Check this out! http://tiny.cc/Swinedef http://bit.ly/WMDiJ";;;;"5591897641";https://twitter.com/SwisherLohseRX/status/5591897641
Jacklyn_222;2009-11-10 16:00;0;0;"FACTBOX-Measures to fight H1N1 swine flu in Europe http://tinyurl.com/yclph8x";;;;"5591897529";https://twitter.com/Jacklyn_222/status/5591897529
Jacklyn_222;2009-11-10 16:00;0;0;"Swine Flu Outbreak In Ukraine Claims 144 Lives http://tinyurl.com/ybq4txd";;;;"5591895618";https://twitter.com/Jacklyn_222/status/5591895618
SwineFlu_news;2009-11-10 16:00;0;0;"Pens head to Boston hoping to avoid third straight defeat http://t.love.com/269333526";;;;"5591885590";https://twitter.com/SwineFlu_news/status/5591885590
AviationAnswers;2009-11-10 16:00;0;0;"Swine flu challenges airlines - Tampa Tribune http://bit.ly/1bvpJp";;;;"5591884417";https://twitter.com/AviationAnswers/status/5591884417
knowmorestuff;2009-11-10 15:59;0;0;"Video: Woman kicked off flight over swine flu fear (NBC 13 Birmingham)|Woman kicked off flight over swine flu fear .. http://oohja.com/x1Y4a";;;;"5591869775";https://twitter.com/knowmorestuff/status/5591869775
Direct2UPC;2009-11-10 15:58;0;0;"Who All is Going? http://caltweet.com/kp - Ultimate Swine Flu Mask available now.... <-- (Please RT)";;;;"5591833356";https://twitter.com/Direct2UPC/status/5591833356
norburylaw;2009-11-10 15:57;0;0;"RT @MiaDebtAttorney : Embattled pork producer files for bankruptcy http://bit.ly/1fgpzi || Blames swine flu , not bad business practices.";;@MiaDebtAttorney;;"5591831602";https://twitter.com/norburylaw/status/5591831602
SwineFluNewsORG;2009-11-10 15:57;0;0;"Flu vaccines accessible in East St. Louis, Fairmount City http://tinyurl.com/yd2457k #swineflu #crisis";;;#swineflu #crisis;"5591825469";https://twitter.com/SwineFluNewsORG/status/5591825469
chloetrammel;2009-11-10 15:57;0;0;"might be getting swine flu . noooooooooooooooooooooooooooooooooooooooooooooooooooooooooooooooooooo oooooooooooooooooooooooooo ooooooooo";;;;"5591821463";https://twitter.com/chloetrammel/status/5591821463
vintisingh;2009-11-10 15:56;0;0;"Watch the video I made on Immaculate High students and staff talking about swine flu : http://bit.ly/220vMt";;;;"5591804792";https://twitter.com/vintisingh/status/5591804792
myneurotica;2009-11-10 15:56;0;0;"RT @SwineFluHQ 'Senator proposes paid sick leave for swine flu (Reuters via Yahoo! News).. http://bit.ly/21TXjA #h1n1 '";;@SwineFluHQ;#h1n1;"5591801918";https://twitter.com/myneurotica/status/5591801918
McCann_WW;2009-11-10 15:56;0;0;"Strange coincidence: Go to NYT.com home page. On right, story about intelligence of pigs. Directly beneath, story about swine flu vaccine.";;;;"5591792978";https://twitter.com/McCann_WW/status/5591792978
weeddude;2009-11-10 15:56;0;0;"Rumor has it Miss Piggy did not attend todays anniversary events celebrating the 40th of Bert and Ernie because of potential swine flu .";;;;"5591790663";https://twitter.com/weeddude/status/5591790663
SwineFluHeds;2009-11-10 15:56;0;0;"Burlington (VT) WCAX: Officials say H1N1 linked to adult's death . More #Swine Flu #news - http://tinyurl.com/lwe3fk";;;#Swine #news;"5591785949";https://twitter.com/SwineFluHeds/status/5591785949
armgate;2009-11-10 15:56;0;0;"Confirmed or not swine-flu in Armenia: see in a month - Aysor http://bit.ly/2qi4Lf";;;;"5591784025";https://twitter.com/armgate/status/5591784025
live_h1n1;2009-11-10 15:55;0;0;"RT @Reuters_FluNews: FACTBOX-Measures to fight H1N1 swine flu in Europe http://link.reuters.com/waq78f";;@Reuters_FluNews;;"5591765670";https://twitter.com/live_h1n1/status/5591765670
fire_fighter;2009-11-10 15:55;0;0;"Almost 24 hours after swine flu shot. I´m free of side effects. Only a little pain in the arm, where the doc put the injection";;;;"5591760045";https://twitter.com/fire_fighter/status/5591760045
prometheusbks;2009-11-10 15:54;0;0;"RT @PregnancyMyths: Should you get the swine flu vaccine when pregnant? http://bit.ly/3gd5dz very tough question and powerful myths involved";;@PregnancyMyths;;"5591754636";https://twitter.com/prometheusbks/status/5591754636
MikeyThreads;2009-11-10 15:54;0;0;"my teacher is makeing us watch swine flu girl";;;;"5591749230";https://twitter.com/MikeyThreads/status/5591749230
ped_consultants;2009-11-10 15:54;0;0;"Swine Flu Vaccine Program Expanded in Memphis and Shelby County myEyewitnessNews.com http://shar.es/akIuy";;;;"5591746622";https://twitter.com/ped_consultants/status/5591746622
Dilsdale;2009-11-10 15:54;0;0;"RT @ocreggie 8 O.C. adults died of swine flu last week > http://bit.ly/3wdd1M";;@ocreggie;;"5591741922";https://twitter.com/Dilsdale/status/5591741922
WVTM13;2009-11-10 15:53;0;0;"Video: Woman kicked off flight over swine flu fear: Woman kicked off flight over swine flu fear http://bit.ly/BfkGS";;;;"5591721280";https://twitter.com/WVTM13/status/5591721280
NewsTimes;2009-11-10 15:53;0;0;"VIDEO: Immaculate High students and staff talk about swine flu http://bit.ly/220vMt";;;;"5591717973";https://twitter.com/NewsTimes/status/5591717973
reutersfeed;2009-11-10 15:53;0;0;"U.S. #news Senator proposes paid sick leave for swine flu #reuters http://bit.ly/1Wfyyr";;;#news #reuters;"5591714511";https://twitter.com/reutersfeed/status/5591714511
zzdrfred;2009-11-10 15:53;0;0;"#RUS Senator proposes paid sick leave for swine flu : WASHINGTON (Reuters) - Americans infected by the H1N1 flu virus... http://bit.ly/4bndND";;;#RUS;"5591712176";https://twitter.com/zzdrfred/status/5591712176
filterednews;2009-11-10 15:52;0;0;""Asthma patients top swine flu admissions - Latest News, Health - Independent.ie" ( http://bit.ly/3XAmYq )";;;;"5591705323";https://twitter.com/filterednews/status/5591705323
jaytsend;2009-11-10 15:52;0;0;"Psychology Degree: Warning! Truth Behide Swine Flu ! ~ Do Not Take Vaccines! ~ http://bit.ly/1C8FUT";;;;"5591701150";https://twitter.com/jaytsend/status/5591701150
Lexbubble1;2009-11-10 15:52;0;0;"Everyone pray for my best friend @young6 . He really isn't feeling well. Pray he gets better and it isn't the swine flu ♡";;@young6;;"5591693424";https://twitter.com/Lexbubble1/status/5591693424
TM_Healthcare;2009-11-10 15:52;0;0;"Swine flu bed pressure on hospitals revealed | Healthcare Republic http://retwt.me/1KsyF (via @HealthcareRep )";;@HealthcareRep;;"5591684674";https://twitter.com/TM_Healthcare/status/5591684674
TM_Outbreak;2009-11-10 15:51;0;0;"Senator proposes paid sick leave for swine flu | U.S.| Reuters http://retwt.me/1Ksyz (via @Newstwytter )";;@Newstwytter;;"5591680145";https://twitter.com/TM_Outbreak/status/5591680145
vipullimbachiya;2009-11-10 15:51;0;0;"♫ A Pig fell in love with a Hen - One day they kissed each other - Next Day Pig died of bird flu and the Hen died of swine flu";;;;"5591678986";https://twitter.com/vipullimbachiya/status/5591678986
swinefluh1n1;2009-11-10 15:51;0;0;""H1N1 Vaccine Clinics Are by Appointment" http://tinyurl.com/yef5kch #swineflu #H1N1";;;#swineflu #H1N1;"5591672673";https://twitter.com/swinefluh1n1/status/5591672673
nandugite;2009-11-10 15:51;0;0;"down by flu ....errrrrrrrrrr not swine flu ...just the common one.. so has to cancel the SMM india conference hope can catch last session";;;;"5591672363";https://twitter.com/nandugite/status/5591672363
RecipesLovers;2009-11-10 15:51;0;0;"H1N1: Food workers should go to front of swine flu line: The Centers for Disease Control and the Pierce County .. http://bit.ly/3Ps6Zu";;;;"5591671414";https://twitter.com/RecipesLovers/status/5591671414
EvitaOchel;2009-11-10 15:51;0;0;"Canada is taking bold steps in changing its swine flu policy, find out why from @Mercola http://bit.ly/q5L21";;@Mercola;;"5591671187";https://twitter.com/EvitaOchel/status/5591671187
s_severin;2009-11-10 15:50;0;0;"Children Sick After Swine Flu Vaccine: myfoxny.com COM - Three children from PS 124 in Queens were take to the .. http://bit.ly/hdpCn";;;;"5591659046";https://twitter.com/s_severin/status/5591659046
SUPERDAVE009;2009-11-10 15:50;0;0;"Swine Flu Outbreak In Ukraine Claims 144 Lives http://tinyurl.com/y86o6hm";;;;"5591643512";https://twitter.com/SUPERDAVE009/status/5591643512
infinitamy;2009-11-10 15:50;0;0;"...away from me, nearer to the wall and then my friend started yelling: "Oh my God, you have SWINE FLU !" and I was pissed because I don't...";;;;"5591642827";https://twitter.com/infinitamy/status/5591642827
21daybodymakeov;2009-11-10 15:50;0;1;"TRUTH Swine flu stats vs regular fludeficiencies- Zn, vitD. coconut oil and its anti-viral properties Sugar and the... http://bit.ly/5cxg9";;;;"5591640016";https://twitter.com/21daybodymakeov/status/5591640016
swinefluh1n1;2009-11-10 15:50;0;0;""3 more La. deaths blamed on flu" http://tinyurl.com/yapcszm #swineflu #H1N1";;;#swineflu #H1N1;"5591638493";https://twitter.com/swinefluh1n1/status/5591638493
swinefluh1n1;2009-11-10 15:50;0;0;""QIAGEN Reports Strong Third Quarter 2009 Results" http://tinyurl.com/ydyzxb8 #swineflu #H1N1";;;#swineflu #H1N1;"5591638077";https://twitter.com/swinefluh1n1/status/5591638077
swinefluh1n1;2009-11-10 15:50;0;0;""Experts predict swine flu 's return as 84000 new cases are reported" http://tinyurl.com/yckd58p #swineflu #H1N1";;;#swineflu #H1N1;"5591638008";https://twitter.com/swinefluh1n1/status/5591638008
girlfridayclean;2009-11-10 15:50;0;0;"G O O D Morning 2 all of u in tweet world! miss ya been sick with the swine flu yuk!! bad bad stuff better now though! yeah i see the light";;;;"5591637792";https://twitter.com/girlfridayclean/status/5591637792
SwineFluNewsORG;2009-11-10 15:50;0;0;"Swine flu deaths climb to 38; asthmatics warned http://tinyurl.com/ykbyfkg #swineflu #flu";;;#swineflu #flu;"5591636920";https://twitter.com/SwineFluNewsORG/status/5591636920
Pistacia;2009-11-10 15:50;0;0;"that's one way to protest the swine flu , kinda chilly though http://www.kyivpost.com/gallery/album/615/photo/13/";;;;"5591635877";https://twitter.com/Pistacia/status/5591635877
dougdanger;2009-11-10 15:49;0;0;"SWINE FLU ! RT @NHLBruins Michael Ryder, feeling "under the weather," is on the ice for morning skate.^BISH (via @HBAdventure via @hubhockey )";;@NHLBruins @HBAdventure @hubhockey;;"5591620391";https://twitter.com/dougdanger/status/5591620391
DrJudyStone;2009-11-10 15:49;0;0;"Sherwood: #Swine Flu Vaccine: Why You Should Stop Worrying and Roll Up Your Sleeve http://snipurl.com/t62ba";;;#Swine;"5591616760";https://twitter.com/DrJudyStone/status/5591616760
wfleurant;2009-11-10 15:48;0;0;"Tommy Haas Recovering from Swine Flu :: The Tennis Rackets - http://tinyurl.com/yccgche";;;;"5591600210";https://twitter.com/wfleurant/status/5591600210
1010WINS;2009-11-10 15:48;0;0;"EXTRAS: Officials Say Swine Flu Linked to Upstate Death http://bit.ly/3Gzxl5";;;;"5591595652";https://twitter.com/1010WINS/status/5591595652
Ericajohn1;2009-11-10 15:48;0;0;"FACTBOX-Measures to fight H1N1 swine flu in Europe: ... programme from Oct. 21 for high-risk patient groups inc.. http://bit.ly/4bsnZN";;;;"5591593265";https://twitter.com/Ericajohn1/status/5591593265
DokterBart;2009-11-10 15:48;0;0;"Do you want some cheap medication against the swine flu ? http://bit.ly/curetheswineflu";;;;"5591591139";https://twitter.com/DokterBart/status/5591591139
JonKeel;2009-11-10 15:48;0;0;"Iowa has had 500 hospitalized from the #Swine_Flu and now 16 deaths http://bit.ly/3VT33g";;;#Swine_Flu;"5591588167";https://twitter.com/JonKeel/status/5591588167
pandemicflublog;2009-11-10 15:47;0;0;"P1C1 - The other Swine Flu Virus http%3A%2F%2Fwww.pandemicflublog.info%2F2009%2F11%2F10%2Fp1c1-the-other- swine-flu -virus%2F";;;;"5591574166";https://twitter.com/pandemicflublog/status/5591574166
PharmacyGuru;2009-11-10 15:47;0;0;"FACTBOX-Measures to fight H1N1 swine flu in Europe http://bit.ly/3B99VE";;;;"5591569573";https://twitter.com/PharmacyGuru/status/5591569573
ahrcanum;2009-11-10 15:47;0;0;"How to make your own H1N1 Swine Flu Vaccine, Satire Video Funny http://wp.me/paBV0-AL";;;;"5591565931";https://twitter.com/ahrcanum/status/5591565931
AidResources;2009-11-10 15:46;0;0;"Ukrainian Leaders Say Swine Flu Under Control http://bit.ly/4qBlAK";;;;"5591559708";https://twitter.com/AidResources/status/5591559708
