username;date;retweets;favorites;text;geo;mentions;hashtags;id;permalink
SwineFluNewsIE;2009-07-09 08:11;0;0;"Swine flu upon a increase http://tinyurl.com/mj2mvy #swineflu #h1n1";;;#swineflu #h1n1;"2547405093";https://twitter.com/SwineFluNewsIE/status/2547405093
SwineFluNewsSG;2009-07-09 08:11;0;0;"Swine flu cases climb to 20 http://tinyurl.com/lokhfw #swineflu #h1n1";;;#swineflu #h1n1;"2547404911";https://twitter.com/SwineFluNewsSG/status/2547404911
SwineFluNewsEU;2009-07-09 08:08;0;0;"Potter actress tells of swine flu fright in Britain http://tinyurl.com/n6gsbd #swineflu #h1n1";;;#swineflu #h1n1;"2547379393";https://twitter.com/SwineFluNewsEU/status/2547379393
peterosbornuk;2009-07-09 08:06;0;0;"Many are preoccupied by H1N1 data but a picture of the information & trends is much more useful http://tinyurl.com/cgoc47 #swineflu #h1n1";;;#swineflu #h1n1;"2547369151";https://twitter.com/peterosbornuk/status/2547369151
SwineFluNewsIN;2009-07-09 08:06;0;0;"50 Alam Trainees Affected By Influenza-like Illness http://tinyurl.com/m5egfp #swineflu #h1n1";;;#swineflu #h1n1;"2547367645";https://twitter.com/SwineFluNewsIN/status/2547367645
peterosbornuk;2009-07-09 08:05;0;0;"9 graphs and a statistics dashboard that give a complete overview of H1N1 across the globe http://tinyurl.com/cgoc47 #swineflu #h1n1";;;#swineflu #h1n1;"2547361396";https://twitter.com/peterosbornuk/status/2547361396
SwineFluNewsCA;2009-07-09 08:05;0;0;"Best Medicine For Cold And Flu http://tinyurl.com/r4l4cx #swineflu #h1n1";;;#swineflu #h1n1;"2547358068";https://twitter.com/SwineFluNewsCA/status/2547358068
SwineFluNewsPH;2009-07-09 08:04;0;0;"Health officials plunge into swine flu as cases spread http://tinyurl.com/md4rp3 #swineflu #h1n1";;;#swineflu #h1n1;"2547352770";https://twitter.com/SwineFluNewsPH/status/2547352770
SwineFluNewsIE;2009-07-09 08:04;0;0;"Swine Flu Illinois News http://tinyurl.com/o7y5lq #swineflu #h1n1";;;#swineflu #h1n1;"2547352615";https://twitter.com/SwineFluNewsIE/status/2547352615
swineflu_news_;2009-07-09 08:02;0;0;"Pupils reject healthy school meals: Four years after Jamie Oliver's campaign to get better foods into schools, m.. http://tinyurl.com/n4u29t";;;;"2547332979";https://twitter.com/swineflu_news_/status/2547332979
SwineFluNewsCA;2009-07-09 08:02;0;0;"Swine flu pathogen unpredictable, experts warn http://tinyurl.com/nc4dpk #swineflu #h1n1";;;#swineflu #h1n1;"2547331516";https://twitter.com/SwineFluNewsCA/status/2547331516
peterosbornuk;2009-07-09 08:02;0;0;"There's already visible evidence showing of case under-reporting - see left summary graph at http://tinyurl.com/cgoc47 #swineflu #h1n1";;;#swineflu #h1n1;"2547331514";https://twitter.com/peterosbornuk/status/2547331514
SwineFluNewsUSA;2009-07-09 08:01;0;0;"More swine flu cases confirmed http://tinyurl.com/lv8kd4 #swineflu #h1n1";;;#swineflu #h1n1;"2547322558";https://twitter.com/SwineFluNewsUSA/status/2547322558
SwineFluNewsORG;2009-07-09 08:00;0;0;"All 4 cases of Swine Flu upon Guam reportedly done full recoveries http://tinyurl.com/lln9my #swineflu #h1n1";;;#swineflu #h1n1;"2547321917";https://twitter.com/SwineFluNewsORG/status/2547321917
SwineFlu_news;2009-07-09 08:00;0;0;"School closed after swine flu outbreak http://t.love.com/230332506";;;;"2547313768";https://twitter.com/SwineFlu_news/status/2547313768
SwineFluNewsHK;2009-07-09 07:58;0;0;"Tamiflu In Mexico http://tinyurl.com/pohn8n #swineflu #h1n1";;;#swineflu #h1n1;"2547302482";https://twitter.com/SwineFluNewsHK/status/2547302482
SwineFluNewsAU;2009-07-09 07:57;0;0;"WHO's advice: Just pretence it's swine flu http://tinyurl.com/mgxvq2 #swineflu #h1n1";;;#swineflu #h1n1;"2547291726";https://twitter.com/SwineFluNewsAU/status/2547291726
swineflu2;2009-07-09 07:53;0;0;"#swineflu Swine flu summit: Govt checks on state readiness - The Associated Press: New Zealand HeraldSw.. http://tinyurl.com/lgulsd";;;#swineflu;"2547264388";https://twitter.com/swineflu2/status/2547264388
st_swineflu;2009-07-09 07:52;0;0;"Worried about Swine Flu? (ChristmasCake@DigitalSpy) #swineflu http://p.boardtracker.com/1621397445";;@DigitalSpy;#swineflu;"2547259733";https://twitter.com/st_swineflu/status/2547259733
SwineFluNewsEU;2009-07-09 07:52;0;0;"Local news, continue and Georgia Bulldogs Sports for Athens GA http://tinyurl.com/l5thcd #swineflu #h1n1";;;#swineflu #h1n1;"2547256191";https://twitter.com/SwineFluNewsEU/status/2547256191
SwineFluNewsHK;2009-07-09 07:51;0;0;"Norwich family's China swine flu ordeal http://tinyurl.com/kr8w28 #swineflu #h1n1";;;#swineflu #h1n1;"2547249730";https://twitter.com/SwineFluNewsHK/status/2547249730
lorenhakeney;2009-07-09 07:47;0;0;"Godddd, im so gunna get swineflu";;;;"2547216907";https://twitter.com/lorenhakeney/status/2547216907
SwineFluNewsCA;2009-07-09 07:46;0;0;"Health Canada, FDA advise of swine flu scams http://tinyurl.com/ng7jwx #swineflu #h1n1";;;#swineflu #h1n1;"2547212674";https://twitter.com/SwineFluNewsCA/status/2547212674
SwineFluNewsIE;2009-07-09 07:46;0;0;"Swine-flu be concerned as dual some-more get virus http://tinyurl.com/ltl33h #swineflu #h1n1";;;#swineflu #h1n1;"2547212447";https://twitter.com/SwineFluNewsIE/status/2547212447
Swine__Flu;2009-07-09 07:46;0;0;"#SwineFlu SNAP ANALYSIS-New Canadian swine virus may be dead-end http://tinyurl.com/mqdbn2";;;#SwineFlu;"2547210395";https://twitter.com/Swine__Flu/status/2547210395
SwineFlu_news;2009-07-09 07:45;0;0;"'I want answers' - Mother seeks closure after son's swine flu death http://t.love.com/230327884";;;;"2547198895";https://twitter.com/SwineFlu_news/status/2547198895
SwineFluNewsIN;2009-07-09 07:42;0;0;"India's swine flu sum reaches 158 http://tinyurl.com/n7d5zv #swineflu #h1n1";;;#swineflu #h1n1;"2547180071";https://twitter.com/SwineFluNewsIN/status/2547180071
SwineFluNewsPH;2009-07-09 07:40;0;0;"Worldwide widespread of H1N1 flu http://tinyurl.com/musutj #swineflu #h1n1";;;#swineflu #h1n1;"2547164895";https://twitter.com/SwineFluNewsPH/status/2547164895
SwineFluNewsAU;2009-07-09 07:40;0;0;"As H1N1 Alert At Phase 6, Sharjah Launches Awareness Campaign http://tinyurl.com/lapdp3 #swineflu #h1n1";;;#swineflu #h1n1;"2547161721";https://twitter.com/SwineFluNewsAU/status/2547161721
SwineFluNewsORG;2009-07-09 07:38;0;0;"- Guam to experience in swine flu summit http://tinyurl.com/mtw8nf #swineflu #h1n1";;;#swineflu #h1n1;"2547144951";https://twitter.com/SwineFluNewsORG/status/2547144951
Kemmitt;2009-07-09 07:37;0;0;"Mexican Swineflu cases still doubling worldwide every 2 weeks. I still say there will be mayhem by October.";;;;"2547141368";https://twitter.com/Kemmitt/status/2547141368
SwineFluNewsEU;2009-07-09 07:36;0;0;"Thais try to captivate tourists with mega bargains http://tinyurl.com/msyedj #swineflu #h1n1";;;#swineflu #h1n1;"2547129291";https://twitter.com/SwineFluNewsEU/status/2547129291
swineflu_news_;2009-07-09 07:31;0;0;"'Potter' star recovers from swine flu: "Harry Potter" star Rupert Grint attended Tuesday's.. http://bit.ly/W7k9h";;;;"2547090143";https://twitter.com/swineflu_news_/status/2547090143
swineflu_news_;2009-07-09 07:31;0;0;"Swine flu: WHO to seek curbs on testing as Tamiflu resistance emerges: Within the next few days, the WHO will su.. http://bit.ly/CVo02";;;;"2547087637";https://twitter.com/swineflu_news_/status/2547087637
SwineFluNewsCA;2009-07-09 07:30;0;0;"Swine flu pathogen unpredictable, experts warn http://tinyurl.com/nc4dpk #swineflu #h1n1";;;#swineflu #h1n1;"2547078365";https://twitter.com/SwineFluNewsCA/status/2547078365
SwineFlu_news;2009-07-09 07:30;0;0;"Health talk on H1N1 virus at UBD http://t.love.com/230318479";;;;"2547077755";https://twitter.com/SwineFlu_news/status/2547077755
SwineFlu_Expert;2009-07-09 07:28;0;0;"Check it out >> Swine Flu Death; Adams Morgan Death; Man Charged in Killing ...: In June, a.. http://bit.ly/3iMMs0";;;;"2547065937";https://twitter.com/SwineFlu_Expert/status/2547065937
SwineFluNewsNZ;2009-07-09 07:28;0;0;"Swine flu fee rises ? giveaway flu vaccine lengthened to all http://tinyurl.com/ngdvht #swineflu #h1n1";;;#swineflu #h1n1;"2547064406";https://twitter.com/SwineFluNewsNZ/status/2547064406
SwineFluNewsUSA;2009-07-09 07:28;0;0;"Thai flu fears mountain among Phuket death http://tinyurl.com/nngyhh #swineflu #h1n1";;;#swineflu #h1n1;"2547063855";https://twitter.com/SwineFluNewsUSA/status/2547063855
CatYong88;2009-07-09 07:28;0;0;"RT @jonrussell The Thai government is covering up #swineflu deaths as hospitals have blundered and run out of vaccinations already- ??";;@jonrussell;#swineflu;"2547062586";https://twitter.com/CatYong88/status/2547062586
swineflu_tips;2009-07-09 07:27;0;0;"Swine Flu 140 Cases in Maine: Maine's swine flu tally now stands at 141.  The Maine Center for Disease Cont.. http://tinyurl.com/nb4f2a";;;;"2547058650";https://twitter.com/swineflu_tips/status/2547058650
swineflu_tips;2009-07-09 07:27;0;0;"First women died by swine flu: The H1N1 virus, commonly known as the swine flu, claimed its first victim in Stan.. http://tinyurl.com/lqo9uj";;;;"2547058380";https://twitter.com/swineflu_tips/status/2547058380
SwineFluNewsORG;2009-07-09 07:27;0;0;"Norwich family's China swine flu ordeal http://tinyurl.com/kv32tc #swineflu #h1n1";;;#swineflu #h1n1;"2547056100";https://twitter.com/SwineFluNewsORG/status/2547056100
SwineFluNewsHK;2009-07-09 07:25;0;0;"Swine flu a risk to HIV/Aids patients http://tinyurl.com/ml2kq6 #swineflu #h1n1";;;#swineflu #h1n1;"2547038266";https://twitter.com/SwineFluNewsHK/status/2547038266
SwineFluNewsAU;2009-07-09 07:24;0;0;"Experts plead measures to quarrel swine flu http://tinyurl.com/osou57 #swineflu #h1n1";;;#swineflu #h1n1;"2547031231";https://twitter.com/SwineFluNewsAU/status/2547031231
swineflu2;2009-07-09 07:24;0;0;"#swineflu 'Potter' star recovers from swine flu - Chicago Tribune: BBC News'Potter' sta.. http://tinyurl.com/nffycv";;;#swineflu;"2547030730";https://twitter.com/swineflu2/status/2547030730
swineflu2;2009-07-09 07:24;0;0;"#swineflu Swine flu: WHO to seek curbs on testing as Tamiflu resistance emerges - Chicago Tribune: Stra.. http://tinyurl.com/m8mxqj";;;#swineflu;"2547030487";https://twitter.com/swineflu2/status/2547030487
ChristianNurse;2009-07-09 07:20;0;0;"RT: @SwineFluNewsGB : United Kingdom outlines fifth swine flu death http://tinyurl.com/nx6sgl #swineflu #h1n1";;@SwineFluNewsGB;#swineflu #h1n1;"2547002804";https://twitter.com/ChristianNurse/status/2547002804
SwineFluNewsEU;2009-07-09 07:20;0;0;"Bulgaria receiving medicine measures opposite swine flu http://tinyurl.com/l9vnhs #swineflu #h1n1";;;#swineflu #h1n1;"2547001412";https://twitter.com/SwineFluNewsEU/status/2547001412
SwineFluNewsIN;2009-07-09 07:19;0;0;"50 Alam Trainees Affected By Influenza-like Illness http://tinyurl.com/m5egfp #swineflu #h1n1";;;#swineflu #h1n1;"2546990747";https://twitter.com/SwineFluNewsIN/status/2546990747
SwineFluNewsPH;2009-07-09 07:17;0;0;"Thailand reports 2 some-more swine flu-related deaths http://tinyurl.com/lozla3 #swineflu #h1n1";;;#swineflu #h1n1;"2546968935";https://twitter.com/SwineFluNewsPH/status/2546968935
SwineFluNewsORG;2009-07-09 07:16;0;0;"Swine Flu closes summer stay in Wisconsin Dells http://tinyurl.com/llt86c #swineflu #h1n1";;;#swineflu #h1n1;"2546968752";https://twitter.com/SwineFluNewsORG/status/2546968752
SwineFlu_news;2009-07-09 07:15;0;0;"Puea Thai wants Witthaya removed http://t.love.com/230319542";;;;"2546951755";https://twitter.com/SwineFlu_news/status/2546951755
SwineFluNewsCA;2009-07-09 07:14;0;0;"Local news, continue and Georgia Bulldogs Sports for Athens GA http://tinyurl.com/nddn6j #swineflu #h1n1";;;#swineflu #h1n1;"2546948681";https://twitter.com/SwineFluNewsCA/status/2546948681
SwineFluNewsPH;2009-07-09 07:14;0;0;"Tamiflu In Mexico http://tinyurl.com/pohn8n #swineflu #h1n1";;;#swineflu #h1n1;"2546948336";https://twitter.com/SwineFluNewsPH/status/2546948336
SwineFluNewsUSA;2009-07-09 07:12;0;0;"Health Canada, FDA upon track for swine flu scams http://tinyurl.com/msvslv #swineflu #h1n1";;;#swineflu #h1n1;"2546933715";https://twitter.com/SwineFluNewsUSA/status/2546933715
st_swineflu;2009-07-09 07:11;0;0;"Swine Flu Strep Throat Sinus Infection and Solutions (sneezer@Mens Health) #swineflu http://p.boardtracker.com/1621354749";;@Mens;#swineflu;"2546922717";https://twitter.com/st_swineflu/status/2546922717
SwineFluNewsAU;2009-07-09 07:08;0;0;"Swine flu right divided 'dominant' strain http://tinyurl.com/kkloqz #swineflu #h1n1";;;#swineflu #h1n1;"2546897453";https://twitter.com/SwineFluNewsAU/status/2546897453
SwineFluNewsORG;2009-07-09 07:07;0;0;"Mob male dies of swine flu http://tinyurl.com/mavjgv #swineflu #h1n1";;;#swineflu #h1n1;"2546885218";https://twitter.com/SwineFluNewsORG/status/2546885218
SwineFluNewsNZ;2009-07-09 07:07;0;0;"Swine flu death fee rises to five http://tinyurl.com/kkz25x #swineflu #h1n1";;;#swineflu #h1n1;"2546885058";https://twitter.com/SwineFluNewsNZ/status/2546885058
fly401;2009-07-09 07:05;0;0;"@ireckon no :( had a packet of chocolate tho - but going home to a bath i think - at least its not swineflu";;@ireckon;;"2546874062";https://twitter.com/fly401/status/2546874062
SwineFluNewsHK;2009-07-09 07:01;0;0;"Infectious mildew experts speak swine flu in Toronto http://tinyurl.com/mrx772 #swineflu #h1n1";;;#swineflu #h1n1;"2546830611";https://twitter.com/SwineFluNewsHK/status/2546830611
SwineFlu_news;2009-07-09 07:00;0;0;"Belait Enforcement Unit spearheads cleanliness operation http://t.love.com/230318527";;;;"2546819570";https://twitter.com/SwineFlu_news/status/2546819570
FU4ChildRights;2009-07-09 06:58;0;1;"RT @juliancain Jane Burgermeister: Interview on Swine Flu Depopulation http://bit.ly/gn5wN #tyranny #swineflu #eugenics #all #NWO #liberty";;@juliancain;#tyranny #swineflu #eugenics #all #NWO #liberty;"2546808813";https://twitter.com/FU4ChildRights/status/2546808813
SwineFluNewsIE;2009-07-09 06:57;0;0;"Health News: Swine flu vaccinations to cover all of Scotland could be 18 months away http://tinyurl.com/nu53u6 #swineflu #h1n1";;;#swineflu #h1n1;"2546799983";https://twitter.com/SwineFluNewsIE/status/2546799983
SwineFluNewsSG;2009-07-09 06:57;0;0;"Swine Flu Fatality Rate May Be Smaller Than Earlier Estimated, Study Says http://tinyurl.com/putxse #swineflu #h1n1";;;#swineflu #h1n1;"2546793917";https://twitter.com/SwineFluNewsSG/status/2546793917
SwineFluNewsUSA;2009-07-09 06:56;0;0;"Thai flu fears mountain among Phuket death http://tinyurl.com/nngyhh #swineflu #h1n1";;;#swineflu #h1n1;"2546786022";https://twitter.com/SwineFluNewsUSA/status/2546786022
SwineFluNewsIN;2009-07-09 06:54;0;0;"Swine flu screening of India-bound passengers a non-starter http://tinyurl.com/ku5o7b #swineflu #h1n1";;;#swineflu #h1n1;"2546771455";https://twitter.com/SwineFluNewsIN/status/2546771455
SwineFluNewsORG;2009-07-09 06:54;0;0;"Camden County lady dies of swine flu http://tinyurl.com/na7yow #swineflu #h1n1";;;#swineflu #h1n1;"2546768529";https://twitter.com/SwineFluNewsORG/status/2546768529
SwineFluNewsAU;2009-07-09 06:54;0;0;"Best Flu Medicines http://tinyurl.com/r4l4cx #swineflu #h1n1";;;#swineflu #h1n1;"2546767632";https://twitter.com/SwineFluNewsAU/status/2546767632
SwineFluNewsPH;2009-07-09 06:52;0;0;"Health officials plunge into swine flu as cases spread http://tinyurl.com/md4rp3 #swineflu #h1n1";;;#swineflu #h1n1;"2546754056";https://twitter.com/SwineFluNewsPH/status/2546754056
SwineFluNewsAU;2009-07-09 06:52;0;0;"Novel Influenza A (H1N1) 09 Swine Flu - Update 99 http://tinyurl.com/nu7upe #swineflu #h1n1";;;#swineflu #h1n1;"2546751887";https://twitter.com/SwineFluNewsAU/status/2546751887
swinefluupdated;2009-07-09 06:51;0;0;"Influenza A (H1N1) - worldwide (84): Tamiflu resistance, China (HK) #swineflu http://tinyurl.com/nesmuc";;;#swineflu;"2546743784";https://twitter.com/swinefluupdated/status/2546743784
swinefluupdated;2009-07-09 06:51;0;0;"Influenza A (H1N1) - worldwide (86): official nomenclature #swineflu http://tinyurl.com/lkdlxm";;;#swineflu;"2546741637";https://twitter.com/swinefluupdated/status/2546741637
H1N1swineflu;2009-07-09 06:48;0;0;"#swineflu Chen Qi |The World of Micro-Organism | Virus | Swine flu | H5N1 ...: Medical News Today July .. http://tinyurl.com/lzd2et";;;#swineflu;"2546716617";https://twitter.com/H1N1swineflu/status/2546716617
SwineFluNewsEU;2009-07-09 06:47;0;0;"Global bonds tumble upon diseased mercantile outlook http://tinyurl.com/nhz5s6 #swineflu #h1n1";;;#swineflu #h1n1;"2546708628";https://twitter.com/SwineFluNewsEU/status/2546708628
SwineFlu_news;2009-07-09 06:45;0;0;"Swine flu: three more quarantined http://t.love.com/230313031";;;;"2546684476";https://twitter.com/SwineFlu_news/status/2546684476
varkens_griep;2009-07-09 06:44;0;0;"Engelse post / Rare Resistant Swine Flu Comes to SF http://tinyurl.com/mcn47t #swineflu ... http://tinyurl.com/nww5cp";;;#swineflu;"2546675120";https://twitter.com/varkens_griep/status/2546675120
SwineFluNewsORG;2009-07-09 06:43;0;0;"Fourth case of swine flu confirmed http://tinyurl.com/lng2hz #swineflu #h1n1";;;#swineflu #h1n1;"2546668702";https://twitter.com/SwineFluNewsORG/status/2546668702
SwineFluNewsCA;2009-07-09 06:42;0;0;"Health Canada, FDA upon track for swine flu scams http://tinyurl.com/mzrjsf #swineflu #h1n1";;;#swineflu #h1n1;"2546661498";https://twitter.com/SwineFluNewsCA/status/2546661498
SwineFluNewsNZ;2009-07-09 06:42;0;0;"Free flu vaccine for all http://tinyurl.com/nftlpg #swineflu #h1n1";;;#swineflu #h1n1;"2546660966";https://twitter.com/SwineFluNewsNZ/status/2546660966
SwineFluNewsUSA;2009-07-09 06:42;0;0;"Two some-more flu deaths in Minnesota http://tinyurl.com/kqfpud #swineflu #h1n1";;;#swineflu #h1n1;"2546660693";https://twitter.com/SwineFluNewsUSA/status/2546660693
swineflu_news_;2009-07-09 06:40;0;0;"frogblog » Samoan community shows leadership on swine flu: Mr Puni says the Otara promotion was a chance for swi.. http://bit.ly/YgagV";;;;"2546645567";https://twitter.com/swineflu_news_/status/2546645567
swineflu_news_;2009-07-09 06:40;0;0;"FREE MARKET FAIRY TALES: Swine flu (again), stupid news reports ...: Three more people in Britain have died afte.. http://bit.ly/fxKOq";;;;"2546645039";https://twitter.com/swineflu_news_/status/2546645039
SwineFluNewsEU;2009-07-09 06:39;0;0;"Tamiflu In Mexico http://tinyurl.com/pohn8n #swineflu #h1n1";;;#swineflu #h1n1;"2546632085";https://twitter.com/SwineFluNewsEU/status/2546632085
Boatnoy;2009-07-09 06:37;0;0;"RT @jonrussell :The Thai government is covering up #swineflu deaths as hospitals run out of vaccinations already < This is what I'm afraid of";;@jonrussell;#swineflu;"2546617856";https://twitter.com/Boatnoy/status/2546617856
SwineFluNewsHK;2009-07-09 06:37;0;0;"Tamiflu-Resistant Swine Flu in U.S.? http://tinyurl.com/mgn9de #swineflu #h1n1";;;#swineflu #h1n1;"2546614129";https://twitter.com/SwineFluNewsHK/status/2546614129
SwineFluNewsAU;2009-07-09 06:36;0;0;"Swine flu investigate since $7m investigate grants http://tinyurl.com/lvjuxs #swineflu #h1n1";;;#swineflu #h1n1;"2546607990";https://twitter.com/SwineFluNewsAU/status/2546607990
SwineFluNewsIE;2009-07-09 06:35;0;0;"Swine-flu be concerned as dual some-more get virus http://tinyurl.com/ltl33h #swineflu #h1n1";;;#swineflu #h1n1;"2546599567";https://twitter.com/SwineFluNewsIE/status/2546599567
jonrussell;2009-07-09 06:35;0;0;"The Thai government is covering up #swineflu deaths as hospitals have blundered and run out of vaccinations already";;;#swineflu;"2546595811";https://twitter.com/jonrussell/status/2546595811
st_swineflu;2009-07-09 06:34;0;0;"... insurance to cover Swine Flu/Pandemics? ... (wife-spent-it-all@Money Saving Expert) #swineflu http://p.boardtracker.com/1621271174";;@Money;#swineflu;"2546581562";https://twitter.com/st_swineflu/status/2546581562
SwineFluNewsSG;2009-07-09 06:33;0;0;"Swine flu cases climb to 20 http://tinyurl.com/lokhfw #swineflu #h1n1";;;#swineflu #h1n1;"2546576750";https://twitter.com/SwineFluNewsSG/status/2546576750
SwineFluNewsORG;2009-07-09 06:32;0;0;"Calif. students quarantined in Japan for swine flu http://tinyurl.com/msk8vk #swineflu #h1n1";;;#swineflu #h1n1;"2546565466";https://twitter.com/SwineFluNewsORG/status/2546565466
SwineFluNZ;2009-07-09 06:32;0;0;"Novel Influenza A (H1N1) 09 Swine Flu - Update 100: New Zealand's confirmed number of deaths fro.. http://nzne.ws/nF #swineflu #H1N1";;;#swineflu #H1N1;"2546562807";https://twitter.com/SwineFluNZ/status/2546562807
SwineFlu_news;2009-07-09 06:30;0;0;"Courteney Cox Insists Her Marriage Has Never Been Better http://t.love.com/230310306";;;;"2546541721";https://twitter.com/SwineFlu_news/status/2546541721
HustlHer_Inc;2009-07-09 06:29;0;0;"@iamhaitianfresh good choice dont want u gettin da swineflu";;@iamhaitianfresh;;"2546531905";https://twitter.com/HustlHer_Inc/status/2546531905
SwineFluNewsPH;2009-07-09 06:28;0;0;"Swine flu outbreak in SA is 'mild infection' http://tinyurl.com/mazm9g #swineflu #h1n1";;;#swineflu #h1n1;"2546530780";https://twitter.com/SwineFluNewsPH/status/2546530780
SwineFluNewsCA;2009-07-09 06:28;0;0;"Swine Flu Russia News http://tinyurl.com/ojy7hg #swineflu #h1n1";;;#swineflu #h1n1;"2546530608";https://twitter.com/SwineFluNewsCA/status/2546530608
SwineFluNewsCA;2009-07-09 06:26;0;0;"Local news, continue and Georgia Bulldogs Sports for Athens GA http://tinyurl.com/nddn6j #swineflu #h1n1";;;#swineflu #h1n1;"2546504557";https://twitter.com/SwineFluNewsCA/status/2546504557
SwineFluNewsCA;2009-07-09 06:25;0;0;"Tamiflu In Mexico http://tinyurl.com/pohn8n #swineflu #h1n1";;;#swineflu #h1n1;"2546501247";https://twitter.com/SwineFluNewsCA/status/2546501247
Swineflu_wires;2009-07-09 06:25;0;0;"New post: Wyoming remains safe from swine flu - KTAK (http://cli.gs/YSE1B)";;;;"2546500917";https://twitter.com/Swineflu_wires/status/2546500917
SwineFluNewsUSA;2009-07-09 06:24;0;0;"Bulgaria receiving medicine measures opposite swine flu http://tinyurl.com/ls5ywa #swineflu #h1n1";;;#swineflu #h1n1;"2546488702";https://twitter.com/SwineFluNewsUSA/status/2546488702
SwineFluNewsAU;2009-07-09 06:22;0;0;"Novel Influenza A (H1N1) 09 Swine Flu - Update 99 http://tinyurl.com/nu7upe #swineflu #h1n1";;;#swineflu #h1n1;"2546471263";https://twitter.com/SwineFluNewsAU/status/2546471263
SwineFluNewsNZ;2009-07-09 06:16;0;0;"Plans for swine-flu clinics face shake-up http://tinyurl.com/lv6gbc #swineflu #h1n1";;;#swineflu #h1n1;"2546412486";https://twitter.com/SwineFluNewsNZ/status/2546412486
SwineFluNewsEU;2009-07-09 06:15;0;0;"Global bonds tumble upon diseased mercantile outlook http://tinyurl.com/nhz5s6 #swineflu #h1n1";;;#swineflu #h1n1;"2546403636";https://twitter.com/SwineFluNewsEU/status/2546403636
SwineFlu_news;2009-07-09 06:15;0;0;"Thailand records 13th death from flu http://t.love.com/230309490";;;;"2546394374";https://twitter.com/SwineFlu_news/status/2546394374
SwineFluNewsHK;2009-07-09 06:14;0;0;"Swine flu a risk to HIV/Aids patients http://tinyurl.com/ml2kq6 #swineflu #h1n1";;;#swineflu #h1n1;"2546385414";https://twitter.com/SwineFluNewsHK/status/2546385414
keith_wilson;2009-07-09 06:11;0;0;"My girlfriend's colleague's son's friend has #swineflu . The son has been told not to go into school but his parents are still going to work.";;;#swineflu;"2546360207";https://twitter.com/keith_wilson/status/2546360207
SwineFluNewsIE;2009-07-09 06:11;0;0;"Best Flu Medicines http://tinyurl.com/r4l4cx #swineflu #h1n1";;;#swineflu #h1n1;"2546358229";https://twitter.com/SwineFluNewsIE/status/2546358229
SwineFluNewsCA;2009-07-09 06:10;0;0;"Local news, continue and Georgia Bulldogs Sports for Athens GA http://tinyurl.com/nddn6j #swineflu #h1n1";;;#swineflu #h1n1;"2546346749";https://twitter.com/SwineFluNewsCA/status/2546346749
SwineFluNewsIE;2009-07-09 06:09;0;0;"Swine flu puts dual in sanatorium in Wales http://tinyurl.com/ldu5ws #swineflu #h1n1";;;#swineflu #h1n1;"2546340877";https://twitter.com/SwineFluNewsIE/status/2546340877
SwineFluNewsSG;2009-07-09 06:09;0;0;"Swine Flu Fatality Rate May Be Smaller Than Earlier Estimated, Study Says http://tinyurl.com/putxse #swineflu #h1n1";;;#swineflu #h1n1;"2546340658";https://twitter.com/SwineFluNewsSG/status/2546340658
Sydney_Uni;2009-07-09 06:08;0;0;"Three Sydney Uni research projects have received NHMRC funding to investigate #swineflu response: http://bit.ly/DI4KX";;;#swineflu;"2546328144";https://twitter.com/Sydney_Uni/status/2546328144
Fluperman;2009-07-09 06:08;0;0;"http://www.flu.gov/ Resilience Summit broadcast in a few hours #swineflu #panflu please RT";;;#swineflu #panflu;"2546326465";https://twitter.com/Fluperman/status/2546326465
SwineFluNewsIN;2009-07-09 06:06;0;0;"India's swine flu sum reaches 158 http://tinyurl.com/n7d5zv #swineflu #h1n1";;;#swineflu #h1n1;"2546307859";https://twitter.com/SwineFluNewsIN/status/2546307859
SwineFluNewsPH;2009-07-09 06:06;0;0;"FACTBOX-Worldwide widespread of H1N1 flu http://tinyurl.com/nh2rcd #swineflu #h1n1";;;#swineflu #h1n1;"2546307538";https://twitter.com/SwineFluNewsPH/status/2546307538
SwineFluNewsEU;2009-07-09 06:00;0;0;"Potter actress tells of swine flu fright in Britain http://tinyurl.com/n6gsbd #swineflu #h1n1";;;#swineflu #h1n1;"2546243685";https://twitter.com/SwineFluNewsEU/status/2546243685
SwineFluNewsORG;2009-07-09 06:00;0;0;"Two some-more flu deaths in Minnesota http://tinyurl.com/kqfpud #swineflu #h1n1";;;#swineflu #h1n1;"2546243330";https://twitter.com/SwineFluNewsORG/status/2546243330
SwineFlu_news;2009-07-09 06:00;0;0;"Quarter of early abortions via pill http://t.love.com/230302487";;;;"2546239670";https://twitter.com/SwineFlu_news/status/2546239670
News_SwineFlu;2009-07-09 05:56;0;0;"#swineflu Swine Flu Death; Adams Morgan Death; Man Charged in Killing ... - Washington Post http://bit.ly/Kcw7F";;;#swineflu;"2546204787";https://twitter.com/News_SwineFlu/status/2546204787
News_SwineFlu;2009-07-09 05:56;0;0;"#swineflu 2 new swine flu deaths confirmed in Minnesota - Minneapolis Star Tribune http://bit.ly/m7EKY";;;#swineflu;"2546204388";https://twitter.com/News_SwineFlu/status/2546204388
