username;date;retweets;favorites;text;geo;mentions;hashtags;id;permalink
dreamtripscda;2009-05-20 12:35;0;0;"The Republic of the Philippines is influenza A (H1N1)-free | Pinay Ads http://bit.ly/xek25";;;;"1858650390";https://twitter.com/dreamtripscda/status/1858650390
Fla_Medic;2009-05-20 12:35;0;0;"Blogging `WHO Influenza Update #34' http://bit.ly/HcWe #swineflu #H1N109";;;#34 #swineflu #H1N109;"1858648203";https://twitter.com/Fla_Medic/status/1858648203
cowboybibimbop;2009-05-20 12:34;0;0;"I've been infected by Mio Influenza http://bit.ly/NomQ4";;;;"1858642226";https://twitter.com/cowboybibimbop/status/1858642226
ryonano;2009-05-20 12:34;0;0;"It is the first time in "domestic infection Tokyo of new model influenza (H1N1)"; even as for the infectee confirmation!";;;;"1858639404";https://twitter.com/ryonano/status/1858639404
cubafeeds;2009-05-20 12:28;0;0;"[cambio] Nota oficial: Con relación a los tres casos confirmados de Influenza A (H1N1) en Cuba, se infor.. http://tinyurl.com/ob6456";;;;"1858602114";https://twitter.com/cubafeeds/status/1858602114
marcobalzerani;2009-05-20 12:26;0;0;"Marco é guarito dall' influenza . http://ff.im/-34qPZ";;;;"1858584318";https://twitter.com/marcobalzerani/status/1858584318
daniele_barresi;2009-05-20 12:24;0;0;"@paliaga Se pasò la influenza ? Te dije que dejaras tranquilos a los mejicanos... ;)";;@paliaga;;"1858571999";https://twitter.com/daniele_barresi/status/1858571999
jumastorga;2009-05-20 12:23;0;0;"@copano grande perro, te voy escuchando de nuevo. Es verdad q despues del simce ahora viene el ranking d los colegios con más influenza ?jaja";;@copano;;"1858563288";https://twitter.com/jumastorga/status/1858563288
tm_insider;2009-05-20 12:22;0;0;"Australia records four new Influenza A(H1N1) cases: SYDNEY, May 20 — Australia confirmed four new cases of Influ.. http://tinyurl.com/prwtta";;;;"1858559085";https://twitter.com/tm_insider/status/1858559085
MollyDugganLLC;2009-05-20 12:22;0;0;"World Health Org: HIGHLIGHTS Influenza A(HIN1) virus Current situation - u http://tinyurl.com/oyjcbt Full http://tinyurl.com/3tx9d";;;;"1858558093";https://twitter.com/MollyDugganLLC/status/1858558093
intheclubcl;2009-05-20 12:20;0;0;"NEWS: A 11 se elevan los casos de influenza humana en Chile. Varios colegios de Stgo. suspenden clases como medida preventiva.";;;;"1858546445";https://twitter.com/intheclubcl/status/1858546445
rrothfeldt;2009-05-20 12:20;0;0;"Bus is 1/2 empty. Whadaya think - influenza porcini fears or vacations?";;;;"1858544252";https://twitter.com/rrothfeldt/status/1858544252
DuchessdeCatur;2009-05-20 12:20;0;0;"Focus on influenza H1N1 RT @BIOConvention : Public Health And Business Wed 2 - 3:30 p.m. Rm B401/B402, http://snipr.com/i8r4t";;@BIOConvention;;"1858544006";https://twitter.com/DuchessdeCatur/status/1858544006
wilolsen;2009-05-20 12:17;0;0;"10000 cases of Influenza A (H1N1) and rising fast - check out the missing link: http://bit.ly/jOMoI 90010642";;;;"1858527034";https://twitter.com/wilolsen/status/1858527034
juankiDuran;2009-05-20 12:15;0;0;"ya regrese, no puede dormir con lasnoticias de la influenza porque soñe con eso :S";;;;"1858510023";https://twitter.com/juankiDuran/status/1858510023
AIDigest;2009-05-20 12:15;0;0;"WHO | Influenza A( #H1N1 ) - update 34 - http://shar.es/VDf";;;#H1N1;"1858507263";https://twitter.com/AIDigest/status/1858507263
kappan;2009-05-20 12:12;0;0;"Oh! From NHK news, it was confirmed confirmed that the high school girl in Tokyo was infected new influenza .";;;;"1858491392";https://twitter.com/kappan/status/1858491392
dps782;2009-05-20 12:11;0;0;"Scoop: Influenza A (H1N1) Swine Flu - Update Forty-four http://bit.ly/VNwQL";;;;"1858486383";https://twitter.com/dps782/status/1858486383
kishimi;2009-05-20 12:04;0;0;"Influenza has been spreading. My daughter says there will be no school for the time being.";;;;"1858441765";https://twitter.com/kishimi/status/1858441765
ricardore;2009-05-20 12:02;0;0;"perdí mi encuesta de la influenza y tuve que salir de la sala de abordar por otra y casi pierdo vuelo :@";;@;;"1858424416";https://twitter.com/ricardore/status/1858424416
Dr_Raj_Miniyar;2009-05-20 11:58;0;0;"Amarillo Biosciences Selects Accelovance for Its Next Influenza Study (Marketwire) http://tinyurl.com/qxwgxe";;;;"1858402635";https://twitter.com/Dr_Raj_Miniyar/status/1858402635
varkens_griep;2009-05-20 11:58;0;0;"Engelse post / WHO - Influenza A(H1N1) - update 33 http://tinyurl.com/o2pdss";;;;"1858399061";https://twitter.com/varkens_griep/status/1858399061
cronaca24;2009-05-20 11:56;0;0;"Nuova Influenza : Test Negativo Su Italiana Ricoverata In Tibet http://tinyurl.com/r3p9z6";;;;"1858388397";https://twitter.com/cronaca24/status/1858388397
MaxHealthcare;2009-05-20 11:56;0;0;"Swine Flu is a respiratory disease in pigs caused by type A influenza virus. Can humans catch swine flu? Read more http://tinyurl.com/qlmedo";;;;"1858384983";https://twitter.com/MaxHealthcare/status/1858384983
ThaiTheNation;2009-05-20 11:54;0;1;"Thailand plans influenza 2009 screening on planes: Department of Disease Control is proposing the screening of p.. http://tinyurl.com/o9mldv";;;;"1858376318";https://twitter.com/ThaiTheNation/status/1858376318
prensa_latina;2009-05-20 11:53;0;0;"Cuba confirma cuarto caso de influenza A (H1N1) - Prensa Latina http://tinyurl.com/p47u4z";;;;"1858371719";https://twitter.com/prensa_latina/status/1858371719
lavozsandinista;2009-05-20 11:46;0;0;"Ascendió a 9 mil 830 el número de enfermos con virus de influenza humana http://bit.ly/9iUiG";;;;"1858330672";https://twitter.com/lavozsandinista/status/1858330672
ToddStark;2009-05-20 11:46;0;0;"Influenza : recent journal articles - http://tinyurl.com/rdhrt7";;;;"1858329485";https://twitter.com/ToddStark/status/1858329485
latercera;2009-05-20 11:44;0;0;"Brote de influenza humana abortaría partidos de Chile en Japón: Ante la rápida expansión del virus, las autorida.. http://twurl.nl/dpww15";;;;"1858317670";https://twitter.com/latercera/status/1858317670
lemirand;2009-05-20 11:43;0;0;""El arte es el arte. Es una vida de perro la vida que nos exige". Despertando, viendo TV y chato con lo de la influenza láis";;;;"1858310803";https://twitter.com/lemirand/status/1858310803
swinefluupdated;2009-05-20 11:42;0;0;"Influenza A (H1N1) - worldwide (31): case counts #swineflu http://tinyurl.com/owm7pa";;;#swineflu;"1858302536";https://twitter.com/swinefluupdated/status/1858302536
swinefluupdated;2009-05-20 11:42;0;0;"Influenza A (H1N1) - worldwide (33): case counts #swineflu http://tinyurl.com/qzd57j";;;#swineflu;"1858302402";https://twitter.com/swinefluupdated/status/1858302402
Anitadalbello;2009-05-20 11:40;0;0;"Os idiotas dos Jonas Brothers [novos Beatles?! ¬¬) cancelaram show no México com medinho da influenza ¬_¬";;;;"1858294822";https://twitter.com/Anitadalbello/status/1858294822
mstaronline;2009-05-20 11:38;0;0;"Pramugari MH091 bebas virus influenza A(H1N1): IPOH: Pramugari yang bertugas dalam pesawat MH091 dari Newark, Am.. http://tinyurl.com/ouxbrs";;;;"1858280580";https://twitter.com/mstaronline/status/1858280580
mstaronline;2009-05-20 11:38;0;0;"Mangsa kedua influenza A (H1N1) dibenarkan keluar hari ini: PULAU PINANG: Mangsa kedua influenza A (H1N1) dibena.. http://tinyurl.com/r266lq";;;;"1858279675";https://twitter.com/mstaronline/status/1858279675
CrisisWatch;2009-05-20 11:35;0;0;"*EMM Disease Alerts* Influenza A (H1N1) Swine Flu - Update Forty-four http://tinyurl.com/o4xb5c";;;;"1858263285";https://twitter.com/CrisisWatch/status/1858263285
chileteinforma;2009-05-20 11:34;0;0;"Cooperativa: La influenza humana ya suma más de 230 casos en Japón: http://tinyurl.com/pyj8ob";;;;"1858256454";https://twitter.com/chileteinforma/status/1858256454
prensa_latina;2009-05-20 11:31;0;0;"Cuba confirma cuarto caso de influenza A (H1N1) http://bit.ly/XHGwZ";;;;"1858240028";https://twitter.com/prensa_latina/status/1858240028
TwitCapital;2009-05-20 11:23;0;0;"Scoop: Influenza A (H1N1) Swine Flu - Update Forty-four: The WHO recommends that individuals who are ill should .. http://bit.ly/mUOyP";;;;"1858198222";https://twitter.com/TwitCapital/status/1858198222
alexdleon;2009-05-20 11:22;0;0;"El deceso de Acatlán fue por influenza estacional http://www.milenio.com/node/217889";;;;"1858193006";https://twitter.com/alexdleon/status/1858193006
alexdleon;2009-05-20 11:22;0;0;"AMLO criticó el “tonto” manejo de la influenza http://www.milenio.com/node/217894";;;;"1858192450";https://twitter.com/alexdleon/status/1858192450
lasnibat;2009-05-20 11:13;0;0;"Influenza humana registra más de 10.000 casos y 80 muertos en el mundo. Hay que tranquilizarse porque el virus llegó para quedarse.";;;;"1858141916";https://twitter.com/lasnibat/status/1858141916
theroarindia;2009-05-20 11:12;0;0;"New Blog post New computer model may improve airport pandemic influenza screening system http://bit.ly/18TOIz ...";;;;"1858138643";https://twitter.com/theroarindia/status/1858138643
swinefluh1n1;2009-05-20 11:11;0;0;""New Zealand's confirmed cases of Influenza A/H1N1 remain at nine" http://tinyurl.com/o228wk #swineflu #H1N1";;;#swineflu #H1N1;"1858130458";https://twitter.com/swinefluh1n1/status/1858130458
Earth_Times;2009-05-20 11:00;0;0;"Amarillo Biosciences Selects Accelovance for Its Next Influenza Study http://tinyurl.com/qgqcdr";;;;"1858075070";https://twitter.com/Earth_Times/status/1858075070
PepeBarrascout;2009-05-20 10:54;0;0;"Australia registra su segundo caso de influenza H1N1: SIDNEY (Reuters) - Australia registró el miércoles su segu.. http://tinyurl.com/q32afx";;;;"1858042746";https://twitter.com/PepeBarrascout/status/1858042746
chileteinforma;2009-05-20 10:51;0;0;"La Segunda: Influenza humana registra más de 10.000 casos y 80 muertos : �ltimo banalnce de la Organi.. http://tinyurl.com/queukw";;;;"1858029516";https://twitter.com/chileteinforma/status/1858029516
chileteinforma;2009-05-20 10:51;0;0;"La Tercera: A más de 230 asciende número de infectados por influenza AH1N1 en Japón: Un estudio revel.. http://tinyurl.com/plzro5";;;;"1858028176";https://twitter.com/chileteinforma/status/1858028176
cnafrontpage;2009-05-20 10:51;0;0;"H1N1 flu cases surge past 10,000: GENEVA : The global Influenza A (H1N1) flu caseload surged past the 10,000 mar.. http://tinyurl.com/plu273";;;;"1858027178";https://twitter.com/cnafrontpage/status/1858027178
worldexpats;2009-05-20 10:48;0;0;"News: Influenza Cases Increase to Five in Chile; Swine Flu http://news.totalchile.com";;;;"1858013793";https://twitter.com/worldexpats/status/1858013793
chileteinforma;2009-05-20 10:47;0;0;"Emol: Influenza humana registra más de 10.000 casos y 80 muertos : Último banalnce de la Organización Mundi.. http://tinyurl.com/p65vky";;;;"1858007427";https://twitter.com/chileteinforma/status/1858007427
Milenio;2009-05-20 10:46;0;0;"Ascienden a 236 casos de influenza humana en Japón http://tinyurl.com/r8ugkj";;;;"1858000523";https://twitter.com/Milenio/status/1858000523
ExoticGoa;2009-05-20 10:42;0;0;"2008 - Chinese year of the Horse - Equine Influenza decimates Australian Racing.";;;;"1857980496";https://twitter.com/ExoticGoa/status/1857980496
TrustedAdvice;2009-05-20 10:40;0;0;"New Zealand's confirmed cases of Influenza A/H1N1 remain at nine http://ff.im/-34h61";;;;"1857972626";https://twitter.com/TrustedAdvice/status/1857972626
TrustedAdvice;2009-05-20 10:39;0;0;"S Korea builds early warning system to brace for influenza outbreak http://ff.im/-34h65";;;;"1857966388";https://twitter.com/TrustedAdvice/status/1857966388
iesamina;2009-05-20 10:38;0;0;"I have got SYMPTOMS. That's it. Porcine influenza .";;;;"1857960798";https://twitter.com/iesamina/status/1857960798
CarloLoRe;2009-05-20 10:34;0;0;"News: Influenza suina, i casi nel mondo sono ormai 10.000 http://tinyurl.com/o2lbwu";;;;"1857944417";https://twitter.com/CarloLoRe/status/1857944417
fabrimarcon;2009-05-20 10:30;0;0;"quem foi que fez? http://shrtlnk.me/fienjc #suineflu #influenza";;;#suineflu #influenza;"1857922390";https://twitter.com/fabrimarcon/status/1857922390
PinayAds;2009-05-20 10:30;0;0;"says http://tinyurl.com/q8hx23 (Philippines is influenza A (H1N1)-free) http://plurk.com/p/uzjs7";;;;"1857922249";https://twitter.com/PinayAds/status/1857922249
NZGovtFeeds;2009-05-20 10:27;0;0;"[MoH] Media Release: Influenza A (H1N1) Swine Flu - Update Forty-four: While the case numbers in New Zealan.. http://tinyurl.com/pjx38y";;;;"1857911576";https://twitter.com/NZGovtFeeds/status/1857911576
tm_insider;2009-05-20 10:27;0;0;"No local transmission of H1N1 virus : PUTRAJAYA, May 20 – Malaysia is free of local transmission of influenza A .. http://tinyurl.com/ov2vt3";;;;"1857910187";https://twitter.com/tm_insider/status/1857910187
wongkendall;2009-05-20 10:23;0;0;"Japan's H1N1 flu infections rise to 232: KOBE, Japan : The number of Influenza A (H1N1) infections in Japan rose.. http://tinyurl.com/qt75yk";;;;"1857890174";https://twitter.com/wongkendall/status/1857890174
wongkendall;2009-05-20 10:23;0;0;"H1N1 flu cases spread in Asia, Americas: GENEVA - Mexico's Influenza A (H1N1) death toll rose by four as the vir.. http://tinyurl.com/ohfewz";;;;"1857889589";https://twitter.com/wongkendall/status/1857889589
Thai_Local_News;2009-05-20 10:22;0;0;"Thailand plans influenza 2009 screening on planes: Department of Disease Control is proposing the screening of p.. http://tinyurl.com/o9mldv";;;;"1857885077";https://twitter.com/Thai_Local_News/status/1857885077
CrisisWatch;2009-05-20 10:20;0;0;"*Pandemic Info News* Chinese reports 4th confirmed case of A/H1N1 influenza http://tinyurl.com/qdesta";;;;"1857879198";https://twitter.com/CrisisWatch/status/1857879198
latercera;2009-05-20 10:15;0;0;"A más de 230 asciende número de infectados por influenza AH1N1 en Japón: Un estudio reveló que la mayoría de los.. http://twurl.nl/lexjk4";;;;"1857856111";https://twitter.com/latercera/status/1857856111
swinefluh1n1;2009-05-20 10:09;0;0;""ECDC situation report on outbreak of influenza A(H1N1) 19 May 2009" http://tinyurl.com/p6kg5g #swineflu #H1N1";;;#swineflu #H1N1;"1857825859";https://twitter.com/swinefluh1n1/status/1857825859
swinefluh1n1;2009-05-20 10:05;0;0;""ReliefWeb » Document » First imported case of influenza A (H1N1 ..." http://tinyurl.com/qebypb #swineflu #H1N1";;;#swineflu #H1N1;"1857809249";https://twitter.com/swinefluh1n1/status/1857809249
immuneprotect;2009-05-20 10:04;0;0;"ReliefWeb » Document » First imported case of influenza A (H1N1 ... http://bit.ly/17BbP8";;;;"1857802594";https://twitter.com/immuneprotect/status/1857802594
Reset_Italia;2009-05-20 10:02;0;0;"Mille nuovi casi in 24 ore..: Nel mondo sono stati diagnosticati circa mille casi in più di nuova influenza , sec.. http://tinyurl.com/rca6lc";;;;"1857795765";https://twitter.com/Reset_Italia/status/1857795765
sammi_jade;2009-05-20 10:02;0;0;"2008 chinese yr of the horse- equine influenza decimates austrilian racing.. 2009 yr of pig swine flu kills hundreads around the world";;;;"1857794793";https://twitter.com/sammi_jade/status/1857794793
web9media;2009-05-20 09:58;0;0;"New computer model may improve airport pandemic influenza screening system http://ff.im/-34dSg";;;;"1857777476";https://twitter.com/web9media/status/1857777476
cnafrontpage;2009-05-20 09:49;0;0;"Japan's H1N1 flu infections rise to 232: KOBE, Japan : The number of Influenza A (H1N1) infections in Japan rose.. http://tinyurl.com/qt75yk";;;;"1857735783";https://twitter.com/cnafrontpage/status/1857735783
TheHumanFlu;2009-05-20 09:42;0;0;"theHumanFlu.com:Chinese reports 4th confirmed case of A/H1N1 influenza http://ow.ly/80Va";;;;"1857704482";https://twitter.com/TheHumanFlu/status/1857704482
georgebkk;2009-05-20 09:39;0;0;"Thailand Plans Influenza 2009 Screening On Aircrafts http://tinyurl.com/qyuepo";;;;"1857688973";https://twitter.com/georgebkk/status/1857688973
H1N1VirusNews;2009-05-20 09:31;0;0;"Iowa Department of Public Health: Novel Influenza A (<B>H1N1</B>) case... http://cli.gs/AXLsa1";;;;"1857650647";https://twitter.com/H1N1VirusNews/status/1857650647
franknorman;2009-05-20 09:30;0;0;"#h1n1 ECDC situation report on Influenza A(H1N1): Within the last 24 hours, 11 new confirmed cases were rep.. http://tinyurl.com/pqft9g";;;#h1n1;"1857649491";https://twitter.com/franknorman/status/1857649491
franknorman;2009-05-20 09:30;0;0;"#h1n1 Recommendations of the WHO expert group on Influenza A (H1N1) vaccines: Recommendations of the WHO St.. http://tinyurl.com/pmyaak";;;#h1n1;"1857648787";https://twitter.com/franknorman/status/1857648787
SwineFlu_news;2009-05-20 09:30;0;0;"S Korea builds early warning system to brace for influenza outbreak http://t.love.com/215320351";;;;"1857645723";https://twitter.com/SwineFlu_news/status/1857645723
persberichtenNL;2009-05-20 09:26;0;0;"New blog post: Buzz rondom Influenza A-H1N1: onduidelijke nieuwsvoorziening http://bit.ly/14ZRcH";;;;"1857631587";https://twitter.com/persberichtenNL/status/1857631587
novoseek;2009-05-20 09:23;0;0;"The lateste articles published in medline on both #avian and #swine influenza #H5N1 #H1N1 http://bit.ly/Ou6JZ";;;#avian #swine #H5N1 #H1N1;"1857616994";https://twitter.com/novoseek/status/1857616994
gypsywolve;2009-05-20 09:21;0;0;"FluView Surveillance Report: 2008-2009 Influenza Season, Week 18 ending May 9, 2009 http://bit.ly/xINOX";;;;"1857609152";https://twitter.com/gypsywolve/status/1857609152
influenza_mxli;2009-05-20 09:10;0;0;"AUTORIZAN ENCENDER REFRIGERACIÓN DE CAMIONES URBANOS - Mexico Webcast: Mexico WebcastAUTORIZAN ENCENDER REFRIGER.. http://tinyurl.com/obf6p7";;;;"1857559866";https://twitter.com/influenza_mxli/status/1857559866
desarrollo;2009-05-20 08:58;0;0;"Los principales centros turísticos del país sin casos de Influenza a H1N1: Cinco de los centros turísticos .. http://bit.ly/193ZC9";;;;"1857501368";https://twitter.com/desarrollo/status/1857501368
cronaca24;2009-05-20 08:56;0;0;"Nuova Influenza : 1000 Nuovi Casi In 24 Ore. Si Punta a Vaccino(Il Punto): ASCA - Roma, 20 mag - Obiettivo il vac.. http://tinyurl.com/o2kp89";;;;"1857495979";https://twitter.com/cronaca24/status/1857495979
scrabysys;2009-05-20 08:54;0;0;"Predire l' influenza suina con Twitter - Zeus News http://ff.im/-348F5";;;;"1857486188";https://twitter.com/scrabysys/status/1857486188
13wmaznews;2009-05-20 08:52;0;0;"Tuesday night, the Bibb County Pandemic Influenza Planning Committee hosted a public forum. http://tr.im/lRel";;;;"1857478160";https://twitter.com/13wmaznews/status/1857478160
CrisisWatch;2009-05-20 08:50;0;0;"*Pandemic Info News* Taiwan reports confirmed case of A/H1N1 influenza http://tinyurl.com/pqc6yz";;;;"1857467228";https://twitter.com/CrisisWatch/status/1857467228
148apps_newapps;2009-05-20 08:45;0;0;"Influenza A(H1N1) (Travel) has been added at $0.99 - http://148apps.com/app/315788840";;;;"1857446021";https://twitter.com/148apps_newapps/status/1857446021
mymonews;2009-05-20 08:41;0;0;"[news] Esteri - Influenza A: Tibet,dimessa italiana: Negativi gli accertamenti.In Giappone 236 casi http://tinyurl.com/q4t6ym";;;;"1857428207";https://twitter.com/mymonews/status/1857428207
Buzzcapture;2009-05-20 08:39;0;0;"Rapport over online buzz en de Influenza A-H1N1 nu opvraagbaar bij Buzzcapture http://www.buzzcapture.com";;;;"1857420222";https://twitter.com/Buzzcapture/status/1857420222
KimmyHamilton;2009-05-20 08:30;0;0;"New Swine Flu ( Influenza ) Cases in Costa Rica.: Posted Under: Costa Rica Real Estate News. The number of influen.. http://bit.ly/Mb0iy";;;;"1857377531";https://twitter.com/KimmyHamilton/status/1857377531
GezondNieuws;2009-05-20 08:30;0;0;"Onderzoek naar griepvaccinatie voor kinderen: UTRECHT - De European Paediatric Influenza Analysis Group (EPIA) g.. http://tinyurl.com/q3rv8p";;;;"1857376981";https://twitter.com/GezondNieuws/status/1857376981
DonnaCercaUomo;2009-05-20 08:24;0;0;"Salute: Influenza A: Tibet, dimessa italiana - ANSA http://is.gd/BuDT";;;;"1857350331";https://twitter.com/DonnaCercaUomo/status/1857350331
reformanacional;2009-05-20 08:16;0;0;"Reportan 2 muertos más por virus A H1N1 : La Secretaría de Salud reportó 2 nuevos decesos por influenza A H1N1, .. http://tinyurl.com/qxzx5n";;;;"1857314640";https://twitter.com/reformanacional/status/1857314640
ChristianNurse;2009-05-20 08:12;0;0;"WHO Influenza A(H1N1) - update 33 #H1N1 #Swineflu http://is.gd/BBTI 9,830 cases & 79 deaths in 40 countries";;;#H1N1 #Swineflu;"1857294207";https://twitter.com/ChristianNurse/status/1857294207
kawaii_kupo;2009-05-20 08:12;0;0;"Wtf our script involves sheep influenza lol";;;;"1857293659";https://twitter.com/kawaii_kupo/status/1857293659
katsuji;2009-05-20 08:11;0;0;"「 influenza 」はイタリアで名付けられたんだよ";;;;"1857291060";https://twitter.com/katsuji/status/1857291060
nacioncl;2009-05-20 08:08;0;0;"02:18 | Colegio informa que alumno padece influenza humana http://tinyurl.com/pd7mky";;;;"1857274198";https://twitter.com/nacioncl/status/1857274198
HIADA;2009-05-20 08:07;0;0;"cancelado el juego de volley y la fiesta de la empresa por influenza A";;;;"1857271128";https://twitter.com/HIADA/status/1857271128
latimesscience;2009-05-20 08:00;0;0;"Swine flu vaccine taking longer than expected, WHO says: The World Health Organization says the H1N1 influenza v.. http://tr.im/lR3I";;;;"1857236561";https://twitter.com/latimesscience/status/1857236561
cristianruz;2009-05-20 07:59;0;0;"si la influenza "estacional" no es influenza "humana", entonces porque los humanos se enferman ?";;;;"1857234179";https://twitter.com/cristianruz/status/1857234179
OnlineBizGirl;2009-05-20 07:42;0;0;"COOL READ! new Influenza A (H1N1) virus pattern emerging in US: And it’s making the health offic.. http://tr.im/lQZy";;;;"1857153295";https://twitter.com/OnlineBizGirl/status/1857153295
swinefluupdated;2009-05-20 07:39;0;0;"Influenza A (H1N1) - worldwide (31): case counts #swineflu http://tinyurl.com/onm8xb";;;#swineflu;"1857138744";https://twitter.com/swinefluupdated/status/1857138744
swinefluupdated;2009-05-20 07:39;0;0;"Influenza A (H1N1) - worldwide (33): case counts #swineflu http://tinyurl.com/o47alm";;;#swineflu;"1857138592";https://twitter.com/swinefluupdated/status/1857138592
ansa_it;2009-05-20 07:34;0;0;"Influenza A: Tibet,dimessa italiana http://tinyurl.com/qp6vfh";;;;"1857114833";https://twitter.com/ansa_it/status/1857114833
GezondNieuws;2009-05-20 07:31;0;0;"9830 gevallen Mexicaanse griep: BAARN - De afgelopen 24 uur zijn er duizend nieuwe gevallen van Nieuwe Influenza .. http://tinyurl.com/ol5y9s";;;;"1857098638";https://twitter.com/GezondNieuws/status/1857098638
BrazilianPost;2009-05-20 07:29;0;0;"Crece posibilidad de que un caso sospechoso en el país sea gripe H1 : Uno de los dos casos sospechosos de Influenza AH1N1 dio positivo a..";;;;"1857087020";https://twitter.com/BrazilianPost/status/1857087020
Sabrina1973;2009-05-20 07:20;0;0;"@rcdellara hai l' influenza ? si devi andare dal dottore ray!";;@rcdellara;;"1857042939";https://twitter.com/Sabrina1973/status/1857042939
NotizieLive;2009-05-20 07:20;0;0;"Influenza A: Tibet,dimessa italiana: Negativi gli accertamenti.In G... http://bit.ly/DawyD";;;;"1857042901";https://twitter.com/NotizieLive/status/1857042901
Ginger_Eil;2009-05-20 07:17;0;0;"@_Mirtilla boh, ma ho l' influenza , mal di ossa di occhi di capelli febbre...'na schifezza :)";;@_Mirtilla;;"1857029620";https://twitter.com/Ginger_Eil/status/1857029620
El_Universal_Mx;2009-05-20 07:11;0;0;"Cuba reporta cuarto caso de influenza A. http://ito.com.mx/QO7W";;;;"1856996967";https://twitter.com/El_Universal_Mx/status/1856996967
immuneprotect;2009-05-20 07:02;0;0;"Influenza A(H1N1) - update 32: The Exact Numbers http://bit.ly/jBByL";;;;"1856952987";https://twitter.com/immuneprotect/status/1856952987
infoxenter_apps;2009-05-20 07:02;0;0;""iPhone New App: Influenza A(H1N1) Price: US$0.99 Category: Travel http://tinyurl.com/ppx6p7"";;;;"1856951173";https://twitter.com/infoxenter_apps/status/1856951173
danielooi;2009-05-20 06:57;0;0;"RT @staronline : Influenza A (H1N1) patients due for discharge http://bit.ly/y5tv5 #swineflu #H1N1";;@staronline;#swineflu #H1N1;"1856925875";https://twitter.com/danielooi/status/1856925875
cnafrontpage;2009-05-20 06:54;0;0;"H1N1 flu cases spread in Asia, Americas: GENEVA - Mexico's Influenza A (H1N1) death toll rose by four as the vir.. http://tinyurl.com/ohfewz";;;;"1856907620";https://twitter.com/cnafrontpage/status/1856907620
chileteinforma;2009-05-20 06:46;0;0;"La Segunda: Aumentan a 65 los casos de influenza humana en Panamá: De los afectados, con el virus A (.. http://tinyurl.com/o8dnos";;;;"1856868226";https://twitter.com/chileteinforma/status/1856868226
chileteinforma;2009-05-20 06:46;0;0;"La Tercera: Colegios con clases suspendidas por influenza AH1N1 llegan a ocho: El The English Institu.. http://tinyurl.com/p76tyk";;;;"1856867327";https://twitter.com/chileteinforma/status/1856867327
VotersUnite;2009-05-20 06:46;0;0;"New Blog post Influenza , Bird Flu and Homeopathy â Can it Provide a Different Perspective? http://bit.ly/Jdk2i ...";;;;"1856867101";https://twitter.com/VotersUnite/status/1856867101
news_agg;2009-05-20 06:45;0;0;"http://bit.ly/dnZK2 #Swine_ Influenza - Bloomberg Navigates the Politics of a Health Scare";;;#Swine_;"1856864493";https://twitter.com/news_agg/status/1856864493
novelh1n1;2009-05-20 06:45;0;0;"http://novelh1n1.com The Influenza A (H1N1) Virus - Swine Flu - Provincial Government of the.. http://tinyurl.com/o7h6jf";;;;"1856862747";https://twitter.com/novelh1n1/status/1856862747
usdemocrats;2009-05-20 06:45;0;0;"WHO teleconference of the Ad hoc Policy Advisory Working Group on Influenza A (H1N1) vaccines http://ping.fm/RpBvP";;;;"1856862300";https://twitter.com/usdemocrats/status/1856862300
latercera;2009-05-20 06:44;0;0;"Colegios con clases suspendidas por influenza AH1N1 llegan a ocho: El The English Institute de Providencia se su.. http://twurl.nl/a0tvb5";;;;"1856858534";https://twitter.com/latercera/status/1856858534
