username;date;retweets;favorites;text;geo;mentions;hashtags;id;permalink
chileteinforma;2009-05-20 06:43;0;0;"Emol: Australia registra su segundo caso de influenza H1N1: Se trata de un menor de nueve años, quien regre.. http://tinyurl.com/qa7g7m";;;;"1856849845";https://twitter.com/chileteinforma/status/1856849845
chileteinforma;2009-05-20 06:43;0;0;"La Tercera: Colegios con clases suspendidas por influenza AH1N1 llegan a ocho: El The English Institu.. http://tinyurl.com/p76tyk";;;;"1856849349";https://twitter.com/chileteinforma/status/1856849349
malaysiatweet;2009-05-20 06:41;0;0;"The Star ☛ Influenza A (H1N1) patients due for discharge http://digg.com/u13gzj";;;;"1856838582";https://twitter.com/malaysiatweet/status/1856838582
vozdelsureste;2009-05-20 06:38;0;0;"México pide al G-7 que se levanten restricciones por influenza : México solicitó a los países que integran el .. http://tinyurl.com/oaswh9";;;;"1856822972";https://twitter.com/vozdelsureste/status/1856822972
OneSilentSmoke;2009-05-20 06:30;0;0;"Los casos de influenza se disparan a 56 (MÉRIDA) http://tinyurl.com/qyx3qw";;;;"1856780583";https://twitter.com/OneSilentSmoke/status/1856780583
staronline;2009-05-20 06:24;0;0;"Influenza A (H1N1) patients due for discharge http://bit.ly/y5tv5";;;;"1856745349";https://twitter.com/staronline/status/1856745349
JimRocheNJ;2009-05-20 06:22;0;0;"A New Influenza Virus, Novel influenza A (H1N1) http://bit.ly/M6k8s";;;;"1856732869";https://twitter.com/JimRocheNJ/status/1856732869
bnbreaking;2009-05-20 06:10;0;0;"influenza 'a': negativa italiana ricoverata in tibet http://ff.im/-33VzH";;;;"1856666950";https://twitter.com/bnbreaking/status/1856666950
magnet4health;2009-05-20 06:09;0;0;"Pandemic or paranoia? Handicapping the swine flu: Without close monitoring, influenza continues to evolve in ani.. http://bit.ly/FtFzT";;;;"1856661579";https://twitter.com/magnet4health/status/1856661579
the_ska;2009-05-20 06:08;0;0;"Litsa oficial de la OMS sobre casos de Influenza humana A H1N1 : http://2tu.us/fk0";;;;"1856654241";https://twitter.com/the_ska/status/1856654241
WKRG;2009-05-20 06:06;0;0;"The military's closely guarded plan for an influenza pandemic assumed that officials would have more time. http://wkrg.com/article/67293/";;;;"1856645380";https://twitter.com/WKRG/status/1856645380
cartanautica;2009-05-20 06:04;0;0;"Third Australian swine flu case confirmed ( #influenza #AH1N1 #swineflu ) (RT @brisbanetimes ): http://tinyurl.com/qnv35x";;@brisbanetimes;#influenza #AH1N1 #swineflu;"1856631485";https://twitter.com/cartanautica/status/1856631485
ciudadnorte;2009-05-20 06:00;0;0;"Tres posibles casos de influenza en FES Acatlán, trascendió, y exhortaron extraoficialmente profesores a extremar precauciones.";;;;"1856608669";https://twitter.com/ciudadnorte/status/1856608669
Gripe_porcina;2009-05-20 05:58;0;0;"Olivos, Empleos e Influenza - Diario Noticias: Olivos, Empleos e InfluenzaDiario NoticiasA varias congregaciones.. http://tinyurl.com/qaxwrp";;;;"1856593412";https://twitter.com/Gripe_porcina/status/1856593412
Gripe_porcina;2009-05-20 05:58;0;0;"Suman 36 casos de influenza H1N1 en Sonora: López Vucovich - El reportero de la comunidad: Suman 36 casos de inf.. http://tinyurl.com/p8zyhj";;;;"1856593266";https://twitter.com/Gripe_porcina/status/1856593266
EsimoMD;2009-05-20 05:58;0;0;"Saludos a quien lea esto informo que la influenza no estacabando con México :-)";;;;"1856592133";https://twitter.com/EsimoMD/status/1856592133
ProMED_mail;2009-05-20 05:57;0;0;"PRO/AH/EDR> Influenza A (H1N1) - worldwide (36): case counts, amended http://tinyurl.com/ocn3j7";;;;"1856587901";https://twitter.com/ProMED_mail/status/1856587901
palmosc;2009-05-20 05:52;0;0;"Influenza A(H1N1) (travel) http://ff.im/-33U8c";;;;"1856558638";https://twitter.com/palmosc/status/1856558638
CrisisWatch;2009-05-20 05:52;0;0;"*EMM Disease Alerts* Influenza A (H1N1) patients due for discharge http://tinyurl.com/oaeage";;;;"1856558514";https://twitter.com/CrisisWatch/status/1856558514
CrisisWatch;2009-05-20 05:52;0;0;"*EMM Disease Alerts* PRO/AH/EDR> Influenza A (H1N1) - worldwide (36): case counts, amended http://tinyurl.com/pdhd8c";;;;"1856558319";https://twitter.com/CrisisWatch/status/1856558319
_faiperucita_;2009-05-20 05:52;0;0;"@Reimer_A jajajaja influenza humana (?) xD";;@Reimer_A;;"1856558227";https://twitter.com/_faiperucita_/status/1856558227
Milieunet;2009-05-20 05:49;0;0;"WHO Update: 40 countries have officially reported 9830 cases of influenza A(H1N1) infection, including 79 deaths. #swineflu http://twurl ...";;;#swineflu;"1856543229";https://twitter.com/Milieunet/status/1856543229
Sociabilidad;2009-05-20 05:42;0;0;"La Red de Periodistas de a Pie hace trabajo colectivo sobre la influenza http://tinyurl.com/c6adz4";;;;"1856498220";https://twitter.com/Sociabilidad/status/1856498220
e_mol;2009-05-20 05:40;0;0;"Niño canadiense es el cuarto caso de influenza humana en Cuba";;;;"1856485548";https://twitter.com/e_mol/status/1856485548
yis;2009-05-20 05:40;0;0;"Influenza update (May 20) http://tinyurl.com/pj4xpf";;;;"1856485102";https://twitter.com/yis/status/1856485102
bipawuado;2009-05-20 05:39;0;0;"luego regguettonearemso con la influenza XD";;;;"1856480349";https://twitter.com/bipawuado/status/1856480349
vozdelsureste;2009-05-20 05:35;0;0;"Llega a nueve mil 830 cifra de casos de influenza en 40 países: OMS : La Organización Mundial de la Salud (OMS) .. http://tinyurl.com/oyalam";;;;"1856457354";https://twitter.com/vozdelsureste/status/1856457354
dontriana;2009-05-20 05:33;0;0;"RECURRE CARTUCHO QUEMADO A TEMOR POR INFLUENZA PARA CAMPAÑA POLITICA: Ya una vez este cartucho quemado uso millo.. http://tinyurl.com/qst2y2";;;;"1856443651";https://twitter.com/dontriana/status/1856443651
ElConfeti;2009-05-20 05:30;0;0;"Fourth case of Cuban H1N1 is Canadian - RT @TBS12001 : New blog post: Confirma Cuba cuarto caso de Influenza A H1N1 http://bit.ly/BPyOP";;@TBS12001;;"1856425802";https://twitter.com/ElConfeti/status/1856425802
SwineFluTicker;2009-05-20 05:30;0;0;"Swine flu vaccine taking longer than expected, WHO says: The World Health Organization says the H1N1 influenza v.. http://bit.ly/udg9Y";;;;"1856422452";https://twitter.com/SwineFluTicker/status/1856422452
captainmaamoo;2009-05-20 05:27;0;0;"I found interesting link related to Swine Flu or Influenza A http://curetoswineflu.blogspot.com/";;;;"1856403437";https://twitter.com/captainmaamoo/status/1856403437
natho47;2009-05-20 05:21;0;0;"La influenza humana sigue expandiéndose y el gobierno pide calma";;;;"1856362744";https://twitter.com/natho47/status/1856362744
iphone_noelito;2009-05-20 05:20;0;0;"http://yfrog.com/0x82ej FOTOS DE LA INFLUENZA MEXICANA 100% REALES, INCREIBLES, INCREIBLES, INCREIBLES";;;;"1856357069";https://twitter.com/iphone_noelito/status/1856357069
adrianramirezb;2009-05-20 05:20;0;0;"Nadie habla de la cagaita que está con los gendarmes. Puro hype con la influenza .";;;;"1856354529";https://twitter.com/adrianramirezb/status/1856354529
pao2401;2009-05-20 05:19;0;0;"@tele13online Acerca de la influenza humana, sería bueno detrminar medidas de precaucion este fin de semana largo";;@tele13online;;"1856350957";https://twitter.com/pao2401/status/1856350957
bipawuado;2009-05-20 05:19;0;0;"lo k faltaba la cancion de la influenza ...";;;;"1856349560";https://twitter.com/bipawuado/status/1856349560
gildy;2009-05-20 05:13;0;0;"the so-called new strain influenza *or swine flu, or whatever* has just arrived at my university. great";;;;"1856312418";https://twitter.com/gildy/status/1856312418
ciudadnorte;2009-05-20 05:08;0;0;"Nuevo número de Ciudadnorte... La influenza , una epidemia más en la Ciudad de México. http://bit.ly/4FPuE";;;;"1856271999";https://twitter.com/ciudadnorte/status/1856271999
poptumblr;2009-05-20 05:06;0;0;"South Korean scientists claim to have developed human vaccine for Influenza A http://bit.ly/jEjgC";;;;"1856260782";https://twitter.com/poptumblr/status/1856260782
Sea_Jackal;2009-05-20 05:03;0;0;"No me importa que estornuden sin taparse de la boca mientras estoy comiendo (por lo de la influenza ), pero que asco.";;;;"1856238533";https://twitter.com/Sea_Jackal/status/1856238533
MLKtoSCL;2009-05-20 05:00;0;1;"No sera que el AH1N1 es una Influenza Opus Dei?";;;;"1856215847";https://twitter.com/MLKtoSCL/status/1856215847
Ddaz;2009-05-20 04:59;0;0;"@cesarmd deja te reenvio el email.... el lio es que ya salieron problemas...adivina : influenza ... xD";;@cesarmd;;"1856212728";https://twitter.com/Ddaz/status/1856212728
Snoopycore;2009-05-20 04:59;0;0;"good morning i realy should go to the doctor why am i still ill f.o. influenza";;;;"1856209396";https://twitter.com/Snoopycore/status/1856209396
Alohran;2009-05-20 04:58;0;0;"@tele13online se agradece la presencia de una voz oficial que disipe dudas, como el supuesto 11° caso de influenza humana.";;@tele13online;;"1856200187";https://twitter.com/Alohran/status/1856200187
genuNERD;2009-05-20 04:58;0;0;"Ooowwhhh lil bit influenza !!give me some pills";;;;"1856199527";https://twitter.com/genuNERD/status/1856199527
Carolonline;2009-05-20 04:57;0;0;"RT @noticiasypunto : Arnold Schwarzenegger, en Cancún http://twurl.nl/d0wxzv #internetlujo wow, ¡sin miedo de la influenza !";;@noticiasypunto;#internetlujo;"1856196857";https://twitter.com/Carolonline/status/1856196857
jhalicea;2009-05-20 04:54;0;0;"Toda una vida de vegetariano… …para venir a morir de influenza porcina. ¡Que tengas un bonito día! http://bit.ly/19mAK9";;;;"1856172309";https://twitter.com/jhalicea/status/1856172309
ciper;2009-05-20 04:52;0;1;"¿Saben cuánta gente muere cada año en EEUU x influenza común? 36.000!!!! http://cort.as/-HI";;;;"1856161568";https://twitter.com/ciper/status/1856161568
cnafrontpage;2009-05-20 04:52;0;0;"Japan's H1N1 flu cases top 200: KOBE, Japan - The number of Influenza A (H1N1) infections in Japan rose to 228 o.. http://tinyurl.com/opltnu";;;;"1856158271";https://twitter.com/cnafrontpage/status/1856158271
christian_fozz;2009-05-20 04:48;0;0;"hahaha Influenza .exe";;;;"1856132519";https://twitter.com/christian_fozz/status/1856132519
chileteinforma;2009-05-20 04:46;0;0;"Emol: Aumenta a 20 el número de casos de influenza humana en Costa Rica: El incremento en los afectados se .. http://tinyurl.com/raoxn4";;;;"1856119857";https://twitter.com/chileteinforma/status/1856119857
chileteinforma;2009-05-20 04:46;0;0;"La Tercera: Paraguay se une a lista de países contagiados por influenza AH1N1: Se trata de una mujer .. http://tinyurl.com/o2gqaa";;;;"1856118761";https://twitter.com/chileteinforma/status/1856118761
Milenio;2009-05-20 04:46;0;0;"En Cuba dan de alta becarios mexicanos por influenza http://tinyurl.com/pqsaxv";;;;"1856118268";https://twitter.com/Milenio/status/1856118268
CrashOverride_;2009-05-20 04:44;0;0;"Impresionante!, telenoche no comenzó con la Influenza Humana!!!";;;;"1856105418";https://twitter.com/CrashOverride_/status/1856105418
NETkoholik;2009-05-20 04:43;0;0;"Esto de la influenza A es ya preocupante..";;;;"1856098005";https://twitter.com/NETkoholik/status/1856098005
zamudioruben;2009-05-20 04:42;0;0;"Yaya y Jair con síntomas de influenza ?!?!?! NO MAMEN!! ...si se mueren los mato!";;;;"1856085026";https://twitter.com/zamudioruben/status/1856085026
luisfrost;2009-05-20 04:39;0;0;"@maistro jejeje. gracias, la verdad es que espero hacerlo algún día... si antes no acaba la INFLUENZA con todos nosotros. o el PAN.";;@maistro;;"1856063955";https://twitter.com/luisfrost/status/1856063955
TrustedAdvice;2009-05-20 04:39;0;0;"Taiwan reports confirmed case of A/H1N1 influenza http://ff.im/-33Ork";;;;"1856063188";https://twitter.com/TrustedAdvice/status/1856063188
MedMinded;2009-05-20 04:37;0;0;"From CDC: Influenza A/H1N1 treatment guidelines. Not everyone needs anti-virals (Tamiflu/Relenza) http://bit.ly/ZGY8V";;;;"1856051073";https://twitter.com/MedMinded/status/1856051073
bibirjahe;2009-05-20 04:34;0;0;"yaay i feel better :) bye bye influenza";;;;"1856025235";https://twitter.com/bibirjahe/status/1856025235
bibetto;2009-05-20 04:33;0;0;"@sheikjm mejor me llevo mi cubrebocas no valla a ser influenza :P";;@sheikjm;;"1856020159";https://twitter.com/bibetto/status/1856020159
ciper;2009-05-20 04:33;0;0;"RT @CronicadeS La Red de Periodistas de a Pie hace trabajo colectivo sobre la influenza http://tinyurl.com/c6adz4";;@CronicadeS;;"1856017955";https://twitter.com/ciper/status/1856017955
peterosbornuk;2009-05-20 04:32;0;0;"Animal health officials in China on May 17 reported an H5N1 avian influenza outbreak in wild birds in Qinghai province #swineflu #h1n1";;;#swineflu #h1n1;"1856013977";https://twitter.com/peterosbornuk/status/1856013977
LadyJany_;2009-05-20 04:31;0;0;"como dijo una buena amiga: "se nos viene el virus Influenza H1N1, ... subtipo ABC1????"";;;;"1856006142";https://twitter.com/LadyJany_/status/1856006142
alexdleon;2009-05-20 04:31;0;0;"Confirma SSPDF policía contagiado con virus de influenza http://www.milenio.com/node/217806";;;;"1856004919";https://twitter.com/alexdleon/status/1856004919
alexdleon;2009-05-20 04:31;0;0;"En Cuba dan de alta becarios mexicanos por influenza http://www.milenio.com/node/217827";;;;"1856002495";https://twitter.com/alexdleon/status/1856002495
Lokein;2009-05-20 04:28;0;0;"@ssunny331 Realistically, Swine Flu would be better than Influenza .";;@ssunny331;;"1855978023";https://twitter.com/Lokein/status/1855978023
monutacvbo;2009-05-20 04:27;0;0;"@leugimxD no le heches la culpa al fin de cuatrimestre, es la influenza la que ya te dejo asi, ya desvarias, y mas por lo del america. XD";;@leugimxD;;"1855974311";https://twitter.com/monutacvbo/status/1855974311
jesusre;2009-05-20 04:27;0;0;"Cómete un moco y si sabe a chicharron tienes influenza";;;;"1855969934";https://twitter.com/jesusre/status/1855969934
alfortune;2009-05-20 04:19;0;0;"新型 influenza と新型iphoneは姉妹ですか？";;;;"1855906567";https://twitter.com/alfortune/status/1855906567
julioponce;2009-05-20 04:17;0;0;"@milfgdl sinceramente y con mucho respeto, con ese avatar es dificil pensar en la influenza u_u";;@milfgdl;;"1855889501";https://twitter.com/julioponce/status/1855889501
santamonicasoft;2009-05-20 04:12;0;0;"10 Tips to Prevent Swine Flu at Home: What Parents Can Do. While we cant do much about the worldwide spread of influenza , there are 10";;;;"1855852531";https://twitter.com/santamonicasoft/status/1855852531
vicesparza;2009-05-20 04:12;0;0;"RT @Milenio : Jackson sorprende al aparecer en público sin cubrirse el rostro (Los Angeles) - ...pues eso, que ya pasó la influenza";;@Milenio;;"1855850369";https://twitter.com/vicesparza/status/1855850369
xangua;2009-05-20 04:09;0;0;"@il_Debasteitor casterns es naco¿ yo pensé que era el que introdujo la influenza";;@il_Debasteitor;;"1855824177";https://twitter.com/xangua/status/1855824177
xangua;2009-05-20 04:01;0;0;"@the_exxception next year¿¿ come today......prease.........i don't have #influenza";;@the_exxception;#influenza;"1855753530";https://twitter.com/xangua/status/1855753530
nzhealthsector;2009-05-20 04:01;0;0;"Influenza A (H1N1) planning being taken seriously by Lakes and Bay of Plenty DHBs: Lakes District Health B.. http://tinyurl.com/qjedrl";;;;"1855746271";https://twitter.com/nzhealthsector/status/1855746271
rodrigovega;2009-05-20 03:59;0;0;"Si veo a alguien con una mascarilla en la calle por temor a la influenza humana, me cago de la risa en su cara...";;;;"1855731524";https://twitter.com/rodrigovega/status/1855731524
immuneprotect;2009-05-20 03:56;0;0;"Tourism Suffers From Crisis and Influenza Threat: Awareness is Key ... http://bit.ly/uxgSg";;;;"1855700325";https://twitter.com/immuneprotect/status/1855700325
fernandofs;2009-05-20 03:55;0;0;"@sheikjm Creo que el lado oscuro te esta infectando en forma de influenza";;@sheikjm;;"1855690034";https://twitter.com/fernandofs/status/1855690034
cubareader;2009-05-20 03:54;0;0;"Confirma Cuba cuarto caso de Influenza A H1N1: Por su importancia reproducimos íntegramente la nota oficial del .. http://tinyurl.com/qfnpo7";;;;"1855673721";https://twitter.com/cubareader/status/1855673721
lilithlanz;2009-05-20 03:51;0;0;"Y sí...hay más fracturas de pene que casos de influenza oficiales en el mundo. Yisus Craist.";;;;"1855643228";https://twitter.com/lilithlanz/status/1855643228
ecodebate;2009-05-20 03:48;0;0;"Influenza A (H1N1): Que pandemia? artigo de Marcelo Leite http://www.ecodebate.com.br/go13717";;;;"1855616048";https://twitter.com/ecodebate/status/1855616048
chilenoblack;2009-05-20 03:46;0;0;"SON los Brocacochi los mas chanchoquis? Pura Influenza escolar";;;;"1855587744";https://twitter.com/chilenoblack/status/1855587744
latercera;2009-05-20 03:45;0;0;"Paraguay se une a lista de países contagiados por influenza AH1N1: Se trata de una mujer adulta que viajó recien.. http://twurl.nl/vmg0i8";;;;"1855579163";https://twitter.com/latercera/status/1855579163
ShukraZestful;2009-05-20 03:44;0;0;"hoy ando retro, voy a hablar de la #influenza";;;#influenza;"1855565245";https://twitter.com/ShukraZestful/status/1855565245
PazCrisostomo;2009-05-20 03:43;0;0;"insólito, somo el primer país que multiplicó por 10 la influenza ABC1, en menos de 3 días";;;;"1855562727";https://twitter.com/PazCrisostomo/status/1855562727
mmweather;2009-05-20 03:42;0;0;"WHO-quoat-19 May 2009, 40 countries have officially reported 9830 cases of influenza A(H1N1) infection, including 79 deaths.";;;;"1855549232";https://twitter.com/mmweather/status/1855549232
swinefluupdated;2009-05-20 03:40;0;0;"Influenza A (H1N1) - worldwide (31): case counts #swineflu http://tinyurl.com/q7ocg3";;;#swineflu;"1855530494";https://twitter.com/swinefluupdated/status/1855530494
crispassinato;2009-05-20 03:34;0;0;"Escola de enfermagem esclarece mitos sobre a Influenza A http://ff.im/33ITE";;;;"1855470666";https://twitter.com/crispassinato/status/1855470666
chidoguan;2009-05-20 03:33;0;0;"¿Ton's es neta que no nos vamos a morir todos de influenza ? ¿O me espero otra semana antes de presentar mi declaración anual al SAT?";;;;"1855463928";https://twitter.com/chidoguan/status/1855463928
lohkc;2009-05-20 03:30;0;0;"map of the spread of Influenza A(H1N1): number of laboratory confirmed cases and deaths as of 19 May 2009 http://href.in/hm72tk";;;;"1855436673";https://twitter.com/lohkc/status/1855436673
NewsMedical;2009-05-20 03:29;0;0;"Recommendations by experts to WHO on influenza A (H1N1) vaccines: Current epidemiological information suggests t.. http://tinyurl.com/p6m3ww";;;;"1855418834";https://twitter.com/NewsMedical/status/1855418834
claudiog;2009-05-20 03:28;0;0;"@micronauta Y ¿te resultó con @IvanValenzuela ? ;D La hija de un amigo va al colegio con nuevo caso de influenza H1ABC1...";;@micronauta @IvanValenzuela;;"1855417678";https://twitter.com/claudiog/status/1855417678
Mr_AP;2009-05-20 03:27;0;0;"RT: @el_universal : Taiwán anuncia su primer caso de influenza A http://rly.cc/CWn7m Toma eso Asia!";;@el_universal;;"1855402592";https://twitter.com/Mr_AP/status/1855402592
robsainz;2009-05-20 03:26;0;0;"RT @el_universal : Taiwán anuncia su primer caso de influenza A http://rly.cc/CWn7m";;@el_universal;;"1855398554";https://twitter.com/robsainz/status/1855398554
matiasalejandro;2009-05-20 03:25;0;0;"11 casos de " Influenza Humana" en 3 días... si, es como grave la cosa, rápida... a cuidarse! pero sin caos.";;;;"1855381553";https://twitter.com/matiasalejandro/status/1855381553
mhchealthcare;2009-05-20 03:23;0;0;"Taiwan reported it 1st confirmed case of Influenza A (H1N1)-a 52-year-old male doctor fr a cruise ship, who came fr Hong Kong";;;;"1855363659";https://twitter.com/mhchealthcare/status/1855363659
CRIbrk;2009-05-20 03:22;0;0;"Taiwan reports confirmed case of A/H1N1 influenza : BEIJING, May 20 (Xinhua) -- Taiwan's health authorities ... http://tinyurl.com/pu3cnr";;;;"1855360287";https://twitter.com/CRIbrk/status/1855360287
mhchealthcare;2009-05-20 03:20;0;0;"Influenza A (H1N1) infections in Japan rose to 196 (mostly school students) . Swine Flu Update from www.mhchealthcare.net";;;;"1855340660";https://twitter.com/mhchealthcare/status/1855340660
Rene_Henriquez;2009-05-20 03:20;0;0;"Bueno, hora de dormir...la influenza aún no llega a San Fernando... que me depara el futuro... espero y confio en que cosas buenas...bye";;;;"1855337477";https://twitter.com/Rene_Henriquez/status/1855337477
Fragman;2009-05-20 03:19;0;0;"EN CASA CON 2 CUENTEROS QUE ASEGURAN QUE LA INFLUENZA SE TOMO CURACAVI";;;;"1855328994";https://twitter.com/Fragman/status/1855328994
mdredza;2009-05-20 03:18;0;0;"Link: When virus have sex, we could be in trouble - WASHINGTON, May 20 - The new H1N1 influenza virus is now... http://tumblr.com/xmd1to2gn";;;;"1855315841";https://twitter.com/mdredza/status/1855315841
nikost;2009-05-20 03:13;0;0;"A propo del reportaje que dieron anoche en CHV... como que Porky #AH1N1 podría atacar a los flaytes ... qué creen? jajajaja #influenza #fb";;;#AH1N1 #influenza #fb;"1855273155";https://twitter.com/nikost/status/1855273155
TBS12001;2009-05-20 03:13;0;0;"New blog post: Confirma Cuba cuarto caso de Influenza A H1N1 http://bit.ly/BPyOP";;;;"1855271705";https://twitter.com/TBS12001/status/1855271705
warkoholic;2009-05-20 03:13;0;0;"Nuevos casos de virus ABC1H1: La Feña del Blog contrajo la gripe cota mil, así mismo Raquelita Calderón, tiene la Influenza pelolais, y más.";;;;"1855269609";https://twitter.com/warkoholic/status/1855269609
PETTTS;2009-05-20 03:13;0;0;"2008: Chinese Year of the Horse - Equine Influenza decimates Australian racing...";;;;"1855265891";https://twitter.com/PETTTS/status/1855265891
JulioCLopezR;2009-05-20 03:13;0;0;"Aislado y mareado, visto como un perro con sarna sólo porque tengo gripe. Gripe, no influenza";;;;"1855265806";https://twitter.com/JulioCLopezR/status/1855265806
Lexico;2009-05-20 03:12;0;0;"@Natsuki_gamer Dr. House tiene que terminar con la influenza .. .despues lo molestare con mis problemas... pero gracias... XD";;@Natsuki_gamer;;"1855263569";https://twitter.com/Lexico/status/1855263569
liberjuan;2009-05-20 03:11;0;0;"posible caso de influenza porcina en el oro, segun telesistema";;;;"1855248127";https://twitter.com/liberjuan/status/1855248127
H1N1VirusNews;2009-05-20 03:09;0;0;"Per& #xFA ;: Comunicado oficial No. 16 sobre situaci& #xF3 ;n de nueva influenza ... http://cli.gs/S8pJ0R";;;#xFA #xF3;"1855227837";https://twitter.com/H1N1VirusNews/status/1855227837
H1N1VirusNews;2009-05-20 03:09;0;0;"Influenza A(<B>H1N1</B>) - update 33 http://cli.gs/qDg7BM";;;;"1855227086";https://twitter.com/H1N1VirusNews/status/1855227086
mhchealthcare;2009-05-20 03:08;0;0;"Evidence available suggests that seasonal vaccines will confer little or no protection against influenza A(H1N1). What";;;;"1855218656";https://twitter.com/mhchealthcare/status/1855218656
maiconnieland;2009-05-20 03:07;0;0;"Suspeita de gripe suína( influenza A) em Lajeado / Era só o q me faltava, eu q não vo usar aquela mascarazinhas bregas !!!";;;;"1855215923";https://twitter.com/maiconnieland/status/1855215923
Drfabrega;2009-05-20 03:06;0;0;"Propuse con presidente regional del colegio médico que Isapres y Fonasa paguen tres primeros días de licencias médicas si es influenza";;;;"1855205271";https://twitter.com/Drfabrega/status/1855205271
crispassinato;2009-05-20 03:06;0;0;"http://migre.me/1jjn => ESCOLA DE ENFERMAGEM ESCLARECE MITOS SOBRE A INFLUENZA A";;;;"1855199739";https://twitter.com/crispassinato/status/1855199739
mhchealthcare;2009-05-20 03:05;0;0;"19 May 2009, 40 countries have officially reported 9830 cases of influenza A(H1N1) infection, including 79 deaths. (source WHO)";;;;"1855190617";https://twitter.com/mhchealthcare/status/1855190617
health;2009-05-20 03:04;0;1;"Dr. Anne Schuchat of the CDC says fatality rate for H1N1 appears to be slightly higher than for seasonal influenza . http://bit.ly/MEbsZ";;;;"1855177907";https://twitter.com/health/status/1855177907
canal_chile;2009-05-20 03:02;0;0;"Colegio The English Institute anuncia que alumno padece influenza H1N1 http://is.gd/Bwyz";;;;"1855163870";https://twitter.com/canal_chile/status/1855163870
Gripe_porcina;2009-05-20 03:01;0;0;"Ya son 11 los casos de influenza A en Chile - InfoBAE.com: Ya son 11 los casos de influenza A en ChileInfoBAE.co.. http://tinyurl.com/ohptcd";;;;"1855154410";https://twitter.com/Gripe_porcina/status/1855154410
Gripe_porcina;2009-05-20 03:01;0;0;"Influenza Aumentan a 36 los casos en Sonora - El Universal (México): Influenza Aumentan a 36 los casos en Sonora.. http://tinyurl.com/qcq62g";;;;"1855153359";https://twitter.com/Gripe_porcina/status/1855153359
jfrippes;2009-05-20 02:59;0;0;"11 casos de influenza a h1n1.....pero q rapido va ......";;;;"1855133580";https://twitter.com/jfrippes/status/1855133580
erickvisa;2009-05-20 02:59;0;0;"como por ejemplo, ya en los medios de comunicacion electronicos, no sales tanta noticia de la influenza ..!!";;;;"1855131499";https://twitter.com/erickvisa/status/1855131499
CrisisWatch;2009-05-20 02:54;0;0;"*EMM Disease Alerts* Media Release: Influenza A (H1N1) Swine Flu - Update Forty-four (Minist.. http://tinyurl.com/of7ahf";;;;"1855078016";https://twitter.com/CrisisWatch/status/1855078016
putrapraditya;2009-05-20 02:53;0;0;"Melihat titik cerah dr influenza yg menyiksa..amiiin http://myloc.me/1d0u";;;;"1855072318";https://twitter.com/putrapraditya/status/1855072318
obesity_tweet;2009-05-20 02:52;0;0;"Official questions closing schools when flu hits ... for influenza and its complications, Schuchat said, citing chron.. http://short.to/aibb";;;;"1855061130";https://twitter.com/obesity_tweet/status/1855061130
JuliaTupp;2009-05-20 02:49;0;0;"News WHO experts vaccines against H1N1 influenza at all will not be enough http://bnott.com/13285";;;;"1855027410";https://twitter.com/JuliaTupp/status/1855027410
