username;date;retweets;favorites;text;geo;mentions;hashtags;id;permalink
valezu;2009-07-18 01:24;0;0;"Se cierra el círculo: chanchos en Argentina tienen AH1N1";;;;"2699070063";https://twitter.com/valezu/status/2699070063
cholotv;2009-07-18 01:20;0;0;"Desfile militar por fiestas patrias en Perú se posterga por dos meses para prevenir gripe AH1N1 : http://bit.ly/7mOax";;;;"2699021527";https://twitter.com/cholotv/status/2699021527
cholotv;2009-07-18 01:20;0;0;"Víctimas mortales en Perú por gripe AH1N1 asciende a 11 personas: http://bit.ly/44IZYA";;;;"2699020382";https://twitter.com/cholotv/status/2699020382
tplatino;2009-07-18 00:36;0;0;"PRODUCTORES NOTIFICAN QUE CONCIERTOS EN COLISEO DE PUERTO RICO PODRIAN SER CANSELADOS POR ALERTAS DE LA PROPAGACION DEL AH1N1 EN LA ISLA";;;;"2698407566";https://twitter.com/tplatino/status/2698407566
Hector_Alvarado;2009-07-18 00:27;0;0;"Number of AH1N1 victims in Costa Rica: 11";;;;"2698281363";https://twitter.com/Hector_Alvarado/status/2698281363
Linkey;2009-07-18 00:24;0;0;"RT @jamrojo: acabo de ver la "cura" para la ah1n1 de una enfermera http://bit.ly/qn3QX // Colocale por último NSFW xD!!";;@jamrojo;;"2698242615";https://twitter.com/Linkey/status/2698242615
helisocorman;2009-07-18 00:22;0;0;"No se pierdan mi sección... ¿cuántos enfermos de AH1N1 hay en Chile? en El Practicante a las 20:30 hrs por la @universitaria";;@universitaria;;"2698210775";https://twitter.com/helisocorman/status/2698210775
NoticiasCaracol;2009-07-18 00:22;0;0;"Colombia logró identificar el mapa genético del virus AH1N1 : Según el Instituto Nacional de Salud, la comunidad .. http://cli.gs/mbu41";;;;"2698208890";https://twitter.com/NoticiasCaracol/status/2698208890
ensiz_news;2009-07-18 00:11;0;0;"Reforzará Veracruz cerco sanitario con estados del sureste por AH1N1 : El gobernador precisó que en coordinación .. http://bit.ly/4a8shT";;;;"2698055813";https://twitter.com/ensiz_news/status/2698055813
JerryNorstrom;2009-07-18 00:09;0;0;"Peru reports its 11th death on AH1N1 influenza and 113 new cases. http://bit.ly/uu7qA";;;;"2698026757";https://twitter.com/JerryNorstrom/status/2698026757