username;date;retweets;favorites;text;geo;mentions;hashtags;id;permalink
raygoma;2009-11-23 23:44;0;0;"Dato "útil" del día: La influenza AH1N1 es un buen pretexto para dejar de fumar este invierno.";;;;"5991735029";https://twitter.com/raygoma/status/5991735029
caminantee;2009-11-23 23:43;0;0;"oye @basstox : me enfermé hace meses de AH1N1 , mes de junio.. me mejoré hace rato.. yo pensé que te había contado compañero! :S";;@basstox;;"5991686602";https://twitter.com/caminantee/status/5991686602
SIPSE;2009-11-23 23:23;0;0;"En México no ha mutado el AH1N1 : Córdova http://bit.ly/4XkJLG";;;;"5991165655";https://twitter.com/SIPSE/status/5991165655
surnoticias;2009-11-23 23:18;0;0;"México ya cuenta con la vacuna contra la gripe AH1N1 http://www.canalsur.com/index.php?nro=89786&canal=Mexico&genero=";;;;"5991045247";https://twitter.com/surnoticias/status/5991045247
regioblogs2;2009-11-23 23:13;0;0;"Anuncia Secretaría de Salud llegada a Nuevo León de la primer remesa de vacunas contra Influenza AH1N1 http://tinyurl.com/yeqt9gt #twitmty";;;#twitmty;"5990907062";https://twitter.com/regioblogs2/status/5990907062
toniserra;2009-11-23 23:10;0;0;"Debate servido y calentito, a ver quien tiene la verdad..... AH1N1 http://www.kaosenlared.net/noticia/el-pais-contra-teresa-forcades";;;;"5990849810";https://twitter.com/toniserra/status/5990849810
EliasArriazola;2009-11-23 22:59;0;0;"Ando con gripe, pero el AH1N1 me la p-la...hasta ahora...jajaja";;;;"5990546343";https://twitter.com/EliasArriazola/status/5990546343
WRADIOMexico;2009-11-23 22:53;0;0;"Piden revisar efectos de vacuna AH1N1 en embarazadas http://bit.ly/4Q8Eai";;;;"5990381887";https://twitter.com/WRADIOMexico/status/5990381887
Noticias_Mexico;2009-11-23 22:47;0;0;"#Mexico Lucha contra AH1N1 y dengue será bien librada: Diputados http://tinyurl.com/y8vsvwp";;;#Mexico;"5990222519";https://twitter.com/Noticias_Mexico/status/5990222519
Dereckb;2009-11-23 22:34;0;0;"Hoy llegaron las primeras 650 mil vacunas contra la AH1N1 a México";;;;"5989869532";https://twitter.com/Dereckb/status/5989869532
indexstiri;2009-11-23 22:31;0;0;"http://www.indexstiri.ro/gaudeamus-intre-ah1n1-si-salman-rushdie.html Gaudeamus, între AH1N1 şi Salman Rushdie";;;;"5989791392";https://twitter.com/indexstiri/status/5989791392
JerryNorstrom;2009-11-23 22:13;0;0;"Influenza Update | Todo sobre la Influenza AH1N1 | All About ... http://bit.ly/5oM93Q";;;;"5989292121";https://twitter.com/JerryNorstrom/status/5989292121
JerryNorstrom;2009-11-23 22:13;0;0;"Ministry brings new vaccine to counter Novel Influenza AH1N1 ... http://bit.ly/5MwvaC";;;;"5989291161";https://twitter.com/JerryNorstrom/status/5989291161
JavTe;2009-11-23 22:10;0;0;"preparando clase de influenza AH1N1";;;;"5989224934";https://twitter.com/JavTe/status/5989224934
AnaPOrdorica;2009-11-23 22:07;0;0;"Estamos al aire en www.imagen.com.mx con el Dr Alejandro Macías sobre la AH1N1 ...también tendremos algo sobre mitin AMLO ayer...";;;;"5989139065";https://twitter.com/AnaPOrdorica/status/5989139065
ziarelive;2009-11-23 22:03;0;0;"In doua zile incepe vaccinarea anti AH1N1 . Cine are prioritate http://bit.ly/8zI0Vl";;;;"5989030236";https://twitter.com/ziarelive/status/5989030236
javirebull;2009-11-23 21:44;0;0;"@lcrystal30: regresando de comer y con ojos llorosos! esto de tener gripa no es lo de hoy caray! u_u<-- gripa o AH1N1 ? Cuidate Linda!!";;@lcrystal30;;"5988524542";https://twitter.com/javirebull/status/5988524542
glasul;2009-11-23 21:40;0;1;"Vindecare miraculoasă de gripa AH1N1 - Asistenta medicală din cadrul Spitalului Clinic Judeţean Arad care a fost c http://twurl.nl/xhbjm1";;;;"5988424871";https://twitter.com/glasul/status/5988424871
JuareZamora;2009-11-23 21:26;0;0;"AH1N1 virus is getting worst, we need medecine, and international support.";;;;"5988057973";https://twitter.com/JuareZamora/status/5988057973
perezpablo212;2009-11-23 21:18;0;0;"Hay rumores de que las vacunas anti AH1N1 las van a subrogar";;;;"5987842350";https://twitter.com/perezpablo212/status/5987842350
nashu;2009-11-23 21:14;0;0;"Basescu a adus criza mondiala si AH1N1 in Romania. In curand va aduce si ninsoarea.";;;;"5987743560";https://twitter.com/nashu/status/5987743560
zmenta;2009-11-23 21:14;0;0;"Cum prevenim gripa porcină sau virusul AH1N1 şi care sunt simptomele http://sp2.ro/f08f3c";;;;"5987733730";https://twitter.com/zmenta/status/5987733730
MicheleRivasi;2009-11-23 21:10;1;0;"Mots Croisés - "Grippe A: les Français font de la résistance" c'est maintenant sur France 2! #Bachelot #campagne #vaccin #AH1N1";;;#Bachelot #campagne #vaccin #AH1N1;"5987630418";https://twitter.com/MicheleRivasi/status/5987630418
nika7k;2009-11-23 21:06;0;0;"#flucast I came late. Did they discuss immunoassay testing of vax against the "new" D225G aH1N1 strain variant? Can we see the data?";;;#flucast;"5987530663";https://twitter.com/nika7k/status/5987530663
TerraMexico;2009-11-23 21:03;0;0;"Llegan 865 mil vacunas contra AH1N1 a México: http://bit.ly/5KhqbA";;;;"5987448633";https://twitter.com/TerraMexico/status/5987448633
WRADIOMexico;2009-11-23 20:47;1;0;"También en Hong Kong muta el virus AH1N1 http://bit.ly/4YsSYW";;;;"5987055960";https://twitter.com/WRADIOMexico/status/5987055960
brocha;2009-11-23 20:45;0;0;"#Lis o #ah1n1 - 3 osoby zmarły - panie Tomaszu a ile zmarło dzisiaj osób na raka? Kolejny sensata.";;;#Lis #ah1n1;"5987006082";https://twitter.com/brocha/status/5987006082
ziarul_gandul;2009-11-23 20:27;0;0;"În două zile începe vaccinarea anti AH1N1 . Cine are prioritate http://gandul.info/rd-5127594";;;;"5986524282";https://twitter.com/ziarul_gandul/status/5986524282
espectronico;2009-11-23 19:52;0;0;"Los europeos también dicen que el ah1n1 (el "ahí ni...") no es sino un virus de al mentis, mediático, político, florecitas virales de papel.";;;;"5985674105";https://twitter.com/espectronico/status/5985674105
swinefluh1n1;2009-11-23 19:51;0;0;"" AH1N1 jab by end December" http://tinyurl.com/y9p9ve3 #swineflu #H1N1";;;#swineflu #H1N1;"5985649244";https://twitter.com/swinefluh1n1/status/5985649244
srilankanews;2009-11-23 19:46;0;0;"AH1N1 jab by end December - Ceylon Daily News http://url4.eu/oYqz";;;;"5985518480";https://twitter.com/srilankanews/status/5985518480
JerryNorstrom;2009-11-23 19:43;0;0;"Influenza Update | Todo sobre la Influenza AH1N1 | All About Influenza http://bit.ly/5CPq7X";;;;"5985445581";https://twitter.com/JerryNorstrom/status/5985445581
Pamboleando;2009-11-23 19:34;0;0;"Regresa Rafa Márquez a los entrenamientos al confirmarse que no tiene el virus AH1N1 .";;;;"5985215401";https://twitter.com/Pamboleando/status/5985215401
noticierovv;2009-11-23 19:27;0;0;"Unos 2,5 millones de peregrinos se reúnen en La Meca a pesar de gripe AH1N1";;;;"5985037812";https://twitter.com/noticierovv/status/5985037812
lapantallaweb;2009-11-23 19:19;0;0;"Piden no temer a vacuna AH1N1 http://www.lapantallaweb.com/noticias/note.php?subaction=showfull&id=1259002895&archive=&start_from=&ucat=9&";;;;"5984852878";https://twitter.com/lapantallaweb/status/5984852878
OdCantu;2009-11-23 19:16;0;0;"@atticus_furx AH1N1 ... si necesitas cualquier cosa me dices, total q a mi ya me dio...";;@atticus_furx;;"5984784755";https://twitter.com/OdCantu/status/5984784755
novaordemmund;2009-11-23 19:14;3;1;"Grã-Bretanha: Paciente Morre Após Receber Vacina Contra Gripe Suína - http://shar.es/aiDSJ #ah1n1 #vacina";;;#ah1n1 #vacina;"5984732423";https://twitter.com/novaordemmund/status/5984732423
cambridgeuio;2009-11-23 19:01;0;0;"Llegan a México vacunas contra el virus AH1N1 : Ciudad de México, DPA México recibió hoy 865 000 dosis de vacuna.. http://bit.ly/6SlETB";;;;"5984413408";https://twitter.com/cambridgeuio/status/5984413408
EduPortas;2009-11-23 18:46;0;0;"Aplicarán el fin de semana vacunas contra AH1N1 http://www.ejecentral.com.mx/noticias/articulo/16357";;;;"5984036748";https://twitter.com/EduPortas/status/5984036748
NotiSaS;2009-11-23 18:42;0;0;"Beso navideño preferible en mejilla, para prevenir virus AH1N1 : Los expertos en etiqueta de Gran Bretaña recomendaron a http://url4.eu/oXGa";;;;"5983940162";https://twitter.com/NotiSaS/status/5983940162
migrantesecuado;2009-11-23 18:42;0;0;"Italia: Piden a trabajadoras domésticas protegerse de gripe AH1N1 http://www.migrantesecuador.org/content/view/4494/108/";;;;"5983924195";https://twitter.com/migrantesecuado/status/5983924195
heritage1972;2009-11-23 18:31;0;0;"los senadores alzan la mano para recibir sus vacunas vs la AH1N1 . dicen que ellos están en contacto con mucha gente! ay ajá!";;;;"5983643241";https://twitter.com/heritage1972/status/5983643241
Siempre889;2009-11-23 18:24;0;0;"Hola! Ya estamos en la Segunda de Panorama. Maru sigue aquí, ahora con Iñaki. Comenzamos con una buena noticia: ya hay vacuna vs gripe AH1N1";;;;"5983488314";https://twitter.com/Siempre889/status/5983488314
Gripe_porcina;2009-11-23 18:24;0;0;"Masivo peregrinaje a La Meca pese a peligros de la influenza AH1N1 (La Hora): Más de 2,5 millones de musulmanes.. http://bit.ly/5OVlqg";;;;"5983486028";https://twitter.com/Gripe_porcina/status/5983486028
CPCSI;2009-11-23 18:18;0;0;"Hoy llegaron a México las vacunas contra la influenza AH1N1";;;;"5983337925";https://twitter.com/CPCSI/status/5983337925
Pajaropolitico;2009-11-23 18:18;0;0;"Ya llegaron las primeras 865 mil vacunas contra la AH1N1 , experimentarán, perdón, las repartirán el próximo fin de semana, aparten la suya";;;;"5983335603";https://twitter.com/Pajaropolitico/status/5983335603
NotiSaS;2009-11-23 18:13;0;0;"El 15 de diciembre llegarán vacunas contra AH1N1 a Chihuahua: Chihuahua, Chih. (Segundoasegundo.com).- Será hasta el 15 http://url4.eu/oWdG";;;;"5983217930";https://twitter.com/NotiSaS/status/5983217930
echapple;2009-11-23 18:11;0;0;"@JavierSolorzano Vacuna contra la influenza AH1N1 !! wow el Gob. nos va salvar de morir a todos! Son unos santos! Habra Vacuna contrapolit..";;@JavierSolorzano;;"5983165603";https://twitter.com/echapple/status/5983165603
DAVIDRINCONGZ;2009-11-23 18:08;0;0;"QUIEN SERA EL PRIMERO EN RECIBIR LA FAMOSA VACUNA AH1N1";;;;"5983095083";https://twitter.com/DAVIDRINCONGZ/status/5983095083
garash;2009-11-23 17:59;0;0;"Voy a poner un negocio que ofrezca vacunas para AH1N1 con agua de tlacote, aparten su dosis contan solo 100 USD. DM.";;;;"5982877651";https://twitter.com/garash/status/5982877651
AndresTorres82;2009-11-23 17:58;0;0;"@Jochepin ... El barca y los q tienen la gripe ah1n1 tiene casi medio equipo titular jodido asi q la tiene bastante mal";;@Jochepin;;"5982838002";https://twitter.com/AndresTorres82/status/5982838002
Cambiomichoacan;2009-11-23 17:56;0;0;"En 21 días llegan a Michoacán 200 mil vacunas de la influenza AH1N1 . - Michoacan. http://bit.ly/7E5eH9";;;;"5982807773";https://twitter.com/Cambiomichoacan/status/5982807773
enomor;2009-11-23 17:56;0;0;"@mjcalvimontes podrías compartir + información de la AH1N1 , porque lo que sucede en el norte hoy, es lo que sucederá en el sur mañana...";;@mjcalvimontes;;"5982785939";https://twitter.com/enomor/status/5982785939
Owiruame;2009-11-23 17:54;0;0;"6mil vacunas AH1N1 para Chihuas... http://bit.ly/87D3ze Creo que ni para el padrón escolar alcanza :/";;;;"5982755172";https://twitter.com/Owiruame/status/5982755172
ContactoLatino;2009-11-23 17:52;0;0;"Iniciará el fin de semana vacunación contra AH1N1 | Milenio.com - Milenio - GN México http://bit.ly/8ENUyv";;;;"5982685295";https://twitter.com/ContactoLatino/status/5982685295
kjurek80;2009-11-23 17:51;0;0;"I favorited a YouTube video -- Polish Health Ministry on swine flu jabs issues AH1N1 English subtitles ... http://bit.ly/6alzzY";;;;"5982674223";https://twitter.com/kjurek80/status/5982674223
Destajador;2009-11-23 17:48;0;0;"señores twiteros pues yo con posible ah1n1 aquellos que me hayan mandado DM ir a un hospital jejeje no mentira lo del hospital pero yo si";;;;"5982594335";https://twitter.com/Destajador/status/5982594335
NotiSaS;2009-11-23 17:46;0;0;"Sujetas a análisis de seguridad, vacunas contra AH1N1 : México.- Las vacunas contra la influenza AH1N1 serán sometidas al http://url4.eu/oVw9";;;;"5982556475";https://twitter.com/NotiSaS/status/5982556475
sandracandy;2009-11-23 17:46;0;0;""Ssa pide no temer a la vacuna contra AH1N1 " ---> Esto lo dice todo.. no vacuna gracias.";;;;"5982537175";https://twitter.com/sandracandy/status/5982537175
mjcalvimontes;2009-11-23 17:44;0;0;"Hablando con mi hermano en Alemania. La AH1N1 está horrible por allá... :S";;;;"5982503690";https://twitter.com/mjcalvimontes/status/5982503690
ecordoba_;2009-11-23 17:42;0;0;"(EX online) Iniciar el fin de semana vacunacin contra AH1N1 - Anuncia secretario de Salud, Jos Angel Crdova Villalo... http://ow.ly/163NZv";;;;"5982436707";https://twitter.com/ecordoba_/status/5982436707
NoticiasVenezue;2009-11-23 17:41;0;0;"Beneficiados con primeras vacunas contra la gripe AH1N1 http://bit.ly/07RwNCh #noticiaoficialista";;;#noticiaoficialista;"5982418291";https://twitter.com/NoticiasVenezue/status/5982418291
chidoguan;2009-11-23 17:40;0;0;"¡Consíganme una vacuna contra la influenza! ¡La nueva civilización post- AH1N1 va a necesitar reír!";;;;"5982396389";https://twitter.com/chidoguan/status/5982396389
biobio;2009-11-23 17:20;0;0;"Más de 2,5 millones de peregrinos se reúnen en La Meca a pesar de gripe AH1N1 http://url.ie/2xzq";;;;"5981891104";https://twitter.com/biobio/status/5981891104
agoncalves67;2009-11-23 17:14;0;0;"RT: @noticias24 Primer lote de 650 mil vacunas contra gripe AH1N1 llega a México y en venezuela 300 tanques de guerra!!";;@noticias24;;"5981733044";https://twitter.com/agoncalves67/status/5981733044
mileniodiario;2009-11-23 17:01;0;0;"Iniciará el fin de semana vacunación contra AH1N1 http://bit.ly/7lMRwU";;;;"5981394063";https://twitter.com/mileniodiario/status/5981394063
LaAldea_Global;2009-11-23 16:53;0;0;"Al Minuto: EL miércoles se determinará el número de vacunas contra el AH1N1 para Puebla: Arango | 09:.. http://bit.ly/92iU9S";;;;"5981188590";https://twitter.com/LaAldea_Global/status/5981188590
Poblanerias;2009-11-23 16:52;0;0;"Vacuna contra influenza AH1N1 llega a Puebla en diciembre http://tinyurl.com/ye9lhdh";;;;"5981165024";https://twitter.com/Poblanerias/status/5981165024
Noticias_Mexico;2009-11-23 16:47;0;0;"#Mexico Pide PVEM reforzar campaña contra AH1N1 http://tinyurl.com/ydrpofj";;;#Mexico;"5981053594";https://twitter.com/Noticias_Mexico/status/5981053594
Siempre889;2009-11-23 16:42;1;0;"Ya están en México las primeras vacunas contra la influenza AH1N1 y tenemos los detalles en este momento en 88.9";;;;"5980913337";https://twitter.com/Siempre889/status/5980913337
Nibylandia;2009-11-23 16:40;0;0;"21 nov - 524 cases of AH1N1 in Poland, today - ?";;;;"5980863880";https://twitter.com/Nibylandia/status/5980863880
Nibylandia;2009-11-23 16:32;0;0;"It's interesting how many cases of ah1n1 virus would have been diagnosed if everybody with signs of flu was analised.";;;;"5980648535";https://twitter.com/Nibylandia/status/5980648535
edu_excelencia;2009-11-23 16:30;0;0;"Llegan hoy las vacunas contra AH1N1 , empezarán por aplicar a trabajadores del sector salud http://bit.ly/7STllI";;;;"5980596350";https://twitter.com/edu_excelencia/status/5980596350
MicheleRivasi;2009-11-23 16:21;0;0;"ce soir à 22h10 j'interviendrai dans l'émission Mots Croisés http://bit.ly/4yo4si aux côtés de #Bachelot #campagne #vaccin #grippeA #AH1N1";;;#Bachelot #campagne #vaccin #grippeA #AH1N1;"5980354121";https://twitter.com/MicheleRivasi/status/5980354121
noticias24;2009-11-23 16:20;0;0;"Primer lote de 650 mil vacunas contra gripe AH1N1 llega a México http://bit.ly/4Q7dVX";;;;"5980319945";https://twitter.com/noticias24/status/5980319945
RadioKAOZ;2009-11-23 16:09;0;0;"Llegan vacunas del AH1N1 primigéneo a México: sólo se vacunarán a embarazadas, enfermeras y doctores.";;;;"5980051375";https://twitter.com/RadioKAOZ/status/5980051375
RadioKAOZ;2009-11-23 16:08;0;0;"CONFIRMADO:Virus AH1N1 mutante no es más contagioso, pero pega más duro y hace sangrar pulmones. Noruega y Reino Unido con casos de neovirus";;;;"5980029743";https://twitter.com/RadioKAOZ/status/5980029743
RFI_Romania;2009-11-23 16:06;0;0;"AH1N1 : Primul deces înregistrat în România http://bit.ly/5XL3ej #social #economic";;;#social #economic;"5979970524";https://twitter.com/RFI_Romania/status/5979970524
Lauraartal;2009-11-23 16:02;0;0;"107 fallecidos por la gripe AH1N1";;;;"5979867806";https://twitter.com/Lauraartal/status/5979867806
Nibylandia;2009-11-23 16:01;0;0;"AH1N1 : In a hospital in Warsaw at ul. Niekłańskiej eight years old girl died today.";;;;"5979822561";https://twitter.com/Nibylandia/status/5979822561
NotiSaS;2009-11-23 15:36;0;0;"Llegan 650 mil vacunas contra el virus AH1N1 : Las primeras 650 mil vacunas contra la influenza A H1N1 llegan hoy al país http://url4.eu/oSEg";;;;"5979198493";https://twitter.com/NotiSaS/status/5979198493
anacecyra;2009-11-23 15:21;0;1;"@Radio13Noticias ¿650 millones de dosis AH1N1 vacuna?";;@Radio13Noticias;;"5978818935";https://twitter.com/anacecyra/status/5978818935
VTVNoticias;2009-11-23 15:18;0;0;"#RNV :: México: Arriban las primeras vacunas contra el virus AH1N1 http://bit.ly/6auXoe";;;#RNV;"5978732390";https://twitter.com/VTVNoticias/status/5978732390
AztecaNoticias;2009-11-23 15:03;0;0;"Llegan a México 650 mil vacunas contra influenza AH1N1 http://www.hechos.tv/bienestar/llegan-a-mexico-650-/v/14546";;;;"5978348988";https://twitter.com/AztecaNoticias/status/5978348988
primicias24;2009-11-23 14:57;0;0;"P24: México recibe primeras vacunas contra la gripe AH1N1 http://bit.ly/7OjAZ1";;;;"5978193704";https://twitter.com/primicias24/status/5978193704
ADNfm;2009-11-23 14:38;0;0;"Noruega detectó casos de mutación en el virus AH1N1 en tres pacientes.";;;;"5977736521";https://twitter.com/ADNfm/status/5977736521
JulioJMarquez;2009-11-23 14:36;0;0;"@salvagoxo Toy lejisimo de disney... Y pluto tiene la ah1n1";;@salvagoxo;;"5977711503";https://twitter.com/JulioJMarquez/status/5977711503
Katherinedsn;2009-11-23 14:31;0;0;"Y venezuela pa cuando?RT @noticierovv : México recibe primeras vacunas contra la gripe AH1N1";;@noticierovv;;"5977572425";https://twitter.com/Katherinedsn/status/5977572425
jhonnyramirez1;2009-11-23 14:30;0;0;"Que buena noticia... que Mexico ya haya recibido la primera vacuana para la gripe AH1N1 ...";;;;"5977565465";https://twitter.com/jhonnyramirez1/status/5977565465
HechosAM;2009-11-23 14:11;0;0;"El Dr. Miguel Ángel Lezana del Centro Nacional de Vigilancia Epidemiológica, confirma la llegada de las vacunas de la Influenza AH1N1 .";;;;"5977106524";https://twitter.com/HechosAM/status/5977106524
leojimenezcr;2009-11-23 14:09;0;0;"La única ministra que bretea en este puto gobierno es la de salud y es en una farsa como lo es la #AH1N1 :-/";;;#AH1N1;"5977075867";https://twitter.com/leojimenezcr/status/5977075867
videotesty;2009-11-23 14:09;0;0;""Grypa AH1N1 – Test | recenzja, specyfikacje, porady – VideoTesty.pl" - link nie znaleziony #404 #grypa #ah1n1 #humor #swinskagrypa";;;#404 #grypa #ah1n1 #humor #swinskagrypa;"5977075692";https://twitter.com/videotesty/status/5977075692
HechosAM;2009-11-23 14:07;0;0;"El Dr. Miguel Ángel Lezana del Centro Nacional de Vigilancia Epidemiológica habla en AM sobre las vacunas de la Influenza AH1N1 .";;;;"5977024380";https://twitter.com/HechosAM/status/5977024380
ivanangel;2009-11-23 14:07;0;0;"Ya llegaron las vacunas para el AH1N1 y luego?";;;;"5977012854";https://twitter.com/ivanangel/status/5977012854
hmonoticias;2009-11-23 14:03;0;0;"Llegan al Paí650 mil dosis contra AH1N1 http://hmonoticias.appspot.com/show/agtobW9ub3RpY2lhc3ILCxIDTmV3GJLYAgw";;;;"5976941258";https://twitter.com/hmonoticias/status/5976941258
tvnwarszawa;2009-11-23 13:59;0;0;"Zmarła dziewczynka z AH1N1 http://bit.ly/5atEEJ";;;;"5976826568";https://twitter.com/tvnwarszawa/status/5976826568
freemediaven;2009-11-23 13:52;0;0;"#FreeMediaVe México recibe primeras vacunas contra la gripe AH1N1 http://url4.eu/oPtI";;;#FreeMediaVe;"5976690227";https://twitter.com/freemediaven/status/5976690227
cwr_ro;2009-11-23 13:46;0;0;"Primul deces provocat de virusul AH1N1 in Romania: Astazi, in Romania a fost inregistrat primul deces provocat de noua http://bit.ly/6oC4Wu";;;;"5976545007";https://twitter.com/cwr_ro/status/5976545007
_alban;2009-11-23 13:39;0;0;"RT @MicheleRivasi : ce soir à 22h10 j'interviendrai dans l'émission Mots Croisés http://bit.ly/4yo4si aux côtés de #Bachelot #AH1N1";;@MicheleRivasi;#Bachelot #AH1N1;"5976405356";https://twitter.com/_alban/status/5976405356
StiriAzi;2009-11-23 13:37;0;0;"BREAKING NEWS: Primul deces cauzat de gripa AH1N1 in Romania http://tinyurl.com/yzd4mhy";;;;"5976362584";https://twitter.com/StiriAzi/status/5976362584
arcano17;2009-11-23 13:37;0;0;"Y adivinen a quien le va a echar la culpa Calderon de su mandato tan desastroso... Ahí les va una pista: AH1N1";;;;"5976357012";https://twitter.com/arcano17/status/5976357012
arcano17;2009-11-23 13:35;0;0;"Amarillistas!! Si bien el virus AH1N1 ya muto, el mismo aun se mata FACILMENTE con antibióticos.";;;;"5976318669";https://twitter.com/arcano17/status/5976318669
elimparcialcom;2009-11-23 13:32;0;0;"Llegan al País 650 mil dosis contra AH1N1 http://tinyurl.com/ycx448f";;;;"5976239896";https://twitter.com/elimparcialcom/status/5976239896
brk_alert;2009-11-23 13:25;0;0;"Romania’s Health Min Allots 1.34M AH1N1 Vaccine Doses For Certain Population Categories http://ping.fm/lzAG0";;;;"5976093325";https://twitter.com/brk_alert/status/5976093325
gazetamobi;2009-11-23 13:22;0;0;"Kolejne ofiary A/H1N1. W Warszawie zmarła 8-latka: Zmarły 3 kolejne osoby zrażone wirusem AH1N1 . Rzecznik Głów... http://bit.ly/4oCX9u";;;;"5976032785";https://twitter.com/gazetamobi/status/5976032785
wirtualnapolska;2009-11-23 13:06;0;0;"Kolejne trzy ofiary wirusa A/H1N1 w Polsce: Zmarły trzy kolejne osoby zrażone wirusem AH1N1 . Rzecznik GIS Jan B.. http://bit.ly/60Ixd5";;;;"5975715460";https://twitter.com/wirtualnapolska/status/5975715460
HoneyOnline;2009-11-23 13:06;0;0;"Noroc ca's sucevean... RT @eCostin : Primul deces din cauza virusului AH1N1 in Romania! http://bit.ly/5LJHHr (stirileprotv.ro)";;@eCostin;;"5975704495";https://twitter.com/HoneyOnline/status/5975704495
EvNightshade;2009-11-23 13:05;0;0;"@Bobbin_x Btw, waddaya have o.O? Hope it's not AH1N1";;@Bobbin_x;;"5975688326";https://twitter.com/EvNightshade/status/5975688326
RefreshRo;2009-11-23 13:04;0;0;"Primul deces din cauza virusului AH1N1 in Romania! http://sp2.ro/ee306c (stirileprotv.ro)";;;;"5975669506";https://twitter.com/RefreshRo/status/5975669506
antena_3;2009-11-23 12:57;0;0;"Antena 3: Concursul Miss România, amânat din cauza virusului AH1N1 (VIDEO) http://bit.ly/5mlbJl";;;;"5975524549";https://twitter.com/antena_3/status/5975524549
ionut_z_z;2009-11-23 12:50;0;0;"Primul deces din cauza virusului AH1N1 in Romania!: UPDATE: Este vorba despre un barbat de 43 de ani, din Siret.. http://bit.ly/6Urx0Z";;;;"5975394222";https://twitter.com/ionut_z_z/status/5975394222
HechosAM;2009-11-23 12:35;0;0;"Hoy llegan las primeras 650 mil vacunas del virus de la Influenza AH1N1 .";;;;"5975117023";https://twitter.com/HechosAM/status/5975117023
Marquesa20;2009-11-23 12:35;0;0;"DRAMA: RT @Cesarpierluissi : Chávez anuncia llegada a VZLA d más d 300 tanques y blindados. Y NI UNA SOLA VACUNA DE AH1N1 . Y VAN 107 MUERTOS!";;@Cesarpierluissi;;"5975113295";https://twitter.com/Marquesa20/status/5975113295
Bourjoi;2009-11-23 12:35;0;0;"AH1N1 nous permet de constater que le gouv. de Charest est un gros parleur petit faiseur jamais prêt.";;;;"5975104479";https://twitter.com/Bourjoi/status/5975104479
SorinNeagu;2009-11-23 12:27;0;0;"dk ai secretii nazale,febra mai mare de ... ,tuse,respiratie greoaie & o senzatie d discomfort e porcina.Deci dk esti fumator mucos ai AH1N1";;;;"5974962140";https://twitter.com/SorinNeagu/status/5974962140
AreliPaz;2009-11-23 12:20;0;0;"muto el virus de Influenza AH1N1 , en Noruega las primeras víctimas de una cepa más agresiva... En México hoy inicia vacunación...";;;;"5974832200";https://twitter.com/AreliPaz/status/5974832200
CosminGhinea;2009-11-23 12:19;0;0;"Primul deces cauzat de gripa AH1N1 în România - http://tinyurl.com/yety4z9";;;;"5974816854";https://twitter.com/CosminGhinea/status/5974816854
biobio;2009-11-23 12:18;0;0;"Más de 2,5 millones de peregrinos se reúnen en La Meca a pesar de gripe AH1N1 http://url.ie/2xvh";;;;"5974792603";https://twitter.com/biobio/status/5974792603
ziarul_gandul;2009-11-23 12:17;0;0;"BREAKING NEWS: Primul deces cauzat de gripa AH1N1 în România http://gandul.info/rd-5126259";;;;"5974786153";https://twitter.com/ziarul_gandul/status/5974786153
Searchingdream;2009-11-23 12:09;0;0;"Epidemic at school, AH1N1 ! There were only 9 persons in the class on 27 .";;;;"5974642725";https://twitter.com/Searchingdream/status/5974642725
brk_alert;2009-11-23 12:02;0;0;"Romania Registers First AH1N1 Fatality http://ping.fm/TfkKZ";;;;"5974533512";https://twitter.com/brk_alert/status/5974533512
adi_zabava;2009-11-23 11:49;0;0;"a murit primul roman din cauza ah1n1 . barbat, 43 de ani, era obez, avea diabet si hipertensiune. dar gripa a contat =))))";;;;"5974312488";https://twitter.com/adi_zabava/status/5974312488
redblooded;2009-11-23 11:45;0;0;"Romania are primul caz de deces din cauza gripei AH1N1";;;;"5974258382";https://twitter.com/redblooded/status/5974258382
OanaPortase;2009-11-23 11:41;2;0;"primul deces cauzat de AH1N1 in Ro";;;;"5974183929";https://twitter.com/OanaPortase/status/5974183929
ElNoticioso;2009-11-23 11:25;0;0;"Podría Rafael Márquez tener virus AH1N1 : El defensa mexicano del Barcelona amaneció con alta temperatura por lo que qued http://url4.eu/oMyF";;;;"5973930762";https://twitter.com/ElNoticioso/status/5973930762
elenadressel;2009-11-23 11:05;0;0;"Cuidado con la Porcina!!!! Ah, sorry, la AH1N1 ....";;;;"5973644449";https://twitter.com/elenadressel/status/5973644449
