username;date;retweets;favorites;text;geo;mentions;hashtags;id;permalink
ensiz_news;2009-10-27 23:56;0;0;"Las hijas de Obama se vacunan contra AH1N1 : La noticia contrasta con la situación de escasez de vacunas que atr.. http://bit.ly/BN5s4";;;;"5215268075";https://twitter.com/ensiz_news/status/5215268075
arqRuiz;2009-10-27 23:45;0;0;"@ShadowWarrior64 Yo apoyo eso , no vayas , te podes refriar y ahora anda la AH1N1 , peligrosisimo, ademas hay rayeria.";;@ShadowWarrior64;;"5214989054";https://twitter.com/arqRuiz/status/5214989054
twistedwritings;2009-10-27 23:24;0;0;"Recientemente me dio AH1N1 , de ahi mi inactividad, pero ya estoy mejor y espero estar de nuevo en mi escritorio esta noche, posteare pronto!";;;;"5214426069";https://twitter.com/twistedwritings/status/5214426069
twistedwritings;2009-10-27 23:23;0;0;"Recently I came down with AH1N1 so I have been a bit inactive, but Im back, want to be back on my desk tonight, hope to post something soon!";;;;"5214397422";https://twitter.com/twistedwritings/status/5214397422
RodolfoZapata;2009-10-27 23:19;0;0;"**Ojo** 50 mil 234 casos de influenza AH1N1 . 328 muertes. Hay que tomar precauciones de nuevo¡ No bajar las medidas sanitarias.";;;;"5214301767";https://twitter.com/RodolfoZapata/status/5214301767
StiriAzi;2009-10-27 22:59;0;0;"Un scenariu apocaliptic pentru victimele virusului AH1N1 . Barack Obama ii lasa pe batrani si pe handicapati fa http://tinyurl.com/yf2zxww";;;;"5213817616";https://twitter.com/StiriAzi/status/5213817616
El_Enigma;2009-10-27 22:46;0;0;"no se preocupen la @AMIPCI pide ya x + vacunas contra AH1N1 (dice q le haran caso ya q los senadores y laboratorios creen es medicamento)";;@AMIPCI;;"5213480391";https://twitter.com/El_Enigma/status/5213480391
LaAldea_Global;2009-10-27 22:33;0;0;"Al Minuto: Confirman 318 muertes por influenza AH1N1 en México | 16:25 PM #Nacional #Noticias : La Sec.. http://bit.ly/1mn0ZH";;;#Nacional #Noticias;"5213131588";https://twitter.com/LaAldea_Global/status/5213131588
jorgitomacumba;2009-10-27 22:31;0;0;"http://bit.ly/2XtilD No olviden hacerse fans de Macumba!! La rifa de la lechona que había sido aplazada por AH1N1 se viene para diciembre!";;;;"5213085449";https://twitter.com/jorgitomacumba/status/5213085449
BetoSalva;2009-10-27 22:23;0;0;"Ahora sólo falta que la AMIPCI nos ayude a erradicar la influenza AH1N1 #amipciNOnecesaria";;;#amipciNOnecesaria;"5212895008";https://twitter.com/BetoSalva/status/5212895008
ToaoSV;2009-10-27 22:22;0;0;"Ese lo trajo Zelaya !!! RT @esmitv : Noticia | Salud confirma brote epidémico de AH1N1 en zona fronteriza con Honduras. http://bit.ly/2xEKeS";;@esmitv;;"5212858831";https://twitter.com/ToaoSV/status/5212858831
SaulSalsa;2009-10-27 22:17;0;0;"Disfraz de virus de la Influenza AH1N1 descartado por falta de tiempo :S...";;;;"5212750678";https://twitter.com/SaulSalsa/status/5212750678
najlaebb;2009-10-27 22:09;0;0;"330 cas officiels de grippe AH1N1 au Maroc. Pandémie?";;;;"5212530866";https://twitter.com/najlaebb/status/5212530866
NotiSaS;2009-10-27 21:40;0;0;"AH1N1 afecta principalmente a personas con obesidad: Chihuahua, Chih. (Segundoasegundo.com).- El virus de la influenza t http://url4.eu/gBjE";;;;"5211805577";https://twitter.com/NotiSaS/status/5211805577
AgenciaCN;2009-10-27 21:23;0;0;"Min Salud confirmó 95 muertes por AH1N1 http://www.acn.com.ve";;;;"5211403800";https://twitter.com/AgenciaCN/status/5211403800
Nickattak;2009-10-27 21:23;0;0;"Prof Nicolas va donner ses cours. J'me met à freaker avec AH1N1 , c'est tellement le genre de mes élèves de venir à l'article de la mort";;;;"5211393406";https://twitter.com/Nickattak/status/5211393406
DesahogoCL;2009-10-27 21:06;0;0;"Joven sufre de rara enfermedad,por vacuna contra la ah1n1 : NIÑA CHEERLEADER QUE AL VACUNARSE CONTRA LA GRIPE PO.. http://bit.ly/2sVXOM";;;;"5210974269";https://twitter.com/DesahogoCL/status/5210974269
esmitv;2009-10-27 21:00;0;0;"Noticia | Salud confirma brote epidémico de AH1N1 en zona fronteriza con Honduras. http://bit.ly/2xEKeS";;;;"5210817370";https://twitter.com/esmitv/status/5210817370
TotiCasanova;2009-10-27 20:56;0;0;"RT @NeoGabox : El estado Bolívar es el tercer estado con más casos de AH1N1 :/ según las estadísticas no maquilladas...";;@NeoGabox;;"5210727364";https://twitter.com/TotiCasanova/status/5210727364
KimTuDien;2009-10-27 20:51;0;0;"WebHay.com Kim Hyun Joong kể về trận cúm AH1N1 http://bit.ly/1xXDVp";;;;"5210601907";https://twitter.com/KimTuDien/status/5210601907
NeoGabox;2009-10-27 20:44;0;0;"Los dos pacientes con AH1N1 de mi servicio no son casos confirmados, sino sospechosos, ambos inmunodeprimidos...";;;;"5210428582";https://twitter.com/NeoGabox/status/5210428582
CaracolRadio;2009-10-27 20:42;0;0;"Los colombianos están desarrollando anticuerpos contra la gripa AH1N1 http://bit.ly/1WYfAV";;;;"5210388426";https://twitter.com/CaracolRadio/status/5210388426
Tikkikun;2009-10-27 20:40;0;0;"AH1N1 por las... RT @jimmyfa : El sexo inseguro, el alcohol y la obesidad son unos de los mayores asesinos del mundo o_O http://bit.ly/3h0MTu";;@jimmyfa;;"5210319550";https://twitter.com/Tikkikun/status/5210319550
olgageorgina;2009-10-27 20:31;0;0;"RT @HarvardHealth : As... flu ( AH1N1 ) pandemic becomes more serious, Harvard Medical School launched its new iPhone app-http://bit.ly/1fdOhi";;@HarvardHealth;;"5210113310";https://twitter.com/olgageorgina/status/5210113310
Terracolombia;2009-10-27 20:31;0;0;"Muertos por gripa AH1N1 ascienden a 131 en Colombia http://bit.ly/22wj82";;;;"5210099229";https://twitter.com/Terracolombia/status/5210099229
PanoramaDiario;2009-10-27 20:11;0;0;"Sespas anuncia en diciembre llegarán vacunas contra gripe AH1N1 http://bit.ly/39iFpa";;;;"5209645094";https://twitter.com/PanoramaDiario/status/5209645094
EnLasRedesMX;2009-10-27 20:11;0;0;"Virus AH1N1 ataca a la Liga Premier http://bit.ly/m1QLo #deportes";;;#deportes;"5209644680";https://twitter.com/EnLasRedesMX/status/5209644680
VTVNoticias;2009-10-27 20:06;0;0;"#YVKEMundial :: Disminuye impacto del Virus AH1N1 :        &nb.. http://bit.ly/2NHxnL";;;#YVKEMundial;"5209525109";https://twitter.com/VTVNoticias/status/5209525109
CronicaLoja;2009-10-27 20:05;0;0;"7 casos reportados de AH1N1 suman 140 en Loja: Fabiola Barba Tapia, epidemióloga Provincial, informó que llegar.. http://bit.ly/KUQxC";;;;"5209499801";https://twitter.com/CronicaLoja/status/5209499801
technomade;2009-10-27 19:55;0;0;"Y'a que la fin qui m'agace un peu... RT @mcommemaman : Un article intéressant et tellement bien écrit à propos de AH1N1 http://bit.ly/2AtcCb";;@mcommemaman;;"5209266216";https://twitter.com/technomade/status/5209266216
mcommemuses;2009-10-27 19:45;0;0;"Un article hyper-intéressant et tellement bien écrit à propos de AH1N1 http://www.ledevoir.com/2009/10/19/272310.html à lire!!";;;;"5209040599";https://twitter.com/mcommemuses/status/5209040599
freemediaven;2009-10-27 19:44;0;0;"#FreeMediaVe Redes de atención y filtros sanitarios minimizan impacto de virus AH1N1 en Falcón http://url4.eu/gAeB";;;#FreeMediaVe;"5209009571";https://twitter.com/freemediaven/status/5209009571
SNMP_ve;2009-10-27 19:42;0;0;"#abn Redes de atención y filtros sanitarios minimizan impacto de virus AH1N1 en Falcón: El impacto que ha tenido el viru http://url4.eu/gAda";;;#abn;"5208969352";https://twitter.com/SNMP_ve/status/5208969352
jorgecortex;2009-10-27 19:32;0;0;"No entiendo por qué a Uribe se le pego el virus del AH1N1 si siempre se lava las manos ¿?";;;;"5208732306";https://twitter.com/jorgecortex/status/5208732306
jricardo27;2009-10-27 19:30;0;0;"No sabia que las dos dosis de vacuna contra la #AH1N1 se ponian al mismo tiempo, una en cada brazo http://bit.ly/2Go4UZ (pobre niña)";;;#AH1N1;"5208692408";https://twitter.com/jricardo27/status/5208692408
stirieuropafm;2009-10-27 19:08;0;0;"Cursuri suspendate o săptămână în şcoala unde au fost depistaţi elevi cu AH1N1 http://bit.ly/30hCn";;;;"5208197718";https://twitter.com/stirieuropafm/status/5208197718
nany9;2009-10-27 18:48;0;0;"@carlaangola y nadie dice nada y admas esta contaminado de ah1n1 y el gobierno no reporta las cifras ni actua.. informa x favor";;@carlaangola;;"5207732926";https://twitter.com/nany9/status/5207732926
daniElGrajo;2009-10-27 18:44;0;0;"sick with AH1N1 ... swine flu... but getting better now... stronger than ever!";;;;"5207645099";https://twitter.com/daniElGrajo/status/5207645099
blogdelcegi;2009-10-27 18:30;0;0;"NACIONAL... IP contra alza de impuestos... CFE venderá electricidad a Guatemala... Descartan alerta por AH1N1 ... http://cegi.blogspot.com/";;;;"5207320038";https://twitter.com/blogdelcegi/status/5207320038
samantha_mmo3;2009-10-27 18:25;0;0;"En la liga Premiere les han pedido no escupir en el campo de fútbol para no propagar la influenza AH1N1 . Creería que en México se haría 1ro.";;;;"5207203710";https://twitter.com/samantha_mmo3/status/5207203710
deportes2;2009-10-27 18:22;0;0;"Jugadores de la Liga Premier de fútbol afectados por el virus AH1N1 : Bolton. - Dos equipos de la Lig.. http://bit.ly/gxnjI Deportes2";;;;"5207136998";https://twitter.com/deportes2/status/5207136998
PanoramaDiario;2009-10-27 18:11;0;0;"Aumenta a 33 muertes por dengue; virus habría fusionado a gripe AH1N1 http://bit.ly/8ptKV";;;;"5206896758";https://twitter.com/PanoramaDiario/status/5206896758
canaldelfutbol;2009-10-27 18:06;0;0;"El virus AH1N1 ataca a Liga Premier: Filed under: Fútbol, Fútbol InglésLos focos rojos se encendieron en el f&u.. http://bit.ly/m1QLo";;;;"5206768993";https://twitter.com/canaldelfutbol/status/5206768993
aguaymanto;2009-10-27 18:02;0;0;"noticias malas del día: 1) atropellaron en la faucett a gastón, el afgano de mi tía. 2) mi prima de 12 años q vive en VA está con la AH1N1 .";;;;"5206688011";https://twitter.com/aguaymanto/status/5206688011
PanamericanaTV;2009-10-27 17:58;0;0;"UE pide no subestimar peligrosidad de la gripe AH1N1 , léalo en http://www.24horas.com.pe/salud/1256655592.php";;;;"5206597418";https://twitter.com/PanamericanaTV/status/5206597418
saulbaloo;2009-10-27 17:51;0;0;"Discutiendo el documento de la secretaria de salud para las medidas a aplicar para el ah1n1 en los bancos";;;;"5206447428";https://twitter.com/saulbaloo/status/5206447428
ionut_z_z;2009-10-27 17:47;0;0;"O scoala din Iasi a fost inchisa din cauza gripei AH1N1 : Decizie extrema luata de autoritatile din Iasi. In pre.. http://bit.ly/2IdY21";;;;"5206338510";https://twitter.com/ionut_z_z/status/5206338510
Takiones;2009-10-27 17:38;0;0;"#Temblores #Sinagua #sinluz #paros #muertes #dieta #totumas #Tornados #dengue #tuberculosis #AH1N1 ,... Que mas le pasará a #Venezuela ?";;;#Temblores #Sinagua #sinluz #paros #muertes #dieta #totumas #Tornados #dengue #tuberculosis #AH1N1 #Venezuela;"5206133432";https://twitter.com/Takiones/status/5206133432
deportesalcien;2009-10-27 17:35;0;0;"El Betis sufre con el virus AH1N1 . http://www.marca.com/2009/10/27/futbol/equipos/betis/1256644576.html";;;;"5206078065";https://twitter.com/deportesalcien/status/5206078065
ECRA;2009-10-27 17:18;0;0;"Desconfían chinos de vacuna contra AH1N1 <-- por razones de "calidad" http://bit.ly/25e0Cu -> Ni ellos quieren consumir lo made in china...";;;;"5205663418";https://twitter.com/ECRA/status/5205663418
Left_News;2009-10-27 17:15;0;0;"AH1N1 Swine Flu incidence reaches over 4000 - http://gclink.us/xa9nl/ [ @communistsusa ] #comrade";;@communistsusa;#comrade;"5205592264";https://twitter.com/Left_News/status/5205592264
NotiSalud;2009-10-27 16:09;0;0;"Primero lo primero: Canadá recibió un lote importante de vacunas contra el virus AH1N1 www.notisalud.com.ve";;;;"5204038789";https://twitter.com/NotiSalud/status/5204038789
hmonoticias;2009-10-27 15:59;0;0;"Suman en Sonora 2 mil 363 casos de influenza AH1N1 : http://tinyurl.com/yggkqj2";;;;"5203780859";https://twitter.com/hmonoticias/status/5203780859
cubablogfeed;2009-10-27 15:28;0;0;"#cuba Prisionero de conciencia cubano con virus AH1N1 : Álvaro Yero Felipe http://bit.ly/2prKal cuba";;;#cuba;"5203033739";https://twitter.com/cubablogfeed/status/5203033739
omarperez1130;2009-10-27 15:17;0;0;"debido a ah1n1 ya no pude ver a mi hijo ni a mi esposa";;;;"5202762544";https://twitter.com/omarperez1130/status/5202762544
prensa_latina;2009-10-27 15:14;0;0;"Mueren cuatro personas en Rusia por gripe AH1N1 - Prensa Latina http://bit.ly/2RAHqh";;;;"5202697196";https://twitter.com/prensa_latina/status/5202697196
Joiedevivre66;2009-10-27 15:12;0;0;"Le petit guide "Autosoins ( AH1N1 )" du Gouvernement du Québec en version PDF: http://tinyurl.com/yh4obfg";;;;"5202641007";https://twitter.com/Joiedevivre66/status/5202641007
Nelicksa;2009-10-27 15:10;0;0;"Buenos dias twitter, solo paso x aca para avisarles q sigo viva, q no m he contagiado de ah1n1 ni nada de eso... solo q tengo mucho trabajo";;;;"5202608321";https://twitter.com/Nelicksa/status/5202608321
106dance;2009-10-27 15:06;0;0;"Vaccin AH1N1 : En Allemagne, le 2 poids 2 mesures ! (vidéo) http://is.gd/4Eowz";;;;"5202508432";https://twitter.com/106dance/status/5202508432
lojesa;2009-10-27 14:58;0;0;"Es evidente y preocupante la desinformación de autoridades de Sonora sobre AH1N1 . Cifras contradictorias y carencia de medidas preventivas.";;;;"5202310662";https://twitter.com/lojesa/status/5202310662
rimbus;2009-10-27 14:45;0;0;"@dagrouik fais toi plutôt vacciner contre AH1N1 : elle est très dangereuse pour les gens ayant des pbs respiratoires !";;@dagrouik;;"5202010804";https://twitter.com/rimbus/status/5202010804
mariajoafana;2009-10-27 14:33;0;0;""No entiendo por qué a Uribe se le pego el virus del AH1N1 si siempre se lava las manos". Blog de Luis Fernando Afanador";;;;"5201737120";https://twitter.com/mariajoafana/status/5201737120
ChayTunacao;2009-10-27 14:31;0;0;"@4privetdrive why, do you reckon it's AH1N1 ? I hope that your mother would agree. get well mate";;@4privetdrive;;"5201692938";https://twitter.com/ChayTunacao/status/5201692938
sandufloarea;2009-10-27 14:28;0;0;"Trei elevi de clasa a cincea şi două studente din Iaşi au ajuns la spital, diagnosticaţi cu virusul AH1N1 . Autorităţile medicale ie...";;;;"5201608363";https://twitter.com/sandufloarea/status/5201608363
elcomerciocom;2009-10-27 14:26;0;0;"Rusia registra las dos primeras muertes por gripe AH1N1 http://bit.ly/3DOxrD";;;;"5201567418";https://twitter.com/elcomerciocom/status/5201567418
Calibre_57;2009-10-27 14:10;0;0;"En Monclova, amenaza la AH1N1 ; 4 internados graves | http://bit.ly/bW6ZD";;;;"5201210429";https://twitter.com/Calibre_57/status/5201210429
iona2009;2009-10-27 14:10;0;0;"Van 95 fallecidos en todo el país por la gripe AH1N1";;;;"5201204312";https://twitter.com/iona2009/status/5201204312
Almomentonet;2009-10-27 13:48;0;0;"OMS: La política no debe impedir la cooperación internacional ante AH1N1 http://bit.ly/7h5EP";;;;"5200711187";https://twitter.com/Almomentonet/status/5200711187
ELDEBATE;2009-10-27 13:46;0;0;"Vacuna contra influenza AH1N1 estará hasta diciembre http://bit.ly/49WkVH";;;;"5200673095";https://twitter.com/ELDEBATE/status/5200673095
MarySobrino;2009-10-27 13:41;0;0;"En minutos vanesa covo, hermana de josè de jesùs covo, quien padeciò la gripe AH1N1";;;;"5200565555";https://twitter.com/MarySobrino/status/5200565555
elimpulsocom;2009-10-27 13:37;0;0;"Van cinco muertes en Lara:Es necesario descartar AH1N1 cuando comienzan los síntomas http://bit.ly/1mQUaH";;;;"5200491232";https://twitter.com/elimpulsocom/status/5200491232
hmonoticias;2009-10-27 13:31;0;0;"Hay 17 alumnos con AH1N1 en Pesqueira: http://tinyurl.com/yzzkp3f";;;;"5200343484";https://twitter.com/hmonoticias/status/5200343484
cubareader;2009-10-27 13:23;0;0;"Cuba recibirá vacuna contra el virus de la influenza AH1N1 :   Cuba será uno de los 100 países a los que la Orga.. http://bit.ly/3RCBEg";;;;"5200196566";https://twitter.com/cubareader/status/5200196566
IngLucho;2009-10-27 13:11;0;0;"Los venezolanos estamos algo salados, primero la AH1N1 , luego los apagones, ahora el Dengue... Pero tranquilos, que ahora toca rac de Agua!!";;;;"5199947779";https://twitter.com/IngLucho/status/5199947779
RegionalDigital;2009-10-27 13:06;0;0;"Cientos se vacunan contra el AH1N1 en Ponce http://bit.ly/nAZOQ";;;;"5199827685";https://twitter.com/RegionalDigital/status/5199827685
LaAldea_Global;2009-10-27 13:03;0;0;"Al Minuto: Tres muertes por influenza AH1N1 en China | 07:26 AM #Internacional #Noticias : Con el dece.. http://bit.ly/2GSWj4";;;#Internacional #Noticias;"5199779604";https://twitter.com/LaAldea_Global/status/5199779604
korbu;2009-10-27 12:42;0;0;"El indice de muertes por gripes como la #AH1N1 es del 3-4%, en #Venezuela es de mas de 8%";;;#AH1N1 #Venezuela;"5199341983";https://twitter.com/korbu/status/5199341983
lahueca;2009-10-27 12:21;0;0;"Alarma en Consejo por AH1N1 http://bit.ly/3ZkNuO";;;;"5198952668";https://twitter.com/lahueca/status/5198952668
edowoo;2009-10-27 12:04;0;0;"Expertos advierten que AH1N1 será más grave en 2010 http://ff.im/-aAD95";;;;"5198748273";https://twitter.com/edowoo/status/5198748273
oneflightdown;2009-10-27 11:37;0;0;"Wow, FAKE vaccine for AH1N1 ? How pathetic does that sound?";;;;"5198423349";https://twitter.com/oneflightdown/status/5198423349
latercera;2009-10-27 11:04;0;0;"Expertos advierten que AH1N1 será más grave en 2010: Esto debido al agresivo comportamiento que ha tenido el vi.. http://twurl.nl/75znic";;;;"5197989995";https://twitter.com/latercera/status/5197989995
Anzoateguivive;2009-10-27 11:03;0;0;"Gobierno nacional confirma 1.910 casos de AH1N1 http://bit.ly/4t00D1 #anzoategui #Honduras";;;#anzoategui #Honduras;"5197980445";https://twitter.com/Anzoateguivive/status/5197980445
JerryNorstrom;2009-10-27 10:25;0;0;"Over the hump? | Todo sobre la Influenza AH1N1 | All About Influenza http://bit.ly/2tyHdM";;;;"5197457745";https://twitter.com/JerryNorstrom/status/5197457745
SociableSport;2009-10-27 10:13;0;0;"Apparently a daily update... watching out for trend! RT @EUinNL : Influenza AH1N1 Situation Report 0900hrs http://tinyurl.com/yl65btr #H1N1";;@EUinNL;#H1N1;"5197296703";https://twitter.com/SociableSport/status/5197296703
EUinNL;2009-10-27 10:11;0;0;"091027 Influenza AH1N1 Situation Report 0900hrs http://tinyurl.com/yl65btr";;;;"5197280262";https://twitter.com/EUinNL/status/5197280262
laverdadweb;2009-10-27 09:48;0;0;"Estuvo 35 días con gripe AH1N1 en la UCI del Universitario http://bit.ly/1bMSgg";;;;"5197010621";https://twitter.com/laverdadweb/status/5197010621
Miecuadorqerido;2009-10-27 09:14;0;0;"Alarma en Consejo por AH1N1 : Empleados de la Prefectura de Los Ríos ingresaron ayer a laborar con mascarillas p.. http://chilp.it/?e4b10e";;;;"5196635958";https://twitter.com/Miecuadorqerido/status/5196635958
_Gyermo;2009-10-27 08:56;0;0;"Aunque me hayas unfolloweado te hago a este>RT @KenoUno :Efectos secundarios de la vacuna contra AH1N1 (video en ingles) http://bit.ly/2pgH7I";;@KenoUno;;"5196432522";https://twitter.com/_Gyermo/status/5196432522
OneSilentSmoke;2009-10-27 08:31;0;0;"Rusia confirma los dos primeras muertes por gripe AH1N1 (EL MUNDO) http://tinyurl.com/yk9rvcx";;;;"5196171857";https://twitter.com/OneSilentSmoke/status/5196171857
Sparky_Joe;2009-10-27 08:27;0;0;"resisto alla ah1n1 che mi tartassa. sembro finito sotto un camion";;;;"5196126973";https://twitter.com/Sparky_Joe/status/5196126973
informazione;2009-10-27 08:25;0;0;"Influenza suina, qualche dettaglio sul virus AH1N1 : Fonte: SanremonewsIl virus A(H1N1), è stato originariamente.. http://bit.ly/iedus";;;;"5196110952";https://twitter.com/informazione/status/5196110952
elEconomistaRSS;2009-10-27 06:46;0;0;"China vacuna contra la gripe A a los musulmanes que viajen a La Meca: China vacunará contra la gripe AH1N1 a todos ... http://bit.ly/2gj0EJ";;;;"5195089278";https://twitter.com/elEconomistaRSS/status/5195089278
tanhooiming;2009-10-27 06:32;0;0;"feel like the AH1N1 frenzy is back =.=";;;;"5194930669";https://twitter.com/tanhooiming/status/5194930669
KenoUno;2009-10-27 06:03;0;0;"Efectos secundarios de la vacuna contra AH1N1 (video en ingles) http://bit.ly/2pgH7I";;;;"5194587551";https://twitter.com/KenoUno/status/5194587551
paw;2009-10-27 04:59;0;2;"jajajaja en este video nos recuerdan cómo cuidarnos de AH1N1 : http://bit.ly/3ATo2m";;;;"5193696317";https://twitter.com/paw/status/5193696317
disidencia;2009-10-27 04:24;0;0;"q amenaza será mayor? la influenza ah1n1 o las componendas de nuestros legisladores?";;;;"5193125699";https://twitter.com/disidencia/status/5193125699
DoomSlayers;2009-10-27 03:21;0;0;"Um... AH1N1";;;;"5191926477";https://twitter.com/DoomSlayers/status/5191926477
pierre_foucart;2009-10-27 03:06;0;0;"This article sums up everyhing I think about the AH1N1 @NYDailyNews http://bit.ly/3i5pIf";;@NYDailyNews;;"5191608796";https://twitter.com/pierre_foucart/status/5191608796
ernestogfa;2009-10-27 03:04;0;0;"ABN / Gobierno ha suministrado más de 40 mil tratamientos gratuitos contra AH1N1 http://is.gd/4Dtso";;;;"5191558966";https://twitter.com/ernestogfa/status/5191558966
mtl_Marie;2009-10-27 02:52;0;0;"I just love the fact that i just realized that I'm scheduled for my AH1N1 flu shot in the morning at the end of my shift and that our";;;;"5191297113";https://twitter.com/mtl_Marie/status/5191297113
eleconomista;2009-10-27 02:36;0;0;"No vamos tarde contra el AH1N1 : Secretaría de Salud: WASHINGTON DC. leer más http://bit.ly/1htwAl";;;;"5190941956";https://twitter.com/eleconomista/status/5190941956
argelmatta;2009-10-27 02:27;0;0;"Conio estoy empezando a preocuparme!! hablando en serio no sera gripe AH1N1 lo q tengo????";;;;"5190719948";https://twitter.com/argelmatta/status/5190719948
LytaF;2009-10-27 02:22;0;0;"@stellar_vzla más peste? Si ya tenemos casi las 7 plagas completas: Dengue, paludismo, AH1N1 ... Sin contar con CH! Na wará...";;@stellar_vzla;;"5190624076";https://twitter.com/LytaF/status/5190624076
GobiernoJalisco;2009-10-27 02:22;0;0;"La obesidad, asma, diabetes, grupo de edad y embarazo como factores de riesgos asociados a influenza AH1N1 : SSJ. http://bit.ly/3sSzV";;;;"5190621412";https://twitter.com/GobiernoJalisco/status/5190621412
zarkanitos;2009-10-27 02:09;0;0;"@carlamariela Muro de berlín, 9/11, AH1N1";;@carlamariela;;"5190310946";https://twitter.com/zarkanitos/status/5190310946
nani_nuni;2009-10-27 01:51;0;0;"RT @caldo_de_cabeza : Le habra dado AH1N1 a @nani_nuni que no aparece xD//jajajja apareci! :P";;@caldo_de_cabeza @nani_nuni;;"5189873143";https://twitter.com/nani_nuni/status/5189873143
daproli;2009-10-27 01:51;0;0;"Con racionamiento eléctrico aumenta la delincuencia, Con el racionamiento del agua se propagan las enfermedades infeciosas ( AH1N1 )";;;;"5189867449";https://twitter.com/daproli/status/5189867449
dranagar;2009-10-27 01:33;0;1;"8 Important Facts about #SwineFlu #AH1N1 http://bit.ly/QHFjS";;;#SwineFlu #AH1N1;"5189422773";https://twitter.com/dranagar/status/5189422773
caldo_de_cabeza;2009-10-27 01:27;0;0;"Le habra dado AH1N1 a @nani_nuni que no aparece xD";;@nani_nuni;;"5189272606";https://twitter.com/caldo_de_cabeza/status/5189272606
yussepin;2009-10-27 01:10;0;0;"segun @noheli20 yo no tenia nada de #ah1n1 ... porque falto la tos.. entonces pregunto lo que tenia era "ah1n" asi sin el otro 1??? #paranoia";;@noheli20;#ah1n1 #paranoia;"5188861100";https://twitter.com/yussepin/status/5188861100
nori_matsumoto;2009-10-27 01:04;0;0;"Interesante video sobre la Gripe A H1N1 (los primeros 15 minutos son muy buenos) http://vimeo.com/6790193 RT please #AH1N1";;;#AH1N1;"5188704207";https://twitter.com/nori_matsumoto/status/5188704207
diarioyabasta;2009-10-27 00:56;0;0;"No hay muertes confirmadas por Influenza Humana en Veracruz: Lila de Arce http://tinyurl.com/yloxhw5 #veracruz #AH1N1";;;#veracruz #AH1N1;"5188513695";https://twitter.com/diarioyabasta/status/5188513695
Gripe_porcina;2009-10-27 00:34;0;0;"OMS enviará vacuna contra la gripe AH1N1 a Cuba (El Universal): La Habana .- La Organización Mundial de la Salu.. http://bit.ly/11eeQT";;;;"5187952278";https://twitter.com/Gripe_porcina/status/5187952278
NatyCGodoy;2009-10-27 00:12;0;0;"@ChavezOfficial Presi l pobr @efrabaritto irà a un CDI cn gripe y sale cn AH1N1 ,Catarata,1 hernia y hablndo cubano!Dele mejors opcions vale!";;@ChavezOfficial @efrabaritto;;"5187430433";https://twitter.com/NatyCGodoy/status/5187430433
mexicociudadano;2009-10-27 00:08;0;0;"en el #mexicoquequiero la líder de la educación sabe pronunciar AH1N1";;;#mexicoquequiero;"5187325958";https://twitter.com/mexicociudadano/status/5187325958
vlexam;2009-10-27 00:06;0;0;"En el #Mexicoquequiero el presidente no dice que salvamos al mundo de la influenza AH1N1 antes de volverse pandemia";;;#Mexicoquequiero;"5187268087";https://twitter.com/vlexam/status/5187268087