username;date;retweets;favorites;text;geo;mentions;hashtags;id;permalink
JRIbarra;2009-05-12 23:44;0;0;"Comunicado Oficial Completo Ministerio de Salud sobre la Pandemia AH1N1 en http://joserodolfoibarra.blogspot.com";;;;"1778836839";https://twitter.com/JRIbarra/status/1778836839
lajornadaonline;2009-05-12 23:40;0;0;"Verifica la OMS 5 mil 251 casos de influenza AH1N1 en 30 países. El reporte incluye por primera vez a Cuba, Tailandia y Finlandia.";;;;"1778805491";https://twitter.com/lajornadaonline/status/1778805491
JMF1957;2009-05-12 22:28;0;0;"Fidel, como sempre: Autoridades mexicanas no informaron al mundo la presencia de la AH1N1 esperando visita de Obama http://twurl.nl/asmw1q";;;;"1778183025";https://twitter.com/JMF1957/status/1778183025
gustavosaul;2009-05-12 22:06;0;0;"He creado una ciudad, visiten a Oaxacalandia!! un lugar sin virus AH1N1 ni pendejadas de esas. un lugar limpio!!! http://tinyurl.com/rywrxp";;;;"1777977914";https://twitter.com/gustavosaul/status/1777977914
ansaca;2009-05-12 22:01;0;0;"RT @ivelaval : Por Dios, a quien se le ocurre crear en facebook el grupo de "Los que no queremos contagiarnos del AH1N1 ". de todo se ve en FB";;@ivelaval;;"1777931385";https://twitter.com/ansaca/status/1777931385
zuloid;2009-05-12 22:00;0;0;"MT Arbeláez: La Academia mira al AH1N1 http://tinyurl.com/perxrj";;;;"1777922537";https://twitter.com/zuloid/status/1777922537
iespinosa;2009-05-12 21:56;0;0;"@luisitomx hh tenia q ser luis y el AH1N1 ¬¬";;@luisitomx;;"1777892977";https://twitter.com/iespinosa/status/1777892977
guatecham;2009-05-12 21:45;0;0;"Alcaldes son traídos de emergencia a la capital para dar su apoyo a Colom. Prensalibre. Ni el virus AH1N1 hizo actuar asi al gobierno";;;;"1777786486";https://twitter.com/guatecham/status/1777786486
lavozdeasturias;2009-05-12 21:31;0;0;"España llega a los cien casos confirmados de gripe AH1N1 http://bit.ly/jwVjJ";;;;"1777655554";https://twitter.com/lavozdeasturias/status/1777655554
elpaiscali;2009-05-12 20:56;0;0;"Se eleva a 6 el número de casos confirmados en Colombia.: Tres personas más contagiadas con el virus AH1N1 en Co.. http://tinyurl.com/q2xgco";;;;"1777310366";https://twitter.com/elpaiscali/status/1777310366
x_tello;2009-05-12 20:36;0;0;""Temen mezcla de H1N1 y H5N1" Exacto ! http://bit.ly/zG16U #Influenza #Flu #AH1N1 #AH5N1";;;#Influenza #Flu #AH1N1 #AH5N1;"1777131731";https://twitter.com/x_tello/status/1777131731
Cooperativa;2009-05-12 20:32;0;0;"Casos de influenza AH1N1 en EE.UU. ascendieron a 3.009 http://twurl.nl/ktrzdw";;;;"1777089882";https://twitter.com/Cooperativa/status/1777089882
Peru21pe;2009-05-12 20:27;0;0;"La gripe AH1N1 podría mutar y generar una pandemia, advierte la OMS. http://is.gd/zgGl";;;;"1777039523";https://twitter.com/Peru21pe/status/1777039523
x_tello;2009-05-12 20:22;0;0;"@xtello : Influenza A(H1N1): ¿Por qué casi todos los muertos son Mexicanos? http://bit.ly/Aushx #Influenza #Flu #AH1N1";;@xtello;#Influenza #Flu #AH1N1;"1776993558";https://twitter.com/x_tello/status/1776993558
tony_zorro;2009-05-12 20:11;0;0;"El ex-presidente Vicente Fox le restó importancia al virus AH1N1 de la influenza porcina y dijo que no es más que “una gripa"";;;;"1776886993";https://twitter.com/tony_zorro/status/1776886993
chileteinforma;2009-05-12 19:54;0;0;"La Tercera: Chile se margina de campeonato por epidemias de dengue y gripe AH1N1 : El encuentro deport.. http://tinyurl.com/qr8l5p";;;;"1776723969";https://twitter.com/chileteinforma/status/1776723969
phenobarbital;2009-05-12 19:35;0;0;"Claro, me imagino que AH1N1 hará que "mágicamente" no pensemos en el H1N1 tipo A que mató a 50 millones de personas en 1914";;;;"1776541611";https://twitter.com/phenobarbital/status/1776541611
phenobarbital;2009-05-12 19:34;0;0;"Por qué ahora los medios le dicen AH1N1 ?, si realmente es un retrovirus de neuroamilasa 1, de tipo A?, debería ser H1N1 tipo A";;;;"1776532628";https://twitter.com/phenobarbital/status/1776532628
acaclub;2009-05-12 19:09;0;0;"Taxistas de Acapulco solicitan al Gobierno del Estado descuento del 50% de sus obligaciones ante baja de ingresos por la influenza AH1N1";;;;"1776306167";https://twitter.com/acaclub/status/1776306167
WRadio_PA;2009-05-12 18:58;0;0;"Confirman tres nuevos casos de gripe AH1N1 en niños. http://tinyurl.com/ospats";;;;"1776199643";https://twitter.com/WRadio_PA/status/1776199643
ADNRadioCL;2009-05-12 18:58;0;0;"A 5.251 se elevaron los casos de influenza AH1N1 http://tinyurl.com/qjfue8";;;;"1776195565";https://twitter.com/ADNRadioCL/status/1776195565
CaracolRadio;2009-05-12 18:56;0;0;"Suben a seis los casos de AH1N1 en Colombia http://tinyurl.com/pj9rbl";;;;"1776175952";https://twitter.com/CaracolRadio/status/1776175952
jaguardP;2009-05-12 18:55;0;0;"#Toronoticias la sacó del estadio. 1ero una nota de publicidad engañosa contra AH1N1 y luego publireportaje sobre aceite que la previene";;;#Toronoticias;"1776173278";https://twitter.com/jaguardP/status/1776173278
bubuybungalow;2009-05-12 18:45;0;0;"España llega a los cien casos confirmados de gripe AH1N1 http://snipurl.com/hvwgz";;;;"1776111756";https://twitter.com/bubuybungalow/status/1776111756
Alexsander_pe;2009-05-12 18:38;0;0;"La OMS insiste en que estemos preparados para la posibilidad que el virus de la gripe AH1N1 mute y se convierta en uno más peligroso.";;;;"1776051024";https://twitter.com/Alexsander_pe/status/1776051024
Miecuadorqerido;2009-05-12 18:37;0;0;"Albos no jugarán en EE.UU. por gripe AH1N1 : El campeón de América ya no disputará en Nueva York un duelo contra .. http://chilp.it/?eea2c5";;;;"1776042231";https://twitter.com/Miecuadorqerido/status/1776042231
swinflunews;2009-05-12 18:28;0;0;"La Gripe AH1N1 http://ff.im/-2PjWa";;;;"1775952038";https://twitter.com/swinflunews/status/1775952038
chileteinforma;2009-05-12 18:17;0;0;"El Clarín: OMS confirma más de cinco mil infectados con el virus AH1N1 : La Organización Mundia.. http://tinyurl.com/oblnkd";;;;"1775855879";https://twitter.com/chileteinforma/status/1775855879
almuerzonegocio;2009-05-12 17:25;0;0;"Las farmacias, Los supermercados, las pizzerias y las tiendas de videos, los mas beneficiados en Mexico por la Gripe AH1N1 .";;;;"1775377640";https://twitter.com/almuerzonegocio/status/1775377640
WRadioColombia;2009-05-12 17:12;0;0;"Gobernador de Casanare confirma tres nuevos casos de gripa AH1N1 http://tinyurl.com/r6ydan";;;;"1775252693";https://twitter.com/WRadioColombia/status/1775252693
elespectador;2009-05-12 16:43;0;0;"OMS: 5.251 casos de gripe AH1N1 ; 61 muertes: Estados Unidos ha reportado 2.600 casos confirmados de la enfermeda.. http://tinyurl.com/qk3pw6";;;;"1774983079";https://twitter.com/elespectador/status/1774983079
wbrenes;2009-05-12 16:42;0;0;"Que tuanis! Se le cierran puertas a los Mexicanos y se las abren a un coro de gringuitos engripaos y q paseen el AH1N1 por Tiquicia..";;;;"1774974429";https://twitter.com/wbrenes/status/1774974429
Lalusa;2009-05-12 16:40;0;0;"Coro de Boston viajó por todo el país con la gripe AH1N1 http://tinyurl.com/o65zbg (hasta la cultura se enfermó de #influenza )";;;#influenza;"1774957192";https://twitter.com/Lalusa/status/1774957192
Culiacan;2009-05-12 15:24;0;0;"El niño de Culiacán infectado con el virus AH1N1 está fuera de peligro y no representa riesgo de contagio (Noroeste) http://twurl.nl/1ndiyj";;;;"1774242533";https://twitter.com/Culiacan/status/1774242533
edugar;2009-05-12 15:04;0;0;"argentina mete chiquita a ministro ugarte x adelantarse a declarar q tenia gripe AH1N1 y agardc a quienes la atendieron http://bit.ly/BuXfk";;;;"1774065082";https://twitter.com/edugar/status/1774065082
NoticiasCaracol;2009-05-12 14:46;0;0;"Ya son seis los casos confirmados del virus AH1N1 en Colombia: Las autoridades sanitarias informaron que los nue.. http://tinyurl.com/qul76m";;;;"1773897443";https://twitter.com/NoticiasCaracol/status/1773897443
elespectador;2009-05-12 14:44;0;0;"Tres nuevos casos de gripe AH1N1 en Casanare: Con ese nuevo reporte se eleva a seis el número de contagiados en .. http://tinyurl.com/qq6dnz";;;;"1773876242";https://twitter.com/elespectador/status/1773876242
OneSilentSmoke;2009-05-12 14:30;0;0;"Ecuador suspende viajes al exterior de estudiante por la gripe AH1N1 (EL MUNDO) http://tinyurl.com/ogrkcd";;;;"1773754495";https://twitter.com/OneSilentSmoke/status/1773754495
davitto;2009-05-12 14:26;0;0;"Ya hay 5.251 casos de gripa AH1N1 en el mundo... cuántos hay de hambre y no es noticia?";;;;"1773720399";https://twitter.com/davitto/status/1773720399
El_Enigma;2009-05-12 14:13;0;0;"poco mas d 10 mil muestras se han realizado para confirmar AH1N1 unos 450 pesos";;;;"1773611370";https://twitter.com/El_Enigma/status/1773611370
perucom;2009-05-12 14:06;0;0;"Casos confirmados de gripe #AH1N1 son 5.251 en el mundo, según Organización Mundial de la Salud. http://is.gd/zaIw";;;#AH1N1;"1773556667";https://twitter.com/perucom/status/1773556667
ginasandovalc;2009-05-12 14:05;0;0;"El virus AH1N1 puede mutar y causar una pandemia de una nueva gripe, dice la OMS. http://tinyurl.com/pgzpo4";;;;"1773546438";https://twitter.com/ginasandovalc/status/1773546438
radiosantafentc;2009-05-12 13:32;0;0;"Casos confirmados de gripa AH1N1 en el mundo ya superan los 5000: El número de casos de gripe A confirmados por.. http://tinyurl.com/pup5j8";;;;"1773279243";https://twitter.com/radiosantafentc/status/1773279243
elespectador;2009-05-12 12:58;0;0;"OMS confirma que casos de Gripe AH1N1 ya son 5.251 en el mundo: México lidera la lista con 2.059 infectados.read.. http://tinyurl.com/okzzr5";;;;"1773027687";https://twitter.com/elespectador/status/1773027687
ADNRadioCL;2009-05-12 12:06;0;0;"Chile se mantiene sin la presencia de la influenza AH1N1 http://tinyurl.com/qrwtka";;;;"1772699086";https://twitter.com/ADNRadioCL/status/1772699086
cubareader;2009-05-12 11:57;0;0;"El AH1N1 se contagia más fácil que la gripe común: Este reporte que publica La Nación informa acerca de las últi.. http://tinyurl.com/rcqzzr";;;;"1772650294";https://twitter.com/cubareader/status/1772650294
noticiasticas;2009-05-12 08:34;0;0;"Coro de Boston viajó por todo el país con la gripe AH1N1 http://twurl.nl/2mgf7g";;;;"1771744901";https://twitter.com/noticiasticas/status/1771744901
chileteinforma;2009-05-12 06:42;0;0;"La Tercera: Fidel Castro critica a México tras primer caso de gripe AH1N1 en Cuba: El ex Presidente c.. http://tinyurl.com/qtek43";;;;"1771254218";https://twitter.com/chileteinforma/status/1771254218
x_tello;2009-05-12 05:56;0;0;"Influenza A(H1N1): ¿Por qué sólo han muerto Mexicanos? http://bit.ly/Aushx #Influenza #Flu #AH1N1";;;#Influenza #Flu #AH1N1;"1771020812";https://twitter.com/x_tello/status/1771020812
x_tello;2009-05-12 05:50;0;0;"Afrontando la nueva realidad de una pandemia, en nuestra Empresa. http://bit.ly/2yaRg #Influenza #Flu #AH1N1";;;#Influenza #Flu #AH1N1;"1770986954";https://twitter.com/x_tello/status/1770986954
noticiasperu;2009-05-12 05:34;0;0;"[RPP] China intensifica controles y comunicación para evitar gripe AH1N1 : Un varón de apellido Bao y de 30 .. http://tinyurl.com/p4rvnz";;;;"1770900945";https://twitter.com/noticiasperu/status/1770900945
RaulLuna;2009-05-12 05:20;0;0;"Acusa Fidel Castro que México calló información sobre #influenza #AH1N1 por visita de Obama http://tinyurl.com/q3oe2r";;;#influenza #AH1N1;"1770823152";https://twitter.com/RaulLuna/status/1770823152
iespinosa;2009-05-12 05:20;0;0;"ahh de vdd a la ah1n1 esta canona ...";;;;"1770822636";https://twitter.com/iespinosa/status/1770822636
Mina_30;2009-05-12 04:57;0;0;"Confirmado primer caso de influenza AH1N1 en China! Y no lo llevó un mexicano... tan bonitas las ironías jijijiji http://tinyurl.com/ra4ldl";;;;"1770676195";https://twitter.com/Mina_30/status/1770676195
influenzame;2009-05-12 04:45;0;0;""Estudio estima entre 6 mil y 32 mil casos de influenza en México". http://bit.ly/KEHUY #AH1N1";;;#AH1N1;"1770596253";https://twitter.com/influenzame/status/1770596253
influenzame;2009-05-12 04:44;0;0;""Cuba confirma primer caso de influenza A; es mexicano". http://bit.ly/2svTy #AH1N1";;;#AH1N1;"1770589970";https://twitter.com/influenzame/status/1770589970
iLukianox;2009-05-12 04:37;0;0;"China intensifica controles y comunicación para evitar gripe AH1N1 : Un varón de apellido Bao y de 30 años, que r.. http://tinyurl.com/p4rvnz";;;;"1770544626";https://twitter.com/iLukianox/status/1770544626
wam1177;2009-05-12 03:25;0;0;"Llegan 40 mil dosis de Tamiflúa gripe AH1N1 http://viigo.im/y0w";;;;"1769995038";https://twitter.com/wam1177/status/1769995038
Encefalemico;2009-05-12 02:52;0;0;"No me dejan hacer practica comunitaria en los jardines infantiles por la AH1N1 :(";;;;"1769716783";https://twitter.com/Encefalemico/status/1769716783
xrazerx;2009-05-12 02:21;0;0;"@faroviejo Tarde pero seguro, andaba escondido del virus AH1N1 jaja, pero ya sali de mi cuarto. Un gusto saber que sigo leyendote igual! :D";;@faroviejo;;"1769450447";https://twitter.com/xrazerx/status/1769450447
Sociabilidad;2009-05-12 02:12;0;1;"Durante la contingencia sanitaria por el virus AH1N1 , aumentó 500% uso de Internet en México (via @urbanitas )";;@urbanitas;;"1769379766";https://twitter.com/Sociabilidad/status/1769379766
LUMINUS74;2009-05-12 02:08;0;0;"Entramos de nuevo a clases... No se les olvide tomar sus precauciones, el Virus AH1N1 sigue haciendo de las suyas... CUÍDENSE!!";;;;"1769338555";https://twitter.com/LUMINUS74/status/1769338555
x_tello;2009-05-12 01:56;0;0;"Influenza A(H1N1): ¿Por qué sólo han muerto Mexicanos? http://bit.ly/Aushx #Influenza #Flu #AH1N1";;;#Influenza #Flu #AH1N1;"1769230950";https://twitter.com/x_tello/status/1769230950
acaclub;2009-05-12 01:56;0;0;"Anuncia Salud estatal que actuarán 10 caravanas en Acapulco para prevenir y controlar brotes de influenza AH1N1 , por tener más casos";;;;"1769227942";https://twitter.com/acaclub/status/1769227942
acaclub;2009-05-12 01:54;0;0;"Se mantiene en 0 defunciones por el virus del AH1N1 en Guerrero, y todos los casos detectados han sido tratados, lo mismo que sus contactos";;;;"1769209719";https://twitter.com/acaclub/status/1769209719
acaclub;2009-05-12 01:53;0;0;"De 47 casos de AH1N1 en Gro. 33 en Acapulco,5 en Chilpo y un caso en Pungarabato,Ometepec,Taxco, Tecpan, Zirándaro,San Marcos y Zihuatanejo";;;;"1769202484";https://twitter.com/acaclub/status/1769202484
x_tello;2009-05-12 01:49;0;0;"Afrontando la nueva realidad de una pandemia, en nuestra Empresa. http://bit.ly/2yaRg #Influenza #Flu #AH1N1";;;#Influenza #Flu #AH1N1;"1769173637";https://twitter.com/x_tello/status/1769173637
desinformado;2009-05-12 01:48;0;0;"CODOBIO exhorta actuar responsabilidad ante el virus AH1N1 y otros males http://ff.im/-2O3IA";;;;"1769160385";https://twitter.com/desinformado/status/1769160385
jjbelmonte;2009-05-12 01:11;0;0;"Ya son 47 casos de AH1N1 en Guerrero, 33 en Acapulco, ¡vamos por 50!!";;;;"1768849379";https://twitter.com/jjbelmonte/status/1768849379
citein;2009-05-12 01:03;0;0;"La convencion de ciencia tecnologia e innovacion ha sido suspendia por prevencion de la Influenza AH1N1";;;;"1768778881";https://twitter.com/citein/status/1768778881
ernestogfa;2009-05-12 01:01;0;0;"El Supositorio: Excelente monográfico del NEJM sobre la nueva Gripe AH1N1 http://tr.im/l5vi";;;;"1768761916";https://twitter.com/ernestogfa/status/1768761916
urbanitas;2009-05-12 00:45;0;0;"@anairam00 mal plan. y cuánto llevan asi? si no es el AH1N1 son las huelgas, pero las clases escolares no importan, parece";;@anairam00;;"1768623030";https://twitter.com/urbanitas/status/1768623030
swinflunews;2009-05-12 00:35;0;0;"Monday 11, PAHO Press Conference Influenza AH1N1 http://ff.im/-2NXWF";;;;"1768544386";https://twitter.com/swinflunews/status/1768544386
banksuk;2009-05-12 00:17;0;0;"Le puede costar a México hasta el 1% del PIB la Influenza AH1N1 http://ff.im/2NWLD";;;;"1768412918";https://twitter.com/banksuk/status/1768412918
banksuk;2009-05-12 00:17;0;0;"Le puede costar a México hasta el 1% del PIB la Influenza AH1N1 http://ff.im/2NWLC";;;;"1768412909";https://twitter.com/banksuk/status/1768412909