username;date;retweets;favorites;text;geo;mentions;hashtags;id;permalink
tainazinha;2009-08-26 23:55;0;0;"e nos jornais internacionais "Brasil, el país con más muertes por influenza AH1N1 ". Maravilha hein Brasil.";;;;"3567757431";https://twitter.com/tainazinha/status/3567757431
x_tello;2009-08-26 23:55;0;0;"Se establece una 1ª causa para la gran mortalidad por Influenza en México: Mala Atención Primaria. http://bit.ly/uC5F8 #Influenza #AH1N1";;;#Influenza #AH1N1;"3567756272";https://twitter.com/x_tello/status/3567756272
pergunteme;2009-08-26 23:39;0;0;"Quando procurar um médico? Como se transmite? Gripe suína #ah1n1 http://bit.ly/6CaQL";;;#ah1n1;"3567452131";https://twitter.com/pergunteme/status/3567452131
elcomerciocom;2009-08-26 23:36;0;0;"Ministerio de Salud confirmó ocho casos sospechosos de AH1N1 en Galápagos http://bit.ly/2PpsKU";;;;"3567398888";https://twitter.com/elcomerciocom/status/3567398888
CanalRTU;2009-08-26 23:22;0;0;"Ocho casos sospechosos de gripe AH1N1 en galápagos confirma Ministerio de Salud del Ecuador";;;;"3567141812";https://twitter.com/CanalRTU/status/3567141812
perucom;2009-08-26 23:12;0;0;"MINSA: "Ahora solo se reportan 15 casos diarios del virus de la gripe AH1N1 ". http://bit.ly/1xObz2";;;;"3566938068";https://twitter.com/perucom/status/3566938068
jeandorgan;2009-08-26 23:00;0;0;"Irrá! Já tá no ar o clipe da música "Não Espirra Mais"! Beatles + AH1N1 http://bit.ly/gNHW";;;;"3566715429";https://twitter.com/jeandorgan/status/3566715429
freemediaven;2009-08-26 22:57;0;0;"#FreeMediaVe Autoridades sanitarias en Aragua descartan fallecimiento por influenza AH1N1 http://url4.eu/JUsS";;;#FreeMediaVe;"3566660530";https://twitter.com/freemediaven/status/3566660530
MLKtoSCL;2009-08-26 22:52;0;0;"WATCH !!! Conciertos en Chile: Galas sin Lujo. http://bit.ly/BnpTV | se fueron al AH1N1 con los precios | #boicoticket";;;#boicoticket;"3566577647";https://twitter.com/MLKtoSCL/status/3566577647
vavi90;2009-08-26 22:45;0;0;"ElNacionalWebHay casos gripe AH1N1 en todos los estados del país http://tinyurl.com/l7lphg";;;;"3566442904";https://twitter.com/vavi90/status/3566442904
greatdilla;2009-08-26 22:40;0;0;"@roytang san ka galing? self-quarantine muna baka mag-spread ng AH1N1 :-)";;@roytang;;"3566363798";https://twitter.com/greatdilla/status/3566363798
revistavistazo;2009-08-26 22:32;0;0;"Gripe AH1N1 gana terreno en Ecuador. Se confirmaron casos en las 24 provincias del país; Galápagos bajo alerta amarilla. http://bit.ly/X24zW";;;;"3566203455";https://twitter.com/revistavistazo/status/3566203455
FuenteNoticias;2009-08-26 22:23;0;0;"ElU: Brasil pide más recursos para vacunas AH1N1 http://url4.eu/JUGu";;;;"3566032510";https://twitter.com/FuenteNoticias/status/3566032510
tvoperu;2009-08-26 21:42;0;0;"New: Laboratorio UPC recibió autorización del MINSA para realizar descarte Influenza AH1N1 on http://cli.gs/Sh7tM";;;;"3565267413";https://twitter.com/tvoperu/status/3565267413
EdieQ;2009-08-26 21:27;0;0;"Echale un ojo a esa página http://bit.ly/USyHm allí hay un artículo OMS sobre AH1N1 y venden un regenerador inmunológico en #Venezuela";;;#Venezuela;"3564976832";https://twitter.com/EdieQ/status/3564976832
EdieQ;2009-08-26 21:26;0;0;"RT @carlamariela : @MlleFelix enviame tu mail viaDM y te paso una info q amablemente me facilito @dr_edurivas sobre AH1N1 http://bit.ly/USyHm";;@carlamariela @MlleFelix @dr_edurivas;;"3564950949";https://twitter.com/EdieQ/status/3564950949
MarielaLlovera;2009-08-26 21:25;0;0;"@MlleFelix enviame tu mail via DM y te paso una info q amablemente me facilito @dr_edurivas sobre AH1N1";;@MlleFelix @dr_edurivas;;"3564932425";https://twitter.com/MarielaLlovera/status/3564932425
Miecuadorqerido;2009-08-26 21:06;0;0;"Ingreso a Galápagos no está restringido por el AH1N1 : Salud: Redacción Sociedad La ministra de Salud, Caroline C.. http://bit.ly/fLpMp";;;;"3564576079";https://twitter.com/Miecuadorqerido/status/3564576079
KuttKatrea;2009-08-26 20:54;0;0;"¡Waii! En el próximo invierno la mejor vacuna contra el #AH1N1 será el Distanciamiento Social... ¡Larga vida a los #antisociales !";;;#AH1N1 #antisociales;"3564326945";https://twitter.com/KuttKatrea/status/3564326945
diegomares;2009-08-26 20:49;0;0;"LIMA: Por caso de gripe AH1N1 , suspendieron clases en colegio de Villa El Salvador. Ver más en: http://bit.ly/kcCJF";;;;"3564234359";https://twitter.com/diegomares/status/3564234359
CronicaLoja;2009-08-26 20:46;0;0;"Aseguradoras de Medicina Prepagada y empresas de salud, deberán cubrir casos de AH1N1 a sus afiliados: Mediante .. http://bit.ly/DBHkH";;;;"3564176128";https://twitter.com/CronicaLoja/status/3564176128
perufeeds;2009-08-26 20:09;0;0;"[Cinencuentro] “Pra onde eu irei?”, el primer largometraje sobre la gripe AH1N1 http://bit.ly/mWqV4";;;;"3563451813";https://twitter.com/perufeeds/status/3563451813
Santaspalabras;2009-08-26 19:58;0;0;"Consejos para ahorrar en septiembre www.blogmujeres.com Prevención Gripe AH1N1 www.blogmujeres.com";;;;"3563242033";https://twitter.com/Santaspalabras/status/3563242033
xazarcom_ru;2009-08-26 18:46;0;0;"Число умерших от гриппа AH1N1 в Индии утроилось за неделю http://ff.im/-7ch1I";;;;"3561907170";https://twitter.com/xazarcom_ru/status/3561907170
montalge;2009-08-26 18:29;0;0;"Ahora los mexicanos tenemos dos tipos de influenza al AH1N1 y la AHLNL, la ultima la tiene Elba Esther y la primera todos los demas.";;;;"3561609361";https://twitter.com/montalge/status/3561609361
MedialogMX;2009-08-26 18:12;0;0;"MVS-102.5 China elaborará vacunas contra la influenza humana AH1N1 cuyo precio está por debajo de laboratorios trasnacionales de Europa reco";;;;"3561281836";https://twitter.com/MedialogMX/status/3561281836
insidecr;2009-08-26 17:59;0;0;"AH1N1 Claims Two More Lives In Costa Rica: Total Now At 33 Deaths";;;;"3561054267";https://twitter.com/insidecr/status/3561054267
xazarcom_ru;2009-08-26 17:38;0;0;"Первая жертва гриппа AH1N1 зарегистрирована в Сирии http://ff.im/-7c5QB";;;;"3560656414";https://twitter.com/xazarcom_ru/status/3560656414
ecuainm;2009-08-26 17:26;0;0;"Se confirman 9 casos de AH1N1 en Galápagos: En Consejo de Operación de Emergentes (COE) del cantón Santa Cruz co.. http://bit.ly/hKUUR";;;;"3560435767";https://twitter.com/ecuainm/status/3560435767
noticia24;2009-08-26 17:23;0;0;"Ssa comprara mas vacunas contra AH1N1 http://bit.ly/8U0DJ";;;;"3560380274";https://twitter.com/noticia24/status/3560380274
ChiwySan;2009-08-26 16:56;0;0;"Oiga alguien sabe que paso con la gripe AH1N1 ? desaperecio solita? que paso con el panico? con el miedo? ya se acabo que vender? : P";;;;"3559855807";https://twitter.com/ChiwySan/status/3559855807
avvandreani;2009-08-26 16:46;0;0;"Influenza AH1N1 : riepilogo situazione italiana ad agosto e previsioni campagna di vaccinazione. (Miolegale): L'a.. http://bit.ly/troJd";;;;"3559676626";https://twitter.com/avvandreani/status/3559676626
cliqzesnews;2009-08-26 16:01;0;0;"Sanidad se reunirá con los obispos para estudiar medidas frente a la gripe AH1N1 http://bit.ly/vswgz";;;;"3558850676";https://twitter.com/cliqzesnews/status/3558850676
CaracolRadio;2009-08-26 15:58;0;0;"Gobierno reconoce fallas en atención a pacientes con virus AH1N1 http://bit.ly/4A5sXP";;;;"3558791403";https://twitter.com/CaracolRadio/status/3558791403
radiosantafentc;2009-08-26 15:52;0;0;"Aumenta número de contagios de AH1N1 en Colombia: Durante los últimos días, la epidemia de AH1N1 en el país ha i.. http://bit.ly/Hn9dJ";;;;"3558670658";https://twitter.com/radiosantafentc/status/3558670658
MarielaLlovera;2009-08-26 15:38;0;0;"@dr_edurivas estoy planeando pequeña charla para trabajadores sobre AH1N1 , sugerencias?";;@dr_edurivas;;"3558414741";https://twitter.com/MarielaLlovera/status/3558414741
MarielaLlovera;2009-08-26 15:37;0;0;"RT @dr_edurivas : Ayer falleció en maracay la Dra. carmelina Dona, aunque fue + AH1N1 autoridades descartan que esa fuera la causa.";;@dr_edurivas;;"3558380805";https://twitter.com/MarielaLlovera/status/3558380805
tessy_hg;2009-08-26 15:36;0;0;"Alguien sabe cuándo empezará la campaña de vacunación vs. la influenza AH1N1 y ese rollo? http://www.eluniversal.com.mx/notas/622260.html";;;;"3558375735";https://twitter.com/tessy_hg/status/3558375735
swinefluh1n1;2009-08-26 15:31;0;0;""Influenza AH1N1 fades with winter in New Zealand | balitadotph" http://tinyurl.com/mo55or #swineflu #H1N1";;;#swineflu #H1N1;"3558282289";https://twitter.com/swinefluh1n1/status/3558282289
Noticias_Mexico;2009-08-26 15:30;0;0;"#Mexico Ssa comprará más vacunas contra AH1N1 http://tinyurl.com/n6qg6u";;;#Mexico;"3558253470";https://twitter.com/Noticias_Mexico/status/3558253470
elpaiscali;2009-08-26 15:14;0;0;"Seis nuevas muertes por AH1N1 en Colombia.: Aumentaron a 29 las víctimas fatales por causa del virus de la influ.. http://bit.ly/sl15s";;;;"3557957658";https://twitter.com/elpaiscali/status/3557957658
comelebien;2009-08-26 14:53;0;0;"Starting to feel it! #ah1n1";;;#ah1n1;"3557557522";https://twitter.com/comelebien/status/3557557522
zolliker;2009-08-26 14:51;0;0;"@AnaSerrano y como van de casos allá de ah1n1 ? Yo veo que se están incrementando bastante...";;@AnaSerrano;;"3557531367";https://twitter.com/zolliker/status/3557531367
Marco2193;2009-08-26 14:44;0;0;"Alguien conoce a alguien que conozca a alguien que conozca a... idem idem idem idem idem que haya tenido AH1N1 ?";;;;"3557404344";https://twitter.com/Marco2193/status/3557404344
lapizlazuli;2009-08-26 14:40;0;0;"Ayer, en reunión con el Alcalde de California, FCH dijo que MX y EU actúan para preparar medidas contra un eventual brote de influenza AH1N1";;;;"3557325635";https://twitter.com/lapizlazuli/status/3557325635
karlitsv;2009-08-26 14:35;0;0;"So... Mexican economy just had a "cold", right Carstens? Now imagine if it had gotten AH1N1 ....";;;;"3557242606";https://twitter.com/karlitsv/status/3557242606
anaccronica;2009-08-26 14:34;0;0;"Atención - noticias q trae @dr_edurivas s/los médicos neumonólogos: Ayer murió una dra y hay otro dr más en tratamiento infectados con AH1N1";;@dr_edurivas;;"3557222627";https://twitter.com/anaccronica/status/3557222627
Ch0_0k;2009-08-26 14:34;0;0;"jiu buenos dias, yo malo de mi garganta y el internet algo lento, que mas se puede esperar,,,, AH1N1 ????? xD";;;;"3557221229";https://twitter.com/Ch0_0k/status/3557221229
Fluheadlines;2009-08-26 14:19;0;1;"Fluheadlines Cameroon: AH1N1 Flu - Gov't on the Alert: In a press conference yesterday, the governme.. http://bit.ly/IKxvm";;;;"3556938784";https://twitter.com/Fluheadlines/status/3556938784
nacion;2009-08-26 14:16;0;0;"Acumulada una presa de 1.000 pruebas de AH1N1 http://nacion.com/g/2o2";;;;"3556887022";https://twitter.com/nacion/status/3556887022
lapsusgiseldis;2009-08-26 14:15;0;0;"Fuck, one of my classmates has Ah1n1 and she's coming to classes. What a inconsiderate dumbass ¬¬";;;;"3556867398";https://twitter.com/lapsusgiseldis/status/3556867398
iona2009;2009-08-26 14:00;0;0;"Primera muerte en Caracas por AH1N1 Embarazada de 28 años....Hasta Cuando ???????? #NoLOE #Freemediave";;;#NoLOE #Freemediave;"3556620568";https://twitter.com/iona2009/status/3556620568
Cabezatuna;2009-08-26 13:51;0;0;"http://www.crazymonkeygames.com/jkf6Tr/pandemic2.swf juego bastante bueno, toma el lugar de una enfermedad tipo ah1n1";;;;"3556461758";https://twitter.com/Cabezatuna/status/3556461758
redvenezuela;2009-08-26 13:21;0;0;"Venezuela tiene la acción más constante para enfrentar la gripe AH1N1";;;;"3556007558";https://twitter.com/redvenezuela/status/3556007558
elcomerciocom;2009-08-26 12:45;0;0;"Disminuye intensidad de casos de fiebre AH1N1 en Brasil http://bit.ly/HIC4S";;;;"3555478391";https://twitter.com/elcomerciocom/status/3555478391
Miecuadorqerido;2009-08-26 12:44;0;0;"Disminuye intensidad de casos de fiebre AH1N1 en Brasil: Brasilia, ANSA El Ministerio de Salud de Brasil reporto.. http://bit.ly/hY91B";;;;"3555472464";https://twitter.com/Miecuadorqerido/status/3555472464
CallColombia;2009-08-26 12:44;0;0;"AH1N1 infections in Colombia soar: Colombia Reports The AH1N1 virus spread rapidly among Colombians this week. A.. http://bit.ly/PTV2n";;;;"3555469410";https://twitter.com/CallColombia/status/3555469410
CaptDaags;2009-08-26 12:30;0;0;"Try and catch me if they introduce compulsory AH1N1 vacccines, not this little black duck.";;;;"3555286379";https://twitter.com/CaptDaags/status/3555286379
adriaanalsema;2009-08-26 12:25;0;0;"AH1N1 infections in Colombia soar http://bit.ly/169p74";;;;"3555215544";https://twitter.com/adriaanalsema/status/3555215544
Sergio_R78;2009-08-26 12:09;0;0;"En el hospital de El Algodonal -Caracas- se registró el lunes la primera muerte en Caracas por AH1N1 . Una embarazada de 28 años";;;;"3555017024";https://twitter.com/Sergio_R78/status/3555017024
todatinta;2009-08-26 12:07;0;0;"El AH1N1 es una amenaza seria (ver portada El Nuevo Dia).Tenemos que prevenir contagio.Tenemos Hand Sanitizer Dispenser $49.99 Entrega FREE.";;;;"3554993091";https://twitter.com/todatinta/status/3554993091
WapaTV;2009-08-26 12:03;0;0;"Urgen más información sobre gripe: Comunidad médica exige al gobierno facilite más información sobre el virus AH1N1 http://bit.ly/ZS07F";;;;"3554948787";https://twitter.com/WapaTV/status/3554948787
canal_chile;2009-08-26 11:59;0;0;"Experto AH1N1 : “Hay que estar preparados para el rebrote del próximo invierno” http://ff.im/-7b7g2";;;;"3554901254";https://twitter.com/canal_chile/status/3554901254
Chukyrp;2009-08-26 11:52;0;0;"Me dijeron en un laboratorio q Venezuela no ha pedido la vacuna AH1N1 q estará lista en octubre, pero si compran tanques y demás. RT";;;;"3554819013";https://twitter.com/Chukyrp/status/3554819013
radiovenezuela;2009-08-26 11:47;0;0;"Van 755 infectados de Gripe AH1N1 y 21 personas fallecidas en todo el país. Entre las víctimas, destaca una mujer embarazada de 31 semanas";;;;"3554762558";https://twitter.com/radiovenezuela/status/3554762558
noticiaaldia;2009-08-26 11:39;0;0;"NAD: Primera muerte en Caracas por AH1N1 http://bit.ly/AnAJM";;;;"3554676026";https://twitter.com/noticiaaldia/status/3554676026
wfleurant;2009-08-26 11:33;0;0;"Cameroon AH1N1 Flu Gov't on the Alert http://tinyurl.com/nbrdv2";;;;"3554613835";https://twitter.com/wfleurant/status/3554613835
HumanRightsNews;2009-08-26 11:00;0;0;"AH1N1 Flu - Govt on the Alert - http://is.gd/2zrd8 - AllAfrica.com";;;;"3554264135";https://twitter.com/HumanRightsNews/status/3554264135
dailynewsvn;2009-08-26 10:54;0;0;"WHO warns of second wave of AH1N1 flu pandemic: Read and give us your comments http://url4.eu/JGca";;;;"3554211030";https://twitter.com/dailynewsvn/status/3554211030
xazarcom_ru;2009-08-26 10:49;0;0;"В Иране число зараженных вирусом AH1N1 достигло 285 человек http://ff.im/-7aXHc";;;;"3554152255";https://twitter.com/xazarcom_ru/status/3554152255
xazar_com;2009-08-26 10:13;0;0;"İranda AH1N1 virusuna yoluxanların sayı 285 nəfərə çatıb http://ff.im/-7aSRQ";;;;"3553807104";https://twitter.com/xazar_com/status/3553807104
xazarcom_ru;2009-08-26 08:47;0;0;"Количество смертей от гриппа AH1N1 приближается к 2,6 тысячи http://ff.im/-7aIcr";;;;"3553081316";https://twitter.com/xazarcom_ru/status/3553081316
mun2regionales;2009-08-26 07:54;0;0;"En Singapur, el Ministerio de Sanidad ha confirmado 13 víctimas mortales desde el pasado junio por la gripe AH1N1 .";;;;"3552587463";https://twitter.com/mun2regionales/status/3552587463
JerryNorstrom;2009-08-26 07:46;0;0;"L.O.N.E.L.Y: Influenza AH1N1 -Is Malaysia Prepare Enough?? http://bit.ly/3ygs4b";;;;"3552513405";https://twitter.com/JerryNorstrom/status/3552513405
JerryNorstrom;2009-08-26 07:46;0;0;"Swine Flu Outbreak | Swine Flu Info & Tips Influenza AH1N1 http://bit.ly/px7BQ";;;;"3552511549";https://twitter.com/JerryNorstrom/status/3552511549
xazarcom_ru;2009-08-26 07:44;0;0;"Онищенко собирается привиться от AH1N1 http://ff.im/-7aAgz";;;;"3552495084";https://twitter.com/xazarcom_ru/status/3552495084
x_tello;2009-08-26 07:28;0;0;"Learn how Kimberly-Clark won with the AH1N1 Flu Pandemic. Hint: Nothing to do with Kleenex http://bit.ly/16THPC #AH1N1 #Flu #KimberlyClark";;;#AH1N1 #Flu #KimberlyClark;"3552334625";https://twitter.com/x_tello/status/3552334625
DoctorGlyco;2009-08-26 07:18;0;0;"Best defense against AH1N1 virus is a strong immune system. Gochi has been clinically proven to strengthen immune function http://bit.ly ...";;;;"3552237392";https://twitter.com/DoctorGlyco/status/3552237392
hotnewsro;2009-08-26 07:12;0;0;"Jumatate din personalul medical din Hong Kong refuza vaccinul impotriva gripei AH1N1 , de teama efectelor secunda.. http://bit.ly/18HigD";;;;"3552184267";https://twitter.com/hotnewsro/status/3552184267
rubensyanes;2009-08-26 06:02;0;0;"El Universal: Primera muerte en Caracas por AH1N1 http://bit.ly/lmnw1 @robertorasquin sorry dude...";;@robertorasquin;;"3551406384";https://twitter.com/rubensyanes/status/3551406384
danielon658;2009-08-26 06:00;0;0;"Tres factores inciden para que los casos de AH1N1 aumenten http://bit.ly/dSe6i";;;;"3551385267";https://twitter.com/danielon658/status/3551385267
danielon658;2009-08-26 05:57;0;0;"Santa Cruz está en alerta amarilla por la gripe AH1N1 http://bit.ly/12188M";;;;"3551338035";https://twitter.com/danielon658/status/3551338035
abreu56k;2009-08-26 05:24;0;0;"Enterate, La segunda oleada del virus de la gripe AH1N1 , estás preparado?: El ministro.. http://tinyurl.com/lxczwo Más detalles...";;;;"3550922955";https://twitter.com/abreu56k/status/3550922955
crisanris;2009-08-26 04:59;0;0;"#Cuantas personas han fallecido en su país por la gripe AH1N1 y cuantos se han contagiado?";;;#Cuantas;"3550571450";https://twitter.com/crisanris/status/3550571450
CaracolRadio;2009-08-26 04:56;0;0;"Se dispara el número de contagios por el virus AH1N1 en Colombia http://bit.ly/NB6wH";;;;"3550526819";https://twitter.com/CaracolRadio/status/3550526819
Univ_Opinion;2009-08-26 04:23;0;0;"Los términos e-pi-de-mio-ló-gi-cos no se le dan a Gordillo. Bautizó a la influenza AH1N1 como “influencia” AHLNL… http://bit.ly/Zcpcq";;;;"3550269560";https://twitter.com/Univ_Opinion/status/3550269560
TonyAnkasky;2009-08-26 03:46;0;0;"hahaha qe wina la gente ta qe se muere de toz!! RT: @gtc1701 a la gente le esta dando la AH1N1";;@gtc1701;;"3549928541";https://twitter.com/TonyAnkasky/status/3549928541
gtc1701;2009-08-26 03:45;0;0;"a la gente le esta dando la AH1N1";;;;"3549913566";https://twitter.com/gtc1701/status/3549913566
mnuneztuntun;2009-08-26 03:40;0;0;"¿que paso con Honduras y con la AH1N1 ? ya no es noticia?";;;;"3549823498";https://twitter.com/mnuneztuntun/status/3549823498
JGonza_R;2009-08-26 03:32;0;0;"AH1N1 ? eso aun existe :S";;;;"3549684276";https://twitter.com/JGonza_R/status/3549684276
somosfullblog;2009-08-26 03:20;0;0;"Redes Socialistas se preparan para combatir una posible oleada de AH1N1 http://www.fullblog.com.ar/125125540362";;;;"3549465710";https://twitter.com/somosfullblog/status/3549465710
mr_mal;2009-08-26 03:03;0;0;"PREVISÕES SÃO SEMPRE PESSIMISTAS: se ocorre - fomos avisados; se não - pq. fomos previnidos. EUA espera até 90000 mortes por AH1N1 em 2010";;;;"3549174954";https://twitter.com/mr_mal/status/3549174954
tuespazio;2009-08-26 02:37;0;0;"RT @mx_mike : Elba Esther Gordillo CULTIVATE es INFLUENZA y es AH1N1 BURRA !!! pobre México como una persona como ella puede ser DIRIGENTE !";;@mx_mike;;"3548669950";https://twitter.com/tuespazio/status/3548669950
mx_mike;2009-08-26 02:20;0;0;"Elba Esther Gordillo CULTIVATE es INFLUENZA y es AH1N1 BURRA !!! pobre México como una persona como ella puede ser DIRIGENTE !!!";;;;"3548350888";https://twitter.com/mx_mike/status/3548350888
JerryNorstrom;2009-08-26 02:16;0;0;"Swine Flu Outbreak | Friday 22, PAHO Press Conference Influenza AH1N1 http://bit.ly/ONy85";;;;"3548279620";https://twitter.com/JerryNorstrom/status/3548279620
zulianamaracuch;2009-08-26 02:08;0;0;"#freemediave http://bit.ly/jymhO #venezuela de verdad sufrida/ 19 muertos x AH1N1 cifras oficialles y las reales?";;;#freemediave #venezuela;"3548117348";https://twitter.com/zulianamaracuch/status/3548117348
Gabriela_nds;2009-08-26 01:38;0;0;"Hj eu não fui a facu pq na facu 80% da galera esta com suspeita da gripe AH1N1 já estou com saudades do povim";;;;"3547534588";https://twitter.com/Gabriela_nds/status/3547534588
RaysFH;2009-08-26 01:18;0;0;"AH1N1 influenza death toll in Peru reaches 80 http://idek.net/R4F via @LivingInPeru";;@LivingInPeru;;"3547150491";https://twitter.com/RaysFH/status/3547150491
anaccronica;2009-08-26 01:18;0;0;"RT @dr_edurivas : Gripe AH1N1 : Dr. Oletta. Debe haber prevención en colegios y Hospitales. http://bit.ly/e4aOP Difundirlo. Viene nueva Ola.";;@dr_edurivas;;"3547140139";https://twitter.com/anaccronica/status/3547140139
NoticiasRCN;2009-08-26 01:10;0;0;"En Colombia el virus AH1N1 sigue expandiéndose http://bit.ly/2TBrRD";;;;"3546993377";https://twitter.com/NoticiasRCN/status/3546993377
eleconomista;2009-08-26 00:50;0;0;"Asia, sin vacunas anti- AH1N1 : HONG KONG. leer más http://bit.ly/18DLLw";;;;"3546615243";https://twitter.com/eleconomista/status/3546615243
cambridgeuio;2009-08-26 00:30;0;0;"Santa Cruz está en alerta amarilla por la gripe AH1N1 : Redacción Sociedad Según reportes del Ministerio de Salud.. http://bit.ly/SZfyF";;;;"3546227664";https://twitter.com/cambridgeuio/status/3546227664
aldiacr;2009-08-26 00:30;0;0;"El 70% de vacunas de Gripe AH1N1 serán compradas por países desarrollados http://tinyurl.com/mz98yh";;;;"3546226624";https://twitter.com/aldiacr/status/3546226624
ZephyreAllegra;2009-08-26 00:19;0;0;"A 36 llegan los muertos en Ecuador por la gripe AH1N1 http://www.timesoftheinternet.com/espanol/55436.html";;;;"3546032118";https://twitter.com/ZephyreAllegra/status/3546032118
lahueca;2009-08-26 00:07;0;0;"Víctimas mortales por gripe AH1N1 suman 36 http://bit.ly/21mzkU";;;;"3545799656";https://twitter.com/lahueca/status/3545799656
lahueca;2009-08-26 00:07;0;0;"Suspenden clases en Galápagos tras confirmarse primer caso de gripe AH1N1 http://bit.ly/1264hX";;;;"3545798907";https://twitter.com/lahueca/status/3545798907
Peru21pe;2009-08-26 00:03;0;1;"Latinoamérica tendrá dificultades para adquirir vacuna contra gripe AH1N1 . http://bit.ly/V0pDt";;;;"3545736417";https://twitter.com/Peru21pe/status/3545736417