username;date;retweets;favorites;text;geo;mentions;hashtags;id;permalink
ciudadanaherze;2009-09-14 01:04;0;0;"Ando viendo un especial de las enfermedades en Discovery Channel, luego sigue uno de la influenza AH1N1 en México, permiso";;;;"3966690782";https://twitter.com/ciudadanaherze/status/3966690782
discovery_prog;2009-09-14 01:00;0;0;"Ahora: AH1N1 : México Reacciona. Prox (22:00): Cuerpo Humano al Límite";;;;"3966573197";https://twitter.com/discovery_prog/status/3966573197
Lenin_Aceves;2009-09-14 00:50;0;0;"A las 20:00 hrs. AH1N1 :México reacciona... por Discovery Channel, a ver que dicen las autoridades...";;;;"3966316452";https://twitter.com/Lenin_Aceves/status/3966316452
daddy_yankee;2009-09-14 00:31;0;6;"Nuevas noticias sobre el virus AH1N1 http://bit.ly/3BucgA";;;;"3965849261";https://twitter.com/daddy_yankee/status/3965849261
discovery_prog;2009-09-14 00:00;0;0;"Ahora: Ciencia Viva. Prox (21:00): AH1N1 : México Reacciona";;;;"3965126894";https://twitter.com/discovery_prog/status/3965126894