username;date;retweets;favorites;text;geo;mentions;hashtags;id;permalink
lacreid;2009-08-16 23:52;0;0;"Por que chingados le pusieron una estatua al "niño cero" (1er caso AH1N1 ) en Veracruz? Gastar impuestos a lo pendejo es lo que hacen";;;;"3352025570";https://twitter.com/lacreid/status/3352025570
zurroneaton;2009-08-16 23:48;0;0;"Se Cancela Concierto por influenza AH1N1 : Wisin & Yandel canceló de última hora la presentación que tenían p.. http://bit.ly/4nTIG6";;;;"3351983150";https://twitter.com/zurroneaton/status/3351983150
brunomiguel;2009-08-16 23:41;0;0;"@ciberesfera : mais "Facts&Figures" (discutíveis) sobre o AH1N1";;@ciberesfera;;"3351884425";https://twitter.com/brunomiguel/status/3351884425
Snowconomics;2009-08-16 21:49;0;0;"La verdad sobre el AH1N1 _http://bit.ly/xelqs";;;;"3350374646";https://twitter.com/Snowconomics/status/3350374646
Gin_san_;2009-08-16 21:22;0;0;"@FALSOFILOSOFO provecho!! combatiendo la AH1N1 no? xD";;@FALSOFILOSOFO;;"3349999646";https://twitter.com/Gin_san_/status/3349999646
elcomerciocom;2009-08-16 20:44;0;0;"No habrá vacuna contra gripe AH1N1 para todos en América Latina, según Ministro de Salud argentino http://bit.ly/fTfUZ";;;;"3349478261";https://twitter.com/elcomerciocom/status/3349478261
luifel2780;2009-08-16 20:30;0;0;"Predicting Pandemics http://bit.ly/Q8mxo with Dr. Larry Brilliant #health #AH1n1";;;#health #AH1n1;"3349287356";https://twitter.com/luifel2780/status/3349287356
Ani_lr2;2009-08-16 18:45;0;0;"vote ya! LMFAO /// robsten = 1 / AH1N1 = 0 /// Cual ganara?? http://bit.ly/Na1am";;;;"3347903871";https://twitter.com/Ani_lr2/status/3347903871
revistapresei;2009-08-16 18:43;0;0;"[CAPITAL] Gripa AH1N1 ar putea să îmbolnăvească 3 milioane de români: Vârful cazurilor de gripă e.. http://bit.ly/11IDpu";;;;"3347868692";https://twitter.com/revistapresei/status/3347868692
Ani_lr2;2009-08-16 18:39;0;0;"q es peor Robsten / AH1N1 vote ya! LMFAO XD";;;;"3347813188";https://twitter.com/Ani_lr2/status/3347813188
x_tello;2009-08-16 17:56;0;0;"Au France: Les écoles pourront fermer à partir de "trois cas de syndromes grippaux" http://bit.ly/U40tT #LeMonde #AH1N1 #Grippe";;;#LeMonde #AH1N1 #Grippe;"3347240762";https://twitter.com/x_tello/status/3347240762
OtakuCompany;2009-08-16 17:56;0;0;"Vocalista da banda Maximum the Hormone é diagnosticado com influenza AH1N1 http://migre.me/5iK7";;;;"3347239154";https://twitter.com/OtakuCompany/status/3347239154
xazarcom_ru;2009-08-16 17:55;0;0;"Число заболевших гриппом AH1N1 в Бельгии превысило 2,3 тысячи человек http://ff.im/-6H4ht";;;;"3347232822";https://twitter.com/xazarcom_ru/status/3347232822
aahmm;2009-08-16 16:35;0;0;"la influenza AH1N1 esta por todos lados, hasta en trending topics =D";;;;"3346172799";https://twitter.com/aahmm/status/3346172799
xaviermolina;2009-08-16 16:29;0;0;"RT @malditogeek : AH1N1 is a hoax. http://bit.ly/Z95LW .. creo que muchos están de acuerdo";;@malditogeek;;"3346096175";https://twitter.com/xaviermolina/status/3346096175
malditogeek;2009-08-16 16:23;0;0;"AH1N1 is a hoax. http://bit.ly/Z95LW";;;;"3346013252";https://twitter.com/malditogeek/status/3346013252
eliezer;2009-08-16 15:13;0;0;"If Landon Donnovan from USA really had AH1N1 since like a week ago, ¿how come he played against México and with the Galaxy in just a week?";;;;"3345109906";https://twitter.com/eliezer/status/3345109906
scwolfcomputec;2009-08-16 14:40;0;0;"After Mexico vs USA Match Landon Donovan got positive on the aH1N1 Diagnostic";;;;"3344737580";https://twitter.com/scwolfcomputec/status/3344737580
argeif;2009-08-16 13:59;0;0;"my colds are preflowing on my nose due to AH1N1 on our enviroment";;;;"3344318373";https://twitter.com/argeif/status/3344318373
CatYong88;2009-08-16 13:01;0;0;"not all medical centers can test AH1N1 , the ones that do hv abt 6 hours waiting time. And it gets further out of hand...";;;;"3343816468";https://twitter.com/CatYong88/status/3343816468
GillesKLEIN;2009-08-16 11:17;0;0;"L'hebdomadaire Time et la grippe AH1N1 #grippeporcine #swineflu http://tinyurl.com/mdxvna";;;#grippeporcine #swineflu;"3343107749";https://twitter.com/GillesKLEIN/status/3343107749
senego;2009-08-16 09:47;0;0;"En24heures.com Grippe AH1N1 à Maurice : Quatre décès, 38 cas répertoriés dont un à Rodrigues.: Gri.. http://twurl.nl/g77tpf";;;;"3342530942";https://twitter.com/senego/status/3342530942
hwikueh;2009-08-16 08:32;0;0;"AH1N1 : Shut schools so more pupils can go to pikom fair";;;;"3342015051";https://twitter.com/hwikueh/status/3342015051
lawgri;2009-08-16 06:13;0;0;"Dites NON au futur vaccin contre l'influenza AH1N1 http://bit.ly/hYAyW";;;;"3340881368";https://twitter.com/lawgri/status/3340881368
x_tello;2009-08-16 05:59;0;0;"@Learn how Kimberly-Clark won with the AH1N1 Flu Pandemic. Hint: Nothing to do with Kleenex http://bit.ly/16THPC #AH1N1 #Flu #KimberlyClark";;@Learn;#AH1N1 #Flu #KimberlyClark;"3340741199";https://twitter.com/x_tello/status/3340741199
desarrollo;2009-08-16 05:07;0;0;"Compromete México 2 mmdp en vacunas contra virus AH1N1 - Rotativo de Querétaro: Compromete México 2 mmdp en vacu.. http://bit.ly/nsHH5";;;;"3340184136";https://twitter.com/desarrollo/status/3340184136
oscarfmurillo;2009-08-16 04:58;0;0;"Entrevista con la presidenta de la Asociación de Rectores; reseña de la jornada por la radio; otro fallecido por gripo AH1N1 en Bolívar";;;;"3340076041";https://twitter.com/oscarfmurillo/status/3340076041
chavoruco60;2009-08-16 04:23;0;0;"Universal Online> Guanajuato registra otra muerte por AH1N1 : Pierde la vida un hombre en el .. http://bit.ly/2kntuT";;;;"3339648273";https://twitter.com/chavoruco60/status/3339648273
swinflunews;2009-08-16 03:39;0;0;"Calle 13 – Habla Sobre Su Disco Nuevo y Sobre La aH1N1 (Loquendo) http://ff.im/-6FHD3";;;;"3339058741";https://twitter.com/swinflunews/status/3339058741
desarrollo;2009-08-16 03:08;0;0;"Ningún seleccionado tiene AH1N1 : Compeán - El Universal (México): MiamiHerald.comNingún seleccionado tiene AH1N1 .. http://bit.ly/yJZ84";;;;"3338630111";https://twitter.com/desarrollo/status/3338630111
xazarcom_ru;2009-08-16 03:01;0;0;"Второй человек скончался от гриппа AH1N1 на Тайване http://ff.im/-6FE7j";;;;"3338541019";https://twitter.com/xazarcom_ru/status/3338541019
laranoticias;2009-08-16 02:39;0;0;"New blog post: Venezuela tendrá vacuna contra AH1N1 http://www.laranoticias.com/?p=389";;;;"3338223830";https://twitter.com/laranoticias/status/3338223830
ensiz_news;2009-08-16 02:19;0;0;"BC aplica medidas contra AH1N1 en escuelas: El secretario de Salud en la entidad, José Guadalupe Bustamante More.. http://bit.ly/kglsy";;;;"3337949031";https://twitter.com/ensiz_news/status/3337949031
bassoburo;2009-08-16 01:25;0;0;"Bon, finalement, je n'ai pas de grippe porcine. Il va y avoir des virus AH1N1 partout au Québec cet automne, paranoia.com!";;;;"3337207635";https://twitter.com/bassoburo/status/3337207635
GregoryRojas;2009-08-16 01:10;0;0;"RT @nbocaranda : RT @darria : #Correa : Malas noticias el Presidente de Ecuador dice no tener gripe AH1N1 . Que lastima!!!";;@nbocaranda @darria;#Correa;"3337011598";https://twitter.com/GregoryRojas/status/3337011598
MarielaLlovera;2009-08-16 01:06;0;0;"RT @darkdarky : Alguien le pude decir el chamo revolucionario q precisamente en su barrio la AH1N1 está fuera de control?";;@darkdarky;;"3336954736";https://twitter.com/MarielaLlovera/status/3336954736
UN_NUEVO_TIEMPO;2009-08-16 00:52;0;0;"La Gripe AH1N1 no le da a ciertos animales...";;;;"3336772295";https://twitter.com/UN_NUEVO_TIEMPO/status/3336772295
rbonfil;2009-08-16 00:32;0;0;"Virus AH1N1 llega a webs mas prestigiosas Cuidado con el TamiFlue XD";;;;"3336506482";https://twitter.com/rbonfil/status/3336506482