username;date;retweets;favorites;text;geo;mentions;hashtags;id;permalink
djthesoftware;2009-07-12 23:58;0;0;"Señores que ha pasado con el AH1N1 , ya no habla de eso en la prensa, al menos de manera directa. ....?¿? eso 'ta chivo :djTS:";;;;"2605702402";https://twitter.com/djthesoftware/status/2605702402
x_tello;2009-07-12 23:55;0;0;"Se establece una 1ª causa para la gran mortalidad por Influenza en México: Mala Atención Primaria. http://bit.ly/uC5F8 #Influenza #AH1N1";;;#Influenza #AH1N1;"2605672637";https://twitter.com/x_tello/status/2605672637
IvanCarVE;2009-07-12 23:51;0;0;"@endrinacrv jajajaja no es la gripe AH1N1 xD Fue por la lluvia del jueves. =P y verdad hay suficientes enfermos en el mundo.";;@endrinacrv;;"2605626412";https://twitter.com/IvanCarVE/status/2605626412
Burzredion;2009-07-12 23:38;0;0;"Parece que también cerrarán la UNAC por 15 días por la gripe #AH1N1 ... sin confirmar.";;;#AH1N1;"2605458556";https://twitter.com/Burzredion/status/2605458556
CaracolRadio;2009-07-12 23:32;0;0;"EEUU destinará 1.000 millones de dólares más a una vacuna contra la gripe AH1N1 http://bit.ly/YycYP";;;;"2605395381";https://twitter.com/CaracolRadio/status/2605395381
danielavus;2009-07-12 23:12;0;0;"con tos, sueño, dolor d estomago.... mmmmm.... gripe ah1n1 ???? NOOOOOOO empacho no mas !!!!";;;;"2605140637";https://twitter.com/danielavus/status/2605140637
oederbrito;2009-07-12 23:06;0;0;"Acabei de pedir uma pizza meia argentina, meia mexicana. Fiquem a vontade para fazer piadas sobre gripe suína. ( AH1N1 , whatever...)";;;;"2605074943";https://twitter.com/oederbrito/status/2605074943
pablochuken;2009-07-12 22:49;0;0;"RT @nacion : Tres atletas fueron sacados de los Juegos Nacionales por sospecha de gripe Ah1N1 http://nacion.com/g/1p7";;@nacion;;"2604860900";https://twitter.com/pablochuken/status/2604860900
ATVenezuela;2009-07-12 22:27;0;0;"ATV- Confirman que 94% de contagiados por AH1N1 están totalmente recuperados http://tinyurl.com/md4ayv";;;;"2604591993";https://twitter.com/ATVenezuela/status/2604591993
xazarcom_ru;2009-07-12 22:18;0;0;"Жителям Латвии предлагают купить лжевакцину от вируса гриппа AH1N1 http://ff.im/-58oH2";;;;"2604478489";https://twitter.com/xazarcom_ru/status/2604478489
Eyy_Dee;2009-07-12 22:12;0;0;"good am people!! feels like summer haha no classes because of AH1N1 . tsk.. good morning!!!";;;;"2604403750";https://twitter.com/Eyy_Dee/status/2604403750
Tikkikun;2009-07-12 22:10;0;0;"@lucianaarata Ponles SARNA y LEPRA XD!!! O AH1N1 y EBOLA!!! O Gato y Canario (y les creas problemas de personalidad :P)";;@lucianaarata;;"2604371687";https://twitter.com/Tikkikun/status/2604371687
chidalgo;2009-07-12 22:09;0;0;"sabía usted que buena parte de los muertos por el AH1N1 eran obesos??? sabía usted que Japón no reporta a la fecha muertos por el AH1N1 ? #fb";;;#fb;"2604362260";https://twitter.com/chidalgo/status/2604362260
elcomerciocom;2009-07-12 21:54;0;0;"EE.UU. destinar� USD 1000 millones m�s a una vacuna contra la gripe AH1N1 http://tinyurl.com/lr9kaq";;;;"2604176097";https://twitter.com/elcomerciocom/status/2604176097
HenryAyalaAbril;2009-07-12 21:54;0;0;"comnzando a sentir cada vez mas cercay mas cerca la AH1N1 ...";;;;"2604175042";https://twitter.com/HenryAyalaAbril/status/2604175042
cveran;2009-07-12 21:32;0;0;"Totalmente destruido...mal muela y paladar destruidos + resaca + AH1N1 + episodio depresivo mayor + paja + heartache";;;;"2603902479";https://twitter.com/cveran/status/2603902479
aljayva;2009-07-12 21:29;0;0;"at work in the UTI w/3 influenza AH1N1 patients'...and their number is increasing...";;;;"2603866765";https://twitter.com/aljayva/status/2603866765
ErWinWin;2009-07-12 21:25;0;0;"1000 personas mueren al dia por la gripe estacional, 429 muertos por AH1N1 en todo el mundo en casi 2 meses, la AH1N1 mata? NO";;;;"2603815876";https://twitter.com/ErWinWin/status/2603815876
GhentBaroli;2009-07-12 20:56;0;0;"#news #Mexico #translated http://cafecode.com/gfzb 94% infected by AH1N1 n in Venezuela are fully recovered";;;#news #Mexico #translated;"2603450806";https://twitter.com/GhentBaroli/status/2603450806
aarontrejos;2009-07-12 20:55;0;0;"Pregnant Woman Becomes 5th AH1N1 Virus Death in Costa Rica: A pregnant woman who was carrying twins died Saturda.. http://tinyurl.com/lgplo6";;;;"2603437995";https://twitter.com/aarontrejos/status/2603437995
crheinga;2009-07-12 20:50;0;0;"last update from US. full plane, lots of facemasks cuz of AH1N1 in Peru getting bad now. need 2 listen 2 Spanish podcasts & read Spanish now";;;;"2603382100";https://twitter.com/crheinga/status/2603382100
palmarosam;2009-07-12 20:50;0;0;"RT @ultimahoraon: 94% de contagiados por AH1N1 están recuperados - http://tinyurl.com/nhoqqt";;@ultimahoraon;;"2603381263";https://twitter.com/palmarosam/status/2603381263
noticiaaldia;2009-07-12 20:42;0;0;"94% de contagiados por AH1N1 en Venezuela están recuperados http://bit.ly/du35R";;;;"2603285103";https://twitter.com/noticiaaldia/status/2603285103
fx211;2009-07-12 20:41;0;0;"PtM..pOsTeRgArOn loS dEsFiLeS ..oSeA PoR LaS wEbS.EsTaBaMoS PrAcTiCaNdO..pErO AsdeLaNtAron lAS VaCaCiOnEs..ToDo pO R La gRipE aH1n1 ..yEAH!!";;;;"2603262521";https://twitter.com/fx211/status/2603262521
nacioncl;2009-07-12 20:35;0;0;"16:05 | Gripe AH1N1 : Se produjo la víctima 26 en Chile http://tinyurl.com/nlfaeu";;;;"2603194390";https://twitter.com/nacioncl/status/2603194390
JerryNorstrom;2009-07-12 19:47;0;0;"What Is Influenza AH1N1 ? - Blurtit http://bit.ly/d0P1C";;;;"2602588453";https://twitter.com/JerryNorstrom/status/2602588453
colmenares;2009-07-12 19:36;0;0;"Donald Rumsfeld behind AH1N1 , sept. 11 and the fake man on the moon... he is the DEVIL !!!";;;;"2602446545";https://twitter.com/colmenares/status/2602446545
CaracolRadio;2009-07-12 19:33;0;0;"Concejal indígena denuncia que desplazados se pueden convertir en foco del virus AH1N1 http://bit.ly/g7k2p";;;;"2602408601";https://twitter.com/CaracolRadio/status/2602408601
airtonfarias;2009-07-12 19:15;0;0;"Perguntas e Respostas sobre a GRIPE “SUINA” ou melhor “ AH1N1 ” – Vamos divulgar!!! http://tinyurl.com/kjkczo";;;;"2602185766";https://twitter.com/airtonfarias/status/2602185766
NoticiasCaracol;2009-07-12 19:04;0;0;"Toda gripa en Bogotá será atendida como caso sospechoso de AH1N1 : Las autoridades sanitarias reforzaron las medi.. http://cli.gs/8Z3B5";;;;"2602052682";https://twitter.com/NoticiasCaracol/status/2602052682
rigotordoc;2009-07-12 18:51;0;0;"RT @cadenaglobal : Min.Salud: 94% de contagiados por AH1N1 están recuperados | Otra gripe mas..., aunque es mejor no contagiarse!";;@cadenaglobal;;"2601885267";https://twitter.com/rigotordoc/status/2601885267
canal_chile;2009-07-12 18:38;0;0;"Número d víctimas d AH1N1 sube a 26, víctima es casado, padre d 4 hijos, se transformó en décimo cuarto ca… http://ff.im/-583ix";;;;"2601726322";https://twitter.com/canal_chile/status/2601726322
noticiasve;2009-07-12 18:35;0;0;"94% de los casos de AH1N1 en el país están totalmente recuperados según Min. Salud http://bit.ly/4mzHsJ";;;;"2601696355";https://twitter.com/noticiasve/status/2601696355
xazarcom_ru;2009-07-12 18:30;0;0;"Создание вакцины против вируса гриппа AH1N1 http://ff.im/-582A8";;;;"2601632884";https://twitter.com/xazarcom_ru/status/2601632884
CallColombia;2009-07-12 18:10;0;0;"Colombia reports sixth AH1N1 fatality: Colombia news - Colombia health authorities Saturday reported the sixth f.. http://bit.ly/QWJA8";;;;"2601387193";https://twitter.com/CallColombia/status/2601387193
educador23013;2009-07-12 17:42;0;0;"Prevención de la Influenza AH1N1 , características y diferencias con una gripa comùn es el tema a tratar el lunes en el patio de formación";;;;"2601040008";https://twitter.com/educador23013/status/2601040008
educador23013;2009-07-12 17:41;0;0;"Charla del Plan de trabajo con los alumnos en el patio "Que puede hacer la escuela para evitar la influenza AH1N1 "";;;;"2601028718";https://twitter.com/educador23013/status/2601028718
elpaiscali;2009-07-12 17:23;0;0;"Sexta víctima en el país por gripa AH1N1 .: Se trata de un hombre de 25 años de edad que consultó a una entidad m.. http://tinyurl.com/lqq7p8";;;;"2600810801";https://twitter.com/elpaiscali/status/2600810801
cadenaglobal;2009-07-12 17:15;0;0;"Min.Salud: 94% de contagiados por AH1N1 están recuperados | http://bit.ly/Dq9eh";;;;"2600720716";https://twitter.com/cadenaglobal/status/2600720716
kerberos2k;2009-07-12 17:15;0;0;"volvienod a vivir, y eso que no era la AH1N1";;;;"2600710908";https://twitter.com/kerberos2k/status/2600710908
veneprensa;2009-07-12 17:00;0;0;"94% de contagiados por AH1N1 están recuperados - http://tinyurl.com/nhoqqt";;;;"2600536131";https://twitter.com/veneprensa/status/2600536131
wivacar;2009-07-12 16:56;0;0;"contra la gripe AH1N1 ESTOY VENDIENDO UN JABÓN LÍQUIDO GERMICIDA DE USO HOSPITALARIO contactos al 044-949343505 044-948592723 ---";;;;"2600480685";https://twitter.com/wivacar/status/2600480685
Ob1Kanabis;2009-07-12 16:52;0;0;"En cama con fiebre, sospechoso de AH1N1 !!! Loser!!!";;;;"2600437489";https://twitter.com/Ob1Kanabis/status/2600437489
detroya;2009-07-12 16:33;0;0;"@zanoni A es un virus, la pregunta es si AH1N1 ? si es esa, uchis, animo y a cuidarse ;)";;@zanoni;;"2600217989";https://twitter.com/detroya/status/2600217989
jozeluiz;2009-07-12 16:33;0;0;"Uy detectaron otro caso de gripe AH1N1 en la Facu de Biología de San Marcos...";;;;"2600215552";https://twitter.com/jozeluiz/status/2600215552
xazar_com;2009-07-12 16:33;0;0;"AH1N1 virusu 539 nəfərin həyatına son qoyub http://ff.im/-57Q0l";;;;"2600213293";https://twitter.com/xazar_com/status/2600213293
GREENPLANETSYS;2009-07-12 16:19;0;0;"FUMIGACION EN COLEGIOS CONTRA LA GRIPE AH1N1 5421242 / 405*8810";;;;"2600055744";https://twitter.com/GREENPLANETSYS/status/2600055744
elespectador;2009-07-12 16:16;0;0;"Desplazados en Bogotá podrían ser foco de transmisión de virus AH1N1 : Cerca de 10 mil personas en esta condición.. http://tinyurl.com/mvskvd";;;;"2600025057";https://twitter.com/elespectador/status/2600025057
radiosantafentc;2009-07-12 16:06;0;0;"Virus AH1N1 en Colombia: Se extreman precauciones ante nueva víctima mortal: –El alcalde mayor de Bogotá, .. http://tinyurl.com/mjkfzj";;;;"2599911765";https://twitter.com/radiosantafentc/status/2599911765
elcomerciocom;2009-07-12 15:56;0;0;"Cifra de muertos en Colombia por gripe AH1N1 sube a seis http://tinyurl.com/nknjo4";;;;"2599794224";https://twitter.com/elcomerciocom/status/2599794224
Peru21pe;2009-07-12 15:34;0;0;"Argentina reconoce que hubo errores en lucha contra la gripe AH1N1 . http://bit.ly/HquFU";;;;"2599553467";https://twitter.com/Peru21pe/status/2599553467
StiriAzi;2009-07-12 15:33;0;0;"Green / Toata populatia Marii Britanii ar putea fi vaccinata anti-gripa AH1N1 http://tinyurl.com/ksahzk";;;;"2599545933";https://twitter.com/StiriAzi/status/2599545933
cjs777;2009-07-12 15:21;0;0;"The cure of AH1N1 flu is inside Chuck Norris' beard. Too bad no one will EVER get it.";;;;"2599416288";https://twitter.com/cjs777/status/2599416288
JerryNorstrom;2009-07-12 15:18;0;0;"Influenza AH1N1 | FilipinoWritercom http://bit.ly/17hGdU";;;;"2599387173";https://twitter.com/JerryNorstrom/status/2599387173
nelsonsito;2009-07-12 15:17;0;0;"Todo esto de la #ah1n1 en reporte semanal me parece contradictorio...esta gripe no se supone preocupaba pq afectaba a a gente saludable?";;;#ah1n1;"2599378072";https://twitter.com/nelsonsito/status/2599378072
PinoyDen;2009-07-12 15:09;0;0;"Wag sanang matakot: Bakit ba kinakatunan ang aH1N1 ? Curable naman yan eh. We don't need much protection. Nak.. http://bit.ly/14fbzf";;;;"2599296699";https://twitter.com/PinoyDen/status/2599296699
antoniomanco;2009-07-12 15:05;0;0;"Laboratorios privados ofrecen desde hoy prueba de descarte para la gripe porcina AH1N1 http://www.periodismoenlinea.org/Actualidad/";;;;"2599258982";https://twitter.com/antoniomanco/status/2599258982
OmarVasquez;2009-07-12 15:05;0;0;"Ecuador registra las primeras dos muertes por la gripe AH1N1 http://bit.ly/OHZg0";;;;"2599253334";https://twitter.com/OmarVasquez/status/2599253334
periodismoperu;2009-07-12 15:05;0;0;"Laboratorios privados ofrecen desde hoy prueba de descarte para la gripe porcina AH1N1 http://www.periodismoenlinea.org/Actualidad/";;;;"2599252747";https://twitter.com/periodismoperu/status/2599252747
Alexsander_pe;2009-07-12 14:32;0;0;"@devil0ck Claro me cuido más en invierno y encima con la gripe AH1N1 más porque estoy en el grupo de riesgo ja!!!!";;@devil0ck;;"2598925875";https://twitter.com/Alexsander_pe/status/2598925875
ZephyreAllegra;2009-07-12 14:25;0;0;"A seis llegan los muertos por gripe AH1N1 en Colombia http://www.timesoftheinternet.com/espanol/48465.html";;;;"2598852394";https://twitter.com/ZephyreAllegra/status/2598852394
odinhood;2009-07-12 13:59;0;0;"sabi ng tita ko "ay baka naghihigpit sa mga airports, dahil nga pala may ahini...." at napaisip naman ako kung anung ahini... AH1N1 pala amp";;;;"2598615213";https://twitter.com/odinhood/status/2598615213
natho47;2009-07-12 12:37;0;0;"Recomiendan no ir a eventos masivos por alta tasa de contagio de AH1N1 http://bit.ly/1VT04Y";;;;"2597947697";https://twitter.com/natho47/status/2597947697
veneprensa;2009-07-12 12:24;0;0;"Ejecutivo confirma que 94% de contagiados por AH1N1 están recuperados - http://tinyurl.com/nhoqqt";;;;"2597852998";https://twitter.com/veneprensa/status/2597852998
DyannaMariae;2009-07-12 11:26;0;0;"OMC!!! I think AH1N1 is already in our school... No classes from July 13-22! ;-O";;;;"2597465753";https://twitter.com/DyannaMariae/status/2597465753
jbinx;2009-07-12 11:24;0;0;"Bad News: Confirmed AH1N1 cases in Pisay :-( Good News: Classes...NOT suspended. :-)";;;;"2597458277";https://twitter.com/jbinx/status/2597458277
SumtinAbtXtine;2009-07-12 11:14;0;0;"still coughing... I hate this part.... I don't have ah1n1 virus!!!";;;;"2597391223";https://twitter.com/SumtinAbtXtine/status/2597391223
alskarmigcor;2009-07-12 10:49;0;0;"just got rid of fever, cough, and colds...( AH1N1 ?...absolutely Not!)";;;;"2597239163";https://twitter.com/alskarmigcor/status/2597239163
rcdiugun;2009-07-12 10:39;0;0;"@JeromeGotangco So is mine. I would have forgotten it's #uaap season if it weren't for those "One Big Fight"s and " AH1N1 LA SALLE"s";;@JeromeGotangco;#uaap;"2597177671";https://twitter.com/rcdiugun/status/2597177671
BleedblueKyGirl;2009-07-12 09:42;0;0;"http://www.cdc.gov/h1n1flu/update.htm This is the Official CDC website for AH1N1 . 33,902 infected 170 dead.";;;;"2596831548";https://twitter.com/BleedblueKyGirl/status/2596831548
diariobogota;2009-07-12 08:18;0;0;"Joven de 25 años: sexta muerte en Bogotá por Ah1N1 http://bit.ly/HGGks - DiarioBogota.com";;;;"2596292451";https://twitter.com/diariobogota/status/2596292451
News_in_Peru;2009-07-12 07:44;0;0;"Peru reports its 5th death from AH1N1 influenza http://www.livinginperu.com/news/9552";;;;"2596046065";https://twitter.com/News_in_Peru/status/2596046065
ApplesH;2009-07-12 07:15;0;0;"RT @piacayetano Just arrived in HK, Vice consul informed me of a pinay ofw who has AH1N1 and is in grave condition. Lets pray for her.";;@piacayetano;;"2595825114";https://twitter.com/ApplesH/status/2595825114
MoldovaNews;2009-07-12 06:54;0;0;"Noua gripă loveşte fotbalul. Micah Richards, de la Manchester City, infectat cu virusul AH1N1 : Noua gripă loveşt.. http://tinyurl.com/lk7slg";;;;"2595653166";https://twitter.com/MoldovaNews/status/2595653166
iammjsamarita;2009-07-12 06:10;0;0;"FIGHT the Pandemic AH1N1 !, boost your immune system with the help of the clinically proven product I use http://bit.ly/BIAzk";;;;"2595263187";https://twitter.com/iammjsamarita/status/2595263187
Danipilze;2009-07-12 05:16;0;0;"El AH1N1 que hubo el primer día en las #cparty . Todos los navegadores en windows. http://yfrog.com/0imensajedj";;;#cparty;"2594727559";https://twitter.com/Danipilze/status/2594727559
laczanu;2009-07-12 05:13;0;0;"So can't wait to get back to school tomorrow :) (Sarcastic? Or not? You decide) I wanna know who's got ah1n1 .";;;;"2594698440";https://twitter.com/laczanu/status/2594698440
nacioncl;2009-07-12 05:05;0;1;"00:43 | Gripe AH1N1 : Denuncian que Isapres rechazan licencias médicas http://tinyurl.com/mhdaf4";;;;"2594610772";https://twitter.com/nacioncl/status/2594610772
Irving_Copi;2009-07-12 04:50;0;0;"CONFIRMADO: AH1N1 en Centros Académicos de Adex CEADEX";;;;"2594449254";https://twitter.com/Irving_Copi/status/2594449254
JerryNorstrom;2009-07-12 04:50;0;0;"Jada Lewis - Peru reported its fifth death on AH1N1 influenza and ... http://bit.ly/OKSpE";;;;"2594445603";https://twitter.com/JerryNorstrom/status/2594445603
Informe21;2009-07-12 04:08;0;0;"Min. Salud confirma que 94% de contagiados por AH1N1 están totalmente recuperados http://informe21.com/node/11651";;;;"2593956909";https://twitter.com/Informe21/status/2593956909
SwineFluNewsORG;2009-07-12 03:51;0;0;"AH1N1 Influenza cases upon a climb in Colombia http://tinyurl.com/l68d9o #swineflu #h1n1";;;#swineflu #h1n1;"2593742630";https://twitter.com/SwineFluNewsORG/status/2593742630
laczanu;2009-07-12 03:51;0;0;"Oooh what wonderful news to be online to -- we have ah1n1 in our school.";;;;"2593741549";https://twitter.com/laczanu/status/2593741549
sapphireboy07;2009-07-12 03:50;0;0;"says, "OHNOES! Pisay has an AH1N1 confirmed case."";;;;"2593738085";https://twitter.com/sapphireboy07/status/2593738085
jcferrada;2009-07-12 03:31;0;0;"having the AH1N1 its not funny at all :(";;;;"2593507694";https://twitter.com/jcferrada/status/2593507694
kareninariehl;2009-07-12 03:08;0;0;"" Eu sou terrível ! " (Influenza AH1N1 )";;;;"2593212043";https://twitter.com/kareninariehl/status/2593212043
adriaanalsema;2009-07-12 03:02;0;0;"Colombia reports sixth AH1N1 fatality http://tinyurl.com/l6vgdq";;;;"2593129217";https://twitter.com/adriaanalsema/status/2593129217
LiYaNcorrea;2009-07-12 02:53;0;0;"NO NET CONNECTION ATM.T_T CLASSES that were suspended for 10days cozof AH1N1 now RESUME..";;;;"2593013751";https://twitter.com/LiYaNcorrea/status/2593013751
tolentinobunny;2009-07-12 02:52;0;0;"Congratulations Medtech students of University of Perpetual Help for a successful AH1N1 and Blood Glucose Seminar Workshop yesterday.";;;;"2593007101";https://twitter.com/tolentinobunny/status/2593007101
elpaiscali;2009-07-12 02:52;0;0;"Sexta víctima en el país por gripa AH1N1 .: El virus de la influenza AH1N1 cobró ayer su sexta víctima en Colombi.. http://tinyurl.com/le72zj";;;;"2593003173";https://twitter.com/elpaiscali/status/2593003173
Agency86;2009-07-12 02:39;0;0;"Nueva víctima mortal del virus AH1N1 en Perú: Un hombre de 27 años residente en Lima es la quinta víctima mortal.. http://bit.ly/19y1oZ";;;;"2592838547";https://twitter.com/Agency86/status/2592838547
blogsbolivia;2009-07-12 02:36;0;0;"#bolivia Empresario alteños se suman en la lucha contra la gripe AH1N1 : El Alto, 8 de julio (CEPABOL).- .. http://tinyurl.com/mgexk9";;;#bolivia;"2592802774";https://twitter.com/blogsbolivia/status/2592802774
CamoGM;2009-07-12 02:29;0;0;"wow ya conozco a alguen con AH1N1 !!!";;;;"2592715008";https://twitter.com/CamoGM/status/2592715008
tonclemopedes;2009-07-12 02:26;0;0;"se elevó a 25 los muertos por la gripe AH1N1 en Chile.........ta fregado esto";;;;"2592680829";https://twitter.com/tonclemopedes/status/2592680829
tonclemopedes;2009-07-12 02:25;0;0;"Ya son 100 muertos por la gripe AH1N1 en Argentina ..............que miedo melas";;;;"2592669779";https://twitter.com/tonclemopedes/status/2592669779
ViCtTeR_;2009-07-12 02:20;0;0;"acabo de enterarme que ya sin 5 los fallecidos por la AH1N1 ...";;;;"2592606715";https://twitter.com/ViCtTeR_/status/2592606715
CaracolRadio;2009-07-12 01:33;0;0;"Confirman la sexta muerte en Colombia por virus AH1N1 http://bit.ly/5HndZ";;;;"2592022003";https://twitter.com/CaracolRadio/status/2592022003
angelacoloms;2009-07-12 01:29;0;0;"@sakuraxyuri, yOu goT thE ah1n1 !?!?! gEt weLL sOon, wE doN't waNt ouR chRistMas vaCatiOn tO bE caNceLleD tOo anD ouR grAduAtioN trAnsferRed!";;@sakuraxyuri;;"2591970272";https://twitter.com/angelacoloms/status/2591970272
abc_mundo;2009-07-12 01:22;0;0;"ABC: Nueva víctima mortal del virus AH1N1 en Perú http://twurl.nl/p1ukot";;;;"2591896687";https://twitter.com/abc_mundo/status/2591896687
dongyoj28;2009-07-12 01:20;0;0;"Svi sa news ng Kapamilya FLU lng. Pro svi s news ng Kapuso ngka AH1N1 si regine.. an0 kaya un.";;;;"2591866944";https://twitter.com/dongyoj28/status/2591866944
alejogonzaleze;2009-07-12 01:17;0;0;"Acaba de morir otra persona por gripe #AH1N1 en Bogotá. Tocará tomar medidas restrictivas con los que vienen de #cparty LOL";;;#AH1N1 #cparty;"2591833660";https://twitter.com/alejogonzaleze/status/2591833660
elespectador;2009-07-12 01:16;0;0;"A seis sube número de víctimas por gripe AH1N1 : En menos de 24 horas las autoridades han reportado los dos últim.. http://tinyurl.com/l9m9b9";;;;"2591822407";https://twitter.com/elespectador/status/2591822407
ZephyreAllegra;2009-07-12 01:16;0;0;"Gripe AH1N1 se cobra dos vidas http://www.timesoftheinternet.com/espanol/48441.html";;;;"2591814117";https://twitter.com/ZephyreAllegra/status/2591814117
dongyoj28;2009-07-12 01:14;0;0;"@yeshasaram ngka AH1N1 talaga si regne yun ang sabi sa GMAnews. Bakit kaya magkaiba ang news ng Kapuso at ng Kapamilya? hmm..";;@yeshasaram;;"2591797617";https://twitter.com/dongyoj28/status/2591797617
jimmyleespore;2009-07-12 00:52;0;0;"[New RightOnClick.com Post] Peru reported its fifth death on AH1N1 influenza and 1,621 cases: Living in Peru, News portal, Lima, Peru ht ...";;;;"2591534052";https://twitter.com/jimmyleespore/status/2591534052
natorrante;2009-07-12 00:37;0;0;"Se buscan víctimas de la AH1N1 para que me contagie... tengo organismo fuerte, pero quiero excusas para faltar al trabajo!! :D";;;;"2591358521";https://twitter.com/natorrante/status/2591358521
NoticiasCaracol;2009-07-12 00:34;0;0;"Murió otra persona en Colombia por el virus AH1N1 . Ya son seis las víctimas fatales que deja la gripa en el país.. http://cli.gs/tD1rt";;;;"2591325298";https://twitter.com/NoticiasCaracol/status/2591325298
NocheDelGOL;2009-07-12 00:21;0;0;"@poliloco85 jaja dudo que tuvieran AH1N1 jugaron y dieron batalla como unos grandes tenistas, solo que le faltó ese toque de profesionalismo";;@poliloco85;;"2591175286";https://twitter.com/NocheDelGOL/status/2591175286
Raf0;2009-07-12 00:08;0;0;"Con la quinta víctima mortal a causa de la gripe #AH1N1 , me ha dejado pensando y un poco preocupado...";;;#AH1N1;"2591019607";https://twitter.com/Raf0/status/2591019607
Raf0;2009-07-12 00:03;0;0;"Por lo visto la situación se pone más grave. Ya son 5 las víctimas en Perú a causa de la gripe #AH1N1 http://bit.ly/zKwgl";;;#AH1N1;"2590965776";https://twitter.com/Raf0/status/2590965776
RPPNoticias;2009-07-12 00:00;0;0;"Ministros de Sudamérica definirán estrategias contra gripe AH1N1 http://tinyurl.com/laowqx";;;;"2590927209";https://twitter.com/RPPNoticias/status/2590927209