username;date;retweets;favorites;text;geo;mentions;hashtags;id;permalink
latercera;2009-07-31 23:43;0;0;"Minsal apoyará a Paraguay en detección de Virus AH1N1 : Esto, debido al compromiso asumido por Bachelet tras su v.. http://twurl.nl/tuoy4g";;;;"3060771168";https://twitter.com/latercera/status/3060771168
elcomerciocom;2009-07-31 22:52;0;0;"Gripe AH1N1 mató a más de 600 personas en América Latina http://bit.ly/dHuDM";;;;"3059978112";https://twitter.com/elcomerciocom/status/3059978112
TuNoticiero;2009-07-31 22:43;0;0;"Muere primer zuliano a causa de la gripe AH1N1 : Lo que dicen Los foristas Estadísticas : 1 Nota || 3 Vistas Post.. http://bit.ly/kJWcD";;;;"3059849686";https://twitter.com/TuNoticiero/status/3059849686
lion05;2009-07-31 22:29;0;0;"@ba_anderson llevas tapabocas para AH1N1 ? :P";;@ba_anderson;;"3059618569";https://twitter.com/lion05/status/3059618569
Cooperativa;2009-07-31 21:00;0;0;"Unasur y México evalúan la compra conjunta de vacunas contra la gripe AH1N1 : http://bit.ly/19v2Wx";;;;"3058164548";https://twitter.com/Cooperativa/status/3058164548
influenza_aH1N1;2009-07-31 20:54;0;0;"Hoy en la noche todos al al Circuito Magico !!!";;;;"3058062342";https://twitter.com/influenza_aH1N1/status/3058062342
ZephyreAllegra;2009-07-31 20:36;0;0;"Ya suman 96 muertes en Chile por la gripe AH1N1 http://www.timesoftheinternet.com/espanol/51640.html";;;;"3057763386";https://twitter.com/ZephyreAllegra/status/3057763386
ZephyreAllegra;2009-07-31 20:35;0;0;"Mueren otros cuatro colombianos a causa de la gripe AH1N1 http://www.timesoftheinternet.com/espanol/51632.html";;;;"3057759651";https://twitter.com/ZephyreAllegra/status/3057759651
DABuiles;2009-07-31 20:21;0;0;"Que hay detras del AH1N1 http://bit.ly/4hSt48";;;;"3057506559";https://twitter.com/DABuiles/status/3057506559
ideeleradio;2009-07-31 19:39;0;0;"Puno: Fallece segunda persona por gripe AH1N1 http://bit.ly/CgxMg";;;;"3056768433";https://twitter.com/ideeleradio/status/3056768433
EnSegun2;2009-07-31 18:58;0;0;"718 ticos confirmados con gripe AH1N1";;;;"3056028681";https://twitter.com/EnSegun2/status/3056028681
pquijada;2009-07-31 18:03;0;0;"A comer algo para luego ir a tomar pruebas atrasadas (todos los que tenian AH1N1 hace 3 semanas)";;;;"3055239481";https://twitter.com/pquijada/status/3055239481
PSarg;2009-07-31 17:45;0;0;"¡Argentina está a punto de superar a los EE.UU.! (en muertes por la AH1N1 )";;;;"3054953160";https://twitter.com/PSarg/status/3054953160
elpaiscali;2009-07-31 17:29;0;0;"Colombia reporta cuatro muertes más por gripe AH1N1 .: El Ministerio de Protección Social informó que reportó cua.. http://bit.ly/10lVge";;;;"3054710342";https://twitter.com/elpaiscali/status/3054710342
noticialocal;2009-07-31 17:16;0;0;"Fumigan mercado chalaco para evitar gripe AH1N1 http://bit.ly/1tlCei";;;;"3054552389";https://twitter.com/noticialocal/status/3054552389
Diario_Libre;2009-07-31 16:43;0;0;"Gripe AH1N1 incrementa riesgo de muerte fetal o aborto espontáneo http://bit.ly/Fwuht";;;;"2954152828";https://twitter.com/Diario_Libre/status/2954152828
vbaosv;2009-07-31 16:26;0;0;"Primera referencia efectos adversos de oseltamivir en niños tratados en profilaxis de AH1N1 . Gracias a Martín Cañás http://bit.ly/yD7a9";;;;"2953843291";https://twitter.com/vbaosv/status/2953843291
elcomerciocom;2009-07-31 16:16;0;0;"Cuatro muertos más en Colombia por gripe AH1N1 y suman 17 en total http://bit.ly/eDvJL";;;;"2953673277";https://twitter.com/elcomerciocom/status/2953673277
x_tello;2009-07-31 16:04;0;0;"Regresa la Influenza AH1N1 . ¿Estamos realmente preparados en nuestras empresas? http://bit.ly/2yaRg #AH1N1 #Influenza #Pandemia #Virus #Flu";;;#AH1N1 #Influenza #Pandemia #Virus #Flu;"2953450405";https://twitter.com/x_tello/status/2953450405
nacion;2009-07-31 15:58;0;1;"Ensayo de vacuna contra virus AH1N1 incluirá a Costa Rica http://nacion.com/g/24p";;;;"2953344607";https://twitter.com/nacion/status/2953344607
Furitu;2009-07-31 15:57;0;0;"Bueno, al parecer son más y más los romeros virtuales que se suman a la caminata por la virgencita: www.romeriavirtual.com, libre de AH1N1";;;;"2953320420";https://twitter.com/Furitu/status/2953320420
MORENA_PC;2009-07-31 15:51;0;0;"RT @Radioacktiva_ : Ms Foro: No elijan a la mexicana, esa nos trae la ah1n1 jajaja<-- pinches racistas chistositos! Salu2 d mex discrim @col";;@Radioacktiva_ @col;;"2953223703";https://twitter.com/MORENA_PC/status/2953223703
alfonsodg;2009-07-31 15:39;0;0;"♺ @_Cecilia_ : Se cancelo el Arco Iris Musical en el nido. (Ya no habrá evento en el peruano japonés gracias a la AH1N1 )";;@_Cecilia_;;"2953011507";https://twitter.com/alfonsodg/status/2953011507
danielon658;2009-07-31 15:38;0;0;"En Cotopaxi fallecíó una persona por la gripe AH1N1 http://bit.ly/JHJOG";;;;"2952999945";https://twitter.com/danielon658/status/2952999945
Radioacktiva_;2009-07-31 15:38;0;0;"Mensajes del Foro: No elijan a la mexicana, esa nos trae la ah1n1 jajajajajajajaja";;;;"2952990571";https://twitter.com/Radioacktiva_/status/2952990571
Danipilze;2009-07-31 15:05;0;0;"Tomorrow Never Dies + Mission: Impossible II = #AH1n1 . Pero si quieren vean en @pulsosocial Operación pandemia http://bit.ly/1jIw58";;@pulsosocial;#AH1n1;"2952421150";https://twitter.com/Danipilze/status/2952421150
DINORAMPINI;2009-07-31 14:54;0;0;"Presidenta del ISP: "Instituto Nacional de Higiene es el único autorizado para certificar muertes por virus AH1N1 http://bit.ly/D5692";;;;"2952226800";https://twitter.com/DINORAMPINI/status/2952226800
NoticiasCaracol;2009-07-31 14:25;0;0;"Mueren otras cuatro personas por virus AH1N1 en Colombia : Con ellas son ya 17 las vidas que ha cobrado la enfer.. http://cli.gs/678hN";;;;"2951745854";https://twitter.com/NoticiasCaracol/status/2951745854
xhugorichardx;2009-07-31 14:07;0;0;"Fallece otra mujer x aH1N1 http://www.losandes.com.pe/Sociedad/20090731/25126.html";;;;"2951467907";https://twitter.com/xhugorichardx/status/2951467907
elcomerciocom;2009-07-31 13:50;0;0;"Muertos por gripe AH1N1 suben a 87 en Chile; contagiados llegan a 11 860 http://bit.ly/1kLNpG";;;;"2951211407";https://twitter.com/elcomerciocom/status/2951211407
ppenzini;2009-07-31 13:39;0;0;"RT @vengador1969 : Ya tenemos muertos en Bolivar mosca a lavarse las manos Sube a cinco el número de venezolanos fallecidos por AH1N1 htt ...";;@vengador1969;;"2951052107";https://twitter.com/ppenzini/status/2951052107
CarlosMatabuena;2009-07-31 13:33;0;0;"@isunscape Todo se andará y no a mucho tardar.A mí de momento éste año me tocará doble vacuna gripal. Mascarilla para twittear?? #AH1N1";;@isunscape;#AH1N1;"2950962045";https://twitter.com/CarlosMatabuena/status/2950962045
Calibre_57;2009-07-31 13:24;0;0;"Se incrementa número de casos de AH1N1 : SSa http://tiny.cc/5Vvxt";;;;"2950837391";https://twitter.com/Calibre_57/status/2950837391
andrescortesd;2009-07-31 13:24;0;0;"Vean este video... sobre todo los que padecieron la Ah1n1 y los que estaban alarmados http://www.rafapal.com/?p=2005";;;;"2950836595";https://twitter.com/andrescortesd/status/2950836595
noticia24;2009-07-31 13:18;0;0;"Desinformacion en poblacion sobre gripe AH1N1 http://bit.ly/ylFOj";;;;"2950756609";https://twitter.com/noticia24/status/2950756609
solazver;2009-07-31 13:14;0;0;"Falleció otro portador de AH1N1 http://p1pv9.tk";;;;"2950698178";https://twitter.com/solazver/status/2950698178
elfalconiano;2009-07-31 13:10;0;0;"Van 5 fallecidos por AH1N1 en Venezuela http://bit.ly/aihaz";;;;"2950641219";https://twitter.com/elfalconiano/status/2950641219
CaracolRadio;2009-07-31 13:08;0;0;"[ Escuche ] Muere en Bogtá una mujer de 5 meses de gestación por contagio de gripa AH1N1 http://bit.ly/NCyP2";;;;"2950615583";https://twitter.com/CaracolRadio/status/2950615583
elimpulsocom;2009-07-31 12:57;0;0;"Ascienden a cinco los venezolanos fallecidos por AH1N1 http://bit.ly/nSxru";;;;"2950473164";https://twitter.com/elimpulsocom/status/2950473164
canal_chile;2009-07-31 12:41;0;0;"Muertos por AH1N1 suman 96 en Chile, informe d Minsal precisa q desde q se detecto virus en país, pasado 17 d mayo, se… http://ff.im/-5YHwq";;;;"2950285137";https://twitter.com/canal_chile/status/2950285137
NoticiasRCN;2009-07-31 12:05;0;0;"Llega a 17 el número de víctimas mortales por AH1N1 http://bit.ly/14bRyt";;;;"2949883060";https://twitter.com/NoticiasRCN/status/2949883060
cadenaglobal;2009-07-31 11:55;0;0;"Confirman dos muertes asociadas a la AH1N1 | http://bit.ly/18OR6I";;;;"2949773441";https://twitter.com/cadenaglobal/status/2949773441
ZephyreAllegra;2009-07-31 11:46;0;0;"Brasil comenzó a producir remedios contra la gripe AH1N1 http://www.timesoftheinternet.com/espanol/51571.html";;;;"2949688211";https://twitter.com/ZephyreAllegra/status/2949688211
etorruella;2009-07-31 11:30;0;0;"Currently reading 'Protocolo en Las Escuelas de La Gripe AH1N1 ' : http://scribd.com/doc/17711261";;;;"2949538374";https://twitter.com/etorruella/status/2949538374
laverdadweb;2009-07-31 10:56;0;0;"Muere primer zuliano a causa de la gripe AH1N1 : http://bit.ly/E55bn";;;;"2949237880";https://twitter.com/laverdadweb/status/2949237880
vbaosv;2009-07-31 09:19;0;0;"Un editorial con sentido común: Lancet y las vacunas contra AH1N1 . Traducción propia http://bit.ly/fXTHE";;;;"2948430180";https://twitter.com/vbaosv/status/2948430180
VNRamirez;2009-07-31 06:16;0;0;"AH1N1 , altamente contagioso y vulnerable al sol, ... http://eluniverso.com/2009/07/31/1/1447/5F65B98D227E4CDB8E73D7A7435A22CA.html";;;;"2946671435";https://twitter.com/VNRamirez/status/2946671435
nacioncl;2009-07-31 05:39;0;0;"00:37 | Minsal: Aumenta a 96 número de muertes por influenza AH1N1 http://bit.ly/uZgfM";;;;"2946237157";https://twitter.com/nacioncl/status/2946237157
alekstrust;2009-07-31 05:34;0;0;"RT: @salo_qj : "Si tienes un estornudo, cierra la boca no seas cojudo" Luchemos contra AH1N1";;@salo_qj;;"2946169798";https://twitter.com/alekstrust/status/2946169798
NoticiasRCN;2009-07-31 04:57;0;0;"Llega a 17 el número de víctimas mortales por AH1N1 http://bit.ly/14bRyt";;;;"2945686205";https://twitter.com/NoticiasRCN/status/2945686205
Gripe_porcina;2009-07-31 04:57;0;0;"A 17 subió número de personas muertas por gripe AH1N1 (El Espectador): Bogotá es la ciudad más afectada con la n.. http://bit.ly/IJuf9";;;;"2945681588";https://twitter.com/Gripe_porcina/status/2945681588
CaracolRadio;2009-07-31 04:53;0;0;"Otras cuatro muertes deja en Colombia la gripa tipo AH1N1 http://bit.ly/14OudR";;;;"2945632870";https://twitter.com/CaracolRadio/status/2945632870
pedroluisflores;2009-07-31 04:06;0;0;"los periodicos de mañana dan cuenta de 5 muertes en el pais por gripe AH1N1";;;;"2944939842";https://twitter.com/pedroluisflores/status/2944939842
tigredepapel;2009-07-31 04:00;0;0;"Me da miedito la fusión de Niño Indigo con Nativo Digital... Si le sumamos la AH1N1 , se acabó!! ( @d0nfil0fi0 live on http://twitcam.com/gzx)";;@d0nfil0fi0;;"2944840908";https://twitter.com/tigredepapel/status/2944840908
NotiSalud;2009-07-31 03:55;0;0;"¿Cómo cree que ha sido la actuación del Gobierno venezolano ante la pandemia de influenza #AH1N1 ?. Opina en: www.notisalud.com.ve";;;#AH1N1;"2944763825";https://twitter.com/NotiSalud/status/2944763825
NotiSalud;2009-07-31 03:53;0;0;"Venezuela, edo. Falcón: un niño de 10 años se contagió con #AH1N1 por contacto con deportistas de Puerto Rico. Lee: www.notisalud.com.ve";;;#AH1N1;"2944732720";https://twitter.com/NotiSalud/status/2944732720
elespectador;2009-07-31 03:49;0;0;"Dos personas más murieron de gripe AH1N1 : Se eleva a 17 el número de personas muertas en el país por la nueva in.. http://bit.ly/13szxx";;;;"2944672217";https://twitter.com/elespectador/status/2944672217
PublimetroMX;2009-07-31 03:44;0;0;"Hay que prepararse contra el AH1N1 : FCH http://bit.ly/40WLZ";;;;"2944588477";https://twitter.com/PublimetroMX/status/2944588477
Gripe_porcina;2009-07-31 03:27;0;0;"Aumenta a 96 número de muertes asociadas a influenza AH1N1 (La Cuarta): Pese a ello, el Minsal informó que desde.. http://bit.ly/2xNBI0";;;;"2944307954";https://twitter.com/Gripe_porcina/status/2944307954
natho47;2009-07-31 02:31;0;0;"Minsal investiga siete casos de muerte por AH1N1 en región de Los Ríos http://tinyurl.com/mkhhre";;;;"2943366441";https://twitter.com/natho47/status/2943366441
Kamiikol;2009-07-31 01:31;0;0;"Creo que me dió la infuelnza ANH2 jajajaja (es mas leve y menos riesgosa que la AH1N1 )";;;;"2942336663";https://twitter.com/Kamiikol/status/2942336663
Aferbaco;2009-07-31 01:22;0;0;"Costa Rica conejillo de indias para vacuna de AH1N1";;;;"2942180302";https://twitter.com/Aferbaco/status/2942180302
Reporte360;2009-07-31 01:17;0;0;"Desmienten muerte de cuatro personas con AH1N1 en Mérida";;;;"2942113232";https://twitter.com/Reporte360/status/2942113232
RPPNoticias;2009-07-31 00:53;0;1;"Confirman seis nuevas víctimas mortales por gripe AH1N1 en el país http://tinyurl.com/met9xb";;;;"2941718030";https://twitter.com/RPPNoticias/status/2941718030
elcomerciocom;2009-07-31 00:49;0;0;"En Cotopaxi fallece una persona por la gripe AH1N1 http://bit.ly/21XsZ";;;;"2941656776";https://twitter.com/elcomerciocom/status/2941656776
PitoAmazonas;2009-07-31 00:44;0;0;"3 caso de gripe AH1N1 en amazonas!!! http://myloc.me/fEg2";;;;"2941575595";https://twitter.com/PitoAmazonas/status/2941575595
teleSURtv;2009-07-31 00:01;0;0;"Aumentan a 29 muertes por gripe AH1N1 en el Perú http://tinyurl.com/n7o7pv";;;;"2940893870";https://twitter.com/teleSURtv/status/2940893870