username;date;retweets;favorites;text;geo;mentions;hashtags;id;permalink
mistermozart;2009-06-15 11:07;0;0;"ah1n1 is only a mild flu. and it subsides just like any normal flu. so what's the buzz all about?";;;;"2176532577";https://twitter.com/mistermozart/status/2176532577
facebuko;2009-06-15 10:49;0;0;"ay lumipat ng ibang puwesto sapagkat malamok sa dating kinauupuan. mas takot ako sa dengue kaysa ah1n1 .";;;;"2176418842";https://twitter.com/facebuko/status/2176418842
GhelSandra;2009-06-15 10:45;0;0;"Nooo! Makati has cases of AH1n1 ?! how will i go to the office now... call me paranoid but i'm scared.... :(";;;;"2176396681";https://twitter.com/GhelSandra/status/2176396681
dranagar;2009-06-15 10:41;0;0;"@CindyBattye Found you through @MrTweet So how soon is soon? How's the AH1N1 condition in Adelaide?";;@CindyBattye @MrTweet;;"2176371392";https://twitter.com/dranagar/status/2176371392
gdsro;2009-06-15 10:30;0;0;"Ultima ora - Gripa porcina face prima victima in Europa- Virusul AH1N1 a facut prima victima în Europa. Un scotian... http://bit.ly/Gp5cz";;;;"2176308656";https://twitter.com/gdsro/status/2176308656
ionnoi;2009-06-15 09:57;0;0;"feeling fatige & like to catch a flu... but should not be the AH1N1 :-P";;;;"2176112389";https://twitter.com/ionnoi/status/2176112389
cadenaglobal;2009-06-15 09:46;0;0;"Ascienden a 44 los casos de gripe AH1N1 en el país | http://bit.ly/5Qj4P";;;;"2176049945";https://twitter.com/cadenaglobal/status/2176049945
perucom;2009-06-15 09:44;0;0;"La industria farmacéutica Novartis se niega a la gratuidad de las vacunas contra la gripe AH1N1 http://is.gd/12mU2";;;;"2176042403";https://twitter.com/perucom/status/2176042403
kyela;2009-06-15 09:40;0;0;"i think we now have the most positive cases of #ah1n1 .. Let's all be extra careful everyone!";;;#ah1n1;"2176016157";https://twitter.com/kyela/status/2176016157
davidgeneraoIII;2009-06-15 09:26;0;0;"ayus~ di natuloy ang pagpunta ko sa Mapua Makati dahil may case na dun ng AH1N1 :) http://plurk.com/p/111gjx";;;;"2175939261";https://twitter.com/davidgeneraoIII/status/2175939261
veneprensa;2009-06-15 09:05;0;0;"44 casos de gripe AH1N1 en Venezuela - http://tinyurl.com/n5te56";;;;"2175821103";https://twitter.com/veneprensa/status/2175821103
xazarcom_ru;2009-06-15 08:46;0;0;"Число заболевших гриппом AH1N1 в Румынии возросло до 16 http://ff.im/-3Zugx";;;;"2175709957";https://twitter.com/xazarcom_ru/status/2175709957
NinCabs;2009-06-15 08:26;0;0;"AH1N1 update: http://bit.ly/vzt2o";;;;"2175597893";https://twitter.com/NinCabs/status/2175597893
iAmAnneLevitt;2009-06-15 08:17;0;0;": 193 na ang cases ng AH1N1 ... tsktsk... http://plurk.com/p/110x7d";;;;"2175545600";https://twitter.com/iAmAnneLevitt/status/2175545600
shinkaide;2009-06-15 08:04;0;0;"Confirmed AH1N1 cases in Makati: 2 residents of the city, 3 students from Mapua-Makati. SRC: DZMM Teleradyo.";;;;"2175469183";https://twitter.com/shinkaide/status/2175469183
xazarcom_ru;2009-06-15 08:03;0;0;"Ученые: новый штамм гриппа AH1N1 оставался незамеченным несколько лет http://ff.im/-3Zq1p";;;;"2175464883";https://twitter.com/xazarcom_ru/status/2175464883
camslab;2009-06-15 07:59;0;0;"how badly do I want to stay at home? I had a dream that our office was infected with the AH1N1 virus. And I believed it was true...";;;;"2175435956";https://twitter.com/camslab/status/2175435956
kattalyzed;2009-06-15 07:45;0;0;"Isolated village first to have Ah1n1 community outbreak. Makes you wonder.";;;;"2175354527";https://twitter.com/kattalyzed/status/2175354527
dingdongmd;2009-06-15 07:20;0;0;"Listening to another AH1N1 lecture.";;;;"2175195962";https://twitter.com/dingdongmd/status/2175195962
heyitsalden;2009-06-15 07:02;0;0;"@johnnymalvar 2 mapua students, AH1N1 positive. :))";;@johnnymalvar;;"2175080320";https://twitter.com/heyitsalden/status/2175080320
etteyucky;2009-06-15 06:56;0;0;"back in ah1n1 zone again!";;;;"2175040360";https://twitter.com/etteyucky/status/2175040360
crayonmeal;2009-06-15 06:49;0;0;"Be careful @jeyowenji, there's an AH1N1 outbreak there";;@jeyowenji;;"2174993282";https://twitter.com/crayonmeal/status/2174993282
sarangani_chic;2009-06-15 06:46;0;0;"is in manila with paranoia seeing all these people walking wearing masks... Its an AH1N1 Fever here... (woot)... http://plurk.com/p/1108h3";;;;"2174979254";https://twitter.com/sarangani_chic/status/2174979254
lurdos;2009-06-15 06:32;0;0;"Y les hice saber a todos mis compañeros que era AH1N1 para que ellos presionaran mi salida, por su salud, pero ni así.";;;;"2174884462";https://twitter.com/lurdos/status/2174884462
lurdos;2009-06-15 06:32;0;0;"Tengo gripe e infección en la garganta, por mas que les dije en mi trabajo que era AH1N1 no me dejaron salir temprano de trabajar.";;;;"2174881029";https://twitter.com/lurdos/status/2174881029
FarrahRodriguez;2009-06-15 06:30;0;0;"Oh God AH1N1 palaaa and we're going to the airport! Do I need to wear some mask?! Lord I don't want that disease.";;;;"2174867871";https://twitter.com/FarrahRodriguez/status/2174867871
swinefluh1n1;2009-06-15 06:14;0;0;""As World Health Organization Raises Influenza AH1N1 Pandemic Alert ..." http://tinyurl.com/mx6ye7 #swineflu #H1N1";;;#swineflu #H1N1;"2174756594";https://twitter.com/swinefluh1n1/status/2174756594
xazar_com;2009-06-15 06:10;0;0;"AH1N1 virusu Çilidə fövqəladə vəziyyətin elan olunmasına gətirib çıxardı http://ff.im/-3ZfyF";;;;"2174722878";https://twitter.com/xazar_com/status/2174722878
elpaiscali;2009-06-15 06:08;0;0;"La gripe AH1N1 ya afecta a 42 personas en Colombia .: Dos nuevos casos se registraron en Barranquilla y Bucaram.. http://tinyurl.com/m7xnn7";;;;"2174712055";https://twitter.com/elpaiscali/status/2174712055
mondort1;2009-06-15 06:05;0;0;"Protect yourself from AH1N1 ! Prevention is way better than cure! Visit http://amegaglobalph.wordpress.com for information";;;;"2174690241";https://twitter.com/mondort1/status/2174690241
xazarcom_ru;2009-06-15 05:49;0;0;"Генсек АСЕАН призывает не паниковать из-за пандемии гриппа AH1N1 http://ff.im/-3ZaTB";;;;"2174564088";https://twitter.com/xazarcom_ru/status/2174564088
innovaclean;2009-06-15 05:37;0;0;"says AH1N1 virus? http://plurk.com/p/10zps0";;;;"2174469565";https://twitter.com/innovaclean/status/2174469565
jdfsystems;2009-06-15 05:26;0;0;"Señores ya hay vacuna para la famosa gri AH1N1 / http://eliax.com/index.php?/archives/6746-Vacuna-contra-virus-H1N1-en-produccion.-En-Ju ...";;;;"2174387221";https://twitter.com/jdfsystems/status/2174387221
Maracuchazo;2009-06-15 05:25;0;0;"Gracias a Dios ya temos vacuna contra la gripe AH1N1 , en julio cominza su distribucion...";;;;"2174376032";https://twitter.com/Maracuchazo/status/2174376032
iAmAnneLevitt;2009-06-15 05:06;0;0;": 147 total number of AH1N1 infected persons in the country.. http://plurk.com/p/10zi2x";;;;"2174211813";https://twitter.com/iAmAnneLevitt/status/2174211813
darkid;2009-06-15 05:01;0;0;"AH1N1 , A:género, H1: hemaglutinina, N1: neuraminidasas... por qué nunca se me ocurrió U_U";;;;"2174175204";https://twitter.com/darkid/status/2174175204
YennyG;2009-06-15 04:36;0;0;"My daughter's school is still closed due to AH1N1 . Putting a nice roast pork in the oven before churning out three proposals.";;;;"2173954695";https://twitter.com/YennyG/status/2173954695
Gripe_porcina;2009-06-15 04:34;0;0;"Confirman dos nuevos casos del virus AH1N1 - La Patria (Colombia): Confirman dos nuevos casos del virus AH1N1La .. http://tinyurl.com/ncx8sb";;;;"2173933782";https://twitter.com/Gripe_porcina/status/2173933782
PartidoPinolero;2009-06-15 04:07;0;0;"13 casos mas de Gripe AH1N1 en Nicaragua, elevando el total a 105";;;;"2173685513";https://twitter.com/PartidoPinolero/status/2173685513
jaceraval;2009-06-15 04:03;0;0;"went to RITM for Jobee's anti-rabies shots. kakatakot. aH1N1 !!! nagface-mask tuloy kami...";;;;"2173639180";https://twitter.com/jaceraval/status/2173639180
nessita;2009-06-15 03:59;0;0;"Primer fallecido por el virus AH1N1 en el Reino Unido :'( http://www.elmundo.es/elmundo/2009/06/14/internacional/1245011322.html";;;;"2173606346";https://twitter.com/nessita/status/2173606346
perucom;2009-06-15 03:40;0;0;"Suben a 94 los casos confirmados de gripe #AH1N1 en el Perú. http://bit.ly/vgpuD";;;#AH1N1;"2173411065";https://twitter.com/perucom/status/2173411065
pastto;2009-06-15 03:36;0;0;"AH1N1 en Discovery Channel, interesante";;;;"2173375573";https://twitter.com/pastto/status/2173375573
TheGeeZus;2009-06-15 03:11;0;0;"Seems my allergy wants to break a record of a straight 3 weeks attacks...Worry not is not AH1N1 since no fever and I am legitimate tired!";;;;"2173106047";https://twitter.com/TheGeeZus/status/2173106047
lerepu;2009-06-15 03:11;0;0;"AH1N1 : premiere contamination groupee http://bit.ly/2lpozF";;;;"2173104472";https://twitter.com/lerepu/status/2173104472
rafaelrojasc;2009-06-15 03:08;0;0;"Buen articulo sobre los primeros casos de AH1N1 en Anzoategui. Mas informacion y menos bolserias. http://bit.ly/o1Atv";;;;"2173069683";https://twitter.com/rafaelrojasc/status/2173069683
Gripe_porcina;2009-06-15 02:34;0;0;"Registran 510 casos de influenza AH1N1 y cero muertos - Notiver: Registran 510 casos de influenza AH1N1 y cero m.. http://tinyurl.com/nffnkz";;;;"2172631531";https://twitter.com/Gripe_porcina/status/2172631531
elcomercio;2009-06-15 02:18;0;1;"Llegan a 94 los casos de gripe AH1N1 en el Perú. http://tinyurl.com/nvoz3f";;;;"2172444532";https://twitter.com/elcomercio/status/2172444532
NotiSalud;2009-06-15 02:16;0;0;"Descubren científicos británicos que la cepa AH1N1 circuló por años en los cerdos. Lee más: www.notisalud.com.ve";;;;"2172414990";https://twitter.com/NotiSalud/status/2172414990
jossy19;2009-06-15 02:05;0;0;"Protejánse del AH1N1 ! Aprenda a usar el tapabocas: http://bit.ly/nufeh jajaja XD";;;;"2172278416";https://twitter.com/jossy19/status/2172278416
MLKtoSCL;2009-06-15 02:04;0;0;"DANGER: Alejandro Navarro en Tolerancia Cero y su hija tiene AH1N1";;;;"2172270422";https://twitter.com/MLKtoSCL/status/2172270422
warkoholic;2009-06-15 01:49;0;0;"esta será la semana de: mi horrendo regreso a clases, la encuesta CEP, el peak de la gripe AH1N1 y un frío que cala huesos. Muy bien! (Y)";;;;"2172089340";https://twitter.com/warkoholic/status/2172089340
HeyLeeey;2009-06-15 01:42;0;0;"AH1N1 Cases in the Philippines rises to 100+: http://bit.ly/BnXdo";;;;"2172019982";https://twitter.com/HeyLeeey/status/2172019982
Informe21;2009-06-15 01:36;0;0;"Chávez llamó a la prevención ante incremento de casos de gripe AH1N1 http://informe21.com/node/9604";;;;"2171954745";https://twitter.com/Informe21/status/2171954745
ATVenezuela;2009-06-15 01:12;0;0;"ATV- Venezuela contabiliza 44 casos de gripe AH1N1 http://tinyurl.com/kujqkv";;;;"2171694857";https://twitter.com/ATVenezuela/status/2171694857
Informe21;2009-06-15 01:10;0;0;"Ascienden a 44 los casos de gripe AH1N1 en el país http://informe21.com/node/9601";;;;"2171674123";https://twitter.com/Informe21/status/2171674123
NoticiasCaracol;2009-06-15 01:10;0;0;"Cuáles son los errores más frecuentes a la hora de prevenir el virus AH1N1 : Usar tapabocas, respiradores o jabon.. http://tinyurl.com/lanucz";;;;"2171673408";https://twitter.com/NoticiasCaracol/status/2171673408
Peru21pe;2009-06-15 01:10;0;0;"Dieron de alta al 85% de los infectados con la gripe AH1N1 en Perú. http://is.gd/123o0";;;;"2171669372";https://twitter.com/Peru21pe/status/2171669372
rvetrovec;2009-06-15 01:00;0;0;"AH1N1 en números: Contagio en el mundo 34.595. Contagios en Europa 2.269. Casos en México: 6.403. Casos en EE UU 17.855 (Cifras OMS)";;;;"2171557517";https://twitter.com/rvetrovec/status/2171557517
gschan;2009-06-15 00:50;0;0;"AH1N1 seems to be out in full effect now. Face masks are all out at the stores. Over-reacting? I'd say so.";;;;"2171450037";https://twitter.com/gschan/status/2171450037
Miecuadorqerido;2009-06-15 00:41;0;0;"Otro caso de AH1N1 en Quito: Redacci�n Sociedad El director del hospital Eugenio Espejo, Alex Camacho, acaba de .. http://tinyurl.com/nmexad";;;;"2171348252";https://twitter.com/Miecuadorqerido/status/2171348252
lalopezita;2009-06-15 00:34;0;0;"'Preocupa a la OMS virulencia del AH1N1 entre los jóvenes'....uchas y yo con gripa espero no estar virulienta";;;;"2171280683";https://twitter.com/lalopezita/status/2171280683
noquierouser;2009-06-15 00:31;0;0;"Una de las únicas formas aéreas de contagio de la AH1N1 es que te chupen un ojo.";;;;"2171251344";https://twitter.com/noquierouser/status/2171251344
Eyy_Dee;2009-06-15 00:16;0;0;"1st day of classes wahaha ingat sa ah1n1 este sya magingat sakin haha.. gud am!!";;;;"2171096224";https://twitter.com/Eyy_Dee/status/2171096224
nthalbornoz;2009-06-15 00:10;0;0;"ah1n1 ö";;;;"2171031527";https://twitter.com/nthalbornoz/status/2171031527
PanoramaDiario;2009-06-15 00:03;0;0;"Fallece en Escocia el primer europeo con gripe AH1N1 ; 140 en el mundo http://tinyurl.com/kkdw3q";;;;"2170956550";https://twitter.com/PanoramaDiario/status/2170956550