username;date;retweets;favorites;text;geo;mentions;hashtags;id;permalink
bachute96;2009-09-14 23:40;0;0;"Hey guys, I have a one-week holiday because of AH1N1 , I think I can tweet all dayy just like in the summer.";;;;"3991744480";https://twitter.com/bachute96/status/3991744480
tin_tuc;2009-09-14 23:29;0;0;"Sixth AH1N1 fatality reported in Vietnam.. http://twit.ac/YZUF";;;;"3991505927";https://twitter.com/tin_tuc/status/3991505927
Peru21pe;2009-09-14 22:54;0;0;"Nota sobre la situación actual de la gripe AH1N1 en el país. http://bit.ly/3W7IjH";;;;"3990800266";https://twitter.com/Peru21pe/status/3990800266
capibar;2009-09-14 22:21;0;1;"Tapabocas y Gripe AH1N1 http://urlcorta.es/bqg";;;;"3990150789";https://twitter.com/capibar/status/3990150789
telenoticias7;2009-09-14 22:21;0;0;"Vea la llegada de la antorcha a Cartago, pruebas de vacunas contra AH1N1 y especial sobre casa embrujada en Guanacaste: Telenoticias 7 p.m.";;;;"3990139765";https://twitter.com/telenoticias7/status/3990139765
Peru21pe;2009-09-14 21:43;0;0;"Doce personas han fallecido en la última semana en el Perú por la gripe AH1N1 .";;;;"3989384343";https://twitter.com/Peru21pe/status/3989384343
drbn175;2009-09-14 21:41;0;0;"La influenza AH1N1 terminara por convertirse en la influenza estacional, asi que sera mejor que empecemos a hacernos inmunes...";;;;"3989336284";https://twitter.com/drbn175/status/3989336284
CaracolRadio;2009-09-14 21:39;0;0;"[ Escuche ] Colombia espera valoración de la OPS para adquirir vacuna contra el virus AH1N1 http://bit.ly/2UlxDk";;;;"3989295568";https://twitter.com/CaracolRadio/status/3989295568
swinefluh1n1;2009-09-14 21:26;0;0;"" AH1N1 2009: gets to parts the other flu doesn't reach « ViroBlogy" http://tinyurl.com/or8gok #swineflu #H1N1";;;#swineflu #H1N1;"3989050361";https://twitter.com/swinefluh1n1/status/3989050361
Diario_Libre;2009-09-14 21:14;0;0;"Muertos por gripe AH1N1 ascienden a 17, según Salud Pública http://bit.ly/hbTNw";;;;"3988789262";https://twitter.com/Diario_Libre/status/3988789262
abloph;2009-09-14 21:06;0;0;"la vacuna ah1n1 que probarán está hecha de paté de ternera.";;;;"3988628617";https://twitter.com/abloph/status/3988628617
miguelml;2009-09-14 21:05;0;0;"Un virus recorre internet escondido en 1 e-mail sobre la gripe AH1N1 adjuntando 1 troyano http://tinyurl.com/mgnrbk";;;;"3988622256";https://twitter.com/miguelml/status/3988622256
AndreaObaid;2009-09-14 21:03;0;0;"Chile realizará ensayos clínicos con vacuna AH1N1 en niños y jóvenes http://tinyurl.com/ndge2j";;;;"3988581331";https://twitter.com/AndreaObaid/status/3988581331
alexval;2009-09-14 21:03;0;0;"Ni terremoto, ni granizo ni AH1N1 , el peor de Venezuela está en Miraflores!!!!! (via @MariaAleLopez )";;@MariaAleLopez;;"3988578760";https://twitter.com/alexval/status/3988578760
Vozpopuli;2009-09-14 20:52;0;0;"1.126 es la nueva cifra de contagios por AH1N1 http://7ax.de/sby";;;;"3988344053";https://twitter.com/Vozpopuli/status/3988344053
larepublica_pe;2009-09-14 20:51;0;0;"por confirmar: Presidente Regional habría contraído gripe AH1N1";;;;"3988329268";https://twitter.com/larepublica_pe/status/3988329268
Tecnomovida;2009-09-14 20:23;0;0;"Nuevo Post en Tecnomovida: Cuidado con lo que leas por email sobre el AH1N1 (http://cli.gs/HmTTD)";;;;"3987757750";https://twitter.com/Tecnomovida/status/3987757750
naandorodriguez;2009-09-14 19:28;0;0;"Dinho Ouro Preto contraiu o vírus AH1N1 /medodele";;;;"3986640781";https://twitter.com/naandorodriguez/status/3986640781
Gripe_porcina;2009-09-14 19:17;0;0;"Muere en Málaga una mujer de 33 años por gripe A, neumonía y obesidad (abc.es): AND-GRIPE AH1N1 Muere en Málaga .. http://bit.ly/cYHL9";;;;"3986436985";https://twitter.com/Gripe_porcina/status/3986436985
the_Mau;2009-09-14 19:16;0;0;"@GamaSoriano no wey, influenza AH1N1 o HLNL como diria tu tia elba";;@GamaSoriano;;"3986423900";https://twitter.com/the_Mau/status/3986423900
reginapoulain;2009-09-14 19:15;0;0;"AH1N1 , chito papá.";;;;"3986385683";https://twitter.com/reginapoulain/status/3986385683
freemediaven;2009-09-14 18:58;0;0;"#FreeMediaVe OMS informó que sólo 40 % de casos graves y muertes por AH1N1 corresponde a personas sanas http://url4.eu/R5qN";;;#FreeMediaVe;"3986066697";https://twitter.com/freemediaven/status/3986066697
Peru21pe;2009-09-14 18:26;0;0;"El 40% de las muertes por la gripe AH1N1 se dio en personas sanas. http://bit.ly/OzsgG";;;;"3985439539";https://twitter.com/Peru21pe/status/3985439539
dailynewsvn;2009-09-14 18:25;0;0;"3950 AH1N1 cases reported to date: Read and give us your comments http://url4.eu/R5Fj";;;;"3985428442";https://twitter.com/dailynewsvn/status/3985428442
mchowlee;2009-09-14 18:19;0;0;"RT @ElNacionalWeb Un virus recorre internet escondido en un e-mail sobre la gripe AH1N1 http://tinyurl.com/qnqzo2";;@ElNacionalWeb;;"3985318637";https://twitter.com/mchowlee/status/3985318637
venpublica;2009-09-14 18:07;0;0;"Confirman brote AH1N1 en Fuerte Tiuna: por MOD1 (Publicado Lun, 14 Sep 2009 13:24:43 GMT)Confirman brote AH1N1 e.. http://bit.ly/4nHvnR";;;;"3985087444";https://twitter.com/venpublica/status/3985087444
giveall;2009-09-14 18:03;0;0;"Une fille de ma classe à la grippe AH1N1 ...";;;;"3985012223";https://twitter.com/giveall/status/3985012223
Sky3RN;2009-09-14 17:59;0;0;"« Grippe AH1N1 : le médecin français Marc Girard dénonce les vaccins qui pourraient tuer jusqu’à 60.000 personnes en France » 1/2";;;;"3984941913";https://twitter.com/Sky3RN/status/3984941913
carlos1cd;2009-09-14 17:58;0;0;"@cristel_ad Adammomania... eso se mata con Baygon! o Tamiflu o es tan dañina con la Gripe AH1N1";;@cristel_ad;;"3984910383";https://twitter.com/carlos1cd/status/3984910383
CaracolRadio;2009-09-14 17:55;0;0;"Colombia espera valoración de la OPS para adquirir vacuna contra el virus AH1N1 http://bit.ly/gQYrF";;;;"3984858012";https://twitter.com/CaracolRadio/status/3984858012
NestorVenegas;2009-09-14 17:53;0;0;"Nueva variante del virus AH1N1 (ch4-v3z) ya es pandemia en ecuador, bolivia, nicaragua";;;;"3984819954";https://twitter.com/NestorVenegas/status/3984819954
NotiSalud;2009-09-14 17:46;0;0;"Inmunes al Tamiflu: Ya son 23 los casos de personas con AH1N1 que son resistentes a los efectos del antiviral Tamiflu www.notisalud.com.ve";;;;"3984681843";https://twitter.com/NotiSalud/status/3984681843
iLivingSoul;2009-09-14 17:45;0;0;"RT @Desperate_Moon : Me acaban de decir que en hospitales del DF cada vez hay más casos de influenza AH1N1 (Info directa de Dr) #influenza";;@Desperate_Moon;#influenza;"3984668102";https://twitter.com/iLivingSoul/status/3984668102
Desperate_Moon;2009-09-14 17:43;0;0;"Me acaban de decir que en los hospitales del DF cada vez hay más casos de influenza AH1N1 ¡Aguas gente! (Info directa de doctor) #influenza";;;#influenza;"3984636807";https://twitter.com/Desperate_Moon/status/3984636807
NotiSalud;2009-09-14 17:42;0;0;"Cero besos: MinSalud Francia recomienda evitar saludarse o despedirse con un beso para evitar el contagio de la AH1N1 www.notisalud.com.ve";;;;"3984618566";https://twitter.com/NotiSalud/status/3984618566
Neon;2009-09-14 17:41;0;0;"@zeitan es por la situacion en maturin con la AH1N1 http://myloc.me/DAFL";;@zeitan;;"3984597724";https://twitter.com/Neon/status/3984597724
NotiSalud;2009-09-14 17:40;0;0;"Vacuna carioca: En enero, Brasil producirá en escala industrial la vacuna contra la gripe AH1N1 www.notisalud.com.ve";;;;"3984563087";https://twitter.com/NotiSalud/status/3984563087
pedro_php;2009-09-14 17:25;0;0;"Recomendados por pediatra y escuela, precticamos uso de mascarilla con mi hija; evitemos de #AH1N1 #Honduras http://mypict.me/DA9P";;;#AH1N1 #Honduras;"3984289360";https://twitter.com/pedro_php/status/3984289360
MORENA_PC;2009-09-14 16:44;0;0;"Nadie ha Hablado sobre la gran Capacidad de Contagio de aH1N1 que tenemos TODOS al USAR Y MANEJAR DINERO";;;;"3983499861";https://twitter.com/MORENA_PC/status/3983499861
tin_tuc;2009-09-14 16:42;0;0;"Sixth AH1N1 fatality reported in Vietnam: Read and give us your comments http://bit.ly/zp50B";;;;"3983453322";https://twitter.com/tin_tuc/status/3983453322
tin_tuc;2009-09-14 16:42;0;0;"MoH urges professional care as AH1N1 cases climb: Read and give us your comments http://bit.ly/15zFpL";;;;"3983452630";https://twitter.com/tin_tuc/status/3983452630
eddie_e65;2009-09-14 16:35;0;0;"#nomaschavez Confirman brote de gripe AH1N1 en Fuerte Tiuna http://url4.eu/R3Cz";;;#nomaschavez;"3983329145";https://twitter.com/eddie_e65/status/3983329145
dailynewsvn;2009-09-14 16:28;0;0;"Health Ministry confirms five AH1N1 flu deaths: Read and give us your comments http://url4.eu/R34z";;;;"3983183524";https://twitter.com/dailynewsvn/status/3983183524
dailynewsvn;2009-09-14 16:28;0;0;"Record number of AH1N1 cases reported in a day: Read and give us your comments http://url4.eu/R34r";;;;"3983180208";https://twitter.com/dailynewsvn/status/3983180208
pemart;2009-09-14 16:24;0;0;"Arma biológica para cuando venga el imperio @codigovenezuela : AH1N1 en los cuarteles - http://bit.ly/1bn1NE";;@codigovenezuela;;"3983105006";https://twitter.com/pemart/status/3983105006
rsucre;2009-09-14 16:23;0;0;""Confirman brote de gripe AH1N1 en Fuerte Tiuna". Curioso, arrancan clases, y no se sugiere nada de prevenc. sólo la "III guerra mundial"..";;;;"3983084149";https://twitter.com/rsucre/status/3983084149
Esparzari;2009-09-14 16:19;0;0;"Brote de AH1N1 en Fuerte Tiuna, controlado: http://bit.ly/1aXI2o";;;;"3983013002";https://twitter.com/Esparzari/status/3983013002
CodigoVenezuela;2009-09-14 16:19;0;0;"AH1N1 en los cuarteles - http://bit.ly/1bn1NE";;;;"3983000390";https://twitter.com/CodigoVenezuela/status/3983000390
cubablogfeed;2009-09-14 16:14;0;0;"#cuba Confirman brote de gripe AH1N1 en Fuerte Tiuna: ND.- La viceministra de Salud, Indira Corao, con.. http://bit.ly/qZNYa cuba";;;#cuba;"3982909288";https://twitter.com/cubablogfeed/status/3982909288
abuepape;2009-09-14 16:05;0;0;"RT @noticiasvenezue : Confirman brote d gripe AH1N1 en FTTiuna:ND.- La vicem Salud, IndiraCorao, confirmó un brote d.. http://bit.ly/2fSS7X";;@noticiasvenezue;;"3982738044";https://twitter.com/abuepape/status/3982738044
SSpencer_12;2009-09-14 15:58;0;0;"AH1N1 it's back! i won't go to the school until thursday";;;;"3982587792";https://twitter.com/SSpencer_12/status/3982587792
Titi_Haiek;2009-09-14 15:55;0;0;"RT @ElNacionalWeb : Un virus recorre internet escondido en un e-mail sobre la gripe AH1N1 http://tinyurl.com/qnqzo2 @irenhw";;@ElNacionalWeb @irenhw;;"3982531970";https://twitter.com/Titi_Haiek/status/3982531970
RubenBolivar;2009-09-14 15:48;0;0;"En el hospital me repiten exámenes a ver como evoluciona mi gripe #ah1n1";;;#ah1n1;"3982400452";https://twitter.com/RubenBolivar/status/3982400452
roko;2009-09-14 15:39;0;0;"MAÑANA TAMBIÉN VA A HABER FILTRO SANITARIO por aca depsues de los 9 casos confirmados de AH1N1";;;;"3982219637";https://twitter.com/roko/status/3982219637
ClaudiaShelley;2009-09-14 15:32;0;0;"RT @Jorgesoldevila : Dice Secretario de Salud que la vacuna contra el AH1N1 que fabrica China... No es pirata. ...... jajajajjajajajaj";;@Jorgesoldevila;;"3982093790";https://twitter.com/ClaudiaShelley/status/3982093790
acianela;2009-09-14 15:30;0;0;"Gripe AH1N1 : Según OMS hay más muertes y afectados entre adultos aparentemente sanos http://bit.ly/2l7mt";;;;"3982061696";https://twitter.com/acianela/status/3982061696
anthoromero;2009-09-14 15:28;0;0;"Mosca con eso! RT @ElNacionalWeb : Un virus recorre internet escondido en un e-mail sobre la gripe AH1N1 http://tinyurl.com/qnqzo2";;@ElNacionalWeb;;"3982020964";https://twitter.com/anthoromero/status/3982020964
docmiguel;2009-09-14 15:28;0;0;"RT @Darkdarky : Se esconde EPIDEMIA q existe.. RT @Jogreg : Caso AH1N1 hay + casos y no lo sabemos o nuestro virus es el + mortal d todos";;@Darkdarky @Jogreg;;"3982013882";https://twitter.com/docmiguel/status/3982013882
ysrraelcamero;2009-09-14 15:27;0;0;"RT @Jogreg : Interesante: única manera d q la mortalidad por AH1N1 en Vzuela cuadre cn el rsto del mundo, es q haya subregistro de casos";;@Jogreg;;"3981991049";https://twitter.com/ysrraelcamero/status/3981991049
dailynewsvn;2009-09-14 15:14;0;0;"MoH urges professional care as AH1N1 cases climb: Read and give us your comments http://url4.eu/R1s0";;;;"3981750998";https://twitter.com/dailynewsvn/status/3981750998
dailynewsvn;2009-09-14 15:14;0;0;"Sixth AH1N1 fatality reported in Vietnam: Read and give us your comments http://url4.eu/R1rp";;;;"3981746128";https://twitter.com/dailynewsvn/status/3981746128
syrellblaquera;2009-09-14 15:08;0;0;"OMG!! Confirm! There's an AH1N1 in are school!, Waaaaa!!!!!!!!";;;;"3981644497";https://twitter.com/syrellblaquera/status/3981644497
testnotizie;2009-09-14 15:08;0;0;"[notizia] Influenza AH1N1 , campagna di vaccinazione in ultima definizione http://bit.ly/kFIOV";;;;"3981640833";https://twitter.com/testnotizie/status/3981640833
RadioHispana;2009-09-14 15:04;0;0;"Rebrote de influenza AH1N1 en Baja California: se han registrado cuatro casos más en escuelas públicas y 39 personas sospechosas.";;;;"3981555045";https://twitter.com/RadioHispana/status/3981555045
rpinop;2009-09-14 15:03;0;0;"Probaran vacuna AH1N1 en 180 niños desde 6meses de edad...me pregunto: para ellos y sus descencientes la vacuna, en el futuro, sera gratis??";;;;"3981536555";https://twitter.com/rpinop/status/3981536555
olivierl;2009-09-14 14:47;0;0;"Grippe Porcine AH1N1 - Opération Pandémie: http://bit.ly/IkgaP /all/uploads-all/0/UpA448TpOO4";;;;"3981233765";https://twitter.com/olivierl/status/3981233765
osiocabrices;2009-09-14 14:44;0;0;"RT @Ytzelperez : RT @ElNacionalWeb : automedicación obstaculiza diagnóstico de AH1N1 http://tinyurl.com/lck7yq";;@Ytzelperez @ElNacionalWeb;;"3981191271";https://twitter.com/osiocabrices/status/3981191271
jgrincon;2009-09-14 14:43;0;0;"La situación de la gripe AH1N1 promete complicarse, OJO PELAO!!";;;;"3981177361";https://twitter.com/jgrincon/status/3981177361
VTVNoticias;2009-09-14 14:36;0;0;"Ciencia/Salud: Brasil producirá vacunas contra la AH1N1 a partir de enero http://url4.eu/R1G8";;;;"3981050679";https://twitter.com/VTVNoticias/status/3981050679
Rafa_la_Mancha;2009-09-14 14:31;0;0;"Buen día, fin de semana resfriado y hoy Lunes todavía ando un poquito mocosón, pero listo pa echarle ganas en la chamba, ojala no sea ah1n1";;;;"3980958953";https://twitter.com/Rafa_la_Mancha/status/3980958953
LaAldea_Global;2009-09-14 14:31;0;0;"MPuebla.com: SEP niega ocultar información de casos de Influenza AH1N1 http://digg.com/u1CUeB";;;;"3980947261";https://twitter.com/LaAldea_Global/status/3980947261
CanalRTU;2009-09-14 14:29;0;0;"El 40 por ciento de los casos graves y las muertes causadas por la gripe AH1N1 corresponde a personas sanas, entre 25 y 49 años, según OMS.";;;;"3980909687";https://twitter.com/CanalRTU/status/3980909687
Notinfoweb;2009-09-14 14:26;0;0;"Viceministra de Salud confirma brote de AH1N1 en el Fuerte Tiuna";;;;"3980869183";https://twitter.com/Notinfoweb/status/3980869183
AnaOtero;2009-09-14 14:20;0;0;"Los casos de AH1N1 siguen aumentando en Venezuela, el gobierno miente con el nùmero oficial y se estàn tomando pocas medidas!!!";;;;"3980762090";https://twitter.com/AnaOtero/status/3980762090
perucom;2009-09-14 14:01;0;0;"OMS: el 40 por ciento de las muertes por la nueva gripe #AH1N1 son personas sanas. http://bit.ly/1293j8";;;#AH1N1;"3980427009";https://twitter.com/perucom/status/3980427009
iLukianox;2009-09-14 13:41;0;0;"El 40% de las muertes por gripe AH1N1 corresponde a personas sanas: Sin-Lun Tam, experto de la Organización Mund.. http://bit.ly/2RrP25";;;;"3980095290";https://twitter.com/iLukianox/status/3980095290
jeanfreddy;2009-09-14 13:41;0;0;"Radonski reacciona ante #LOE : becas, bultos con útiles, instructivos AH1N1 y proveedurias escolares. Competencia que ganan los chamos";;;#LOE;"3980092211";https://twitter.com/jeanfreddy/status/3980092211
lamejorayuda;2009-09-14 13:32;0;0;"RT @elcomerciocom Vacuna anti- AH1N1 es eficaz desde primera dosis: GlaxoSmithKline http://bit.ly/uCOwt";;@elcomerciocom;;"3979949551";https://twitter.com/lamejorayuda/status/3979949551
roko;2009-09-14 13:31;0;0;"ne mi institucion hay o hubo 9 casos confirmados de AH1N1";;;;"3979931511";https://twitter.com/roko/status/3979931511
SandritaGG;2009-09-14 13:29;0;0;"RT @docmiguel : RT @ElNacionalWeb : Un virus recorre internet escondido en un e-mail sobre la gripe AH1N1 http://tinyurl.com/qnqzo2";;@docmiguel @ElNacionalWeb;;"3979899825";https://twitter.com/SandritaGG/status/3979899825
carlosmocinos;2009-09-14 13:26;0;0;"En casa al fin, de post guardia con 2 posibles pacientes pediátricos sospechosos de portar la gripe AH1N1 ...";;;;"3979849525";https://twitter.com/carlosmocinos/status/3979849525
noticiasperu;2009-09-14 13:23;0;0;"[RPP] El 40% de las muertes por gripe AH1N1 corresponde a personas sanas: Sin-Lun Tam, experto de la Organi.. http://bit.ly/2RrP25";;;;"3979790974";https://twitter.com/noticiasperu/status/3979790974
ElNacionalWeb;2009-09-14 13:20;0;0;"Un virus recorre internet escondido en un e-mail sobre la gripe AH1N1 http://tinyurl.com/qnqzo2";;;;"3979743529";https://twitter.com/ElNacionalWeb/status/3979743529
informados;2009-09-14 13:16;0;0;"Noticias de último minuto, Vacunación contra la gripe AH1N1 en Estados Unidos empezaría en octubre - http://tinyurl.com/ovchel";;;;"3979693584";https://twitter.com/informados/status/3979693584
elcomerciocom;2009-09-14 13:14;0;0;"Vacuna anti- AH1N1 es eficaz desde primera dosis: GlaxoSmithKline http://bit.ly/uCOwt";;;;"3979654252";https://twitter.com/elcomerciocom/status/3979654252
WendyRH08;2009-09-14 13:03;0;0;"Chavez es pavoso:llueve a morir,graniza,tiembla, se desvordan quebradas y rios,explota un edificio,el dengue muta y se incrementa la AH1N1";;;;"3979487021";https://twitter.com/WendyRH08/status/3979487021
freemediaven;2009-09-14 12:57;0;0;"#FreeMediaVe Brasil producirá vacunas contra la AH1N1 a partir de enero http://url4.eu/QzYc";;;#FreeMediaVe;"3979401283";https://twitter.com/freemediaven/status/3979401283
RadarPolitico;2009-09-14 12:41;0;0;"Nueva nota: CONVOCA NAM A CIUDADANÍA A FORTALECER MEDIDAS PREVENTIVAS CONTRA LA INFLUENZA AH1N1 http://cli.gs/9NM56";;;;"3979158160";https://twitter.com/RadarPolitico/status/3979158160
ciberdix;2009-09-14 12:36;0;0;"Desde Ciberdix.net: Lo que hay Detrás de la Gripe AH1N1 http://tinyurl.com/p62vg7";;;;"3979098990";https://twitter.com/ciberdix/status/3979098990
docmiguel;2009-09-14 12:31;0;0;"De pana no pienso ír a la feria por 2 razones 1. Me molestan las multitudes 2. AH1N1 is un the air!";;;;"3979028325";https://twitter.com/docmiguel/status/3979028325
docmiguel;2009-09-14 12:25;0;0;"El porcentaje de muertes x AH1N1 en Venezuela es del 5% una de las. Más altas de mundo! En farmatodo venderán Tamiflu?";;;;"3978953699";https://twitter.com/docmiguel/status/3978953699
fforzano;2009-09-14 12:01;0;0;"Stavo considerando quanto sono simili gli allarmismi legali a AH1N1 e alla GWOT: servono solo a far fare affari sulle paure della gente";;;;"3978634631";https://twitter.com/fforzano/status/3978634631
marconunez;2009-09-14 11:52;0;0;"Vacuna contra la gripe AH1N1 sera probada en 180 niñy jóes chilenos http://viigo.im/0Sxa";;;;"3978524508";https://twitter.com/marconunez/status/3978524508
RubenBolivar;2009-09-14 11:47;0;0;"buenos dias twitters en mi segundo dia con la gripe ·#ah1n1 y con mas tiempo para tuitear y leer tuits";;;#ah1n1;"3978464598";https://twitter.com/RubenBolivar/status/3978464598
daproli;2009-09-14 11:42;0;0;"Now, In The Way, Driving, Listening to Radio News, Take Forecasts with Influenza AH1N1 , use cover your mouth...";;;;"3978408573";https://twitter.com/daproli/status/3978408573
Reporte360;2009-09-14 11:34;0;0;"40% de muertes por gripe AH1N1 son personas sanas según la OMS http://bit.ly/oigDM";;;;"3978308279";https://twitter.com/Reporte360/status/3978308279
latercera;2009-09-14 11:27;0;0;"Vacuna contra la gripe AH1N1 será probada en 180 niños y jóvenes: Chile es hasta ahora el único país en Latinoam.. http://twurl.nl/opckuq";;;;"3978231434";https://twitter.com/latercera/status/3978231434
laverdadweb;2009-09-14 10:42;0;0;"Desde el jueves está en Cuidados Intensivos joven con gripe AH1N1 http://bit.ly/K4k6Z";;;;"3977761692";https://twitter.com/laverdadweb/status/3977761692
fortuneacademie;2009-09-14 09:57;0;0;"Au fait j'ai oublié de prendre mon petit déjeuner! la grippe AH1N1";;;;"3977322836";https://twitter.com/fortuneacademie/status/3977322836
Josevilla_of;2009-09-14 08:18;0;0;"No puedo dormir tengo sintomas de AH1N1 al amanecer saldre ala clinica zulia a hacerme la prueba";;;;"3976415854";https://twitter.com/Josevilla_of/status/3976415854
freemediaven;2009-09-14 07:59;0;0;"Brasil producirá vacunas contra gripe AH1N1 a partir de enero de 2010: Según los estudios hechos ha.. http://bit.ly/5Ih8e #FreeMediaVe";;;#FreeMediaVe;"3976237885";https://twitter.com/freemediaven/status/3976237885
tshiunghan;2009-09-14 07:54;0;0;"I wish the WHO would just come out and say that masks are ineffective in preventing AH1N1 infection";;;;"3976194449";https://twitter.com/tshiunghan/status/3976194449
lajmeshqip;2009-09-14 07:09;0;0;"Shqipëria merr masa për evidentimin e rasteve të gripit AH1N1 http://bit.ly/mKVnc";;;;"3975758721";https://twitter.com/lajmeshqip/status/3975758721
tuxsoul;2009-09-14 05:45;0;0;"RT @verucacorleone : Un video muy interesante sobre la Influenza #AH1N1 (en Español) - http://bit.ly/Z95LW ...";;@verucacorleone;#AH1N1;"3974753959";https://twitter.com/tuxsoul/status/3974753959
swinefluh1n1;2009-09-14 05:25;0;0;""Pat for State on handling AH1N1 | State handling H1N1 hospital ..." http://tinyurl.com/qdyj2q #swineflu #H1N1";;;#swineflu #H1N1;"3974468489";https://twitter.com/swinefluh1n1/status/3974468489
swinefluh1n1;2009-09-14 04:26;0;0;""QIAGEN Releases New Pandemic Influenza AH1N1 Detection Kit" http://tinyurl.com/r3atlt #swineflu #H1N1";;;#swineflu #H1N1;"3973433105";https://twitter.com/swinefluh1n1/status/3973433105
tinitalo;2009-09-14 04:04;0;0;"Se protege de la Gripe AH1N1 RT @spartamg : Porque se momifico esa loca ???? Jajajajaja se paso lady Gaga";;@spartamg;;"3973000127";https://twitter.com/tinitalo/status/3973000127
afroecuadorian;2009-09-14 04:01;0;0;"Como si la gripe AH1N1 no fuese suficiente ahora hallan nueva forma de malaria mortal en humanos: http://bit.ly/3YvG8e";;;;"3972926664";https://twitter.com/afroecuadorian/status/3972926664
nanypadra;2009-09-14 03:54;0;0;"I'm still waiting too read something in spanish.. here in venezuela we're well... A ilttle scared with ah1n1 flu but as well as we can..";;;;"3972758117";https://twitter.com/nanypadra/status/3972758117
chckz;2009-09-14 03:53;0;0;"Eminem cayó en drogas y le pegaron a AH1N1 .";;;;"3972756277";https://twitter.com/chckz/status/3972756277
nanypadra;2009-09-14 03:50;0;0;"aun sigo esperando leer algo en español.. por aqui en venezuela bien, asustados con el ah1n1 pero bien..";;;;"3972680002";https://twitter.com/nanypadra/status/3972680002
pupucito_;2009-09-14 03:23;0;0;"RT @JoseSottile : @Globovision Según el Dr. que está entrevistando Nitu al que se contagie de AH1N1 RECE!!... http://bit.ly/1kYHJ";;@JoseSottile @Globovision;;"3971823038";https://twitter.com/pupucito_/status/3971823038
danjav32;2009-09-14 03:22;0;0;"RT @JoseSottile : @Globovision Según el Dr. que está entrevistando Nitu al que se contagie de AH1N1 RECE!!! RECE!!! #freemediave";;@JoseSottile @Globovision;#freemediave;"3971786899";https://twitter.com/danjav32/status/3971786899
al3xss;2009-09-14 02:53;0;0;"algunos estornudos , espero no estar influenciado por la influencia AHLNL de elba esther y tampoco tener influenza AH1N1 ...";;;;"3970694581";https://twitter.com/al3xss/status/3970694581
Orly50;2009-09-14 02:32;0;0;"Looking For Health Tips for your Kids? Worried about AH1N1 Virus? http://healthytips4us.com/SwineFluVirus.html Get health protection here.";;;;"3969976453";https://twitter.com/Orly50/status/3969976453
veruzkperox;2009-09-14 02:23;0;0;"Alerta roja en Maturin por la propagación de gripe Ah1n1 , centros comerciales, hospitales y clínicas los principales focos de contaminación";;;;"3969611228";https://twitter.com/veruzkperox/status/3969611228
edgar4x4;2009-09-14 02:16;0;0;"RT @EdieQ : Le están haciendo propaganda al AH1N1 ?// aqui en Maturin se vende sola, no necesita publicidad, esta por todos lados!!";;@EdieQ;;"3969374465";https://twitter.com/edgar4x4/status/3969374465
EdieQ;2009-09-14 02:12;0;0;"Le están haciendo propaganda al AH1N1 ?";;;;"3969250041";https://twitter.com/EdieQ/status/3969250041
NocheDelGOL;2009-09-14 02:07;0;0;"@mmturmero gracias, un abrazo para ti y mosca con la AH1N1 ... en Maturín anda desatada como prosti en construcción! jajaja";;@mmturmero;;"3969051303";https://twitter.com/NocheDelGOL/status/3969051303
Ciencia1com;2009-09-14 01:55;0;0;"Como si la gripe AH1N1 no fuese suficiente ahora hallan nueva forma de malaria mortal en humanos: http://bit.ly/3YvG8e";;;;"3968603619";https://twitter.com/Ciencia1com/status/3968603619
mimartin;2009-09-14 01:40;0;0;"Trato de ver el programa especial " AH1N1 : Mexico Reacciona" en Discovery Channel y NO PUEDO!!! Se va la señal de SKY!!! FUCK!!!";;;;"3968017336";https://twitter.com/mimartin/status/3968017336
mayala38;2009-09-14 01:37;0;0;"Por qué el Presidente en vez de comprar tanquesitos en Rusia, no compra el medicamento para combatir la gripe AH1N1 ???";;;;"3967908059";https://twitter.com/mayala38/status/3967908059
villaquijano;2009-09-14 01:31;0;0;"4 días con fiebre, con tanta ah1n1 , ya me da es miedo...";;;;"3967672788";https://twitter.com/villaquijano/status/3967672788
al3xss;2009-09-14 01:14;0;0;"viendo " AH1N1 mexico reacciona" en discovery channel";;;;"3966982377";https://twitter.com/al3xss/status/3966982377
RubenBolivar;2009-09-14 01:04;0;0;"a mis amigos tuiteros les informo que me diagnosticaron AH1N1 ; y no se preocupen que por twitter no se pega";;;;"3966704131";https://twitter.com/RubenBolivar/status/3966704131
