username;date;retweets;favorites;text;geo;mentions;hashtags;id;permalink
Arbolina;2009-06-15 23:50;0;0;"A kiss in the rain = getting wet and getting AH1N1 jeje";;;;"2185068040";https://twitter.com/Arbolina/status/2185068040
venefeeds;2009-06-15 23:46;0;0;"[Cadena Global] Aumentan a 45 los casos de AH1N1 en en país http://tinyurl.com/lcr6b5";;;;"2185032131";https://twitter.com/venefeeds/status/2185032131
desinformado;2009-06-15 23:45;0;0;"Autoridades de Falcón controlan ingreso de buques provenientes de países afectados con virus AH1N1 http://ff.im/-41gPA";;;;"2185019629";https://twitter.com/desinformado/status/2185019629
desinformado;2009-06-15 23:45;0;0;"Aumentan a 45 los infectados por gripe AH1N1 en el país http://ff.im/-41gPv";;;;"2185019615";https://twitter.com/desinformado/status/2185019615
carlzac;2009-06-15 23:43;0;0;"Listening to professor about ah1n1 .. Soap, water, mask blah blah";;;;"2184994542";https://twitter.com/carlzac/status/2184994542
Gripe_porcina;2009-06-15 23:32;0;0;"Novartis no regalará vacunas para AH1N1 - El Economista.com.mx: Novartis no regalará vacunas para AH1N1El Econom.. http://tinyurl.com/l794pg";;;;"2184865272";https://twitter.com/Gripe_porcina/status/2184865272
eleconomista;2009-06-15 23:31;0;0;"Novartis no regalará vacunas para AH1N1 : LONDRES. Novartis se niega a distribuir vacunas gratuitamente entre las.. http://tinyurl.com/nqnd6n";;;;"2184855576";https://twitter.com/eleconomista/status/2184855576
RPPNoticias;2009-06-15 23:25;0;1;"A 113 se incrementó los casos confirmados de Nueva Influenza AH1N1 en el país http://tinyurl.com/mb3vvg";;;;"2184794735";https://twitter.com/RPPNoticias/status/2184794735
perucom;2009-06-15 23:20;0;0;"Ministerio de Salud confirma 113 casos de la gripe #AH1N1 en el Perú. http://bit.ly/2in8ED #fb";;;#AH1N1 #fb;"2184730991";https://twitter.com/perucom/status/2184730991
jahz_joash;2009-06-15 23:08;0;0;"Whoa! I was nervous awhild ago because of the AH1N1 prevention! Good thing! :-D";;;;"2184594874";https://twitter.com/jahz_joash/status/2184594874
whatisfail;2009-06-15 23:06;0;0;"AH1N1 yata 'to eeh! ahu. atchu! grrr.";;;;"2184576376";https://twitter.com/whatisfail/status/2184576376
veneprensa;2009-06-15 22:51;0;0;"AH1N1 en el país aumentó a 45 casos - http://tinyurl.com/njrhee";;;;"2184403048";https://twitter.com/veneprensa/status/2184403048
fabiolamorales;2009-06-15 22:47;0;0;"La población no previene la gripe AH1N1 http://bit.ly/YXA0b No hay que descuidarse http://bit.ly/pZlGm";;;;"2184358821";https://twitter.com/fabiolamorales/status/2184358821
fabiolamorales;2009-06-15 22:44;0;0;"RT @Peru21pe "Confirmados 19 nuevos casos más de gripe #AH1N1 . Se elevan a 113 los casos en Perú" http://bit.ly/110USA";;@Peru21pe;#AH1N1;"2184326106";https://twitter.com/fabiolamorales/status/2184326106
Isaamoreno;2009-06-15 22:44;0;0;"sickk :(:( btww. nott iss AH1N1 xDD";;;;"2184317199";https://twitter.com/Isaamoreno/status/2184317199
elcomercio;2009-06-15 22:43;0;0;"La gripe AH1N1 llegó al fútbol chileno: Rodrigo Millar fue diagnosticado con el mal (http://is.gd/12PGl)";;;;"2184316659";https://twitter.com/elcomercio/status/2184316659
Dx;2009-06-15 22:41;0;0;"Novartis ya hizo la primera vacuna contra el AH1N1 ... qué bueno! Antes de que llegue a cifras estratosféricas! :P";;;;"2184284778";https://twitter.com/Dx/status/2184284778
lavendano;2009-06-15 22:39;0;0;"¿Hasta cuando seguirán contando los contagiados (muchos ya curados imagino) de la gripe #AH1N1 ?";;;#AH1N1;"2184264948";https://twitter.com/lavendano/status/2184264948
numerozero;2009-06-15 22:37;0;0;"113 casos de gripe #AH1N1 http://bit.ly/16noxX";;;#AH1N1;"2184240410";https://twitter.com/numerozero/status/2184240410
veneprensa;2009-06-15 22:37;0;0;"AH1N1 en el país aumentó a 45 casos - http://tinyurl.com/njrhee";;;;"2184239802";https://twitter.com/veneprensa/status/2184239802
Peru21pe;2009-06-15 22:36;0;0;"Confirmados 19 nuevos casos más de gripe #AH1N1 . Se elevan a 113 los casos en Perú. (Fuente: Minsa)";;;#AH1N1;"2184234262";https://twitter.com/Peru21pe/status/2184234262
Catitax;2009-06-15 22:35;0;0;"Ya son 113 los peruanos con gripe AH1N1";;;;"2184217090";https://twitter.com/Catitax/status/2184217090
jcescares;2009-06-15 22:09;0;0;"que bueno que llovió el fin de semana, sino el smog y la AH1N1 nos habrían comido vivos.";;;;"2183916970";https://twitter.com/jcescares/status/2183916970
TelevisaIntl;2009-06-15 22:07;0;0;"Calderón: México buscará obtener vacuna contra AH1N1 : Al inaugurar la Segunda Semana Nacional de Vacunación, el .. http://bit.ly/Wr2pv";;;;"2183884088";https://twitter.com/TelevisaIntl/status/2183884088
1PhilippineNews;2009-06-15 22:05;0;1;"Free alcohol in La Salle vs aH1N1";;;;"2183869013";https://twitter.com/1PhilippineNews/status/2183869013
AndrEduardo;2009-06-15 22:03;0;0;"RT @ElNacionalWeb : Otro caso de gripe AH1N1 que eleva la cifra a 45 contagiados. / Agarren palco!";;@ElNacionalWeb;;"2183845345";https://twitter.com/AndrEduardo/status/2183845345
superdharma;2009-06-15 21:58;0;0;"@ElNacionalWeb la noticia sobre el caso de AH1N1 está incompleta al final del tercer párrafo";;@ElNacionalWeb;;"2183781880";https://twitter.com/superdharma/status/2183781880
willicab;2009-06-15 21:58;0;0;"@xinita jajaja esa cola en el consulado va a estar mas larga que la del hospital para despistaje de ah1n1 XD";;@xinita;;"2183780315";https://twitter.com/willicab/status/2183780315
eft0;2009-06-15 21:54;0;0;"Lo malo de tener a mi hermano con AH1N1 , la casa PASADA a Lysoform, jalando en mala esa cosa.";;;;"2183730484";https://twitter.com/eft0/status/2183730484
cadenaglobal;2009-06-15 21:52;0;0;"Aumentan a 45 los casos de AH1N1 en en país | http://bit.ly/ZaTfy";;;;"2183705237";https://twitter.com/cadenaglobal/status/2183705237
danielahidalgom;2009-06-15 21:48;0;0;"Influenza AH1N1 http://porlademocraciaparticipativa.blogspot.com/";;;;"2183656692";https://twitter.com/danielahidalgom/status/2183656692
PODERmagazines;2009-06-15 21:44;0;0;"COLOMBIA> El Ministerio de la Protección Social confirmó que ya son 45 los casos de gripa AH1N1 en el país. - http://bit.ly/45I0C";;;;"2183606200";https://twitter.com/PODERmagazines/status/2183606200
Gripe_porcina;2009-06-15 21:32;0;0;"Se mantiene estadística por casos de influenza AH1N1 - La Noticia a secas: Se mantiene estadística por casos de .. http://tinyurl.com/lmvgrt";;;;"2183465967";https://twitter.com/Gripe_porcina/status/2183465967
chileteinforma;2009-06-15 21:23;0;0;"Emol: Girardi es dado de alta tras sufrir complicaciones bronquiales por influenza AH1N1 http://tinyurl.com/l7hg3z";;;;"2183352415";https://twitter.com/chileteinforma/status/2183352415
chandycontenta;2009-06-15 21:21;0;0;"Licencia médica a contactos de enfermos con AH1N1 está asegurada (mañana en el diario oficial) Osea quien va a quedar trabajando?";;;;"2183324653";https://twitter.com/chandycontenta/status/2183324653
AndreaObaid;2009-06-15 21:03;0;0;"Infectóloga: En seis a ocho semanas el virus AH1N1 irá decayendo http://tinyurl.com/kruja8";;;;"2183107987";https://twitter.com/AndreaObaid/status/2183107987
RyBr;2009-06-15 21:01;0;0;"Hasta mi papa esta traumado con la aburrida AH1N1";;;;"2183080109";https://twitter.com/RyBr/status/2183080109
mercedro;2009-06-15 20:51;0;0;"First swine flu death in NJ. RTnewsunivision: Primera muerte por gripe AH1N1 en New Jersey http://bit.ly/yySEc";;;;"2182960045";https://twitter.com/mercedro/status/2182960045
ErWinWin;2009-06-15 20:33;0;0;"gripe hecha en laboratorio: RT: @zajnostiko : Novartis no donará vacuna contra el AH1N1 a los países pobres. http://tinyurl.com/m7xn3r";;@zajnostiko;;"2182732948";https://twitter.com/ErWinWin/status/2182732948
leugimfigueroa;2009-06-15 20:33;0;0;"Licencia médica a contactos de enfermos con gripe AH1N1 estará asegurada: http://tr.im/oAfP";;;;"2182724304";https://twitter.com/leugimfigueroa/status/2182724304
laonews;2009-06-15 20:32;0;0;"ໂຣຄໄຂ້ຫວັດໃຫຍ່ ສາຍພັນໃໝ່ ຊນິດ AH1N1 : ໂຣຄໄຂ້ຫວັດໃຫຍ່ ສາຍພັນໃໝ່ 2009 ຊນິດ AH1N1 ທີ່ຖືກພົບເຫັນ ແພ່ຣະບາຕ ຢູ່ປະເທສ Me.. http://twurl.nl/50cdb0";;;;"2182720509";https://twitter.com/laonews/status/2182720509
Gripe_porcina;2009-06-15 20:31;0;0;"Calderón ordena apresurar vacuna contra influenza AH1N1 - Rotativo de Querétaro: Calderón ordena apresurar vacun.. http://tinyurl.com/lkfjep";;;;"2182708927";https://twitter.com/Gripe_porcina/status/2182708927
ah1n1;2009-06-15 20:20;0;0;"Canada's Inuit hit hard by H1N1 swine flu http://twurl.nl/lb4tyf #H1N1";;;#H1N1;"2182565241";https://twitter.com/ah1n1/status/2182565241
ah1n1;2009-06-15 20:12;0;0;"BBC NEWS | Scotland | Double loss for swine flu family http://twurl.nl/ty2f02 #H1N1";;;#H1N1;"2182471661";https://twitter.com/ah1n1/status/2182471661
infozeus;2009-06-15 20:09;0;0;"@Monsex hasta el momento contigo son como 5 los tuiteros que conozco que tienen o tuvieron AH1N1 ...";;@Monsex;;"2182427245";https://twitter.com/infozeus/status/2182427245
danielahidalgom;2009-06-15 20:02;0;0;"Los casos de Influenza AH1N1 aumentan en el pais, en la Provincia de Cañar se registra el primero";;;;"2182343453";https://twitter.com/danielahidalgom/status/2182343453
dalealbo;2009-06-15 19:53;0;0;"Millar en reposo absoluto por posible contagio con el virus AH1N1 http://tinyurl.com/nb4xyb";;;;"2182226470";https://twitter.com/dalealbo/status/2182226470
AbdullahMosaad;2009-06-15 19:43;0;0;"اكتشاف حالة إصابة جديدة بفيروس الوباء العالمى AH1N1 المعروف بأنفلونزا الخنازير، لترتفع حالات الإصابة فى مصر إلى 20 حالة";;;;"2182105480";https://twitter.com/AbdullahMosaad/status/2182105480
ontobelli;2009-06-15 19:42;0;0;"RT @el_economista FCH apura desarrollo de vacuna contra el AH1N1 http://tinyurl.com/nrmfbg | pues no que habías salvado al mundo? XD";;@el_economista;;"2182087600";https://twitter.com/ontobelli/status/2182087600
AbdullahMosaad;2009-06-15 19:42;0;0;"الحالة الـ19 المصابة بأنفلونزا AH1N1 هى لطفل أمريكى الجنسية يبلغ من العمر 4 سنوات مقيم مع أسرته بمحافظة القاهرة";;;;"2182087521";https://twitter.com/AbdullahMosaad/status/2182087521
fradest;2009-06-15 19:37;0;0;"FCH apura desarrollo de vacuna contra el AH1N1 : México mantendrá las medidas preventivas y de seguimiento ante l.. (cont…";;;;"2182032056";https://twitter.com/fradest/status/2182032056
swinefluh1n1;2009-06-15 19:35;0;0;""WHO | Influenza AH1N1 update 49" http://tinyurl.com/nxc69x #swineflu #H1N1";;;#swineflu #H1N1;"2182004143";https://twitter.com/swinefluh1n1/status/2182004143
noticia24;2009-06-15 19:24;0;0;"Infectados con virus AH1N1 ya son 94 en Peru http://tinyurl.com/nqmskr";;;;"2181866300";https://twitter.com/noticia24/status/2181866300
actiondatsun;2009-06-15 19:21;0;0;"cachanso que a @monsex le dio la AH1N1 , que lata =/";;@monsex;;"2181833715";https://twitter.com/actiondatsun/status/2181833715
infozeus;2009-06-15 19:21;0;0;"@wachunei de verdad que la @monsex está con AH1N1 ? se la habrá traído desde Canadá??";;@wachunei @monsex;;"2181831471";https://twitter.com/infozeus/status/2181831471
debolivia;2009-06-15 19:18;0;0;"Como usar el barbijo para prevenir el AH1N1 -> http://su.pr/1RV7fR yo me cague de risa, que tipo boludo!!!";;;;"2181798145";https://twitter.com/debolivia/status/2181798145
FernandoCL;2009-06-15 19:16;0;0;"Entrando a clases, aparece la profe y si tenia la AH1N1 confirmando los rumores";;;;"2181770533";https://twitter.com/FernandoCL/status/2181770533
chileteinforma;2009-06-15 19:15;0;0;"La Tercera: Licencia médica a contactos de enfermos con gripe AH1N1 estará asegurada: Esta es una de .. http://tinyurl.com/kwb22f";;;;"2181760452";https://twitter.com/chileteinforma/status/2181760452
eleconomista;2009-06-15 19:15;0;0;"FCH apura desarrollo de vacuna contra el AH1N1 : México mantendrá las medidas preventivas y de seguimiento ante l.. http://tinyurl.com/nrmfbg";;;;"2181754524";https://twitter.com/eleconomista/status/2181754524
elpaiscali;2009-06-15 19:13;0;0;"La gripe AH1N1 ya afecta a 45 personas en Colombia .: Los nuevos casos se registraron en la ciudad de Tunja, en .. http://tinyurl.com/n4vvcd";;;;"2181729689";https://twitter.com/elpaiscali/status/2181729689
ah1n1;2009-06-15 19:12;0;0;"Reuters: Novartis won't give free H1N1 vaccines to the poor http://twurl.nl/fvi6c0 #H1N1";;;#H1N1;"2181723055";https://twitter.com/ah1n1/status/2181723055
MLKtoSCL;2009-06-15 19:10;0;0;"En 6 a 8 semanas el virus AH1N1 irá decayendo. Chile presenta + casos porque cuenta con tecnología de diagnóstico rápido http://tr.im/ozJv";;;;"2181696594";https://twitter.com/MLKtoSCL/status/2181696594
adriaanalsema;2009-06-15 19:00;0;0;"Colombia raises number of AH1N1 cases to 45 http://tinyurl.com/lq7ahy";;;;"2181573144";https://twitter.com/adriaanalsema/status/2181573144
akirareiko;2009-06-15 18:57;0;0;"@seiichi_saito yeah, maybe you got the coolest souvenir: AH1N1 virus! hahahaha viva Mexico!";;@seiichi_saito;;"2181527885";https://twitter.com/akirareiko/status/2181527885
jvillasis;2009-06-15 18:56;0;0;"5th day of being sick. no it's not AH1N1 .";;;;"2181519663";https://twitter.com/jvillasis/status/2181519663
pandemicflublog;2009-06-15 18:54;0;0;"Travelling in the midst of AH1N1 Scare http://bit.ly/Nqq0c";;;;"2181493908";https://twitter.com/pandemicflublog/status/2181493908
pumba;2009-06-15 18:53;0;0;"@andreabuccioni una mujer anti ah1n1";;@andreabuccioni;;"2181488569";https://twitter.com/pumba/status/2181488569
dalealbo;2009-06-15 18:53;0;0;"Millar en reposo absoluto por posible contagio con el virus AH1N1 http://tinyurl.com/nb4xyb";;;;"2181481439";https://twitter.com/dalealbo/status/2181481439
xazarcom_ru;2009-06-15 18:44;0;0;"Число жертв вируса AH1N1 в США достигло 45 человек http://ff.im/-40Gle";;;;"2181379238";https://twitter.com/xazarcom_ru/status/2181379238
xazarcom_ru;2009-06-15 18:42;0;0;"Число заболевших гриппом AH1N1 составило почти 36 тысяч - ВОЗ http://ff.im/-40Glh";;;;"2181352859";https://twitter.com/xazarcom_ru/status/2181352859
eft0;2009-06-15 18:42;0;0;"Demasiado tarde, mi hermano en cama con AH1N1 positivo, cague :S";;;;"2181345041";https://twitter.com/eft0/status/2181345041
soldadoryan;2009-06-15 18:40;0;0;"Da buena imagen inaugurar ampliación de clínica Santa Maria en medio de crisis ah1n1 ?";;;;"2181320775";https://twitter.com/soldadoryan/status/2181320775
Blawer;2009-06-15 18:33;0;0;"El Baguazo; 94 casos AH1N1 ; 190 muertos por no PREVEER friaje de Puno. Toma de aeropuerto en Andahuaylas: "El mal menor". De yapa, temblor.";;;;"2181242043";https://twitter.com/Blawer/status/2181242043
soldadoryan;2009-06-15 18:33;0;0;"Novartis no entregará gratuitamente vacuna AH1n1 a países pobres. "Necesitamos un estímulo económico de los países ricos" dijeron.";;;;"2181236684";https://twitter.com/soldadoryan/status/2181236684
ADNRadioCL;2009-06-15 18:08;0;0;"Novartis se niega a distribuir gratuitamente la vacuna contra la gripe AH1N1 http://tinyurl.com/mbc29q";;;;"2180940508";https://twitter.com/ADNRadioCL/status/2180940508
NoticiasCaracol;2009-06-15 18:08;0;0;"Sigue en aumento el contagio con virus AH1N1 en Colombia: A 45 asciende este lunes el número de casos confirmado.. http://tinyurl.com/n8lduj";;;;"2180935255";https://twitter.com/NoticiasCaracol/status/2180935255
tranced;2009-06-15 17:33;0;0;"no hay vacunas gratis contra la AH1N1 de parte de Novartis http://bit.ly/zgsAu";;;;"2180506159";https://twitter.com/tranced/status/2180506159
ZephyreAllegra;2009-06-15 17:27;0;0;"Confirman en Bélgica tres casos de AH1N1 provenientes de R. Dominicana http://www.timesoftheinternet.com/espanol/44192.html";;;;"2180431583";https://twitter.com/ZephyreAllegra/status/2180431583
phormazabal;2009-06-15 17:25;0;0;"llego el chanchoman a la oficina, primera contagiada de AH1N1";;;;"2180404238";https://twitter.com/phormazabal/status/2180404238
colombiareports;2009-06-15 17:05;0;0;"Asciende a 45 los casos de gripa AH1N1 en Colombia http://tinyurl.com/mx6kbn";;;;"2180163122";https://twitter.com/colombiareports/status/2180163122
AtacamaQuerida;2009-06-15 17:00;0;0;"otra vez en Videoconferencia por la Influenza AH1N1";;;;"2180102325";https://twitter.com/AtacamaQuerida/status/2180102325
Nickolas;2009-06-15 16:57;0;0;"Cerco epidemiológico continúa tras confirmarse 44 casos de AH1N1 en el país";;;;"2180057907";https://twitter.com/Nickolas/status/2180057907
proyectomarker;2009-06-15 16:31;0;0;"En Argentina ya hay más de 600 casos de AH1N1 . En Colombia... vamos a pasar por los 80 y ya hay un muerto.http://bit.ly/p1A1v";;;;"2179742812";https://twitter.com/proyectomarker/status/2179742812
CaracolRadio;2009-06-15 16:29;0;1;"Confirman primer caso de AH1N1 en Bucaramanga http://tinyurl.com/mv83b7";;;;"2179721252";https://twitter.com/CaracolRadio/status/2179721252
paulidlux;2009-06-15 16:23;0;0;"Chuta mas amigos(as) con Ah1n1";;;;"2179649089";https://twitter.com/paulidlux/status/2179649089
cadenaglobal;2009-06-15 16:16;0;0;"AH1N1 : Cerco epidemiológico continúa en Venezuela | http://bit.ly/Wi4do";;;;"2179562231";https://twitter.com/cadenaglobal/status/2179562231
fchamy;2009-06-15 16:15;0;0;"Feeling better, no fever, might not be AH1N1 , thank God. Me siento mejor y sin fiebre, parece que no era AH1N1 , gracias a Dios!";;;;"2179554310";https://twitter.com/fchamy/status/2179554310
flpmonje;2009-06-15 15:43;0;0;"UGM under attack of AH1N1";;;;"2179153762";https://twitter.com/flpmonje/status/2179153762
Naky;2009-06-15 15:36;0;0;"Novartis no dará gratis a los países pobres la vacuna de la AH1N1 : http://bit.ly/Q1l4S #AH1N1";;;#AH1N1;"2179073905";https://twitter.com/Naky/status/2179073905
bolUDOoficial;2009-06-15 15:16;0;0;"no han confirmado ningún caso de gripe Ah1n1 en la Universidad de Oriente hasta el momento.";;;;"2178835140";https://twitter.com/bolUDOoficial/status/2178835140
elpalabrista;2009-06-15 15:05;0;0;"temperatura: 36.3°C. No es motiv de consulta por AH1N1 a pesar de los mocos y el malestar";;;;"2178706378";https://twitter.com/elpalabrista/status/2178706378
Naigabi;2009-06-15 15:03;0;0;"@nicolasyanez Vio que Montt también está con la AH1N1 ?";;@nicolasyanez;;"2178681532";https://twitter.com/Naigabi/status/2178681532
MiDiabetes;2009-06-15 14:35;0;0;"Max evolucionando bien de su AH1N1 . Yo sigo firme por ahora. Esperemos que siga así.";;;;"2178364075";https://twitter.com/MiDiabetes/status/2178364075
swinefluh1n1;2009-06-15 14:29;0;0;""Influenza AH1N1 update 48 Medicine" http://tinyurl.com/mvybvz #swineflu #H1N1";;;#swineflu #H1N1;"2178291156";https://twitter.com/swinefluh1n1/status/2178291156
mrduranch;2009-06-15 14:26;0;0;"#Novartis no dara gratis la vacuna contra la gripe @AH1N1 a paises pobres //la OMS deberia declarar medicamento generico";;@AH1N1;#Novartis;"2178259013";https://twitter.com/mrduranch/status/2178259013
iammjsamarita;2009-06-15 14:17;0;0;"FIGHT the Pandemic AH1N1 !, boost your immune system with the help of the clinically proven product I use http://bit.ly/BIAzk";;;;"2178167278";https://twitter.com/iammjsamarita/status/2178167278
nacioncl;2009-06-15 14:12;0;0;"09:54 | Laboratorio Novartirs descartó regalar vacunas contra la gripe AH1N1 http://tinyurl.com/mgtd3v";;;;"2178110995";https://twitter.com/nacioncl/status/2178110995
gypsywolve;2009-06-15 14:02;0;0;"RT @tweetmeme Common illness could be deadly if mixed with AH1N1 flu http://bit.ly/a8Pss";;@tweetmeme;;"2178001420";https://twitter.com/gypsywolve/status/2178001420
salecaliente;2009-06-15 14:01;0;0;"New blog post: Primera muerte en Europa por virus AH1N1 http://bit.ly/FH0wf";;;;"2177986243";https://twitter.com/salecaliente/status/2177986243
Riotobago;2009-06-15 13:48;0;0;"Chile is among the 5 countries with the highest percentage of infected AH1N1 .";;;;"2177857147";https://twitter.com/Riotobago/status/2177857147
ropalaro;2009-06-15 13:47;0;0;"Podrían ser 60.000 los contagiados con la ah1n1 en Chile,,buena cifra.. http://bit.ly/GY2zM";;;;"2177844599";https://twitter.com/ropalaro/status/2177844599
ChristianLTulio;2009-06-15 13:46;0;0;"With the AH1N1 situation, you'd think that people are more careful right? Well, somebody sneezed on me this morn and didn't apologize! hmp!";;;;"2177827022";https://twitter.com/ChristianLTulio/status/2177827022
fchamy;2009-06-15 13:45;0;0;"In bed. AH1N1 ??? Estoy en cama ¿ AH1N1 ???";;;;"2177821351";https://twitter.com/fchamy/status/2177821351
Nacho_the_Best;2009-06-15 13:36;0;0;"Creo que el IIE necesita algun plan de contingencia si ya tenemos casos de AH1N1 confirmados en la organizacion.";;;;"2177729018";https://twitter.com/Nacho_the_Best/status/2177729018
erunge;2009-06-15 13:35;0;0;"un colega con ah1n1 confirmado, ufff";;;;"2177718578";https://twitter.com/erunge/status/2177718578
Peru21pe;2009-06-15 13:33;0;0;"Alertan que la población no previene la gripe AH1N1 . Hasta el momento hay 94 casos. http://tr.im/oxgh";;;;"2177701558";https://twitter.com/Peru21pe/status/2177701558
juanchomendez;2009-06-15 13:23;0;0;"Comenzando el día en la pega y en convivencia con varias personas posiblemente comtagiadas con AH1N1";;;;"2177599426";https://twitter.com/juanchomendez/status/2177599426
perucom;2009-06-15 13:15;0;0;"La primera víctima mortal de la gripe AH1N1 en Europa es una mujer de 38 años http://is.gd/12tHw";;;;"2177521548";https://twitter.com/perucom/status/2177521548
joseccnet;2009-06-15 13:12;0;0;"Informacion: Vacuna de farmaceutica Baxter AH1N1 influenza flu http://tinyurl.com/ks94vm";;;;"2177499083";https://twitter.com/joseccnet/status/2177499083
xazarcom_ru;2009-06-15 13:10;0;0;"Грипп AH1N1 ничем не отличается от обычного гриппа - врач http://ff.im/-3ZVQ2";;;;"2177479546";https://twitter.com/xazarcom_ru/status/2177479546
xazarcom_ru;2009-06-15 13:08;0;0;"Грипп AH1N1 ничем не отличается от обычного гриппа - врач http://ff.im/-3ZVQ2";;;;"2177459282";https://twitter.com/xazarcom_ru/status/2177459282
bolUDOoficial;2009-06-15 13:07;0;0;"nos hemos mantenido al margen con los comentarios del virus ah1n1 para no causar pánico pues no hay confirmación de nada";;;;"2177449631";https://twitter.com/bolUDOoficial/status/2177449631
joseccnet;2009-06-15 13:05;0;0;"Farmaceutica Baxter ya tiene la vacuna para influenza AH1N1 . Faltaria producirla a gran escala. ¿Quienes seran los primeros/ultimos? ¿Cu ...";;;;"2177429949";https://twitter.com/joseccnet/status/2177429949
pumba;2009-06-15 13:01;0;0;"me siento pal pico hoy... me siento como si hubiera corrido 20 vueltas en un estadio, pero no tengo sintomas de resfrio (no es ah1n1 , creo)";;;;"2177395130";https://twitter.com/pumba/status/2177395130
armanneil;2009-06-15 12:57;0;0;"wonders why the media sensationalized the Ah1N1 ? (thinking) http://plurk.com/p/113fbp";;;;"2177357302";https://twitter.com/armanneil/status/2177357302
dennison;2009-06-15 12:57;0;0;"Severe tummy ache ... :( at least it's not AH1N1 hehe";;;;"2177349988";https://twitter.com/dennison/status/2177349988
Informe21;2009-06-15 12:47;0;0;"Alcalde solicita la suspensión de clases por contagio de gripe AH1N1 http://informe21.com/node/9631";;;;"2177263992";https://twitter.com/Informe21/status/2177263992
Gripe_porcina;2009-06-15 12:33;0;0;"Novartis descarta donar vacunas contra la gripe AH1N1 a países pobres - El Universal (Venezuela): Novartis desca.. http://tinyurl.com/lnx58p";;;;"2177152684";https://twitter.com/Gripe_porcina/status/2177152684
jmuena;2009-06-15 12:20;0;0;"Con el AH1N1 en las proximidades...";;;;"2177051164";https://twitter.com/jmuena/status/2177051164
5ymb14n4d1c70;2009-06-15 12:18;0;0;"Eso es sólo una prueba de muchas que tienen que hacer :-s RT @Jdfsistems : Señores ya hay vacuna para la famosa gri AH1N1";;@Jdfsistems;;"2177037194";https://twitter.com/5ymb14n4d1c70/status/2177037194
Chepe_Centro;2009-06-15 12:16;0;0;"Con principios de #gripe . Tan solo espero que si llega sea estacional y no #ah1n1 :-S";;;#gripe #ah1n1;"2177020342";https://twitter.com/Chepe_Centro/status/2177020342
dhezzanne;2009-06-15 12:11;0;0;"now its fair.. coz the college starts their clases nah.. peo dapat lang mag ingat sa Ah1n1 ..-)";;;;"2176977586";https://twitter.com/dhezzanne/status/2176977586
ebriceno;2009-06-15 12:01;0;0;"Suspendidas las clases en el colegio Pio XII por posible caso de AH1N1 . Mi hermanita regresó feliz. La inocencia de los niños jeje.";;;;"2176905035";https://twitter.com/ebriceno/status/2176905035
phoebeelizaga;2009-06-15 11:59;0;0;"Nearly 200 AH1N1 cases in the Philippines, bad news! :o A rainy Monday evening, not bad. :)";;;;"2176891392";https://twitter.com/phoebeelizaga/status/2176891392
mariaelmina;2009-06-15 11:57;0;0;"Moms off to Zambales "/ sadd&&nervous. ZOMFG! We mite get the effin AH1N1 thinggy! Oh myy!";;;;"2176876111";https://twitter.com/mariaelmina/status/2176876111
jomarr;2009-06-15 11:47;0;0;"@boysnightout899 now, when it was suspended. ha! because of ah1n1 ..";;@boysnightout899;;"2176805658";https://twitter.com/jomarr/status/2176805658
xazarcom_ru;2009-06-15 11:38;0;0;"Число заболевших гриппом AH1N1 в Египте достигло 23 человек http://ff.im/-3ZLAB";;;;"2176742386";https://twitter.com/xazarcom_ru/status/2176742386
h3nryx;2009-06-15 11:31;0;0;"Ya hay 3 casos confirmados de influenza AH1N1 en Montero - Santa cruz :s";;;;"2176693307";https://twitter.com/h3nryx/status/2176693307
apriannemarie;2009-06-15 11:21;0;0;"doing some research abt AH1N1";;;;"2176624465";https://twitter.com/apriannemarie/status/2176624465
korbu;2009-06-15 11:11;0;0;"Madrugándoles a casi todos y al #AH1N1";;;#AH1N1;"2176559516";https://twitter.com/korbu/status/2176559516
