username;date;retweets;favorites;text;geo;mentions;hashtags;id;permalink
ZephyreAllegra;2009-08-07 23:55;0;0;"Región peruana suma seis muertos por influenza AH1N1 http://www.timesoftheinternet.com/espanol/52788.html";;;;"3185600101";https://twitter.com/ZephyreAllegra/status/3185600101
EnSegun2;2009-08-07 23:11;0;0;"Cifra de muertes por gripe AH1N1 llega a 27 http://bit.ly/D0YZG";;;;"3185048525";https://twitter.com/EnSegun2/status/3185048525
Peru21pe;2009-08-07 23:06;0;0;"Ministerio de Salud confirma 4 nuevas muertes en Perú por el virus de la Nueva Influenza #AH1N1 .";;;#AH1N1;"3184984662";https://twitter.com/Peru21pe/status/3184984662
boliviabits;2009-08-07 22:41;0;0;"#bolivia Contagios de la gripe AH1N1 disminuyen en La Paz:     La Paz - Bolivia.- El Hospital de Clínica.. http://bit.ly/13Suam";;;#bolivia;"3184693430";https://twitter.com/boliviabits/status/3184693430
JerryNorstrom;2009-08-07 22:16;0;0;"Reporta Ssa tres muertos más por influenza AH1N1 ; suman 149 http://bit.ly/kFkHn";;;;"3184380063";https://twitter.com/JerryNorstrom/status/3184380063
noticia24;2009-08-07 22:15;0;0;"Inmunizacion contra AH1N1 iniciara en diciembre http://bit.ly/wEvJw";;;;"3184364619";https://twitter.com/noticia24/status/3184364619
jepintocornejo;2009-08-07 22:13;0;0;"Méco supera los 17.500 contagios por gripe AH1N1 http://viigo.im/0usn";;;;"3184335380";https://twitter.com/jepintocornejo/status/3184335380
SaludDGPS;2009-08-07 21:47;0;0;"Estudian a fondo el virus AH1N1 para neutralizarlo http://bit.ly/G1QJa";;;;"3184002903";https://twitter.com/SaludDGPS/status/3184002903
PanamericanaTV;2009-08-07 21:43;0;0;"Contagio por gripe AH1N1 bajó un 39% entre la población escolar http://www.24horaslibre.com/salud/1249686037.php";;;;"3183959007";https://twitter.com/PanamericanaTV/status/3183959007
EnriqueVasquez;2009-08-07 21:25;0;0;"@_Gyermo De bolas, tienes que formatear, cuando un super virus ataca, hay que formatear. So simple :) Ojalá se pudiera hacer con el AH1N1";;@_Gyermo;;"3183723925";https://twitter.com/EnriqueVasquez/status/3183723925
Cyberperiodista;2009-08-07 21:09;0;0;"Huaral frente a la influenza AH1N1 . Victor Arrunategui nos trae la nota. http://bit.ly/19b6X2";;;;"3183509594";https://twitter.com/Cyberperiodista/status/3183509594
alv4;2009-08-07 20:36;0;0;"Interesante sobre la gripe AH1N1 , Todo es un negocio sucio :( http://bit.ly/wef6w";;;;"3183047152";https://twitter.com/alv4/status/3183047152
Miecuadorqerido;2009-08-07 20:25;0;0;"Cuarto fallecimiento por gripe AH1N1 en Loja: Con la presente víctima, una mujer 58 años, suman veintidos los de.. http://buzzup.com/9zdk";;;;"3182885235";https://twitter.com/Miecuadorqerido/status/3182885235
valmenfa;2009-08-07 19:26;0;0;"En Chiclayo, se reporta tercera víctima de la gripe AH1N1 .";;;;"3182124287";https://twitter.com/valmenfa/status/3182124287
Filock;2009-08-07 19:18;0;0;"Una chica murio en el Hosp.Almanzor el 31 de Julio y hoy se sabe que fue por el virus #AH1N1 ...plop";;;#AH1N1;"3182015126";https://twitter.com/Filock/status/3182015126
rbv_008;2009-08-07 18:18;0;0;"tengo la ah1n1 cuidado !!!";;;;"3181252947";https://twitter.com/rbv_008/status/3181252947
Agencia_Andina;2009-08-07 18:02;0;0;"#Ministros #andinos buscarán reducción de #precio de #vacuna contra #AH1N1 , que alcanza a US$ 14 por #dosis";;;#Ministros #andinos #precio #vacuna #AH1N1 #dosis;"3181042030";https://twitter.com/Agencia_Andina/status/3181042030
freemediaven;2009-08-07 17:38;0;0;"#FreeMediaVe Ministro de Salud: "El país cuenta con suficientes kits para diagnóstico de AH1N1 " http://url4.eu/Bxch";;;#FreeMediaVe;"3180724900";https://twitter.com/freemediaven/status/3180724900
nacion;2009-08-07 17:33;0;0;"Cifra de muertes por gripe AH1N1 llega a 27 http://nacion.com/g/29k";;;;"3180657633";https://twitter.com/nacion/status/3180657633
cnieto;2009-08-07 16:47;0;0;"Operacion Pandemia AH1N1 - http://bit.ly/12rPMx";;;;"3180068688";https://twitter.com/cnieto/status/3180068688
juancho21;2009-08-07 16:26;0;0;"mas enfermo imposibleeeee pues tengo la peste AH1N1 "RELOADED"";;;;"3179795283";https://twitter.com/juancho21/status/3179795283
perucom;2009-08-07 16:24;0;0;"¡Mucho ojo! Recomiendan a escolares no compartir chupetines o golosinas por gripe AH1N1 http://bit.ly/32KisZ";;;;"3179773119";https://twitter.com/perucom/status/3179773119
perucom;2009-08-07 15:46;0;0;"DIRESA reporta tercera víctima mortal por gripe AH1N1 en Puno http://bit.ly/9rHFO";;;;"3179279014";https://twitter.com/perucom/status/3179279014
elimpulsocom;2009-08-07 15:30;0;0;"Sanofi Pasteur empieza a probar su vacuna contra gripe AH1N1 http://bit.ly/GuswQ";;;;"3179066158";https://twitter.com/elimpulsocom/status/3179066158
ZephyreAllegra;2009-08-07 15:30;0;0;"Muertes en Chile por influenza AH1N1 suman 104 http://www.timesoftheinternet.com/espanol/52707.html";;;;"3179062591";https://twitter.com/ZephyreAllegra/status/3179062591
alv4;2009-08-07 15:03;0;0;"Nunca pensé encontrar algo tan claro sobre la gripe porcina ( AH1N1 ): http://bit.ly/e1TNA";;;;"3178722961";https://twitter.com/alv4/status/3178722961
epsrcmupr;2009-08-07 14:38;0;0;"Informate sobre el Virus AH1N1 : http://www.rcm.upr.edu/ah1n1/";;;;"3178406841";https://twitter.com/epsrcmupr/status/3178406841
epsrcmupr;2009-08-07 14:35;0;0;"AH1N1 - Suben a 34 las muertes sospechosas: http://bit.ly/qdMzE";;;;"3178371339";https://twitter.com/epsrcmupr/status/3178371339
CPN_Noticias;2009-08-07 14:22;0;0;"Movilidades escolares se suman a lucha contra la gripe AH1N1 http://www.cpnradio.pe/html/2009/08/07/3/3529.htm";;;;"3178217184";https://twitter.com/CPN_Noticias/status/3178217184
edwinvazquez;2009-08-07 13:52;0;0;"Cargas y Descargas: Datos Sobre la Gripe AH1N1 en Puerto Rico http://bit.ly/3YVJlD";;;;"3177873217";https://twitter.com/edwinvazquez/status/3177873217
RPPNoticias;2009-08-07 12:53;0;0;"A 36 se elevan los muertos por la gripe AH1N1 en el Perú. http://tinyurl.com/n7ho6w";;;;"3177273055";https://twitter.com/RPPNoticias/status/3177273055
perucom;2009-08-07 12:21;0;0;"Farmacéutica Sanofi completa la información sobre su vacuna contra la gripe AH1N1 http://is.gd/26qJT";;;;"3176995367";https://twitter.com/perucom/status/3176995367
db3N;2009-08-07 07:27;0;0;"A si... ni mi hermano, ni yo tenemos influenza AH1N1 XD. Yo tengo gripe comun, y mi carnal tifoidea. Todo esta bajo control. tnx =)";;;;"3175440608";https://twitter.com/db3N/status/3175440608
x_tello;2009-08-07 07:02;0;0;"Regresa la Influenza AH1N1 . ¿Estamos realmente preparados en nuestras empresas? http://bit.ly/2yaRg #AH1N1 #Influenza #Pandemia #Virus #Flu";;;#AH1N1 #Influenza #Pandemia #Virus #Flu;"3175354282";https://twitter.com/x_tello/status/3175354282
LaTribunahn;2009-08-07 07:00;0;0;"Virus de la gripe AH1N1 obliga al cierre de escuelas y colegios: - http://tinyurl.com/nt68rg";;;;"3175341622";https://twitter.com/LaTribunahn/status/3175341622
TrujilloInforma;2009-08-07 02:52;0;0;"Evitar pánico público frente a AH1N1 sostiene médico norteamericano en Trujillo: “Todavía no sabemo.. http://bit.ly/19mu8b";;;;"3173259276";https://twitter.com/TrujilloInforma/status/3173259276
perucom;2009-08-07 02:47;0;0;"El Gobierno de Costa Rica ordena dar tratamiento gratuito para la gripe AH1N1 . http://bit.ly/c1VmJ";;;;"3173185603";https://twitter.com/perucom/status/3173185603
canal_chile;2009-08-07 01:57;0;0;"104 fallecidos ha dejado gripe humana en Chile. 104 personas han fallecido hasta fecha por causa d AH1N1 , según último… http://ff.im/-6gv51";;;;"3172529422";https://twitter.com/canal_chile/status/3172529422
JG_Hn;2009-08-07 01:32;0;0;"Mi hermana salio positiva en el examen de Influenza AH1N1 hoy. Ew pobrecita ella.";;;;"3172219476";https://twitter.com/JG_Hn/status/3172219476
Aferbaco;2009-08-07 01:12;0;0;"Noticia de ultima hora, la pandemia de AH1N1 es como la ping@de Oscar Arias, nadie la para";;@de;;"3171975663";https://twitter.com/Aferbaco/status/3171975663