username;date;retweets;favorites;text;geo;mentions;hashtags;id;permalink
CristianAmDs;2009-07-18 23:56;0;0;"Creo que tengo AH1N1 . Casi todos los síntomas ya los presento, me falta uno sólo. Comeré mucha torta de brigadeiro para morir en paz.";;;;"2713666129";https://twitter.com/CristianAmDs/status/2713666129
isoliett;2009-07-18 23:53;0;0;"Historia médica de la beba muerta por AH1N1 al parecer se perdió,temen pase lo mismo con acta de defunción.MinSalud brilla x su ausencia";;;;"2713637018";https://twitter.com/isoliett/status/2713637018
deivisramirez;2009-07-18 23:49;0;0;"La historia médica de la menor fallecida por virus AH1N1 no aparece.. Temen se pierda acta de defunción. Qué pasa MinSalud?";;;;"2713582289";https://twitter.com/deivisramirez/status/2713582289
blosky51;2009-07-18 23:38;0;0;"La gripe AH1N1 genera polémica en Santa Cruz, Bolivia: http://is.gd/1DBns";;;;"2713455229";https://twitter.com/blosky51/status/2713455229
deivisramirez;2009-07-18 23:38;0;0;"Confirman 1 muerte por gripe AH1N1 en Caracas. Se trata de una niña de 11 meses. Murió ayer en el San Juan de Dios. Nadie habla del caso.";;;;"2713454960";https://twitter.com/deivisramirez/status/2713454960
LinEdx;2009-07-18 23:18;0;0;"Noticia: La OMS(Organización Mundial de la Salud) Sorprendida por la gripe AH1N1 http://bit.ly/3tj4G";;;;"2713215178";https://twitter.com/LinEdx/status/2713215178
anlora;2009-07-18 23:09;0;0;"soo scared with the AH1N1 influenza!! I have to carry hand sanitizer on my purse everywhere!";;;;"2713106052";https://twitter.com/anlora/status/2713106052
WapaTV;2009-07-18 22:58;0;0;"Precavidos los comercios: Ante el aumento de casos del virus AH1N1 , los comercios y también los consumidores est.. http://bit.ly/3Q0NZ";;;;"2712970409";https://twitter.com/WapaTV/status/2712970409
danielon658;2009-07-18 22:50;0;0;"Ecuador suma su sexta víctima mortal por gripe AH1N1 http://bit.ly/15WtT";;;;"2712863888";https://twitter.com/danielon658/status/2712863888
isoliett;2009-07-18 22:47;0;0;"Confirmada muerte de pequeña, la primera por gripe AH1N1 . Nadie se atreve a atribuirse información.";;;;"2712835808";https://twitter.com/isoliett/status/2712835808
elcomerciocom;2009-07-18 22:39;0;0;"22 trabajadores del hospital de IESS de Loja, sospechosos de gripe AH1N1 http://bit.ly/Qr8qx";;;;"2712733681";https://twitter.com/elcomerciocom/status/2712733681
inespm;2009-07-18 22:29;0;0;"alguien tiene información si se murió la bebe contagiada con AH1N1 ?";;;;"2712614441";https://twitter.com/inespm/status/2712614441
miguelrios;2009-07-18 22:29;0;0;"Tírense para Barranquitas. Feria de artesanías este weekend y 0 (o pocos) casos de AH1N1 . http://digg.com/u18stv";;;;"2712611455";https://twitter.com/miguelrios/status/2712611455
Neo_Kabuki;2009-07-18 22:19;0;0;"aburrido encerrado te odio ah1n1";;;;"2712498819";https://twitter.com/Neo_Kabuki/status/2712498819
javierbellido;2009-07-18 22:13;0;0;"@thatssoet Cuidado que no vayas a contagiarte con la AH1N1 . jejejeje!";;@thatssoet;;"2712418169";https://twitter.com/javierbellido/status/2712418169
xazarcom_ru;2009-07-18 22:02;0;0;"Бельгийцы предлагают бороться с гриппом AH1N1 , избегая рукопожатий http://ff.im/-5p3lx";;;;"2712279247";https://twitter.com/xazarcom_ru/status/2712279247
xazarcom_ru;2009-07-18 22:02;0;0;"Польские врачи подтвердили 37-й случай заболевания гриппом AH1N1 http://ff.im/-5p3ly";;;;"2712279240";https://twitter.com/xazarcom_ru/status/2712279240
xazarcom_ru;2009-07-18 22:02;0;0;"Польские врачи подтвердили 37-й случай заболевания гриппом AH1N1 http://ff.im/-5p3lA";;;;"2712279239";https://twitter.com/xazarcom_ru/status/2712279239
NoticiasCaracol;2009-07-18 21:53;0;0;"Científicos le siguen la pista minuto a minuto al virus AH1N1 : Una de las mayores preocupaciones de las autorida.. http://cli.gs/05Hv9";;;;"2712174790";https://twitter.com/NoticiasCaracol/status/2712174790
xazarcom_ru;2009-07-18 21:15;0;0;"Бельгийцы предлагают бороться с гриппом AH1N1 , избегая рукопожатий http://ff.im/-5oZkV";;;;"2711712729";https://twitter.com/xazarcom_ru/status/2711712729
ayDomo;2009-07-18 21:10;0;0;"Suspendida mi clase de estructuras del martes xq hay un caso de AH1N1 en el CTI-ESPOL. Nadie que conozco transita por ahí ? cuidarse... :S";;;;"2711648082";https://twitter.com/ayDomo/status/2711648082
diarioojo;2009-07-18 20:51;0;0;"Ministro de Salud dice que no es oportuno suspender todas las actividades públicas ante avance de la gripe AH1N1 . http://tinyurl.com/mdyyxk";;;;"2711406846";https://twitter.com/diarioojo/status/2711406846
reporteroiqq;2009-07-18 20:29;0;0;"AH1N1 : Virus presenta curva de descenso http://bit.ly/1blbmJ";;;;"2711127682";https://twitter.com/reporteroiqq/status/2711127682
Nelissh;2009-07-18 20:15;0;0;"@Ovejuno cierto.. esto es más peligroso que AH1N1";;@Ovejuno;;"2710961451";https://twitter.com/Nelissh/status/2710961451
UnixLover;2009-07-18 20:10;0;0;"Infected with AH1N1 X_x nuuuuuuuuuuuuuuuu!!";;;;"2710896014";https://twitter.com/UnixLover/status/2710896014
phichai;2009-07-18 20:10;0;0;"AH1N1 " ดื้อยา...น่ากลัว "นักการเมือง" ดื้อ...น่ากลัวยิ่งกว่า !!!" http://bit.ly/poRu9";;;;"2710892073";https://twitter.com/phichai/status/2710892073
TaiPelli;2009-07-18 19:51;0;0;"Not a bottle of hand sanitizer in stores with the huge paranoia of the freaking virus AH1N1 .";;;;"2710661182";https://twitter.com/TaiPelli/status/2710661182
DiggFrance;2009-07-18 19:45;0;0;"QUELS SONT LES RISQUES A VOYAGER EN THAILANDE, RISQUES DE GRIPPE AH1N1 EN THAILANDE ETE 2001: http://xabdn.tk";;;;"2710586231";https://twitter.com/DiggFrance/status/2710586231
Ciberdoc;2009-07-18 19:31;0;0;"Cafecito y una bolsa de papitas , receta segura para contraer la influenza aH1N1";;;;"2710411083";https://twitter.com/Ciberdoc/status/2710411083
manuelmax;2009-07-18 19:29;0;0;"Infiltrada del Ah1N1 en la UNL... cuidado con acercarse a la Patoja..estuvo en la Tecnica";;;;"2710391499";https://twitter.com/manuelmax/status/2710391499
DiggFrance;2009-07-18 19:24;0;0;"GRIPPE AH1N1 EN THAILANDE, RISQUE DES VACANCES EN THAILANDE, COMMENT SURVIVRE PENDANT SES VACANCES EN THAILANDE: http://kx8az.tk";;;;"2710322890";https://twitter.com/DiggFrance/status/2710322890
BlrdPatchTeens;2009-07-18 19:13;0;0;"Website to be informed about the Swine Influenza AH1N1 Virus (Is getting out of control in Puerto Rico) http://www.ah1n1.com/";;;;"2710194540";https://twitter.com/BlrdPatchTeens/status/2710194540
jdguariglia;2009-07-18 18:38;0;0;"RT @insanojournal: Hospital San Juan de Dios donde estuviera recluida la niña que murió por AH1N1 ha cerrado el acceso a prensa";;@insanojournal;;"2709762225";https://twitter.com/jdguariglia/status/2709762225
elmigueesteban;2009-07-18 18:30;0;0;"mi viejo con la AH1N1 ; contagiado en IQUIQUE... y yo... tal vez....";;;;"2709662396";https://twitter.com/elmigueesteban/status/2709662396
johannalogan4;2009-07-18 18:28;0;0;"OMG!Philippines have the most people with ah1n1 .Ranking for top 1 in south east asia.Beware to this disease not just in philippines but all.";;;;"2709633728";https://twitter.com/johannalogan4/status/2709633728
EspacinsularRD;2009-07-18 18:08;0;0;"Advierten 1.5 millones de puertorriqueños son más propensos a contagiarse con el virus AH1N1 .http://bit.ly/lBmgx";;;;"2709379709";https://twitter.com/EspacinsularRD/status/2709379709
alanele;2009-07-18 18:06;0;0;"2 o 3 fallecidos en Cajamarca con probables síntomas de gripe AH1N1 , muestras se analizarán en las próximas horas";;;;"2709345128";https://twitter.com/alanele/status/2709345128
radiosantafentc;2009-07-18 18:04;0;0;"Ya son ocho las víctimas por virus AH1N1 : El virus esta vez tomó la vida de un menor de 11 años de edad de la c.. http://bit.ly/17iHkz";;;;"2709325442";https://twitter.com/radiosantafentc/status/2709325442
xazarcom_ru;2009-07-18 18:01;0;0;"Школьные каникулы в Италии могут продлиться из-за гриппа AH1N1 http://ff.im/-5oGpr";;;;"2709286886";https://twitter.com/xazarcom_ru/status/2709286886
franci_g;2009-07-18 17:58;0;0;"RT @latercera : AH1N1 : Virus presenta curva de descenso: Subsecretaria de Salud Jeanette Vega espera para las próximas semanas u.. http:/ ...";;@latercera;;"2709245343";https://twitter.com/franci_g/status/2709245343
Merki589;2009-07-18 17:54;0;0;"is feeling bummed...curses ah1n1 ...because of it we don't have classes for a week..consequence? NO semestral break!!!! aaargh!!!!";;;;"2709196186";https://twitter.com/Merki589/status/2709196186
elcomerciocom;2009-07-18 17:40;0;0;"Ecuador suma su sexta v�ctima mortal por gripe AH1N1 http://bit.ly/1dGEQk";;;;"2709016117";https://twitter.com/elcomerciocom/status/2709016117
J_an_M_Lignelli;2009-07-18 17:39;0;0;"aH1N1 is coming to you in every town in Puerto Rico.....be careful....be wary.... be ready";;;;"2708997956";https://twitter.com/J_an_M_Lignelli/status/2708997956
JoseManuelR;2009-07-18 17:39;0;0;"RT @insanojournal Tenía 11 meses RT @isoliett : Primera fallecida x AH1N1 n Vzla. Murió n Caracas, hospital San Juan d Dios. Era 1 niña";;@insanojournal @isoliett;;"2708996422";https://twitter.com/JoseManuelR/status/2708996422
orbitando;2009-07-18 17:30;0;0;"Adoptan medidas especiales por AH1N1 en vacaciones de invierno http://bit.ly/TzkbZ";;;;"2708885287";https://twitter.com/orbitando/status/2708885287
Brian_yapareci;2009-07-18 17:20;0;0;"or AH1N1";;;;"2708748080";https://twitter.com/Brian_yapareci/status/2708748080
edumorfosis;2009-07-18 17:10;0;0;"Alerta X el AH1N1 - http://bit.ly/7wIQK";;;;"2708623985";https://twitter.com/edumorfosis/status/2708623985
Prehidalgo;2009-07-18 16:56;0;0;"Escolares británicos en cuarentena en China por influenza #AH1N1 . http://is.gd/1Dogo";;;#AH1N1;"2708440064";https://twitter.com/Prehidalgo/status/2708440064
numerozero;2009-07-18 16:55;0;0;"El Minsa no emitirá comunicados actualizando la situación de la gripe AH1N1 en fines de semana y feriados desde hoy http://ow.ly/hAQt";;;;"2708421156";https://twitter.com/numerozero/status/2708421156
n0ta_mental;2009-07-18 16:46;0;0;"jajajajaja RT @julianortegam : (vía FB) "LOS URIBISTAS CREEN QUE AH1N1 ES EL MODELO DE LA NAVE DE URIBE QUE LOS VA A LLEVAR A FELICIDONIA"";;@julianortegam;;"2708314298";https://twitter.com/n0ta_mental/status/2708314298
rosemiller89;2009-07-18 16:43;0;0;"OMG!Philippines have the most people with ah1n1 .Ranking for top 1 in south east asia.Beware to this disease not just in philippines but all.";;;;"2708269749";https://twitter.com/rosemiller89/status/2708269749
elpaiscali;2009-07-18 16:27;0;0;"Confirman nueva muerte por AH1N1 en Colombia.: Un menor de edad que residía en Bogotá se convirtió en la octava .. http://bit.ly/JsSOC";;;;"2708066844";https://twitter.com/elpaiscali/status/2708066844
adriaanalsema;2009-07-18 16:20;0;0;"Colombia confirms 8th AH1N1 fatality http://bit.ly/H3pwg";;;;"2707976420";https://twitter.com/adriaanalsema/status/2707976420
giovannabartho;2009-07-18 16:16;0;0;"GRIPE SUINA ( AH1N1 ) CHEGOOU NA REGIÃO DO ABC PAULISTA, OLHA QUE BELEZA [2]";;;;"2707921868";https://twitter.com/giovannabartho/status/2707921868
frankproducer;2009-07-18 16:15;0;0;"Leaving soon to work!! Here In Puerto Rico!! the Ah1n1 is a real problem!!";;;;"2707907623";https://twitter.com/frankproducer/status/2707907623
lavozdevalpo;2009-07-18 16:04;0;0;"Adoptan medidas especiales por AH1N1 en vacaciones de invierno http://bit.ly/13les2";;;;"2707775275";https://twitter.com/lavozdevalpo/status/2707775275
quietd0ll;2009-07-18 16:03;0;0;"OMG!Philippines have the most people with ah1n1 .Ranking for top 1 in south east asia.Beware to this disease not just in philippines but all.";;;;"2707755789";https://twitter.com/quietd0ll/status/2707755789
NoticiasCaracol;2009-07-18 15:53;0;0;"Un niño, la octava víctima mortal del virus AH1N1 en Colombia: El menor, de ocho años, murió el pasado 13 de jul.. http://cli.gs/20yht";;;;"2707624486";https://twitter.com/NoticiasCaracol/status/2707624486
who_is_egay;2009-07-18 15:43;0;0;"So what's the latest with the ah1n1 cases in camsur, in naga?";;;;"2707509992";https://twitter.com/who_is_egay/status/2707509992
latercera;2009-07-18 15:41;0;0;"AH1N1 : Virus presenta curva de descenso: Subsecretaria de Salud Jeanette Vega espera para las próximas semanas u.. http://twurl.nl/t3bnfg";;;;"2707485566";https://twitter.com/latercera/status/2707485566
CPN_Noticias;2009-07-18 15:33;0;0;"Circos deberían reducirse al mínimo por gripe AH1N1 http://www.cpnradio.pe/html/2009/07/18/3/3224.htm";;;;"2707388295";https://twitter.com/CPN_Noticias/status/2707388295
adonias;2009-07-18 15:25;0;0;"Organização Mundial de Saúde decidade párar de contar casos da nova gripe #ah1n1";;;#ah1n1;"2707286929";https://twitter.com/adonias/status/2707286929
primerahora;2009-07-18 15:11;0;0;"No los dejan protegerse de la influenza AH1N1 http://bit.ly/mR5oG";;;;"2707118017";https://twitter.com/primerahora/status/2707118017
primerahora;2009-07-18 15:11;0;0;"Maestros se tiran a la calle para educar sobre la influenza AH1N1 http://bit.ly/PWQpe";;;;"2707117257";https://twitter.com/primerahora/status/2707117257
canal_chile;2009-07-18 14:52;0;0;"Minsal: La AH1N1 ya está en curva d descenso en Chile, subsecretaria Jeanette Vega destacó disminución d c… http://ff.im/-5olfL";;;;"2706890536";https://twitter.com/canal_chile/status/2706890536
anakbrunei;2009-07-18 14:51;0;0;"RT @KhairulKhalil : AH1n1 cases surpass the 400 mark after the 1st case was detected a month ago. 20 cases today, bringing a total of 415";;@KhairulKhalil;;"2706879905";https://twitter.com/anakbrunei/status/2706879905
gwacie;2009-07-18 14:51;0;0;"just sneezed. Have to be careful because ah1n1 is now in the city...";;;;"2706874310";https://twitter.com/gwacie/status/2706874310
ah1n1;2009-07-18 14:45;0;0;"Reuters: UK school children quarantined for H1N1 flu in China http://twurl.nl/77g0k1 #H1N1";;;#H1N1;"2706808666";https://twitter.com/ah1n1/status/2706808666
xazarcom_ru;2009-07-18 14:44;0;0;"Первый случай гриппа AH1N1 выявлен в Грузии http://ff.im/-5oktu";;;;"2706801988";https://twitter.com/xazarcom_ru/status/2706801988
huizache;2009-07-18 14:37;0;0;"Excelente articulo de Sivia Ribeiro: Microbios, gripe y puercos trasnacionales - http://shar.es/dbAL #AH1N1 #biodiversidad #biodiversity";;;#AH1N1 #biodiversidad #biodiversity;"2706721320";https://twitter.com/huizache/status/2706721320
moolahmaker;2009-07-18 14:32;0;0;"sick...i hope its not AH1N1 or else....good gravy!";;;;"2706665423";https://twitter.com/moolahmaker/status/2706665423
arangurens;2009-07-18 14:30;0;0;"RT @insanojournal: Tenía 11 meses RT @isoliett : Primera fallecida x AH1N1 n Vzla. Murió n Caracas, hospital San Juan d Dios. Era 1 niña.";;@insanojournal @isoliett;;"2706650932";https://twitter.com/arangurens/status/2706650932
karlaveloso;2009-07-18 14:25;0;0;"had fun in class shooting pretty girls/laughed a lot with everyday friends/saw Harry Potter with people who might have ah1n1 . swell.";;;;"2706595137";https://twitter.com/karlaveloso/status/2706595137
mrduranch;2009-07-18 14:14;0;0;"terrible, viacrucis gripe #AH1N1 http://bit.ly/BkMA4 favor RT";;;#AH1N1;"2706480311";https://twitter.com/mrduranch/status/2706480311
urru_urru;2009-07-18 13:49;0;0;"Q saben de esto? "tenemos el primer muerto x gripe AH1N1 Es bebe de 8 meses de El Hatillo fallecio en Hospital San Juan de Dios"";;;;"2706236296";https://twitter.com/urru_urru/status/2706236296
isoliett;2009-07-18 13:49;0;0;"Primera fallecida por AH1N1 en Venezuela. Murió en Caracas, hospital San Juan de Dios. Era una niña.";;;;"2706227351";https://twitter.com/isoliett/status/2706227351
alexvazquezpr;2009-07-18 13:36;0;0;"Felicidades a la administracion del coliseo de Quebradillas el juego anoche... sin aire acondicionado la propagacion del virus AH1N1 se ...";;;;"2706111416";https://twitter.com/alexvazquezpr/status/2706111416
jfmanzo;2009-07-18 13:30;0;0;"gripe y resfrio en Rio de Janeiro causan tension entre los habitantes, temen casos de AH1N1 .. nah! soy solo yo y no tengo la gripe suina! :P";;;;"2706055268";https://twitter.com/jfmanzo/status/2706055268
MiguelE_Ayala;2009-07-18 13:08;0;0;"Me tienen harto con el AH1N1 ! No jodan mas, no me saludes no me beses!!!";;;;"2705858324";https://twitter.com/MiguelE_Ayala/status/2705858324
xazarcom_ru;2009-07-18 13:06;0;0;"Состояние заболевшей AH1N1 в Северске удовлетворительное - Онищенко http://ff.im/-5oa9l";;;;"2705841019";https://twitter.com/xazarcom_ru/status/2705841019
xazarcom_ru;2009-07-18 13:06;0;0;"Еще три россиянина, возможно, заразились гриппом AH1N1 - Онищенко http://ff.im/-5oa9h";;;;"2705841016";https://twitter.com/xazarcom_ru/status/2705841016
xazarcom_ru;2009-07-18 13:06;0;0;"Распространение гриппа AH1N1 в России http://ff.im/-5oa93";;;;"2705840117";https://twitter.com/xazarcom_ru/status/2705840117
ah1n1;2009-07-18 13:03;0;0;"Musician Melissa Auf der Maur, formerly of Hole and the Smashing Pumpkins has Mexican Flu. http://twurl.nl/6v1b4v #H1N1";;;#H1N1;"2705813729";https://twitter.com/ah1n1/status/2705813729
xazar_com;2009-07-18 12:40;0;0;"Gürcüstanda AH1N1 virusuna ilk yoluxma halı qeydə alınıb http://ff.im/-5o7nV";;;;"2705618511";https://twitter.com/xazar_com/status/2705618511
paolocelso;2009-07-18 12:32;0;0;"@jambakuyaw Oh my! Seriously?! Sam C. has AH1N1 ?! :| Or is it a joke?";;@jambakuyaw;;"2705557896";https://twitter.com/paolocelso/status/2705557896
ah1n1;2009-07-18 12:31;0;0;"Times Online: Swine flu reports jump by half in a week http://twurl.nl/qxuczl #H1N1";;;#H1N1;"2705551736";https://twitter.com/ah1n1/status/2705551736
xratedcontent;2009-07-18 12:31;0;0;"how to get rid of a speeding ticket, Cough in front of the police and say that you think you have AH1N1 and going to the hospital";;;;"2705550877";https://twitter.com/xratedcontent/status/2705550877
McV1C10us;2009-07-18 12:27;0;0;"Comenzando el dia con la familia paranoica x la #AH1N1 ... mejor escucho Killling es My Business... And Business is Good para relajarme ^_^";;;#AH1N1;"2705519446";https://twitter.com/McV1C10us/status/2705519446
ah1n1;2009-07-18 12:27;0;0;"Edmonton Sun: Swine flu on wane, but health officials anticipate comeback http://twurl.nl/2ea0m5 #H1N1";;;#H1N1;"2705517856";https://twitter.com/ah1n1/status/2705517856
lahueca;2009-07-18 12:08;0;0;"En Loja murió la 6ª víctima por AH1N1 http://bit.ly/2CZKU";;;;"2705375917";https://twitter.com/lahueca/status/2705375917
jalmeyda;2009-07-18 10:33;0;0;"De estadia en Rincon Beach Resort con mi familia y cargando el kit contra el AH1N1 para todos lados. Eso del virus me tiene intranquilo!";;;;"2704728802";https://twitter.com/jalmeyda/status/2704728802
News_in_Peru;2009-07-18 06:56;0;0;"Peru reports its 11th death on AH1N1 influenza http://www.livinginperu.com/news/9610";;;;"2703110185";https://twitter.com/News_in_Peru/status/2703110185
izquierdaperu;2009-07-18 06:30;0;0;"Influenza AH1N1 causa estragos en Perú: El brote de Influenza AH1N1 se ha convertido en una de las principales p.. http://bit.ly/zQ7Sw";;;;"2702885525";https://twitter.com/izquierdaperu/status/2702885525
natho47;2009-07-18 06:25;0;0;"RT@canal_chileAumentan a 40 las muertes por Gripe AH1N1 en Chile http://bit.ly/9Sb47";;@canal_chileAumentan;;"2702834409";https://twitter.com/natho47/status/2702834409
iammjsamarita;2009-07-18 06:07;0;0;"FIGHT the Pandemic AH1N1 !, boost your immune system with the help of the clinically proven product I use http://bit.ly/BIAzk";;;;"2702660641";https://twitter.com/iammjsamarita/status/2702660641
canal_chile;2009-07-18 05:56;0;0;"Aumentan a 40 las muertes por Gripe AH1N1 en Chile http://bit.ly/9Sb47";;;;"2702551523";https://twitter.com/canal_chile/status/2702551523
GREENPLANETSYS;2009-07-18 05:42;0;0;"11 personas mueren en Perú víctimas de la gripe AH1N1 , http://tinyurl.com/mu5ddm www.greenplanetsys.spaces.live.com";;;;"2702410011";https://twitter.com/GREENPLANETSYS/status/2702410011
MissSkuiken;2009-07-18 05:09;0;0;"Waaa.. Creo q ahora si ya me enferme bn... Maldita gripe... Espero en dios q no ea de esa ah1n1 ... o.O";;;;"2702040219";https://twitter.com/MissSkuiken/status/2702040219
aldiacr;2009-07-18 04:45;0;0;"Dos muertos más por gripe AH1N1 http://tinyurl.com/nhh9w7";;;;"2701756054";https://twitter.com/aldiacr/status/2701756054
julcafer;2009-07-18 04:22;0;0;"Catolicos Peru en apoyo a campaña contra Influenza #AH1N1 recibiran sagrada hostia en la mano y suspenden ABRAZO SHALOM http://bit.ly/wNR91";;;#AH1N1;"2701465531";https://twitter.com/julcafer/status/2701465531
aldiacr;2009-07-18 04:15;0;0;"OMS: Virus AH1N1 se propaga a “una velocidad sin precedentes” http://tinyurl.com/mzluqk";;;;"2701373431";https://twitter.com/aldiacr/status/2701373431
titodolores;2009-07-18 04:13;0;0;"Soy tacneño pero no sabia que la Diósesis de Tacna ha prohibido dar abrazo de paz en misa para evitar contagio aH1N1 - segun diario Ojo";;;;"2701352405";https://twitter.com/titodolores/status/2701352405
sgarciaasenjo;2009-07-18 04:08;0;0;"Dónde está Rosa María? Es verdad que tiene el virus AH1N1 ? Qué ha dicho Sol?";;;;"2701281024";https://twitter.com/sgarciaasenjo/status/2701281024
GLR_Networks;2009-07-18 03:58;0;0;"/ COL / A ocho se eleva el número de muertos en Colombia por la gripa AH1N1 http://bit.ly/qfpKS";;;;"2701154160";https://twitter.com/GLR_Networks/status/2701154160
GREENPLANETSYS;2009-07-18 03:53;0;0;"CAMPAÑA INTEGRAL DE FUMIGACION CONTRA LA INFLUENZA AH1N1 , DESINFECCION INTEGRAL 405*8810 - 5421242 www.greenplanetsys.spaces.live.com";;;;"2701084231";https://twitter.com/GREENPLANETSYS/status/2701084231
noticia24;2009-07-18 03:53;0;0;"Campaña de difusion masiva para prevenir la Influenza AH1N1 en Tacna http://bit.ly/FpHXc";;;;"2701082928";https://twitter.com/noticia24/status/2701082928
jaom7;2009-07-18 03:52;0;0;"I was just notified about a colleague with AH1N1 , Right now I'm inside an epidemiological fence";;;;"2701074933";https://twitter.com/jaom7/status/2701074933
elespectador;2009-07-18 03:49;0;0;"Confirman octava muerte por la gripa AH1N1 : El caso corresponde a un menor de edad, residente en la ciudad de Bo.. http://bit.ly/jVOuG";;;;"2701033278";https://twitter.com/elespectador/status/2701033278
excitedg1rl;2009-07-18 03:41;0;0;"OMG!Philippines have the most people with ah1n1 .Ranking for top 1 in south east asia.Beware to this disease not just in philippines but all.";;;;"2700936761";https://twitter.com/excitedg1rl/status/2700936761
Najla_;2009-07-18 03:41;0;0;"y yo lo que traje de "gocholandia" fue una "quiebrahuesos" aunque no es AH1N1 , debe ser una H1D1P1! =/";;;;"2700928383";https://twitter.com/Najla_/status/2700928383
diarioojo;2009-07-18 03:31;0;0;"Diósesis de la provincia de Tacna prohíbe darse el abrazo de la paz en misas para evitar el contagio de la gripe AH1N1 .";;;;"2700802377";https://twitter.com/diarioojo/status/2700802377
pumba;2009-07-18 03:28;0;0;"@framedu AH1N1 , neumonitis, faringitis y otras cosas más por no hacerle caso al tipico doctor que llevan siempre al matinal";;@framedu;;"2700763765";https://twitter.com/pumba/status/2700763765
je_bogantes;2009-07-18 02:24;0;0;"Y bueno lo de la AH1N1 solo un comentario. Solo me parece extraño";;;;"2699897841";https://twitter.com/je_bogantes/status/2699897841
CaracolRadio;2009-07-18 02:20;0;0;"Otro niño muere por gripa AH1N1 . Suben a 8 las víctimas fatales http://bit.ly/jxrFI";;;;"2699834865";https://twitter.com/CaracolRadio/status/2699834865
Gerente;2009-07-18 02:14;0;0;"ahora dice CM& que hay chanchos contagiados de AH1N1 por humanos, para ellos, los chanchos, gripe humana";;;;"2699765078";https://twitter.com/Gerente/status/2699765078
hablemosdesexo;2009-07-18 02:11;0;0;"AH1N1 SIGNOS DE CONTAGIO http://hablemosdesexoenserio.blogspot.com/search/label/PERIODISTICOS";;;;"2699718790";https://twitter.com/hablemosdesexo/status/2699718790
lizysmind;2009-07-18 02:05;0;0;"Cargas y Decargas: Respuestas sencillas sobre la gripe AH1N1 : Por Edwin Vázquez de Cargas y Descargas¿Cuál es la tasa de http://url4.eu/6lZZ";;;;"2699626982";https://twitter.com/lizysmind/status/2699626982
TrujilloInforma;2009-07-18 02:03;0;0;"Sigue avanzando la gripe AH1N1 en Trujillo, ya hay 88 personas infectadas y 451 casos sospechosos: El Director R.. http://bit.ly/Rgl5Z";;;;"2699607395";https://twitter.com/TrujilloInforma/status/2699607395
je_bogantes;2009-07-18 01:59;0;0;"Porque tantos muertos en Costa Rica por #AH1N1 sera que los datos de infectados son mayores a los reales y no quieren alarmar a la poblacion";;;#AH1N1;"2699549815";https://twitter.com/je_bogantes/status/2699549815
palulo;2009-07-18 01:51;0;0;"Primera víctima en Loja por la AH1N1 (via @catimier ) -> que pena.";;@catimier;;"2699439040";https://twitter.com/palulo/status/2699439040
FanUltra;2009-07-18 01:39;0;0;"RT @noticiascaracol : Colombia logró identificar el mapa genético del virus AH1N1 : Según el Instituto Nacional de Salud, la comunidad .. ...";;@noticiascaracol;;"2699271841";https://twitter.com/FanUltra/status/2699271841
universitaria;2009-07-18 01:35;0;0;"El reporte sobre el AH1N1 http://bit.ly/xKxTE (pdf)";;;;"2699222851";https://twitter.com/universitaria/status/2699222851
sergioayala;2009-07-18 01:32;0;0;"RT @RPPNoticias : Confirman 40 muertos y 10 mil 926 contagiados por gripe AH1N1 en Chile http://tinyurl.com/nvohzo Ya falta poco para ig ...";;@RPPNoticias;;"2699173219";https://twitter.com/sergioayala/status/2699173219
fashionexport;2009-07-18 01:29;0;0;"RT @esmitv NOTICIA | Fuerza Armada se reúne para discutir tema de influenza AH1N1 (esmitv.com). http://tinyurl.com/nx4bob";;@esmitv;;"2699141206";https://twitter.com/fashionexport/status/2699141206
