username;date;retweets;favorites;text;geo;mentions;hashtags;id;permalink
x_tello;2009-06-20 23:55;0;0;"Se establece una 1ª causa para la gran mortalidad por Influenza en México: Mala Atención Primaria. http://bit.ly/uC5F8 #Influenza #AH1N1";;;#Influenza #AH1N1;"2259047786";https://twitter.com/x_tello/status/2259047786
latercera;2009-06-20 23:41;0;1;"Alumnos de medicina de Valdivia reforzarán unidades de emergencia en Los Ríos por AH1N1 : En la región los casos .. http://twurl.nl/ex2wp1";;;;"2258904255";https://twitter.com/latercera/status/2258904255
pizzzaa;2009-06-20 23:41;0;0;"was gonna go to the movies but not anymore cause got scared of the swine flu (or influenza AH1N1 or whatever)";;;;"2258902613";https://twitter.com/pizzzaa/status/2258902613
xazarcom_ru;2009-06-20 23:30;0;0;"Два новых случая заболевания гриппом AH1N1 подтверждены в Польше http://ff.im/-4eqT1";;;;"2258795126";https://twitter.com/xazarcom_ru/status/2258795126
NoticiasCaracol;2009-06-20 23:21;0;0;"Analizan posible caso de muerte por AH1N1 en Bogotá: El equipo científico del Instituto Nacional de Salud y Medi.. http://tinyurl.com/lg8bhh";;;;"2258702174";https://twitter.com/NoticiasCaracol/status/2258702174
chileteinforma;2009-06-20 23:15;0;0;"La Tercera: Alumnos de medicina de Valdivia reforzarán unidades de emergencia en Los Ríos por AH1N1 : .. http://tinyurl.com/ntdfrf";;;;"2258644663";https://twitter.com/chileteinforma/status/2258644663
helisocorman;2009-06-20 23:15;0;0;"Más de 1200 contagiados con AH1N1 en Los Ríos, tal como adelantó Radio @Universitaria http://bit.ly/HhheX #valdivia";;@Universitaria;#valdivia;"2258640993";https://twitter.com/helisocorman/status/2258640993
acianela;2009-06-20 22:55;0;0;"92 casos de influenza AH1N1 confirmados. Pero a mi hermana la sacaron de una clínica en Valencia porque había 3 casos y estaban asustados";;;;"2258431570";https://twitter.com/acianela/status/2258431570
destiario;2009-06-20 22:54;0;0;"¿ENTONCES? RT @cadenaglobal : 25 han sido dados de alta | http://bit.ly/ve62r o RT @globovision Sube a 92 (...) AH1N1 http://bit.ly/16jyzA";;@cadenaglobal @globovision;;"2258422404";https://twitter.com/destiario/status/2258422404
adguer;2009-06-20 22:32;0;0;"Prevencion de la influenza AH1N1 -->http://bit.ly/1SsyXs";;;;"2258203665";https://twitter.com/adguer/status/2258203665
iammjsamarita;2009-06-20 22:16;0;0;"FIGHT the Pandemic AH1N1 !, boost your immune system with the help of the clinically proven product I use http://tinyurl.com/dau3xb";;;;"2258031459";https://twitter.com/iammjsamarita/status/2258031459
Biosalud_ve;2009-06-20 22:14;0;0;"Venezuela suma 92 casos confirmados de influenza AH1N1 http://bit.ly/164PdX";;;;"2258008775";https://twitter.com/Biosalud_ve/status/2258008775
TruthOrLies;2009-06-20 21:53;0;0;"The note 'Venezuelan structures in health matters allow to face influenza AH1N1 cases' has been added to the dro.. http://tinyurl.com/nw84sr";;;;"2257789958";https://twitter.com/TruthOrLies/status/2257789958
MissClaudiaL;2009-06-20 21:25;0;0;"... Qué puedo decir? cuando pasa una, pasan todas... Ahora a esperar el resultado del IFI, pero confío en que no es la AH1N1 ...";;;;"2257495137";https://twitter.com/MissClaudiaL/status/2257495137
ATVenezuela;2009-06-20 21:21;0;0;"ATV- Sube a 92 la cifra de venezolanos con virus AH1N1 http://tinyurl.com/mz4prq";;;;"2257454599";https://twitter.com/ATVenezuela/status/2257454599
JoseSimons;2009-06-20 21:14;0;0;"92 casos de AH1N1 ... EN VENEZUELA";;;;"2257379530";https://twitter.com/JoseSimons/status/2257379530
paulanunez;2009-06-20 21:03;0;0;"confirmado... Mi hno tiene AH1N1";;;;"2257258965";https://twitter.com/paulanunez/status/2257258965
radiosantafentc;2009-06-20 21:00;0;0;"En Ubaté investigan presunta muerte por gripa AH1N1 : El deceso de una mujer embaraza de treinta años podría ser .. http://tinyurl.com/nz45x8";;;;"2257233495";https://twitter.com/radiosantafentc/status/2257233495
Gripe_porcina;2009-06-20 20:58;0;0;"Se espera que los casos de la gripe AH1N1 en el Perú aumenten - El Comercio Perú: Se espera que los casos de la .. http://tinyurl.com/m5kcq5";;;;"2257212943";https://twitter.com/Gripe_porcina/status/2257212943
WRadioColombia;2009-06-20 20:29;0;0;"Investigan posible segunda muerte por el virus AH1N1 http://tinyurl.com/myfows";;;;"2256907785";https://twitter.com/WRadioColombia/status/2256907785
warmth;2009-06-20 20:25;0;0;"RT @ultimahoraon: 92 venezolanos con virus AH1N1 - http://tinyurl.com/mf24on";;@ultimahoraon;;"2256864627";https://twitter.com/warmth/status/2256864627
xfabricio;2009-06-20 20:04;0;0;"¿Cómo combatir un contagio de AH1N1 ? Un experto de la Univ. Cayetano Heredia nos da algunos consejos. Buena entrevista. http://is.gd/17Cp1";;;;"2256637858";https://twitter.com/xfabricio/status/2256637858
ebriceno;2009-06-20 19:57;0;1;"via sms: Debido al virus AH1N1 esta prohibido dar besos y abrazos, se recomiendan agarrones de nalgas y tetas. es por tu salud.";;;;"2256558807";https://twitter.com/ebriceno/status/2256558807
xazarcom_ru;2009-06-20 19:56;0;0;"Число заболевших вирусом гриппа AH1N1 в Египте возросло до 34 человек http://ff.im/-4e7y0";;;;"2256550868";https://twitter.com/xazarcom_ru/status/2256550868
laterceracom;2009-06-20 19:44;0;0;"Un adolescente de Puerto Montt se convirtió hoy en la quinta víctima fatal por gripe AH1N1 en el país http://tinyurl.com/l4tjpo";;;;"2256416473";https://twitter.com/laterceracom/status/2256416473
AndreCel;2009-06-20 19:41;0;0;"Gripe AH1N1 : Joven de 18 años es la quinta víctima fatal en el país...otra vez Puerto Montt!! http://tinyurl.com/kksx8e";;;;"2256379377";https://twitter.com/AndreCel/status/2256379377
globovision;2009-06-20 19:35;0;3;"Sube a 92 la cifra de venezolanos con virus AH1N1 http://bit.ly/16jyzA";;;;"2256312889";https://twitter.com/globovision/status/2256312889
cadenaglobal;2009-06-20 19:26;0;0;"AH1N1 : Venezuela suma 92 casos confirmados de influenza | http://bit.ly/bBQiM";;;;"2256223373";https://twitter.com/cadenaglobal/status/2256223373
ebriceno;2009-06-20 19:18;0;0;"RT @JoseManuelR : RT @noticiaaldia : Aumentó a 92 casos de virus AH1N1 en Venezuela http://bit.ly/JJ7rq (Y la gente mamando gallo)";;@JoseManuelR @noticiaaldia;;"2256134396";https://twitter.com/ebriceno/status/2256134396
noticiaaldia;2009-06-20 19:04;0;0;"Aumentó a 92 casos de virus AH1N1 en Venezuela http://bit.ly/JJ7rq";;;;"2255980083";https://twitter.com/noticiaaldia/status/2255980083
senortortillero;2009-06-20 18:57;0;0;"el quinto contagiado de ah1n1 en chile acaba de morir.";;;;"2255897607";https://twitter.com/senortortillero/status/2255897607
twitero;2009-06-20 18:41;0;0;"ya todos se olvidaron de la AH1N1 y eso que ya empezo a morir gente un muchos paises y ya fue considerada pandemia por la OMS ...";;;;"2255721187";https://twitter.com/twitero/status/2255721187
Peru21pe;2009-06-20 18:37;0;0;"Chile suma su quinta muerte por la gripe AH1N1 http://bit.ly/bG1Hu";;;;"2255675818";https://twitter.com/Peru21pe/status/2255675818
marconunez;2009-06-20 18:36;0;0;"#AH1N1 Puertomontino trasladado a Santiago por gripe A (H1N1) se encuentra grave http://tinyurl.com/ldoq6w";;;#AH1N1;"2255672286";https://twitter.com/marconunez/status/2255672286
pablo_psd;2009-06-20 18:15;0;0;"#24h Joven de Puerto Montt se convierte en quinta víctima fatal por AH1N1";;;#24h;"2255432202";https://twitter.com/pablo_psd/status/2255432202
elantro;2009-06-20 18:08;0;0;"Gripe AH1N1 : Joven de 18 Años Es la Quinta Víctima Fatal En el País http://tinyurl.com/nb2ev9";;;;"2255356275";https://twitter.com/elantro/status/2255356275
maga72;2009-06-20 18:07;0;0;"el AH1N1 afecta + agresivamente a poblaciones indígenas, estoy segura ke "lxs expertxs" pensarán 1º en genes antes ke en condiciones de vida";;;;"2255341587";https://twitter.com/maga72/status/2255341587
xazar_com;2009-06-20 18:01;0;0;"Estoniyada AH1N1 virusuna növbəti yoluxma qeydə alınıb http://ff.im/-4dWaF";;;;"2255274688";https://twitter.com/xazar_com/status/2255274688
sofilatino;2009-06-20 17:50;0;0;"mi profesor de mktg III tiene AH1N1";;;;"2255152129";https://twitter.com/sofilatino/status/2255152129
tuinkerbell;2009-06-20 17:49;0;0;"parece que el AH1N1 llegó al hogash";;;;"2255140375";https://twitter.com/tuinkerbell/status/2255140375
pastoroviedo;2009-06-20 17:40;0;0;"Despertando como lo planifique... Les deseo feliz fin a mis twitter's friends... Por favor tomar previsiones contra el AH1N1 ...";;;;"2255044744";https://twitter.com/pastoroviedo/status/2255044744
MauroNPW;2009-06-20 17:09;0;0;"con miedo de estar con AH1N1";;;;"2254708737";https://twitter.com/MauroNPW/status/2254708737
xazarcom_ru;2009-06-20 17:01;0;0;"Первый случай передачи вируса AH1N1 от человека к человеку отмечен в Турции http://ff.im/-4dPvo";;;;"2254613380";https://twitter.com/xazarcom_ru/status/2254613380
xazarcom_ru;2009-06-20 16:59;0;0;"Число заболевших гриппом AH1N1 в КНР возросло за день на 50 http://ff.im/-4dPvm";;;;"2254588362";https://twitter.com/xazarcom_ru/status/2254588362
PinayAds;2009-06-20 16:57;0;0;"says we're home na. buti nlng d Ah1n1 ... @techsterr was advised to rest for 3 days... http://plurk.com/p/12i2n5";;@techsterr;;"2254577302";https://twitter.com/PinayAds/status/2254577302
marconunez;2009-06-20 16:56;0;0;"#AH1N1 joven de 18 años se convierte en quinto fallecido por influenza humana en Chile";;;#AH1N1;"2254563648";https://twitter.com/marconunez/status/2254563648
AngeloAnolin;2009-06-20 16:42;0;0;"RT @TheWheat : 1st confirmed case of AH1N1 in Brunei. 19y/o from UK. Came back on 16th checked into RIPAS on 20th. Currently held in Tutong";;@TheWheat;;"2254416761";https://twitter.com/AngeloAnolin/status/2254416761
harrinsonnet;2009-06-20 16:40;0;0;"SERA QUE EN GUATEMALA HABRAN MAS INFECTADOS CON EL VIRUS AH1N1 ??? APARTE DE LOS CASOS YA ANUNCIADOS??";;;;"2254393847";https://twitter.com/harrinsonnet/status/2254393847
geeayeyen;2009-06-20 16:40;0;0;"says i actually feel frustrated right now. with this Ah1n1 scare!!! pakshet. lahat apektado.. http://plurk.com/p/12hxma";;;;"2254387046";https://twitter.com/geeayeyen/status/2254387046
cinderella_mayo;2009-06-20 16:38;0;0;"will plurk again... thank God it's not AH1N1 :D http://plurk.com/p/12hx1f";;;;"2254367119";https://twitter.com/cinderella_mayo/status/2254367119
yoyitadeconcep;2009-06-20 16:18;0;0;"em casa con faringobronquitis, la flaca con ah1n1 y la pioja con bronquitis..... que rico no?";;;;"2254150490";https://twitter.com/yoyitadeconcep/status/2254150490
elandresvaras;2009-06-20 16:17;0;0;"En Chile está el pueblo más afectado del mundo por virus AH1N1 http://bit.ly/EC2VD";;;;"2254137477";https://twitter.com/elandresvaras/status/2254137477
loveuffa;2009-06-20 15:59;0;0;"eff ah1n1";;;;"2253945949";https://twitter.com/loveuffa/status/2253945949
venefeeds;2009-06-20 15:46;0;0;"[Cadena Global] AH1N1 : Uno de cada tres contagiados ya está chévere http://tinyurl.com/ljpgx9";;;;"2253805575";https://twitter.com/venefeeds/status/2253805575
red_rojo;2009-06-20 15:45;0;0;"y si es cierto es ah1n1";;;;"2253795948";https://twitter.com/red_rojo/status/2253795948
Gripe_porcina;2009-06-20 15:34;0;0;"Decretan alerta amarilla por gripe AH1N1 - Diario La Página El Salvador: Decretan alerta amarilla por gripe AH1N.. http://tinyurl.com/lww3gz";;;;"2253682260";https://twitter.com/Gripe_porcina/status/2253682260
herardeaux;2009-06-20 15:25;0;0;"@buhrayaaan well that's good. there were actually rumors that there were some AH1N1 cases here too but they were negatve..";;@buhrayaaan;;"2253585947";https://twitter.com/herardeaux/status/2253585947
xazarcom_ru;2009-06-20 14:47;0;0;"Первый случай передачи AH1N1 от человека к человеку отмечен в Турции http://ff.im/-4dABF";;;;"2253218368";https://twitter.com/xazarcom_ru/status/2253218368
vampy;2009-06-20 14:45;0;0;"RT @barquisimeto 3 casos sospechosos de AH1N1 en Bqto, los cuales están siendo monitoreados. No hay casos confirmados oficialmente en Lara.";;@barquisimeto;;"2253198254";https://twitter.com/vampy/status/2253198254
TheWheat;2009-06-20 14:19;0;0;"1st confirmed case of AH1N1 in Brunei. 19year old from UK. Came back on 16th checked into RIPAS on 20th. Currently held in Tutong";;;;"2252958052";https://twitter.com/TheWheat/status/2252958052
jawwwo;2009-06-20 14:07;0;0;"it's a bash. bash of experiences and emotions. anyways, masaya ang first week. :) kala ko may Ah1n1 na ako wahaha";;;;"2252858241";https://twitter.com/jawwwo/status/2252858241
Gripe_porcina;2009-06-20 14:03;0;0;"Islas Fiji y Etiopia reportan primeros caso de gripe AH1N1 y se ... - RIA Novosti: Islas Fiji y Etiopia reportan.. http://tinyurl.com/mtkp9h";;;;"2252821240";https://twitter.com/Gripe_porcina/status/2252821240
geeayeyen;2009-06-20 13:25;0;0;"says sh*T. sirang sira na buhay namin sa ah1n1 ... http://plurk.com/p/12fyp5";;;;"2252512293";https://twitter.com/geeayeyen/status/2252512293
jparedeso;2009-06-20 13:25;0;0;"creo que los sectores carenciados se contagian con la AH1N1 , lo que pasa es que hay que seguir viviendo y no viven en burbujas";;;;"2252506515";https://twitter.com/jparedeso/status/2252506515
cestMadonnaxD;2009-06-20 13:22;0;0;"RT @jperalta_10 : Lord, Keep us from the pandemic flu ah1n1 and other disease, cure our illnessmost esp heal the wounds in our relationships.";;@jperalta_10;;"2252484362";https://twitter.com/cestMadonnaxD/status/2252484362
ebriceno;2009-06-20 13:18;0;0;"Y la gente aqui sigue pensando que lo del virus AH1N1 es mamadera de gallo. No creo que debamos alarmarnos, pero coño PREVENGAMOS.";;;;"2252457396";https://twitter.com/ebriceno/status/2252457396
ebriceno;2009-06-20 13:17;0;0;"RT @sanrau : Confirmados los 2 casos de AH1N1 y se manejan 17 como probables en San Cristóbal http://bit.ly/uhxVk";;@sanrau;;"2252448874";https://twitter.com/ebriceno/status/2252448874
cristobalcampos;2009-06-20 13:13;0;0;"Primera alumna mía con #AH1N1 ... Viene para acá!";;;#AH1N1;"2252421125";https://twitter.com/cristobalcampos/status/2252421125
estordy;2009-06-20 13:07;0;0;"Attn DOH: Getting tested for AH1N1 puts you at risk because of all the people with symptoms queing for test!";;;;"2252377467";https://twitter.com/estordy/status/2252377467
KiannaDy;2009-06-20 13:07;0;0;"head hurts hope its not ah1n1 :|";;;;"2252370555";https://twitter.com/KiannaDy/status/2252370555
CaracolRadio;2009-06-20 12:58;0;0;"Investigan posible segunda muerte por gripa AH1N1 en Colombia http://tinyurl.com/l6dwzx";;;;"2252310756";https://twitter.com/CaracolRadio/status/2252310756
pnikoforonda;2009-06-20 12:53;0;0;"http://twitpic.com/7w9jh - My school just got quarantined.. DAMN AH1N1 VIRUS!!!!";;;;"2252272231";https://twitter.com/pnikoforonda/status/2252272231
vayiedelapaz;2009-06-20 12:13;0;0;"no classes for a week in our school due to confirmed AH1N1 cases";;;;"2252015710";https://twitter.com/vayiedelapaz/status/2252015710
xanejoi;2009-06-20 12:08;0;0;"yuhoo! no classes from june21-29 bec of fuckin' ah1n1 virus.LOL. some said it came from the varsity players of UP who were in MAPUA dz week.";;;;"2251983710";https://twitter.com/xanejoi/status/2251983710
pnikoforonda;2009-06-20 12:02;0;0;"Dang it!! Mapua Intramuros has ah1n1 !!! Damn.. Im feeling extension..";;;;"2251950075";https://twitter.com/pnikoforonda/status/2251950075
nacionales_cl;2009-06-20 12:00;0;0;"En Chile estaría el pueblo más afectado del mundo por virus AH1N1 > http://tinyurl.com/ltps9a";;;;"2251931378";https://twitter.com/nacionales_cl/status/2251931378
loretourbina;2009-06-20 11:58;0;0;"despertando para ir a trabajar...seré un nuevo caso de AH1N1 ?...en la Reg de Coquimbo sólo 3 casos clínicos y 180 tratados ambulatoriamente";;;;"2251921891";https://twitter.com/loretourbina/status/2251921891
jperalta_10;2009-06-20 11:40;0;0;"Lord, Keep us from the pandemic flu ah1n1 and other disease, cure our illnessmost esp heal the wounds in our relationships.";;;;"2251817439";https://twitter.com/jperalta_10/status/2251817439
rio_zanessa14;2009-06-20 11:28;0;0;"here in philippines there is so many a h1n1 that is affected in here......scary.... i dont want to have Ah1n1 ...........";;;;"2251751978";https://twitter.com/rio_zanessa14/status/2251751978
yeabrena;2009-06-20 11:27;0;0;"ah1n1 positive on Central. awwww.";;;;"2251748334";https://twitter.com/yeabrena/status/2251748334
desinformado;2009-06-20 11:24;0;0;"Disponen medidas ante virus gripal AH1N1 para Salones de Embajadores y VIP http://ff.im/-4dhSl";;;;"2251732187";https://twitter.com/desinformado/status/2251732187
sanrau;2009-06-20 10:59;0;0;"Confirmados los 2 casos de AH1N1 y se manejan 17 como probables en San Cristóbal http://bit.ly/uhxVk";;;;"2251591148";https://twitter.com/sanrau/status/2251591148
sheenaangeles;2009-06-20 09:49;0;0;"For the influenza ah1n1 .";;;;"2251224269";https://twitter.com/sheenaangeles/status/2251224269
dyananore;2009-06-20 09:42;0;0;"thank god wala na ako fever.. I was like wtf?! hopin' its not ah1n1 LOL";;;;"2251189067";https://twitter.com/dyananore/status/2251189067
carmelaramirez;2009-06-20 09:39;0;0;"My dad`s friend tested positive for AH1N1 , and he was just with him the other night. K, i`m scared.";;;;"2251172107";https://twitter.com/carmelaramirez/status/2251172107
IceEspino;2009-06-20 09:39;0;0;"bohoo ! :[ im not feeling well.. do i habb a aH1N1 virus ? haha :D";;;;"2251169638";https://twitter.com/IceEspino/status/2251169638
terenz09;2009-06-20 09:05;0;0;"hey everyone theres a AH1N1 virus in our school isn't that nc";;;;"2250989139";https://twitter.com/terenz09/status/2250989139
acidnews;2009-06-20 08:57;0;0;"US missionary positive for AH1N1 in Bacolod - GMA news.tv http://tinyurl.com/nmh5ad";;;;"2250943281";https://twitter.com/acidnews/status/2250943281
SwineFlu_news;2009-06-20 08:30;0;0;"US missionary positive for AH1N1 in Bacolod http://t.love.com/224771611";;;;"2250791959";https://twitter.com/SwineFlu_news/status/2250791959
alabordaje;2009-06-20 08:17;0;0;"¿Qué es lo que no sabe sobre la Influenza AH1N1 ? hoy en "http://www.alabordaje.cl"";;;;"2250717655";https://twitter.com/alabordaje/status/2250717655
noticia24;2009-06-20 07:54;0;0;"Casos de gripe AH1N1 superan los 44 mil http://tinyurl.com/letlx5";;;;"2250580964";https://twitter.com/noticia24/status/2250580964
SXMtimes;2009-06-20 07:48;0;0;"No registrations of AH1N1 yet on Curaçao http://tinyurl.com/n2e9bv";;;;"2250545507";https://twitter.com/SXMtimes/status/2250545507
jahz_joash;2009-06-20 07:39;0;0;"I was so nervous everytime we had an AH1N1 check on our gate in school!";;;;"2250486799";https://twitter.com/jahz_joash/status/2250486799
jiayouanamarie;2009-06-20 07:19;0;0;"my AH1N1 ata ako. hehehe. Kasi naman lahat dito sa bahay may sakit! Grrr... another boring day.";;;;"2250358083";https://twitter.com/jiayouanamarie/status/2250358083
carlosrvelarde;2009-06-20 06:23;0;0;"AH1N1 in La Salle? Please no. :|";;;;"2249962730";https://twitter.com/carlosrvelarde/status/2249962730
SaludDGPS;2009-06-20 05:58;0;0;"Norte de México, con mayor riesgo de segundo brote de AH1N1 : Salud http://tinyurl.com/laptv6";;;;"2249764171";https://twitter.com/SaludDGPS/status/2249764171
SaludDGPS;2009-06-20 05:58;0;0;"Confirma la Ssa 7 mil 624 casos del virus AH1N1 http://tinyurl.com/meuctf";;;;"2249763802";https://twitter.com/SaludDGPS/status/2249763802
shinkaide;2009-06-20 05:44;0;0;"Old People May Be Immune To Swine Flu: http://tinyurl.com/ls2aa3 #ah1n1 #swineflu";;;#ah1n1 #swineflu;"2249646355";https://twitter.com/shinkaide/status/2249646355
peanutbitterkid;2009-06-20 05:29;0;0;"is coughing.hatchu! Ah1n1 attack.haha:) http://plurk.com/p/12cfzu";;;;"2249518484";https://twitter.com/peanutbitterkid/status/2249518484
Cinderella9887;2009-06-20 05:12;0;0;"Me estoy recuperando de la AH1N1 ... aun con algunos malestares..!!";;;;"2249376929";https://twitter.com/Cinderella9887/status/2249376929
Darth_Jam;2009-06-20 04:51;0;0;"asi que @ballero tiene AH1N1 ??";;@ballero;;"2249176222";https://twitter.com/Darth_Jam/status/2249176222
arlesophia;2009-06-20 04:45;0;0;"#ultimasdablogosfera Crônicas e Críticas da AL: POLÍTICA GENOCIDA: EL SIDA Y LA GRIPE AH1N1 http://url4.eu/elK";;;#ultimasdablogosfera;"2249125874";https://twitter.com/arlesophia/status/2249125874
braindaamage;2009-06-20 04:44;0;0;"No me siento muy bien, será AH1N1 ? Dx... Mañana voy al medico";;;;"2249115859";https://twitter.com/braindaamage/status/2249115859
Hellatina;2009-06-20 04:35;0;0;"AH1N1 serology running. Sucks 2 b sick";;;;"2249028273";https://twitter.com/Hellatina/status/2249028273
kirk102;2009-06-20 04:27;0;0;"With the up coming AH1N1 .The possibilities of the world ending in December 21,2012 is at hand this is just a prediction";;;;"2248948993";https://twitter.com/kirk102/status/2248948993
latercera;2009-06-20 04:11;0;0;"Suben a siete los muertos y a 1.010 los enfermos por AH1N1 en Argentina: Además, las autoridades sanitarias se e.. http://twurl.nl/u0umg2";;;;"2248789209";https://twitter.com/latercera/status/2248789209
Gripe_porcina;2009-06-20 04:08;0;0;"Suben a siete los muertos ya 1.010 los enfermos por AH1N1 en Argentina - latercera.com: Suben a siete los muerto.. http://tinyurl.com/krqer8";;;;"2248756563";https://twitter.com/Gripe_porcina/status/2248756563
rrojastello;2009-06-20 03:51;0;0;"alvaro ballero tiene AH1N1 . . el choque noticioso cuatico, como el encontron entre lo que fue noticia ayer y lo que es noticia hoy por hoy";;;;"2248587051";https://twitter.com/rrojastello/status/2248587051
Informe21;2009-06-20 03:42;0;0;"25 de los 71 casos confirmados de gripe AH1N1 han sido dados de alta http://informe21.com/node/9975";;;;"2248486014";https://twitter.com/Informe21/status/2248486014
kijasbm;2009-06-20 03:26;0;0;"Ah1n1 ... why do we have that here in the Philippines? mygoshhh... tsk tsk tsk";;;;"2248323005";https://twitter.com/kijasbm/status/2248323005
Galdar;2009-06-20 02:55;0;0;"@marconunez Si, mi hermano chico ya tuvo su semana de "Vacaciones" por AH1N1";;@marconunez;;"2247977853";https://twitter.com/Galdar/status/2247977853
marconunez;2009-06-20 02:48;0;0;"#AH1N1 Contagiados de AH1N1 en Chile ascienden a 4.000 http://viigo.im/XBr";;;#AH1N1;"2247905128";https://twitter.com/marconunez/status/2247905128
detroya;2009-06-20 02:22;0;0;"me dan noticias que siguen cayendo niños que atiendo con AH1N1 .... anoche fue una que atendí el lunes :S";;;;"2247618325";https://twitter.com/detroya/status/2247618325
webmasterph;2009-06-20 02:15;0;0;"Reading: "5 more students test positive for AH1N1 DOH - Worldnews.com" ( http://bit.ly/WbwYW )";;;;"2247546815";https://twitter.com/webmasterph/status/2247546815
calela;2009-06-20 02:14;0;0;"Quién explica eso de que : la gripe AH1N1 está controlada! ?";;;;"2247539098";https://twitter.com/calela/status/2247539098
JoseManuelR;2009-06-20 02:12;0;0;"RT @ebriceno : Mi hermanita me comenta que suspendieron las clases indefinidamente en su colegio (Pio XII) por 3 casos de AH1N1 :(";;@ebriceno;;"2247511865";https://twitter.com/JoseManuelR/status/2247511865
latercera;2009-06-20 02:10;0;0;"Muertes por AH1N1 en Nueva York ascienden a 30: Siete de las víctimas fatales fueron confirmadas hoy por la auto.. http://twurl.nl/m3snju";;;;"2247484441";https://twitter.com/latercera/status/2247484441
Betroyer;2009-06-20 01:59;0;0;"Ay Dios... estoy en la línea de contagio del AH1N1 !!!!";;;;"2247366430";https://twitter.com/Betroyer/status/2247366430
RodValenzuela;2009-06-20 01:57;0;0;"En la tarde dolores de cuello musculares, luego el dolor de cabeza y ahora la fiebre. AH1N1 penetrò mi organismo.";;;;"2247347479";https://twitter.com/RodValenzuela/status/2247347479
primerahora;2009-06-20 01:50;0;0;"Ascienden a 21 los casos del virus AH1N1 en la Isla http://tinyurl.com/ma8ko6";;;;"2247265565";https://twitter.com/primerahora/status/2247265565
Pameloide12;2009-06-20 01:48;0;0;"trying to survive to this fucking flu!!!!! (not the ah1n1 )";;;;"2247241882";https://twitter.com/Pameloide12/status/2247241882
celtejada;2009-06-20 01:33;0;0;"Got a simple cold and went to the doctor for check up. I'm getting paranoid over AH1N1 .";;;;"2247082478";https://twitter.com/celtejada/status/2247082478
indexstiri;2009-06-20 01:32;0;0;"http://bit.ly/1E8VB5 Institutul Cantacuzino a efectuat teste pentru depistarea virusului AH1N1 doar pentru Albania";;;;"2247064678";https://twitter.com/indexstiri/status/2247064678
helisocorman;2009-06-20 01:02;0;0;"dando mi conteo de ah1n1 al aire";;;;"2246733536";https://twitter.com/helisocorman/status/2246733536
ang_manunusok;2009-06-20 00:35;0;0;"@cherrythegreat i learned how to drink more than that gradually...practice lang! ahehe tapos di ba you ae concerned with Ah1n1 ..";;@cherrythegreat;;"2246435526";https://twitter.com/ang_manunusok/status/2246435526
cocoxkris;2009-06-20 00:33;0;0;"ashhhh odio la AH1N1 =s hoy fui al clinico a sacar dinero y estuve cerca de personas enfermas posiblemente contagiadas... como pude??";;;;"2246417108";https://twitter.com/cocoxkris/status/2246417108
latercera;2009-06-20 00:08;0;0;"Contagiados de AH1N1 en Chile ascienden a 4.000: El Ministerio de Salud señaló que sólo el 3,7% de los casos ha .. http://twurl.nl/80hbmh";;;;"2246138408";https://twitter.com/latercera/status/2246138408